video_id,title,publishedAt,channelId,channelTitle,categoryId,trending_date,tags,view_count,likes,dislikes,comment_count,thumbnail_link,comments_disabled,ratings_disabled,description
_xJUCsyMQes,Saweetie - Best Friend (feat. Doja Cat) [Official Music Video],2021-01-07T23:00:20Z,UC2FCUwThC0RAzaQoI0TtpLA,Official Saweetie,22,21-01-09,saweetie|sweetie|tap in|my type|icy grl|icy girl|female hip hop|female rapper|hip hop|R&B|Doja Cat|Featuring Doja Cat|That's my best friend|Best Friend|Best Friend Saweetie Doja Cat|best friend thats my bestfriend lyrics|best friend tiktok|doja cat saweetie song|doja cat saweetie best friend mp3|saweetie ft doja cat|doja cat x saweetie type beat|dojacat|best friend video|best friend song|she's a real bad bitch,10918748,354808,17141,20603,https://i.ytimg.com/vi/_xJUCsyMQes/default.jpg,FALSE,FALSE,"Download/Stream Best Friend (feat. Doja Cat): https://Saweetie.lnk.to/BestFriend❄️ICY GANG❄️Tap in with Saweetie to gain exclusive access to the next episode first! Text +1 (510) 250-3890 Follow SaweetieOfficial Website: www.saweetie.comTwitter: https://twitter.com/saweetieFacebook: https://www.facebook.com/OfficialSaweetieInstagram: https://www.instagram.com/saweetie/Credits: Starring: Saweetie, Doja Cat, & King BachDirected by Dave MeyersExecutive Producer: Nathan ScherrerProduced by Roisín Audrey MoloneyProduction Supervisor: Tori StoroshProduction Company: Freenjoy Saweetie Costume Design: Bryon JavarDoja Cat Costume Design: Brett Alan Nelson Director of Photography: Joshua Zucker- PludaProduction Designer: Alec Contestabile Cast Costume Design: Ann-Marie HoangEditor: Alyssa Oh @ Rock Paper ScissorsColorist: Stefan Sonnenfeld @ Company 3VFX: Buf ParisSound Design: Jeff Malen @ Lime Studios 00:42 Lyrics:That’s my bestfriend she a real bad bitchGot her own money she don’t need nigOn the dance floor she had two three drinksNow she twerking she throw it out and come back inThat’s my bestfriend she a real bad bitchDrive her own car she don’t need no lyftIn the strip club know my girl gone tipNow she twerking throw it out and come back inBeep beep is that my bestie in a tesiFresh blow out skin on 10 owe she readyBitch you look goodt with a t at the endImma hype her every time that’s my mothafuckin friendShe been down since the jellies and the bo bo’sNow we steppin out the G in manolo’sWhen we pull up to scene hoes be filled with jealousyIf a bitch get finicky she gone bring that energyI hit her phone with the tea like bitch guess whatAll the rich ass boys wanna fuck on usAll this ass sittin up you can look don’t touchAnd I’m bad bussin bands every time we link upThat’s my bestfriend she a real bad bitchGot her own money she don’t need nigOn the dance floor she had two three drinksNow she twerking she throw it out and come back inThat’s my bestfriend she a real bad bitchDrive her own car she don’t need no lyftIn the strip club know my girl gone tipNow she twerking throw it out and come back inThat’s my bestfriend if you need a freakI aint dumb but mothafucka she my Tweedle DIf she ride for me she don’t need a keyIf you sideways she’ll straighten you as needed beAnd she so bad that I just can’t take that bitch nowhereShe off her fish I said uh uh don’t go thereBitch break her back she protect and attackGet that strap let them buckleFoot on neck give no airWhole world wanna be usMy main bitch she my day 1On my way bitch letcha get drunkCelebrate cause we the baddest in the clubThat’s my bestfriend she a real bad bitchGot her own money she don’t need nigOn the dance floor she had two three drinksNow she twerking she throw it out and come back inThat’s my bestfriend she a real bad bitchDrive her own car she don’t need no lyftIn the strip club, know my girl gone tipNow she twerking throw it out and come back inBest friend you the baddest and you know itUh oh girl I think yo booty growingFck it up in the mirror hit them posesBest friend damn you mfn glowingBest friend damn yo wrist look like it’s frozenUh oh girl I think yo booty growingFck it up in the mirror hit them posesBest friend you mfn soulmate#Saweetie #DojaCat #BestFriend #PrettyBitchMusic"
C7Tl7Zn-KRE,The Hoonicorn's Last Ride? Ken Block's Final Drive in the 1400hp AWD Mustang Hoonicorn V2,2021-01-08T18:00:03Z,UCpCJ0y-_y03qPlG4zrYAAvQ,Ken Block,2,21-01-09,Ken Block|hoonicorn|Ken Block leaves Ford|Hoonicorn Vs The World|Hoonicorn Vs.|gymkhana|Ken Block Retirement|Ken block Mustang|Ken Block Fired|Climbkhana|twin turbo mustang|Hoonigan|hoonigan racing|RTR mustang,1504277,43656,1135,5965,https://i.ytimg.com/vi/C7Tl7Zn-KRE/default.jpg,FALSE,FALSE,"Ken Block and Ford Motor Company’s exclusive partnership has brought in some real hardware over the past decade in rally and rallycross. 19 race wins plus 17 other podium finishes, 2 X Games medals, well over a billion video views across Block’s social media platforms, and the first ever World Rally Championship points scored for the brand by an American driver. As of January 2021, that exclusivity comes to an end, with Block becoming a free agent. And that means his options behind the wheel are now wide open. “Working  with Ford over the past decade has been awesome.” says Ken Block. “From racing all over the world, to accumulating  a half billion views from Gymkhana THREE to Gymkhana TEN, to creating the Emmy nominated series The Gymkhana Files for Amazon Prime - along with building a fleet of Fords including the iconic AWD Mustang Hoonicorn and F-150 Hoonitruck - it’s been a great partnership. It’s simply been a dream come true to work with the company that built the truck that my Dad drove when I was a teenager. I’m super appreciative to Ford for the support over the years, but I am also looking forward to what an unrestricted 2021 holds, and the ability to spread my wings a bit and play with a lot other toys.2020 was a big year for Block and his Ford vehicles. He took the overall win at Rally Barbados in a WRC2 Ford Fiesta, won his class (and 3rd overall) at Rally Legend in San Marino in his Ford Escort Cossie V2, and also won the first ever Projekt E race of the FIA World RallyCross Championship in Holjes, Sweden, in a Ford Fiesta. Along with winning races, Block and Hoonigan launched the all-new viral video series,- Hoonicorn Vs The World. Spanning 11 episodes, the series features Ken racing his 1965 Ford Mustang RTR Hoonicorn against a variety of wild vehicles including a McLaren Senna and the World’s Fastest Donk. The series has been viewed over 34 million times since its launch in late November. What does the next chapter have in store? Ken Block and Hoonigan Racing Division will be announcing new partnerships very soon. In the meantime, enjoy this video of Ken’s favorite Ford – the 1,400 horsepower AWD Mustang Hoonicorn V2 – get taken on its “last ride”."
ZmDBbnmKpqQ,Olivia Rodrigo - drivers license (Official Video),2021-01-08T05:00:22Z,UCxE5jEls-T0QtlTHT8lI1lw,OliviaRodrigoVEVO,10,21-01-09,Olivia|Rodrigo|drivers|license|Pop,3908348,439694,2558,25087,https://i.ytimg.com/vi/ZmDBbnmKpqQ/default.jpg,FALSE,FALSE,"Listen to ‘drivers license’ out now: https://smarturl.it/driverslicenseFollow Olivia Rodrigo:Instagram: https://instagram.com/olivia.rodrigoTwitter: https://twitter.com/Olivia_RodrigoFacebook: https://www.facebook.com/OliviaRodrigoOfficialMusic video by Olivia Rodrigo performing drivers license. © 2021 Olivia Rodrigo, under exclusive license to Geffen Records"
KgrCYvVYSRE,Jazmine Sullivan: Tiny Desk (Home) Concert,2021-01-08T17:00:09Z,UC4eYXhJI4-7wSWc8UNRwD4A,NPR Music,10,21-01-09,NPR|NPR Music|National Public Radio|Live|Performance|tiny desk|tiny desk concert|tony desk|tiny concert,676651,46038,557,4490,https://i.ytimg.com/vi/KgrCYvVYSRE/default.jpg,FALSE,FALSE,"The Tiny Desk is working from home for the foreseeable future. Introducing NPR Music's Tiny Desk (home) concerts, bringing you performances from across the country and the world. It's the same spirit — stripped-down sets, an intimate setting — just a different space.Bobby Carter | January 8, 2021I don't recall any other artist at the Tiny Desk harmonizing their own introduction, but Philadelphia's own Jazmine Sullivan didn't waste a second, greeting us all by flexing those once-in-a-generation chops from the jump. The singer-songwriter, draped in a trench coat while her band sports all black, are nestled in the corner of a dimly lit space resembling a cabaret.We don't see or hear much from Jazmine Sullivan until she has something to get off her chest. She drops a body of work every five years or so, shakes up the world of R&B with each offering, then quietly goes back to minding her own business. Her latest project, Heaux Tales, is a bold and timely conversation piece addressing truths regarding relationships, sex, social norms, self-worth and a myriad of other topics that women graple with. Each song is masterfully connected to another through unique yet familiar testimonies by women from all walks of life.She starts her Tiny Desk (home) concert with three extended and reworked selections from Heaux Tales, squeezes in thee fan favorite from 2015's Reality Show, then invites Tiny Desk alum H.E.R. to the stage to close with Girl Like Me. Ms. Sullivan, her background vocalists and H.E.R. ate this performance up and left not a crumb on the floor.SET LISTBodies (Intro)The Other SideLost OneLet It BurnGirl Like Me (featuring H.E.R.)MUSICIANSJazmine Sullivan: vocalsH.E.R.: vocalsAlisa Joe: vocalsNatalie Curtis: vocalsAyana George: vocalsDave Watson: drumsSimon Martinez: guitarJermaine Blandford: bassEric Wortham: keysCREDITSVideo: Mansa Twin Johnson, Mignotae Kebede, Evan MorsellAudio: Chauncey BurneyCreative Director: Amaya SeguraSet Design: Matthew EnglebertExecutive Producer: Omari WilliamsTINY DESK TEAMProducer: Bobby CarterVideo Producer: Maia SternAudio Mastering: Josh RogosinTiny Production Team: Bob Boilen, Kara Frame, Morgan Noelle SmithExecutive Producer: Lauren OnkeySenior VP, Programming: Anya Grundmann"
8PbhGt8XxSM,Ruination | Season 2021 Cinematic - League of Legends,2021-01-08T16:00:06Z,UC2t5bjwHdUX4vM2g8TRDq5g,League of Legends,20,21-01-09,Riot Games|Riot|League of Legends|League|LoL|MOBA|Season start|season 2021|cinematic|ruined king|ruination|viego|animation|senna|lucian|shadow isles|runeterra|lore|video|league of legends|league|noxus|samira|darius|karma|poppy|vayne|black mist,2689484,151211,1994,9787,https://i.ytimg.com/vi/8PbhGt8XxSM/default.jpg,FALSE,FALSE,A king returns. All he touches turns to ruin.Video created in partnership with Digic Pictures.League of Legends Sign Up & Downloadhttps://signup.leagueoflegends.com/
Mxuw6FiD7hc,"Mom, You Look Frightened  Bride Chooses a JUMPSUIT Over a Wedding Dress! | Say Yes To The Dress",2021-01-08T12:00:06Z,UC6B64FzMdVOvtgo6ebdRCjA,Say Yes to the Dress,24,21-01-09,Say Yes to the Dress|say yes to the dress|TLC|TLC UK|wedding dresses|marriage|wedding jumpsuits for brides|wedding jumpsuit with detachable train|diy wedding jumpsuit|say yes to the dress jumpsuit randall|say yes to the dress jumpsuit hayley paige|say yes to the dress jumpsuit|say yes to the dress bridesmaids|say yes to the dress full episodes|say yes to the dress watch online free|say yes to the dress watch online uk|say yes to the dress watch online youtube,893649,17589,641,1384,https://i.ytimg.com/vi/Mxuw6FiD7hc/default.jpg,FALSE,FALSE,"Randell comes into Kleinfield to find herself the perfect wedding outfit and surprises everyone by requesting to try out wedding jumpsuits!🇬🇧 Viewing from the UK? Watch full episodes of Say Yes To The Dress UK on Discovery+: https://bit.ly/3hPvR47Catch Say Yes to the Dress on TLC - Sky 133, Virgin 162, BT TV 323"
i7DI_62-4_Q,Jon Z x Natti Natasha x Farruko x Darrell x Brytiago x Eladio Carrion x Kevvo x Miky Wo...,2021-01-08T17:00:15Z,UCpZt1pulAmGEKF4yGtuy-LA,JonZVEVO,10,21-01-09,Jon Z|Farruko|& Natti Natasha Natti|Karol|Becky (feat. KEVVO|Brytiago|Darell|Eladio Carrión & Miky Woodz) Latin,1280962,108991,2482,5436,https://i.ytimg.com/vi/i7DI_62-4_Q/default.jpg,FALSE,FALSE,"Music video by Jon Z, Farruko, Natti Natasha performing Natti, Karol, Becky (feat. KEVVO, Brytiago, Darell, Eladio Carrión & Miky Woodz) [Remix]. ℗ 2021 Chosen Few Emerald Entertainment Inc."
Q4P9wJApo38,I Finally Bought an Electric Car...,2021-01-08T16:01:44Z,UCsTcErHg8oDvUnTzoqsYeNw,Unbox Therapy,28,21-01-09,unbox therapy|unboxtherapy|tech|technology|gadgets|gadget|unboxing|review|unbox|therapy|new|youtube|porsche|taycan|taycan turbo s|turbo|tesla|electric car,1688536,92692,2854,8511,https://i.ytimg.com/vi/Q4P9wJApo38/default.jpg,FALSE,FALSE,I finally pulled the trigger on an electric car...This is the Porsche Taycan Turbo S. It was a tough choice between this and a Tesla (both are awesome cars). The Tesla has a lot more in terms of autonomous tech/software where the Taycan leans into Porsche's racing heritage/feel. The Taycan Turbo S is likely a touch faster around a race track compared to Tesla's current performance model as well (if that matters to you).Porsche North TorontoInsta - https://www.instagram.com/PorscheNorthToronto/Youtube - https://youtube.com/c/PorscheCentreNorthTorontoFOLLOW ME IN THESE PLACES FOR UPDATESTwitter - http://twitter.com/unboxtherapyFacebook - http://facebook.com/lewis.hilsentegerInstagram - http://instagram.com/unboxtherapy
FXzE9eP1U_E,Morgan Wallen: Sand In My Boots (The Dangerous Sessions),2021-01-08T05:00:08Z,UCzIyoPv6j1MAZpDHKLGP_eA,Morgan Wallen,24,21-01-09,[none],768684,17438,315,1094,https://i.ytimg.com/vi/FXzE9eP1U_E/default.jpg,FALSE,FALSE,Check out Morgan's episode of RELEASED: https://youtu.be/DiC41exb5VAListen to ‘Dangerous: The Double Album’ now: https://MorganWallen.lnk.to/DangerousYD Stay connected for exclusive updates:▸Mailing List: https://bit.ly/2FRP7LK▸Text: 865-351-6290▸Website: https://morganwallen.com/▸ Shop Merch: https://morganwallen.lnk.to/shopFollow Morgan:▸Instagram: https://instagram.com/morganwallen/▸Twitter: https://twitter.com/morganwallen/▸TikTok: https://vm.tiktok.com/ZMJHVheG5/▸Facebook: https://facebook.com/morgancwallen
qx9CUujjMcU,"Viego, The Ruined King Ability Reveal | New Champion",2021-01-08T16:00:42Z,UC0NwzCHb8Fg89eTB5eYX17Q,SkinSpotlights,20,21-01-09,Viego|The Ruined King|Champion Reveal|League of Legends|Viego Champion Spotlight|Champion Spotlight|Riot Games|SkinSpotlights|Viego The Ruined King|Viego Spotlight|Viego Gameplay|Viego Abilities|League of Legends (Video Game)|Piltover|mid|Viego mid|Ruined King Blade|Viego Ruined King Blade|Stained Blade|Ruined King|Viego Ruined King,1453645,41694,1086,5702,https://i.ytimg.com/vi/qx9CUujjMcU/default.jpg,FALSE,FALSE,"The new champion Viego, the Ruined King is here!Thanks to Riot Games for providing some of the assets in this video!Purchase RP here (Amazon Affiliate - NA): https://amzn.to/2qZ3BmvVideo contains Viego Abilities descriptions.00:00 Passive00:21 Q Ability00:42 W Ability01:02 E Ability01:22 R Ability01:45 Splash Art"
VSpgaN3wuag,ZAYN - Vibez (Official Video),2021-01-08T17:00:08Z,UCy5FUarBYUHFpPtYVuvzgcA,ZaynVEVO,10,21-01-09,zayn|vibez|zayn vibez|vibez video|new zayn video|#vibez|zayn malik|better|zayn better|better video|zayn gigi|gigi|gigi hadid|zayn 2020|zayn lyrics|zayn video|inzayn|new zayn music|new zayn song|zayn live|pillowtalk|zayn pillowtalk|zayn flames|dusk till dawn|zayn dusk till dawn|zayn sia|whole new world|zayn aladdin|i don’t wanna live forever|zayn taylor swift|zayn let me|entertainer|enertainer video|snakehips,4716911,704431,6817,54801,https://i.ytimg.com/vi/VSpgaN3wuag/default.jpg,FALSE,FALSE,"#ZAYN // “Vibez” // Out Now: https://smarturl.it/zVibezNobody Is Listening // 1.15.21 // Pre-Order: https://smarturl.it/zNIL 🎧Put your headphones on to listen in immersive 360 Reality Audio🎧Director: Ben MorProducer: Melissa Llewellyn-AlstonProduction Company: London Alley Entertainment Inc. Watch the official video for “Better”: https://smarturl.it/xBetterx/youtube Listen to more music from Zayn: https://zayn.lnk.to/listenYD  “Vibez” was mixed with an immersive #360RA experience in mind, use headphones for the full effect.Stream “Vibez” in full 360 Reality Audio, now available on Tidal, Amazon and Deezer.Register at the link below to redeem your 3-month free trial!Visit: https://cutt.ly/music_com_Zayn*Quantities are limited, while supplies lastSubscribe to ZAYN’s channel for more content: https://smarturl.it/ZAYNytSubscribe    Follow ZAYN:▶https://www.facebook.com/zayn▶https://www.instagram.com/zayn▶https://twitter.com/zaynmalik___“Vibez”Don’t keep me waiting I’ve been waiting all night to get closerAnd you already know I got it for yaYou know the vibes, know the vibesPut it on ya If we’re moving too fast we can slow up Baby, this far from mediocre no You know the vibes, know the vibes It’s you and me Here in this room Imagining things we could do Won’t tell no lies, no lies to you I need you here, I need you here Mind running wild We touching slow Just say the word, I’m ready to go Anticipation plays after 4 I need you now oh  Baby I’mma get you right, I will When I touch you tell me how it feel Trust me, I’mma make it feel surreal Baby Mind Of Mine I’mma do all the things Type of things that happen in your dreams Get you right where you need to be Just don't keep me Don't keep me waiting I’ve been waiting all night to get closer And you already know I got it for yaYou know the vibes, know the vibes Put it on ya If we’re moving too fast, we could slow up Baby, this far from mediocre no You got the vibes, got the vibes  Baby I’mma get you right, I willWhen I touch you tell me how it feel Trust me, I’mma make it feel surrealBaby Mind of MineI’mma do all the things Type of things that happen in your dreamsGet you right where you need to be Just don't keep me  Don’t keep me waiting I’ve been waiting all night to get closer Yeah you already know I got it for yaYou know the vibes, know the vibesPut it on yaIf were moving to fast, we could slow up Baby, this far from mediocre no You got the vibes, got the vibes#zayn #vibez #360RA"
EUjp8PkwWqA,NLE Choppa - Moonlight feat. Big Sean (Official Music Video),2021-01-08T19:12:29Z,UCWICXNlSLc7eeNazpzUZcLg,NLE CHOPPA,10,21-01-09,NLE Choppa|Bryson|From Dark To Light|Top Shotta|New Rap Music|New Hip Hop|XXL|Complex|Lyrical Lemonade|Rap Caviar|Tee Grizzley|Comethazine|Famous Dex|Roddy Ricch|Blueface|Mulatto|Chief Keef|Shotta Flow|Narrow Road|Walk Em Down|New Hip Hop Music|No Jumper|Adam 22|Top Shotta Don Dada|Big Sean|Moonlight|Picture Me|Body Catchers|Picture Me Grapin|2Pac|2pac sample|100 grapes|Jiggin|big sean feature|moonlight|choppa moonlight|featuring big sean,386961,48979,584,6601,https://i.ytimg.com/vi/EUjp8PkwWqA/default.jpg,FALSE,FALSE,Listen to From Dark To Light here: https://nlechoppa.lnk.to/fromdarktolightMerch: https://warnerrecords.lnk.to/choppastoreFollow NLE Choppa:Txt: (901)245-5603Web: https://nlechoppa.comEmail: https://nlechoppa.com/mailing-listInstagram: https://instagram.com/nlechoppamusicFacebook: https://facebook.com/nlechoppamusicTwitter: https://twitter.com/nlechoppa1Snapchat: https://snapchat.com/add/nlechoppamusicTikTok: @NLEChoppaMusicTriller: @NLEChoppa#NLEChoppa #BigSean #Moonlight #FromDarkToLight
Dqe7Iw2MiZ8,HOVERBOARD TEST! (PART 2/2),2021-01-07T21:00:05Z,UCjgpFI5dU-D1-kh9H1muoxQ,Hacksmith Industries,28,21-01-09,thehacksmith|hacksmith|back to the future|marty|doc|doc brown|hoverboard|future|delorean|time machine|hovering|magnets|science|make it real|real working hoverboard|magnetic|eddy currents|engineering|engineer|stem|experiment|workshop|build|electronics|battery|michael j fox|metal|mechanical|inventor|creating|time travel|self lacing shoes|hover board|board|back to the future board|scientist|batteries|wires|ESC|wrapping|vinyl|hot pink|floating|magnet wheel|wheels,4025328,219702,3440,12473,https://i.ytimg.com/vi/Dqe7Iw2MiZ8/default.jpg,FALSE,FALSE,"Check out http://kiwico.com/Hacksmith50 for 50% off your first month of any crate!Thanks to Grepow for providing the Epic LiPo batteries ► http://bit.ly/2JLYCltVisit Twin City Graphics for all your vinyl wrapping needs ► http://www.twincitygraphics.com/Check out K&J Magnetics for all your magnet needs! https://www.kjmagnetics.com/Become a Hacksmith member get exclusive perks! ► https://www.youtube.com/channel/UCjgpFI5dU-D1-kh9H1muoxQ/join►Early video access ►Project design files (solidworks)►Merch Discounts ►Collaborate with us on our videos SOCIALWebsite ► http://www.hacksmith.techFacebook ► http://www.facebook.com/thehacksmithInstagram ► http://www.instagram.com/thehacksmithTwitter ► http://twitter.com/thehacksmithPatreon ► http://www.patreon.com/thehacksmithDiscord ► https://discordapp.com/invite/thehacksmith Merch ► https://www.hacksmith.storeCHAPTERS: 0:16 Intro & Recap1:56 Wrapping the Board & Assembly2:50 Installing New Speed Controllers3:16 How Will We Power The Board?4:14 Hovering Test4:52 How To Get Started With Engineering!5:55 Jimmy Has A Solution!6:50 Making Sure Things Don't Go Boom.8:16 4th Hover Test - Will It Succeed? 9:51 Cooking Eggs On A Super Hot Motor10:20 The Finished Board & Installing The Floor10:40 The Final Test12:56 OutroMUSIC:After Dark by PYLOTLicensed from Monstercat ►https://www.monstercat.com/Time Spender by F.O.O.L Licensed from Monstercat ►https://www.monstercat.com/Curious Cat by Cinema LifeLicensed from Triple Scoop Music ►https://triplescoopmusic.com/Horse Power by F.O.O.L & Tokyo RoseLicensed from Monstercat ►https://www.monstercat.com/She by F.O.O.L Licensed from Monstercat ►https://www.monstercat.com/Caine by PYLOTLicensed from Monstercat ►https://www.monstercat.com/SOFTWARE:PCB Design ► https://www.altium.com/yt/TheHacksmithVideo Review / Collaboration ► http://r.frame.io/pZq3NVideo Editing ► Adobe Premiere CAD ► Solidworks CAM ► Autodesk HSM http://bit.ly/HSMworksCAMERA GEAR:Highspeed Cam - Chronos 1.4 ► http://bit.ly/chronosCamMain shooter - Panasonic GH5s ► https://bhpho.to/2Fjd80N Phone - Samsung S10  ► https://bhpho.to/2N8FOh8Camcorder - Sony Handycam ► https://bhpho.to/2FDnq81 Action Cam - GoPro ► https://bhpho.to/2FxXDC4 Steadicam - Removu K1 ► https://bhpho.to/2N9lDQq Main mic - Sennheiser ► https://bhpho.to/2DsR8ecBendy Tripod ► https://bhpho.to/2FyLNb0 Main Tripods - old second hand Manfrotto tripods no longer sold. Studio Light - Luxli ► https://bhpho.to/2N9SPavTOOLS / MACHINES: CNC Mill - Tormach 1100MX ► https://hubs.ly/H0B8DWG0CNC Mill - Tormach PCNC 440 ► https://hubs.ly/H0B8DYk0CNC Lathe - Tormach 15L ► https://hubs.ly/H0B8Gcp0Autofeed Bandsaw - Tormach AF50 ► https://hubs.ly/H0B8Gj10CNC Waterjet Cutter ► http://bit.ly/wazerJetCNC Plasma Cutter ► http://bit.ly/EMTplasma3d Printers ► http://bit.ly/H1PrinterLaser Cutter - Gweike LG900N 80W ► http://lmgtfy.com/?q=lg900n 3d Scanner ► http://amzn.to/2pwbvTuDrills, drivers, grinders, saws, etc ► http://amzn.to/2p9SPJ3 Mig Welder ► http://bit.ly/MP250iWelderTig Welder ► http://bit.ly/Tig200WelderQuiet Air Compressor ► http://bit.ly/38zVKzBDesktop PC ► https://youtu.be/gSbt3LK8hCs Oscilloscope ► https://bit.ly/38sOzKwMultimeters ► https://bit.ly/2WKwPEQPurchases made through some store links may provide some compensation to Hacksmith.WARNING: THESE VIDEOS ARE FOR ENTERTAINMENT PURPOSES ONLY. PERSONAL USE OF VIDEO CONTENT IS AT YOUR OWN RISK. THE HACKSMITH IS A TRAINED PROFESSIONAL WHO KNOWS EXACTLY WHAT HE'S DOING. EXCEPT WHEN HE DOESN'T. DO NOT ATTEMPT TO RECREATE OR RE-ENACT ANYTHING SHOWN IN THESE VIDEOS."
UXR_bqyAy4E,Chaos in Washington as Trump supporters storm Capitol and force lockdown of Congress - BBC News,2021-01-06T22:27:24Z,UC16niRr50-MSBwiO3YDb3RA,BBC News,25,21-01-09,bbc|bbc news|news|Washington|Capitol|capital|DC|Congress|Trump|supporters|storm|stormed|building|lockdown|evacuation|police|national|guard|chaos|crisis|President|Biden|representatives|senators|vote|election|result|victory|defeat|challenge|mob|anger|protest|demonstrating|protesting|demonstration|rage|White|House|elect|elected|mayor|deployed|Huw Edwards|Jon Sopel|US|United|States|North|America|editor|Aleem Maqbool|Lebo|Diseko|coup|constitution|attack|attempt|armed|shot|woman|insurrection,7237403,64245,12786,57511,https://i.ytimg.com/vi/UXR_bqyAy4E/default.jpg,FALSE,FALSE,"Thousands of supporters of President Trump have stormed the US Capitol building, venting their anger at the victory of Joe Biden in the presidential election. They forced the evacuation and lockdown of Congress, where lawmakers were preparing to approve the election result. Shortly before the clashes President Trump had addressed his supporters near the White House telling them that he would never accept defeat. President-elect Biden called on Mr Trump to tell his people to go home and eventually that was the message delivered from the White House.Washington’s Mayor ordered a curfew as members of the US National Guard were deployed to protect the city. Huw Edwards presents BBC News at Ten reporting by North America editor Jon Sopel in Washington and from Aleem Maqbool and Lebo Diseko at the Capitol.Please subscribe HERE http://bit.ly/1rbfUog"
rnFRcjzhTzE,Season 2021 Opening Day | Full Livestream - League of Legends,2021-01-08T15:00:09Z,UC2t5bjwHdUX4vM2g8TRDq5g,League of Legends,20,21-01-09,Riot Games|Riot|League of Legends|League|LoL|MOBA|yt:cc=on,2678861,132364,1999,6949,https://i.ytimg.com/vi/rnFRcjzhTzE/default.jpg,FALSE,FALSE,"New year, new surprises: Welcome to Season 2021. Experience the Opening Day livestream again for a first look at the upcoming year across League of Legends, Wild Rift, Teamfight Tactics, Legends of Runeterra, and esports.League of Legends Sign Up & Downloadhttps://signup.leagueoflegends.com/"
