video_id,title,publishedAt,channelId,channelTitle,categoryId,trending_date,tags,view_count,likes,dislikes,comment_count,thumbnail_link,comments_disabled,ratings_disabled,description
bIiLofAhTz8,ALLERGIC REACTION after SAYING YES to the dress,2021-01-05T01:13:39Z,UCLGe0PxyRFWmXVGJKq_gGvw,fancy vlogs by gab,22,21-01-09,Allergic reaction after saying yes to the dress|Say yes to the dress|Saying yes to the dress|Hi stalker taking the time to search my tags 🥰|Mother laughs at bridesmaid|Allergic reaction|Bridal vlogs|Fancy vlogs by gab|Gabi demartino|Gabi demartino engaged,664813,27865,1582,2400,https://i.ytimg.com/vi/bIiLofAhTz8/default.jpg,FALSE,FALSE,"What is grace? https://youtu.be/m2bz8mnWsbsBeautiful mess FRAGRANCE ORDER NOW HERE:https://gabifragrances.com shop my clothes + antiques! https://gabtoinetteantiques.bigcartel.comDOWNLOAD + STREAM pretty little mind http://smarturl.com/prettylittlemindDOWNLOAD + STREAM Champagne Dreamshttp://smarturl.it/champagnedreamsSUBSCRIBE TO MY NEW VEVO ARTIST PAGE!https://www.youtube.com/channel/UC9apgDi_fm5AUeZf6PAvYlAMY SITE! MERCH / ALBUM / TOUR UPDATES HERE / video + ANTIQUE SHOP HERE!https://gabidemartino.coPLS DONATE https://www.gofundme.com/f/policeaccountability?sharetype=teams&member=4519946&utm_medium=copy_link&utm_source=customer&utm_campaign=p_na+share-sheet&rcid=3a10c4ec01464269a3b43a081378f35bhi i’m gabi DeMartinostay fancy always a video is posted every 3 days!Beautiful Mess album coming to you 2021! (15 tracks)Gabroadway - EP by Gabi DeMartinohttps://music.apple.com/us/album/gabroadway-ep/1518006502Thumbnails by: @abbyclocker @abbytheanimator 🐇twitter.com/gabcake tweet me that you saw this and I’ll follow u back heheTIKTOK: fancytiktokbygabInstagram.com/gabiyou’ve never seen an aesthetic til you’ve seen my instaaaafollow the instagram page for our home! instagram.com/thecastawaycottageFollow my show on instagram! instagram.com/bloodqueensofficialFor $5 in ride credit, download the Lyft app using my referral link: https://www.lyft.com/i/GABRIELLA20736?utm_medium=p2pi_iacc. It's the most affordable ride in town. ORDER our EP! http://smarturl.it/NikiGabiINDIVIDUALDownload my single, flowers! http://smarturl.it/NikiGabiINDIVIDUALmake sure to follow the instagram page @blooduqeensofficial-Snapchat-fancysnapsbygabi mean, if you’re girly and would love to see girly snaps and over-usage of snapchat filters then go ahead and add me!!i have my own series going on this channel in october and you can get inside looks already at @bloodqueensofficial on instagram!!!steal my style: http://stealherstyle.net/gabriella-demartino/  -Tumblr- http://www.breakfastatchanel-starringgabi.tumblr.com-Pinterest-www.pinterest.com/pinkprincessGAB"
QQXm88ppbIs,Game Theory: The Dark Future of the Dream SMP (Minecraft),2021-01-03T19:05:16Z,UCo_IB5145EVNcf8hw1Kku7w,The Game Theorists,20,21-01-09,minecraft|Dream|dream smp|dream minecraft|dream team minecraft|dream team|minecraft dream|minecraft dream smp|dream smp minecraft|minecraft 1.7|minecraft update|minecraft lore|unsolved mysteries of minecraft|dream unsolved mysteries|zombie minecraft story mode|minecraft story mode|minecraft cave update|dream minecraft manhunt|minecraft funny moments|minecraft funny|minecraft hardcore,3439261,219590,8364,29585,https://i.ytimg.com/vi/QQXm88ppbIs/default.jpg,FALSE,FALSE,"SUBSCRIBE to Catch all the Theories! ► https://goo.gl/kQWHkJ      Dream has made Minecraft history with his SMP, or Survival Multiplayer Server, with his Dream Team. It has captivated many and finally I'm here to show you EXACTLY what he's been up to and what I predict is the FUTURE of his SMP. You see, this is not some simple impromptu game between friends. No sir!. There are layers of story going on here and it's getting dark. Political battles, a fight for control, and a nemesis out to rule the world - and that is just the beginning!SUBSCRIBE to Catch all the Theories! ► https://goo.gl/kQWHkJ      Find the game here ► https://www.minecraft.net/en-usNeed Royalty Free Music for your Content? Try Epidemic Sound. Get A 30 Day Free Trial! ► http://share.epidemicsound.com/MatPat#Dream #DreamSMP #Minecraft  #SMP #DreamTeam #MinecraftTheory #MinecraftLore #MinecraftHistory #MinecraftUpdate #MatPat #Theory #GameTheory  More THEORIES: FNAF, The FINAL Timeline ►► https://bit.ly/2MlHYFeFNAF, The Monster We MISSED! ►► https://youtu.be/_ygN8HLCaJgFNAF This Theory Changes Everything ► https://bit.ly/2JUQUn6FNAF, You Were Meant To Lose ► https://youtu.be/7bn8hM9k0b0FNAF 6, No More Secrets ► https://bit.ly/2LVCq4u   Credits:Writers: Matthew Patrick and Justin KuiperEditors: Alex Sedge Sedgwick, Danial BanditRants Keristoufi, and Tyler MascolaAssistant Editor: AlyssaBeCrazySound Editor: Yosi Berman"
cfykWkilSQ8,Markiplier Isn't Real,2021-01-04T20:19:14Z,UC7_YxT-KID8kRbqZo7MyscQ,Markiplier,22,21-01-09,markiplier isn't real,4328429,415907,3582,38759,https://i.ytimg.com/vi/cfykWkilSQ8/default.jpg,FALSE,FALSE,I'm leaving for a week. Also I'm not real.
0-Tm65i96TY,Pooh Shiesty - Back In Blood (feat. Lil Durk) [Official Music Video],2021-01-02T17:00:01Z,UCTBIIbIs83IBsy4E1BQxYBw,Pooh Shiesty,10,21-01-09,pooh shiesty|pooh sheisty|pooh|shiesty|atlanta pooh shiesty|atlanta|1017 records|1017 artist|1017 pooh|1017|rap|hip hop|atlanta rap|back in blood|lil durk|pooh shiesty back in blood|lil durk back in blood|chicago|memphis|back in blood music video,8602638,181688,7795,16767,https://i.ytimg.com/vi/0-Tm65i96TY/default.jpg,FALSE,FALSE,"Pooh Shiesty - Back In Blood (feat. Lil Durk)Listen/Download: https://apple.co/2MybyfYShot by @JerryPHD Subscribe for more official content from POOH SHIESTY:https://poohshiesty.lnk.to/YoutubeFOLLOW POOH SHIESTYInstagram: https://poohshiesty.lnk.to/InstagramTwitter: https://poohshiesty.lnk.to/TwitterFacebook: https://poohshiesty.lnk.to/FacebookLISTEN TO POOH SHIESTYApple: https://poohshiesty.lnk.to/AppleMusicSpotify: https://poohshiesty.lnk.to/SpotifySoundcloud: https://poohshiesty.lnk.to/SoundcloudAudiomack: https://poohshiesty.lnk.to/Audiomack The official YouTube channel of 1017 Records artist POOH SHIESTY. Subscribe for the latest music videos, performances, and more.#BackInBlood #PoohShiesty #LilDurk #TheNew1017"
iIZWNsBe6cM,Kim Kardashian & Kanye West Headed for Divorce,2021-01-06T13:14:50Z,UChi08h4577eFsNXGd3sxYhw,Breakfast Club Power 105.1 FM,24,21-01-09,the breakfast club|breakfast club|power1051|celebrity news|radio|video|interview|angela yee|charlamagne tha god|dj envy,342507,4576,399,2236,https://i.ytimg.com/vi/iIZWNsBe6cM/default.jpg,FALSE,FALSE,"Subscribe NOW to The Breakfast Club: http://ihe.art/xZ4vAcAGet MORE of The Breakfast Club:► LISTEN LIVE: http://power1051fm.com/► CATCH UP on What You Missed: http://ihe.art/Dx2xSGN► FOLLOW us on Instagram: https://www.instagram.com/BreakfastClubAM/► FOLLOW us on Twitter: https://twitter.com/BreakfastClubAM► LIKE us on Facebook: https://www.facebook.com/BreakfastClubAM/Executive Producer: Eddie F.APD/Producer: Daniel Greene - @d7greeneBoard Producer: DJ Dramos - @djdramosProducer: Taylor Hayes - @funsize_tCamera/Video Editor: Nick Cio - @isaywesayAssistant Editor: Breanna Chianne - @iamb_chianneThe Breakfast Club features celebrity interviews, Charlamagne tha God’s Donkey of the Day, Angela Yee’s Rumor Reports, DJ Envy’s mixes and so much more! Every guest visiting the world’s most dangerous morning show is grilled with their signature blend of honesty and humor. The results are the best interviews to be found on radio.#BreakfastClub#RumorReport"
SAjP9HCqk4I,Deadpool 2 Monologue,2021-01-04T22:15:37Z,UCA3-nIYWu4PTWkb6NwhEpzg,Ryan Reynolds,22,21-01-09,[none],1500899,94145,747,3047,https://i.ytimg.com/vi/SAjP9HCqk4I/default.jpg,FALSE,FALSE,"Introducing Walker Scobell. This innocent young boy plays 12 year old me in our upcoming Netflix film #TheAdamProject. Because he takes his job seriously, the role required significant research. No matter what, he’s WAY too young to know this monologue by heart. So precious."
m5TV_ucH_G8,"Pat McAfee Reacts To Eagles Benching Jalen Hurts, NFL Investigation",2021-01-04T21:00:26Z,UCxcTeAKWJca6XyJ37_ZoKIQ,The Pat McAfee Show,17,21-01-09,pat mcafee|podcast|sports|nfl|football|for the brand|pat mcafee show|nfl news|pat mcafee reacts|pat mcafee live|pat mcafee show live|pat mcafee podcast|jalen hurts|jalen hurts benched|eagles|philadelphia eagles|nfl 2020|2020 nfl|nate sudfeld|carson wentz|eagles washington|doug pederson|eagles qb,901695,14238,336,2590,https://i.ytimg.com/vi/m5TV_ucH_G8/default.jpg,FALSE,FALSE,Do you think that the Eagles could get in some trouble for this?This is a clip from The Pat McAfee Show live from Noon-3PM EST Mon-Fri.Become a member! https://www.youtube.com/channel/UCxcTeAKWJca6XyJ37_ZoKIQ/joinSUBSCRIBE: https://www.youtube.com/channel/UCxcTeAKWJca6XyJ37_ZoKIQ?sub_confirmation=1MERCH: https://store.patmcafeeshow.com#PatMcAfee #Eagles #NFL
fWdbo0i8v9g,Get Abs & Flat Stomach Workout | Flat Stomach Challenge 2021,2021-01-04T12:00:13Z,UCCgLoMYIyP0U56dEhEL1wXQ,Chloe Ting,26,21-01-09,abs|abs workout|abs exercise|lower abs workout|intense ab workout|10 minute abs|flat belly exercise|flat belly workout|abs workout program|abs program|workout|exercise|flat stomach|flat tummy|female abs|female six pack|how to get abs|sexy abs|girl abs|quick way to get abs|get abs quick|abs fast|10 mins workout|abs challenge|chloe ting abs|abs chloe|chloe abs|flat stomach workout|flat stomach exercise|how to get flat stomach|abs routine,1653833,56164,950,3578,https://i.ytimg.com/vi/fWdbo0i8v9g/default.jpg,FALSE,FALSE,"Time to work those abs! Check out my Flat Stomach Challenge. We've got 8 brand new episodes in this 28 days program. Please smash that like button for me, and drop a comment below with how you go each day.✚ Free Program Schedulehttps://www.chloeting.com/program/2021/flat-stomach-challenge.htmlNew Warm Up Routine - https://youtu.be/j6C-6F6dr-4Ep 1 - Full Body - https://youtu.be/CPI_Ve7vsHsEp 2 - Abs - https://youtu.be/fWdbo0i8v9gEp 3 - Upper Body -  https://youtu.be/iN-AEOs9rzcEp 4 - Booty - 7th JanEp 5 - HIIT - 11th JanEp 6 - Lower Abs - 13th JanCooldown - TBA✚ Sponsor this channelhttps://www.youtube.com/chloeting/joinSub to my 2nd channelhttps://www.youtube.com/channel/UCBrcDabYtwbR1VIhwH5efZA?sub_confirmation=1✚ My linkshttps://www.instagram.com/chloe_t/https://www.instagram.com/itschloeting/twitch.tv/chloetinghttps://discord.gg/chloetingMy Spotify Playlist https://open.spotify.com/user/s17162aerlbfj7cpsvv48spyx?si=0Zzwvx6-SdW2gbuyIveoaQ✚ Music byParty in Backyard - https://www.youtube.com/user/PartyInBackyardI Can Feel It - https://youtu.be/rMxjLEfZUrwSean Remix - https://youtu.be/R4YzjPfwSJgDylan LockeRoomie Badhttps://youtu.be/XYVqxH1s4qc#workouts #fitness #chloetingIMPORTANT DISCLAIMER: Some people may see my video titles as click-bait. YouTubers optimise their video's meta data for discovery due to how the algorithm is like. This isn't anything new. Most people who've been watching YouTube for years would understand this. If you're unhappy and get triggered by this, well, this channel isn't for you then. I’ve provided free workout schedules and programs since day 1 and have always optimised my meta data as such so that's not going to change.Having said that, it doesn't mean the workout do not work. You will still see results by following a suitable program schedule, watching your diet, being in a deficit or surplus (based on your goals), doing exercises in good form, etc. These are all equally important factors. You're not going to get abs, grow a booty, grow biceps magically from 1 or 2 videos, in 1, 2, 3 or 4 weeks cause everyone is different. I've explain multiple times throughout videos throughout my channel over years that it takes time and lots of factors, so don't take a video title out of context. Targetting fat loss is not scientifically proven. Everyone is different and it takes time. When doing any home workouts, do take precaution to exercise in a safe environment, and if you need help or you're not seeing results, I suggest seeing a health and fitness professional to give you tailored advice on your exercise form and dietary needs. I am not a medical professional and what I share on my channel are my views and what has worked for myself. Your health and safety is the utmost importance so find out what works for you."
Pl2XMFyERsc,Amy Learns She's Pregnant! | 1000-lb Sisters,2021-01-04T20:57:34Z,UCqf2gzmKtH3PaAbt-qgFFsw,TLC,24,21-01-09,tlc|tlc shows|tlc full episodes|reality tv series|morbidly obese|weight issues|overweight people|weight loss|surgical intervention|overweight|fat|heavy|fat tv show|fat video|1000 pound sisters|1000 pounds|1000-lb sisters|1000lb sisters|1000 lb sisters|overweight sisters|overweight siblings|slaton sisters|amy slaton|tammy slaton,635595,9090,492,1189,https://i.ytimg.com/vi/Pl2XMFyERsc/default.jpg,FALSE,FALSE,Stream Full Episodes of 1000-lb Sisters:discovery+ ► https://www.discoveryplus.com/show/1000-lb-sistersTLC ► https://www.tlc.com/tv-shows/1000-lb-sisters/Start your free trial of discovery+ ► https://www.discoveryplus.com/Subscribe to TLC: http://bit.ly/SubscribeTLC Facebook: https://www.facebook.com/TLCTwitter: https://twitter.com/TLCInstagram:https://www.instagram.com/TLC
M8g1M6yNels,LIL BOOSIE $1 MILLION DOLLAR CAR COLLECTION IS CRAZY! *EVERY SPEC YOU NEED*,2021-01-04T16:35:09Z,UCzecSiF3smi07ZNyZhTUoZg,CamaKat,24,21-01-09,Josh Laurent|tallguycarreviews|tallguycarreviews hellcat|streetspeed717|streetspeed717 hellcat|streetspeed717 cars|mrorganik|mrorganik cars|mrorganik hellcat|living with mazi|hemilife44|Tallguycarreviews collab|Tallguycarreviews exposed|Mrorganik collab|Mrorganik exposed|Lil boosie|Lil boosie drives hellcat|Lil boosie collab|Camakat|Pooh shiesty|Pooh shiesty collab|Pooh shiesty drives hellcat,422464,11419,393,746,https://i.ytimg.com/vi/M8g1M6yNels/default.jpg,FALSE,FALSE,Hope you guys are enjoying the content. There is way more to come. Like & Sub to join the Cam Fam.#camakat #lilboosie #roadto50k
SNefSqfYzZg,Kid Auditions That Will Make You CRY Britain's Got Talent Edition | Amazing Auditions,2021-01-04T16:34:53Z,UCTi3mRHhtqqrz5rXgw0F3mw,Amazing Auditions,24,21-01-09,amazing auditions|Kid Auditions That Will Make You CRY Britain's Got Talent Edition|kid auditions that will make you cry|bgt|britain's got talent|crying judges|judges cry|emotional auditions|emotional bgt|emotional kid auditions|emotional bgt auditions|crying|bgt cry|britain's got talent crying|emotional|emotional performance,473868,2318,165,153,https://i.ytimg.com/vi/SNefSqfYzZg/default.jpg,FALSE,FALSE,Check out the TOP 5 EMOTIONAL Kid Auditions that will make you CRY - BGT Edition!Subscribe for Amazing Auditions ▶︎ http://bit.ly/AMAZING_SUBSCRIBE#bgt #britainsgottalent #amazingauditions
B2v9vfuM5X8,Is This Roller Coaster Bike Actually Going To Work?,2021-01-04T21:00:02Z,UCxS2lX7728bTnmK1t21bYlA,Scotty Cranmer,24,21-01-09,[none],344889,19426,279,1001,https://i.ytimg.com/vi/B2v9vfuM5X8/default.jpg,FALSE,FALSE,Buy CAN'T SLOW DOWN Clothing Here! http://www.cantslowdown.comWe built a DIY Roller Coaster Bike and today is the day that we are going to ride it and see if it actually works! We have four different BMX riders attempting forward rolls and Matty Cranmer is going to attempt a world's first backwards loop!
fZvg42vBuc0,I've never seen a shooter greater than Steph Curry' - Stephen A. reacts to Curry's 62-point game,2021-01-04T16:51:23Z,UCiWLfSweyRNmLpgEHekhoAg,ESPN,17,21-01-09,first take|stephen curry|stephen a smith|espn|nba|nba on espn|espn nba|first take today,1756174,32883,916,4393,https://i.ytimg.com/vi/fZvg42vBuc0/default.jpg,FALSE,FALSE,"Stephen A. Smith and Max Kellerman react to Golden State Warriors star Stephen Curry scoring 62 points in a win against the Portland Trail Blazers.#NBA #FirstTake ✔️ Subscribe to ESPN+https://plus.espn.com/✔️ Get the ESPN App: http://www.espn.com/espn/apps/espn✔️ Subscribe to ESPN on YouTube: http://es.pn/SUBSCRIBEtoYOUTUBE✔️ Subscribe to NBA on ESPN on YouTube: http://bit.ly/SUBSCRIBEtoNBAonESPN✔️ Watch ESPN on YouTube TV: http://es.pn/YouTubeTVESPN on Social Media:► Follow on Twitter: http://www.twitter.com/espn► Like on Facebook: http://www.facebook.com/espn► Follow on Instagram: http://www.instagram.com/espnVisit ESPN on YouTube to get up-to-the-minute sports news coverage, scores, highlights and commentary for NFL, NHL, MLB, NBA, College Football, NCAA Basketball, soccer and more. More on ESPN.com: https://www.espn.com"
xDX-rFibnu8,Watching my old videos.,2021-01-03T15:00:31Z,UCgAyQyy6x3L-tmM1GICelGA,TommyOutit,20,21-01-09,Tommyinnit|minecraft|mine craft|old videos|old|watching old videos|old tommyinnit videos|funny|minecraft funny|dream|dream minecraft|minecraft manhunt|minecraft speedrunner vs hunter|minecraft speedrunner|minecraft speedrun|minecraft challenge|challenge|the funniest minecraft video|real life|Watching my old videos.,2510931,337880,1266,13114,https://i.ytimg.com/vi/xDX-rFibnu8/default.jpg,FALSE,FALSE,"TommyInnit & Tubbo watch his old, unseen Minecraft videos. This was insane. Follow my Twitter - @tommyinnitFollow my Instagram - @tommyinnittEdited by Tommy + Big Man Editor Larry ( @TalentLacking )This is my Second Channel where I post extra content & videos that I love making but wouldn't be as awesome, cool or funny on the TommyInnit channel! There is still some Dream SMP Minecraft & some of The Funniest Minecraft Videos Ever... and even some vlogs like the time I met Wilbur Soot in real life... it is awesome & I have lots of laughs! I am not crazy"
4_Tm0SxIp6w,Wonder Woman 1984 Pitch Meeting,2021-01-03T20:15:01Z,UC2iUwfYi_1FCGGqhOUNx-iA,Screen Rant,24,21-01-09,Wonder woman 1984|ww84|wonder woman|gal gadot|diana prince|steve trevor|patty jenkins|dc|dceu|max lord|pedro pascal|barabara|kristen wiig|cheetah|superhero|dc universe|lasso of truth|wonder woman weird moments|dreamstone|ending|dumb things|makes no sense|review|plot holes|super easy barely an inconvenience|ryan george|screen rant|screenrant,1917279,103294,1437,9199,https://i.ytimg.com/vi/4_Tm0SxIp6w/default.jpg,FALSE,FALSE,"Step inside the pitch meeting that led to Wonder Woman 1984!Subscribe for more Pitch Meetings: http://goo.gl/ho3Hg6Wonder Woman was received as one of the best DCEU movies when it came out in 2017, so naturally Warner Bros wanted Gal Gadot, Chris Pine and Patty Jenkins to make a sequel. That sequel comes three years later in the form of Wonder Woman 1984, which in a historic first for a massive superhero blockbuster - came out on streaming at the same time as in theatres!Wonder Woman 1984 movie definitely raises some questions. Like why did Steve Trevor return through some random guy? Why are they using this man’s body for anything they like? Why is there a fully-fueled jet lying around at the Smithsonian and how does Steve Trevor know how to fly it? How does Diana know how to make it invisible? How did Wonder Woman get her lasso around Max Lord? How did literally everyone renounce their wishes? How did nobody wish the world to immediately end? What exactly is the message of this movie?!To answer all these questions and more, step inside the Pitch Meeting that led to Wonder Woman 1984! It’ll be super easy, barely an inconvenience.Check Out These Other Amazing Videos:Wonder Woman Pitch Meetinghttps://www.youtube.com/watch?v=PrAT_ncXr7MBatman V Superman: Dawn of Justice Pitch Meetinghttps://www.youtube.com/watch?v=a0DgGsKBpowOur Social Media:https://twitter.com/screenranthttps://www.facebook.com/ScreenRantOur Websitehttp://screenrant.com/"
xN8ENrfE-TY,"If You Build a House, I'll Pay For It!",2021-01-02T19:07:38Z,UCIPPMRA040LQr5QPyJEbmXA,MrBeast Gaming,20,21-01-09,[none],20122860,946729,13166,63951,https://i.ytimg.com/vi/xN8ENrfE-TY/default.jpg,FALSE,FALSE,"If you build the best house, I'll buy you a house! This is definitely the biggest prize we've given away yet and the builds players created in this challenge were insane!SUBSCRIBE OR YOU'LL HAVE BAD LUCKNew Merch - shopmrbeast.comJoin our discord server for your chance to compete in future Minecraft challenges!https://discord.gg/kCQKvZD----------------------------------------------------------------follow all of these or i will kick you• Facebook - https://www.facebook.com/MrBeast6000/• Twitter - https://twitter.com/MrBeastYT•  Instagram - https://www.instagram.com/mrbeast--------------------------------------------------------------------"
d3e8d9nErUk,"Bridgerton Costumes Are A Historical Mess, But They Kinda Work",2021-01-04T19:10:24Z,UCNwZIGnHkzy6KpHPQtserzQ,Karolina Żebrowska,27,21-01-09,[none],600623,42654,591,3275,https://i.ytimg.com/vi/d3e8d9nErUk/default.jpg,FALSE,FALSE,"forgot to mention that I focus - as always - on women's clothing here, but @Pinsent Tailoring should drop his review soon! also check out @Costuming Drama 's interesting video about issues within the show: https://www.youtube.com/watch?v=9XQxFcRfWSc&_____________________My Instagram: https://bit.ly/2Qo9rrIMy nudes: https://bit.ly/2UHHY6NMy merch: https://bit.ly/2CCq5jE"
quAzY1J68_A,NEVER Before Seen Video INSIDE The BENT Pyramid of Egypt! Lost Civilizations & the Ancient Egyptians,2021-01-05T02:16:41Z,UCsIlJ9eYylZQcyfMOPNUz9w,Bright Insight,24,21-01-09,[none],206136,14138,578,3293,https://i.ytimg.com/vi/quAzY1J68_A/default.jpg,FALSE,FALSE,"INCREDIBLE! First ever video footage INSIDE the Bent Pyramid of Egypt! Researchers have waited more than 5 decades to see what the interior structure of the Bent Pyramid looks like. This video was filmed on November 30th, 2020 and is among the first to ever show the public what the interior of this incredible ancient site looks like. This pyramid had been closed to researchers and the public up until June of 2019, and very few people have had the privilege to enter this incredible ancient site."
1hsaGjOoT6Q,Here's What It's Like To Road Trip The 702 HP Ram TRX - You'll Be Surprised By The Eye-Opening MPG!,2021-01-04T18:21:40Z,UCO-85LYfB61OP4SRAgpfncw,The Fast Lane Truck,2,21-01-09,TFLtruck|The Fast Lane Truck|ram trx|2021 ram 1500 trx|ram 1500 trx|2021 ram trx|ram rebel trx|ram trx 2021|ram 1500 trx 2021|2021 ram rebel trx|2021 ram trx truck|ram trx vs ford raptor|new ram trx|ram rebel trx 2021|all-new ram trx|ram trx review|trx|ram 1500|ram|ram trucks|ram rebel|ram trx price|2021 ram 1500 trx review|road trip|2021 ram 1500|2021 ram trx 1500|ram rebel trx drive|ram rebel trx vs ford raptor|ford raptor vs ram trx,237772,7330,227,1328,https://i.ytimg.com/vi/1hsaGjOoT6Q/default.jpg,FALSE,FALSE,"GIVE THE GIFT OF A TFL T-SHIRT! You know the truck and car lovers on your list want one. (https://www.duckco.com/tfl-store).Roman just took delivery of our brand new, long-term 2021 Ram TRX. Sporting a 702 horsepower supercharged V8, the truck promises huge fun (with a hefty price tag), but what sort of fuel economy can it manage on a 1,300-mile road trip from Detroit to our home base in Colorado? Let's find out!( http://www.patreon.com/tflcar )  Visit our Patreon page to support the TFL team!Watch more videos from TFL Studios:The Fast Lane Truck ( https://www.youtube.com/tfltruck )The Fast Lane Car ( https://www.youtube.com/tflcar )TFLoffroad ( https://www.youtube.com/tfloffroad )TFLbike (https://www.youtube.com/channel/UCo9xl4LtXSbsywS_J2n4iUQ )TFLnow ( https://www.youtube.com/tflnow )TFLclassics ( http://www.youtube.com/tflclassics )TFLtalk (https://www.youtube.com/tfltalk )TFL Podcasts:TFL Talkin' Cars Podcast ( https://tflcar.libsyn.com/ )TFL Talkin' Trucks Podcast ( https://tfltruck.libsyn.com/ )#Ram #TRX #RoadTrip"
guI7oxnXOKY,TROLLING KSI with a W2S DISSTRACK! (Proximity Chat Among Us),2021-01-04T16:44:40Z,UCvwgF_0NOZe2vN4Q3g1bY-A,Vikkstar123,20,21-01-09,Vikkstar|Vikkstar123|Vikkstar123HD|Sidemen|The Sidemen|Fortnite|Fort Nite|Fortnite Battle Royale|Fortnite Gameplay|Fortnite Custom Games|Fortnite Playground Mode,1282055,60831,785,1017,https://i.ytimg.com/vi/guI7oxnXOKY/default.jpg,FALSE,FALSE,More Among Us Enjoy!Follow me on TWITTER: http://twitter.com/#!/Vikkstar123Follow me on  INSTAGRAM: http://instagram.com/VikkstagramSidemen Clothing: http://sidemenclothing.com/Sidemen PCs: http://bit.ly/Vikkstar123My capture card: http://e.lga.to/vCheck out my other channels linked below:Minecraft: http://www.youtube.com/Vikkstar123HDLets Play: http://www.youtube.com/VikkstarPlays
TBiPFIdIpIA,"MUM, AM I ANIMATED?",2021-01-04T14:51:04Z,UCsS3G0h8Z9WOSD6ubFyelnA,Squiddo,24,21-01-09,tommyinnit|mum am i adopted|mum am i adopted tommyinnit|animation|animatic|dream smp,2883891,176033,2285,4478,https://i.ytimg.com/vi/TBiPFIdIpIA/default.jpg,FALSE,FALSE,If it looks crappy it's because I did it in one sitting asdgfhsdfhsdfAudio is from tommyinnit's 3000 subscriber special which got popularHope u enjoyed :]Twitter: https://twitter.com/TheRealSquiddoI use Clip Studio Paint and Hitfilm Express to animate(Do not repost)
