video_id,title,publishedAt,channelId,channelTitle,categoryId,trending_date,tags,view_count,likes,dislikes,comment_count,thumbnail_link,comments_disabled,ratings_disabled,description
CPI_Ve7vsHs,NEW Full Body HIIT Workout to lose Weight | 2021 Flat Stomach Challenge,2021-01-02T12:00:09Z,UCCgLoMYIyP0U56dEhEL1wXQ,Chloe Ting,26,21-01-09,flat stomach|flat stomach workout|flat stomach exercise|flat stomach and small waist|flat stomach and small waist workout|flat stomach in 28 days|flat stomach program|flat tummy|flat tummy workout|flat tummy exercise|flat tummy home workout|flat stomach at home|home workout|beginner workout|beginner friendly workout|hiit|exercise|stomach workout|tummy workout|abs|abs workout|abs exercise|abs routine|abs workout for women|female abs|easy abs workout,1601541,58677,453,3770,https://i.ytimg.com/vi/CPI_Ve7vsHs/default.jpg,FALSE,FALSE,"Start your 2021 new years resolution with a new flat stomach challenge! We've got 8 brand new episodes in this 28 days program. Please smash that like button for me, and drop a comment below with how you go each day.✚ Free Program Schedulehttps://www.chloeting.com/program/2021/flat-stomach-challenge.htmlNew Warm Up Routine - https://youtu.be/j6C-6F6dr-4Ep 1 - Full Body - https://youtu.be/CPI_Ve7vsHsEp 2 - Abs - https://youtu.be/fWdbo0i8v9gEp 3 - Upper Body -  https://youtu.be/iN-AEOs9rzcEp 4 - Booty - 7th JanEp 5 - HIIT - 11th JanEp 6 - Lower Abs - 13th JanCooldown - TBA✚ Other Free Programshttps://www.chloeting.com/program✚ Sponsor this channelhttps://www.youtube.com/chloeting/joinSub to my 2nd channelhttps://www.youtube.com/channel/UCBrcDabYtwbR1VIhwH5efZA?sub_confirmation=1✚ My linkshttps://www.instagram.com/chloe_t/https://www.instagram.com/itschloeting/twitch.tv/chloetinghttps://discord.gg/chloetingMy Spotify Playlist https://open.spotify.com/user/s17162aerlbfj7cpsvv48spyx?si=0Zzwvx6-SdW2gbuyIveoaQ✚ Music bySan Holo - I Still See Your Face (Hundaes Remix)Watch: https://youtu.be/ThoBhh6IG98Download / Stream: https://sanholo.lnk.to/wPYKovogSan Holo - Still Looking (CESQEAUX Remix)Watch: https://youtu.be/OfOhY2sBV24Download / Stream: https://sanholo.lnk.to/PZGN6q7GMusic provided by Monstercat: Dallas & BEAUZ - Outerspacehttps://youtube.com/monstercat https://youtube.com/monstercatinstinctMusic provided by Monstercat: inverness & William Bolton - Lost My Mindhttps://youtube.com/monstercat https://youtube.com/monstercatinstinctTrack:   Someone Else & IMMENSE - Hold On To MeMusic Provided by Magic RecordsListen To The Original:  https://youtu.be/HUeDrqQNOwoFree Download:  https://fanlink.to/et8BUsage Policy: http://www.magicmusicLLC.comTrack: Unknown Brain - Hollywood Perfect (ft. NotEvenTanner) [NCS Release]Music provided by NoCopyrightSounds.Watch: https://youtu.be/l6IcWZHico8Free Download / Stream: http://ncs.io/HollywoodPerfectTrack: Unknown Brain - Jungle of Love (ft. Glaceo) [NCS Release]Music provided by NoCopyrightSounds.Watch: https://youtu.be/ohymkBe4zhgFree Download / Stream: http://ncs.io/JungleofLoveCadmium - No Friends (feat. Rosendale)Free Download - https://fanlink.to/cDpV#workouts #fitness #chloetingIMPORTANT DISCLAIMER: Some people may see my video titles as click-bait. YouTubers optimise their video's meta data for discovery due to how the algorithm is like. This isn't anything new. Most people who've been watching YouTube for years would understand this. If you're unhappy and get triggered by this, well, this channel isn't for you then. I’ve provided free workout schedules and programs since day 1 and have always optimised my meta data as such so that's not going to change.Having said that, it doesn't mean the workout do not work. You will still see results by following a suitable program schedule, watching your diet, being in a deficit or surplus (based on your goals), doing exercises in good form, etc. These are all equally important factors. You're not going to get abs, grow a booty, grow biceps magically from 1 or 2 videos, in 1, 2, 3 or 4 weeks cause everyone is different. I've explain multiple times throughout videos throughout my channel over years that it takes time and lots of factors, so don't take a video title out of context. Targetting fat loss is not scientifically proven. Everyone is different and it takes time. When doing any home workouts, do take precaution to exercise in a safe environment, and if you need help or you're not seeing results, I suggest seeing a health and fitness professional to give you tailored advice on your exercise form and dietary needs. I am not a medical professional and what I share on my channel are my views and what has worked for myself. Your health and safety is the utmost importance so find out what works for you."
eMFBEiAJaKc,UFC 257 Free Fight: Conor McGregor vs Dustin Poirier 1,2021-01-02T15:00:19Z,UCvgfXK4nTYKudb0rFR6noLA,UFC - Ultimate Fighting Championship,17,21-01-09,ufc|257|ufc 257|free|fight|dustin|poirier|conor|mcgregor|first|ufc 178|2014|featherweight|lightweight|full|ko|knockout|round|finish|walkout|interview|joe|rogan|mma|ultimate fighting championship,5233106,60012,7728,8966,https://i.ytimg.com/vi/eMFBEiAJaKc/default.jpg,FALSE,FALSE,"Watch the first matchup between Dustin Poirier and Conor McGregor back at UFC 178 in 2014 when both fighters were featherweights on the rise. The lightweight rematch goes down at UFC 257 on Saturday, January 23 in Abu Dhabi.Subscribe to get all the latest UFC content: http://bit.ly/2uJRzRRExperience UFC live with UFC FIGHT PASS, the digital subscription service of the UFC. Visit https://ufcfightpass.com/To order UFC Pay-Per-Views on ESPN+, visit https://bit.ly/2vNIBE8 (U.S. only)To order UFC Pay-Per-Views, visit http://welcome.ufcfightpass.com/#PPV (Non U.S.)Connect with UFC online and on Social:Website: http://www.ufc.comTwitter: http://www.twitter.com/ufcFacebook: http://www.facebook.com/ufcInstagram: http://www.instagram.com/ufcSnapchat: UFCPeriscope: http://Periscope.tv/ufcConnect with UFC FIGHT PASS on Social:Twitter: http://www.twitter.com/ufcfightpassFacebook: http://www.facebook.com/ufcfightpassInstagram: http://www.instagram.com/ufcfightpass#UFC257"
1Rf9-Ej2xPw,The Matrix | Never-Before-Seen Cold Open | A Peacock Extra,2021-01-01T16:00:00Z,UCa90xqK2odw1KV5wHU9WRhg,The Office,24,21-01-09,the office|the office full episodes|rainn wilson|john krasinski|steve carell|michael scott|the office fire drill|jim and dwight pranks|dwight schrute|jim halpert|jenna fischer|the office thug life|the office funniest moments|the office bloopers season 1|the office cpr|the office parkour|Best The Office Moments|the office cold opens|the office matrix|the office matrix prank|the office matrix prank episode|the office dwight matrix,3877586,163292,1089,5494,https://i.ytimg.com/vi/1Rf9-Ej2xPw/default.jpg,FALSE,FALSE,"The Office US streaming now on Peacock: https://www.peacocktv.com/the-office-on-peacock?cid=2101priolibraryofceownyt731&utm_campaign=2101priolibraryofce&utm_source=yt&utm_medium=own_yt_brandawareness_descriptionlink&utm_content=matrixcoldopen&utm_term=theofficeWatch an exclusive, never-before-seen cold open from The Office's ninth season to celebrate The Office US coming to Peacock! In loving memory of Hugh Dane, Hank the security guard.Subscribe: http://bit.ly/2y5VK8NThis is the official YouTube channel for The Office US. Home to all of the official clips from the series, the funniest moments, pranks and fails. Think we should feature your favourite episode? Let us know in the comments! FB : https://www.facebook.com/theofficenbcTwitter : https://twitter.com/theofficenbcWebsite : http://www.nbc.com/the-office#TheOffice #PeacockTV"
PKtnafFtfEo,"Youtube Rewind 2020, Thank God It's Over",2021-01-01T21:00:03Z,UCX6OQ3DkcsbYNE6H8uQQuVA,MrBeast,24,21-01-09,[none],32937219,3848439,53030,294220,https://i.ytimg.com/vi/PKtnafFtfEo/default.jpg,FALSE,FALSE,This is what Youtube Rewind would look like if it was made by creators lolSUBSCRIBE TO THESE SMALL CHANNELS PLEASENalterDeeds: https://www.youtube.com/user/nalterdeedsAmelia and Bridie: https://www.youtube.com/channel/UCrSTjIIkIBHL7VDx7utP56wSoyan Osman: https://www.youtube.com/channel/UCuPGqvywieBAqvbkMSF4CNQThank you to these 3 boys for editing this video! I LOVE YOU GUYS AND AM FOREVER GRATEFUL!FlyingKitty: https://www.youtube.com/channel/UCYQT13AtrJC0gsM1far_zJgDolan Dark: https://www.youtube.com/channel/UCI5qWAMf5PHLNcM13R8pfiQGrandayy: https://www.youtube.com/channel/UCa6TeYZ2DlueFRne5DyAnygAll creator sub data from SocialBlade https://socialblade.com/╔═╦╗╔╦╗╔═╦═╦╦╦╦╗╔═╗║╚╣║║║╚╣╚╣╔╣╔╣║╚╣═╣ ╠╗║╚╝║║╠╗║╚╣║║║║║═╣╚═╩══╩═╩═╩═╩╝╚╩═╩═╝----------------------------------------------------------------follow all of these or i will kick you• Facebook - https://www.facebook.com/MrBeast6000/• Twitter - https://twitter.com/MrBeastYT•  Instagram - https://www.instagram.com/mrbeast--------------------------------------------------------------------
KIK3azN4w34,Justin Bieber - Anyone,2021-01-01T05:00:08Z,UCHkj014U2CQ2Nv0UZeYpE_A,JustinBieberVEVO,10,21-01-09,Justin|Bieber|Anyone|RBMG/Def|Jam|Pop,33173377,1267703,47738,100004,https://i.ytimg.com/vi/KIK3azN4w34/default.jpg,FALSE,FALSE,"Anyone out now: https://JustinBieber.lnk.to/Anyone Listen to Holy, Lonely, and Monster here: https://JustinBieber.lnk.to/OutNow Follow Justin:http://facebook.com/justinbieberhttp://twitter.com/justinbieberhttp://instagram.com/justinbieber Sign up for Justin’s newsletter: http://justinbiebermusic.com Starring: Justin Bieber & Zoey Deutch Director - Colin TilleyProducers - Jamee Ranta & Whitney JacksonDirector of Photography - Elias Talbot Editor - Vinnie HobbsManagement - SB Projects #Anyone #JustinBieberhttp://vevo.ly/n4TUUB"
aE_zvyuAcuo,If Everything Was Like Among Us *Bloopers 2*,2021-01-01T22:15:10Z,UCn3AViOfcFN4zIICMC5hvPg,Shiloh & Bros,22,21-01-09,among us|among us in real life|among us imposter|in real life|irl|among us reality|if everything was like among us|imposter iq|900 iq|imposter among us|part 2|part 3|imposter|among us but in real life|real life|among us irl|among us parody|among us skit|funny among us|funny|funny among us moments|imposter in real life|siblings|comedy|shiloh|shiloh and bros|real|imposter among us funny|blooper|among us behind the scenes|outtake|gag reel,4218282,72481,2135,7631,https://i.ytimg.com/vi/aE_zvyuAcuo/default.jpg,FALSE,FALSE,"Among us in real life bloopers! These are bloopers and outtakes from our Imposter videos part 3, part 4, and part 5. I hope they make you laugh! https://shilohandbros.com/ ⬅ Get the Imposter shirts and hoodies here! If you like Piper Rockelle, The Norris Nuts, Dixie D'Amelio, or the Txunamy, you'll love our channel. We do funny pranks, challenges, and skits!Shiloh's Instagram: https://www.instagram.com/shilohanelson/   Elijah's Instagram: https://www.instagram.com/iamelijahnelson/Judah's Instagram: https://www.instagram.com/judahnelson/Micah's Instagram: https://www.instagram.com/heythisismicah/Britney's Instagram: https://www.instagram.com/britneyleighnelson/Daniel's Instagram: https://www.instagram.com/danielnelsonofficial/Subscribe here! http://bit.ly/ShilohToJudahChannelHit the bell to be notified when we post new videos! Puppy Love (Sting) by Twin Musicom is licensed under a Creative Commons Attribution 4.0 license. https://creativecommons.org/licenses/by/4.0/Artist: http://www.twinmusicom.org/#amongus #amongusinreallife #bloopers"
YmXwzRgOSMk,Gavin Magnus - A Whole 'Nother Level (Official Video **FIRST KISS ON CAMERA**),2021-01-02T16:46:06Z,UCY9xPODIpMH1FZDr708s_1g,GavinMagnusVEVO,10,21-01-09,gavin magnus|gavin|magnus|gavinmagnus|coco quinn|coco|quinn|crush|gavin and coco|gaven magnus|boyfriend girlfriend|official video|music video|official music video|music|new music|original|nayip ramos|gavin magnus music|gavin magnus song|gavin magnus original|piper|rockelle|piper rockelle|piper gavin|2020|teens|song|rap|love|offical video|kid laroi|juice wrld|sony music|rapper|first kiss|whole nother level,1675739,73833,3771,0,https://i.ytimg.com/vi/YmXwzRgOSMk/default.jpg,TRUE,FALSE,"Hey guys, I really hope you enjoy watching my new music video for “Whole ’Nother Level.” My girlfriend, Coco Quinn, and I had so much fun creating this amazing music video for you guys, and we hope you like it. Watch until the very end because there might be a special first kiss surprise! Have you guys seen my other music videos with my girlfriend Coco Quinn? Let me know in the premiere chat! Love you Goat Fam!#WholeNotherLevel #GavinMagnus #OfficialVideoDownload & Stream “Whole ’Nother Level”: jamjr.lnk.to/AWNL  Goat Fam Merch:https://gavinmagnusline.com/ Credits Director: Nayip Ramoshttps://www.instagram.com/nayipramos/Production Company:CentertainmentCast:Gavin Magnushttps://www.instagram.com/gavinmagnus/Coco Quinnhttps://www.instagram.com/cocoquinn3/Sicily Rosehttps://www.instagram.com/sicily.rose/Ryker Balounhttps://www.instagram.com/ryker_baloun_official/Zander Zachhttps://www.instagram.com/zanderzachofficial/Paesha Poehttps://www.tiktok.com/@paesha.poe?lang=enMusic Producer:Andrew Lanehttps://www.instagram.com/drewlanester/Follow Gavin Magnus:Instagram: https://www.instagram.com/gavinmagnus/Twitter: https://twitter.com/Gavinmagnus1 TikTok: https://www.tiktok.com/@gavinmagnushttp://vevo.ly/sRKnNg"
ZSIp00SewO8,Day 1 - Invite  |  BREATH - A 30 Day Yoga Journey,2021-01-02T06:00:03Z,UCFKE7WVJfvaHW5q283SxchA,Yoga With Adriene,26,21-01-09,breath|30 day yoga journey|30 days of yoga|yoga challenge|30 Day yoga challenge|30 day challenge|home yoga|home yoga practice|yoga at home|at home yoga|Adriene Mishler|austin yoga instructor|free yoga|free yoga videos|full yoga class|morning yoga|online yoga|yoga practice|Yoga with Adrienne|yoga at home day 1,2165820,61045,880,8812,https://i.ytimg.com/vi/ZSIp00SewO8/default.jpg,FALSE,FALSE,"Your first yoga practice is here, and it is a full one, packed with valuable invitations! We begin by taking things nice and slow. You will soon feel more fire, you may move fast, but this series asks you to be disciplined about bringing awareness to the deeper layers of your practice - with breath. What makes this 30 Day series unique is that these practices are designed to work together 1-30, not just as one-offs, though that is time well spent too. This series is a process with intention. Today’s practice is all about listening, respectfully setting the tone, building foundation with slow and with purposeful movement. Thank you for joining me on this journey and for sharing this connection with so many people around the world. **REMINDER** If you are not signed up for the daily email that corresponds with each practice video, sign up for free and receive your free BREATH calendar here: https://www.yogawithadriene.com/breathLet me know how it goes for you in the comment section down below! - - - - - - - - - - ❤️SUBSCRIBE to the YWA channel for free yoga videos every week and to support high-quality free yoga for all! ❤️https://www.youtube.com/user/yogawithadriene?sub_confirmation=1- - - - - - - - - - 🧘🏽‍♂️🧘‍♀️Become a FWFG YOGA member! 🧘🏻‍♂️🧘🏿‍♀️https://fwfg.comJoin Find What Feels Good and access over 700 videos including yoga and meditation for all levels. Explore daily practices, workshops, in depth learning, weekly or monthly accountability series, and an opportunity to connect with a one of a kind global community. This is your one stop shop for yoga, creativity, wellness, and all things FWFG. Try it FREE for 7 Days! - - - - - - - - - - 🗓Get your FREE Yoga Calendar: 🗓http://yogawithadriene.com/calendar/- - - - - - - - - - More at www.yogawithadriene.com▶︎ Instagram: @adrienelouise▶︎ Twitter: @yogawithadriene▶︎ Facebook: Yoga With Adriene▶︎ Shop: https://shop.fwfg.com- - - - - - - - - - Yoga With Adriene, LLC recommends that you consult your physician regarding the applicability of any recommendations and follow all safety instructions before beginning any exercise program. When participating in any exercise or exercise program, there is the possibility of physical injury. If you engage in this exercise or exercise program, you agree that you do so at your own risk, are voluntarily participating in these activities, assume all risk of injury to yourself."
B7Ivkss15NA,Devin Haney Surprised By Tayler Holder As He Talks Ryan Garcia KO Win Over Luke Campbell | Esnews,2021-01-03T00:29:11Z,UCI-Oq7oFGakzSzHFlTtsUsQ,ESNEWS,17,21-01-09,[none],620232,7788,296,1999,https://i.ytimg.com/vi/B7Ivkss15NA/default.jpg,FALSE,FALSE,#TaylerHolder  #devinhaney #ryangarcia
L0X03zR0rQk,Harry Styles - Treat People With Kindness (Official Video),2021-01-01T15:00:27Z,UCbOCbp5gXL8jigIBZLqMPrw,HarryStylesVEVO,10,21-01-09,HarryStyles|Golden|FineLine|HS1|HS2|WatermelonSugar|Harry|Adore You|LightsUp|Cherry|Falling|ToBeSoLonely|She|Styles|Sunflower|SunflowerVol|CanyonMoon|TreatPeoplewithKindness|Line|Fine|Hstyles|kiwi|Canyon Moon|To Be So Lonely|You’re so Golden|Maybe we can find a place to feel good|And we can treat people with kindness|Find a place to feel good|I’ve got a good feeling|I’m just taking it all in|Floating|and|the,15994828,1678618,12001,108628,https://i.ytimg.com/vi/L0X03zR0rQk/default.jpg,FALSE,FALSE,Listen to Harry Styles’ new album ‘Fine Line’ now: https://HStyles.lnk.to/FineLineAY  Follow Harry Styles: Facebook: https://HarryStyles.lnk.to/followFI Instagram: https://HarryStyles.lnk.to/followII Twitter: https://HarryStyles.lnk.to/followTI Website: https://HarryStyles.lnk.to/followWI Spotify: https://HarryStyles.lnk.to/followSI YouTube: https://HarryStyles.lnk.to/subscribeYD  Lyrics:Maybe we can find a place to feel good And we can treat people with kindness Find a place to feel good I’ve got a good feeling I’m just taking it all in Floating up and dreamingDropping into the deep end And if we’re here long enough They’ll sing a song for usAnd we’ll belong Maybe we can find a place to feel good And we can treat people with kindness Find a place to feel good Given second chancesI don’t need all the answers Feeling good in my skinI just keep on dancing And if we’re here long enough We’ll see it’s all for usAnd we’ll belong Maybe we can find a place to feel good And we can treat people with kindness Find a place to feel good And it’s just another dayAnd if our friends all pass away It’s okayIt’s okayIt’s okay Maybe we can find a place to feel good And we can treat people with kindness Find a place to feel good All we ever want is automatic all the time All we ever want is auto all of the time Maybe we can find a place to feel good And we can treat people with kindness Find a place to feel good Credits:Starring Harry Styles and Phoebe Waller-Bridge Directed by - Ben Turner & Gabe Turner Executive Producer - Carly Shackleton Commissioner – Bryan YounceHead of Live & Multicam - Lou Fox Line Producer - Bex Hampson Junior Production Manager - Aimee Nathan Production Secretary - Terri Jacobson 1st AD - James Amos DOP - Ben Magahy Art Director - Sally lock Choreographer - Paul Roberts Assistant Choreographer - Jared Hageman H & PWB Styling - Harry Lambert H & PWB Hair - Malcolm Edwards H Makeup - Carol Dotti PWB Make up - Lydia Barnes Dancer Costume Designer - Patrick Jack Editor - Claudia Wass Final Post - Joe Williams Finance - Carol Harris  Principle Dancers: Katie Collins Naomi Weijand Demi Mensah  Jo Dyce Danni Hampson Billy Sawyer Kane Horn Kieran Daley Ward James MulfordBen Hukin  #HarryStyles #TreatPeopleWithKindness #FineLine
OyX4YHuy-zI,Why I wasn't in MrBeast's Youtube Rewind 2020,2021-01-02T21:04:31Z,UCewMTclBJZPaNEfbf-qYMGA,JackSucksAtLife,24,21-01-09,jacksucksatlife|JackSucksAtLife YouTube|JackSucksAtLife YouTube channel|JackSucksAtLife Channel|YouTube JackSucksAtLife|YouTube channel|jack massey welsh|youtube play button|Youtube Rewind 2020|Thank God It's Over|youtube rewind 2020 thank god its over|mrbeast rewind|mrbeast youtube rewind|youtube rewind|youtube rewind 2019|youtube rewind 2018|reaction|dream|dream face reveal|jacksucksatlife youtube rewind|diamond play button|mr beast|don't subscribe|why,721607,47271,1682,3569,https://i.ytimg.com/vi/OyX4YHuy-zI/default.jpg,FALSE,FALSE,"Why I wasn't in MrBeast's Youtube Rewind 2020 🔔 Subscribe if you like these videos! Watch MrBeast's video yourself: https://www.youtube.com/watch?v=PKtnafFtfEo Get Don't Subscribe to 700k: https://www.youtube.com/channel/UC68DIXWCmetC8N5J_Kc5gjQ Last night MrBeast released Youtube Rewind 2020, Thank God It's Over where he created his own version of Youtube Rewind. JackSucksAtLife was not featured in the video despite him being very famous, handsome & the creator of turd boi420.Subscribe to these smaller creators:NalterDeeds: https://www.youtube.com/user/nalterdeedsAmelia and Bridie: https://www.youtube.com/channel/UCrSTjIIkIBHL7VDx7utP56wSoyan Osman: https://www.youtube.com/channel/UCuPGqvywieBAqvbkMSF4CNQ👍 more videos on my OTHER Youtube channels:https://youtube.com/jacksucksatstuffhttps://youtube.com/jackmasseywelshhttps://www.youtube.com/c/JacksEpicYoutubeChannelFullOfFunTimesAndFunHiRickXhttps://youtube.com/jacksucksatgeographySubscribe to this channel and MrBeast will give me $100,000:https://www.youtube.com/channel/UC68DIXWCmetC8N5J_Kc5gjQtwitter: https://twitter.com/jackmasseywelshinstagram: https://instagram.com/jackmasseywelshmerch https://jacksucksatlife.shopmy subreddit: https://reddit.com/r/jacksucksatlife/cameo: https://www.cameo.com/jacksucksatlifebusiness email: jack @ skycade . netmy gear (affiliate links):jacksucksatlife hoodie - https://bit.ly/3ajzQ5d (code JACK for 18% off anything on Zaful!)subscribe animations - https://creatorset.com/?ref=jackcamera - https://amzn.to/3q0FBMrmicrophone - https://amzn.to/2JccPaUlights - https://amzn.to/33hOc3xnanoleaf (cool background lights) - https://go.nanoleaf.me/jack15"
7Jbtl9JTOHQ,Trolling FatMemeGod with a MORPH MOD in minecraft,2021-01-01T22:13:43Z,UC-XTuGOHIF7vWvbhJZ56wbw,Socksfor2,20,21-01-09,Family Friendly|VR|Gaming|Dank|socksfor2|Socksfor1|minecraft|socksfor1 troll fatmemegod|socksfor1 mods|fatmemegod and socksfor1 funny|funny moments between socksfor1 and fatmemegod|trolling fatmemegod in minecraft,1516515,56983,1027,2200,https://i.ytimg.com/vi/7Jbtl9JTOHQ/default.jpg,FALSE,FALSE,"today we teach fatmemegod more about minecraft but at the same time, we troll him with the morph mod Previous Video →https://www.youtube.com/watch?v=p6XvP3HYzaM#Minecraft#ModFriends (sub to them) Fatmemegod- https://bit.ly/33oDf0GBlaza-https://bit.ly/3cWCMGj⛏️JOIN SERVER → socks.gg use code Socksfor1 in the item shop ad👽REDDIT → https://bit.ly/3ejZBmf🔴TWITCH → https://bit.ly/3iSmkcq📷INSTAGRAM → https://bit.ly/38KFjRA 🐦TWITTER → https://bit.ly/2Oi0YHC👕NEW MERCH → https://bit.ly/2AThH0O🎥2ND CHANNEL → https://bit.ly/38Kb6SQ 😀DISCORD → https://bit.ly/2ZXonUcMUSIC → https://bit.ly/3edT2Sc (Kevin MacLeod)→ https://bit.ly/3kdvbVY (Epidemic) OUTRO → https://bit.ly/2DoKefpMODPACK → https://bit.ly/2BQWQM9EDITOR → praduhEMAIL→ nicholas@socksfor1.comFamily Friendly PG Clean 13+"
mB9-UYgvFkY,her thoughts on the best bro video,2021-01-02T22:32:56Z,UCbT46RpTtZLLri1vhytF5tg,latestlucas,1,21-01-09,anything for my best bro|trihunna|latestlucas,1072429,27676,665,1289,https://i.ytimg.com/vi/mB9-UYgvFkY/default.jpg,FALSE,FALSE,"*CAPTIONS BELOW*She didn't know I was recording this but she liked that I did! so here are Tri's thoughts on the whole thing if any of you wanted to know! we're really happy you all enjoyed it and we really appreciate all the support! YouTube also saw it first, here's the video on TikTok: https://www.tiktok.com/@latestlucas/video/6913295476364283141?sender_device=pc&sender_web_id=6881095861121156614&is_from_webapp=v2tri: you know what? if i'm remembered for something...i'm glad. i'm - I am incredibly grateful that this is the thing I will be remembered for.*sucks on popsicle*I feel like it had to happen...me:it had to!!tri: and it had to be THAT video, and it had to be THAT onethe universe was literally like... you know what bro? if we're gonna spread it out into the world- if we're gonna spread you out into the world..it has to be a video of you telling your best friend that... you would suck his ✨peepee✨ it's going to be that and you're going to be- you're just gonna have to take it and you're gonna be grateful about itand YOU KNOW WHAT? I am. I'm so grateful.https://onlyfans.com/trihunnafollow us if you feel it!Tri's TikTok: https://www.tiktok.com/@trihunnaMy TikTok: https://www.tiktok.com/@latestlucasFollow us on the socials:my Insta: https://www.instagram.com/latestlucas/Tri's Insta: https://www.instagram.com/trianap24/Twitter: https://twitter.com/latestlucasDepop: https://www.depop.com/latestlucas/"
tXZ0Qq_Nbc0,Jennifer Lopez | New Year's Rockin' Eve Performance,2021-01-01T09:00:37Z,UCr8RjWUQ_9KYcIPmWiqBroQ,Jennifer Lopez,10,21-01-09,[none],4299606,55948,12158,11151,https://i.ytimg.com/vi/tXZ0Qq_Nbc0/default.jpg,FALSE,FALSE,Jennifer Lopez | New Year's Rockin' Eve PerformanceHappy New Year 2021 Everyone!!!! Thanks for ringing in the new year with me.Official Website: https://jenniferlopez.comFacebook: https://www.facebook.com/jenniferlopez/Instagram: https://www.instagram.com/jlo/TikTok: https://www.tiktok.com/@jloTwitter: https://twitter.com/jloText Me: +1 (305) 690-0379#JenniferLopez #JLo #NewYear
