video_id,title,publishedAt,channelId,channelTitle,categoryId,trending_date,tags,view_count,likes,dislikes,comment_count,thumbnail_link,comments_disabled,ratings_disabled,description
dBap_Lp-0oc,The Illusion Only Some Can See,2020-12-31T14:29:14Z,UCHnyfMqiRRG1u-2MsSQLbXA,Veritasium,27,21-01-09,veritasium|science|physics|Ames|ames illusion|illusion|optical illusion|ilusion|perspective|perception,2630118,142513,1908,10170,https://i.ytimg.com/vi/dBap_Lp-0oc/default.jpg,FALSE,FALSE,"Ames window illusion illustrates how we don't directly perceive external reality. Special Holiday deal! Go to https://NordVPN.com/veritasium and use code VERITASIUM to get 68% off a 2 year plan plus 4 additional months free. It’s risk free with Nord’s 30 day money-back guarantee!Special thanks to:Prof. Phil Kellman from UCLA Psychology https://kellmanlab.psych.ucla.eduMuseum of Illusions in Los Angeles for the use of their Ames Room https://laillusions.comCuriosity Show - Video on Ames Illusion: https://youtu.be/DkVOIJAaWO0References:Ames, A., Jr. (1951). Visual perception and the rotating trapezoidal window. Psychological Monographs: General and Applied, 65(7), i–32. https://doi.org/10.1037/h0093600Marcel de Heer & Thomas V. Papathomas (2017) The Ames Window Illusion and Its VariationsDOI:10.1093/acprof:oso/9780199794607.003.0014Oross, Stephen, Francis, Ellie, Mauk, Deborah & Fox, Robert. (1987). The Ames Window Illusion: Perception of Illusory Motion by Human Infants. Journal of Experimental Psychology: Human Perception & Performance, 13(4), 609-613.Behrens, R. (1987). The Life and Unusual Ideas of Adelbert Ames, Jr. Leonardo, 20(3), 273-279. doi:10.2307/1578173Burnham, C., & Ono, H. (1969). Variables Altering Perception of the Rotating Trapezoidal Illusion. The American Journal of Psychology, 82(1), 86-95. doi:10.2307/1420609Allport, G. W., & Pettigrew, T. F. (1957). Cultural influence on the perception of movement: The trapezoidal illusion among Zulus. The Journal of Abnormal and Social Psychology, 55(1), 104–113. https://doi.org/10.1037/h0049372Zenhausern R. Effect of Perspective on Two Trapezoid Illusions. Perceptual and Motor Skills. 1969;28(3):1003-1009. doi:10.2466/pms.1969.28.3.1003Gehringer, W. L., & Engel, E. (1986). Effect of ecological viewing conditions on the Ames' distorted room illusion. Journal of Experimental Psychology: Human Perception and Performance, 12(2), 181–185. https://doi.org/10.1037/0096-1523.12.2.181Long, G.M., Toppino, T.C. Adaptation effects and reversible figures: A comment on Horlitz and O’Leary. Perception & Psychophysics 56, 605–610 (1994). https://doi.org/10.3758/BF03206956Gregory RL. Looking through the Ames window. Perception. 2009;38(12):1739-40. doi: 10.1068/p3812ed. PMID: 20192124.Jahoda, G. (1966). Geometric illusions and environment: A study in Ghana. British Journal of Psychology, 57(1-2), 193–199. https://doi.org/10.1111/j.2044-8295.1966.tb01019.xV. Mary Stewart (1974) A Cross-Cultural Test of the “Carpentered World” Hypothesis Using The Ames Distorted Room Illusion, International Journal of Psychology, 9:2, 79-89, DOI: 10.1080/00207597408247094Margaret Kathleen Cappone (1966) The Effect of Verbal Suggestion on the Reversal Rate of the Ames Trapezoid Illusion, The Journal of Psychology, 62:2, 211-219, DOI: 10.1080/00223980.1966.10543786Researched and written by Petr Lebedev and Derek MullerFilmed by Derek Muller and Raquel NunoAnimations, VFX, and Music by Jonny HymanAmes Room VFX and additional Ames Window animation by Nicolas PrattAdditional Music from https://epidemicsound.com Life in Color SingularityLarge Ames window construction by GW ConstructionVideo supplied by Getty Images"
vGQQbulRUjY,"2020, in 7 minutes",2020-12-31T13:00:14Z,UCLXo7UDZvByw2ixzpQCufnA,Vox,25,21-01-09,2020|sizzle|year in review|year|annual|protests|covid|coronavirus|lockdown|quarantine|donald trump|events|compilation|elections|review|look back|news|Vox.com|vox|explain|explainer|2020 rewind|2020 look back|2020 vox|2020 recap|2020 review|2020 look back vox|2020 rewind vox|2020 in review|new year|2021|who died in 2020|what happened in 2020|2020 so far|best of 2020|news in 2020|new year countdown 2021|new year 2021,2522582,160394,7467,13031,https://i.ytimg.com/vi/vGQQbulRUjY/default.jpg,FALSE,FALSE,"Let’s close out 2020 by looking back at the moments that inspired us and changed us in a year unlike any other.Subscribe to our channel! http://goo.gl/0bsAjO2020 changed everything. From the deadly Covid-19 pandemic to protests against systemic racism and police brutality, from changing global leadership to the effects of climate change, Vox explained the moments that mattered — and the ones that brought us joy.  From voting to vaccines and from protests to pets, a look Vox broke down 2020’s biggest trends, explained in 20 charts: https://www.vox.com/recode/21727016/2020-in-charts-covid-vaccine-pandemic-electionExplore all of our 2020 reviews on Vox: https://www.vox.com/2020-year-in-reviewCheck out Emily VanDerWerff’s series on Vox.com called “Stories from a Lost Year,” featuring as-told-to accounts from everyday people living through 2020.  https://www.vox.com/culture/2020/12/17/22177093/lost-year-2020-stories Vox.com is a news website that helps you cut through the noise and understand what's really driving the events in the headlines. Check out http://www.vox.com.Watch our full video catalog: http://goo.gl/IZONyEFollow Vox on Facebook: http://goo.gl/U2g06oOr Twitter: http://goo.gl/XFrZ5H"
mviuNd0l680,Phish Dinner And A Rematch Madison Square Garden — 12/31/95,2021-01-01T06:50:44Z,UCDEPOd0RCvw8iSTqFpSBZLA,Phish,10,21-01-09,Phish|LivePhish|Trey Anastasio|Mike Gordon|Jon Fishman|Page McConnell|HD|4K HD|HD Video|Hi Definition Concert|hi def concert|live music|phish live|phish concert|rock guitar|guitar|rock and roll|jam|jam band|rock band,366713,2751,254,275,https://i.ytimg.com/vi/mviuNd0l680/default.jpg,FALSE,FALSE,"Listen on Apple Music: https://apple.co/3rViVhKExactly 25 years after the audience tied the band 1-1 in a chess rivalry, Phish challenges YOU to a rematch as part of a special New Year’s Eve “Dinner And A Movie”. We’ll be presenting Phish’s first New Year’s Eve show from Madison Square Garden — 12/31/95 — in its entirety, beginning at 8:30 pm ET.We’ve teamed up with the fine folks at https://Chess.com to host the Band vs. Audience online chess game which will start right at the top of the show and move at a decent clip. In short, fans will have 5 minutes to move their piece (the band will have no more than that as well). At the end of 5 minutes, whichever move has the most votes is the ‘audience’ move. Stick around during the set breaks as the band joins in from their various homes, playing a few moves and providing scintillating commentary on the game. We will post and send out the actual game link on 12/31.To pace yourself over a long evening, we present some chess cheese board recipes for extended grazing. Our friend Marissa Mullen put together two options — “Olive Cheese Dreams” and “Billy Bries” — with an easy ‘cheese by numbers’ guide. Feel free to swap out any of the ingredients if there’s something else you prefer. Pair with the bubbly of your choice. For dessert, chessboard cookies! Recipes can be found at https://livephi.sh/chessmenuFor this final webcast of the year, our beneficiary will be none other than The WaterWheel Foundation itself. Since 1997, the band and their fans have collaborated on a nationwide charitable endeavor by raising funds and donating the proceeds across the country. This year alone, collectively we have raised and donated nearly $750,000 to 27 different nonprofits during the Dinner And A Movie series. Join us in continuing to support those in need. Donate at https://www.phish.com/waterwheel"
2IQ4Kr-SnU0,"The Stunning Conclusion to an Amazing Tribute Show | AEW Brodie Lee Celebration of Life, 12/30/20",2020-12-31T03:58:51Z,UCFN4JkGP_bVhAdBsoV9xftA,All Elite Wrestling,24,21-01-09,All Elite Wrestling|AEW|The Young Bucks|Cody Rhodes|Brandi Rhodes|Nick Jackson|Matt Jackson|Chris Jericho|Pro Wrestling|Kenny Omega|Being the Elite|Jon Moxley|Luchasaurus|Jungle Boy|Jack Perry|MOX|AEW DYNAMITE HIGHLIGHTS|#AEWDYNAMITE|AEW ON TNT|AEWonTNT|Jurassic Express|Jake Hager|Inner Circle|Join Dark Order|Rusev|Miro|AEW Dynamite|#AEW|DON CALLIS|Video Games|Music Video|Among Us|Sting|AEW Sting|WCW Sting|the icon sting|man called sting,3077178,91665,1819,6730,https://i.ytimg.com/vi/2IQ4Kr-SnU0/default.jpg,FALSE,FALSE,#AEW #AllEliteWrestlingAEW Dynamite airs every Wednesday night 8e/7c on TNTAEW Dark airs every Tuesday night 7e/6c here on YouTubeHow to watch Dynamite➡️  Fite TV - https://www.fite.tv/channel/aew➡️  BR Live - https://www.AEWonBRLive.com➡️  TNT - https://www.tntdrama.com/allelitewrestlingFollow #AllEliteWrestling on all social media platforms➡️  https://www.Twitter.com/aew➡️  https://www.instagram.com/allelitewrestling➡️ https://www.youtube.com/AEWGames➡️  Tik Tok - AllEliteWrestling➡️  Snapchat - AllEliteWrestling➡️  https://www.Twitter.com/AEWonTNT➡️  https://www.Facebook.com/allelitewrestling➡️  https://www.instagram.com/AEWonTNT
OK_ChvMo1BQ,Hello 2021 Americas | YouTube NYE Celebration,2021-01-01T03:29:11Z,UCqVDpXKLmKeBU_yyt_QkItQ,YouTube Originals,24,21-01-09,Hello 2021 Americas|Hello 2021|Hello 2021 YouTube|Hello 2021 NYE|Hello 2021 meme|Hello 2021 New Years Eve|NYE livestream|New Years countdown 2021|new years 2021|New Years Eve|goodbye 2020|Dua Lipa|Emma Chamberlain|Dude Perfect|YG|Demi Lovato|Juanpa Zurita|NYE|YouTube NYE|YouTube New Years|YouTube New Year's Eve|Hello 2021 YouTube Originals|justin bieber|hello 2021 song|nye 2021|j balvin|dolan twins|mrbeast|bts nye performance|jimmy fallon,758150,24977,3057,3649,https://i.ytimg.com/vi/OK_ChvMo1BQ/default.jpg,FALSE,FALSE,"Celebrate the most anticipated New Year in modern history with YouTube’s Hello 2021; a virtual celebration featuring J Balvin, Dua Lipa, YG, Karol G, Emma Chamberlain, Dude Perfect, Demi Lovato, hosts Juanpa Zurita and Storm Reid, and more. Watch now! Chaptering:0:00 Intro2:31 Looking Back4:35 D’Amelio Family7:19 2020 Time Capsule9:30 Dua Lipa13:13 Looking Back II16:08 Demi Lovato18:26 Jay Shetty21:43 Karamo23:00 Rudy Mancuso25:31 Hannah Stocking26:42 Onyx Family28:38 Sabrina Carpenter29:09 Chelsea Peretti30:43 Matthew McConaughey31:57 Ne-Yo32:18 Brad Mondo35:55 YG38:58 Looking Back III43:38 Marques Brownlee & Tech46:35 Bubba Wallace & Ryan Blaney48:55 Kane Brown53:11 Tom Schwartz & Tom Sandoval54:00 Dude Perfect55:25 Shangela56:03 Karol G01:02:54 Moriah Elizabeth01:06:00 NYE Messages01:06:48 Emma Chamberlain01:08:56 Finneas01:09:22 Rupaul1:12:58 Larray1:15:28 Jimmy Fallon1:15:49 Bretman Rock1:17:47 Time Capsule1:18:55 NYE Messages1:19:50 David Blaine1:20:26 J Balvin1:24:51 NY Resolutions1:27:47 Countdown To Midnight!1:29:30 Dua LipaSome performances have a strobing effect that may affect photosensitive viewers.All applicable COVID-19 protocols  were implemented during the recording of this show.#YouTubeNYE #Hello2021"
9XQ6EZrQYng,Bud Light Seltzer Sessions Presents: New Years Eve 2021,2021-01-01T07:09:24Z,UC1O6nGbccGhl2akEVaSpKsA,Bud Light,10,21-01-09,[none],739014,8269,482,872,https://i.ytimg.com/vi/9XQ6EZrQYng/default.jpg,FALSE,FALSE,"Bud Light Seltzer Sessions presents New Year's Eve 2021.  Performances by @PostMalone, @SteveAoki, @Saweetie, @SebastianYatra, @JackHarlow, hosted by @LillySingh + @MattSteffanina with @MGMResorts. Set your reminder here to tune in, or go to https://budlight.com/NYE for a more interactive viewing experience. The show starts on 12.31.20 - at 10:30 pm ET."
p19cjKg8dIc,goodbye california. a new chapter.,2020-12-30T16:58:08Z,UCcgVECVN4OKV6DH1jLkqmcA,Jake Paul,22,21-01-09,jake paul,5153429,121052,63821,26056,https://i.ytimg.com/vi/p19cjKg8dIc/default.jpg,FALSE,FALSE,"new chapter...text me im bored - 310-870-3349🔴SUBSCRIBE ➤ http://bit.ly/SUB2JAKEPAUL INSTAGRAM ➤  https://www.instagram.com/JakePaul TWITTER ➤  http://twitter.com/JakePaul ⚠ WARNING ⚠Please be warned (and we cannot possibly stress this enough); under no circumstances should any challenges, stunts, or pranks be attempted by any of our viewers. All challenges, stunts, and pranks are performed by trained professionals in a controlled environment and are for entertainment purposes only. Again, do not try anything you see in this content at home and always consult a parent or adult with any questions or concerns."
sMw8_fHER4k,HOW TO COMPLETE ALL QUESTS OF THE NEW YEARS EVENT 2021! I Roblox: Royale high,2020-12-31T03:53:06Z,UC6cVP0fX3mMYRUp-ZXKoLhA,JadeRK,20,21-01-09,[none],1686785,45794,1653,11166,https://i.ytimg.com/vi/sMw8_fHER4k/default.jpg,FALSE,FALSE,"NEW YEARS EVENT 2021 UPDATE! How to complete ALL NEW YEARS 2021 QUESTS! NEW MIDNIGHT'S STRIKE POPSTAR SET made by Vioncii! Share this video with friends or family who are struggling completing all quests! ^^🌙FOLLOW ME:✨Discord: https://discord.gg/TXVezbmTwitter: https://twitter.com/JadeRK_Twitch: https://www.twitch.tv/jaderk_Roblox: https://www.roblox.com/users/142158969/profileTikTok: jaderk_Private Server: https://www.roblox.com/games/735030788/Royale-High?privateServerLinkCode=RajgDv9FfDvznH07n-4dNkY6PJTuObpWPlease be respectful in the comments, no hate, no insults, no abuse. Treat each other like were family! Be aware that abusive or spam comments could be automatically retained! ^^#royalehigh #rhteaspill #roblox"
ptndYf5whSU,EXCLUSIVE! WOW! RYAN GARCIA IMMEDIATELY AFTER STOPPING LUKE CAMPBELL,2021-01-03T01:00:51Z,UCjb7rhCq6GmiW42NRjEgA9g,Fino Boxing,17,21-01-09,Ryan García|Luke Campbell|Fino Boxing|Eddie Hearn|Matchroom Boxing|Sky Sports|IFL TV|seconds out|boxing social|behind the gloves|FIGHTHYPE|Frank Warren|Anthony Joshua|Tyson Fury|Ricky Hatton|Billy Joe Saunders|Chris Eubanks|Frank Smith|DAZN|UK Boxing|The Boxing Source|George Groves|Carl FRONCH|TY Boxing|Adriana Jimenez|TV BOXEO|HAY TIRO|ESPN DEPORTES|ESPN KNOCKOUT|CANAL SPACE,210414,2579,95,451,https://i.ytimg.com/vi/ptndYf5whSU/default.jpg,FALSE,FALSE,
wW-KBzKWvrU,Concerning the Wendigo doll: An Apology,2020-12-31T09:16:45Z,UCitKV0ebZVbtU2nIPihDGMQ,Dollightful,24,21-01-09,[none],2903937,0,0,0,https://i.ytimg.com/vi/wW-KBzKWvrU/default.jpg,TRUE,TRUE,"References:Barnouw, Victor. 1977. Wisconsin Chippewa myths and tales and their relation to Chippewa life. Madison, WI: University of Wisconsin Press.DeSanti, Brady. 2015. The Cannibal Talking Head: The Portrayal of the Windigo “Monster” in Popular Culture and Ojibwe Traditions. The Journal of Religion and Popular Culture. Volume 27, Issue 3 pp.186-201.Rheault, D'arcy. 1999. Anishinaabe Mino-Bimaadiziwin - The Way of a Good Life: An Examination of Anishinaabe Philosophy, Ethics and Traditional Knowledge. Createspace Independent Pub.----------------------------------------------------------------Comments are disabled because I don't want people who may be inclined to defend the doll entering into arguments with others who may have strong opinions about the topic and other tangential topics. This was my decision, and I feel it was the right thing to do. Please be respectful to each other!Please do not re-upload the video. Please respect this decision. I'm trying to do the right thing."
YIs8t3ro9Fw,2021 NEW YEAR’S EVE COUNTDOWN DRONE LIGHT SHOW in YEONGDONG-DAERO (SEOUL),2020-12-31T15:15:01Z,UC5f97D60yHa7UE9rFfbej8g,HyundaiWorldwide,2,21-01-09,Hyundai|HyundaiWorldwide|Car|Hyundai company,3653995,22065,746,1618,https://i.ytimg.com/vi/YIs8t3ro9Fw/default.jpg,FALSE,FALSE,"We had to put aside everything we dreamed of in 2020.This pause in our lives was only a short break to leap even higher. And now we take the next step for a tomorrow full of new dreams, greeting the new year, 2021.Happy New Year for all.#newyeareve #newyear #drone #droneshow#happynewyear #countdown #2021"
9X6hH-Z1Tyw,David Guetta | United at Home - Paris Edition from the Louvre,2021-01-01T00:27:24Z,UC1l7wYrva1qCH-wgqcHaaRg,David Guetta,10,21-01-09,david guetta|Paris|new years eve|david guetta live|david guetta live set|new years eve party music|david guetta live paris|david guetta titanium|paris by night|louvre museum,3174514,110537,1971,4515,https://i.ytimg.com/vi/9X6hH-Z1Tyw/default.jpg,FALSE,FALSE,"DONATE NOWon https://davidguetta.com/donateIn partnership with @PlayStation France & @Xiaomi France After raising $1.5 million (USD) for charities and amassing over 50 million views in Miami and New York, “United At Home” continues from the iconic city of Paris with a phenomenal production in front of the Louvre museum’ glass pyramid. In an effort to unite people around the globe, David Guetta is inviting everyone to join him in celebrating NYE and spreading the holidays spirit to benefit UNICEF, Les Restos du Coeur and the Musée du Louvre.0:00 Countdown0:14 Intro0:56 David Guetta & MORTEN - Dreams (feat Lanie Gardner) (extended)5:20 David Guetta feat Sia - Titanium (Future Rave Remix)9:13 Jack back - Permanence13:18 David Guetta & MORTEN - Save My Life VS Fatboy Slim - Sunset (Bird Of Prey) [David Guetta Mashup]15:50 David Guetta - Play Hard (feat Ne-Yo & Akon) (Future Rave Remix)18:54 David Guetta & MORTEN - VS Everything But The Girl - Missing Nothing (David Guetta & DJs From Mars Bootleg)20:40 David Guetta feat Chris Willis - Love Is Gone (2020 David Guetta Remix)24:05 Oxia - Domino (2021 David Guetta Remix)26:35 David Guetta & Kid Cudi - Memories (2021 Remix)29:35 David Guetta & Sam Martin - Lovers On The Sun (David Guetta 2020 Remix)32:20 David Guetta & MORTEN - Make It To Heaven (with Raye)35:54 David Guetta - When love takes over (feat Kelly Rowland) (Future Rave Remix)38:25 David Guetta & MORTEN - Alive VS Daft Punk feat Pharrell Williams & Nile Rodgers (Accapella) - Get Lucky (David Guetta & DJs From Mars Bootleg)40:10 David Guetta & MORTEN - Kill Me Slow43:47 David Guetta feat Chris Willis - Love Don’t Let Me Go (Future Rave Remix)45:33 Camelphat & Yanis & Foals - Hypercolour (Arbat Remix) [David Guetta Rework]49:15 Energy 52 - Cafe Del Mar (Tale Of Us Renaissance Remix) [David Guetta Rework]51:53 David Guetta feat AKON - Sexy Bitch (David Guetta Techy Remix)54:55 Florence + The Machine - Spectrum (Say My Name) (David Guetta Remix)58:26 Black Coffee & David Guetta - Drive (feat Delilah Montagu) (David Guetta & Morten Future Rave Remix)1:02:18 David Guetta feat Sia - Let’s Love (Future Rave Remix) 1:05:05 David Guetta - Without You (feat Usher)Follow David Guetta:https://www.davidguetta.comhttps://facebook.com/DavidGuettahttps://www.twitter.com/DavidGuettahttps://www.instagram.com/davidguettaFollow the Louvre:https://www.instagram.com/museelouvre/https://twitter.com/MuseeLouvrehttps://www.facebook.com/museedulouvre/https://www.youtube.com/channel/UCafm6w_rPndqAtokQy04Jdwhttps://www.linkedin.com/company/musee-du-louvre/"
hG2f2zerHhM,Rushing My Fiance To The Hospital *Broke Both Legs*,2020-12-30T22:45:00Z,UCnM1ay_QoQOpa1N2iejLA7A,Jatie Vlogs,1,21-01-09,rushing my fiance to the hospital|Rushing My Fiance To The Hospital *Broke Both Legs*|hopsital|hospital vlog|broken leg|broken|dirt bike accident|dirt bike gone wrong|gone wrong|injury|jatie|jatie vlogs|jatie vlogs pranks|josh and katie|josh brueckner|katie betzing,1663359,84551,1160,14025,https://i.ytimg.com/vi/hG2f2zerHhM/default.jpg,FALSE,FALSE,"Had to rush Josh to the hospital. He was in a bad dirt bike crash and broke both of his legs. Thanks for all your prayers, love yall!J80Fit: https://jatiecorp.com/collections/j80...Exclusive Jatie Website: http://Patreon.com/jatievlogsPROPOSAL VID: https://youtu.be/U7VEN2EZkI8NEW MERCH: http://fanjoy.co/jatieMakeup giveaway! Follow @jatiebeauty for a chance to win! SUBSCRIBE & FOLLOW ON THE IG FOR A CHANCE TO WIN SOME AIRPODS!@joshbrueckner@katiebetzing @jatiebeauty Tiktok: @joshxkatie-PRANK WARS-You can look but you CANT touch prank: https://youtu.be/WtVe0typDVIBeing PDA in front of our friends: https://youtu.be/-MP2E1IiHXgBeing mean to my fiancé: https://youtu.be/Yi6T9UCslx0•Follow Us On Social Media•Instagram: @katiebetzing @JoshbruecknerFitness Instagram @J80FitTwitter: @ktbetzing @Joshbrueckner Snapchat: @k80betz @JoshbruecknerHow we met: https://youtu.be/Ed6MYkS1-eoKatie’s Main Channel: https://www.youtube.com/user/Beautygu...Business inquiries: j80vlogs@gmail.com"
fn3KWM1kuAw,Do You Love Me?,2020-12-29T18:51:48Z,UC7vVhkEfw4nOGp8TyDk7RcQ,Boston Dynamics,28,21-01-09,Boston Dynamics|Robots|Dynamic Balance|Dancing Robots|Legged Locomotion,25000738,932138,22008,142229,https://i.ytimg.com/vi/fn3KWM1kuAw/default.jpg,FALSE,FALSE,Our whole crew got together to celebrate the start of what we hope will be a happier year:  Happy New Year from all of us at Boston Dynamics.  www.BostonDynamics.com.
o1_Gu5tUu20,Our Generation As Parents Are Bouta Be Like,2020-12-30T22:00:16Z,UCR9NuNwCUIhMOLUQnLN7_WA,Kyle Exum,23,21-01-09,Our Generation As Parents Are Bouta Be Like|Gen Z As Parents|When Our Generation Gets Old|When Our Generation Gets Old and Hears a Throwback Song|The Kahoot Rap|The Teacher Rap|Parents Be Like|Kahoot Star|Bassthoven|Our Generation Old|Our Generation Gets Old Series|Kyle Exum Parents Parody|Kyle Exum|Parents Rap|Dad's Plan|Dads Be Like|Our Generation as Teachers Are Bouta Be Like|Teachers Be Like|Dante Williams|Dtay|Dtay Known|kyle exum songs|Mama Mode,1344365,153056,1567,14537,https://i.ytimg.com/vi/o1_Gu5tUu20/default.jpg,FALSE,FALSE,"400,000 Likes and I’ll Drop my Next Video Early!Thanks for Watching! Like, Subscribe and Comment! 500,000 Likes and I’ll respond to every comment up until the 500K mark2090 Merch Available Now!: https://montlaurel.com/collections/kyle-exum/products/mont-laurel-x-kyle-exum-collab-t-shirtText Me! +1 (860) 385-6295The Kahoot Rap (Kahoot Star) Is Now Available on All Streaming Networks! Stream it Up!: https://fanlink.to/TheKahootRapSpotify: https://open.spotify.com/album/2NxDAN...Apple Music: https://music.apple.com/us/album/the-...YouTube Music: https://music.youtube.com/watch?v=1MW...iTunes: https://music.apple.com/us/album/the-...SoundCloud: https://soundcloud.com/kyleexum/the-k...Tidal: https://tidal.com/album/163981723Deezer: https://deezer.page.link/zQ67HGiFjMPv...Follow My Social Media:Instagram: http://www.Instagram.com/KyleExumTikTok: Kyle Exum Twitter: http://www.Twitter.com/KyleExumFacebook: http://www.Facebook.com/KyleExumOfficial Apple Music:  https://music.apple.com/us/artist/kyl...Spotify:  https://open.spotify.com/artist/6EYpu...Stream my “Trap 3 Little Pigs” Song: https://fanlink.to/Trap3LittlePigsApple Music:  https://music.apple.com/us/album/trap...Spotify: https://open.spotify.com/track/3WoHA0...SoundCloud: http://www.soundcloud.com/kyleexumYou can Buy my Trap 3 Little Pigs Book Here: Trap 3 Little Pigs (Lyrically Accurate Version): https://amzn.to/30qvtzdTrap 3 Little Pigs (Young Readers Version): https://amzn.to/2LGEG2aStream my “The Exum Household” Album: https://fanlink.to/TheExumHouseholdBusiness Email: kyleexum@select.coMerchandise: https://exumerch.com/———————————————————————————For anyone looking to start your own YouTube channel, here’s the equipment I use to make my videos:Camera: https://amzn.to/2szlclaLighting Set-Up: https://amzn.to/2W5KgxSTripod: https://amzn.to/2RXftnnComputer: https://amzn.to/2RWuDJSMicrophone (For Parodies & Raps): https://amzn.to/2T5xDkjCamera Microphone: https://amzn.to/2S59u0d"
nlGllxnSfgA,"AMONG US W/ CORPSE, JAMES, ADDISON, BRETMAN, KARL, GEORGE, POKI, AND MORE :)",2020-12-30T04:37:38Z,UCt_DaLB_NDqPVxezyvcfRtg,LARRAY,22,21-01-09,LARRAY,3902242,139002,3274,7463,https://i.ytimg.com/vi/nlGllxnSfgA/default.jpg,FALSE,FALSE,
A8_7Hlbshg0,Chloe x Halle Perform “Don’t Make It Harder On Me” Live on the Honda Stage,2020-12-30T17:08:27Z,UCsVcseUYbYjldc-XgcsiEbg,Billboard,10,21-01-09,"YOUTUBE KEYWORDS:	Honda Stage|Honda|American Honda|Billboard|Billboard video|Chloe x Halle|Chloe x Halle songs|Chloe x Halle Honda Backstage|Chloe x Halle Interview|Chloe x Halle Documentary|Chloe x Halle New Album|Chloe x Halle Performance|Chloe x Halle Music|Chloe x Halle New Music|Chloe x Halle Video|Chloe x Halle The Kids Are Alright|Chloe x Halle Ungodly Hour|Chloe x Halle Don’t Make It Harder On Me|Chloe x Halle Do It|R&B Music|Pop Music",1905637,47553,2247,3372,https://i.ytimg.com/vi/A8_7Hlbshg0/default.jpg,FALSE,FALSE,"Chloe x Halle Perform “Don’t Make It Harder On Me” Live on the Honda Stage Follow Chloe x Halle: https://www.instagram.com/chloexhalle/?hl=enhttps://www.facebook.com/chloexhalle/https://twitter.com/chloexhallehttps://open.spotify.com/artist/0AsThoR4KZSVktALiNcQwW?si=DfZwALVnSNKMl0Zem0X95ABuilding on its deep foundation of bringing music to fans, American Honda brings you Honda Stage - a platform that celebrates determined, breakout artists and features their exclusive performances. And for a unique behind-the-scenes experience, Honda introduces Honda Backstage, where fans can dive deeper into what inspires and drives these artists who have pushed further and reached higher, no matter the obstacles.Through Honda Stage, Honda Backstage, live events like Honda Civic Tour and Honda Stage festivals, as well as exclusive online content from partners (Billboard, UPROXX, UMG, Vevo, and iHeartMedia), Honda offers music fans access to the moments they love while celebrating the creativity and drive it takes to make it big.Subscribe to discover new music from #HondaStage: http://honda.us/YTSubscribeFind us on Facebook: http://honda.us/HSFacebookFollow us on Twitter: http://honda.us/HSTwitterFollow us on Instagram: http://honda.us/HSInstagramVisit our website: http://honda.us/HondaStage"
