video_id,title,channelId,channelTitle,categoryId,duration,thumbnail_link,tags,description,channel_desc,channel_keywords,related_vid_id
fmyZAkiyxk4,"Panel: Pelosi SNAPS BACK At AOC Over Leadership Age Criticism","UCPWXiRWZ29zrxPFIQT7eHSA","The Hill","25","493.0","https://i.ytimg.com/vi/fmyZAkiyxk4/default.jpg","Rising|Krystal Ball|Saagar Enjeti|Progressive|Progressive Politics|Democrats|Democratic Party|Republicans|GOP|Republican Party|Pelosi|House|House Speaker|Congress|AOC|60 Minutes","Team Rising discusses a 60 Minutes interview of House Speaker, Nancy Pelosi, in which she discusses younger members of Congress, specifically Rep. Alexandria Ocasio-Cortez.About Rising: Rising is a weekday morning show with bipartisan hosts that breaks the mold of morning TV by taking viewers inside the halls of Washington power like never before. The show leans into the day's political cycle with cutting edge analysis from DC insiders who can predict what is going to happen. It also sets the day's political agenda by breaking exclusive news with a team of scoop-driven reporters and demanding answers during interviews with the country's most important political newsmakers. Follow Rising on social media:Website: Hill.TVFacebook: facebook.com/HillTVLive/Instagram: @HillTVLiveTwitter: @HillTVLiveFollow Saagar Enjeti & Krystal Ball on social media:Twitter: @esaagar and @krystalballInstagram: @esaagar and @krystalmball","The Hill is the premier source for policy and political news. Follow for tweets on what's happening in Washington, breaking news and retweets of our reporters.","The Hill Capitol Hill Lobbying Politics Campaign Political Congress Trump Clinton Obama Congressional House Senate Legislation Roll Call Lobbyists Presidential Election K Street Pelosi Rising Krystal Ball Saagar Enjeti Bernie Sanders Rising Joe Biden","Cl-Cb2psM-M"
UWBX9OR572E,"Speaker Nancy Pelosi: How We Go Forward Has To Have Transparency And Accountability","UCMtFAi84ehTSYSE9XoHefig","The Late Show with Stephen Colbert","24","746.0","https://i.ytimg.com/vi/UWBX9OR572E/default.jpg","The Late Show|Late Show|Stephen Colbert|Steven Colbert|Colbert|celebrity|celeb|celebrities|late night|talk show|comedian|comedy|CBS|joke|jokes|funny|funny video|funny videos|humor|hollywood|famous","Stephen checks in with Speaker Nancy Pelosi in Washington who says that Congress is on a war-like footing in its fight to protect Americans against the damage caused by coronavirus. #Colbert #StephenAtHome #SpeakerPelosiSubscribe To The Late Show Channel HERE: http://bit.ly/ColbertYouTubeFor more content from The Late Show with Stephen Colbert, click HERE: http://bit.ly/1AKISnRWatch full episodes of The Late Show HERE: http://bit.ly/1Puei40Like The Late Show on Facebook HERE: http://on.fb.me/1df139YFollow The Late Show on Twitter HERE: http://bit.ly/1dMzZzGFollow The Late Show on Google+ HERE: http://bit.ly/1JlGgzwFollow The Late Show on Instagram HERE: http://bit.ly/29wfREjFollow The Late Show on Tumblr HERE: http://bit.ly/29DVvtRWatch The Late Show with Stephen Colbert weeknights at 11:35 PM ET/10:35 PM CT. Only on CBS.Get the CBS app for iPhone & iPad! Click HERE: http://bit.ly/12rLxgeGet new episodes of shows you love across devices the next day, stream live TV, and watch full seasons of CBS fan favorites anytime, anywhere with CBS All Access. Try it free! http://bit.ly/1OQA29B---The Late Show with Stephen Colbert is the premier late night talk show on CBS, airing at 11:35pm EST, streaming online via CBS All Access, and delivered to the International Space Station on a USB drive taped to a weather balloon. Every night, viewers can expect: Comedy, humor, funny moments, witty interviews, celebrities, famous people, movie stars, bits, humorous celebrities doing bits, funny celebs, big group photos of every star from Hollywood, even the reclusive ones, plus also jokes.","Welcome to the official YouTube channel for The Late Show with Stephen Colbert! Weeknights at 11:35pm/10:35c","colbert late show comedy","Cl-Cb2psM-M"
mq-9G4bUqnk,"Pelosi reacts to Trump's name appearing on stimulus checks","UCupvZG-5ko_eiXAupbDfxWw","CNN","25","624.0","https://i.ytimg.com/vi/mq-9G4bUqnk/default.jpg","latest News|Happening Now|CNN","House Speaker Nancy Pelosi called the appearance of President Donald Trump's name on stimulus checks amid the coronavirus pandemic shameful.","CNN operates as a division of Turner Broadcasting System, which is a subsidiary of Warner Media. CNN identifies itself as -- and is widely known to be - the most trusted source for news and information. The CNN umbrella includes nine cable and satellite television networks, two radio networks, the CNN Digital Network, which is the top network of news Web sites in the United States, and CNN Newsource, the world's most extensively syndicated news service. CNN is proud of our ability to bring you up-to-the-minute news from around the world, as a result of our many extensions.","CNN CNN News news breaking news","Cl-Cb2psM-M"
7JOqTsefIJM,"Pelosi says Congress may move to impeach Trump following Capitol riots if 25th Amendment not invoked","UCinjnmQEwCddOudyCC1v7qA","KTLA 5","25","1386.0","https://i.ytimg.com/vi/7JOqTsefIJM/default.jpg","[none]","House Speaker Nancy Pelosi has joined the Senate’s top Democrat and others in urging for the removal of President Trump from office after Wednesday’s riot at the U.S. Capitol.At a news conference Thursday, she urged Vice President Mike Pence and the Cabinet to invoke the 25th Amendment and oust him from office. But if they don’t do that, she added, Congress could step in.Story: https://ktla.com/news/politics/pelosi-to-hold-news-conference-amid-growing-calls-for-trump-to-be-removed-from-office/","KTLA, channel 5 in Los Angeles, covers breaking news, weather and traffic for L.A., Orange, Riverside, San Bernardino and Ventura counties.","KTLA5 KTLA Los Angeles Los Angeles News Los Angeles Breaking News LA News Los Angeles Entertainment News CW LA CW Los Angeles CW LA Station LA TV News Tribune Broadcasting","Cl-Cb2psM-M"
Wd0aKN0moDE,"House to vote on resolution urging Pence to invoke 25th Amendment","UCAeWdyKJXGWmVAXFpgLNNTg","CBS Evening News","25","264.0","https://i.ytimg.com/vi/Wd0aKN0moDE/default.jpg","FBI|voting|mike pence|25th amendment|Donald Trump|congress|impeachment|pro-trump|trumpist|supporters|violence|protests|crowd|mob|crime|u.s.|politics|capitol|inauguration","House lawmakers are voting on a resolution that asks Vice President Pence to invoke the 25th Amendment against President Trump in wake of the deadly U.S. Capitol attack. Nancy Cordes reports.Subscribe to the CBS Evening News Channel HERE: http://bit.ly/1S7DhikWatch Full Episodes of the CBS Evening News HERE: http://cbsn.ws/23XekKAWatch the latest installment of On the Road, only on the CBS Evening News, HERE: http://cbsn.ws/23XwqMHFollow CBS Evening News on Instagram: http://bit.ly/1T8icTOLike CBS Evening News on Facebook HERE: http://on.fb.me/1KxYobbFollow the CBS Evening News on Twitter HERE: http://bit.ly/1O3dTTeFollow the CBS Evening News on Google+ HERE: http://bit.ly/1Qs0aamGet your news on the go! Download CBS News mobile apps HERE: http://cbsn.ws/1Xb1WC8Get new episodes of shows you love across devices the next day, stream local news live, and watch full seasons of CBS fan favorites anytime, anywhere with CBS All Access. Try it free! http://bit.ly/1OQA29B---The CBS Evening News premiered as a half-hour broadcast on Sept. 2, 1963. Check local listings for CBS Evening News broadcast times.","Welcome to the official YouTube channel for CBS Evening News.The CBS Evening News airs every weekday night at 6:30 PM ET. First broadcast in 1948, it's the longest running evening newscast.","","Cl-Cb2psM-M"
hhzAqdD3TpA,"Democrats call on Pence to invoke 25th Amendment to remove Trump","UC8p1vwvWtl6T73JiExfWs1g","CBS News","25","457.0","https://i.ytimg.com/vi/hhzAqdD3TpA/default.jpg","Kim Wehle|law professor|President Donald Trump|trump impeachment|nancy pelosi|Mike Pence|assault on capitol|25th Amendment","Democrats plan to bring a resolution to the House floor calling on Vice President Mike Pence to invoke the 25th Amendment, which allows for the president to be removed from power with support from a majority of his Cabinet. If Pence doesn't act, the Democratic-led House will move to impeach Mr. Trump for an unprecedented second time. Kim Whele, a law professor at the University of Baltimore and author of How to Read the Constitution - and Why, joins CBSN AM with more.","CBS News is a trusted source for the latest in politics, U.S. and world news. The network is home to award-winning broadcasts CBS This Morning, CBS Evening News with Norah O’Donnell, 60 Minutes, CBS Sunday Morning, 48 Hours and Face the Nation.CBSN is CBS News’ 24/7 digital streaming news service featuring live, anchored coverage available for free across all platforms. Launched in November 2014, the service is a premier destination for breaking news and original storytelling from the deep bench of CBS News correspondents and reporters. CBSN features live coverage of the top stories of the day and deep dives into key issues facing the nation and the world. CBSN is currently available on CBSNews.com and the CBS News app across more than 20 platforms, as well as the CBS All Access subscription service.Subscribe to our YouTube channel for breaking news, live events and in-depth reporting from CBS News and CBSN.","cbs news live news cbsn politics breaking news 2020 election CBSN","Cl-Cb2psM-M"
YF-E4ZpLsSE,"A look at Trump's last day in office and impeachment, Biden inauguration and Senate appointments","UCEAZeUIeJs0IjQiqTCdVSIg","Yahoo Finance","25","279.0","https://i.ytimg.com/vi/YF-E4ZpLsSE/default.jpg","Yahoo Finance|Personal Finance|Money|Investing|Business|Savings|Investment|Stocks|Bonds|FX|Currencies|NYSE|Equities|News|Politics|Market|Markets|Yahoo FInance Premium|Stock market","#PresidentTrump #Trump #BidenYahoo Finance's Jessica Smith breaks down the busy week in Washington D.C and what to expect as Trump serves his last day as President of the United States amid a looming impeachment trial, the city prepares for Joe Biden's inauguration and Senate appointment trials take place.For 2020 election results please visit:Election results: https://www.yahoo.com/electionsSubscribe to Yahoo Finance: https://yhoo.it/2fGu5BbAbout Yahoo Finance: At Yahoo Finance, you get free stock quotes, up-to-date news, portfolio management resources, international market data, social interaction and mortgage rates that help you manage your financial life.About Yahoo Finance Premium: With a subscription to Yahoo Finance Premium, get the tools you need to invest with confidence. Discover new opportunities with expert research and investment ideas backed by technical and fundamental analysis. Optimize your trades with advanced portfolio insights, fundamental analysis, enhanced charting, and more.To learn more about Yahoo Finance Premium please visit: https://yhoo.it/33jXYBpConnect with Yahoo Finance:Get the latest news: https://yhoo.it/2fGu5BbFind Yahoo Finance on Facebook: http://bit.ly/2A9u5ZqFollow Yahoo Finance on Twitter: http://bit.ly/2LMgloPFollow Yahoo Finance on Instagram: http://bit.ly/2LOpNYzFollow Cashay.comFollow Yahoo Finance Premium on Twitter: https://bit.ly/3hhcnmV","Yahoo Finance is the largest business and financial news site in the world, with unrivaled access to data, insights, and content. This channel shares some that of knowledge with informative video.","yahoo finance news business money stocks videos yahoo news yahoo finance live market news market news coronavirus COVID-19 econony recession Yahoo Finance Premium","Cl-Cb2psM-M"
GTzy8iQrUsM,"WATCH LIVE: House Speaker Pelosi speaks with media following Capitol siege — 1/7/21","UCrp_UI8XtuYfpiqluWLD7Lw","CNBC Television","25","1391.0","https://i.ytimg.com/vi/GTzy8iQrUsM/default.jpg","CNBC|business news|finance stock|stock market|news channel|news station|breaking news|us news|world news|cable|cable news|finance news|money|money tips","House Speaker Nancy Pelosi holds her weekly news conference with Capitol Hill reporters.» Subscribe to CNBC TV: https://cnb.cx/SubscribeCNBCtelevision» Subscribe to CNBC: https://cnb.cx/SubscribeCNBC» Subscribe to CNBC Classic: https://cnb.cx/SubscribeCNBCclassicTurn to CNBC TV for the latest stock market news and analysis. From market futures to live price updates CNBC is the leader in business news worldwide.Connect with CNBC News OnlineGet the latest news: http://www.cnbc.com/Follow CNBC on LinkedIn: https://cnb.cx/LinkedInCNBCFollow CNBC News on Facebook: https://cnb.cx/LikeCNBCFollow CNBC News on Twitter: https://cnb.cx/FollowCNBCFollow CNBC News on Instagram: https://cnb.cx/InstagramCNBC#CNBC#CNBCTVWATCH LIVE: House Speaker Pelosi speaks with media following Capitol siege — 1/7/21","","CNBC Stock news business news finance news which stocks economy","Cl-Cb2psM-M"
7zSgruNR0d8,"Meet The Press Broadcast (Full) - January 10th, 2020 | Meet The Press | NBC News","UCeY0bbntWzzVIaj2z3QigXg","NBC News","25","2852.0","https://i.ytimg.com/vi/7zSgruNR0d8/default.jpg","nbc|news|news nbc|nbc live|live news|news nbc live|nbc news live|nbc special report|nbc news today|news today|nightly news|nightly news nbc|nbc news special report|nbc news live today|nbc news live stream|nbc news now","Former White House Chief of Staff Mick Mulvaney talks to Meet the Press about why President Trump’s actions in the last week were a breaking point for some in the administration. In an exclusive interview with Meet the Press, Rep. Hakeem Jeffries (D-N.Y.), Chair, House Democratic Caucus, talks to Chuck Todd about the Democrats’ impeachment plans. Sen. Pat Toomey (R-Pa.) tells Chuck Todd that he believes the best path forward would be for President Trump to leave the White House and resign. Kasie Hunt, Hallie Jackson, Jeh Johnson and Peggy Noonan join the Meet the Press roundtable to discuss how Congress will react to the Trump mob that stormed that Capitol.» Subscribe to NBC News: http://nbcnews.to/SubscribeToNBC» Watch more NBC video: http://bit.ly/MoreNBCNewsNBC News is a leading source of global news and information. Here you will find clips from NBC Nightly News, Meet The Press, and original digital videos. Subscribe to our channel for news stories, technology, politics, health, entertainment, science, business, and exclusive NBC investigations.Connect with NBC News Online!Visit NBCNews.Com: http://nbcnews.to/ReadNBCFind NBC News on Facebook: http://nbcnews.to/LikeNBCFollow NBC News on Twitter: http://nbcnews.to/FollowNBCFollow NBC News on Instagram: http://nbcnews.to/InstaNBCMeet The Press Broadcast (Full) - January 10th, 2020 | Meet The Press | NBC News","» Subscribe to NBC News: http://nbcnews.to/SubscribeToNBC» Watch more NBC video: http://bit.ly/MoreNBCNewsNBC News Digital is a collection of innovative and powerful news brands that deliver compelling, diverse and engaging news stories. NBC News Digital features NBCNews.com, MSNBC.com, TODAY.com, Nightly News, Meet the Press, Dateline, and the existing apps and digital extensions of these respective properties.  We deliver the best in breaking news, live video coverage, original journalism and segments from your favorite NBC News Shows.Connect with NBC News:NBC News App: https://smart.link/5d0cd9df61b80Breaking News Alerts: https://link.nbcnews.com/join/5cj/breaking-news-signup?cid=sm_npd_nn_yt_bn-clip_190621Visit NBCNews.Com: http://nbcnews.to/ReadNBCFind NBC News on Facebook: http://nbcnews.to/LikeNBCFollow NBC News on Twitter: http://nbcnews.to/FollowNBCFollow NBC News on Instagram: http://nbcnews.to/InstaNBC","NBC News News Politics Today Show NBC Nightly News Meet The Press Dateline Brian Williams nbc news nbc nbcnews breaking news nbc breaking news nbc news now nbc news live stream nbc latest news nbc politics nbc news breaking news live news news nbc live nbc news live nbc special report nbc news today news today nightly news nightly news nbc nbc news special report","Cl-Cb2psM-M"
6LxDPeKv-DI,"Speaker Nancy Pelosi: Trump Made “terrible mistake” Calling Stop to Stimulus Talks | The View","UCeH6qE4V7n5tVwP7NkdrtJg","The View","24","561.0","https://i.ytimg.com/vi/6LxDPeKv-DI/default.jpg","The View|Whoopi Goldberg|Joy Behar|Meghan McCain|Sunny Hostin|Sara Haines|Ana Navarro|Speaker Nancy Pelosi|Donald Trump|coronavirus|covid-19|stimulus package|relief|exclusive","The Speaker of the House reacts to President Trump announcing he was calling coronavirus relief negotiations off until after the election and changing course later that same evening.Subscribe to our YouTube channel: http://bit.ly/2Ybi4tM MORE FROM 'THE VIEW':Full episodes: http://abcn.ws/2tl10qhTwitter: http://twitter.com/theviewFacebook: http://facebook.com/TheViewInstagram: http://instagram.com/theviewabc","The View is the place to be heard with live broadcasts five days a week with Whoopi Goldberg, Joy Behar, Sara Haines, Sunny Hostin, Meghan McCain, and Ana Navarro. Watch weekdays at 11e|10c|p on ABC.","the view abc daytime tv television news politics interview hot topics whoopi goldberg","Cl-Cb2psM-M"
bLR9-q5pKnk,"Calls grow for Pence to use 25th Amendment to remove Trump from office","UCAeWdyKJXGWmVAXFpgLNNTg","CBS Evening News","25","196.0","https://i.ytimg.com/vi/bLR9-q5pKnk/default.jpg","video|cbs|news|president trump|protesters|rioters|capitol|washington D.C.|mike pence|removal|democrats|25th amendment|attack","Top Democrats are calling for President Trump’s removal from office with less than two weeks left of his term after his supporters attacked the Capitol. Nancy Cordes has more.Subscribe to the CBS Evening News Channel HERE: http://bit.ly/1S7DhikWatch Full Episodes of the CBS Evening News HERE: http://cbsn.ws/23XekKAWatch the latest installment of On the Road, only on the CBS Evening News, HERE: http://cbsn.ws/23XwqMHFollow CBS Evening News on Instagram: http://bit.ly/1T8icTOLike CBS Evening News on Facebook HERE: http://on.fb.me/1KxYobbFollow the CBS Evening News on Twitter HERE: http://bit.ly/1O3dTTeFollow the CBS Evening News on Google+ HERE: http://bit.ly/1Qs0aamGet your news on the go! Download CBS News mobile apps HERE: http://cbsn.ws/1Xb1WC8Get new episodes of shows you love across devices the next day, stream local news live, and watch full seasons of CBS fan favorites anytime, anywhere with CBS All Access. Try it free! http://bit.ly/1OQA29B---The CBS Evening News premiered as a half-hour broadcast on Sept. 2, 1963. Check local listings for CBS Evening News broadcast times.","Welcome to the official YouTube channel for CBS Evening News.The CBS Evening News airs every weekday night at 6:30 PM ET. First broadcast in 1948, it's the longest running evening newscast.","","Cl-Cb2psM-M"
vvNY5u7pmqA,"Is This Blood on Mitch McConnell's Hands?","UCQVhgOxzt5W1fZhOd0l2E6g","The First","25","299.0","https://i.ytimg.com/vi/vvNY5u7pmqA/default.jpg","trump|conservative|dana|loesch|buck|sexton|jesse|kelly|show|mike|slater|first|radio|pluto|tv|new|news|opinion|politics|political|report|media|donald|republicans|republican|gop|democrats|liberals|i'm right|crusaders|shield's|high|bill|oreilly|Trump|Donald|Joe|Biden|Kamala|Harris|2020|Election|Foxnews|Newsmax|CNN|ABC|NBC|CBS|OANN|Blaze|no|spin|Dana|Loesch|Bill|O’Reilly|Jesse|Kelly|Buck|Sexton|Slater|F1rst","An MS-13 gangster who was deported TEN TIMES killed his girlfriend in front of their child, reports Bill O'Reilly. Kate's Law would have locked him away for a decade.Hundreds, if not thousands, of people are dead since 2015 because THE TURTLE wouldn't put it up for a vote!","The First is the network for free speech and big ideas, and the new TV home of Bill O'Reilly. The First is designed for Americans who love freedom and bold opinions. Hosts include Dana Loesch, Buck Sexton, Jesse Kelly, Mike Slater, and top contributors. Get it on your phone, computer, or TV at www.thefirsttv.com/watch.","Politics Trump Conservative Republican Libertarian Buck Sexton Trump Donald Joe Biden Kamala Harris 2020 Election Foxnews Newsmax CNN ABC NBC CBS OANN Blaze Dana Loesch Bill O’Reilly Jesse Kelly Buck Sexton Slater F1rst","Cl-Cb2psM-M"
jqzXgoH3STE,"Trump remains out of sight amid growing calls for resignation","UCBi2mrWuNuyYy4gbM6fU18Q","ABC News","25","435.0","https://i.ytimg.com/vi/jqzXgoH3STE/default.jpg","resignation|trump|president|republicans|impeachment|democrats|joe|biden|election|riot|world|news|abc|p_cmsid=2494279|p_vid=news-75143615","Democrats and some Republicans have taken steps toward impeaching President Donald Trump again, including having already written an impeachment resolution for “incitement of resurrection.”","Make ABC News your daily news outlet for breaking national and world news, broadcast video coverage, exclusive interviews and 24/7 live coverage that will help you stay up to date on the events shaping our world. https://abcnews.go.com","ABC News WWYD GMA 2020 Nightline This Week George Stephanopolous Charles Gibson Diane Sawyer Robin Roberts Lara Spencer Terry Moran Juju Chang David Muir abc news abc news live ABC TV Disney Breaking news barbara walters joy behar meghan mccain walters behar","Cl-Cb2psM-M"
2gkhJ1F46E0,"NBC Nightly News Broadcast (Full) - January 11th, 2021 | NBC Nightly News","UCeY0bbntWzzVIaj2z3QigXg","NBC News","25","1277.0","https://i.ytimg.com/vi/2gkhJ1F46E0/default.jpg","Nightly Netcast|Nightly News Netcast|nbc news|breaking news|us news|world news|politics|nightly news|top stories|health|nbc nightly news full episode|nightly news full episode|nightly news full|episode|full episode|lester holt|Nightly news full broadcast|Democrats|Impeach Trump|Capitol Attack|Congresswoman|Covid Strains|Covid Vaccinations|Homeland Security|National Guard|US Attorney|FBI|covid-19|us protest capitol|us protest 2021|us protests news","House Democrats introduce article of impeachment against President Trump, more cities opening mass Covid vaccination centers, and U.S. Secret Service expands security plan for Biden inauguration. Watch “NBC Nightly News With Lester Holt” at 6:30 p.m. ET / 5:30 p.m. CT (or check your local listings).00:00 Intro02:02 Democrats Introduce Article Of Impeachment Against Trump04:33 Will Republicans Join Effort To Impeach Trump?05:30 Two Capitol Police Officers Suspended In Siege Fallout06:18 FBI Reports Dozens Arrested In Capitol Attack06:41 Capitol Police Cheif Says Plea For National Guard Denied07:58 GOP State A.G.'S Under Fire For Robocall Ahead Of Riot08:19 U.S. Attorney: 'Hundreds' May Be Charged For Siege08:51 Congresswoman Believes She Caught COVID During Siege09:11 U.S. Struggles To Ramp Up Covid Vaccinations11:10 Post-Holday Covid Surge Hits U.S., Deaths Top 375,00013:02 Frantic Race To Stop New Covid Strains14:47 Pressure Mounts On Social Media Companies After Riot16:40 Homeland Security Expands Inauguration Protection17:25 FBI Warns Of Armed Protests In All 50 States17:38 Washington, D.C. Mayor Calls For Tighter Security18:26 More Retailers Letting Customers Keep Unwanted Gifts  » Subscribe to NBC News: http://nbcnews.to/SubscribeToNBC» Watch more NBC video: http://bit.ly/MoreNBCNewsConnect with NBC Nightly News online! NBC News App: https://smart.link/5d0cd9df61b80Breaking News Alerts: https://link.nbcnews.com/join/5cj/breaking-news-signup?cid=sm_npd_nn_yt_bn-clip_190621Visit NBCNightlyNews.com: https://nbcnews.to/2wFotQ8Find Nightly News on Facebook: https://bit.ly/2TZ1PhFFollow Nightly News on Twitter: https://bit.ly/1yFY2s4Follow Nightly News on Instagram: https://bit.ly/2tEncJD NBC News Digital is a collection of innovative and powerful news brands that deliver compelling, diverse and engaging news stories. NBC News Digital features NBCNews.com, MSNBC.com, TODAY.com, Nightly News, Meet the Press, Dateline, and the existing apps and digital extensions of these respective properties. We deliver the best in breaking news, live video coverage, original journalism and segments from your favorite NBC News Shows.#HouseDemocrats #USSecretService #NBCNewsNBC Nightly News Broadcast (Full) - January 11th, 2021 | NBC Nightly News","» Subscribe to NBC News: http://nbcnews.to/SubscribeToNBC» Watch more NBC video: http://bit.ly/MoreNBCNewsNBC News Digital is a collection of innovative and powerful news brands that deliver compelling, diverse and engaging news stories. NBC News Digital features NBCNews.com, MSNBC.com, TODAY.com, Nightly News, Meet the Press, Dateline, and the existing apps and digital extensions of these respective properties.  We deliver the best in breaking news, live video coverage, original journalism and segments from your favorite NBC News Shows.Connect with NBC News:NBC News App: https://smart.link/5d0cd9df61b80Breaking News Alerts: https://link.nbcnews.com/join/5cj/breaking-news-signup?cid=sm_npd_nn_yt_bn-clip_190621Visit NBCNews.Com: http://nbcnews.to/ReadNBCFind NBC News on Facebook: http://nbcnews.to/LikeNBCFollow NBC News on Twitter: http://nbcnews.to/FollowNBCFollow NBC News on Instagram: http://nbcnews.to/InstaNBC","NBC News News Politics Today Show NBC Nightly News Meet The Press Dateline Brian Williams nbc news nbc nbcnews breaking news nbc breaking news nbc news now nbc news live stream nbc latest news nbc politics nbc news breaking news live news news nbc live nbc news live nbc special report nbc news today news today nightly news nightly news nbc nbc news special report","Cl-Cb2psM-M"
