video_id,title,channelId,channelTitle,categoryId,duration,thumbnail_link,tags,description,channel_desc,channel_keywords,related_vid_id
XwVJYFTvAZc,"Democrats Introduce Resolution Calling On Pence To Invoke 25th Amendment, Republicans Object","UCeY0bbntWzzVIaj2z3QigXg","NBC News","25","279.0","https://i.ytimg.com/vi/XwVJYFTvAZc/default.jpg","News|Congress|Politics|NBC News|nbc|breaking news|us news|world news|nightly news|current events|top stories|pop culture|lester holt|Democrats|25th Amendment|Republicans Object|Rep. Steny Hoyer|Vice President Pence|President Trump|25th Amendment resolution|donald trump|25th amendment explained|Trump impeachment|House Democrats|Invoke 25th Amendment|Steny Hoyer resolution|Steny Hoyer announcement|resolution calling|unanimous consent request","Rep. Steny Hoyer introduced a resolution calling on Vice President Pence to invoke the 25th Amendment and remove President Trump from office, but Republicans objected to a unanimous consent request to pass it. NBC's Pete Williams and Kasie Hunt have details.» Subscribe to NBC News: http://nbcnews.to/SubscribeToNBC» Watch more NBC video: http://bit.ly/MoreNBCNewsNBC News Digital is a collection of innovative and powerful news brands that deliver compelling, diverse and engaging news stories. NBC News Digital features NBCNews.com, MSNBC.com, TODAY.com, Nightly News, Meet the Press, Dateline, and the existing apps and digital extensions of these respective properties.  We deliver the best in breaking news, live video coverage, original journalism and segments from your favorite NBC News Shows.Connect with NBC News Online!NBC News App: https://apps.nbcnews.com/mobileBreaking News Alerts: https://link.nbcnews.com/join/5cj/breaking-news-signup?cid=sm_npd_nn_yt_bn-clip_190621Visit NBCNews.Com: http://nbcnews.to/ReadNBCFind NBC News on Facebook: http://nbcnews.to/LikeNBCFollow NBC News on Twitter: http://nbcnews.to/FollowNBCFollow NBC News on Instagram: http://nbcnews.to/InstaNBC#Democrats #StenyHoyer #NBCNewsDemocrats Introduce Resolution Calling On Pence To Invoke 25th Amendment, Republicans Object","» Subscribe to NBC News: http://nbcnews.to/SubscribeToNBC» Watch more NBC video: http://bit.ly/MoreNBCNewsNBC News Digital is a collection of innovative and powerful news brands that deliver compelling, diverse and engaging news stories. NBC News Digital features NBCNews.com, MSNBC.com, TODAY.com, Nightly News, Meet the Press, Dateline, and the existing apps and digital extensions of these respective properties.  We deliver the best in breaking news, live video coverage, original journalism and segments from your favorite NBC News Shows.Connect with NBC News:NBC News App: https://smart.link/5d0cd9df61b80Breaking News Alerts: https://link.nbcnews.com/join/5cj/breaking-news-signup?cid=sm_npd_nn_yt_bn-clip_190621Visit NBCNews.Com: http://nbcnews.to/ReadNBCFind NBC News on Facebook: http://nbcnews.to/LikeNBCFollow NBC News on Twitter: http://nbcnews.to/FollowNBCFollow NBC News on Instagram: http://nbcnews.to/InstaNBC","NBC News News Politics Today Show NBC Nightly News Meet The Press Dateline Brian Williams nbc news nbc nbcnews breaking news nbc breaking news nbc news now nbc news live stream nbc latest news nbc politics nbc news breaking news live news news nbc live nbc news live nbc special report nbc news today news today nightly news nightly news nbc nbc news special report","Cl-Cb2psM-M"
9OYatH7aITA,"House bill calls for Pence to remove Trump via 25th Amendment","UCupvZG-5ko_eiXAupbDfxWw","CNN","25","463.0","https://i.ytimg.com/vi/9OYatH7aITA/default.jpg","latest News|Happening Now|CNN|mike pence|25th amendment|politics|us news","Republicans just blocked a bill introduced by House Majority Leader Steny Hoyer aimed at pushing President Trump out of office through the 25th Amendment. Democrats on sought to take up a resolution from Rep. Jamie Raskin of Maryland urging Vice President Mike Pence and the Cabinet to invoke the 25th Amendment, but it was blocked by Republicans. Hoyer tried to pass the resolution through unanimous consent. West Virginia Republican Rep. Alex Mooney objected to the request.House Speaker Nancy Pelosi has said the Democrats will move to bring the resolution for a full floor vote on Tuesday.The House is now adjourned until 9:00 a.m. ET tomorrow.#CNN #News","CNN operates as a division of Turner Broadcasting System, which is a subsidiary of Warner Media. CNN identifies itself as -- and is widely known to be - the most trusted source for news and information. The CNN umbrella includes nine cable and satellite television networks, two radio networks, the CNN Digital Network, which is the top network of news Web sites in the United States, and CNN Newsource, the world's most extensively syndicated news service. CNN is proud of our ability to bring you up-to-the-minute news from around the world, as a result of our many extensions.","CNN CNN News news breaking news","Cl-Cb2psM-M"
oVsMpkjDDhI,"House Democrats plan to impeach Trump, again","UCupvZG-5ko_eiXAupbDfxWw","CNN","25","276.0","https://i.ytimg.com/vi/oVsMpkjDDhI/default.jpg","latest News|Happening Now|CNN|politics|president donald trump|newsroom|manu raju","House Democrats are currently planning to introduce articles of impeachment against President Trump as soon as Monday, according to multiple sources familiar with the matter. That could set up a vote in the House early to the middle of next week. Speaker of the House Nancy Pelosi has not explicitly said when this will go to the floor. This would be the second time the House has unveiled articles of impeachment against President Trump.In December 2019, the House impeached Trump on charges of abuse of power and obstruction of Congress. The Senate acquitted him on both charges last February.#Trump #CNN #News","CNN operates as a division of Turner Broadcasting System, which is a subsidiary of Warner Media. CNN identifies itself as -- and is widely known to be - the most trusted source for news and information. The CNN umbrella includes nine cable and satellite television networks, two radio networks, the CNN Digital Network, which is the top network of news Web sites in the United States, and CNN Newsource, the world's most extensively syndicated news service. CNN is proud of our ability to bring you up-to-the-minute news from around the world, as a result of our many extensions.","CNN CNN News news breaking news","Cl-Cb2psM-M"
KY83_1zPFfk,"NBC Nightly News Broadcast (Full) - January 16th, 2020 | NBC Nightly News","UCeY0bbntWzzVIaj2z3QigXg","NBC News","25","1288.0","https://i.ytimg.com/vi/KY83_1zPFfk/default.jpg","Nightly Netcast|Nightly News Netcast","More than 100 individuals involved in Capitol riots arrested, National Guard deployed to state Capitols ahead of Inauguration Day, and states struggle to meet growing vaccine demand.Watch “NBC Nightly News With Lester Holt” at 6:30 p.m. ET / 5:30 p.m. CT (or check your local listings).  » Subscribe to NBC News: http://nbcnews.to/SubscribeToNBC» Watch more NBC video: http://bit.ly/MoreNBCNewsConnect with NBC Nightly News online! NBC News App: https://smart.link/5d0cd9df61b80Breaking News Alerts: https://link.nbcnews.com/join/5cj/breaking-news-signup?cid=sm_npd_nn_yt_bn-clip_190621Visit NBCNightlyNews.com: https://nbcnews.to/2wFotQ8Find Nightly News on Facebook: https://bit.ly/2TZ1PhFFollow Nightly News on Twitter: https://bit.ly/1yFY2s4Follow Nightly News on Instagram: https://bit.ly/2tEncJD NBC News Digital is a collection of innovative and powerful news brands that deliver compelling, diverse and engaging news stories. NBC News Digital features NBCNews.com, MSNBC.com, TODAY.com, Nightly News, Meet the Press, Dateline, and the existing apps and digital extensions of these respective properties. We deliver the best in breaking news, live video coverage, original journalism and segments from your favorite NBC News Shows.  NBC Nightly News Broadcast (Full) - January 16th, 2020 | NBC Nightly News","» Subscribe to NBC News: http://nbcnews.to/SubscribeToNBC» Watch more NBC video: http://bit.ly/MoreNBCNewsNBC News Digital is a collection of innovative and powerful news brands that deliver compelling, diverse and engaging news stories. NBC News Digital features NBCNews.com, MSNBC.com, TODAY.com, Nightly News, Meet the Press, Dateline, and the existing apps and digital extensions of these respective properties.  We deliver the best in breaking news, live video coverage, original journalism and segments from your favorite NBC News Shows.Connect with NBC News:NBC News App: https://smart.link/5d0cd9df61b80Breaking News Alerts: https://link.nbcnews.com/join/5cj/breaking-news-signup?cid=sm_npd_nn_yt_bn-clip_190621Visit NBCNews.Com: http://nbcnews.to/ReadNBCFind NBC News on Facebook: http://nbcnews.to/LikeNBCFollow NBC News on Twitter: http://nbcnews.to/FollowNBCFollow NBC News on Instagram: http://nbcnews.to/InstaNBC","NBC News News Politics Today Show NBC Nightly News Meet The Press Dateline Brian Williams nbc news nbc nbcnews breaking news nbc breaking news nbc news now nbc news live stream nbc latest news nbc politics nbc news breaking news live news news nbc live nbc news live nbc special report nbc news today news today nightly news nightly news nbc nbc news special report","Cl-Cb2psM-M"
-ZBzkOwohMs,"The $5,200,000,000,000 Trick Killing More Than Covid, w Stephen Fry.","UCDg_EVBPyUmKrR54mp9Wjyw","Pindex","28","958.0","https://i.ytimg.com/vi/-ZBzkOwohMs/default.jpg","climate change|air pollution|stephen fry|pindex|coronavirus","A powerful trick is forcing governments to keep quiet about a toxic threat that's killing more than Coronavirus. Voiced by Stephen FryWatch the new hyperloop video:https://youtu.be/BxuOJfAOsncHelp us make more videos like this (and enjoy exclusive content):patreon.com/pindexReceive our videos via email:https://www.pinfact.org/joinNeed a video?https://www.pindexvideoproduction.comSources:The film references Michael Moore’s film  Planet of The Humans, which claims that renewable energy isn't the answer to climate change. We don’t point out all the problems with the film, so if you watch it, we recommend checking the facts via independent sources.Global CO2 emissions have risen dramatically:https://ourworldindata.org/co2-and-other-greenhouse-gas-emissionsScientists expect a 3 degree temperature increase will happen even if countries meet their commitments under the Paris climate agreement.https://news.un.org/en/story/2019/11/1052171The world is failing to meet Paris Climate Agreement targets.https://climateactiontracker.org/When trees are burnt, they release a lot of CO2. The idea is to absorb it with new trees, but studies show that this would take around 40-100 years.  Study by Stanford University, published in Nature Communications. Summary: https://www.independent.co.uk/environment/europe-eu-renewable-energy-deforestation-forests-climate-change-a8534151.html200 scientists wrote to the EU, warning that wood creates more emissions than coal, because it’s less efficient to process. Biofuel is not the answer to climate change.https://iopscience.iop.org/article/10.1088/1748-9326/aaa512/pdfRenewable energy sources emit up to 50g of C02 per kWh, over their lifetime, compared to around 1000g for coal and 475 for natural gas. Study by the National Renewable Energy Lab:https://www.nrel.gov/docs/fy13osti/57187.pdfFossil fuel air pollution causes around 3.6 million deaths per year (the IMF estimates that this would have been cut in half with carbon taxes).Study published in Cardiovascular Research: https://academic.oup.com/cardiovascres/article/116/11/1910/5770885An IMF study found that if prices had been corrected in 2015, the world would be very different. Summary and link to study:https://www.vox.com/2019/5/17/18624740/fossil-fuel-subsidies-climate-imfAir pollution nearly doubles the risk of dementia in parts of the US.Study in the Proceedings of the National Academy of Sciences of the USA:https://www.pnas.org/content/117/25/13856Economists agree that if temperatures rise by 3 degrees, it will plunge the world’s economy into a deep depression, or worse. Institute for Policy Integrity:https://www.edf.org/sites/default/files/expertconsensusreport.pdf75% also said that a carbon tax was the most efficient way to tackle climate change.Broad expert and government support for carbon taxes. How Carbon Pricing Can Save the World, Johan Eyckmans:https://www.youtube.com/watch?v=rg_fP2CZYq4&feature=youtu.be&t=1035Electricity is cheaper in countries with more renewable energy:https://www.forbes.com/sites/davidrvetter/2020/07/23/european-renewables-just-crushed-fossil-fuels-heres-how-it-happened/?sh=3a08fba815dfIMF global temperature estimates. How carbon taxes could prevent climate change.https://www.datawrapper.de/_/G1tKm/Australia’s brief carbon tax worked, and after it was removed, electricity prices rose:https://www.tai.org.au/sites/default/files/Carbon%20price%2010%20years%20on%20%5Bweb%5D.pdfNASA images of the earth warming:https://climate.nasa.gov/vital-signs/global-temperature/#:~:text=Nineteen%20of%20the%2020%20warmest,National%20Oceanic%20and%20Atmospheric%20Administration.Fossil Fuels are subsidised by $5.2 Trillion per year. Summary and link to study:https://www.vox.com/2019/5/17/18624740/fossil-fuel-subsidies-climate-imfBig Oil is still trying to deny climate change:https://thebulletin.org/2019/08/millions-of-times-later-97-percent-climate-consensus-still-faces-denial/Exxon CEO said the Earth was cooling, decades after his own scientists found the opposite:http://www.climatefiles.com/exxonmobil/1997-exxon-lee-raymond-speech-at-world-petroleum-congress/","Join us at patreon.com/pindex to help us make more videos. You'll also get early access to our videos and can help improve them.If you need a video or you'd like to sponsor a Pindex video, please get in touch: https://www.pindexvideoproduction.com/","science tech","Cl-Cb2psM-M"
Le0o_b2Ypis,"NBC Nightly News Broadcast (Full) - January 14th, 2021 | NBC Nightly News","UCeY0bbntWzzVIaj2z3QigXg","NBC News","25","1284.0","https://i.ytimg.com/vi/Le0o_b2Ypis/default.jpg","Nightly Netcast|Nightly News Netcast|nbc news|news|breaking news|us news|world news|politics|nightly news|current events|top stories|pop culture|business|health|nbc nightly news full episode|nightly news full episode|nightly news full|episode|full episode|lester holt|Nightly news full broadcast|New Threats|Siegfried Fischbacher|Hunger Crisis|Fatally Shoots Unarmed|America's Seniors Facing|COVID Origin|COVID Relief Plan|Police Officers Capitol","Nation on alert ahead of President-elect Biden’s inauguration, President Trump’s impeachment trial could start next week, and ex-governor, former Michigan officials charged in Flint water crisis. Watch “NBC Nightly News With Lester Holt” at 6:30 p.m. ET / 5:30 p.m. CT (or check your local listings).00:00 Intro02:12 FBI Warns Of New Threats Ahead Of Inauguration03:54 Police Officers Capitol Visitors Under Investigation04:23 New Arrests Include Man Carrying Confederate Flag04:50 Report: Dozens On Terror Watch List Came To D.C.05:30 Trump's Impeachment Trial Could Begin Next Week8:08 Frustration & Confusion Over Slow Vaccine Rollout8:31 Congressman Tests Positive After Receiving COVID Vaccine8:59 COVID Vaccination Rules Vary State By State9:47 36,000 + U.S. COVID Deaths In Last Two Weeks9:58 COVID Vaccination Rules Vary State By State10:30 Biden Unveiling $2 Trillion COVID Relief Plan11:40 EX-Michigan Governor Charged In Flint Water Crisis13:04 Who Team Arrives In Wuhan To Investigate COVID Origin14:48 Officers Fatally Shoots Unarmed Black Man In His Yard16:19 Siegfried Fischbacher Of Siegfried & Roy Dies At 8116:40 America's Seniors Facing Hunger Crisis In Pandemic» Subscribe to NBC News: http://nbcnews.to/SubscribeToNBC» Watch more NBC video: http://bit.ly/MoreNBCNewsConnect with NBC Nightly News online! NBC News App: https://smart.link/5d0cd9df61b80Breaking News Alerts: https://link.nbcnews.com/join/5cj/breaking-news-signup?cid=sm_npd_nn_yt_bn-clip_190621Visit NBCNightlyNews.com: https://nbcnews.to/2wFotQ8Find Nightly News on Facebook: https://bit.ly/2TZ1PhFFollow Nightly News on Twitter: https://bit.ly/1yFY2s4Follow Nightly News on Instagram: https://bit.ly/2tEncJD NBC News Digital is a collection of innovative and powerful news brands that deliver compelling, diverse and engaging news stories. NBC News Digital features NBCNews.com, MSNBC.com, TODAY.com, Nightly News, Meet the Press, Dateline, and the existing apps and digital extensions of these respective properties. We deliver the best in breaking news, live video coverage, original journalism and segments from your favorite NBC News Shows.#BidensInauguration #TrumpsImpeachment #NBCNewsNBC Nightly News Broadcast (Full) - January 14th, 2021 | NBC Nightly News","» Subscribe to NBC News: http://nbcnews.to/SubscribeToNBC» Watch more NBC video: http://bit.ly/MoreNBCNewsNBC News Digital is a collection of innovative and powerful news brands that deliver compelling, diverse and engaging news stories. NBC News Digital features NBCNews.com, MSNBC.com, TODAY.com, Nightly News, Meet the Press, Dateline, and the existing apps and digital extensions of these respective properties.  We deliver the best in breaking news, live video coverage, original journalism and segments from your favorite NBC News Shows.Connect with NBC News:NBC News App: https://smart.link/5d0cd9df61b80Breaking News Alerts: https://link.nbcnews.com/join/5cj/breaking-news-signup?cid=sm_npd_nn_yt_bn-clip_190621Visit NBCNews.Com: http://nbcnews.to/ReadNBCFind NBC News on Facebook: http://nbcnews.to/LikeNBCFollow NBC News on Twitter: http://nbcnews.to/FollowNBCFollow NBC News on Instagram: http://nbcnews.to/InstaNBC","NBC News News Politics Today Show NBC Nightly News Meet The Press Dateline Brian Williams nbc news nbc nbcnews breaking news nbc breaking news nbc news now nbc news live stream nbc latest news nbc politics nbc news breaking news live news news nbc live nbc news live nbc special report nbc news today news today nightly news nightly news nbc nbc news special report","Cl-Cb2psM-M"
9wnbrv_HTWE,"WOW! Chris Wallace calls Mick Mulvaney Spineless Trump Yes Man to his face as Mulvaney Dumps on 45","UCRPdcY4_Al8TrRtgkMzkrQQ","Tony Dortie - 24/7 Eyes","24","697.0","https://i.ytimg.com/vi/9wnbrv_HTWE/default.jpg","[none]","WOW! Chris Wallace calls Mick Mulvaney a Trump Yes Man to his face as Mulvaney Dumps on Lame Duck 45","Tony Dortie - 24/7 Eyes  Moments That Matter +   Hosted by Tony Dortie with nonstop updates.on  American Politics and occasional music, breaking news, sport,  and funny moments. The Largest online UK Voice in the World commenting on Trump, Dems, Gop, Fox & CNN from the outside  24/7 Eyes the first talk show host online to look at and  Mix Politics as Entertainment, but that isn't the USPTony Dortie 24/7 Eyes (n), 1.Fresh perspective  never missing a political moment of all American political voices  2. Based on normal authority and societal expectations. (American Heritage Dictionary)Tony Dortie 24/7 Eyes totally rare in combining all of the news that people care about in one place. a news reporting site covered under Copyright Disclaimer Under Section Section 107 of the Copyright Act 1976, allowance is made for fair use for purposes such as criticism, comment, news reporting, teaching, scholarship, and research.","","Cl-Cb2psM-M"
w7LpTvjplcM,"Meet The Press Broadcast ( Full) - January 17th, 2020 | Meet The Press | NBC News","UCeY0bbntWzzVIaj2z3QigXg","NBC News","25","2879.0","https://i.ytimg.com/vi/w7LpTvjplcM/default.jpg","nbc|news|news nbc|nbc live|live news|news nbc live|nbc news live|nbc special report|nbc news today|news today|nightly news|nightly news nbc|nbc news special report|nbc news live today|nbc news live stream|nbc news now","Mayor of the District of Columbia Muriel Bowser (D) talks to Meet the Press about the security preparations in Washington, DC ahead of Joe Biden’s inauguration. Sen. Cory Booker (D-N.J.) discusses the next phase of the impeachment process as President Trump’s administration comes to an end. Rep. Nancy Mace (R-S.C.) tells Chuck Todd that she opposed impeachment because Democrats skipped the usual investigative process.  Dr. Anthony Fauci discusses the more virulent coronavirus strains that are under study, and the future of vaccination efforts. Kristen Welker, Rich Lowry and Former Sen. Claire McCaskill (D-Mo.) join the Meet the Press roundtable.» Subscribe to NBC News: http://nbcnews.to/SubscribeToNBC» Watch more NBC video: http://bit.ly/MoreNBCNewsNBC News is a leading source of global news and information. Here you will find clips from NBC Nightly News, Meet The Press, and original digital videos. Subscribe to our channel for news stories, technology, politics, health, entertainment, science, business, and exclusive NBC investigations.Connect with NBC News Online!Visit NBCNews.Com: http://nbcnews.to/ReadNBCFind NBC News on Facebook: http://nbcnews.to/LikeNBCFollow NBC News on Twitter: http://nbcnews.to/FollowNBCFollow NBC News on Instagram: http://nbcnews.to/InstaNBCMeet The Press Broadcast ( Full) - January 17th, 2020 | Meet The Press | NBC News","» Subscribe to NBC News: http://nbcnews.to/SubscribeToNBC» Watch more NBC video: http://bit.ly/MoreNBCNewsNBC News Digital is a collection of innovative and powerful news brands that deliver compelling, diverse and engaging news stories. NBC News Digital features NBCNews.com, MSNBC.com, TODAY.com, Nightly News, Meet the Press, Dateline, and the existing apps and digital extensions of these respective properties.  We deliver the best in breaking news, live video coverage, original journalism and segments from your favorite NBC News Shows.Connect with NBC News:NBC News App: https://smart.link/5d0cd9df61b80Breaking News Alerts: https://link.nbcnews.com/join/5cj/breaking-news-signup?cid=sm_npd_nn_yt_bn-clip_190621Visit NBCNews.Com: http://nbcnews.to/ReadNBCFind NBC News on Facebook: http://nbcnews.to/LikeNBCFollow NBC News on Twitter: http://nbcnews.to/FollowNBCFollow NBC News on Instagram: http://nbcnews.to/InstaNBC","NBC News News Politics Today Show NBC Nightly News Meet The Press Dateline Brian Williams nbc news nbc nbcnews breaking news nbc breaking news nbc news now nbc news live stream nbc latest news nbc politics nbc news breaking news live news news nbc live nbc news live nbc special report nbc news today news today nightly news nightly news nbc nbc news special report","Cl-Cb2psM-M"
gPTSZ6z_6BM,"Trump explodes at Nixon comparisons as he prepares to leave office","UCupvZG-5ko_eiXAupbDfxWw","CNN","25","540.0","https://i.ytimg.com/vi/gPTSZ6z_6BM/default.jpg","latest News|Happening Now|CNN|Politics|President Trump|US News","CNN's Jim Acosta and Watergate journalist Carl Bernstein discuss what's happening behind closed doors during President Trump's final days in office.#CNN #News","CNN operates as a division of Turner Broadcasting System, which is a subsidiary of Warner Media. CNN identifies itself as -- and is widely known to be - the most trusted source for news and information. The CNN umbrella includes nine cable and satellite television networks, two radio networks, the CNN Digital Network, which is the top network of news Web sites in the United States, and CNN Newsource, the world's most extensively syndicated news service. CNN is proud of our ability to bring you up-to-the-minute news from around the world, as a result of our many extensions.","CNN CNN News news breaking news","Cl-Cb2psM-M"
