video_id,title,channelId,channelTitle,categoryId,duration,thumbnail_link,tags,description,channel_desc,channel_keywords,related_vid_id
JeHUHuIRXHo,"HIGHLIGHTS | Ryan Garcia vs. Luke Campbell","UCurvRE5fGcdUgCYWgh-BDsg","DAZN Boxing","17","507.0","https://i.ytimg.com/vi/JeHUHuIRXHo/default.jpg","dazn|boxing|highlights|full fight|ko|knockout|ryan garcia|top 10|canelo|anthony joshua|ggg|haney|garcia campbell|luke campbell|golden boy","January 2nd, 2021 -- Ryan Garcia vs. Luke Campbell from the American Airlines Center in Dallas, Texas.Subscribe to our YouTube channel 👉  http://bit.ly/DAZNBoxingYouTubeDownload the DAZN app now 👉  http://bit.ly/DAZN_YTFollow DAZN Boxing On Social Media 👇Twitter: https://www.twitter.com/DAZNBoxingInstagram: https://www.instagram.com/DAZNBoxingFacebook: https://www.facebook.com/DAZN","Subscribe to our YouTube channel 👉  http://bit.ly/DAZNBoxingYouTubeDownload the DAZN app now 👉  http://bit.ly/DAZN_YTFollow DAZN Boxing On Social Media 👇Twitter: https://www.twitter.com/DAZNBoxingInstagram: https://www.instagram.com/DAZNBoxingFacebook: https://www.facebook.com/DAZN","boxing mma dazn stream highlights full fights canelo ryan garcia","6lIvg3JLQk0"
LFqeiGkXmSo,"7 Times When RYAN GARCIA showed Next LEVEL Speed!","UC2-jrfZFK5oj28ic00X3anQ","Boxing Matrix","17","676.0","https://i.ytimg.com/vi/LFqeiGkXmSo/default.jpg","Ryan garcia|ryan garcia training|ryan garcia vs|ryan garcia vs francisco fonseca|ryan garcia vs romero duno|ryan garcia highlights|ryan garcia fight|ryan garcia moments|ryan garcia speed|ryan garcia knockouts|ryan garcia vs luke campbell|ryan garcia vs gervonta davis|ryan garcia vs devin haney|boxing|boxing matrix","Does Ryan Garcia have the fastest hands today ? Narrator: Nikola Muckajev____________________________________________Follow Audiomachine on:• Official Site: http://Audiomachine.com• Facebook: https://www.facebook.com/Audiomachine• Twitter: https://twitter.com/Audiomachine• Instagram: https://www.instagram.com/Audiomachine_official/• License music: http://audiomachine.com/licensingBuy Audiomachine music:• Amazon: https://tinyurl.com/Audiomachine-amazon• CDBaby: https://tinyurl.com/Audiomachine-CDBaby• Spotify: https://tinyurl.com/Audiomachine-Spotify• iTunes: https://tinyurl.com/Audiomachine-iTunes","Just here, to make Boxing bigger.I'm mainly making promotions, motivation and kind of story telling videos. I hope you enjoy my videos! :)) For business inquiry: boxingmatrix@gmail.com","mike tyson boxing anthony joshua floyd mayweather khabib nurmagomedov Conor McGregor Highlights knockout full top 10 ''best'' ''moments'' ''funny'' ''interview''","6lIvg3JLQk0"
P9mNxJdq1nM,"Ryan Garcia & Luke Campbell Share Special Moment In Locker Room Post-Fight","UCurvRE5fGcdUgCYWgh-BDsg","DAZN Boxing","17","130.0","https://i.ytimg.com/vi/P9mNxJdq1nM/default.jpg","dazn|boxing|highlights|full fight|ko|knockout|ryan garcia|top 10|canelo|anthony joshua|ggg|haney|garcia campbell|luke campbell","January 2nd, 2021 -- Ryan Garcia vs. Luke Campbell from the American Airlines Center in Dallas, Texas.Subscribe to our YouTube channel 👉  http://bit.ly/DAZNBoxingYouTubeDownload the DAZN app now 👉  http://bit.ly/DAZN_YTFollow DAZN Boxing On Social Media 👇Twitter: https://www.twitter.com/DAZNBoxingInstagram: https://www.instagram.com/DAZNBoxingFacebook: https://www.facebook.com/DAZN","Subscribe to our YouTube channel 👉  http://bit.ly/DAZNBoxingYouTubeDownload the DAZN app now 👉  http://bit.ly/DAZN_YTFollow DAZN Boxing On Social Media 👇Twitter: https://www.twitter.com/DAZNBoxingInstagram: https://www.instagram.com/DAZNBoxingFacebook: https://www.facebook.com/DAZN","boxing mma dazn stream highlights full fights canelo ryan garcia","6lIvg3JLQk0"
RwidTi50afI,"Ryan Garcia Punches Logan Paul Hard During Podcast","UCfDzizo9u_OupDC60m0HJwg","Elvin Lu","24","169.0","https://i.ytimg.com/vi/RwidTi50afI/default.jpg","ryan garcia|logan paul|ryan garcia highlights|ryan garcia knockouts|ryan garcia speed|golden boy|logan paul podcast|logan paul vlogs|logan paul bradley martyn|ryan garcia logan paul|logan paul workout|logan paul training|ryan garcia training|logan paul vs ksi|ryan garcia impaulsive|ryan garcia fight|logan paul punched|boxing|interview|net worth|ryan garcia destroys logan paul|mayweather vs tenshin|logan paul vs ryan garcia|KSIOlajidebtHD|ksi","Logan Paul receiving lots of body shots during podcast","If you want to contact me,  this is my email: randomtopics@hotmail.com","logan paul jake paul ricegum faze david dobrik money finance marketing dropshipping make money advice help real state amazon fba ksi elvin lu funny compilations best moments","6lIvg3JLQk0"
cnw4K4pDiOc,"The Biggest Fight of My Life | 30 Days With: Ryan Garcia","UCaVIKOexO3N_6Sdl-Zug0Kg","Ryan Garcia","17","1402.0","https://i.ytimg.com/vi/cnw4K4pDiOc/default.jpg","Ryan Garcia|Boxing|Ryan Garcia boxing|DAZN|GOLDEN BOY|golden boy productions|ryan garcia highlights|fights|ryan garcia fight|boxing highlights|ryan garcia training|ryan garcia full fight|ryan garcia sparring|training|fight|ryan garcia youtube|ryan garcia knockouts|boxing|garcia campbell|30 days with ryan garcia|ryan garcia doc|ryan garcia documentary|luke campbell|garcia vs campbell|youtube originals|30 Days With: Ryan Garcia|originals|docu-series","On the day of his fight against Luke Campbell, Ryan Garcia lets us into his world, providing access you’ve never seen into the life of a boxer minutes before he steps into the ring. Everything hangs in the balance, but if we’ve learned anything from this journey, it’s that Ryan, the unflappable kid from Victorville, isn’t going to let anything change his relentless pursuit of greatness.Get Ryan Garcia merch at http://www.RyanGarciaMerch.comFollow Ryan Garcia on Social Media!Twitter: https://twitter.com/KingRyanGInstagram: https://www.instagram.com/kingryanFacebook: https://www.facebook.com/kingryang","Ryan Garcia's official YouTube channel Undefeated • lightweight superstar • 20-0 • 17ko’s 🥊","Ryan Garcia Boxing Vlog highlights","6lIvg3JLQk0"
MRaUKY3-iXU,"Callum Smith Suffers MASSIVE Arm Injury vs Canelo Alvarez - Doctor Explains!","UCHlBaw2X5iYQGJhd5v718Zw","Brian Sutterer MD","17","530.0","https://i.ytimg.com/vi/MRaUKY3-iXU/default.jpg","callum smith|canelo smith|canelo alvarez|callum smith arm injury|callum smith arm|canelo alvarez vs callum smith|canelo alvarez vs callum smith live|callum smith vs canelo alvarez highlights|dazn fight highlights|doctor explains|callum smith biceps|canelo alvarez highlights|callum smith vs canelo|boxing injuries","Callum Smith suffered a massive arm injury against Canelo Alvarez during Alvarez's win this past weekend on DAZN. There are some concerns for a ruptured bicep or even a broken arm for the former champ. In this video we'll take a look at the injury possibilities and discuss the important anatomy! More Boxing and UFC injuries!https://youtube.com/playlist?list=PLrdpldKEF236khwdFNRilNeOZded9gZLDFollow Me on Twitter!https://twitter.com/b_suttererI'm a doctor and a sports fan and this channel is dedicated to exploring the unique medical side of the world of sports, including NBA, MLB, NFL, UFC, and many more! Breaking down the biggest what ifs, historical injuries and stories, and making learning about medicine fun and relevant for all sports fans!Anatomy images: https://www.biodigital.comDISCLAIMER: Content not intended to be taken as medical advice. Opinions are my own and do not represent those of my employer. I have not personally treated or evaluated the individual(s) discussed in this video. Content used with educational and transformative intent within Fair Use GuidelinesContent owned and produced by Brian Sutterer LLC 2020","Are you a sports fan? Ever wonder about what is going on when they discuss different injuries? This channel is all about combining my two passions and reviewing sports injuries to explain them in a way the casual fan can understand and learn from.  I'm a resident doctor specializing in physical medicine and rehabilitation (PM&R).  So if you want to learn more about everything from past notable injuries to current athletes, be sure to subscribe and check out my channel!*Content on this channel is not to be taken as medical advice and opinions represent those of the individual(s) and not of my employer. I have not personally evaluated any of the athletes discusses on this channel and have never been involved in any aspect of their clinical care-Content produced and owned by Brian Sutterer LLC","nba nfl highlights nba what if sports medicine nba news sports news basketball sports injuries brian sutterer ufc injuries nba highlights","6lIvg3JLQk0"
rDlo6W1s_W0,"25 Punches That Are Just Epic","UCrr3aD1Bax8YREMV-woeUPw","The Fight Game","24","642.0","https://i.ytimg.com/vi/rDlo6W1s_W0/default.jpg","boxing|floyd mayweather|canelo alvarez|ryan garcia|teofimo lopez|gennady golovkin|boxing punches|boxing highlights|boxing knockouts","There are many ways boxing excites the fans of the sport, in our last video we took a look 15 times where boxers scored epic one-punch knockouts. In this video we take a look at 25 times where boxers scored an epic punch. We break down the skills and techniques behind the moves in this educational overview of the sport of Boxing.-------------------------------------------------------------------Resource Credits:🎵 Music:• Red Parker - Take A Picture• Reno - Hip-Hop Drama• Judge Jury Productions - Can't Do That, Chronic Strains🎬 Visuals:• Showtime Sports: https://www.youtube.com/user/shosports• Top Rank Boxing: https://www.youtube.com/user/trboxing• Sky Sports Boxing: https://www.youtube.com/channel/UC_JQGBtA7P0RwkRxd7xpJcA• Ryan Garcia: https://www.youtube.com/channel/UCaVIKOexO3N_6Sdl-Zug0Kg• HBO Boxing: https://www.youtube.com/user/HBOsports• Matchroom Boxing: https://m.youtube.com/user/MatchroomBoxing• DAZN USA: https://www.youtube.com/channel/UCurvRE5fGcdUgCYWgh-BDsg• PBC On FOX: https://www.youtube.com/channel/UCxm10NbD7LF1fVYcbHbcbXg-------------------------------------------------------------------About The Fight Game:This is a YouTube channel where we talk and give our opinions about everything regarding boxing. We talk about different things in every video, and we do it in a way that's both fun and educational for you. On this channel all videos are:• Exclusive to this YouTube channel• Trans-formative in nature, making content original and unique• Unlike any other content• Narrated with original commentary• Used with licensed music• Edited extensively to change the way footage is used• Educational• Unique editing for a captivating experienceOur goal here at The Fight Game is to provide a channel on YouTube for Boxing fans to enjoy by posting unique videos with original commentary that educates the people about boxers and the sport of Boxing as a whole. I make my content original and unique by adding cool editing (ALL clips in my videos are edited by me), I give insight into boxing that's not often heard anywhere else, in videos I also like to make epic poetic voice overs to hype up my audience for upcoming fights, by doing this I give my videos a unique cinematic feeling that's original to my YouTube channel. I also like to compare two boxers who have an upcoming fight by listing their strengths and weaknesses, and what I think they need to do to win their fights. All in all, the videos I post here on YouTube are aimed to make learning fun with cinematic editing and authentic commentary.-------------------------------------------------------------------0:00 Introduction2:26 25 Punches","Hi there! My name is Kenny, and I create original informative videos here on YouTube about the sport of Boxing - by adding significant original commentary in every video with high quality editing and significant educational value.Here on The Fight Game we talk about upcoming boxing matches, individual boxers and boxing history. Sometimes we take a look back in the past to talk about events that shaped the world of boxing we see today, sometimes we talk about what's going on currently and we also speculate on what we have yet to see in the future.I'm a professional video editor & I've been involved in the sport of Boxing for more than a decade, in my videos I put these two together as I create cool unique videos with entertaining storylines, high quality transformative editing, professional voice-overs while also sharing my knowledge of Boxing with you. If you're already a hardcore fight fan, or you're simply curious about Boxing you can learn something from watching our videos :)","Boxing","6lIvg3JLQk0"
VaQI0sKum3M,"Vasyl lomachenko vs Luke campbell highlights","UCrsSjTIlkIoXrVSNFEvgiww","BOXEO BOXING","17","390.0","https://i.ytimg.com/vi/VaQI0sKum3M/default.jpg","vasyl lomachenko vs luke campbell highlights boxing fight boxeo lomachenko vs campbell highlights","Boxing fight vasyl lomachenko vs luke campbell highlights","Boxeo","Boxeo","6lIvg3JLQk0"
uZPhfx6QoKQ,"The Most Shocking and Unusual Injury of NFL Season - Doctor Explains Deandre Baker Femur Fracture","UCHlBaw2X5iYQGJhd5v718Zw","Brian Sutterer MD","17","397.0","https://i.ytimg.com/vi/uZPhfx6QoKQ/default.jpg","doctor explains|nfl injuries|football injuries|nfl|nfl week 17|nfl season|deandre baker|deandre baker injury|deandre baker leg injury|shocking nfl injuries|shocking nfl moments|nfl moments|worst nfl injuries|bad nfl injuries|doctor reacts|kansas city chiefs|nfl season injuries|most unusual sports injuries|nfl injury update|nfl news|nfl week 17 news","Deandre Baker of the Kansas City Chiefs suffered what might be the most unusual and shocking injury in recent NFL history when he broke his femur on a non contact play while falling to ground to stop a receiver. The femur is the strongest bone in the body and requires an huge amount of energy to break. The 2020-2021 NFL season has seen some pretty bad injuries, but this is truly the most shocking and unusual injury moment of the NFL season. More NFL videos!https://youtube.com/playlist?list=PLrdpldKEF234DpxS6fOr9becIHtz7ibPtFollow Me on Twitter!https://twitter.com/b_suttererI'm a doctor and a sports fan and this channel is dedicated to exploring the unique medical side of the world of sports, including NBA, MLB, NFL, UFC, and many more! Breaking down the biggest what ifs, historical injuries and stories, and making learning about medicine fun and relevant for all sports fans!MY MUSIC:Epidemic Sound - Sign up with this link for a FREE 30 day trial!https://www.epidemicsound.com/referral/2m1bb5/Anatomy images: https://www.biodigital.comDISCLAIMER: Content not intended to be taken as medical advice. Opinions are my own and do not represent those of my employer. I have not personally treated or evaluated the individual(s) discussed in this video. Content used with educational and transformative intent within Fair Use GuidelinesContent owned and produced by Brian Sutterer LLC 2021","Are you a sports fan? Ever wonder about what is going on when they discuss different injuries? This channel is all about combining my two passions and reviewing sports injuries to explain them in a way the casual fan can understand and learn from.  I'm a resident doctor specializing in physical medicine and rehabilitation (PM&R).  So if you want to learn more about everything from past notable injuries to current athletes, be sure to subscribe and check out my channel!*Content on this channel is not to be taken as medical advice and opinions represent those of the individual(s) and not of my employer. I have not personally evaluated any of the athletes discusses on this channel and have never been involved in any aspect of their clinical care-Content produced and owned by Brian Sutterer LLC","nba nfl highlights nba what if sports medicine nba news sports news basketball sports injuries brian sutterer ufc injuries nba highlights","6lIvg3JLQk0"
1FI5eB0gQmQ,"RYAN GARCIA VS LUKE CAMPBELL //// BOXING HIGHLIGHTS","UCi3klaxdKEqKmUBnWP3AW6Q","BK Games","22","33.0","https://i.ytimg.com/vi/1FI5eB0gQmQ/default.jpg","[none]","Hello everyone, wanted to upload this video pretty quickly so enjoy, feel free to leave a sub and drop a like. Thanks for the support, I’ve now reached 107 subs, and over 80k views! Copyright Disclaimer under section 107 of the Copyright Act 1976, allowance is made for “fair use” for purposes such as criticism, comment, news reporting, teaching, scholarship, education and research. Fair use is a use permitted by copyright statute that might otherwise be infringing. Fair use is a use permitted by copyright statute that might otherwise be infringing.","Hello everyone, I will be uploading a variety of different videos on this channel ranging from gaming videos all the way to fight videos/ reviews of different new game releases. I will be doing a Resident Evil 8: Village walkthrough to kickstart my gaming content when it comes out in 2021.... leave any recommendations for other games that you guys want me to play or just suggest different videos that you want me to upload in the future.... I’d appreciate it if you like and subscribe if you enjoy my content. stay safe and enjoy!Email: ckravcak@gmail.com Instagram: corey.krav22","","6lIvg3JLQk0"
vw6-1QGzWhQ,"Ryan Garcia vs Luke Campbell - A CLOSER LOOK","UCq99IkCksd1N1DaV6eWlCmg","Motivedia - Boxing","17","657.0","https://i.ytimg.com/vi/vw6-1QGzWhQ/default.jpg","Ryan garcia|Garcia campbell|Ryan Garcia vs campbell|campbell vs garcia|Luke Campbell vs Ryan garcia|Ryan Garcia vs Luke campbell|campbell garcia|motivedia","On the latest 'Closer Look' feature we preview the latest chapter in boxings thriving lightweight division. This weekend a showdown awaits between Luke 'Coolhand' Campbell, a resilient British Southpaw.. Against Golden Boy's next generation, Ryan 'Kingry' Garcia, a devastating American finisher.","An educational and informative Boxing Channel which brings you closer to the sweet science. Our Channel utilises fair use commentary, an original non-synthetic voiceover and a brings a unique narrative to every piece of content we create. By doing this, we hope to promote, educate and inspire the next generation of athletes.","Boxing Boxers Anthony Joshua Deontay Wilder Heavyweight Mayweather Highlights Motivedia","6lIvg3JLQk0"
4UfLa4Gmen0,"FULL CARD HIGHLIGHTS | Ryan Garcia vs. Luke Campbell","UCurvRE5fGcdUgCYWgh-BDsg","DAZN Boxing","17","1739.0","https://i.ytimg.com/vi/4UfLa4Gmen0/default.jpg","dazn|boxing|highlights|full fight|ko|knockout|ryan garcia|top 10|canelo|anthony joshua|ggg|haney|garcia campbell|full card|luke campbell","January 2nd, 2021 -- Ryan Garcia vs. Luke Campbell from the American Airlines Center in Dallas, Texas.Subscribe to our YouTube channel 👉  http://bit.ly/DAZNBoxingYouTubeDownload the DAZN app now 👉  http://bit.ly/DAZN_YTFollow DAZN Boxing On Social Media 👇Twitter: https://www.twitter.com/DAZNBoxingInstagram: https://www.instagram.com/DAZNBoxingFacebook: https://www.facebook.com/DAZN","Subscribe to our YouTube channel 👉  http://bit.ly/DAZNBoxingYouTubeDownload the DAZN app now 👉  http://bit.ly/DAZN_YTFollow DAZN Boxing On Social Media 👇Twitter: https://www.twitter.com/DAZNBoxingInstagram: https://www.instagram.com/DAZNBoxingFacebook: https://www.facebook.com/DAZN","boxing mma dazn stream highlights full fights canelo ryan garcia","6lIvg3JLQk0"
WOyeV6CHpqY,"Tom Segura Breaks His Arm and Ruptures Knee in Failed Dunk Attempt - Doctor Explains Injuries!","UCHlBaw2X5iYQGJhd5v718Zw","Brian Sutterer MD","17","338.0","https://i.ytimg.com/vi/WOyeV6CHpqY/default.jpg","tom segura|tom segura arm|tom segura arm break|tom segura accident|dom segura dunk attempt|doctor reacts|doctor explains|Bert Kreischer|crazy arm injuries|basketball fails|dunk attempt fails|tom segura breaks arm|tom segura breaks arm and leg|ymh podcast new years","Comedian (and athlete) Tom Segura broke his arm and ruptured his patellar tendon during a failed dunk attempt. As he went up for the dunk, his knee gave out from the ruptured tendon and then as he landed on his arm he broke the humerus in a truly unfortunate and wild sequence of events. With the help of Bert Kreischer setting his arm back in place, Seruga is on his way to recovery.More Basketball Videos!https://youtube.com/playlist?list=PLrdpldKEF234R2whitL1475Fo6AlftDrIFollow Me on Twitter!https://twitter.com/b_suttererMY MUSIC:Epidemic Sound - Sign up with this link for a FREE 30 day trial!https://www.epidemicsound.com/referral/2m1bb5/I'm a doctor and a sports fan and this channel is dedicated to exploring the unique medical side of the world of sports, including NBA, MLB, NFL, UFC, and many more! Breaking down the biggest what ifs, historical injuries and stories, and making learning about medicine fun and relevant for all sports fans!Anatomy images: https://www.biodigital.comDISCLAIMER: Content not intended to be taken as medical advice. Opinions are my own and do not represent those of my employer. I have not personally treated or evaluated the individual(s) discussed in this video. Content used with educational and transformative intent within Fair Use GuidelinesContent owned and produced by Brian Sutterer LLC 2021","Are you a sports fan? Ever wonder about what is going on when they discuss different injuries? This channel is all about combining my two passions and reviewing sports injuries to explain them in a way the casual fan can understand and learn from.  I'm a resident doctor specializing in physical medicine and rehabilitation (PM&R).  So if you want to learn more about everything from past notable injuries to current athletes, be sure to subscribe and check out my channel!*Content on this channel is not to be taken as medical advice and opinions represent those of the individual(s) and not of my employer. I have not personally evaluated any of the athletes discusses on this channel and have never been involved in any aspect of their clinical care-Content produced and owned by Brian Sutterer LLC","nba nfl highlights nba what if sports medicine nba news sports news basketball sports injuries brian sutterer ufc injuries nba highlights","6lIvg3JLQk0"
06sfzaL78A0,"EDDY REYNOSO EXPLAINS TO RYAN WHY HE GOT DROPPED I LOVE THAT YOU SHOWED BALLS MORE THEN YOU WINNING","UCzp5-dEdqKOS9tCF8S-UErg","Little Giant Boxing","17","161.0","https://i.ytimg.com/vi/06sfzaL78A0/default.jpg","Eddy Reynoso|Boxing|Boxeo|Ryan garcia|Eddy Reynoso and Ryan garcia after beating Luke Campbell|Ryan garcia vs Luke Campbell fight|Ryan garcia knocks out Luke Campbell via body shot|Eddy Reynoso tells Ryan garcia what he did wrong on the fight|Luke Campbell drops Ryan garcia in the 2nd fight|Ryan garcia vs Luke Campbell post fight press conference|Eddy Reynoso talks Ryan garcia getting dropped","#GarciaCampbell #GarciavsCampbell #Ryan garcia EDDY REYNOSO TELLS RYAN WHY HE GOT DROPPED I LIKED THAT YOU SHOWED BALLS MORE THEN YOU WONIn this video, Eddy Reynoso gives an honest assessment on Ryan Garcia on why he got dropped in the second round. Eddy Reynoso then tells Ryan that he loved that he showed balls more then him winning In this video, Trainer of the year Eddy Reynoso tells Ryan Garcia why he got dropped and tells him he loved that he showed heart more then the fact that he won the fightINSTAGRAM: https://www.instagram.com/ConstantinogarciaTWITTER: https://twitter.com/Constntino","Bringing you behind the scenes with your favorite fighters. Boxing interviews, training, and one on one interviews","Boxing Boxeo Little Giant Boxing Canelo","6lIvg3JLQk0"
sIbh5_GdCWE,"LUKE CAMPBELL IMMEDIATE REACTION TO RYAN GARCIA KNOCKOUT LOSS: I'M HEARTBROKEN","UCmxZw7N4Jyljr1RbSs4Ymaw","FightHype.com","17","62.0","https://i.ytimg.com/vi/sIbh5_GdCWE/default.jpg","Luke Campbell|Ryan Garcia|Boxing|FightHype","FightHype.com is on hand in Dallas, Texas where lightweight sensation Ryan Garcia knocked out top contender Luke Campbell with a brutal body shot in the 7th round of their showdown. You don't want to miss what went down after the fight. Check it out!","FIGHTHYPE.COM - A FIGHT IS A FIGHTThe one-stop source for all of your boxing and mixed martial arts news from around the internet. Get exclusive interviews, breaking news, interactive features and more.Powered by hard work & dedication and founded by Ben Thompson.SUBSCRIBE NOW TO THIS CHANNEL TO BE NOTIFIED OF DAILY VIDEO UPDATESIF YOU ENJOY OUR VIDEOS, PLEASE BE SURE TO SHOW YOUR SUPPORT AND ALSO VISIT THE WEBSITE, WWW.FIGHTHYPE.COM, DAILY SO WE CAN CONTINUE TO BRING YOU COMPLETE FIGHT COVERAGE.","FightHype Floyd Mayweather Jr. Manny Pacquiao Mayweather Pacquiao Canelo Boxing MMA UFC","6lIvg3JLQk0"
