video_id,title,channelId,channelTitle,categoryId,duration,thumbnail_link,tags,description,channel_desc,channel_keywords,related_vid_id
cjtHsZWs98s,"Your Friend Who Low Key Knows How To Fight w/ @Young Don The Sauce God","UCYtkAd9sMy7rafLtUdQ1drg","Chaz Smith","23","278.0","https://i.ytimg.com/vi/cjtHsZWs98s/default.jpg","Chaz|Chaz Smith|Chaz Smith funny|Chaz Smith comedy|hilarious|clean comedy|family friendly comedy|young don|young don the sauce god|slapbox|slap box|slapboxing|slap boxing|your|friend|who|low|key|knows|how|to|fight|Your friend who low key knows how to fight","Everybody has a friend who low key knows how to fight whether they know it or not (w/@Young Don The Sauce God). I ain't never seen two fighting best friends. It's always one of em gotta be trash at slap boxing. Idk, I tried to remix the TikTok but whatever, lemme know what you think about the video lol #ChazSmith #YoungDonTheSauceGodCheck out Don’s channel! https://youtube.com/c/YoungDonTheSauceGodSubscribe for more!https://bit.ly/2IzWIAtFollow me on all socials here!https://www.instagram.com/chazsmithhttps://www.tiktok.com/@chazsmithhttps://www.facebook.com/SimplyPutChazhttps://twitter.com/simplyputchaz","What's up y'all?! My name's Chaz Smith, the guy known for pronouncing things incorrectly on Vine and YouTube, screaming about why water is not wet, explaining what parents actually mean when they say there's food at home, and that one weird quesadilla video. You might've seen me in some funny Vine compilations and videos, but now I'm an actual YoUtuBeR. I hope my videos brighten your day and make you laugh!When I'm not posting on YouTube, you can follow me here!https://www.instagram.com/chazsmithhttps://www.tiktok.com/@chazsmithhttps://twitter.com/simplyputchazhttps://www.facebook.com/SimplyPutChaz","Chaz Smith Pronouncing Things Incorrectly Is Water Wet? Water isn't wet vine comedy funny videos Simply Put #SimplyPut","ELQmwf0uUVQ"
XsVRXJDtyxU,"How J Cole Fans finna be Hooping in his New Shoes","UC4G10tk3AHFuyMIuD3rHOBA","RDCworld1","23","293.0","https://i.ytimg.com/vi/XsVRXJDtyxU/default.jpg","[none]","J. Cole got some new shoes out, you already know how you gotta hoop when you put them on. Shoutout to Dreamville & J. Cole for the shoes!~RDC Social Media ~@RDCWorld1Mark Phillips - @SupremeDreams_1Affiong Harris - @CleanUniformDesmond Johnson - @l0v3andpeac3Leland Manigo - @23_Is_LelandDylan Patel - @dylanpatel4_Benjamin Skinner - @Ive_Ben_JamminJohnathan Newton - @playthatjohnMERCHhttps://rdcworld1.com/collections/allGAMING CHANNELhttps://www.youtube.com/watch?v=TB73K...TWITCH CHANNELhttps://www.twitch.tv/rdcgamingDREAM CON INFO!https://www.dreamconvention.comDISCORDhttps://discord.gg/dVT5jSu","RDCworld1 is all about making our fans laugh. We provide entertainment through skits, vlogs, short films, and more. Therefore, if you come across this channel please join our world and leave feedback!Anticipating rain, I can't make the same mistakes again.We hope to make it to 5,000,000 subscribers now! And even quicker than it took to get to 3,000,000! Thank you for all of y'alls support!After reaching 1 million subscribers I feel like a Great mission has been accomplished, but when one mission ends another begins...Check out our shop! https://www.rdcworld1.com/shopRDCworldPO Box 6124Round Rock, TX 78683","Rdcworld1 Comedy Vlogs Skits Entertainment Rdcworld Anime SupremeDreams RDC","ELQmwf0uUVQ"
Nic2NO6dH_k,"Black people will say anything while roasting part 2","UCWiY6fYdxuEe78r-0uFCnhA","LongBeachGriffy","24","338.0","https://i.ytimg.com/vi/Nic2NO6dH_k/default.jpg","[none]","Go to https://buyraycon.com/griffy for 15% off your order! Brought to you by Raycon.Thank you for watching! Follow my socials if you want :) Www.instagram.com/longbeach_griffy Www.facebook.com/longbeachgriffy Www.twitter.com/longbeachgriffy","I haven't decided yet, give me some time okay, I am new to this.","","ELQmwf0uUVQ"
crKohKpVoAM,"I wore Rock Lee's leg Weights for TWO WEEKS, did I get faster???","UCVS89U86PwqzNkK2qYNbk5A","Allen Pan - Sufficiently Advanced","28","1123.0","https://i.ytimg.com/vi/crKohKpVoAM/default.jpg","naruto|rock lee|rock lee takes off his weights|rock lee vs gaara|allen pan|sufficiently advanced|anime|weighted clothing|weighted clothing training|weighted clothing goku|goku takes off weighted clothing|hunter x hunter|505 agility test|illinois agility test","Thanks to DeltaTrainer for sponsoring today’s video! Viewers of my channel will get a 14-day free trial and pay only $59/mo instead of $100/mo if you sign up by February 1st. Visit https://bit.ly/train_like_allen to learn more!I've been waiting 17 years for the chance to make Rock Lee's leg weights so I can finally answer the question: would they actually make me faster?Thanks for eating my sandwiches @Kyle Hill !You never did answer my bra question @Xyla Foxlin ??Akeboshi Wind remix:https://youtu.be/4RiTpQz68mAExplosion footage from here:https://youtu.be/KskBRHAlmDgHelp Me Make More Awesome Stuff!https://www.patreon.com/sufficientlyadvancedSubscribe!http://goo.gl/xZvS5s Follow Sufficiently Advanced!https://twitter.com/AnyTechnologyhttps://www.facebook.com/sufficientlyadvancedhttps://www.instagram.com/sufficientlyadvanced/","Any sufficiently advanced technology is indistinguishable from magic. -Arthur C. ClarkeMy name's Allen, I try to make pretend things into real things!I get tons of emails, so I probably won't respond if you send one asking for build advice :( Sorry!","allen pan sufficiently advanced how to diy engineering tech science mythbusters anime inventions","ELQmwf0uUVQ"
ghzdwjWrWcc,"Juice WRLD - Bad Boy ft. Young Thug (Directed by Cole Bennett)","UCtylTUUVIGY_i5afsQYeBZA","Lyrical Lemonade","24","206.0","https://i.ytimg.com/vi/ghzdwjWrWcc/default.jpg","Juice WRLD|last video|music video|young thug|bad boy|bad boys|martin lawrence|will smith|2021|hip hop|rap|lyrical lemonade|cole bennett|grand national|chicago|north lawndale|west side|blue cash|mannequin challenge|on god|ysl|slime|pierre bourne|clowns|fire|swirl|lucid dreams|all girls are the same|bandit|armed & dangerous","Lyrical Lemonade Presents:Juice WRLD - Bad Boy featuring Young Thug (Official Music Video)In Loving Memory of Jarad HigginsDirected & Edited by: Cole Bennett Song Produced by Pi'erre BourneVFX: Cole Bennett & Nocturnal FXColorist: Loren White & Cole Bennett Director of Photography: Taylor Randall Steadicam: Renard Cheren 1st AC: Olivia Aquilina 2nd AC: Paige Hochstatter Gaffer: Christian Meijia Key Grip: Salvador Torrison Grip: Jonathan Lopez Grip: Alex Halsted Electric: Lars Moede Set Build: DreDayDesignz Art Asst: Conrad Edmonds Key Makeup: Michelle Echevarria 1st AD: Bernard Niyonzima PA: Anthony Alvarado PA: George Hammond PA: Blayne Parker PA: Jake Wilson PA: Lance Rowland PA: Faisal A.Omar Production Company: Lyrical Lemonade Executive Producer: Cole Bennett Producer: Salvatore Tarantino & Jay TauzinProduction Manager: Henri Coleman Production Coordinator: Toni SudimacJuice WRLD Socials:http://instagram.com/juicewrld999http://twitter.com/juiceworldddYoung Thug Socials:http://instagram.com/thuggerthugger1http://twitter.com/youngthug--Official Channel of Lyrical Lemonade Subscribe for updates on music videos, interviews, performance videos, etc.Lyrical Lemonade's Hot 25 Spotify Playlist:https://open.spotify.com/user/gh3vdz775oy18ah1wp9ucxsj5/playlist/5UuPeWDR2I8a8pORvW9vmrLyrical Lemonade Socials:http://www.twitter.com/lyricalemonadehttp://www.instagram.com/lyricalemonadehttp://www.facebook.com/lyricalemonadehttp://www.lyricallemonade.comCole Bennett Socials:http://www.twitter.com/_colebennett_http://www.instagram.com/_colebennett_LENNY ~ a hidden character representing happiness & good energyhttp://instagram.com/lenny","LYRICAL LEMONADE - a multi-media company specializing in music videos, live events, exclusive content, merchandise and plenty more.- striving to create innovative and creative content.your guys' support is everything.           - Cole BennettCHICAGO, IL ★★★★","Cole Bennett Lyrical Lemonade","ELQmwf0uUVQ"
rIjdXTkPJNc,"Two competitive magicians part 2","UCrA2bqOHwjX1DxgP9CaVJzw","Lenarr Young","23","807.0","https://i.ytimg.com/vi/rIjdXTkPJNc/default.jpg","Lenarr|Lenarr Young|lennarr|lenarryoung|lenar|lanar|lanarr|young|skit|skits|comedy|creator|funny","Follow me on:Twitter: https://twitter.com/lenarr_?lang=enInstagram: https://www.instagram.com/lenarr___/?hl=en","Im here to make you laugh / business email - Lenarr@viralnation.comInstagram - Lenarr___Twitter - Lenarr_ZD5GVJ","","ELQmwf0uUVQ"
tGs8_a36m6Y,"The Wait in the Doctor’s Office","UC6HfhID-PTOtY3T2JylQVGA","HARDSTOP LUCAS","23","718.0","https://i.ytimg.com/vi/tGs8_a36m6Y/default.jpg","[none]","Install Raid for Free ✅ IOS: https://clik.cc/AXzo9 ✅ ANDROID: https://clik.cc/6UGv2 Start with💰50K silver and get a Free Epic Champion 💥 on day 7 of “New Player Rewards” programThanks for watching!For business, email me: TLDfluent@gmail.comLit by Lookatbook: https://youtu.be/JZglRmlpWxcIntro created by Teaks: https://www.youtube.com/user/teaksanim12Beat used in video: https://youtu.be/knNPNMThJmcOutro song: Dices - Live Life https://youtu.be/t7kJH7CiHJMInstagram: https://www.instagram.com/hardstop.lucas/Twitter: http://twitter.com/hardstoplucas Facebook: https://www.facebook.com/hardstoplucas/Tumblr: https://hardstoplucas1.tumblr.com/TikTok: https://m.tiktok.com/h5/share/usr/64641059665756160.html","Yeah, I'm a LOUDMOUTHBusiness email: TLDfluent@gmail.comInstagram: @hardstop.lucasTwitter/Facebook/Snapchat/TikTok: @hardstoplucas  Tumblr: @hardstoplucas1","","ELQmwf0uUVQ"
uQjBZLBk4TQ,"I walked into the wrong restaurant.","UCI1XS_GkLGDOgf8YLaaXNRA","CalebCity","23","195.0","https://i.ytimg.com/vi/uQjBZLBk4TQ/default.jpg","comedy|calebcity|Lenarr|when you walk into the wrong restaurant|but you already sat down|so you want dont want to jusat leave and look stupid","When you walk into the wrong restaurant and the prices are mad high, but you already sat down so you don't want to just leave and look stupid.Feat. Lenarr - https://www.youtube.com/channel/UCrA2bqOHwjX1DxgP9CaVJzwMusicDancin all jolly like - TEK.LUN","","","ELQmwf0uUVQ"
ME3kc6zWl58,"Club Among Us","UCrA2bqOHwjX1DxgP9CaVJzw","Lenarr Young","23","234.0","https://i.ytimg.com/vi/ME3kc6zWl58/default.jpg","Lenarr|Lenarr Young|lennarr|lenarryoung|lenar|lanar|lanarr|young|skit|skits|comedy|creator|funny","Follow me on:Twitter: https://twitter.com/lenarr_?lang=enInstagram: https://www.instagram.com/lenarr___/?hl=en","Im here to make you laugh / business email - Lenarr@viralnation.comInstagram - Lenarr___Twitter - Lenarr_ZD5GVJ","","ELQmwf0uUVQ"
g_4RbM8j5Hk,"All black infinity forces","UCrA2bqOHwjX1DxgP9CaVJzw","Lenarr Young","23","639.0","https://i.ytimg.com/vi/g_4RbM8j5Hk/default.jpg","Lenarr|Lenarr Young|lennarr|lenarryoung|lenar|young|skit|skits|comedy|creator|funny|2019","People who wear black air forces cannot be trusted, this man right here got infinity stones in his....Instagram: https://www.instagram.com/lenarr___/?hl=en","Im here to make you laugh / business email - Lenarr@viralnation.comInstagram - Lenarr___Twitter - Lenarr_ZD5GVJ","","ELQmwf0uUVQ"
6AHxjNULeKY,"Rappers snitch on themselves in songs","UCWiY6fYdxuEe78r-0uFCnhA","LongBeachGriffy","24","91.0","https://i.ytimg.com/vi/6AHxjNULeKY/default.jpg","[none]","Thank you for watching! Follow my socials if you want :) Www.instagram.com/longbeach_griffy Www.facebook.com/longbeachgriffy Www.twitter.com/longbeachgriffy","I haven't decided yet, give me some time okay, I am new to this.","","ELQmwf0uUVQ"
WhkEMX8QUS8,"When Future and Lil Yachty was recording Pardon Me","UCrA2bqOHwjX1DxgP9CaVJzw","Lenarr Young","23","132.0","https://i.ytimg.com/vi/WhkEMX8QUS8/default.jpg","Lenarr|Lenarr Young|lennarr|lenarryoung|lenar|lanar|lanarr|young|skits|comedy|creator|funny|lil yachty|future|pardon me|lil yachty future|lil yachty pardon me|future pardon me|lil yachty future pardon me","Follow me on:Twitter: https://twitter.com/lenarr_?lang=enInstagram: https://www.instagram.com/lenarr___/?hl=enSong - https://youtu.be/W7VK4DUHvKU","Im here to make you laugh / business email - Lenarr@viralnation.comInstagram - Lenarr___Twitter - Lenarr_ZD5GVJ","","ELQmwf0uUVQ"
eFe6N-i4JWw,"When nobody wants to play the game that you want to play","UCrA2bqOHwjX1DxgP9CaVJzw","Lenarr Young","23","154.0","https://i.ytimg.com/vi/eFe6N-i4JWw/default.jpg","Lenarr|Lenarr Young|lennarr|lenarryoung|lenar|lanar|lanarr|young|skit|skits|comedy|creator|funny","Follow me on:Twitter: https://twitter.com/lenarr_?lang=enInstagram: https://www.instagram.com/lenarr___/?hl=en","Im here to make you laugh / business email - Lenarr@viralnation.comInstagram - Lenarr___Twitter - Lenarr_ZD5GVJ","","ELQmwf0uUVQ"
iLRWbeeNeVw,"Teacher Embarrasses Poor Student In Front Of Class","UCpB959t8iPrxQWj7G6n0ctQ","SSSniperWolf","24","635.0","https://i.ytimg.com/vi/iLRWbeeNeVw/default.jpg","sssniperwolf|sniper wolf|reacting|reaction|funny|teacher|student","Teacher Embarrasses Poor Student In Front Of Class Leave a Like if you enjoyed! Watch the last vid https://youtu.be/9dC7Rd3Rpu4  Watch the last vid https://youtu.be/KtKmeYtNHks Subscribe to join the Wolf Pack and enable notifications! http://bit.ly/SubSSSniperWolf Check out Dhar Mann https://www.youtube.com/c/DharMannOfficialTikTok: http://tiktok.com/@sssniperwolfInstagram: http://instagram.com/sssniperwolfTwitter: http://www.twitter.com/sssniperwolfFacebook: https://www.facebook.com/sssniperwolfOfficial Merch: https://ogwolfpack.com/","Hi I'm SSSniperWolf! You can call me Lia, sniper wolf or sssniperwolf! I love gaming and making videos! Subscribe to join the Wolfpack","sssniperwolf sniper wolf reaction reacting funny funniest fortnite","ELQmwf0uUVQ"
FN9SOnx49pI,"When a Transgender gets pulled over","UCWiY6fYdxuEe78r-0uFCnhA","LongBeachGriffy","24","115.0","https://i.ytimg.com/vi/FN9SOnx49pI/default.jpg","[none]","Thank You for watching :)IG: longbeach_griffyFB: longbeachgriffyTwitter: longbeachgriffy","I haven't decided yet, give me some time okay, I am new to this.","","ELQmwf0uUVQ"
pN83z-8loHw,"Girl Dumps Man for Being Too Short and Regrets It","UCq6VFHwMzcMXbuKyG7SQYIg","penguinz0","24","685.0","https://i.ytimg.com/vi/pN83z-8loHw/default.jpg","[none]","This is the greatest height of All Time","Email:     Cr1TiKaLContact@gmail.com (anyone can email me about anything)                admin@theofficialfour.comTwitter:     https://twitter.com/MoistCr1TiKaLInstagram:    https://www.instagram.com/bigmoistcr1tikal/?hl=enTwitch: https://www.twitch.tv/moistcr1tikalI don't have any other public accounts.","Cr1TiKaL Gears of War Call Duty Battlefield Bad Company Fun Tactics","ELQmwf0uUVQ"
ZrS9vWPSQEU,"MrBEAST BURGER Full Menu Challenge **DESTROYED**","UCd1fLoVFooPeWqCEYVUJZqg","Matt Stonie","24","482.0","https://i.ytimg.com/vi/ZrS9vWPSQEU/default.jpg","Matt Stonie|Megatoad|Competitive Eating|Food Challenge|Speed Eating|Eating Challenge","Good Video? You know what to do :)A bit back Mr. Beast releases his very own restaurant, Mr. Beast Burgers!! Unfortunately I was out of town for the launch and couldn't get my hands on them sooner, but I had to try them out!Full Order =1 Beast-Style Burger (triple + extra patty)1 Chris-Style Burger (extra patty)1 Chandler-Style Burger (extra patty)1 Chicken Tender Sandwich1 Nashville Hot Chicken Sandwich1 Karl's Grilled Cheese1 Seasoned Fries1 Beast-Style Fries6 Cookies1 Water Bottle1 Can of Coke (diet)ENJOY!!!Follow me on Social!FACEBOOK - https://www.facebook.com/mattmegatoadstonieTWITTER - https://www.twitter.com/mattstonieINSTAGRAM - https://www.instagram.com/matt_stonieTWITCH - https://www.twitch.tv/mattstonieMERCH - http://www.mattstoniemerch.comMailing Address:P.O. Box 22210San Jose, CA 95151Credits:Music & Sounds from VideoCo Pilot's Proscores & Design Studio FX CD/DVDsMusic from Epidemic SoundHot Coffee by Ghostrifter Official https://soundcloud.com/ghostrifter-of...Creative Commons — Attribution-ShareAlike 3.0 Unported — CC BY-SA 3.0 http://creativecommons.org/licenses/b...Music promoted by Audio Library https://youtu.be/Y30VQPGtxOs","I record myself eating food and upload it here.New Videos Kinda Every Week!-------------","Matt Stonie Megatoad Competitive Eating Speed eating MLE Major Leauge Eating Professional Eating Funny Food Challenge","ELQmwf0uUVQ"
YPsi2wLU2xw,"When the teacher can't pronounce your name Lenarr Young Hilarious Reaction","UCRF76qxoXEJbTn3DqJnUl1g","Keepitabean Reacts","20","314.0","https://i.ytimg.com/vi/YPsi2wLU2xw/default.jpg","#Lenarr|#funny|#comedy|#skits|#reaction|#reaction videos","Make Sure Yall Like the Video and Sub to the Channel it would make my day GOOD LOOKS!Original Video- https://www.youtube.com/watch?v=ELQmwf0uUVQ&t=2s&ab_channel=LenarrYoung","I React to Anything ","","ELQmwf0uUVQ"
MrhVaZu57bU,"What You Say VS What You WANT to Say to Parents","UCyoEZ7icpGsUlki08Is8v9g","loveliveserve","24","888.0","https://i.ytimg.com/vi/MrhVaZu57bU/default.jpg","Loveliveserve|lls|love live serve|Noah boat|rhino|comedy|skit|music|rapping|reactions|hip hop|rap|parody|prank|rappers|funny songs|blasting music in the library|playing music in library|library prank|types of people|blasting inappropriate music|types of aux cord users|zeze|blueface|airpods|types of rappers|library pranks","Rise of the Kings is the best war strategy mobile game with fantasy elements, grounded in the Middle Ages and a massive-multiplayer online game. Since the day I started I playing I never stopped! What are you waiting for? Download it now: https://app.adjust.com/9wb43qj. You can also get a free gift pack(worths $99.99) with the code: SDGBY6B38RSubscribe to LoveLiveServe: https://www.youtube.com/user/loveliveserve?sub_confirmation=1WATCH OUR VLOGS HERE: https://www.youtube.com/channel/UCyLLL4Al34gr3XH2_h4db5g#loveliveserveGET THE NEW LLS MERCH BELOW!http://bit.ly/LLSMerchFOLLOW US ON SOCIAL MEDIA:Noah Boat:⇨IG- https://www.instagram.com/noahboat_⇨Twitter- https://twitter.com/noahboat_Rhino:⇨IG- https://www.instagram.com/rhino_⇨Twitter- https://twitter.com/ryaburtonLoveLiveServe:⇨IG- https://www.instagram.com/loveliveserve⇨TikTok- https://www.tiktok.com/@loveliveserve⇨FB- https://www.facebook.com/loveliveservevideosFor business contact, email us at brian.sokolik@authenticm.comAbout LoveLiveServe:Wuz Goodie! Welcome to LoveLiveServe! We go by Noah Boat & Rhino and we have a passion for making relatable and entertaining video content. We produce a variety of entertaining material on this channel that is suitable for a wide range of audiences. We look forward to creating a lot more entertaining videos for you guys!What You Say VS What You WANT to Say to Parentshttps://youtu.be/MrhVaZu57bULoveLiveServehttps://www.youtube.com/user/loveliveserve","Wuz Goodie! Welcome to LoveLiveServe! We go by Rhino & Noah Boat. We have a passion for making relatable and entertaining video content. We produce a variety of material on this channel that is suitable for a wide range of audiences. We look forward to creating a lot more videos for you guys!For business contact, email us at brian.sokolik@authenticm.com","Loveliveserve lls love live serve Noah boat rhino comedy skit music rapping reactions hip hop rap parody prank rappers funny songs blasting music in library playing music in library library prank","ELQmwf0uUVQ"
oQvAPrQOJdM,"I pretended to be a Mom on Facebook groups AGAIN...","UCSHff31HSK0VVPOzGTz8dPg","Duncanyounot","23","561.0","https://i.ytimg.com/vi/oQvAPrQOJdM/default.jpg","DuncanYouNot|Duncan Joseph|Duncan Angiuli|TikTok|Vegan Teacher|Dance Moms|Food Network|Master Chef|Top Chef|Comedy","EDUCATIONAL PURPOSES ONLY!!! LOLFor new videos, make sure you subscribe: http://bit.ly/DuncanYouNotFollow My Socials:Instagram.com/duncanyounotTwitter.com/duncanyounotTiktok.com/@duncanyounotSnap: @dunkthedoodbusiness email - teamduncan@select.co","Hi! I'm from TikTok. I wore some wigs and now people seem to like me.","DuncanYouNot Duncan Joseph Duncan Angiuli TikTok Vegan Teacher Dance Moms Food Network Comedy","ELQmwf0uUVQ"
b1qjzYhp1WQ,"Im the best Brawlhalla player ever.... w/ Typical Gamer #sponsored","UCrA2bqOHwjX1DxgP9CaVJzw","Lenarr Young","23","423.0","https://i.ytimg.com/vi/b1qjzYhp1WQ/default.jpg","Lenarr|Lenarr Young|lennarr|lenarryoung|lenar|lanar|lanarr|young|skit|skits|comedy|creator|funny","Typical Gamer and I battling it out in Brawlhalla!Download Brawlhalla on the Google Play Store in the next 10 days with the link below and earn 5 Google Play Points, which are rewards points you can redeem for in-game items or Play Credit.: https://gplay.page.link/ez99#GooglePlayGamer #Brawlhalla #Sponsored Follow me on:Twitter: https://twitter.com/lenarr_?lang=enInstagram: https://www.instagram.com/lenarr___/?hl=en","Im here to make you laugh / business email - Lenarr@viralnation.comInstagram - Lenarr___Twitter - Lenarr_ZD5GVJ","","ELQmwf0uUVQ"
oHnBKQa9xNA,"Among Us But Imposter Is A God","UCMYevdNaWmPbuIB0PdPc9ZQ","ZMDE Animations","20","484.0","https://i.ytimg.com/vi/oHnBKQa9xNA/default.jpg","zmde|zmde animations|among us|there is an imposter among us|among us memes|how to be the imposter|among us short film|among us tik tok|among us gameplay|imposter iq|among us iq","Subscribe for new videos every week! https://www.youtube.com/user/zenmdeproductions?sub_confirmation=1Follow me @https://Instagram.com/zmdeanimationshttps://twitter.com/zmdeanimations- A new Among Us video and this time as Imposter I make some godly plays!    Watch your favourite story by clicking a title below:    All ZMDE Stories (in order): https://www.youtube.com/playlist?list=PLIJLxmM3MViV_Aa_7UvZwlAGOBTW6HQNiAbout ZMDE:ZMDE Animations is an online web series where you'll find Horror Stories, Funny Stories, Inspiring Stories, True Stories, History Stories, Unsolved Mysteries, & more!#animated #animatedshortfilms #zmde","Subscribe for Animated Story Time! In our Web Series, you'll find Horror Stories, Funny Stories, Inspiring Stories, True Stories, History Stories, Unsolved Mysteries, & more! Business Inquiries: hello@zmde.caDISCLAIMER: The use of animation and animated characters is only as an intentional artistic style and is not reflective of the intended appropriate audience of this channel. Content may frequently touch on mature language, stories, themes or subjects. ALL content on this channel is not directed towards or intended for audiences under the age of 13.","Animation Animated story time storytime story time animated stories animated life true stories short film animated short film","ELQmwf0uUVQ"
jny0fATDVBo,"How Lebron was when he found out James Harden Went to the Nets","UC4G10tk3AHFuyMIuD3rHOBA","RDCworld1","22","81.0","https://i.ytimg.com/vi/jny0fATDVBo/default.jpg","[none]","We know lebron was hot at this news man they always got this man going up against every top person in the world together 🤣🤣Follow our social media:@rdcworld1@supremedreams_1@23_is_leland@dylanpatel4@l0veandpeac3@ive_ben_jammin@cleanuniform@playthatjohn","RDCworld1 is all about making our fans laugh. We provide entertainment through skits, vlogs, short films, and more. Therefore, if you come across this channel please join our world and leave feedback!Anticipating rain, I can't make the same mistakes again.We hope to make it to 5,000,000 subscribers now! And even quicker than it took to get to 3,000,000! Thank you for all of y'alls support!After reaching 1 million subscribers I feel like a Great mission has been accomplished, but when one mission ends another begins...Check out our shop! https://www.rdcworld1.com/shopRDCworldPO Box 6124Round Rock, TX 78683","Rdcworld1 Comedy Vlogs Skits Entertainment Rdcworld Anime SupremeDreams RDC","ELQmwf0uUVQ"
ndc3-JMVYAw,"Day in the life of a Discord Mod","UCHyIvHeTyU2ALxwX4vm_Y4w","Ryan The Leader","23","515.0","https://i.ytimg.com/vi/ndc3-JMVYAw/default.jpg","Ryan Leader|Ryantheleader|ryan the leader|discord mod|day in the life of a discord mod|softwilly discord|discord moderator|discord moderators|what discord mods are like|discord mods|discord memes|gamer memes|discord mod memes|discord skit|what discord moderators are like|how to be a discord mod|a life of a discord mod|softwilly discord edit|music discord|edit a video in discord|make a song in discord","Video Sponsored by Ridge Wallet:https://www.ridge.com/LEADERUse Code “LEADER” for 10% off your orderWe take a look at Murray, who's been a discord moderator for the last 8 months of his life. He spends his days looking at memes, telling people what to do, and banning people out of the server that he doesn't agree with. JOIN MY DISCORD SERVER & BECOME A MOD: https://discord.gg/3vnS5p5PUT YOUR NAME AT THE END OF THE VIDEOS:https://www.Patreon.com/ryantheleaderCAST:Server Owner: @Softwilly Cameraman:  @cer spence MY PODCAST: YOUTUBE: https://www.youtube.com/channel/UCpSbtmVBM4-aSFVA8ZFT1RQAPPLE: https://podcasts.apple.com/us/podcast/sad-lil-sweethearts/id1494803435?uo=4SPOTIFY: https://open.spotify.com/show/1adRunkbBhquk0dOlKUCQ2Secret message: Comment How does anyone not know what poggers is? thats not poggers. if you find this...FOLLOW MEH:Insta: @ryantheleaderTwitter: @ryantheleaderSnap: FloydSmith69also subscribe to me if you have time....","videos I make for gigglesif u subscribe a little boy gets a hometwitter: ryantheleader_insta: ryantheleadersnap: Floydsmith69 Hit the 2019 goal of 10,000 subs and that makes me feel so god damn special, thank you to everyone. :)100,000 subs end of 2020 is the goal - Written December 1st, 2019.500,000 is the goal now for the end of 2020. - Written April 4th, 2020.(Didn't quite hit the goal for 2020 of 500k, but we came close 450,000)1,000,000 subs end of 2021 is the goal. - Written. January 4th, 2021","Ryan The Leader ryan leader ryantheleader Ryan cherdleys cherdleys ryantheleader ryantheleader simp ryan the leader step bro","ELQmwf0uUVQ"
