video_id,title,channelId,channelTitle,categoryId,duration,thumbnail_link,tags,description,channel_desc,channel_keywords,related_vid_id
z-FDQ21a8lY,"Why Mini Ladd Left And Doesn't Play With Vanoss And His Old Friends","UCJ4PxMpsg7fwckW8sMZa5bg","Hi","22","471.0","https://i.ytimg.com/vi/z-FDQ21a8lY/default.jpg","Mini Ladd|Terroriser|VanossGaming|Banana Bus Squad|H2O Delirious|I AM WILDCAT|Daithi De Nogla|Moo Snuckel|BasicallyIDoWrk|Fourzer0seven|BigJigglyPanda|Ohmwrecker|Lui Calibre|Vanoss and Friends|Vanoss and Squad","Mini Ladd (Craig) and Terroriser (Brian) explain why Craig is not playing with Vanoss and left the group. 1. On 27th of August, Craig tweeted regarding to this situation. He also posted it on Instagram.- https://twitter.com/MiniLaddd/status/1166472032994750464- https://www.instagram.com/p/B1r3EU6lQoK/?igshid=1bheg2hbkes9h2. Then, Brian responded with:- https://twitter.com/Terroriser/status/11664882200931778573. Craig reply:- https://twitter.com/MiniLaddd/status/11664900158425210894. Brian reply:- https://twitter.com/Terroriser/status/11664947565761863685. Later, Brian give full response and statement:- https://www.twitlonger.com/show/n_1sr0a04Some of you may have seen some of the video above from CALY X but not in chronological order, which may confused who doesn't follow the story. So, I created this video in chronological order and want all of you see this thing clearly from early on that caused the feud between both of them. Also, credit to E.R.S. Productions for the Mini Ladd Meme Stream #12 clip.Source all the clip in video above:Mini Ladd Mario Kart 8 Live Stream:- https://clips.twitch.tv/ExquisiteResourcefulChinchillaThunBeastMini Ladd Meme Stream #12:- https://www.youtube.com/watch?v=W9fPVJqn724Terroriser Minecraft Live Stream #3:- 09.10 and 21:44 - https://www.youtube.com/watch?v=7a9cTScBEG8&list=PL6eblKObXd5xHfHXivSCUXkUEYtTRXoXk&index=3Terroriser Mincraft Live Stream BUILDING A NEW CAKE SHOP AND FINISHING MY HOUSE!:- 1:56:41- https://www.youtube.com/watch?v=hrieSUdvYAM","","","_WfGgl9Q1JQ"
HeZtOmiJGOQ,"RATING YOUTUBER APOLOGY VIDEOS","UC-lHJZR3Gqxm24_Vd_AJ5Yw","PewDiePie","24","1594.0","https://i.ytimg.com/vi/HeZtOmiJGOQ/default.jpg","SATIRE|apology video|my response|pewdiepie|logan paul|laura lee|tmartin","Rating my favorite youtuber apology videos. Pewdiepie, logan paul , laura lee, tmarting apology videoBECOME SPONSOR: https://youtube.com/pewdiepie/join 🙇MERCH: https://represent.com/pewdiepie 🔥SUBMIT MEMES: https://www.reddit.com/r/PewdiepieSubmissions/ ʚ(•__AD| Shop my headphones: http://rzr.to/edgar__TSUKI: https://tsuki-co-uk.myshopify.com__:::::::My Setup:::::::: (Affiliate links)Chair:: ONLY 399 !USA & Asia: https://usa.clutchchairz.com/product/pewdiepie-edition-throttle-series/Europe: https://europe.clutchchairz.com/en/product/throttle-series-pewdiepie-edition/Canada: https://canada.clutchchairz.com/product/throttle-series-pewdiepie-edition/Elgato green screen: http://e.lga.to/PewDiePie (Affiliate)__:::::::Check out: ::::::::http://store.steampowered.com/app/703840/Animal_Super_Squad/(A game I helped make and affiliated with)__Outro:Animation: https://www.youtube.com/user/jae55555Song: https://www.youtube.com/channel/UC3e8EMTOn4g6ZSKggHTnNng","I make videos.","pewdiepie pewds gaming felix arvid ulf felix kjellberg","_WfGgl9Q1JQ"
gMiPe0oD418,"The Rollercoaster Rise and Fall of Mini Ladd (2011 - 2021)","UCuF49lP5gkkw5L8HK3H6GJg","SunnyV2","24","1397.0","https://i.ytimg.com/vi/gMiPe0oD418/default.jpg","Mini Ladd|Miniladd|mini ladd exposed|mini ladd vanoss fight|Mini Ladd terroriser|Mini Ladd Downfall|Mini Ladd Prison mate luke|mini ladd diesel patches|vanoss gaming crew|where are they now?|a brief history|documentary|youtube documentary|where is|Biography|narration|video essay|twitch|youtube|entertainment|education|joon the king|fredrik knudsen|down the rabbit hole|no swearing|family friendly|sunnyv2|sunnyv2 downfall|downfall|demise|rise and fall","After 9 years of creating content on the YouTube platform, Mini Ladd AKA Craig Thompson has seen influence dissolve in his hands over the last year. From the crumbling of the Vanoss gaming crew to the storm of a scenario coming out of twitter over the last few months - Mini Ladd has faced many a challenge in recent times. But it wasn't always like this, Mini Ladd was once in a king in the YouTube gaming genre, seemingly untouchable by any external force. This video will show that was not truly the case, and that a downfall can happen significantly quicker than a rise. This is the story of Mini Ladd AKA Craig Thompson.Thank you guys for watching, like and sub if you enjoyed, Sunny XO ❤Twitter - https://twitter.com/v2_sunnyAll of my gear (camera and computer) is listed below - Purchasing any of the items below through the links will help support the channel, or feel free to just check out what I use :)Microphone (used in voice overs / documentaries) - https://amzn.to/3ozafuSMicrophone (used in gaming videos) - https://amzn.to/2K3nIMGCamera - https://amzn.to/2JOCzKTTripod - https://amzn.to/382AP9hMonitor 1 - https://amzn.to/33STi6zMonitor 2 - https://amzn.to/2K3xePVKeyboard - https://amzn.to/2VZ85Z2Mouse - https://amzn.to/37G3P6cHeadphones - https://amzn.to/3qJykRMMouse pad - https://amzn.to/3qIYy6DWebcam - https://amzn.to/3qCOigiSpeakers - https://amzn.to/3gv1AXB","You're not allowed to stalk me to this extent without being subscribed ;)","minecraft a brief history documentary youtube documentary rise and fall where is Biography narration video essay twitch youtube entertainment education no swearing family friendly sunnyv2 youtube documentaries documentaries","_WfGgl9Q1JQ"
PKtnafFtfEo,"Youtube Rewind 2020, Thank God It's Over","UCX6OQ3DkcsbYNE6H8uQQuVA","MrBeast","24","391.0","https://i.ytimg.com/vi/PKtnafFtfEo/default.jpg","[none]","This is what Youtube Rewind would look like if it was made by creators lolSUBSCRIBE TO THESE SMALL CHANNELS NOW PLEASE!!!NalterDeeds: https://www.youtube.com/user/nalterdeedsAmelia and Bridie: https://www.youtube.com/channel/UCrSTjIIkIBHL7VDx7utP56wSoyan Osman: https://www.youtube.com/channel/UCuPGqvywieBAqvbkMSF4CNQThank you to these 3 boys for editing this video! I LOVE YOU GUYS AND AM FOREVER GRATEFUL!FlyingKitty: https://www.youtube.com/channel/UCYQT13AtrJC0gsM1far_zJgDolan Dark: https://www.youtube.com/channel/UCI5qWAMf5PHLNcM13R8pfiQGrandayy: https://www.youtube.com/channel/UCa6TeYZ2DlueFRne5DyAnygAll creator sub data from SocialBlade https://socialblade.com/╔═╦╗╔╦╗╔═╦═╦╦╦╦╗╔═╗║╚╣║║║╚╣╚╣╔╣╔╣║╚╣═╣ ╠╗║╚╝║║╠╗║╚╣║║║║║═╣╚═╩══╩═╩═╩═╩╝╚╩═╩═╝----------------------------------------------------------------follow all of these or i will kick you• Facebook - https://www.facebook.com/MrBeast6000/• Twitter - https://twitter.com/MrBeastYT•  Instagram - https://www.instagram.com/mrbeast--------------------------------------------------------------------","Accomplishments- Raised $20,000,000 To Plant 20,000,000 Trees- Given millions to charity- Donated over 100 cars lol- Gave away a private island- Given away over 100 ps4s lol- Gave away 1 million dollars in one video - Counted to 100k- Read the Dictionary- Watched Dance Till You're Dead For 10 Hours- Read Bee Movie Script- Read Longest English Word- Watched Paint Dry- Ubering Across America- Watched It's Every Day Bro For 10 Hours- Ran a marathon in the world's largest shoes- Adopted every dog in a shelterYou get the point haha*Do not email me asking for money, I give away money because it makes me happy :)","mrbeast6000 beast mrbeast Mr.Beast mr","_WfGgl9Q1JQ"
crKohKpVoAM,"I wore Rock Lee's leg Weights for TWO WEEKS, did I get faster???","UCVS89U86PwqzNkK2qYNbk5A","Allen Pan - Sufficiently Advanced","28","1123.0","https://i.ytimg.com/vi/crKohKpVoAM/default.jpg","naruto|rock lee|rock lee takes off his weights|rock lee vs gaara|allen pan|sufficiently advanced|anime|weighted clothing|weighted clothing training|weighted clothing goku|goku takes off weighted clothing|hunter x hunter|505 agility test|illinois agility test","Thanks to DeltaTrainer for sponsoring today’s video! Viewers of my channel will get a 14-day free trial and pay only $59/mo instead of $100/mo if you sign up by February 1st. Visit https://bit.ly/train_like_allen to learn more!I've been waiting 17 years for the chance to make Rock Lee's leg weights so I can finally answer the question: would they actually make me faster?Thanks for eating my sandwiches @Kyle Hill !You never did answer my bra question @Xyla Foxlin ??Akeboshi Wind remix:https://youtu.be/4RiTpQz68mAExplosion footage from here:https://youtu.be/KskBRHAlmDgHelp Me Make More Awesome Stuff!https://www.patreon.com/sufficientlyadvancedSubscribe!http://goo.gl/xZvS5s Follow Sufficiently Advanced!https://twitter.com/AnyTechnologyhttps://www.facebook.com/sufficientlyadvancedhttps://www.instagram.com/sufficientlyadvanced/","Any sufficiently advanced technology is indistinguishable from magic. -Arthur C. ClarkeMy name's Allen, I try to make pretend things into real things!I get tons of emails, so I probably won't respond if you send one asking for build advice :( Sorry!","allen pan sufficiently advanced how to diy engineering tech science mythbusters anime inventions","_WfGgl9Q1JQ"
G70-Bp6kHGU,"The Accidental 400mg Edible","UCJGgP4txIUr_7JTDvOGVQrA","Ted Nivison","23","994.0","https://i.ytimg.com/vi/G70-Bp6kHGU/default.jpg","The Accidental 400mg Edible|The|Accidental|400mg|Edible|Ted|Nivison|Story|Funny Story|Storytime|TedNivison|Ted Nivison","Ted accidentally ate a 400mg Edible. Listen to his tell-all here, its funny. ►Instagram: https://www.instagram.com/TedNivison►Twitch: https://www.twitch.tv/TedNivison►Follow my Twitter: https://twitter.com/TedNivison►Discord: https://discord.gg/c3qMbDMVIDEO CREDITS:Misfits Podcast: https://www.youtube.com/channel/UC6OUstIo-qXiJzcsJ0toz-ACooper: https://www.youtube.com/channel/UCC8sUDdQ8qKcPVcuwhouLewRoyalty Free Music by http://audiomicro.com/royalty-free-musicSound Effects by http://audiomicro.com/sound-effectsAnd:http://www.epidemicsound.com/About Ted Nivison / JehBerDeh: Ted Nivison is a YouTube entertainer/Filmmaker/voice actor/comedian based in New York. He creates comedy videos on YouTube making commentary videos about various funny topics and poking fun at ridiculous people on Facebook, YouTube, and Instagram. He's got some sweet moves as well.","Ted Nivison is a YouTube entertainer / Filmmaker / voice actor / comedian based in New York. He creates comedy videos on YouTube making commentary about various funny topics and poking fun at ridiculous people on Facebook, YouTube, and instagram. He's got some sweet moves as well.","Ted Nivison Ted Nivison Nivision cringe Cooking With Ted Fiverr Filth Fiverr Vlog Commentary Instagram Comedians Comedy","_WfGgl9Q1JQ"
xz2JyPgUmH4,"Steven Seagal: Certified Tough Guy - JonTron","UCdJdEguB1F1CiYe7OEi3SBg","JonTronShow","23","1210.0","https://i.ytimg.com/vi/xz2JyPgUmH4/default.jpg","[none]","Install Raid for Free ✅ IOS: https://clik.cc/9CX36 ✅ ANDROID: https://clik.cc/9Ku8q ✅ PC: https://clik.cc/b64yV and get a special starter pack 💥 Available only for the next 30 days!--Follow JonTron Here:Instagram: http://www.Instagram.com/JonTronShowTwitter: http://www.Twitter.com/JonTronShowBusiness Inquiries:jontron(at)ellifyagency.com--Crew:Jon Jafari - Director/Editor Sergio Torres - Director of Photography/Line ProducerMike Butler - Gaffer/PhotographyLewis Bown - Editor/WriterCharlotte Jafari - Production Designer","Welcome to JonTron! Hopefully laugh!","jontron funny comedy review h3h3 ethan klein hila klein h3h3 podcast weird commercials","_WfGgl9Q1JQ"
WNOgyKJlh6w,"MARKIPLIER IS A QUEEN!! | Sort the Court UPDATED AGAIN","UC7_YxT-KID8kRbqZo7MyscQ","Markiplier","20","4703.0","https://i.ytimg.com/vi/WNOgyKJlh6w/default.jpg","markiplier|sort the court|sort the court game|yes or no|choices|endings|playthrough|walkthrough|choose your own adventure|gameplay|gaming|sort the court update|sort the court markiplier","Sort the Court received a HUGE update with new visitors, new kings, and a true ending! Let's see what we can mess up this time!CLICK HERE TO JOIN ► https://www.youtube.com/markiplier/joinSubscribe Today! ► http://bit.ly/MarkiplierMy Clothing Brand ► https://cloakbrand.com/Play Sort the Court ► http://gamejolt.com/games/sort-the-court/117326Check Out My WEBSITE!! ► https://markiplier.com/Awesome Games Playlist ► https://www.youtube.com/playlist?list=PL3tRBEVW0hiDAf0LeFLFH8S83JWBjvtqEScary Games Playlist ► https://www.youtube.com/playlist?list=PL3tRBEVW0hiBSFOFhTC5wt75P2BES0rAoFollow my Instagram ► http://instagram.com/markiplierFollow me on Twitter ► https://twitter.com/markiplierLike me on Facebook ► https://www.facebook.com/markiplierJoin us on Reddit! ► https://www.reddit.com/r/Markiplier/Horror Outro ► https://soundcloud.com/shurkofficial/hauntedHappy Outro ► https://soundcloud.com/hielia/minimusicman-crazy-la-paint","Welcome to Markiplier! Here you'll find some hilarious gaming videos, original comedy sketches, animated parodies, and other bits of entertainment! If this sounds like your kind of channel then please Subscribe Today!Total Charity Raised ▶ $3,000,000+","markiplier comedy gaming funny videos funny moments sketch comedy laughing lets play challenge videos hilarious challenges sketches","_WfGgl9Q1JQ"
1C0SckVqH2g,"My Response","UCN5xN8gIljvWYnsj06V8WbQ","Pyrocynical","23","1353.0","https://i.ytimg.com/vi/1C0SckVqH2g/default.jpg","[none]","My Original Statement: https://www.reddit.com/r/pyrocynical/comments/jrsu4v/addressing_the_false_allegations/?utm_source=share&utm_medium=web2x&context=3Google Doc: https://docs.google.com/document/d/13maO9zrhJK_vJD2Nxa3Vg2EjN4jIFWsnJt3ArE08v70/edit","Only The Most Popular Trends Videos, Kid Friendly / Family Friendly no Swearing Content. Subscribe for good luck forever :smile:","pyrocynical pyro","_WfGgl9Q1JQ"
k4v6slOxxXs,"Minecraft Speedrunner VS 4 Hunters FINALE REMATCH","UCTkXRDQl0luXxVQrRQvWS6w","Dream","20","2988.0","https://i.ytimg.com/vi/k4v6slOxxXs/default.jpg","Dream Minecraft|dream Minecraft youtube|minecraft|dream|Speedrunner vs 3 hunters|Speedrunner vs 4 hunters|Speedrunner vs someone trying to stop them|Beating Minecraft but my friend tries to stop me|Minecraft but water rises every minute|minecraft but lava rises every minute|minecraft but challenge|minecraft challenge|challenge|minecraft 1.14|beating minecraft|rematch|finale|finale rematch|grand finale|grand|four hunters|4 hunters","Minecraft Speedrunner VS 4 Hunters FINALE REMATCH. You asked for it. This was insane.Patreon (Plugin): https://www.patreon.com/DreamWasTakenFollow my socials:➽ Twitter - @dreamwastaken➽ Instagram - @dreamwastaken➽ Snapchat - @dreampublicMerch: https://www.dream.shopBadBoyHalo:  @BadBoyHalo George:  @GeorgeNotFound Sapnap:  @Sapnap Antfrost: @Antfrost We decided to call this series Minecraft Manhunt. This video is a different rendition of it, where there are FOUR hunters instead of just one.This is a new Minecraft but, 1.16 challenge that we have decided to try. I try to beat the game, while my friend George AND my friend Sapnap AND my friend BadBoyHalo AND my friend Antfrost tries to prevent me from doing it. It's a race, and it's super intense and we had a lot of laughs. I love doing these challenges.If this video gets 1,000,000 likes we'll do something else.Not Minecraft, But Water Rises or Minecraft, But Lava Rises, or any other but challenge like that. This is a speed run / speed runner of Minecraft against a killer / assassin#MinecraftManhunt","Minecraft stuff, yes, my IGN is Dream","dream minecraft dream minecraft channel dream youtube dreamonpvp minecraft dreamaf minecraft dreamxd minecraft dream ign minecraft dream ign dream skippy dream badboyhalo skeppy badboyhalo Pewdiepie dream hypixel dream munchymc dream gapple gapple.io munchymc.com hypixel.net minecraft pop minecraft trolling minecraft troll pewdiepie minecraft minecraft bedwars","_WfGgl9Q1JQ"
bLzKCcuIitg,"Mini Ladd Just ENDED His Own Career... **shocking video**","UCZSVvDqRX9_b377Jta8eA_Q","Kavos","24","947.0","https://i.ytimg.com/vi/bLzKCcuIitg/default.jpg","mini ladd|mini ladd exposed|mini ladd apology|mini ladd halley|mini ladd apology reaction|mini ladd rant|mini lad|mini|ladd|mini ladd apology video|kavos|mini ladd video|mini ladd drama|mini lad exposed|mini lad drama|mini lad apology|do not forgive mini lad|do not forgive mini ladd|mini lad apology video|mini ladd allegations|what did mini ladd do|what did miniladd do|what did mini lad do","Mini Ladd Just ENDED His Own Career... **shocking video**♦Instagram: https://www.instagram.com/kavos.yt/♦Twitter: https://twitter.com/KavosYT★ Business Email: Kavos@colossalinfluence.com","YouTube Commentary covering all the latest drama unfolding on YouTube and social media. Subscribe  to stay up to date with everything going on on Youtube and social mediaIf you have tips or suggestions for something you would like me to cover please Tweet @KavosYT with the hashtag: #KavosYT","Youtube youtube news youtube drama youtube drama channels youtube drama 2018 youtube drama news satire pop culture drama twitch instagram team 10 twitter snapchat best drama 2018 drama 2018 why I left team 10 kavos kavos channel best of twitch drama channels funny lol videos funny videos instagram videos rant why I left youtube career career best youtuber","_WfGgl9Q1JQ"
w2n4Y8gZ9iE,"OPENING CHRISTMAS GIFTS FROM MY SUBSCRIBERS!","UCQiojTHkAvFvdCSajklqUXA","Terroriser","20","1363.0","https://i.ytimg.com/vi/w2n4Y8gZ9iE/default.jpg","Opening Gifts From Vanoss! (A Terroriser Christmas)|terroriser|terrorizer|the terroriser|gifts from vanoss|vanoss presents|gifts|vanoss|vanossgaming|gift opening|opening presents|ireland|unboxing|christmas day|christmas|comedy|funny videos|silly|funniest|reacting|qna|gaming|nogla|funny|youtubers|questions|ask mini|fun|reacting to|how to|daithidenogla|christmas morning|youtube tips|question|skit|brian|snap map memes|christmas eve|presents|shopping","Tanks to everyone that sent in gifts! Check out Lanai's channel! https://www.twitch.tv/ms_vixenBecome a member of the channel and gain access to the Terroriser Discord and also custom emotes in livestreams here: https://www.youtube.com/channel/UCQiojTHkAvFvdCSajklqUXA/joinIf you enjoyed the video hit that LIKE button and drop a COMMENT down below!Stay Awesome guys!Want a Terroriser T-Shirt? Check them out here: https://shop.terrorisermerch.com/https://terroriser.3blackdot.com/Please behave in the comments section and avoid silly or hateful comments :D►►►Follow me on Twitter◄◄◄ https://twitter.com/Terroriser►►►Like me on Facebook◄◄◄ https://www.facebook.com/pages/Terroriser►►►Follow me on Twitch◄◄◄http://www.twitch.tv/Terroriser►►►Follow me on Instagram◄◄◄http://instagram.com/Terroriser","Hi.","Terroriser Terrorizer thegamingterroriser Brian Funny Moments Comedy Irish Ireland Vlogs Vlogger Blogs Blogger Gaming Gameplay Video Games Let's Plays Lets Play Lets Plays Scary Scary Moments Reaction Videos Funny","_WfGgl9Q1JQ"
0jzS9GEDfJs,"Watching Anthony LOSE His MIND & BREAK EVERYTHING","UCQCnMFr8uHBaMTaNBhych_A","Mini Ladd","20","1139.0","https://i.ytimg.com/vi/0jzS9GEDfJs/default.jpg","Mini|Ladd|MiniLadd|Craig|Thompson|kid|friendly|child|no swearing|no cursing|golf it|funny|golf|golf with friends|rage","SUBSCRIBE OR I'LL TAKE YOUR BED!: http://bit.ly/SubMiniLadddVlog Channel: http://bit.ly/CraigThompsonVlogsMini Golf Playlist: http://bit.ly/MiniLaddGolfFriends in this video:BasicallyIDoWrk: http://bit.ly/22ir4wZI AM WILDCAT: http://bit.ly/21u4ICXBigJigglyPanda: http://bit.ly/1pmGMoRMerch Store: http://miniladd.3blackdot.com/Insomnia Merch: https://shop.miniladdmerch.com/Instagram: http://instagram.com/miniladddTwitter: http://www.twitter.com/MiniLadddLivestream: http://www.twitch.tv/MiniladddDiscord: https://discord.gg/miniladdFacebook: http://www.facebook.com/MiniLadddSnapchat: mini_ladd","Hi! Welcome! Feel free to stay & relax :)","Hilarious Energetic Family Friendly Comedy React MiniLaddd Mini Ladd MiniLadd vlog hilarious funny moments fun new viral vlogs gameplay montage lets play playthrough walkthrough","_WfGgl9Q1JQ"
O7C4AQPzRwo,"The 10 Year Evolution of Vanoss Crew (Mini Ladd, Terroriser, Ohmwrecker, Lui Calibre, VanossGaming)","UCuF49lP5gkkw5L8HK3H6GJg","SunnyV2","24","1204.0","https://i.ytimg.com/vi/O7C4AQPzRwo/default.jpg","Vanossgaming|vanoss crew|vanoss group|vanoss|the evolution of|mini ladd|mini ladd drama|rise and fall of mini ladd|terroriser|terroriser mini ladd|terroriser ohmwrecker|ohmwrecker|where are they now?|a brief history|documentary|gamerfrommars|youtube documentary|rise and fall|where is|Biography|from vanity to insanity|narration|video essay|twitch|youtube|entertainment|education|joon the king|down the rabbit hole|no swearing|family friendly|sunnyv2|wildcat","The Vanoss Crew - Arguably the most influential group in YouTube's history. A mix of 10 - 20 (at one point) nameless individuals who took the mediocre reality of their lives in the early 2010's and transformed them into something more impressive than sliced bread. This video will cover the transition of the Vanoss Crew, beginning with the early story of VanossGaming, then grow to include Moo Snuckel, Big Jiggly Panda, I Am Wildcat, Terroriser, H20 Delirious, BasicallyIDoWrk, Fourzer0Seven, Mini Ladd, Lui Calibre, Daithi De Nogla, Ohmwrecker and Smii7y,Then finally finish by covering the drama and controversy surrounding the group, focusing on the current situation with Mini Ladd.This is, The Full 10 Year Evolution of The Vanoss Gaming Crew (FULL STORY).Thank you guys for watching, like and sub if you enjoyed, Sunny XO ❤Twitter - https://twitter.com/v2_sunnyAll of my gear (camera and computer) is listed below - Purchasing any of the items below through the links will help support the channel, or feel free to just check out what I use :)Microphone (used in voice overs / documentaries) - https://amzn.to/3ozafuSMicrophone (used in gaming videos) - https://amzn.to/2K3nIMGCamera - https://amzn.to/2JOCzKTTripod - https://amzn.to/382AP9hMonitor 1 - https://amzn.to/33STi6zMonitor 2 - https://amzn.to/2K3xePVKeyboard - https://amzn.to/2VZ85Z2Mouse - https://amzn.to/37G3P6cHeadphones - https://amzn.to/3qJykRMMouse pad - https://amzn.to/3qIYy6DWebcam - https://amzn.to/3qCOigiSpeakers - https://amzn.to/3gv1AXB","You're not allowed to stalk me to this extent without being subscribed ;)","minecraft a brief history documentary youtube documentary rise and fall where is Biography narration video essay twitch youtube entertainment education no swearing family friendly sunnyv2 youtube documentaries documentaries","_WfGgl9Q1JQ"
xx1iXnBj-1s,"Among Us moments where we worship the HOLE GOD...","UC-kOXc3gBwksVfmndSEz7jg","I AM WILDCAT","20","768.0","https://i.ytimg.com/vi/xx1iXnBj-1s/default.jpg","WILDCAT|I AM WILDCAT|iamwildcat|Among Us|Impostor|Imposter|Win|Victory|Crew|Crewmate|Detective|Space|Ship|Discord|Tasks|Sus|Vouch|PC|Party Game|Indie|Social Deduction|Steam|Proximity Chat|Mod|Polus|The Crew","I AM WILDCAT MERCH AVAILABLE NOW! https://iamwildcat.net/The future is near: https://glitchenergy.coThanks for watching! LIKE the video if you enjoyed!Follow me on Twitter: http://bit.ly/I_AM_WILDCATMy Instagram: http://instagram.com/wildcat_official Friends in this video!@SideArms4Reason @TheDeluxe4 @KYRSP33DY @NobodyEpic @Kruzadar @Bigpuffer @HyperNovaPuma @Deluxe2O @Junkyard129 Follow Me on Twitch: http://www.twitch.tv/WILDCATSubscribe to my let's play channel: http://bit.ly/WILDCATLetsPlaysApply for a Partnership: http://apply.fullscreen.net/?ref=w1ldc4t43For Business Inquiries Contact: business@iamwildcat.netPlease flag hateful comments or spam...we don't need that here :DMusic from:Kevin MacLeod: http://incompetech.com/ http://www.premiumbeat.com/ http://audionautix.com/I am a part owner of Glitch Energy DrinkNo one reads this far into the description...what are you doing snooping around...#WILDCAT #AmongUs #ProximityChat","Tyler - I AM WILDCATFor Business Inquiries Contact: business@iamwildcat.netAbout Me:My name is Tyler and I make my videos for fun and to get a couple laughs out of my viewers. I do my best to make entertaining content and upload as often as I see fit. Feel free to subscribe, it's free :D","I AM WILDCAT WILDCAT Funny Moments Videos GTAV GTA 5 GTA V Gmod Gmod Sandbox Sandbox Garry's Mod Call of Duty CoD Fortnite","_WfGgl9Q1JQ"
