video_id,title,channelId,channelTitle,categoryId,duration,thumbnail_link,tags,description,channel_desc,channel_keywords,related_vid_id
Vuz6UYS0qJs,"The Significance Of Garth Brooks' Inauguration Performance | Morning Joe | MSNBC","UCaXkIU1QidjPwiAYu6GcHjg","MSNBC","25","226.0","https://i.ytimg.com/vi/Vuz6UYS0qJs/default.jpg","Democrats|Elections|Joe Biden|Best of last night|Joe Biden Inauguration|Morning Joe|Joe Scarborough|Mika Brzezinski|Willie Geist|MSNBC|MSNBC news|MSNBC live|MSNBC TV|breaking news|current events|US news|politics|politics news|political news|morning joe full|morning joe live|morning joe today|Significance Of Garth Brooks|Garth Brooks|Brooks Innaguration performance|President joe biden|inauguration day 2021|inguration ceremony|music legend Brooks","Country music legend Garth Brooks performed Wednesday at Joe Biden's inauguration, to the chagrin of some of his more conservative fans. Kurt Bardella explains the importance of Brooks' performance. Aired on 01/21/2021.» Subscribe to MSNBC: http://on.msnbc.com/SubscribeTomsnbcAbout Morning Joe with Joe Scarborough: Join Joe Scarborough, Mika Brzezinski, and Willie Geist, for in-depth and informed discussions that help drive the day's political conversation. Top newsmakers, Washington insiders, journalists, and cultural influencers, come together on Morning Joe for unparalleled insight and analysis around the day's biggest stories.MSNBC delivers breaking news, in-depth analysis of politics headlines, as well as commentary and informed perspectives. Find video clips and segments from The Rachel Maddow Show, Morning Joe, Meet the Press Daily, The Beat with Ari Melber, Deadline: White House with Nicolle Wallace, Hardball, All In, Last Word, 11th Hour, and more.Connect with MSNBC OnlineVisit msnbc.com: http://on.msnbc.com/ReadmsnbcSubscribe to MSNBC Newsletter: http://MSNBC.com/NewslettersYouTubeFind MSNBC on Facebook: http://on.msnbc.com/LikemsnbcFollow MSNBC on Twitter: http://on.msnbc.com/FollowmsnbcFollow MSNBC on Instagram: http://on.msnbc.com/Instamsnbc#GarthBrooks #Inauguration #MSNBCThe Significance Of Garth Brooks' Inauguration Performance | Morning Joe | MSNBC","The official MSNBC YouTube Channel. MSNBC  is the premier destination for in-depth analysis of daily headlines, insightful political commentary and informed perspectives. Reaching more than 95 million households worldwide, MSNBC  offers a full schedule of live news coverage, political opinions and award-winning documentary programming -- 24 hours a day, 7 days a week.Sign up for newsletters!: MSNBC.com/NewslettersYouTube","msnbc politics rachel maddow lawrence o'donnell News politics Brian Williams Chris Hayes Morning Joe Stephanie Ruhle msnbc news live msnbc maddow msnbc maddow msnbc stream live msnbc stream msnbc joe msnbc rachel msnbc rachel maddow rachel maddow msnbc today msnbc morning joe msnbc news live live news msnbc news live stream msnbc stream live msnbc stream msnbc live now msnbc news today lawrence msnbc am joy am joy msnbc msnbc ari ari melber msnbc ari melber rachel maddow live msnbc live rachel maddow msnbc chris hayes chris hayes","e4wajXk_cDs"
pqHF8fnI8Kc,"Sykkuno And I GASLIGHT The Lobby And Create A GRAVEYARD","UCFNTq9XKHDNy_1-2lL0kqCg","Corpse Husband","24","1868.0","https://i.ytimg.com/vi/pqHF8fnI8Kc/default.jpg","Among Us|CORPSE Among Us|among us corpse|funny among us|best among us|among us funny moments|among us gameplay|among us imposter|among us IQ|among us best|jacksepticeye among us|disguised toast among us|sykkuno among us|valkyrae among us|proximity chat among us|corpse imposter|corpse choke me|corpse clips|corpse husband","PROXIMITY CHAT AMONG USSTREAM MY MUSIC: https://open.spotify.com/artist/7yntSJ6uojO3z6GFUVwhAW?si=Svqv_I6iSp6McwGLH0UNpATWITTER: https://twitter.com/Corpse_HusbandINSTAGRAM: https://www.instagram.com/Corpse_Husband/Thumbnail by: https://twitter.com/chryseuswitchEdited by: https://twitter.com/Otriggad","I tell scary stories, mostly true ones, and you get scared. And I guess some people like that► If you have any personal horror stories that you want read please email it to CorpseHStories@gmail.com and include what kind of story it is.For example, a stalker story, a camping story, etc ► Instagram: https://instagram.com/corpse_husband/► Twitter: https://twitter.com/Corpse_Husband► Send your much appreciated fan mail to:P.O. Box 902 Murrieta, Ca, 92564______Most music on my videos by► Myuuji https://www.youtube.com/user/myuujiandKevin MacLeod (incompetech.com)► Outro music credit to: https://www.youtube.com/user/naraklash► Outro video credit: https://www.youtube.com/user/lillilfredWILL I EVER HIT 10 SUBS??!?!ONE!","creepy pasta deep web paranormal ghosts creepypasta Creepy Pasta story telling experiences true chilling stories REAL corpse husband scary top","e4wajXk_cDs"
Npl0qxQBnEo,"DELIVERY ROULETTE with my family!","UCLUXOvi9mq90L7wlfBisTRA","Grackle","24","1000.0","https://i.ytimg.com/vi/Npl0qxQBnEo/default.jpg","lockdown|lockdown activities|things to do in lockdown|family lockdown activities|things to cook|deliveroo challenge|takeaway roulette|deliveroo roulette|family food challenge|what food will they get|random food challenge|tik tok food roulette|come dine with me family|grackle family|grackle dad|take away roulette|take away food challenge","This was SO much fun picking each others meals, I hope you enjoy! More video ideas like this are welcome because it was a right hoot tbh! Also gassed that deliveroo is in my area hahahInstagram: gracebooth97extra channel: https://www.youtube.com/channel/UC_J93mR-rtZsrEFC23zVwtQ","instagram: gracebooth97just here for the bants, post stuff that is irrelevant but I enjoy that.","","e4wajXk_cDs"
FacYFBd6p3o,"What Chip And Joanna Gaines' Gorgeous Home Really Looks Like","UCJ7dtuZhjFSJvb_CZjWJkng","The List","24","718.0","https://i.ytimg.com/vi/FacYFBd6p3o/default.jpg","the list|thelist|chip and joanna gaines|chip gaines|joanna gaines|chip and joanna gaines gorgeous house|inside chip and joanna gaines gorgeous house|chip and joanna|joanna and chip gaines house|joanna and chip gaines gorgeous house|chip and joanna gorgeous house|chip and joanna gaines gorgeous home|joanna and chip gaines gorgeous home|joanna and chip gaines a look inside their gorgeous|inside chip and joanna gaines gorgeous home","Joanna Gaines, one half of the Fixer Upper team, revealed: My home is my safe place, it is my exhale, it is my shelter from the storm. After seeing her home, it's not hard to understand why. Here's a sneak peek into the Gaines' beyond incredible family home.If you were a regular watcher of Fixer Upper, you saw a few snippets of Chip and Joanna Gaines' home here and there. You already know it's beautiful, but just how did Joanna design it? The shiplap queen granted Today a tour of the couple's farmhouse in 2018.When speaking with Jenna Bush Hager, Joanna revealed her secrets behind creating a simple, inviting front porch. The design guru believes a house should be welcoming — and explained how that begins at the front door. If you're looking to create a similarly cozy space, Joanna's got your back. In an interview with Architectural Digest, she revealed her tips for improving curb appeal, advising - Freshening up the landscape, adding new shutters, and wrapping dated columns with redwood or cedar wood. These are all things you can tackle over the weekend and without killing your budget.Keep watching to see What Chip And Joanna Gaines' Gorgeous Home Really Looks Like.#ChipAndJoannaGainesAn intentional exterior | 0:00No grand foyer | 1:14The heart of the home | 1:46Joanna Gaines' favorite room | 2:43A simple office | 3:23Baby Crew's eclectic nursery | 3:57Sons' bedroom | 4:51Whimsical bedroom for their daughters | 5:30Kitchen has an epic island | 6:11Open concept dining room | 7:04Slumber in a spacious bedroom | 7:52From attic to craft room | 8:36The she-shed | 9:14A gorgeous greenhouse | 10:13A serene in-ground pool | 11:14Read Full Article: https://www.thelist.com/140015/inside-chip-and-joanna-gaines-gorgeous-house/","The List is a women’s news and lifestyle destination with a twist. From reality TV to Hollywood and everything in-between, we’ve got you covered. We obsess over tried-and-true beauty hacks and all things royal family. And we’ll keep you up to date on news and politics, too, from who’s making headlines to how those headlines affect you. The List has what you need, whether it’s real-life news or a break from it.","women beauty health food","e4wajXk_cDs"
AWqhIKgwWI0,"Randell and Chad Tie the Know October 19, 2019","UCa6PTeLNreX4GmaBwBe3DXg","Jacquie Lewis","1","1417.0","https://i.ytimg.com/vi/AWqhIKgwWI0/default.jpg","iMovie","This video is about Randell and Chad Tie the Know October 19, 2019","Jacquie specializes in the sale and purchase of properties throughout Chicago, and the North Shore. She consistently receives top accolades from clients and co-workers for her commitment to the job at hand, and her unmatched work ethic. She is top producing real estate professional in this area representing many distinctive properties, and distinguished clients. Jacquie is particularly knowledgeable in marketing listings with architectural and historical pedigree. A focused persistence and an unwavering dedication to her clients' needs has boosted Jacquie into top production. Her negotiating skills and her unparalleled attention to detail have ensured her success. Jacquie possesses an unmistakable combination of unbridled energy and enthusiasm coupled with an uncompromising need for perfection that has propelled her. Jacquie is frequently consulted by her fellow professionals for her outstanding knowledge of the market.","North Shore Chicago Real Estate Broker Agent Coldwell Banker","e4wajXk_cDs"
eE-eJVJNYKQ,"Frenemies Is Under Attack - Frenemies #16","UCLtREJY21xRfCuEKvdki1Kw","H3 Podcast","24","4579.0","https://i.ytimg.com/vi/eE-eJVJNYKQ/default.jpg","h3 podcast|h3h3 podcast|the h3 podcast|the h3h3 podcast|h3h3productions|h3h3|h3|ethan klein|hila klein|ethan and hila|ethan & hila|trisha paytas|trisha|frenemies|paytas","Become a member for access to the episodes a day early with no ads and no cuts: http://youtube.com/h3podcast/joinTrisha's YouTube Channel:  @blndsundoll4mj TEDDY FRESH...http://teddyfresh.comH3 MERCH... http://h3h3shop.comFollow us on Social Media:https://twitter.com/theh3podcasthttps://www.instagram.com/h3_podcastFollow Teddy Fresh Social Media:https://teddyfresh.comhttps://instagram.com/teddyfreshhttps://twitter.com/teddyfresh","The official podcast of Ethan and Hila Klein of h3h3productions.","h3 podcast podcast h3h3 h3h3productions ethan and hila ethan klein hila klein h3h3 podcast","e4wajXk_cDs"
TyVqlbPEV7Q,"Banned From Youtube! Belle Delphine Outrage, PewDiePie, AOC, Trump Impeached Again, & More News","UClFSU9_bUb4Rc6OYfTt5SPw","Philip DeFranco","25","1153.0","https://i.ytimg.com/vi/TyVqlbPEV7Q/default.jpg","PewDiePie|Facebook|YouTube|Belle Delphine|Valkyrae|Pokimane|Twitch|Donald Trump|Sportsmix|FDA Recall|Dogs|Prop 22|California|Uber|Lyft|India|Italy|Alexandria Ocasio-Cortez|Lauren Boebert|Congress|Impeachment|DeFranco|News|News & Culture","Go to http://www.omaxdefranco.com & use code DEFRANCO to get 20% off CryoFreeze & sitewide + free shipping! WATCH My John Green Podcast: https://youtu.be/L8SOhkpjtGA --WATCH Full “A Convo With” Podcasts: https://www.youtube.com/ACW LISTEN On The Podcast Platform Of Your Choice: http://LinksHole.comWATCH the ACW Clips channel!: https://youtube.com/ACWClips--00:00 - HatGate 202001:01 - Belle Delphine03:16 - Valkyrae04:33 - Pewdiepie05:46 - YouTube Bans Trump06:14 - Drivers Say Prop 22 Is Illegal07:59 - DON'T BUY THIS DOG FOOD08:50 - Sponsor10:02 - India's Farmers Protesting11:25 - Negative COVID Test Needed To Enter US11:58 - Huge Mob Trial In Italy13:09 - Trump Impeached Again15:31 - Republicans Don't Like New Capitol Security Measures--✩ SUPPORT THE SHOW ✩✭ BUY our GEAR, Support the Show!: http://ShopDeFranco.com✭ Lemme Touch Your Hair: http://BeautifulBastard.com✭ Paid Subscription: http://DeFrancoElite.com ✩ TODAY’S STORIES ✩ Belle Delphine Responds to Controversy:https://roguerocket.com/2021/01/13/belle-delphine-responds/Valkyrae Edges Out Pokimane as Most Watched Female Streamer:https://www.dexerto.com/entertainment/valkyrae-pokimane-most-watched-female-streamer-2020-1491517/PewDiePie Heading to Facebook:https://www.forbes.com/sites/johnkoetsier/2021/01/12/youtubes-top-creator-pewdiepie-is-coming-to-facebook-watch/?sh=203c2f634264YouTube Suspends Trumphttps://www.cnn.com/2021/01/12/tech/youtube-trump-suspension/index.htmlFDA Recalls Sportsmix Pet Food Productshttps://roguerocket.com/2021/01/13/ice-cream-and-sportsmix-recalls/Uber and Lyft Drivers Sue To Overturn California’s Prop 22https://roguerocket.com/2021/01/13/some-uber-and-lyft-drivers-sue-to-overturn-californias-prop-22/India puts three contentious farm laws on hold following nationwide protestshttps://www.cnn.com/2021/01/12/asia/india-farm-law-intl-hnk-scli/index.htmlU.S. to Require Negative Tests From International Air Passengershttps://www.nytimes.com/2021/01/12/health/us-to-require-negative-virus-tests-from-international-air-passengers.html?smid=tw-nytimes&smtyp=curItaly Starts Largest Mob Trial in Decadeshttps://roguerocket.com/2021/01/13/italy-mob-trial/House Impeaches Trump:https://roguerocket.com/2021/01/13/house-impeach-trump/Security Ramps Up After Capitol Attack:https://www.nbcnews.com/politics/congress/republicans-protest-circumvent-new-metal-detectors-inside-capitol-after-riot-n1254011——————————    Edited by: James Girardier, Julie Goldberg, Maxx EnrightProduced by: Amanda MoronesArt Director: Brian Borst Writing/Research: Philip DeFranco, Lili Stenn, Maddie Crichton, Cory Ray, Neena Pesqueda, Brian EspinozaProduction Team: Zack Taylor, Luke Manning ————————————#DeFranco #PewDiePie #Impeachment","A 5 day a week, daily show where I talk about the news and pop culture that matters to me and should matter to you.","sxephil philip defranco news show satire opinion current events video sxe phil phillyd politics entertainment web youtube","e4wajXk_cDs"
QBmlIdXpGeU,"Trisha Paytas, Jeffree Star, Hair By Jay, D'Angelo Wallace, Cr1TiKaL - H3 After Dark #19","UCLtREJY21xRfCuEKvdki1Kw","H3 Podcast","24","11486.0","https://i.ytimg.com/vi/QBmlIdXpGeU/default.jpg","h3h3|h3|h3 after dark|h3h3productions|ethan klein|hila klein|ethan and hila|ethan & hila|after dark|d'angelo wallace|dangelo|jeffree star|trisha paytas|cr1tikal|hair by jay","Thank you to http://Keeps.com/h3 & http://Upstart.com/H3 for sponsoring us!NEW H3 MERCH! http://h3h3shop.comTEDDY FRESH...http://teddyfresh.comFollow us on Social Media:https://twitter.com/theh3podcasthttps://www.instagram.com/h3_podcastFollow Teddy Fresh Social Media:https://teddyfresh.comhttps://instagram.com/teddyfreshhttps://twitter.com/teddyfresh","The official podcast of Ethan and Hila Klein of h3h3productions.","h3 podcast podcast h3h3 h3h3productions ethan and hila ethan klein hila klein h3h3 podcast","e4wajXk_cDs"
Cm1Q5t6oJtQ,"2020 nyc college dorm room tour! | indie + kidcore aesthetic","UC-2x5nqQGs-9clL0X7jggZg","kristine","26","963.0","https://i.ytimg.com/vi/Cm1Q5t6oJtQ/default.jpg","[none]","SOCIALS☽ Instagram: https://www.instagram.com/xbbykristine☽ Twitter: https://www.twitter.com/xbbykristine☽ Spotify: https://open.spotify.com/user/kristine_182☽ Depop: https://www.depop.com/kristinesnormal/✧･ﾟ: *✧･ﾟ:*use code kristine15 on the #aureliegi website for 15% off your entire order!pieces worn:LYNN | CABLE CHAIN -16: https://aureliegi.com/products/lynn-cable-chain-16?utm_source=youtube&utm_medium=social&utm_campaign=KristinesnormalJOY | ENGRAVABLE HEART CHARM: https://aureliegi.com/products/joy-engravable-heart-charm?utm_source=youtube&utm_medium=social&utm_campaign=KristinesnormalANGELICA | WING CHARM: https://aureliegi.com/products/angelica-wing-charm?utm_source=youtube&utm_medium=social&utm_campaign=Kristinesnormal✧･ﾟ: *✧･ﾟ:*support me!☽ yesstyle discount code: Z4QYP8✧･ﾟ: *✧･ﾟ:*FAQ☽ how old are you? 19☽ wHaT aRe yOu? i'm half filipino, half german☽ what do you use to edit? final cut pro☽ what do you use to record? my iphone 11 and canon sx730 hs :)☽ i love you! i love you too!!!","does anyone even read this?","kristine ukulele music beauty beauty guru music channel fashion best dressed yesstyle asian abg haul clothing haul college college youtuber day in the life yesstyle haul brandy melville brandy melville haul nyc new york city new york new york youtuber nyc youtuber new york city youtuber asian girl try on haul dorm dorm room apartment tour apartment nyc apartment nyu","e4wajXk_cDs"
HGH01WpJ1GU,"PRODUCTS I WILL REPURCHASE | EMPTIES","UC-Q2g3Vn6uZSW56yHqlrJDg","Kassie Thatcher","26","1230.0","https://i.ytimg.com/vi/HGH01WpJ1GU/default.jpg","shadesofkassie|makeup|beauty|cosmetics|tutorial|tips|eyeshadow|how to do makeup|how to apply makeup","----------------------------------|  P R O D U C T S   M E N T I O N E D |Bondi Sands Gradual Tan https://amzn.to/39JkLtPLiving Proof Dry Shampoo https://bit.ly/3nWJv6YDP Hue Apple Cider Dry Shampoo https://bit.ly/31FjYrkBatiste Dry Shampoo https://amzn.to/3qtzM9IIGK Dry Shampoo https://bit.ly/2LEwlOZFinola Purple Shampoo https://amzn.to/35UM5UyKirkland Wipes https://amzn.to/3qxAKSqUD All Nighter Spray https://bit.ly/2M7VVvfPixi Rose Glow Mist https://bit.ly/3iugYo7Colleen Rothschild Cleansing BalmDermalogica Precleanse https://bit.ly/2LFTwbESephora Eye Makeup Remover https://bit.ly/3iwLXQjPixi Glow Tonic https://bit.ly/2NkR22MPixi GLow Mist https://bit.ly/3p0Za6nPixi Vitamin C Tonic https://bit.ly/38Yo2X2Bum Bum Cream https://bit.ly/2XU20ODEOS Shave Balm https://amzn.to/3iAbrfSMac Tourquatic https://bit.ly/3p1kt7MConfidence in a Cream https://bit.ly/3nYZwJpConfidence in your Beauty Sleep https://bit.ly/3qyjQD3Mac Moisture Infusion Serum https://bit.ly/3p1LWX3Nordiac C Glow Boost https://bit.ly/2KsNtGzNO 7 Lift and Illuminate Serum https://bit.ly/3bUp4VGDermae Peptide Serum https://amzn.to/35UU0BEBondi Sands Tanning Oil https://amzn.to/38UHrrHDermae Microderm Scrub https://bit.ly/2XRGKt3Dermae Essential C moisturizer https://bit.ly/3sI0KfFFirst Aid Beauty Eye Cream https://bit.ly/2Ng8bul Essence Lash Princess https://bit.ly/2qpZ5zNToo Faced Dew You https://bit.ly/38oKpVmCT Wonder Glow https://bit.ly/2XXxOlIYSL All HOurs Foundation https://bit.ly/2M5UsWABorn This way Multitasking Concealer Honey https://bit.ly/3nZyq59ND Face Glow Foundation https://bit.ly/3iqEfr5Pixi Retinol Eye Cream https://bit.ly/39IVRdSPCA Hylaronic Acid Serum https://bit.ly/2Nnymj3Nioxin Hair and Scalp Treatment https://bit.ly/38VYDNCBB Enriched Face Base https://bit.ly/2MybgWfSR Luna Oil https://bit.ly/3bUk0AQIt Cosmtics Bye Bye Lines https://bit.ly/3qtGBYSUD Perversion Mascara https://bit.ly/3nZzoOPDermalogica C eye Cream https://bit.ly/2LLB9SxMac Brow Pencil https://bit.ly/3p1ei3EColourpop BFF Liquid Liner https://bit.ly/3oZeWPpWet N Wild Makeup Breakup https://bit.ly/3fN2H3LMac Brushstroke Liner https://bit.ly/3sCwS4lPrecisecly My Brow Pencil https://bit.ly/3sN2AMDPaulas Choice Omega Complex Serum https://bit.ly/39qdLBDLinaege Sleeping Lip Mask https://bit.ly/3201f6gLoreal Loose Setting Powder https://bit.ly/2OIEpvKNYX Natural Lip Liner https://bit.ly/3amXuwd| W H A T   I S   O N   M Y   F A C E |Foundation https://rstyle.me/cz-n/ewuhmj9u7eCream Bronzer https://rstyle.me/cz-n/ewuhpu9u7eBronzer https://rstyle.me/cz-n/ewuhwi9u7eCream Blush https://rstyle.me/cz-n/ewuhsr9u7eCream Highlight https://rstyle.me/cz-n/ewuhvf9u7eHighlight https://rstyle.me/cz-n/ewuhy49u7e| E Y E S |Palette https://rstyle.me/cz-n/ewuh4b9u7ehttps://rstyle.me/cz-n/ewuh479u7eLiner https://rstyle.me/cz-n/ewuh979u7eMascara https://rstyle.me/cz-n/ewuidu9u7e| L I P S |Liner https://rstyle.me/cz-n/ewuh6i9u7eLipstick Andrea & Beatrice https://rstyle.me/cz-n/ewuifc9u7e----------------------------------- | L E T ' S  B E  B F F ' S |→ SUBSCRIBE | http://www.youtube.com/shadesofkassie→ TWITTER| http://www.twitter.com/shadesofkassie→ FACEBOOK| http://www.facebook.com/shadesofkassie→ INSTAGRAM| http://www.instagram.com/shadesofkassie| P R   I N Q U I R I E S |→ makeupbykassie@gmail.com------------------------------------------------------------------------------| D I S C O U N T   C O D E S |    (AFFILIATE LINKS)GET MONEY BACK FOR SHOPPING ONLINE EBATES | http://bit.ly/1rtpa4vBEST LASHES: ESQIDO Lashes | http://ESQIDO.com/?r=331USE DISCOUNT CODE: CHIC for 10% off Everything| F A Q S | → Camera | http://bit.ly/2GPdwlN→ Lens | http://bit.ly/2tsj9n9→ Lighting: BH Photo→ Chair: http://bit.ly/2GO2rld→ Clothing Rack: http://bit.ly/31pjfbO| F T C    D I S C L O S U R E | → All opinions are 100% my own :)  → Some links are affiliate links. → I am thankful any time you choose to click and purchase from the links I provide as I do receive a small commission on Affiliate Links. And the good news is they do not cost you anything :)","I am a girly girl that LOVES makeup and fashion...pretty much anything beauty related! I can't wait to share my makeup & beauty tips and tricks with you!! Don't forget to subscribe! :) xo","fitness lifestyle Makeup tutorial mac foundation eyeshadow clothing haul favorites girly blush bronzer lipstick cosmetics beauty fashion","e4wajXk_cDs"
0Xch5pASpUg,"Coming This February | Disney+","UCIrgJInjLS2BhlHOMDW7v0g","Disney Plus","24","31.0","https://i.ytimg.com/vi/0Xch5pASpUg/default.jpg","Disney+|Disney Plus|Disney|streaming","It’s nearly showtime for February! Next month, stream new episodes of Marvel Studios’ #WandaVision, all five seasons of The Muppet Show, the Original Movie #FloraAndUlysses, and more on #DisneyPlus.For more updates, subscribe to Disney, Pixar, Marvel, Star Wars, and National Geographic. Disney+ is the ultimate streaming destination for entertainment from Disney, Pixar, Marvel, Star Wars, and National Geographic. Follow Disney+ for the latest:Disney+: https://disneyplus.com/Instagram: https://www.instagram.com/DisneyPlus/Twitter: https://www.twitter.com/DisneyPlus/Facebook: https://www.facebook.com/DisneyPlus/","Subscribe to the official Disney+ YouTube channel to go deeper into your favorite movies and series from Disney, Pixar, Star Wars, Marvel, National Geographic, and more. From a weekly hosted talk show to a hosted facts series, and from interviews with talent to trailers and sneak peeks, Disney+ YouTube has something for everyone. New episodes every week. #DisneyPlus","","e4wajXk_cDs"
