video_id,title,channelId,channelTitle,categoryId,duration,thumbnail_link,tags,description,channel_desc,channel_keywords,related_vid_id
UBnfm4s7CRA,"10 Mins ABS Workout To Get FLAT BELLY IN 30 DAYS | FREE WORKOUT PROGRAM","UCCgLoMYIyP0U56dEhEL1wXQ","Chloe Ting","26","663.0","https://i.ytimg.com/vi/UBnfm4s7CRA/default.jpg","abs|abs workout|abs exercise|lower ab workout|lower abs workout|intense lower belly exercise|lower belly exercise|intense ab workout|10 minute abs|flat belly exercise|flat belly workout|flat belly in 30 days|fastest way to get flat belly|flat belly program|abs workout program|abs program|workout|exercise|flat stomach|flat tummy|30 days workout program|intense abs workout|muffin top workout|홈트레이닝|홈트레이닝 복근|복근운동|복부운동|복근|여자복근운동|여자복근만들기|여자복근|여자복근 만들기|복근만드는법","This is a 10 mins intense abs workout that will help you get that flat belly and toned abs. This video is part of my 30 day FREE flat belly challenge program. If you want to get that flat abs and six pack, try out this video as well as the other abs videos in this series and get those abs you want in 30 days.FREE 30 day FLAT BELLY CHALLENGE PROGRAM: https://www.chloeting.com/programEp 1 - 30 Min Full Body Workout: https://youtu.be/NQmnJtB1gzoEp 2 - 10 Mins Abs Workout: https://youtu.be/UBnfm4s7CRAEp 3 - 20 Mins Abs Hiit Cardio: https://youtu.be/owrBD7_8edAEp 4 - 10 Mins Lower Abs: https://youtu.be/Th97oQ4eF9UEp 5 - 45 Mins Full Body Burn: https://youtu.be/LDvAuqTZxMwCommunity RESULTS Video: https://youtu.be/VedbZeysJrkMeal Prep Video: https://youtu.be/CB0bqOCb1RESPONSOR THIS CHANNEL: https://www.youtube.com/chloeting/joinSUB TO MY 2ND CHANNEL: https://www.youtube.com/channel/UCBrcDabYtwbR1VIhwH5efZA?sub_confirmation=1☆Fitness Outfits☆My Gymshark Affiliate Link - https://gym.sh/Shop-Chloe-Ting ☆My Instagram links☆https://www.instagram.com/chloe_t/https://www.instagram.com/itschloeting/☆Filmed With☆Panasonic GH5Lumix G 8-18mm Lumix G 12-35mm Lumix G 42.5mmhttps://www.amazon.com/shop/chloeting☆Music by☆Track: RetroVision - Hope [NCS Release]Music provided by NoCopyrightSounds.Watch: https://youtu.be/4ukOvwQmJvEFree Download / Stream: http://ncs.io/RVHopeYOTrack: ÉWN - The Light [NCS Release]Music provided by NoCopyrightSounds.Watch: https://youtu.be/q2D4-fuv67UFree Download / Stream: http://ncs.io/EWNTheLightYOTrack: TULE - Lost [NCS Release]Music provided by NoCopyrightSounds.Watch: https://youtu.be/h-nHdqC3pPsFree Download / Stream: http://ncs.io/LostYOTrack: Andromedik - With Me [NCS Release]Music provided by NoCopyrightSounds.Watch: https://youtu.be/pyj9yJO4rbAFree Download / Stream: http://ncs.io/WithMeYO#abs #absworkout #chloetingchallenge","Subscribe to my channel and find weekly workout videos, healthy food recipes and other fun videos! I've got FREE workout programs on my channel with workout calendar schedules so check it out!","fitness health lifestyle healthy diet healthy diet workout bodybuilding exercise exercise for women women fitness gym abs flat tummy fitspo fitspiration fit girls absworkout abs workout fashion travel lookbook chloeting free workout program","CPI_Ve7vsHs"
4CkVdu4z1HA,"Hourglass Abs Workout  🙋‍♀️Lose Muffin Top & Love Handles | 10 Mins","UCCgLoMYIyP0U56dEhEL1wXQ","Chloe Ting","26","660.0","https://i.ytimg.com/vi/4CkVdu4z1HA/default.jpg","muffin top|muffin top workout|muffin top exercise|love handles|love handles workout|how to get rid of love handles|how to get rid of muffin top|how to lose muffin top|how to lose love handles|abs|abs workout|six pack workout|belly fat|lose belly fat workout|how to lose belly fat|abs workout for women|female abs|abs exercise|intense ab workout|flat belly workout|flat stomach|flat tummy|hourglass abs|hourglass workout","This is episode 2 of my new Hourglass Program. This abs workout  video targets your love handles and help you to lose that muffin top and get you closer to getting your abs visible. ☆Hourglass Program☆Full schedule: https://www.chloeting.com/programEpisode 1 - Small Waist Round Butt - https://youtu.be/eKzG6Prq_wEEpisode 2 - Muffin Top Workout - This VideoEpisode 3 - Booty Burn - https://youtu.be/9SuTAxJGQuYEpisode 4 - Booty & Legs - https://youtu.be/Byn9mPPZrtk☆Help Subtitle this video☆http://www.youtube.com/timedtext_video?ref=share&v=4CkVdu4z1HA☆Sponsor this channel☆https://www.youtube.com/chloeting/join☆Sub to my 2nd channel☆https://www.youtube.com/channel/UCBrcDabYtwbR1VIhwH5efZA?sub_confirmation=1☆My Instagram links☆https://www.instagram.com/chloe_t/https://www.instagram.com/itschloeting/☆Music by☆TheFatRat, Slaydit & Anjulie - Strongerhttps://youtube.com/monstercat https://youtube.com/monstercatinstinctSlushii - Far Awayhttps://youtube.com/monstercat https://youtube.com/monstercatinstinctNitro Fun - So Far Awayhttps://youtube.com/monstercat https://youtube.com/monstercatinstinctDylan Locke - Johnny Johnny (the remix instrumental) #workouts #abs #absworkoutIMPORTANT DISCLAIMER: Please note that all of my videos are titled according to SEO best practices for content discoverability. Unfortunately this may mean that video titles are subjective and shouldn't be seen as absolute truth. As an example, targeting fat reduction is not scientifically proven but a video title might suggest otherwise. When following any of my videos, please take precaution to exercise in a safe environment, and I highly suggest seeing a health and fitness professional to give you advice on your exercise form and dietary needs. Every person is unique and there is no one size fits all solution to health or fitness. I am not a medical professional and your health and safety is the utmost importance.","Subscribe to my channel and find weekly workout videos, healthy food recipes and other fun videos! I've got FREE workout programs on my channel with workout calendar schedules so check it out!","fitness health lifestyle healthy diet healthy diet workout bodybuilding exercise exercise for women women fitness gym abs flat tummy fitspo fitspiration fit girls absworkout abs workout fashion travel lookbook chloeting free workout program","CPI_Ve7vsHs"
cO2RqgslEjk,"Do this Cooldown after a workout | Relaxation Recovery Stretches","UCCgLoMYIyP0U56dEhEL1wXQ","Chloe Ting","26","934.0","https://i.ytimg.com/vi/cO2RqgslEjk/default.jpg","workout|cooldown|cool down|stretch|stretches|stretching|flexibility|cool down stretch|cool down workout|cool down exercises|cool down exercises after workout|stretching exercises|stretches for flexibility|stretching exercise for beginners|stretching routine|stretching routine for flexibility|stretch for legs|stretch for lean legs|stretch for leg flexibility|stretch for leg day","☆Summer Shred Challenge 2020☆Full program schedule - https://www.chloeting.com/programWarm Up - https://youtu.be/-p0PA9Zt8zkEpisode 1 - https://youtu.be/OBSUUi0FAKoEpisode 2 - https://youtu.be/hAUIGLE8PEoEpisode 3 - https://youtu.be/7L-Td_p0bXEEpisode 4 - https://youtu.be/fMPoCc78v0gEpisode 5 - https://youtu.be/JEEG0hBNk3EEpisode 6 - https://youtu.be/-GhaJFcj3Mk☆Help subtitle this video☆http://www.youtube.com/timedtext_video?ref=share&v=cO2RqgslEjk☆Sponsor this channel☆https://www.youtube.com/chloeting/join☆Sub to my 2nd channel☆https://www.youtube.com/channel/UCBrcDabYtwbR1VIhwH5efZA?sub_confirmation=1☆My links☆https://www.instagram.com/chloe_t/https://www.instagram.com/itschloeting/twitch.tv/chloeting☆Music by☆Music | Magical by Declan DPWatch: https://youtu.be/WIs5LmR5ZGULicense: http://www.declandp.info/licenseDownload/Stream: https://hypeddit.com/link/t7shxiSong: Fredji & Tobsky - Flow (Vlog No Copyright Music)Music promoted by Vlog No Copyright Music.Video Link: https://youtu.be/6EBy3JmrKXg#workouts #fitness #chloetingIMPORTANT DISCLAIMER: Some people may see my video titles as click-bait. YouTubers optimise their video's meta data for discovery due to how the algorithm is like. This isn't anything new. Most people who've been watching YouTube for years would understand this. If you're unhappy and get triggered by this, well, this channel isn't for you then. I’ve provided free workout schedules and programs since day 1 and have always optimised my meta data as such so that's not going to change.Having said that, it doesn't mean the workout do not work. You will still see results by following a suitable program schedule, watching your diet, being in a deficit or surplus (based on your goals), doing exercises in good form, etc. These are all equally important factors. You're not going to get abs, grow a booty, grow biceps magically from 1 or 2 videos, in 1, 2, 3 or 4 weeks cause everyone is different. A title may come close to suggesting that, but I've explain multiple times throughout videos throughout my channel over years that it takes time and lots of factors, so don't take a video title out of context. Targetting fat loss is also not scientifically proven. Everyone is different and it takes time. When doing any home workouts, do take precaution to exercise in a safe environment, and if you need help or you're not seeing results, I suggest seeing a health and fitness professional to give you tailored advice on your exercise form and dietary needs. I am not a medical professional and what I share on my channel are my views and what has worked for myself. Your health and safety is the utmost importance so find out what works for you.","Subscribe to my channel and find weekly workout videos, healthy food recipes and other fun videos! I've got FREE workout programs on my channel with workout calendar schedules so check it out!","fitness health lifestyle healthy diet healthy diet workout bodybuilding exercise exercise for women women fitness gym abs flat tummy fitspo fitspiration fit girls absworkout abs workout fashion travel lookbook chloeting free workout program","CPI_Ve7vsHs"
1skBf6h2ksI,"15 MIN FULL BODY HIIT WORKOUT - burn lots of calories / No Equipment I Pamela Reif","UChVRfsT_ASBZk10o0An7Ucg","Pamela Reif","17","929.0","https://i.ytimg.com/vi/1skBf6h2ksI/default.jpg","workout|training|abs|sickpack|flat|stomach|exercise|how to get|home workout|no equipment|sport|kayla itsines|sweat|kylie jenner|body fat|get thin|lose weight|fit|healthy|crunch|plank|strong|intense|fat burner|instagram|puma|bauchfett|hiit|cardio|30 seconds|kurz|keine gewichte|no weight|bodyweight|körpergewicht|pamela rf|muscle|tammy hembrow|bauchmuskeln|bauchspeck|burn calories|fat loss|legs|booty|butt|ganzkörper|bikini body|skinny|shape","wow - this one is NEXT LEVEL intense :D // Werbung You will definitely sweat and most likely struggle during those 15 minutes .. but that's alright. Just don't quit. But this killer workout burns a lot of calories - and that's what we need sometimes, right? ▸  In those 15min, you will burn anything between 80-150kcal, depending on your weight, height and fitness level. __No Equipment necessary and not much space needed :) If you need more breaks - TAKE THEM! Don't worry too much about that. You will improve over time :) that's the best feeling! The video is in full length which means you can just follow whatever I’m doing 30s for each exercise. I recommend switching up your workouts to give your muscles enough time to recover and to hit them from different angles. If you want to challenge your body in another way: check out my 10min Ab Workout, 20min Booty Workout or the Song Workouts.  __▸ You can always find ALL SONGS in my workout playlist. I update it weekly & it's available on Spotify, Apple Music, etc. ♥︎http://wmg.click/GetActive1. Ava Max - Torn 2. Lizzo feat. Ariana Grande - Good as Hell 3. Sam Feldt - Post Malone 4. Galantis – Faith (featuring Dolly Parton & Mr. Probz)5. Paulo Londra feat. Boogie Wit da Hoodie - Party__➞ Instagram http://www.instagram.com/pamela_rf/➞ Food Account http://www.instagram.com/pamgoesnuts/__unterstützt durch Warner Music GermanyDisclaimer:When joining me for this workout video, you need to take some precautions as your health and safety is the most important. To avoid any injury or harm, you need to check your health with your doctor before exercising. By performing any fitness exercises without supervision like with this video, you are performing them at your own risk. See a fitness professional to give you advice on your exercise form. Pamela Reif will not be responsible or liable for any injury or harm you sustain as a result of this video.","Super happy to be your online training buddy! ♡ free fitness videos in real time ♡ free workout schedules every Sunday on my Instagram (pamela_rf). Different versions: Beginner, 30min per day, 45min Slow & 45min Hard ♡ have a look at the YouTube Playlists to filter the workouts depending on your level!  all links / Impressum:www.pamelareif.com","","CPI_Ve7vsHs"
Th97oQ4eF9U,"10 Min Lower Abs Workout | BURN Lower Belly Fat | Free Flat Belly Program","UCCgLoMYIyP0U56dEhEL1wXQ","Chloe Ting","26","645.0","https://i.ytimg.com/vi/Th97oQ4eF9U/default.jpg","abs|ab|lower abs|lower ab|lower ab workout|lower abs workout|intense lower ab workout|intense lower belly exercises|10 min intense lower ab workout|ab workout|abs exercise|best exercise for lower abs|flat belly in 30 days|abs workout program|abs program|workout|exercise|flat stomach|flat tummy|홈트레이닝|홈트레이닝복근|복근운동|복부운동|복근|여자복근운동|여자복근만들기|여자복근|여자복근 만들기|복근만드는법","This is an intense 10 mins lower abs workout that will help you get that flat belly and toned abs. This video is part of my FREE 30 days flat belly challenge program. If you want to get flat abs and a six pack, try out this video as well as the others in this series to get those abs you want in 30 days.FREE 30 day FLAT BELLY CHALLENGE PROGRAM: https://www.chloeting.com/programEp 1 - 30 Min Full Body Workout: https://youtu.be/NQmnJtB1gzoEp 2 - 10 Mins Abs Workout: https://youtu.be/UBnfm4s7CRAEp 3 - 20 Mins Abs Hiit Cardio: https://youtu.be/owrBD7_8edAEp 4 - 10 Mins Lower Abs: https://youtu.be/Th97oQ4eF9UEp 5 - 45 Mins Full Body Burn: https://youtu.be/LDvAuqTZxMwCommunity RESULTS Video: https://youtu.be/VedbZeysJrkMeal Prep Video: https://youtu.be/CB0bqOCb1RE☆Help Subtitle this video☆http://www.youtube.com/timedtext_video?ref=share&v=Th97oQ4eF9USPONSOR THIS CHANNEL: https://www.youtube.com/chloeting/joinSUB TO MY 2ND CHANNEL: https://www.youtube.com/channel/UCBrcDabYtwbR1VIhwH5efZA?sub_confirmation=1☆Fitness Outfits☆My Gymshark Affiliate Link - https://gym.sh/Shop-Chloe-Ting ☆My Instagram links☆https://www.instagram.com/chloe_t/https://www.instagram.com/itschloeting/☆Filmed With☆Panasonic GH5Lumix G 8-18mm Lumix G 12-35mm Lumix G 42.5mmhttps://www.amazon.com/shop/chloeting☆Music by☆Track: Unknown Brain - Why Do I? (ft. Bri Tolani) [NCS Release]Music provided by NoCopyrightSounds.Watch: https://youtu.be/tcHJodG5hX8Free Download / Stream: http://ncs.io/WhyDoIYOTrack: Electro-Light - Symbolism pt.II [NCS Release]Music provided by NoCopyrightSounds.Watch: https://youtu.be/U7gDB634iAAFree Download / Stream: http://ncs.io/Symbolism2YOTrack: ÉWN - Feels [NCS Release]Music provided by NoCopyrightSounds.Watch: https://youtu.be/ZevEW7zwslAFree Download / Stream: http://ncs.io/feels#lowerabs #abs #absworkout","Subscribe to my channel and find weekly workout videos, healthy food recipes and other fun videos! I've got FREE workout programs on my channel with workout calendar schedules so check it out!","fitness health lifestyle healthy diet healthy diet workout bodybuilding exercise exercise for women women fitness gym abs flat tummy fitspo fitspiration fit girls absworkout abs workout fashion travel lookbook chloeting free workout program","CPI_Ve7vsHs"
6TmQiugy_qw,"Abs Workout 🔥Get that 11 Line Abs in 35 days","UCCgLoMYIyP0U56dEhEL1wXQ","Chloe Ting","26","668.0","https://i.ytimg.com/vi/6TmQiugy_qw/default.jpg","abs|abs workout|abs exercise|11 abs|11 abs workout|11 abs workout kpop|11 abs workout for women|11 abs workout in 4 weeks|lower ab workout|lower abs workout|intense ab workout|10 minute abs|flat belly exercise|flat belly workout|flat belly in 30 days|abs workout program|abs program|workout|exercise|flat stomach|flat tummy|10 min abs workout|30 day ab challenge|홈트레이닝|홈트레이닝 복근|복근운동|복부운동|복근|여자복근운동|여자복근만들기|여자복근|여자복근 만들기|복근만드는법","Want that 11 line abs? It's the 2019 Summer Shred Challenge! Time to burn that belly fat away, lose weight in time to get that summer body! This intense abs workout is 10 mins long, contains 12 abs exercises that will help you tone your abs towards that 11 line abs and flat tummy.Enjoy the workouts, and please do hit that like button, subscribe and leave a comment below.35 Days Summer Shredding Program:https://www.chloeting.com/program/☆ Summer Shred Challenge Videos ☆Episode 1 - Full Body Burn - https://youtu.be/Lscqihirc3cEpisode 2 - 11 Abs - https://youtu.be/6TmQiugy_qwEpisode 3 - HIIT Workout - https://youtu.be/mvlfZ43ehmEEpisode 4 - Arms & Back - https://youtu.be/d8STqg1VvN0Episode 5 - Booty & Toned Legs - https://youtu.be/mTgc6gpCEngWeight Loss Meal Ideas  - https://youtu.be/q65enzklzqo☆Help Subtitle this video☆http://www.youtube.com/timedtext_video?ref=share&v=6TmQiugy_qw☆Sponsor this channel☆https://www.youtube.com/chloeting/join☆Sub to my 2nd channel☆https://www.youtube.com/channel/UCBrcDabYtwbR1VIhwH5efZA?sub_confirmation=1☆My Instagram links☆https://www.instagram.com/chloe_t/https://www.instagram.com/itschloeting/☆Filmed With☆Panasonic GH5Lumix G 8-18mm Lumix G 12-35mm Lumix G 42.5mmhttps://www.amazon.com/shop/chloeting☆Music by☆MBB - Wake UpSoundCloud: https://soundcloud.com/mbbofficialhttps://bit.ly/DownloadWakeUpMusic provided by Monstercat: Conro - Remember Youhttps://youtube.com/monstercat https://youtube.com/monstercatinstinctVicetone - I Hear Youhttps://youtube.com/monstercat https://youtube.com/monstercatinstinctMarshmello - Alone (MRVLZ Remix)https://youtube.com/monstercat https://youtube.com/monstercatinstinctBishu - Way Uphttps://youtube.com/monstercat https://youtube.com/monstercatinstinct #abs #absworkout #chloetingchallengeIMPORTANT DISCLAIMER: Please note that all of my videos are titled according to SEO best practices for content discoverability. Unfortunately this may mean that video titles are subjective and shouldn't be seen as absolute truth. As an example, targeting fat reduction is not scientifically proven but a video title might suggest otherwise. When following any of my videos, please take precaution to exercise in a safe environment, and I highly suggest seeing a health and fitness professional to give you advice on your exercise form and dietary needs. Every person is unique and there is no one size fits all solution to health or fitness. I am not a medical professional and your health and safety is the utmost importance.","Subscribe to my channel and find weekly workout videos, healthy food recipes and other fun videos! I've got FREE workout programs on my channel with workout calendar schedules so check it out!","fitness health lifestyle healthy diet healthy diet workout bodybuilding exercise exercise for women women fitness gym abs flat tummy fitspo fitspiration fit girls absworkout abs workout fashion travel lookbook chloeting free workout program","CPI_Ve7vsHs"
LeOHID-EDA0,"Complete Fat Blasting Full Body Workout | Burn 500 Calories | Warm Up & Cool Down","UCCgLoMYIyP0U56dEhEL1wXQ","Chloe Ting","26","2097.0","https://i.ytimg.com/vi/LeOHID-EDA0/default.jpg","Full Body Workout|Workout|Burn Calories|workout|abs|exercise|full body|intense workout|workout exercise|fat burning|fat blasting|lose fat|burn fat exercise|fat burning workout|follow alo","Add this workout to your playlist NOW! This is a complete full body workout which includes a warm up and a cool down as well. It's a great full body workout that's going to get you sweating and feeling good. It burns about 300-500 calories depending on your stats and intensity.Remember, if you can't finish the workout, NEVER give up and stop. Just jog in place and track your progress over time. Hope you enjoy sweating to this one!☆My second Youtube Channel - VLOG & Behind The Scenes ☆https://www.youtube.com/channel/UCBrcDabYtwbR1VIhwH5efZA☆Wearing Gymshark Energy Seamless Set☆http://gym.sh/Shop-Chloe-Ting☆My Instagram links☆https://www.instagram.com/chloe_t/https://www.instagram.com/itschloeting/☆Filmed With☆Panasonic GH5Lumix G 8-18mm Lumix G 12-35mm Lumix G 42.5mmhttps://www.amazon.com/shop/chloeting☆Music☆Track: Raven & Kreyn - Biscuit [NCS Release]Music provided by NoCopyrightSounds.Watch: https://youtu.be/npG_UUUnwjIFree Download / Stream: http://ncs.io/BiscuitYOTrack: Unknown Brain - Perfect 10 (feat. Heather Sommer) [NCS Release]Music provided by NoCopyrightSounds.Watch: https://youtu.be/AEVaK0e1kTEFree Download / Stream: http://ncs.io/P10YOTrack: 2SCOOPS - Donuts [NCS Release]Music provided by NoCopyrightSounds.Watch: https://youtu.be/lc4Tt-CU-i0Free Download / Stream: http://ncs.io/DonutsYOTrack: Elektronomia - The Other Side [NCS Release]Music provided by NoCopyrightSounds.Watch: https://youtu.be/odThebFOFVgFree Download / Stream: http://ncs.io/TheOtherSideYOTrack: Elektronomia - Disco BoyMusic by ElektronomiaWatch: https://youtu.be/8_eDiZCVyR4Free Download / Stream: https://fanlink.to/Elektronomia_Disco_BoyTrack: Halcyon - Runaway (feat. Valentina Franco) [TARI Remix] | NCS ReleaseMusic provided by NoCopyrightSounds.Watch: https://youtu.be/k0Fz9FXos-UFree Download / Stream: http://ncs.io/RunawayTARIYO#workout #homeworkout","Subscribe to my channel and find weekly workout videos, healthy food recipes and other fun videos! I've got FREE workout programs on my channel with workout calendar schedules so check it out!","fitness health lifestyle healthy diet healthy diet workout bodybuilding exercise exercise for women women fitness gym abs flat tummy fitspo fitspiration fit girls absworkout abs workout fashion travel lookbook chloeting free workout program","CPI_Ve7vsHs"
aPpDDgf4FPY,"INTENSE ABS and LOSE BELLY FAT in 7 Days | 7 minute Home Workout","UCTsM1dSAiXqiV5oZjuNw_Bg","Lilly Sabri","22","489.0","https://i.ytimg.com/vi/aPpDDgf4FPY/default.jpg","home workout|at home workout|workout challenge|intense abs|abs workout|abs home workout|intense abs home workout|at home abs workout|loes belly fat|how to lose belly fat|lose fat|belly fat|belly fat burn|burn belly fat|flat stomach|how to get a flat stomach|lose stubborn fat|lose stubborn belly fat|how to lose stubborn belly fat|lose fat in 7 days|lose belly fat in 7 days|abs workout challenge|abs workout results|abs exercise|best abs workout|abs","This is an intense abs and lose belly fat in 7 days, 7 minute at home workout challenge. These intense abs exercises will help show you how to lose stubborn belly fat and get a flat stomach from home. For the best abs workout results, do this with good nutrition and my fat burn workouts.👟 My Trainers: HeatRDY Adidas Trainers @adidasrunning♥️ Get my Cookbook here:https://www.leanwithlilly.com/products/the-anti-inflammatory-cook-book🔥 Click here to download your free home workout programs:https://www.leanwithlilly.com💙 Gymshark Outfit: https://gym.sh/Shop-Lilly-Gymshark💛 FOLLOW ME:Instagram:  https://instagram.com/lillysabriPrivate Facebook Group- Lean with Lilly Guideshttps://www.facebook.com/groups/508730913266325/Twitter:  https://twitter.com/lillysabriFacebook:  https://www.facebook.com/lilly.sabri/0:00 Intense Abs Workout Introduction0:43 Lose Belly Fat Home Workout Challenge7:37 You Did It🔔 DON'T FORGET to Subscribe for daily uploads xxHit that bell icon to get a notification when I upload.Please remember that we cannot spot reduce fat, meaning we can’t choose the areas on our body where we loose fat. However to get fat loss results I recommend the following1. Being in calorie deficit2. Cardio/ HIIT workout (I often call these Fat Loss/Burn workouts on my channel)3. Specific muscle targeted workouts. To strengthen and develop specific muscles.The key to achieving your fitness and health goals is consistency and healthy lifestyle changes, without restriction. I don’t believe in crazy fad diets. Simply eat nutritious food, move your body, smile and enjoy the journey! Love Lilly","I’m Lilly Sabri, founder of Lean with Lilly. I’ve been a Chartered Physiotherapist since 2010, APPI Pilates instructor, Fitness, Heath and Lifestyle Influencer. Over the years, I’ve educated and empowered hundreds of thousands of people around the world to live a healthier lifestyle in a way that encourages increased body confidence regardless of shape, size and fitness level. Their transformations have been my driving force.My aim is to create a supportive community, accessible to anyone wanting to take control and make changes towards leading a healthier, happier lifestyle!I've now taken my years of physio experience and poured it into my guides, workout videos, and more to develop a fit, confident and healthy lifestyle for myself and others! Join the #LeanWithLilly family to take control, feel confident and make changes towards a healthier, happier lifestyle!Instagram/Twitter/Facebook: @lillysabriWebsite: www.leanwithlilly.com","fitness health lifestyle diet healthy diet workout exercise exercise for women women fitness gym abs flat tummy abs workout fashion travel free workout program home workout home exercise fitness challenge exercise challenge 11 line abs fitspo 11 abs body building lookbook workout challenge vlog health tips how to be healthy workout for women home workout guide free home workout guide","CPI_Ve7vsHs"
