video_id,title,channelId,channelTitle,categoryId,duration,thumbnail_link,tags,description,channel_desc,channel_keywords,related_vid_id
6o50I7535qA,"How Good is Dustin Poirier's Grappling?","UCe7PjUj3LI9jxmuK8yv8hCQ","The Fight Dialogue","17","1039.0","https://i.ytimg.com/vi/6o50I7535qA/default.jpg","mma|combat sports|jiujitsu|ufc|grappling|martial arts|fights|self defence|fighting|sports|competition|bjj|boxing|wrestling|muay thai|striking|sambo|judo|technique|champ|champion|title|belt|pfl|bellator|one fc|dustin poirier|diamond|max holloway|conor mcgregor|khabib nurmagomedov|dan hooker|ufc 257|darce choke|submission|ground game|breakdown|analysis|anthony pettis|Louisiana|fight island","Dustin Poirier is a man who has many ups and downs in his career. Many of those roller coaster moments have been the result of an exciting grappling exchange with which he was able to achieve victory, and fall short of it as well. In this video I give a detailed breakdown of how good Poiriers ground skills are.Patreon --- https://www.patreon.com/TFD1MERCH --- https://teespring.com/stores/tfd-merch-storeFor quality martial arts training equipment, check out our affiliate RevGear! --- https://revgear.com?aff=198Follow us on facebook and IG @fightdialogueSupport our podcast on Anchor! --- https://anchor.fm/podcast-tfdMusic --- Heisenburg by HomageBeats --- www.youtube.com/channel/UCbavHy2_zVCMCvVdR8qp2UQ(Disclaimer) --- I do not own the rights to any of these pictures/videos. All rights belong to the UFC, BELLATOR, ONE FC, PFL, MMAFIGHTING, SHERDOG, GETTYIMAGES and ESPN --- Under Section 107 of the Copyright Act 1976, allowance is made for 'fair use' for purposes such as criticism, comment, news reporting, teaching, scholarship, and research. Fair use is a use permitted by copyright statute that might otherwise be infringing. Non-profit, educational or personal use tips the balance in favor of fair use#DustinPoirier #UFC257 #ConorMcGregor","The channel where we talk about the world of martial arts and the evolving sport of MMA. We post three podcast episodes a month and other content every other week covering fight philosophy, life style, and technique.","Martial Arts MMA PODCAST COMBAT SPORTS","6lIvg3JLQk0"
hACmbLk9Feg,"The Penny Stock Analyst's Say Could Jump 400%, Catalysts Coming!! DARE Me to Buy?!","UC0h64epNmMIPYuqSGKCrj9Q","JT Wealth","27","571.0","https://i.ytimg.com/vi/hACmbLk9Feg/default.jpg","[none]","Taking a look at a penny stock that analysts rate a ''strong buy on TipRanks, with a 400% potential upside! Daré Bioscience, Inc. DARE Check out TipRanks, one of my favorite resources for analyst's insight & stock research! https://www.tipranks.com/go-premium?utm_source=JTwealth&utm_medium=affiliate&utm_campaign=cpa Link to my Patreon Group, with access to Discord Chat Group here: https://www.patreon.com/JTWealthPlease follow the channel on IG at: JT.Wealth and on Twitter @jt_wealthTo receive 4 FREE stocks after funding your account with $100, use my Webull link: https://act.webull.com/k/pgEWKgLxzLRQ/mainStart your own investing journey right along with me using M1 Finance and receive $10 for FREE after funding your acct here: https://m1.finance/jVKV7YCAyYyAGet a FREE stock on Robinhood (yes, Free money): Your free stock is waiting for you! Join Robinhood and we'll both get a stock like Apple, Ford, or Facebook for free. Sign up with my link: https://join.robinhood.com/travisk611For business inquiries: jt.wealth101@gmail.comAmazon Affiliate Links:https://amzn.to/30ZQ3JN   Atterstone Whiskey Globe Decanter Sethttps://amzn.to/3iKAsDT   2 Piece Stainless Steel Wine Pourer (Deer Head and Dragon)https://amzn.to/3h2UGbr   The Intelligent Investor BookSources:https://finance.yahoo.com/news/now-opportune-moment-examine-dar-062330283.html https://finance.yahoo.com/news/dar-bioscience-announces-positive-topline-130000145.html https://ir.darebioscience.com/static-files/e440b4ba-2a37-4e26-accd-2335002149af https://darebioscience.com/Again, I am not a financial advisor, this is not investment, tax, or legal advice. Any investments should only be made based on your own due diligence and research. This is for informational and entertainment purposes only. Do not make any buying or selling decisions based on my videos or channel. There has been no compensation by any companies for any of the stocks mentioned in my videos. Any sponsored content is required to be disclosed and will be done so accordingly. Some of the links on this page are affiliate/referral links, meaning, at no additional cost to you, I may also be awarded sign up bonuses for new account openings, or a commission if you click through and make a purchase. Affiliate/referral commissions help fund videos like this one.#Stocks #PennyStock","A girl and her wine talking about finance!","finance wealth investing stocks","6lIvg3JLQk0"
ma72dEjU9Yk,"Golden State Warriors vs Los Angeles Lakers Highlights 2nd Quarter | NBA Season 2021 - Jan 18","UC4aJtqYiDKJ5gG3UuYJb9aQ","MLG Highlights 2021","17","349.0","https://i.ytimg.com/vi/ma72dEjU9Yk/default.jpg","[none]","Golden State Warriors vs Los Angeles Lakers Highlights 2nd Quarter | NBA Season 2021 - Jan 18","","","6lIvg3JLQk0"
RdTH2GpAHg4,"Pair arrested by FBI in connection with riot at US Capitol","UC72UssJ1DNQcakZXm-B2-zw","WCVB Channel 5 Boston","25","66.0","https://i.ytimg.com/vi/RdTH2GpAHg4/default.jpg","Town Meeting member|woman|arrested|Natick|FBI|Massachusetts|boston|Boston","Two Massachusetts residents were arrested by the FBI in connection with the riot at the U.S. Capitol.Subscribe to WCVB on YouTube now for more: http://bit.ly/1e8lAMZGet more Boston news: http://www.wcvb.comLike us:  https://www.facebook.com/wcvb5Follow us: https://twitter.com/WCVBInstagram: https://www.instagram.com/wcvb5/","Visit WCVB.com for breaking news in Boston, MA from WCVB. Get updated New England local news, weather, and sports. All the latest local Boston news and more at ABC TV's local affiliate in Boston, Massachusetts, WCVB - Boston's Channel 5.","news weather boston wcvb breaking politics sports","6lIvg3JLQk0"
7GdKujUNMJU,"RYAN GARCIA CALLS OUT GERVONTA DAVIS AFTER KNOCKING OUT CAMPBELL W/ SPECTACULAR 7TH RD BODY SHOT!","UCYAFyhDgPaz2vkb_XeWNwVw","Fannon International Boxing Channel","17","627.0","https://i.ytimg.com/vi/7GdKujUNMJU/default.jpg","boxing manager boxing heavyweight boxing championship boxing boxing interview latest boxing knockout|mma|ufc|mixed martial arts|boxing workout|boxing fitness model|boxing commentary|tyson fury|boxing|sky sports|sky sports boxing|deontay wilder|boxing news|showtime|pbc|premier boxing champions|eddie hearn|matchroom boxing|top rank|mma news|ufc news|espn mma|ifl tv|blue blood sports tv|boxingego|ldbc|ufc espn|boxing rankings|gervonta davis","Ryan Garcia made me look good!!! Got to bet on the talent.  King Ry, got off his back to scare an exciting 7 round KO of Luke Campbell.  Garcia showed great heart, focus, and a nice chin...but flaws as well.  Let’s talk about Ryan Garcia and the fight in this video! Patreon:  https://www.patreon.com/fannonboxingVenmo:https://venmo.com/Fannon-Boxing-2https://twitter.com/FannonBoxingIf you like this video please select the SUBSCRIBE BUTTON and hit the BELL ICON.  That way you will be notified when a new video is released.  Thanks! boxingego ifl tv ldbc mma news blue blood sports tv","This channel is a boxing forum for avid boxing fans!  I share my opinion....please come share yours.  We discuss current and upcoming fights as well as the boxers that fight them.","boxing errol spence gervonta davis boxing commentary ldbc anthony joshua tyson fury pbc eddie hearn mathroom boxing floyd mayweather terence crawford canelo alvarez boxingego blue blood sports tv new media fighthub fighthype top rank pbc al haymon bob arum","6lIvg3JLQk0"
2-br9q4u954,"I Bought a Performance Tesla Model Y! (HILARIOUS)","UC9NYKlf0sEhjmLnIGzSEtfQ","FOUSEY","24","361.0","https://i.ytimg.com/vi/2-br9q4u954/default.jpg","fousey|fouseytube|yousef erakat|tesla|tesla model y|performance tesla|performance tesla model y|tesla model y review|delivery of tesla|i bought a new car|new car|car|cars|elon musk|car reviews","5,000 LIKES on this video and I'll do a follow up video to show you what it looks like with FULL BLACKOUT TINTS... Thanks for supporting this new chapter family. This is only the beginning. PS. Biggest Announcement of my career uploaded Friday. :)Follow:Instagram: https://www.instagram.com/fousey/Twitter: https://twitter.com/fouseyTik-Tok: https://www.tiktok.com/@fouseyPodcast: https://www.youtube.com/gottagetitMusic: Apple: https://music.apple.com/us/artist/fousey/954171261Spotify: https://open.spotify.com/artist/6GZUEdPWJRfQxTsgM9j120?si=HxufkL3ZTOewCZXjTiaT-QSerious Business Inquiries, Media Requests, Etc: YousefSErakat@Gmail.com#TESLA #ELONMUSK #CARS","Welcome to the life of FOUSEY in 2021!Follow:Instagram: https://www.instagram.com/fousey/Twitter: https://twitter.com/fouseyTik-Tok: https://www.tiktok.com/@fouseyPodcast: https://www.youtube.com/gottagetitMusic: Apple: https://music.apple.com/us/artist/fousey/954171261Spotify: https://open.spotify.com/artist/6GZUEdPWJRfQxTsgM9j120?si=HxufkL3ZTOewCZXjTiaT-QSerious Business Inquiries, Media Requests, Etc: YousefSErakat@Gmail.com","fousey fouseytube yousef erakat doseoffousey","6lIvg3JLQk0"
NEzG7f4aYU0,"What have i done to this girl's stream...","UC4N7s7vYsTs6eRGUYh2fIEQ","Nimbo","24","7.0","https://i.ytimg.com/vi/NEzG7f4aYU0/default.jpg","live|live stream fails|twitch|twitch highlight|best of twitch|funny twitch clips|funny|trainwrecks|summit1g|tfue|among us|fortnite|minecraft|shroud|hytale|recomended|ludwig|poke|asmongold|xqc|clips|pokimane|greekgodx|tyler1|mizkif|trend|viral|sodapoppin|slicker|vaush|destiny|myth|ninja|lirik|forsen|sweet anita|ksi|react|response|drama|thot|fedmyster|leak|exposed|cyberpunk|league of legends|new|pewdiepie|mrbeast|JJ olatunji|corpse|corpse husband|hasanabi|mr beast","What have i done to this girl's stream...Go follow NYYXXII!: hhttps://www.twitch.tv/nyyxxiiNew merch out now!https://streamlabs.com/nimbo1/merchBuy stuff here at a discount from Amazon!https://amzn.to/3sn7qzPInstagram: https://www.instagram.com/nimbo_youtube/?hl=enMore Pokimane twitch clips and fails: https://www.youtube.com/watch?v=iESSLdTt16M&list=PLQdWsFcoj5WHa0SN0JzwNeNXHR1QJboEY&ab_channel=Nimbo▬▬▬▬▬▬▬▬▬▬▬▬▬▬▬▬▬▬▬▬▬▬▬▬More from xQc: https://www.youtube.com/playlist?list=PLQdWsFcoj5WF7qpxny5as0oenH6r2KqO7For promotions contact me! -Jazzysansom123@gmail.com▬▬▬▬▬▬▬▬▬▬▬▬▬▬▬▬▬▬▬▬▬▬▬▬» If you nubs wanna join       Discord: https://discord.gg/GEN7VBmEpgRecommended For You: https://www.youtube.com/watch?v=ylQxBiLDEK4Hope you guys enjoyed these twitch funny moments and hope to bring you more funny twitch clips.I also upload twitch fails and compilation!▬▬▬▬▬▬▬▬▬▬▬▬▬▬▬▬▬▬▬▬▬▬▬▬Twitch streamers I usually watchxQc: https://www.youtube.com/channel/UCmDTrq0LNgPodDOFZiSbswwTrainwrecks: https://www.youtube.com/channel/UCbYVxiNJmsbhvlUmy4_JbXASliker: https://www.youtube.com/channel/UC2XKHR8yr6Zsa3NwXxbCD-QAli Larsen: https://www.youtube.com/user/madbaddog05Tyler1: https://www.youtube.com/channel/UCwV_0HmQkRrTcrReaMxPeDw» I do not take credit of this stream highlight, all credit goes to the content creator.      If you are the content creator and would like the video to be removed please contact me       Discord: Nimbo#6969","Hey guys it’s me Nimbo! Official channel of Nimbo, Ex TYT member, I upload Twitch clips too","Nimbo twitch agma.io twitch lyfe twitch clips nimbo agma nimbo.io","6lIvg3JLQk0"
Qj7xdoxD4yw,"Jay Williams shocked Bruce Arians takes a shot at Bill Belichick & Patriots over Tom Brady","UCeOaZhR60vjlVz1DfYWDnaA","McLinced","17","713.0","https://i.ytimg.com/vi/Qj7xdoxD4yw/default.jpg","NFL|NFL Highlights|Super Bowl LV|NFL 2020|NFL Gameday|NFL Good morning football|NFL Gameday Prime Live|Cowboys|Ravens|Patriots|Seahawks|Steelers|Titans|Buccaneers|Dak Prescott|Tom Brady|Lamar Jackson|Patrick Mahomes|Stephen A. Smith|Ian Rapoprt|Michael Irvin|First Take|Get up|NFL Draft 2020|Max Kellerman|Cam Newton|Chiefs|Undisputed Skip and Shannon|Sunday Night Foot Ball|Monday Night Football|Thursday Night Football|SNF|MNF|TNF","Jay Williams shocked Bruce Arians takes a shot at Bill Belichick & Patriots over Tom Brady","NFL on ESPN First Take","NFL NFL Highlights Super Bowl LV NFL 2020 NFL Gameday NFL Good morning football NFL Gameday Prime Live Cowboys Ravens Patriots Seahawks Steelers Titans Buccaneers Dak Prescott Tom Brady Lamar Jackson Patrick Mahomes Stephen A. Smith Ian Rapoprt Michael Irvin First Take Get up NFL Draft 2020 Max Kellerman Cam Newton Chiefs Undisputed Skip and Shannon Sunday Night Foot Ball Monday Night Football Thursday Night Football SNF MNF TNF","6lIvg3JLQk0"
-eRQrCvQuic,"Chimaev OUT Of UFC Fight Island 8 | Garcia vs Campbell | End Of Year Awards | Morning Kombat Ep. 100","UC9Qy3sHrr5wil-rkYcmcNcw","Morning Kombat","17","6706.0","https://i.ytimg.com/vi/-eRQrCvQuic/default.jpg","Morning Kombat|Luke Thomas|Brian Campbell|Morning Kombat with Luke Thomas|fight|UFC|sports|showtime|shosports|fight analysis|ufc analysis|livestream|podcast|Canelo Alvarez|Jermall Charlo|Conor McGregor|Dana White|Dana White Media|Dustin Poirier|McGregor Poirier 2|Ben Askren|Scott Coker|Scott Coker Bellator|Khamzat Chimaev|Leon Edwards|Fight Island 8|UFC Fight Island|UFC Fight Island 8|Ryan Garcia|Luke Campbell|Garcia Campbell|End Of Year Awards","It is finally here, the 100th episode of Morning Kombat has arrived and the boys end a crazy 2020 on a high note. Luke and Brian hand out their end of year awards and discuss the news that Khamzat Chimaev is OUT of UFC Fight Island 8. Plus, they preview Ryan Garcia vs. Luke Campbell. Get MORNING KOMBAT merchandise now: https://s.sho.com/2M5TshH#MorningKombat #UFC #Boxing #Rizin #KhamzatChimaev #RyanGarcia #LukeCampbellMORNING KOMBAT WITH LUKE THOMAS AND BRIAN CAMPBELL, Showtime's first live digital series, spotlights the weekend’s biggest news from the world of combat sports. MORNING KOMBAT airs live every Monday at 12 PM ET / 9 AM PT.Subscribe to Morning Kombat! https://bit.ly/2lPpvsjGet more SHOWTIME:Website: http://www.sho.com/sho/homeFollow: https://twitter.com/ShowtimeLike: https://www.facebook.com/showtimeInstagram: https://instagram.com/showtime/","Live digital series that spotlights the weekend’s biggest news from the world of boxing and mixed martial arts. Premieres every Monday, Wednesday and Friday at 11AM ET / 8AM PT.","Morning Kombat Luke Thomas Brian Campbell MMA mixed martial arts boxing combat sports results UFC results UFC news UFC rumors Conor McGregor Khabib Nurmagomedov Showtime CBS Sports Dana White Joe Rogan Floyd Mayweather Canelo Alvarez Manny Pacquiao UFC analysis sports live chat Brock Lesnar Jon Jones Teofimo Lopez Tyson Fury Mike Tyson Dissected breakdown Deontay Wilder Israel Adesanya pay-per-view ESPN Bellator MMA","6lIvg3JLQk0"
KJlBKnxiU94,"TEOFIMO LOPEZ DEMOLISHES  RYAN GARCIA SAYS CONLAN, SHAKUR STEVENSON LAUGHS @ NEW ”4 HORSEMAN”!","UCYAFyhDgPaz2vkb_XeWNwVw","Fannon International Boxing Channel","17","587.0","https://i.ytimg.com/vi/KJlBKnxiU94/default.jpg","boxing manager boxing heavyweight boxing championship boxing boxing interview latest boxing knockout|mma|ufc|mixed martial arts|boxing workout|boxing fitness model|boxing commentary|tyson fury|boxing|sky sports|sky sports boxing|deontay wilder|boxing news|showtime|pbc|premier boxing champions|eddie hearn|matchroom boxing|top rank|mma news|ufc news|espn mma|ifl tv|blue blood sports tv|boxingego|ldbc|ufc espn|boxing rankings|gervonta davis","There is a good amount of excitement about Ryan Garcia’s win against Luke Campbell.  But we should not get carried away.  Garcia has shown that he is a legit contender in the lightweight division but not that he is one of the top lightweights.  Mike Conlan, a top rank fighter that entered the pro ranks around the same time as Garcia, believes that Ryan is not ready for Teofimo Lopez just yet...Shakur Stevenson thinks the whole conversation is ridiculous.  Let’s talk about that in this video!Patreon:  https://www.patreon.com/fannonboxingVenmo:https://venmo.com/Fannon-Boxing-2https://twitter.com/FannonBoxingIf you like this video please select the SUBSCRIBE BUTTON and hit the BELL ICON.  That way you will be notified when a new video is released.  Thanks! boxingego blue blood sports tv ldbc ifl tv mma news","This channel is a boxing forum for avid boxing fans!  I share my opinion....please come share yours.  We discuss current and upcoming fights as well as the boxers that fight them.","boxing errol spence gervonta davis boxing commentary ldbc anthony joshua tyson fury pbc eddie hearn mathroom boxing floyd mayweather terence crawford canelo alvarez boxingego blue blood sports tv new media fighthub fighthype top rank pbc al haymon bob arum","6lIvg3JLQk0"
kkFdw9aEbaY,"Duncan Robinson on His Unlikely Journey from Division III to The NBA Finals | The Long Shot Podcast","UCbPY1Efha9VPRBYW2x1M16A","JJ Redick","17","1988.0","https://i.ytimg.com/vi/kkFdw9aEbaY/default.jpg","duncan robinson|duncan robinson the long shot podcast|duncan robinson the long shot|the long shot podcast|davis reid|duncan robinson miami heat|duncan robinson story|duncan robinson heat|duncan robinson nba finals|duncan rabinson shooting|duncan robinson 3-point shooting|the long shot|jj redick duncan robinson|threefourtwo producations","Welcome to the debut episode of The Long Shot Podcast with Duncan Robinson and Davis Reid. The Long Shot is a podcast about underdog stories and come-ups in the sports world and beyond. In this episode, Duncan Robinson (The Miami Heat) discusses his unlikely journey from Division III college basketball to becoming one the the best 3-point shooters in The NBA for The Miami Heat. He talks about all the stops along the way including his time at The University of Michigan and The G-League. Subscribe to The Long Shot Podcast with Duncan Robinson and Davis Reid on Apple and Spotify.","Hosted by JJ Redick and Tommy Alter, The Old Man and the Three podcast is presented by ThreeFourTwo Productions and available wherever you get your podcasts.","","6lIvg3JLQk0"
jVkOpxluhBY,"What Is Bitcoin & How Does It Work? (w/ Andrei Jikh) - IMPAULSIVE EP. 250","UCGeBogGDZ9W3dsGx-mWQGJA","Impaulsive","24","4662.0","https://i.ytimg.com/vi/jVkOpxluhBY/default.jpg","podcast guest|Jake Paul brother|impaulsive|impaulsive podcast|logan paul podcast|maverick|andrei jikh|bitcoin|what is bitcoin|how is bitcoin mined|finance|financial guru|bitcion guru|cryptocurrency|is bitcoin legit|how to buy bitcoin|what is bitcoins market cap|is bitcoin better than gold|mike majlak|george janko|magic tricks|now you see me 2|ethereum|litecoin|alt coins|algo|gold|president|joe biden|donald trump|economy|bitcoin price","Bitcoin & financial guru, Andrei Jikh, joins the boys to explain the complex yet revolutionary system that is Cryptocurrency: What is a Bitcoin? How are they mined? What is the market cap and when will it stop growing? What about “Alt” coins, like Ethereum, Litecoin, or ALGO? + much more. PLUS... Andrei’s exclusive card tricks that he taught to the cast of Now You See Me 2... Wear Maverick Clothing ► https://maverickclothing.comSUBSCRIBE TO THE PODCAST ► https://www.youtube.com/impaulsiveLISTEN ON:ITUNES: https://itunes.apple.com/us/podcast/impaulsive-with-logan-paul/id1442164847?mt=2SPOTIFY: https://open.spotify.com/show/36PzTdM4rvRPaJYdBW1ZNa?si=NIdEVBarRWuw17x3ubWZCwCASTBOX: https://castbox.fm/vc/1486024Get 15% off your order at http://BUYRAYCON.com/loganAndrei's Channel: How to Buy Bitcoin Safely https://m.youtube.com/watch?v=fAmdC64KKdM“How Andrei Went From Zero To A Million” https://www.zerotoamillion.com/paulWatch Previous (Logan Paul Responds to Jake Paul: “My Brother Is A Fake Fighter) ► https://www.youtube.com/watch?v=GHWktWq5PSw&t=814s&ab_channel=ImpaulsiveADD US ON:INSTAGRAM: https://www.instagram.com/impaulsiveshow/***PLEASE NOTE***Impaulsive is a significant break from the typical content viewers have come to expect from the vlog channel & we could not be more proud and excited to watch this unfold and grow. Please be advised that we will be exploring a wide variety of topics (some adult-themed) and our younger viewers (and their parents) should be advised that some topics will be for mature audiences only.","The world's greatest, most thought-provoking, mentally stimulating podcast in the history of mankind... hosted by a bunch of idiots.","impaulsive impaulsive podcast Logan Paul podcast Logan podcast impulsive podcast maverick","6lIvg3JLQk0"
pr_SYjooELg,"HIGHLIGHTS | LeBron James (19 pts, 5 reb, 5 ast) vs Golden State Warriors","UC8CSt-oVqy8pUAoKSApTxQw","Los Angeles Lakers","17","115.0","https://i.ytimg.com/vi/pr_SYjooELg/default.jpg","Lakers|NBA|Basketball|Los Angeles|Showtime|LakeShow|LA|Sports|National Basketball Association","Subscribe for the latest Lakers' content: https://www.youtube.com/channel/UC8CSt-oVqy8pUAoKSApTxQwFollow us on Facebook: https://www.facebook.com/lakersFollow us on Instagram: https://www.instagram.com/lakers/Follow us on Twitter: https://twitter.com/LakersGet the Lakers app: https://www.nba.com/lakers/multimedia...Check out the Lakers full 2019-20 regular-season schedule: https://www.nba.com/lakers/schedule","Official YouTube channel of the 16-time NBA Champion Los Angeles Lakers","Lakers Los Angeles Basketball NBA","6lIvg3JLQk0"
xJpVD8NhcQ0,"RYAN GARCIA NOQUEA A LUKE CAMPBELL Análisis post-combate | Auténtico Boxing","UCp5lLx--CeltdsTRoIxjcSQ","Auténtico Studios","22","270.0","https://i.ytimg.com/vi/xJpVD8NhcQ0/default.jpg","autentico studios|auténtico studios|autentico boxing|auténtico boxing|boxing|boxeo|boxing analysis|boxing review|fights|peleas|análisis de boxeo|boxeo aficionado|puerto rico|arecibo|star wars|movies|peliculas|comedia|comedy|tal vez mañana|podcast|movies reviews|análisis de peliculas|cine|series|netflix|hulu|disney+|canelo alvarez|mayweather|pacquiao|alex candelario|Ryan garcia|Luke campbell|Garcia vs campbell|kingry","Ryan García NOQUEA A LUKE CAMPBELLAnálisis del combate#RyanGarcia #LukeCampbell #Boxing #Boxeo #GarciaCampbellSÍGUENOS Alex CandelarioInstagram: https://www.instagram.com/soyalexcandelario/REDES SOCIALES - Auténtico StudiosInstagram: https://www.instagram.com/autenticostudios/Facebook: https://www.facebook.com/autenticostudios/Podcast:Spotify: https://open.spotify.com/show/4zGdtoQuUO28ZOGICeJd0Y?si=kcJ-JBWdS_uKkRPsJY4ATgApple Podcast: https://podcasts.apple.com/us/podcast/aut%C3%A9ntico-studios/id1491119493Stitcher: https://www.stitcher.com/s?fid=490332&refid=stpr","Auténtico Studios es un espacio creado por jóvenes puertorriqueños que quieren traer conceptos diferentes. Con producciones de distintos tipos, informar y entretener, en un espacio sano y abierto. ¡Síguenos, para que veas todo lo que tenemos para ti!","autentico auténtico studios autentico studios box office weekly tal vez manana tal vez mañana hulu netflix boxeo podcast puerto rico auténtico boxing comedia risa deportes sports arecibo radio media entretenimiento blog vlog empresas en vivo facebook redes sociales studios netflix video edicion capitanes de arecibo","6lIvg3JLQk0"
_bhCpskKnWc,"Stephen A.: Kevin Durant will win NBA MVP and Comeback Player of the Year! | First Take","UCiWLfSweyRNmLpgEHekhoAg","ESPN","17","364.0","https://i.ytimg.com/vi/_bhCpskKnWc/default.jpg","first take|kevin durant|nba|nba on espn|espn nba","Stephen A. Smith eagerly declares Kevin Durant will be crowned MVP and Comeback Player of the Year after his strong start with the Brooklyn Nets.#FirstTake #NBA✔️ Subscribe to ESPN+https://plus.espn.com/✔️ Get the ESPN App: http://www.espn.com/espn/apps/espn✔️ Subscribe to ESPN on YouTube: http://es.pn/SUBSCRIBEtoYOUTUBE✔️ Subscribe to NBA on ESPN on YouTube: http://bit.ly/SUBSCRIBEtoNBAonESPN✔️ Watch ESPN on YouTube TV: http://es.pn/YouTubeTVESPN on Social Media:► Follow on Twitter: http://www.twitter.com/espn► Like on Facebook: http://www.facebook.com/espn► Follow on Instagram: http://www.instagram.com/espnVisit ESPN on YouTube to get up-to-the-minute sports news coverage, scores, highlights and commentary for NFL, NHL, MLB, NBA, College Football, NCAA Basketball, soccer and more. More on ESPN.com: https://www.espn.com","ESPN on YouTube features up-to-the-minute sports news coverage, scores, highlights and commentary for NFL, NHL, MLB, NBA, College Football, NCAA Basketball, Soccer, Fantasy, UFC/Boxing and more. ✔ Subscribe to ESPN on YouTube: http://es.pn/SUBSCRIBEtoYOUTUBE✔ Watch ESPN on YouTube TV: http://es.pn/YouTubeTVGet more ESPN on YouTube:► First Take: http://es.pn/FirstTakeonYouTubeESPN on Social Media:► Follow on Twitter: http://www.twitter.com/espn► Like on Facebook: http://www.facebook.com/espn► Follow on Instagram: http://www.instagram.com/espnMore on ESPN.com: http://www.espn.com","espn sports sports news sports live sports clips sports videos sports center sportscenter sports channel sports documentaries first take the jump sportsnation outside the lines nfl live nba countdown highlights","6lIvg3JLQk0"
