video_id,title,channelId,channelTitle,categoryId,duration,thumbnail_link,tags,description,channel_desc,channel_keywords,related_vid_id
s5tQXDuOkTE,"EXCLUSIVE: EDDY REYNOSO EXPLAINS WHY CANELO WILL GO DOWN AS THE GREATEST MEXICAN FIGHTER IN HISTORY!","UCzp5-dEdqKOS9tCF8S-UErg","Little Giant Boxing","17","1682.0","https://i.ytimg.com/vi/s5tQXDuOkTE/default.jpg","Eddy Reynoso Canelo greatest Mexican fighter in history|Best Mexican fighters ever|Canelo greatest Mexican fighter in history|Eddy Reynoso says Canelo is the best Mexican fighter ever|Boxing|Boxeo|Little Giant Boxing Eddy Reynoso exclusive|Canelo vs Gennady Golovkin trilogy|Canelo vs Callum Smith|Eddy Reynoso talks|Canelo vs Miguel cotto fight|Greatest Mexican Fighter in History|Canelo the greatest Mexican fighter in history|Sugar Ray Leonard Canelo Tommy Hearns","#Canelo #EddyReynoso #MexicanfightersEXCLUSIVE: EDDY REYNOSO EXPLAINS WHY CANELO WILL GO DOWN AS THE GREATEST MEXICAN FIGHTER IN HISTORY!In this video, Eddy Reynoso sat down with Constantino Garcia in an exclusive interview to talk about why he believes Saul “Canelo” Alvarez will go down in history as the greatest Mexican fighter in history. Eddy Reynoso uses stats, data, facts, as well as Canelo’s boxing resume to justify why he believes Canelo will go down as the greatest Mexican fighter ever. Eddy Reynoso talks about his favorite victory with Canelo which is Miguel Cotto. Eddy Reynoso explains what makes Canelo’s career so special and unique. Eddy says Canelo has accomplished so much as the young age of 30 years old compared to what other greats such as Julio Cesar Chavez Sr, Salvador Sanchez, Finito Lopez, Erik Morales, Juan Manuel Marquez etc. Eddy Reynoso also talks about the humble beginnings he had with Canelo when they were barely starting his career as well as the struggles that come with success such as missing Christmas, New Years, with his wife and daughters. Eddy Reynoso compares Canelo’s career and resume to other Mexican greats and explains why Canelo is a unique case and justifies why he will go down as the best.","Bringing you behind the scenes with your favorite fighters. Boxing interviews, training, and one on one interviews","Boxing Boxeo Little Giant Boxing Canelo","6lIvg3JLQk0"
JcDwx4M1taM,"(WOW!) GERVONTA DAVIS CLOWNS RYAN GARCIA FOR “EATING PUNCHES”, RYAN GARCIA NOT AND ELITE FIGHTER?!","UCYAFyhDgPaz2vkb_XeWNwVw","Fannon International Boxing Channel","17","653.0","https://i.ytimg.com/vi/JcDwx4M1taM/default.jpg","boxing manager boxing heavyweight boxing championship boxing boxing interview latest boxing knockout|mma|ufc|mixed martial arts|boxing workout|boxing fitness model|boxing commentary|tyson fury|boxing|sky sports|sky sports boxing|deontay wilder|boxing news|showtime|pbc|premier boxing champions|eddie hearn|matchroom boxing|top rank|mma news|ufc news|espn mma|ifl tv|blue blood sports tv|boxingego|ldbc|ufc espn|boxing rankings|gervonta davis","Ryan Garcia had a great night last night in his win with Luke Campbell.  It was a step-up fight and not a championship matchup...but it was very entertaining.  With the win, Garcia puts himself in a position to fight Devin Haney.  Not surprisingly, Garcia immediately dropped any conversation about fighting Haney for that belt.Patreon:  https://www.patreon.com/fannonboxingVenmo:https://venmo.com/Fannon-Boxing-2https://twitter.com/FannonBoxingIf you like this video please select the SUBSCRIBE BUTTON and hit the BELL ICON.  That way you will be notified when a new video is released.  Thanks! boxingego ifl tv ldbc mma news blue blood sports tv","This channel is a boxing forum for avid boxing fans!  I share my opinion....please come share yours.  We discuss current and upcoming fights as well as the boxers that fight them.","boxing errol spence gervonta davis boxing commentary ldbc anthony joshua tyson fury pbc eddie hearn mathroom boxing floyd mayweather terence crawford canelo alvarez boxingego blue blood sports tv new media fighthub fighthype top rank pbc al haymon bob arum","6lIvg3JLQk0"
zish1t107v4,"GARCIA STOPS CAMPBELL!! Ryan Garcia vs Luke Campbell Review/Result...WHATS NEXT?","UCibGr-o6pA-16IhAHnj7pEQ","MB BoxingOfficial","22","302.0","https://i.ytimg.com/vi/zish1t107v4/default.jpg","[none]","On Saturday January 2nd from the American Airlines Center in Dallas Texas, after getting dropped for the first time in his career, Ryan Garcia battles back, hurts, and stops Luke Campbell in the seventh round with a liver shot to become the new interim WBC lightweight champion.","Predictions, Reviews, and News simply about boxing 🥊 Young Boxing Enthusiast Been to over 20 professional boutsStarted in boxing at age 5My favorite fighter is Gennadiy Golovkin aka “GGG”","","6lIvg3JLQk0"
GBQzj2yVDqY,"*wears AirPods Max once*","UCc35WvHmQjLE8NN4Y_ITmUQ","Trevor Wallace","23","321.0","https://i.ytimg.com/vi/GBQzj2yVDqY/default.jpg","trevor wallace|trevor walace|travis wallace|monster|airpods|airpods max|airpod|airpods max pro|unbox|marques brown|marques|mkbhd","if u ain't tryna (airpods) Max out, you better back out. -s/o to @Jonathan Morrison for the cameo and AirPods Max hook up !check his page for for tech reviews! Like this one!https://www.youtube.com/watch?v=oSaA9iB99kU&feature=youtu.be -Shot by @Ryan The Leader -Come see me live in Phoenix, AZ. This weekend Jan. 21-24th (6 socially distanced shows)!!https://trevorwallacecomedy.com/shows/phoenix-az-jan-21-24 -all other stuff go to my website!https://trevorwallacecomedy.com/-Book me on cameo this valentine's day!https://www.cameo.com/trevwall -if ur still reading that, go comment cat probably got Soulja Pods","Trevor Wallace is a stand up comedian and actor who specializes in making fun of the people closest to him. Here you'll find a mix of sketches, stand up comedy, a podcast and more relatable STUFF.Instagram: https://www.instagram.com/trevorwallaceFacebook: https://www.facebook.com/TrevorWallaceComedyTwitter: https://twitter.com/TrevWallBusiness: TWallComedy@gmail.comBook me for a shoutout! https://www.bookcameo.com/trevwall","Comedy","6lIvg3JLQk0"
MPn3e3Cg1NM,"BREAKING! Bumagsak si Ryan Garcia! Pero PANALO via 7th RD TKO! | Si Pacquiao ang GUSTO ISUNOD!","UCzzflHnkC32Z7oOP5GxyZ_Q","SportsTalk PH","17","132.0","https://i.ytimg.com/vi/MPn3e3Cg1NM/default.jpg","ryan garcia|ryan garcia vs luke campbell|luke campbell|ryan garcia vs manny pacquiao|manny pacquiao|manny pacquiao vs ryan garcia|ryan garcia knockdown|ryan garcia latest fight|boxing news|boxing updates|philippines|pilipinas|sportstalk ph|martin quintano","Ryan Garcia vs Luke Campbell | Manny Pacquiao | Boxing news & updates! Follow us on Instagram: (@SportsTalkPH) https://instagram.com/sportstalkph?igshid=14e4q3klb3zsyLike us on Facebook: (SportsTalk PH) https://www.facebook.com/SportsTalkPH/Personal Instagram Account: @MartinquintanoPersonal Facebook Account: Martin QuintanoThank you for watching. This is SportsTalk PH! Wag pong kakalimutang mag subscribe at iclick ang notification bell button for more SportsTalk! Maraming salamat po sa suporta! *Copyright Disclaimer Under Section 107 of the Copyright Act 1976, allowance is made for “fair use” for purposes such as criticism, comment, news reporting, teacher, scholarship, and research. Fair use is a use permitted by copyright statute that might otherwise be infringing. Non profit, educational or personal use tips the balance in favor of fair use. No Copyright infringement intended. ALL RIGHT BELONG TO THEIR RESPECTIVE OWNERS*For business inquiries email me at martinquintano11@gmail.com#SportsTalkPH","Welcome to SportsTalk PH. Usapang sports lang lahat mga idol. Wag kakalimutang mag subscribe bilang suporta sa channel natin. Maraming salamat!","Manny Pacquiao Boxing Basketball NBA","6lIvg3JLQk0"
uR84ErQC7gE,"Max on Boxing | Max Kellerman & Ryan Garcia reacts won WBC interim lightweight title as K.O Campbell","UC09dDXOyXrrMg3bDFCgHkIQ","FIRST TAKE NFL","17","1234.0","https://i.ytimg.com/vi/uR84ErQC7gE/default.jpg","[none]","Max on Boxing | Max Kellerman & Ryan Garcia reacts won WBC interim lightweight title as K.O Campbell","","NFL NFL Gameday NFL Total Access Good Morning Football First Take ESPN First Take NFL News Today","6lIvg3JLQk0"
nBf-BMDTYDY,"LaMelo Ball Reacts To Becoming The Youngest Player In NBA History To Post Triple-Double","UC9-OpMMVoNP5o10_Iyq7Ndw","Bleacher Report","17","200.0","https://i.ytimg.com/vi/nBf-BMDTYDY/default.jpg","bleacher report|br|nba|lamelo ball|lamelo ball highlights|lamelo ball 19|lamelo ball charlotte hornets|lamelo ball rookie highlights|lamelo ball nba|lamelo ball triple-double|lamelo ball nba history|lamelo ball best passes|lamelo ball best highlights|lamelo ball 2021|lamelo ball 2021 highlights|lamelo ball vs. trae young|lamelo ball hornets|lamelo ball best assists|lamelo ball mix|lamelo ball fadeaway|lamelo ball 3-pointer|charlotte hornets|atlanta hawks","LaMelo Ball continues to impress as Charlotte's No. 3 overall draft pick. Tonight, he made NBA history at just 19 years old. He finished with 22 PTS, 12 REB, 11 AST in a win over the Atlanta Hawks. Subscribe: https://www.youtube.com/user/BleacherReport?sub_confirmation=1Follow on IG: http://www.instagram.com/f/bleacherreportFollow us on Twitter: http://www.twitter.com/bleacherreportLike us on Facebook: http://www.facebook.com/bleacherreport","The official YouTube page of Bleacher Report. Subscribe to see sports highlights, features and animations that drive fandom and bring the culture of sports to life.","sports bleacher report nba mma ufc football basketball nfl mlb baseball playoffs","6lIvg3JLQk0"
XqNjxJk29yc,"TOP: LOMACHENKO THREATENS TO EXPOSE RYAN GARCIA W8R SPARRING TAPE SAYS GARCIA WAS TERRIFIED","UCfjoPL1zn6jtNWNJwq6H0RA","BOXINGEGO","17","726.0","https://i.ytimg.com/vi/XqNjxJk29yc/default.jpg","ryan garcia sparring|ryan garcia campbell|ryan garcia vs luke campbell|becoming a monster|snowqueen|vasiliy lomachenko|lomachenko|vasyl lomachenko|lomachenko lopez|teofimo lopez|lomachenko linares|boxing|boxing news|boxing life|manny pacquiao|oleksandr usyk|errol spence|terence crawford|gervonta davis|devin haney|ryan garcia|garcia vs campbell|leo santa cruz|ukrainian|василий ломаченко|conor mcgregor|fighting|ufc|#boxingego|mma news","lomachenko threatens he can expose ryan garcia W8R Sparring if he wanted HYPE says ryan was terrifed. Hear more of EGO's  thoughts on in this BOXINGEGO boxing news Youtube video. Check out the new one by BOXINGEGO for boxing news latest today and daily content! WATCH IT NOW!  ⠀⠀⠀⠀⠀⠀⠀⠀⠀⠀⠀⠀   ⠀⠀⠀⠀⠀⠀⠀⠀⠀⠀⠀⠀https://linktr.ee/boxingego✔ ESPN+ app for more Boxing, UFC, Sports Documentaries and more!CLICK HERE: https://go.web.plus.espn.com/Q3LBP (Affiliate). ✔ Amazon Products I use!https://www.amazon.com/shop/boxingego✔ INSTALL TUBEBUDDY TODAY TO HYPE UP YOUR YOUTUBE CHANNEL!CLICK HERE: https://www.tubebuddy.com/BOXINGEGOAffiliate Links Notice: By clicking the above links, you will support the channel directly!SOURCE: https://youtu.be/RxTgwNtQI1w*** 🤑 Donate-the-Creator▶ Zelle - directedbyego@gmail.com▶ $CashApp - cash.app/$BOXINGEGO▶ Patreon - https://www.patreon.com/BOXINGEGO▶ PayPal -  https://www.paypal.me/BoxingEGO▶ StreamLabs - https://streamlabs.com/boxingego1▶ Venmo - https://venmo.com/BOXINGEGO❤ Become a Channel Member: https://www.youtube.com/watch?v=4i-BGbZJkWg&t=2865s&ab_channel=BOXINGEGOFollow Boxingego on Social Media:Subscribe on YouTube: ☞  https://www.youtube.com/user/EGOSWORLD1?sub_confirmation=1TWITTER: ☞ https://twitter.com/boxingegoINSTAGRAM: ☞ http://instagram.com/boxingego1FACEBOOK: ☞ https://www.facebook.com/boxingegoMore on BOXINGEGO.comLOMACHENKO CALLS OUT GERVONTA DAVIS; TALKS SPARRING RYAN GARCIA, PICKS LUKE CAMPBELL TO WIN... VIDEO REACTION by BOXINGEGOBoxingego is a large boxing news show Hosted by EGO the owner and founder. Check the channel out for the fastest news in boxing, exclusive live streams, and the best boxing talk on the net. Always real, always original, always RAW.Help support our mission to protect BOXINGEGO’s creativity and originality. Your support allows me to create 100% original content, provide free live shows, and all associated costs of being an independent Creator on this platform. Thanks in advance!#Lomachenko #RyanGarciaSPARRING #Boxingego","Welcome to the OFFICIAL VERIFIED BOXINGEGO YouTube Channel giving the fight fans the rawest, pure, uncut, DAILY edge-of-your-seat entertainment in boxing & combat sports. Subscribe to catch EGO LIVE at various boxing cards around the world covering stars like Floyd Mayweather, Canelo Alvarez, GGG, Terence Crawford, Errol Spence Jr., Conor McGregor, Deontay Wilder, Anthony Joshua, Gervonta Davis, Keith Thurman, Shawn Porter, Roy Jones, and others. I want to always be transparent with fight fans, making BOXINGEGO your non-stop, round-the-clock hub for fights, giving boxing events the proper fight hype, complete with the latest and greatest information. My early influences are Muhammad Ali, Prince Naseem Hamed, the great Roy Jones Jr., Mike Tyson, Julio Cesar Chavez, Sugar Ray Leonard, Felix Tito Trinidad, and many more. I plan to deliver the best boxing content on the net from Showtime Boxing, Premier Boxing Champions (PBC), DAZN, & ESPN(+). Enjoy! -EGO http://www.boxingego.com","#boxing #boxingego #sports #fights #breaking #breakingnews breaking news breaking highlights youtube video sports youtube videos boxing boxingego boxing videos #new #caneloalvarez canelo #adrienbroner pbc fox showtime boxing boxing news #boxingnews exclusive breaking! top stories boxingego.com boxing newz","6lIvg3JLQk0"
_Mjo_npUP7k,"Science of Ryan Garcia PERFECT Liver Shot KO!","UCP0Y8EXT7V1o-gDROpZktZQ","David Abbasi, MD","28","128.0","https://i.ytimg.com/vi/_Mjo_npUP7k/default.jpg","Ryan Garcia|King Ryan|King Ryan Garcia|Luke Campbell|David Abbasi md|Dr David Abbasi|Boxing|Liver shot|Knockout|Gervante davis|Oscar delahoya|Canelo Alvarez","My Breakdown on Ryan Garcia’s Liver Shot KO. Quickly learn about Liver Physiology & how Liver shots make fighters go down and unable to continue.  Tip- It has nothing to do with toughness...If you like this video on Liver Shots make sure to check my longer video on my channel from 1 month ago. 😷👊🏼👍🏼 David Abbasi, MD-Board Certified In Orthopedic Surgery & Sports Medicine -UFC/Pro MMA & Boxing Ringside Physician#RyanGarciaVsLukeCampbell #RyanGarcia #LukeCampbell #boxing #mma#kingryan #caneloalvarez #gervantadavis #oscardelahoya #floydmayweather #ggg #kickboxing #fitness #muaythai #ufc #bjj #boxingtraining #training #fight #gym #martialarts #boxeo #workout #fighter #motivation #sport #boxinglife #wrestling #jiujitsu #karate #boxer #boxingworkout #fitnessmotivation #champion #sports #fit","😷 Orthopedic Sports Medicine Surgeon⚒👊🏼 UFC/Pro MMA Ringside Physician💉📺 Insider MMA & Sports Injury Breakdowns!🗣🦴🫀👉SUBSCRIBE and Turn On the Notifications! ✅","Orthopedic Sports Medicine MMA Boxing Sports Medicine Dr. David Abbasi David Abbasi MD UFC Bellator OneFc Mixed Martial Arts Ringside Physician Knee Shoulder Elbow Anatomy","6lIvg3JLQk0"
TBoJdnUfXEo,"ROBERT GARCIA SAYS RYAN GARCIA BEATS GERVONTA TANK DAVIS BUT IT'S A CLOSE FIGHT  EsNews Boxing","UCI-Oq7oFGakzSzHFlTtsUsQ","ESNEWS","17","767.0","https://i.ytimg.com/vi/TBoJdnUfXEo/default.jpg","elie seckbach|esnews|boxing|mma|sports interviews|es news|boxing news|mma news|boxing interviews|mma interviews|champion|championship|gold medal|boxeo|knockout|winner|boxing movie|USA|AUSTRALIA|NEW ZEALAND|UK BOXING","Elie Seckbach ReportingSubscribe: https://www.youtube.com/user/ESNEWSFollow TALENT:➡️ Follow my IG: https://www.instagram.com/elieseckbach/➡️ Twitter: https://twitter.com/SeckbachOfficial Website: http://www.esnewsreporting.com/ Watch More ESNEWS:➡️ Latest Uploads: http://bit.ly/esnews-latest-uploads➡️ The Robert Garcia Reality Show: http://bit.ly/robert-garcia-reality-show➡️ Brandon Krause Videos: http://bit.ly/brandon-krause-videos➡️ Boxing Basics: http://bit.ly/boxing-basics➡️ Popular Videos: http://bit.ly/esnews-popular-videos About ESNEWS:Elie Seckbach (אלי זקבך) features by the LA Times and Ring Magazine as the Most Influential boxing reporter has been covering Sports BOXING MMA & The NBA since 1997. ✅ His ability to get interesting quotes from star athletes prompted Andy Gray of CNN/SI to call him the most entertaining NBA reporter out there.✅ While Former Mike Tyson Publicist Michael Marley writes: If there is going to be an Internet age Howard Cosell, it may turn out to be Elie Seckbach.⭐In 2009  Seckbach was nominated by the Associated Press and won the Mark Twain Award.⭐✅ In June 09' Lil Wayne samples Seckbach in his song 'Kobe Bryant. And in 2010 Seckbach won the Boxing Reporter of The Year award from ATG Radio. In 2017 Seckbach received two Awards for his boxing coverage. ✅ Away from sports Elie has covered major news events and has won both a Golden Mike and an Emmy Award. ✅ His reports have been featured on: AOL Sports FanHouse & NBC TV, The LA Daily News and CBS 2 News.Prior to that Seckbach reported for leading news outlets in Israel.","EsNews Is ranked among the top 40 Sports Sites In the WorldElie Seckbach (אלי זקבך) has been featured by RING Magazine & the LA Times dubbed The most influential reporter in boxing.His ability to get interesting quotes from star athletes prompted Andy Gray of CNN/SI to call him the most entertaining NBA reporter out there.While Former Mike Tyson Publicist Michael Marley writes: If there is going to be an Internet age Howard Cosell,  it's Elie Seckbach.In 2009  Seckbach was nominated by the Associated Press and won the Mark Twain Award. In 2010 Seckbach won the Boxing Reporter of The Year award from ATG Radio. In 2019 The WBA Honored Elie for his contribution to boxing coverage. In August 2020 Lil Wayne samples Seckbach in his song 'Kobe Bryant. Away from sports Elie has covered major news events and has won both a Golden Mike and an Emmy Award. His reports have been featured on: ESPN, AOL Sports FanHouse & NBC TV, The LA Daily News, FOX 11 NEWS and CBS 2 News.","Boxing Boxing Interviews Boxing Highlights Boxing News MMA UFC Sporting News Boxing Footage Boxing Behind The Scenes Behind The Scenes Boxing News 2019 UFC Fighting MMA Fighting Breaking Boxing News Boxing Videos MMA Highlights UFC Highlights Training Sports Interviews Authentic Boxing News Boxing Matches UFC Videos MMA Videos Manny Pacquiao Deontay Wilder Oscar Del A Hoya Conor Mcgregor Ronda Rousey Sports Interviews Boxing News 2019 Boxing Press Conferences Fight Night Outside The Ring Boxing Updates Rare Footage Sports","6lIvg3JLQk0"
b327g7oemAU,"GERVONTA, 2 ROUNDS - RYAN GARCIA SENDS GERVONTA DAVIS A KO MESSAGE; GETS REAL ON NEED TO FIGHT","UCmxZw7N4Jyljr1RbSs4Ymaw","FightHype.com","17","738.0","https://i.ytimg.com/vi/b327g7oemAU/default.jpg","Ryan Garcia|Gervonta Davis|Boxing|FightHype","FightHype.com recently caught up with lightweight sensation Ryan Garcia fresh off his knockout victory over Luke Campbell. You don't want to miss what he had to say about his performance and his future plans, including a potential showdown with multi-divsion world champion Gervonta Davis. Check it out!","FIGHTHYPE.COM - A FIGHT IS A FIGHTThe one-stop source for all of your boxing and mixed martial arts news from around the internet. Get exclusive interviews, breaking news, interactive features and more.Powered by hard work & dedication and founded by Ben Thompson.SUBSCRIBE NOW TO THIS CHANNEL TO BE NOTIFIED OF DAILY VIDEO UPDATESIF YOU ENJOY OUR VIDEOS, PLEASE BE SURE TO SHOW YOUR SUPPORT AND ALSO VISIT THE WEBSITE, WWW.FIGHTHYPE.COM, DAILY SO WE CAN CONTINUE TO BRING YOU COMPLETE FIGHT COVERAGE.","FightHype Floyd Mayweather Jr. Manny Pacquiao Mayweather Pacquiao Canelo Boxing MMA UFC","6lIvg3JLQk0"
dUdOYPacRlk,"Asuka steps inside Alexa Bliss’ playground: Raw, Jan. 18, 2021","UCJ5v_MCY6GNUBTO8-D3XoAg","WWE","17","311.0","https://i.ytimg.com/vi/dUdOYPacRlk/default.jpg","wwe|world wrestling entertainment|wrestling|wrestler|wrestle|superstars|कुश्ती|पहलवान|डब्लू डब्लू ई|मैच|सुपरस्टार|व्यावसायिक कुश्ती|مصارعه|wwe 2021|Raw|Alexa Bliss|Asuka|wwe raw highlights|the fiend bray wyatt|wwe raw|randy orton alexa bliss|alexa bliss and the fiend|alexa bliss randy orton|the fiend and alexa bliss|randy orton vs the fiend|wwe raw highlights this week|randy orton vs bray wyatt","Raw Women’s Champion Asuka has a creepy experience in “Alexa’s Playground” ahead of meeting Alexa Bliss in a match on Raw. Catch WWE action on WWE Network, FOX, USA Network, Sony India and more.WWE Network | Subscribe now: http://wwe.yt/wwenetwork---------------------------------------------------------------------Follow WWE on YouTube for more exciting action!---------------------------------------------------------------------Subscribe to WWE on YouTube: http://wwe.yt/Check out WWE.com for news and updates: http://goo.gl/akf0J4Watch WWE on Sony in India: http://www.wwe.com/SonySportsNetworkFind the latest Superstar gear at WWEShop: http://shop.wwe.com---------------------------------------------Check out our other channels!---------------------------------------------The Bella Twins: https://www.youtube.com/thebellatwinsUpUpDownDown: https://www.youtube.com/upupdowndownWWEMusic: https://www.youtube.com/wwemusicTotal Divas: https://www.youtube.com/wwetotaldivas------------------------------------WWE on Social Media------------------------------------Twitter: https://twitter.com/wweFacebook: https://www.facebook.com/wweInstagram: https://www.instagram.com/wwe/Reddit: https://www.reddit.com/user/RealWWEGiphy: https://giphy.com/wwe------------------------------------WWE Podcasts------------------------------------After the Bell with Corey Graves: https://wwe.com/afterthebellThe New Day: Feel the Power: https://wwe.com/feelthepowerUncool with Alexa Bliss: https://wwe.com/uncoolwithalexa","WWE on YouTube is your number one spot to catch WWE original shows and exclusives!Watch videos from all of your favorite WWE Superstars, backstage fallout from live shows including Raw, SmackDown, NXT and original shows such as Top 10, List This, WWE's The Bump and much more! Subscribe - https://goo.gl/2YO0Is","wrestling submission wrestling wwe व्यावसायिक कुश्ती professional wrestling مصارعة المحترفين الرياضة القتالية finishing moves चालें परिष्करण الانتهاء من التحركاتالانتهاء التحركات wrestler network Raw SmackDown WrestleMania SummerSlam","6lIvg3JLQk0"
bbyH0VvX7wA,"GERVONTA DAVIS IMMEDIATE REACTION TO RYAN GARCIA'S WIN OVER CAMPBELL","UC9UhQwGYany3mcEFf0NxswA","DontaesBoxingNation","17","507.0","https://i.ytimg.com/vi/bbyH0VvX7wA/default.jpg","[none]","","Dontae’s Boxing Nation 🥊🎙","boxing floyd mayweather muhammad ali sugar ray robinson leonard Canelo alvarez tim Bradley robert guerrero austin trout canelo guillermo rigondeaux gamboa highlights dontaesboxingnation DONTAESBOXINGNATION DontaeBoxingNation DBN dontae New Media boxing boxing news Floyd Mayweather Manny pacquiao DontaeBoxingNation Dontaes Boxing Dontae Boxing Nation Dontaes Nation Dontae's Boxing Nation Dontae's Boxing Dontae's Nation","6lIvg3JLQk0"
117JQFf4TqA,"1v1 Basketball Against NBA Champion Big Baby Glen Davis  *Trash Talk*","UCvyTdLw8SkVmUcHYXSDEGwA","CashNasty","24","1115.0","https://i.ytimg.com/vi/117JQFf4TqA/default.jpg","1v1 basketball against glen davis|1v1 basketball|cash 1v1|basketball videos|basketball moves|glen davis|big baby davis|big baby davis highlights|basketball highlights|nba highlights|funny videos clean|entertainment|1v1 basketball physical|basketball trash talk|hooper|cash vs hooper hooper|defense basketball|how to play basketball|dribble moves|basketball highlights 2020|1v1 basketball game|Entertainment news","Subscribe to Glen Big Baby Davis here!https://www.youtube.com/channel/UCJVt-atpD3brOZ2ysQxeCjA?sub_confirmation=1Pre-Workout I Use...GG!!I receive commission from purchases made through this link:https://t.co/q6oEqxDGLb?amp=1Use code CASH for 10% off your order!Gaming Channel: https://goo.gl/Se1qBH 2HYPE Channel: https://www.youtube.com/channel/UCY4AlDv6wL2qhrX29iwdqAgFollow me on Twitter: www.twitter.com/cashnastygamingInstagram: @cashnastyI livestream on Twitch! www.twitch.tv/cashnastygaming","I make videos. I make you laugh. I be happy.","Basketball Sneakers Challenges Food Fitness Funny Health Diet Diet Tips Bodybuilding Working Out Cooking Catch n cook 1v1 basketball 2hype","6lIvg3JLQk0"
