video_id,title,channelId,channelTitle,categoryId,duration,thumbnail_link,tags,description,channel_desc,channel_keywords,related_vid_id
px2hdZJLC3A,"Metal Iron Man Helmet WITH DISPLAY!","UCjgpFI5dU-D1-kh9H1muoxQ","Hacksmith Industries","28","1599.0","https://i.ytimg.com/vi/px2hdZJLC3A/default.jpg","endgame|end game|marvel|thehacksmith|hacksmith|iron man|metal iron man helmet|ironman|iron man helmet for sale|metal iron man suit|make it real|mcu|avengers endgame|marvel cinematic universe|iron man flight system|avengers: infinity war|flying like iron man|flying like iron man update|real life iron man|real life tony stark|tony stark in real life|iron man in real life|ironman flight|comics|gravity jet suit|MK42|mark42|mark 42|iron man helmet hud|HUD","Get Honey for FREE and start saving money today ► https://joinhoney.com/hacksmithIts 10 million members save an average of $28.61 on stores like Amazon, Newegg and Best Buy.The Giveaway has ended and the winner has been selected. Check out the circuit on Maker.io ► http://bit.ly/IronmanHUDCheck out the Iron Man Helmets available on ► https://www.aliexpress.com/VuFine HUD (Amazon) ► https://amzn.to/2DB0yHrBecome a Hacksmith member get exclusive perks and to learn more about this project! ► https://www.youtube.com/channel/UCjgpFI5dU-D1-kh9H1muoxQ/join►Early video access ►Project design files (solidworks)►Merch Discounts ►Collaborate with us on our videos TOOLS / MACHINES: CNC Plasma Cutter ► https://goo.gl/UurkwX3d Printers - Taz 6 ► http://amzn.to/2FVe3Uq Moarstruder ► http://amzn.to/2DpbcOc Filament ► http://amzn.to/2FGnt2R CNC Mill ►  https://goo.gl/7Cnk48 CNC Lathe ► https://goo.gl/QUUjxT Laser Cutter - Gweike LG900N 80W ► https://www.google.com/search?q=lg900n 3d Scanner ► http://amzn.to/2pwbvTuDrills, drivers, grinders, saws, etc ► http://amzn.to/2p9SPJ3 Welder ► https://goo.gl/QmTT4S Desktop PC ► https://youtu.be/gSbt3LK8hCs SOCIALWebsite ► http://www.hacksmith.techFacebook ► http://www.facebook.com/thehacksmithInstagram ► http://www.instagram.com/thehacksmithTwitter ► http://twitter.com/thehacksmithPatreon ► http://www.patreon.com/thehacksmithDiscord ► https://discordapp.com/invite/thehacksmith Merch ► https://www.hacksmith.storeSOFTWARE:Video Review / Collaboration ► http://r.frame.io/pZq3NVideo Editing ► Adobe Premiere CAD ► Solidworks CAM ► Autodesk HSMCAMERA GEAR:Highspeed Cam - Chronos 1.4 ► https://goo.gl/t7eCGGMain shooter - Panasonic GH5s ► https://bhpho.to/2Fjd80N Phone - Samsung Note 8  ► https://bhpho.to/2DnDicX B Camera - Sony RX10ii ► https://bhpho.to/2Dp9r3y Camcorder - Sony Handycam ► https://bhpho.to/2FDnq81 Slow Motion (960fps) - Sony RX10ii ► https://bhpho.to/2Dp9r3y Slow Motion (240fps) - Panasonic GH5s ► https://bhpho.to/2Fjd80N Action Cam - GoPro ► https://bhpho.to/2FxXDC4 Steadicam - Osmo ► https://bhpho.to/2GreBj2 Main mic - Sennheiser ► https://bhpho.to/2DsR8ecBendy Tripod ► https://bhpho.to/2FyLNb0 Main Tripods - old second hand Manfrotto tripods no longer sold. Music:1) @02:10 Can't Stop Me Now by Jay Denton- Licensed from TripleScoop Musichttps://triplescoopmusic.com/2) @07:37 At the Top by Steve Benton- Licensed from TripleScoop Musichttps://triplescoopmusic.com/3) @15:37 Monkeys, Spinning Monkeys by Kevin Macleod- https://incompetech.com/4) @19:30 Buckaroo by Katja Rieckerman- Licensed from TripleScoop Musichttps://triplescoopmusic.com/5) @22:1- Marty's got a Plan by Kevin Macleod- https://incompetech.com/CREDITS:|| Project design ||► James “the Hacksmith” Hobson|| Cinematography ||► James “the Hacksmith” Hobson► Owen Lynch ( https://lystudioso.wixsite.com/lystudios )|| Video Editing || ► James “the Hacksmith” Hobson► Evan Morrison ( https://vimeo.com/344945311 )|| Thumbnail ||► Skylar GirardProduced by Hacksmith Entertainment © 2019Directed by James “the Hacksmith” HobsonWARNING: THESE VIDEOS ARE FOR ENTERTAINMENT PURPOSES ONLY. PERSONAL USE OF VIDEO CONTENT IS AT YOUR OWN RISK. THE HACKSMITH IS A TRAINED PROFESSIONAL WHO KNOWS EXACTLY WHAT HE'S DOING. EXCEPT WHEN HE DOESN'T. DO NOT ATTEMPT TO RECREATE OR RE-ENACT ANYTHING SHOWN IN THESE VIDEOS.","We take fictional ideas from movies, video games & comics, and make real working prototypes!I quit my full-time job as an engineer and product developer to make only the coolest inventions -- just for you guys -- right here on YouTube. We show the engineering process of making our projects to inspire others into STEM fields, and to show that anything is possible with science!Please send media inquires through https://www.hacksmith.tech/contactFor FAQ please visit https://www.hacksmith.tech/faq","DIY props cosplay prop replicas tech engineering gadgets make it real prototyping marvel make it real science prop replicas real working props extreme cosplay stark industries hacksmith industries real life tony stark technology real life iron man","Dqe7Iw2MiZ8"
IaWDooUorU0,"WE GOT A TANK! (POWER LOADER: PART 11)","UCjgpFI5dU-D1-kh9H1muoxQ","Hacksmith Industries","28","901.0","https://i.ytimg.com/vi/IaWDooUorU0/default.jpg","thehacksmith|hacksmith|power loader part 11|part 11|aliens powerloader part 11|aliens mech 11|aliens mech|power loader|hacksmith mech|power loader hacksmith|ripley scott|james cameron|aliens|alien|aliens movie|aliens technology|engineering|power loader returns|power loader costume|make it real|hacksmith power loader|power loader aliens|aliens 1986|aliens power loader|hacksmith exo|sigourney weaver|real life mech|hacksmith exoskeleton","Try World of Tanks For FREE Today and Help Support this Project! ► https://tanks.ly/39rXcHfBecome a Hacksmith member get exclusive perks, like seeing these videos before anyone else! ► https://www.youtube.com/channel/UCjgpFI5dU-D1-kh9H1muoxQ/join►Early video access ►Project design files (solidworks)►Merch Discounts ►Collaborate with us on our videos Big thank you to @Cat® Products  for giving us the 239D Compact Track Loader! Check them out on social:► https://www.linkedin.com/company/caterpillar-inc/► https://instagram.com/caterpillarinc► https://twitter.com/caterpillarinc► https://www.facebook.com/CATERPILLAR/And big thank you to Robert Stanners who made the first connection to Caterpillar for us! check out his site at https://www.vrx.caSOCIALWebsite ► http://www.hacksmith.techFacebook ► http://www.facebook.com/thehacksmithInstagram ► http://www.instagram.com/thehacksmithTwitter ► http://twitter.com/thehacksmithPatreon ► http://www.patreon.com/thehacksmithDiscord ► https://discordapp.com/invite/thehacksmith Merch ► https://www.hacksmith.storeCHAPTERS:0:00 I had a dream0:26 How are we doing the base?2:40 Trip to Caterpillar!5:52 How to drive a Cat8:10 Why this Cat?8:38 Design it to Drive it9:02 Shopping trip!9:42 OLD vs NEW11:07 Taking apart the Cat!13:40 Driving a tank14:35 What's next?SOFTWARE:PCB Design ► https://www.altium.com/yt/TheHacksmithVideo Review / Collaboration ► http://r.frame.io/pZq3NVideo Editing ► Adobe Premiere CAD ► Solidworks CAM ► Autodesk HSM http://bit.ly/HSMworksCAMERA GEAR:Highspeed Cam - Chronos 1.4 ► http://bit.ly/chronosCamMain shooter - Panasonic GH5s ► https://bhpho.to/2Fjd80N Phone - Samsung S10  ► https://bhpho.to/2N8FOh8Camcorder - Sony Handycam ► https://bhpho.to/2FDnq81 Action Cam - GoPro ► https://bhpho.to/2FxXDC4 Steadicam - Removu K1 ► https://bhpho.to/2N9lDQq Main mic - Sennheiser ► https://bhpho.to/2DsR8ecBendy Tripod ► https://bhpho.to/2FyLNb0 Main Tripods - old second hand Manfrotto tripods no longer sold. Studio Light - Luxli ► https://bhpho.to/2N9SPavTOOLS / MACHINES: CNC Mill - Tormach 1100MX ► https://hubs.ly/H0B8DWG0CNC Mill - Tormach PCNC 440 ► https://hubs.ly/H0B8DYk0CNC Lathe - Tormach 15L ► https://hubs.ly/H0B8Gcp0Autofeed Bandsaw - Tormach AF50 ► https://hubs.ly/H0B8Gj10CNC Waterjet Cutter ► http://bit.ly/wazerJetCNC Plasma Cutter ► http://bit.ly/EMTplasma3d Printers ► http://bit.ly/H1PrinterLaser Cutter - Gweike LG900N 80W ► http://lmgtfy.com/?q=lg900n 3d Scanner ► http://amzn.to/2pwbvTuDrills, drivers, grinders, saws, etc ► http://amzn.to/2p9SPJ3 Mig Welder ► http://bit.ly/MP250iWelderTig Welder ► http://bit.ly/Tig200WelderQuiet Air Compressor ► http://bit.ly/38zVKzBDesktop PC ► https://youtu.be/gSbt3LK8hCs MUSIC IN ORDER OF APPEARANCE:Came To Party by Weston KleinknechtLicensed from Triple Scoop Music ►https://triplescoopmusic.com/Bad Ways by Diego MartinezLicensed from Triple Scoop Music ►https://triplescoopmusic.com/Muddy Road by Evgeny KiselevichLicensed from Triple Scoop Music ►https://triplescoopmusic.com/Piece Of S**** by Symphony Of DistractionLicensed from Triple Scoop Music ►https://triplescoopmusic.com/Time Spender by F.O.O.LLicensed from Monstercat ►https://monstercat.comNeon by TelevisorLicensed from Monstercat ►https://monstercat.comCan't Sleep All Night by PlayhouseLicensed from Triple Scoop Music ►https://triplescoopmusic.com/Mercenary by F.O.O.L & PowergloveLicensed from Monstercat ►https://monstercat.comPurchases made through some store links may provide some compensation to Hacksmith.WARNING: THESE VIDEOS ARE FOR ENTERTAINMENT PURPOSES ONLY. PERSONAL USE OF VIDEO CONTENT IS AT YOUR OWN RISK. THE HACKSMITH IS A TRAINED PROFESSIONAL WHO KNOWS EXACTLY WHAT HE'S DOING. EXCEPT WHEN HE DOESN'T. DO NOT ATTEMPT TO RECREATE OR RE-ENACT ANYTHING SHOWN IN THESE VIDEOS.#alienspowerloader #LetsDoTheWork #makeitreal","We take fictional ideas from movies, video games & comics, and make real working prototypes!I quit my full-time job as an engineer and product developer to make only the coolest inventions -- just for you guys -- right here on YouTube. We show the engineering process of making our projects to inspire others into STEM fields, and to show that anything is possible with science!Please send media inquires through https://www.hacksmith.tech/contactFor FAQ please visit https://www.hacksmith.tech/faq","DIY props cosplay prop replicas tech engineering gadgets make it real prototyping marvel make it real science prop replicas real working props extreme cosplay stark industries hacksmith industries real life tony stark technology real life iron man","Dqe7Iw2MiZ8"
VwNLxFYcxCo,"How To Sleep Only 2 Hours Per Day!","UCjgpFI5dU-D1-kh9H1muoxQ","Hacksmith Industries","28","796.0","https://i.ytimg.com/vi/VwNLxFYcxCo/default.jpg","how to sleep better|sleep technology|sleeping pod|ultimate sleeping pod|ultimate sleep system|sleep aid technology|sleep tech|polyphasic sleep|sleep chamber|hacksmith|sleeping better|mattress sensor|binaural beats|simulated sunrise|oxygen enrichment|sleeping|casper mattress|casper|smart pillow|smart mattress|sleeping smart|cryopod|stasis pod|fallout bunker|fallout vault|vault tec|vault-tec|apocalypse|hacksmith bunker|how to sleep|sleep","Check out https://Casper.com/Hacksmith and use Coupon code “Hacksmith” to save $50 off of the purchase of a mattress. More information about the pod  ► http://www.hacksmith.tech/ultimate-sleeping-pod/SUBSCRIBE for more AWESOME Videos ► http://goo.gl/MU4hNABecome a Hacksmith member get exclusive perks! ► https://www.youtube.com/channel/UCjgpFI5dU-D1-kh9H1muoxQ/join►Early video access►Project design files (solidworks)►Merch Discounts►Colaborate with us on our videosSOCIALWebsite ► http://www.thehacksmith.caFacebook ► http://www.facebook.com/thehacksmithInstagram ► http://www.instagram.com/thehacksmithTwitter ► http://twitter.com/thehacksmithPatreon ► http://www.patreon.com/thehacksmithDiscord ► https://discordapp.com/invite/thehacksmithMerch ► https://www.hacksmith.storeSOFTWARE:Video Review / Collaboration ► http://r.frame.io/pZq3NVideo Editing ► Adobe PremiereCAD ► Solidworks CAMERA GEAR:Highspeed Cam - Chronos 1.4 ► https://goo.gl/t7eCGGMain shooter - Panasonic GH5s ► https://bhpho.to/2Fjd80NPhone - Samsung Note 8  ► https://bhpho.to/2DnDicXB Camera - Sony RX10ii ► https://bhpho.to/2Dp9r3yCamcorder - Sony Handycam ► https://bhpho.to/2FDnq81Slow Motion (960fps) - Sony RX10ii ► https://bhpho.to/2Dp9r3ySlow Motion (240fps) - Panasonic GH5s ► https://bhpho.to/2Fjd80NAction Cam - GoPro ► https://bhpho.to/2FxXDC4Steadicam - Osmo ► https://bhpho.to/2GreBj2Main mic - Sennheiser ► https://bhpho.to/2DsR8ecBendy Tripod ► https://bhpho.to/2FyLNb0Main Tripods - old second hand Manfrotto tripods no longer sold.TOOLS / MACHINES:CNC Plasma Cutter ► https://goo.gl/UurkwX3d Printers - Taz 6 ► http://amzn.to/2FVe3UqMoarstruder ► http://amzn.to/2DpbcOcFilament ► http://amzn.to/2FGnt2RCNC Mill ►  https://goo.gl/7Cnk48CNC Lathe ► https://goo.gl/QUUjxTLaser Cutter - Gweike LG900N 80W ► https://www.google.com/search?q=lg900n3d Scanner ► http://amzn.to/2pwbvTuDrills, drivers, grinders, saws, etc ► http://amzn.to/2p9SPJ3Welder ► https://goo.gl/QmTT4SDesktop PC ► https://youtu.be/gSbt3LK8hCs WARNING: THESE VIDEOS ARE FOR ENTERTAINMENT PURPOSES ONLY. PERSONAL USE OF VIDEO CONTENT IS AT YOUR OWN RISK. THE HACKSMITH IS A TRAINED PROFESSIONAL WHO KNOWS EXACTLY WHAT HE'S DOING. EXCEPT WHEN HE DOESN'T.","We take fictional ideas from movies, video games & comics, and make real working prototypes!I quit my full-time job as an engineer and product developer to make only the coolest inventions -- just for you guys -- right here on YouTube. We show the engineering process of making our projects to inspire others into STEM fields, and to show that anything is possible with science!Please send media inquires through https://www.hacksmith.tech/contactFor FAQ please visit https://www.hacksmith.tech/faq","DIY props cosplay prop replicas tech engineering gadgets make it real prototyping marvel make it real science prop replicas real working props extreme cosplay stark industries hacksmith industries real life tony stark technology real life iron man","Dqe7Iw2MiZ8"
rXCHn9B5dH0,"The Machine That Erases What It Creates","UC873OURVczg_utAk8dXx_Uw","RCLifeOn","24","591.0","https://i.ytimg.com/vi/rXCHn9B5dH0/default.jpg","rclifeon|sisyphus table|sand drawing machine|3d printer|a machine that erases whatever it creates|kinetic art machine erases whatever it creates|3d printing|building a table|machine makes perfect pattern then erases everything!|perfect pattern machine|The machine that erases what it made","I built a kinetic art table that erases whenever it completes a pattern. Cruel but it likes it. Instagram: rclifeonhttps://www.patreon.com/rclifeonEMAIL: rclifeon2014@gmail.comMusic:Oh What A Whirl - Jules GaiaCotton Candy - CospeBlack Hole (Instrumental Version) - Tommy LjungbergRevolt - Luwaks","My name is Simon Sörensen and I am the creator of RCLifeOn. I do a little bit of everything, nothing too fancy. I love 3D printing, DIY and radio controlled stuff. Yeah, that's pretty much it. If you want to be a part of my family here on YouTube, hit the subscribe button and let's hang out!","rclifeon DIY Simon Sörensen 3d printing Awesome 3d printer How to best 3d printer do it yourself tevo tarantula tevo project Awesome Idea RC Giveaway Useful Peltier Tool CNC Fusion360 Review Life Hack Software Autodesk Tech Technology RCLifeOn Sweden Sverige","Dqe7Iw2MiZ8"
1xCPzOinZB8,"YouTube Secret Santa: MAKER EDITION!","UCjgpFI5dU-D1-kh9H1muoxQ","Hacksmith Industries","28","636.0","https://i.ytimg.com/vi/1xCPzOinZB8/default.jpg","thehacksmith|hacksmith|colin furze|sufficiently advanced|xrobots|kids invent stuff|this old tony|secret santa|youtube secret santa|maker edition|estefannie explains it all|make it real|engineering","Watch the other videos! Playlist ► https://youtube.com/playlist?list=PLBsfTOjKcQe-duagTS5o2rx5vzthE5BZt Look Mum https://youtu.be/7Zn7MasWpds Estefennie https://youtu.be/AO4P768-GCo XRobots https://youtu.be/5SoGct1dts4 Colin Furze https://www.youtube.com/watch?v=bmqm4RQ_1P4Kids Invent Stuff https://youtu.be/V28qsYqs0Rs Alan Pan https://youtu.be/dN2jhnWNyxs This Old Tony https://youtu.be/f9qN9LIChh4Become a Hacksmith member get exclusive perks! ► https://www.youtube.com/channel/UCjgpFI5dU-D1-kh9H1muoxQ/join►Early video access ►Project design files (solidworks)►Merch Discounts ►Collaborate with us on our videos SOCIALWebsite ► http://www.hacksmith.techFacebook ► http://www.facebook.com/thehacksmithInstagram ► http://www.instagram.com/thehacksmithTwitter ► http://twitter.com/thehacksmithPatreon ► http://www.patreon.com/thehacksmithDiscord ► https://discordapp.com/invite/thehacksmith Merch ► https://www.hacksmith.storeCHAPTERS:0:00 Maker Secret Santa0:46 A Bright Idea1:42 The Brain2:01 Painting2:24 Opening Gifts5:19 Playing Around6:38 It All Comes Together8:52 Beauty9:13 Sending The Gift!9:49 Merry Christmas!SOFTWARE:PCB Design ► https://www.altium.com/yt/TheHacksmithVideo Review / Collaboration ► http://r.frame.io/pZq3NVideo Editing ► Adobe Premiere CAD ► Solidworks CAM ► Autodesk HSM http://bit.ly/HSMworksCAMERA GEAR:Highspeed Cam - Chronos 1.4 ► http://bit.ly/chronosCamMain shooter - Panasonic GH5s ► https://bhpho.to/2Fjd80N Phone - Samsung S10  ► https://bhpho.to/2N8FOh8Camcorder - Sony Handycam ► https://bhpho.to/2FDnq81 Action Cam - GoPro ► https://bhpho.to/2FxXDC4 Steadicam - Removu K1 ► https://bhpho.to/2N9lDQq Main mic - Sennheiser ► https://bhpho.to/2DsR8ecBendy Tripod ► https://bhpho.to/2FyLNb0 Main Tripods - old second hand Manfrotto tripods no longer sold. Studio Light - Luxli ► https://bhpho.to/2N9SPavTOOLS / MACHINES: CNC Mill - Tormach 1100MX ► https://hubs.ly/H0B8DWG0CNC Mill - Tormach PCNC 440 ► https://hubs.ly/H0B8DYk0CNC Lathe - Tormach 15L ► https://hubs.ly/H0B8Gcp0Autofeed Bandsaw - Tormach AF50 ► https://hubs.ly/H0B8Gj10CNC Waterjet Cutter ► http://bit.ly/wazerJetCNC Plasma Cutter ► http://bit.ly/EMTplasma3d Printers ► http://bit.ly/H1PrinterLaser Cutter - Gweike LG900N 80W ► http://lmgtfy.com/?q=lg900n 3d Scanner ► http://amzn.to/2pwbvTuDrills, drivers, grinders, saws, etc ► http://amzn.to/2p9SPJ3 Mig Welder ► http://bit.ly/MP250iWelderTig Welder ► http://bit.ly/Tig200WelderQuiet Air Compressor ► http://bit.ly/38zVKzBDesktop PC ► https://youtu.be/gSbt3LK8hCs Purchases made through some store links may provide some compensation to Hacksmith.MUSIC IN ORDER OF APPEARANCE:Unbreakable Life by Golden VibesLicensed from Triple Scoop Music ►https://triplescoopmusic.com/This Is Fun by DPLicensed from Triple Scoop Music ►https://triplescoopmusic.com/Zero To Eleven by Julian Taylor BandLicensed from Triple Scoop Music ►https://triplescoopmusic.com/Jump, Jive & Sing by Elvis SchoenbergLicensed from Triple Scoop Music ►https://triplescoopmusic.com/Hurricane by Oliver MelchersLicensed from Triple Scoop Music ►https://triplescoopmusic.com/A Carefree Day by Dream WaveLicensed from Triple Scoop Music ►https://triplescoopmusic.com/WARNING: THESE VIDEOS ARE FOR ENTERTAINMENT PURPOSES ONLY. PERSONAL USE OF VIDEO CONTENT IS AT YOUR OWN RISK. THE HACKSMITH IS A TRAINED PROFESSIONAL WHO KNOWS EXACTLY WHAT HE'S DOING. EXCEPT WHEN HE DOESN'T. DO NOT ATTEMPT TO RECREATE OR RE-ENACT ANYTHING SHOWN IN THESE VIDEOS.#secretsanta","We take fictional ideas from movies, video games & comics, and make real working prototypes!I quit my full-time job as an engineer and product developer to make only the coolest inventions -- just for you guys -- right here on YouTube. We show the engineering process of making our projects to inspire others into STEM fields, and to show that anything is possible with science!Please send media inquires through https://www.hacksmith.tech/contactFor FAQ please visit https://www.hacksmith.tech/faq","DIY props cosplay prop replicas tech engineering gadgets make it real prototyping marvel make it real science prop replicas real working props extreme cosplay stark industries hacksmith industries real life tony stark technology real life iron man","Dqe7Iw2MiZ8"
M2idDi4ukA8,"Moments of Animal Genius That Will Amaze You","UCmo0ZANU_oN_hWy77Hjuuxg","WATOP","27","577.0","https://i.ytimg.com/vi/M2idDi4ukA8/default.jpg","WATOP|Wa Top|genius animals|zoo|top","Sometimes animals are so clever that it's frightening.","","Animals Wild life Interesting top WATOP","Dqe7Iw2MiZ8"
xfnGqspheZw,"FLOOR IS LAVA 14.0!","UC9PgszLOAWhQC6orYejcJlw","Braille Skateboarding","26","979.0","https://i.ytimg.com/vi/xfnGqspheZw/default.jpg","skate|skateboard|skater|skateboarding|skateboarder|skating|sk8|sk8ing|learn to skateboard|how to skateboard|secrets of skateboarding|aaron|kyro|braille|how to skate|braille skateboarding|aaron kyro|floor is lava|obstacle course|ninja warrior|lava|obstacles","The Floor is Lava is back and hotter than ever! How will the Braille team handle some obstacles that have never been done before?!Get everything you need to learn how to skateboard at https://brailleskateboarding.comDownload the Braille App here: https://brailleskateboarding.com/plus/For media or brand inquiries email kylie@brailleskateboarding.com","WE MAKE SKATEBOARDING VIDEOS!  LEARN TO SKATEBOARD!On our channel you will find skateboarding content as well as the best tutorials for learning to skateboard. Go to our website for more skateboarding help and to get Skateboarding Made Simple! https://www.brailleskateboarding.comInterested in having your company or product featured in a Braille video?  Email kylie@brailleskateboarding.comTo collab with us email devin@brailleskateboarding.com.  We want to feature awesome skaters and inspire more people to skate!For Braille merch inquiries please email chloe@brailleskateboarding.comFor all other inquiries email contact@brailleskateboarding.com","braille skateboarding aaron kyro how to skateboard learn skating skateboarding made simple how to kickflip clip of the week slow motion sk8 sk8ing skate heelflip pop shove it frontside","Dqe7Iw2MiZ8"
wSLPHZLYTn0,"Cybertruck vs Delorean Drag Race","UCeSkF8EXePqtSmqN26KNX5A","Hacksmith VLOGS","22","493.0","https://i.ytimg.com/vi/wSLPHZLYTn0/default.jpg","hacksmith vlogs|hacksmithvlogs|the straight pipes|cybertruck|delorean|race|elon musk|tesla|half scale cybertruck|cyber|truck|back to the future|vlog|racing|onewheel|drag race|cybertruck review|fast and furious|kia|stinger|car|motorsport|speed|future|turbo|moto|auto|battery|electric|stem|electricity|mechanic|mechanical|exo skeleton|racing flag|toronto|launch control|tesla cybertruck|torque|tri moto design|design|fabrication|half scale|ludicrous|sport mode|engineer","Become a Hacksmith member get exclusive perks! ► https://www.youtube.com/channel/UCjgpFI5dU-D1-kh9H1muoxQ/join►Early video access ►Project design files (solidworks)►Merch Discounts ►Collaborate with us on our videos SOCIALWebsite ► http://www.thehacksmith.caFacebook ► http://www.facebook.com/thehacksmithInstagram ► http://www.instagram.com/thehacksmithTwitter ► http://twitter.com/thehacksmithPatreon ► http://www.patreon.com/thehacksmithDiscord ► https://discordapp.com/invite/thehacksmithMerch ► https://teespring.com/stores/hacksmithCHAPTERS: 0:00 Teaser0:19 Intro1:32 Donuts In The Cybertruck!2:01 Trailer Pull2:29 Delorean Arrives2:59 James Loses The Keys3:20 The Race Begins3:59 Cybertruck Breakdown4:37 Would You Change Anything On The Cybertruck?5:36 The Cybertruck Is Fixed5:52 Another Delorean Shows Up6:12 Taking The Stinger Around The Track6:41 Epic MontageMUSIC: Catch Up by Diego MartinezLicensed from Triple Scoop Music ►https://triplescoopmusic.com/Time For The Winners by The VortexLicensed from Triple Scoop Music ►https://triplescoopmusic.com/SOFTWARE:Video Review / Collaboration ► http://r.frame.io/pZq3NVideo Editing ► Adobe Premiere CAD ► Solidworks CAM ► Autodesk HSMCAMERA GEAR:Highspeed Cam - Chronos 1.4 ► http://bit.ly/chronosCamMain shooter - Panasonic GH5s ► https://bhpho.to/2Fjd80N Phone - Samsung Note 8  ► https://bhpho.to/2DnDicX B Camera - Sony RX10ii ► https://bhpho.to/2Dp9r3y Camcorder - Sony Handycam ► https://bhpho.to/2FDnq81 Slow Motion (960fps) - Sony RX10ii ► https://bhpho.to/2Dp9r3y Slow Motion (240fps) - Panasonic GH5s ► https://bhpho.to/2Fjd80N Action Cam - GoPro ► https://bhpho.to/2FxXDC4 Steadicam - Osmo ► https://bhpho.to/2GreBj2 Main mic - Sennheiser ► https://bhpho.to/2DsR8ecBendy Tripod ► https://bhpho.to/2FyLNb0 Main Tripods - old second hand Manfrotto tripods no longer sold. TOOLS / MACHINES: CNC Plasma Cutter ► http://bit.ly/EMTplasma3d Printers - Affinia 3D ► http://bit.ly/H1PrinterCNC Mill ►  http://bit.ly/PCNC440CNC Lathe ► http://bit.ly/15LSlantProLaser Cutter - Gweike LG900N 80W ► http://lmgtfy.com/?q=lg900n 3d Scanner ► http://amzn.to/2pwbvTuDrills, drivers, grinders, saws, etc ► http://amzn.to/2p9SPJ3 Welder ► http://bit.ly/MP250iWelder Desktop PC ► https://youtu.be/gSbt3LK8hCs WARNING: THESE VIDEOS ARE FOR ENTERTAINMENT PURPOSES ONLY. PERSONAL USE OF VIDEO CONTENT IS AT YOUR OWN RISK. THE HACKSMITH IS A TRAINED PROFESSIONAL WHO KNOWS EXACTLY WHAT HE'S DOING. EXCEPT WHEN HE DOESN'T. DO NOT ATTEMPT TO RECREATE OR RE-ENACT ANYTHING SHOWN IN THESE VIDEOS.","Various vlogs and behind the scenes stuff and other videos that don't belong on the main channel the Hacksmith! https://www.YouTube.com/c/theHacksmith/Subscribe now and hit that notify button to make sure you know when we put out new videos!","hacksmith vlog vlogs vlogging","Dqe7Iw2MiZ8"
