video_id,title,channelId,channelTitle,categoryId,duration,thumbnail_link,tags,description,channel_desc,channel_keywords,related_vid_id
vroihcwV5qI,"Mean Foster Mother Won't Buy Daughter Food","UCpB959t8iPrxQWj7G6n0ctQ","SSSniperWolf","24","561.0","https://i.ytimg.com/vi/vroihcwV5qI/default.jpg","sssniperwolf|sniper wolf|reacting|reaction|funny","Mean Foster Mother Won't Buy Daughter Food! Leave a Like if you enjoyed! Watch the last vid https://youtu.be/iLRWbeeNeVw Subscribe to join the Wolf Pack and enable notifications! http://bit.ly/SubSSSniperWolf Check out Dhar Mann https://www.youtube.com/c/DharMannOfficialTikTok: http://tiktok.com/@sssniperwolfInstagram: http://instagram.com/sssniperwolfTwitter: http://www.twitter.com/sssniperwolfFacebook: https://www.facebook.com/sssniperwolfOfficial Merch: https://ogwolfpack.com/","Hi I'm SSSniperWolf! You can call me Lia, sniper wolf or sssniperwolf! I love gaming and making videos! Subscribe to join the Wolfpack","sssniperwolf sniper wolf reaction reacting funny funniest fortnite","Dqe7Iw2MiZ8"
aBo4D7MfOdI,"Hermitcraft 7: Episode 63 - THE MANSION INTERIOR","UCR9Gcq0CMm6YgTzsDxAxjOQ","Grian","20","1466.0","https://i.ytimg.com/vi/aBo4D7MfOdI/default.jpg","Minecraft|Grian|building|grian|mincraft|tutorial|yt:quality=high|minecraft|ideas|creative|hermitcraft|grian hermitcraft|episode 63","Hermitcraft 7: Episode 63 - THE MANSION INTERIOR grian is back on the hermitcraft server building his minecraft mansion base but this time focusing on the mansion interior. He also discovers there is a secret base in the mansion#minecraft #hermitcraft","This channel focuses on gaming (specifically minecraft) content aimed at a general audience. I build minecraft houses and make minecraft house tutorials along with everything else minecraft. If you want to learn how to build minecraft houses, or like hermitcraft, check out my videos. If you want to learn how to build in minecraft this is the place for you!Safety Disclaimer: I never add viewers on any personal accounts, such as Discord. Please be wary who you add on Discord, Skype or other instant messaging programs! Also never comment your personal contact information such as Skype, discord or e-mail address on my videos. Please be safe online! If you think you have me added on skype or another platform IT IS NOT ME. I don't use alt accounts, I only use my main, linked accounts.","Minecraft house Grian Building tutorial minecraft","Dqe7Iw2MiZ8"
AsVmdAIk6Wc,"Hermitcraft 7: Episode 68 - WHAT IS THIS!?","UChFur_NwVSbUozOcF_F2kMg","Mumbo Jumbo","20","1244.0","https://i.ytimg.com/vi/AsVmdAIk6Wc/default.jpg","Hermitcraft 7: Episode 68 - WHAT IS THIS!?|Hermitcraft 7: Episode 68|Hermitcraft 7|Hermitcraft|Hermitcraft Season 7|episode of Hermitcraft|Mumbo|Hermitcraft shopping district|Hermitcraft shopping|Pacific Store|Hermitcraft shopping district Pacific|shopping district|HCBBS|#HCBBS|Hermitcraft conspiracy theories|Hermitcraft conspiracy|Mumbo jumbo|Mumbo Hermitcraft|Mumbo pacific|Mumbo jumbo pacific|Mumbo HCBBS|Mumbo jumbo HCBBS|The Button|#Hermitcraft","In this episode of Hermitcraft Season 7, Mumbo does some serious progress on the Hermitcraft shopping district Pacific Store, connecting the full banking system together, adding the first Pacific shopping module and creating a Diamond to Pacifico converter. Mumbo also discovers a strange crash site in the Hermitcraft shopping district, surrounded by oddly named items, one of which spelling out HCBBS. The #HCBBS crash site is gradually counting down to an unknown event in the near future... what could it mean!? Let the Hermitcraft conspiracy theories begin. #HermitcraftMUSIC FROM ARTLIST (This is an affiliate link, so if you sign up, I receive a small commission): https://bit.ly/39Iw1GzFilming channel: https://www.youtube.com/user/ThatMumboJumbo2Instagram: https://www.instagram.com/officialmumbo/Twitter: https://twitter.com/ThatMumboJumbo","My name is Oli, also known as Mumbo Jumbo and I make videos on the popular voxel based game 'Minecraft'. I focus mainly on the technical elements of the game, doing tutorials on various elements of redstone to try and make you better, and hopefully give you something you can show off to your friends.  I also have a long running Vanilla Survival Let's Play series on the well known Hermitcraft server. I work with the guys at Chillblast to provide Official Mumbo Jumbo PCs – check them out www.chillblast.com/mumbojumboMy PC specs; CHILLBLAST FUSION JUMBO SIGNATURE EDITION PC Processor: Intel Core i7-6800K Broadwell-E CPU, 6 Cores, 3.4 - 3.8GHzCase: NZXT Noctis 450 CaseCPU Cooler: Corsair H100i V2 CPU CoolerMotherboard: Asus X99-A II MotherboardMemory: 16GB DDR4 2133MHGraphics Card: NVIDIA GeForce GTX 1080 8GB Graphics CardOS Drive: 512GB Samsung M.2 SSDSecondary Hard Drive: Seagate 3TB 7200RPM HDDMY CONTACT EMAIL IS BELOW :)","Minecraft Redstone Tutorials Teaching Tutorial Piston Door 2x2 3x3 4x4","Dqe7Iw2MiZ8"
taDJVEBEPk8,"MAKING MY DOG FROM HEX NUTS!!!","UCWizIdwZdmr43zfxlCktmNw","Alec Steele","24","699.0","https://i.ytimg.com/vi/taDJVEBEPk8/default.jpg","alec steele|alex steele|steel|alec|damascus|blacksmith|make|forge|anvil|mill|lathe|weld|tig|mig|engineering|blacksmithing|blade|bladesmithing|knife|knifemaking|sword|handmade|diy|craft|woodworking|forged in fire|axe|fabrication|art","Install Raid for Free  ✅ IOS: https://clik.cc/9ea9Y  ✅ ANDROID: https://clik.cc/UObdh  ✅ PC: https://clik.cc/Qu7vl  and get a special starter pack 💥 Available only for the next 30 days!Thank you to Raid for sponsoring this episode! OUR PRODUCTS: http://alecsteeleco.com/INSTAGRAM: https://www.instagram.com/alecsteele/ALECSTEELECO YOUTUBE: http://bit.ly/alecsteelecoYTALECSTEELECO INSTAGRAM: https://www.instagram.com/alecsteeleco/LEARN BLACKSMITHING ONLINE: http://beginblacksmithing.com/PATREON: https://www.patreon.com/alecsteele(Affiliate link): The Rhino Cart Welding table is utterly incredible and an essential piece of fab equipment for your shop! Use code “forge” for 5% off: http://bit.ly/RhinoCartFORGEInstagrams: Alec: @alecsteele Will: @will_stelter Jamie (editor): @jamie.poppleIsaiah (Videographer): @isaiaharnoldfilmMy name is Alec Steele and I am a 22 year old blacksmith from England, now living in Montana in the USA! With a great team of hardworking folks, we upload videos showcasing the projects we get up to here at the workshop. Lots of sparks, lots of making, lots of fantastic-ness. Great to have you here following along!https://www.patreon.com/alecsteeleINSTAGRAM @alecsteeleFACEBOOK PAGE  https://www.facebook.com/alecsteeleblacksmithMUSIC:Epidemic Sound - https://goo.gl/iThmfx -signing up at this link supports the show! SoundStripe https://soundstripe.com?fpr=alec84- signing up at this link supports the show!MUSIC - goo.gl/iThmfx signing up at this link supports the show!------------------------------------------------AMAZON AFFILIATE LINKS TO GEAR I LIKE, buying here supports us: --------------CAMERA + MAIN LENS: http://amzn.to/2CrLyYPWIDE LENS: http://amzn.to/2CsAZouTRIPOD: http://amzn.to/2GpBX7fMIC: http://amzn.to/2CrBmiQSD CARD: http://amzn.to/2sF0i7gCOMPUTER: http://amzn.to/2C4i0ooAlec Steele Blacksmith 2020","My name's Alec Steele and here you'll find near-daily videos documenting the process of building some awesome projects here in the shop. As a blacksmith, most of the projects start as lumps of steel, or stacks of different alloys for making damascus, that I forge out into blades, sculpture, art or tools before taking the project to the machining equipment or into the grinding room for finishing. Each project teaches me a lot and stretches the bounds of my knowledge. I make a lot of mistakes but they serve as an excellent teacher. There's always something important for me to learn in the shop! I want my work to be the spark that ignites the desire for you to get into your shop (or kitchen/basement/garage) and make something too! Whether it's stitching a leather wallet or forging a giant sword, you'll love the creative process.Be sure to follow me on instagram @alecsteele for behind the scenes and grab some awesome products at https://alecsteeleshop.com/Thanks! Alec","Alec Steele Blacksmith learn blacksmithing daily vlog Daily Vlogger how to forge blacksmithing anvil bladesmith forged in fire","Dqe7Iw2MiZ8"
9lpTCCTuAHM,"I think I got the wrong Teletubbies - DANK DOODLE MEMES V800","UCAToczv95SVPQXYVycoqUKg","Clumsy","23","691.0","https://i.ytimg.com/vi/9lpTCCTuAHM/default.jpg","memes|dank doodle memes|best memes|dank memes|memes compilation|dank memes compilation|best memes compilation|clean memes|ddm|tik tok memes|memes clean|reddit memes|pewdiepie memes|family friendly memes|funny memes","All the posts in this video are jokes and for comedic purposes only.Funny memes daily, Welcome to another episode of Dank Doodle Memes, Subscribe for best memes compilation & reddit clean memes 2020My Instagram for more dank memes https://www.instagram.com/doodlememesytAll Dank Doodle Memes Episodes (binge watch) ► https://www.youtube.com/playlist?list=PLV7oOsXh3LN9YpHiqY4koTASrwqOdSzZI","Welcome to my channel where I Originally Create, Edit and Voice Over videos about latest internet trends & memes.Subscribe for Dank Memes, Reddit related posts, stories, cringe and other Funny stuff found on the Internet. Thanks","dank doodle memes dank memes new memes funny memes best memes memes 2018 dank memes memes compilation dank memes compilation funniest memes meme","Dqe7Iw2MiZ8"
V5lg6baLhMw,"What I LEARNED after 1 YEAR of Flying FPV DRONES!","UC8YarS7Dd3oQa5hyJZF0cYQ","TMS Productions","1","739.0","https://i.ytimg.com/vi/V5lg6baLhMw/default.jpg","TMS|tms|productions|film|filmmaker|Kelowna|BC|tommy|dewitt|kss|mitchell|kucher|stephen|cinematic|vancouver|tutorial|sam kolder|broll|how to|studio|slow motion|premiere pro|FPV|Drone|Quadcopter|FPV drone|dji|air unit|analoge|First person View|First Person|Virtual Reality|VR|learning|After 1 year|1 year|tricks|cliffs|cliff dive|flight controller|adventure|quest|forest|trees|grass|crash|impact|snow|winter|wonderland|water damage|building|soldering|programming","Follow us here!Instagram: https://www.instagram.com/tmsproductions_/TikTok: https://www.tiktok.com/@tmsproductions_The music used in this video is from Musicbed. Get a 30 Day Free Trial here: http://share.mscbd.fm/tmsproductions#FPVFAQ'sQ: How old are you guys?A: We are 20 years old!Q: How many of you are there?A: There are 3 of us: Tommy, Mitchell, and Stephen! Mitchell & Stephen are identical twins, and Tommy is their friend who looks remarkably similar!Q: What does TMS stand for?A: It's our first initials combined! (We made it at 15, what did you expect?)Q: Where are you from?A: British Columbia, Canada! We got those PNW vibes;)Q: What gear do you use?Vlog Camera (Our Everyday Carry): https://amzn.to/37wrRisCrazy Cinema Camera: https://amzn.to/2QlPdBwThe RAZOR SHARP Cinema Camera Lens: https://amzn.to/31zx7SXThe BIG KAHUNA Zoom Lens!: https://amzn.to/2YAS6COAperture 120D KILLER! (IT'S HALF THE PRICE): https://amzn.to/3ibqn3dSoftbox for the 120D!: https://amzn.to/3eJJFL2BIG DRONE: https://amzn.to/39AuyBqAll the Fixin's for the BIG DRONE: https://amzn.to/2ujLxIhsmall drone (to fly through things): https://amzn.to/2Qnm60OND Filters for small drone: https://amzn.to/37wB2PZGoPro Goodness: https://amzn.to/2FlbVnfCrispy Microphone: https://amzn.to/2Fl0tYBCheaper Microphone: https://amzn.to/35o6mz0Our Trusty Tripods: https://amzn.to/2ZTcgaiAffordable Light Kit: https://amzn.to/2sIWP8cTHE Camera Bag: https://amzn.to/2QozFNzRon, the Gimble: https://amzn.to/2QnqJrDLaptop (MacBook Pro Equivalent!): https://amzn.to/2ZQ2V2SExternal Monitor: https://amzn.to/2QHZWp3As always… we’ll see you guys next Monday!Created by: Tommy DeWitt, Stephen & Mitchell KucherMusic: Licensed through  @Musicbed    @Epidemic Sound  Editing Software: Adobe Creative CloudWe gain a small monetary compensation if items are purchased through the links provided. It helps keep the channel running:)","We make films! Contact us to work together!FAQ'sQ: How old are you guys?A: We are 20 years old!Q: How many of you are there?A: There are 3 of us: Tommy, Mitchell, and Stephen! Mitchell & Stephen are identical twins, and Tommy is their friend who looks remarkably similar!Q: What does TMS stand for?A: It's our first initials combined! (We made it at 15, what did you expect?)Q: Where are you from?A: British Columbia, Canada! We got those PNW vibes;)Q: What gear do you use?A: Check out the description of any video! It has a complete list.What was /52?Out of 52 was a video project where we created a new video every week for an entire year. Each video had no set theme, just what interested or inspired us that week. Initially, we embarked on this project to challenge ourselves creatively and develop our filmmaking skills. We understand not every video will appeal to our entire audience, but we hope you enjoy what you watch and stick around for more.","TMS Productions Stephen Mitchell Kucher Tommy DeWitt /52 out of 52 Film Cinematic","Dqe7Iw2MiZ8"
89UYLaoaB3g,"Minecraft | RON'S TV is Broken & Zombies Are Coming Out Of It","UCaA8TUWM6TJ5wj-DH60VEFg","RON GAMING","20","1324.0","https://i.ytimg.com/vi/89UYLaoaB3g/default.jpg","RON|GAMING|fun|gameplay|pubg|mobile|human|fall|flat|funny|ark|minecraft|gta v|gta|dbd|dead|by|daylight|SEA|OF|THIEVES|SEA OF THIEVES|sea of thieves|human fall flat|parkour|gta parkour|dead by daylight|grand theft auto v|ronak|golf|free fire|grounded|among us|amongus|dynamo|mortal|carry|minati|carry minati|carri|carri miniti|soal|soal mortal|soul|soul mortal|dinamo|dainamo|gtx|preet|gtx preet|mayur gaming|mayur|gaming|mayurgaming|total gaming|total|techno|gamer","[My New Channel For Videos]  ➤ https://bit.ly/31u6E6S[PayPal Link]   ➤  paypal.me/RONGAMING[PayTm]     ➤  9016657575If you enjoy the video please like,share and subscribe.[Become Sponsor]    ➤ https://bit.ly/2MQoV6i[Instagram]                ➤ https://www.instagram.com/_ron_gaming_[Discord Link]            ➤ https://discord.gg/rongaming[Nonolive ID]              ➤  https://www.nonolive.com/20549407 [My Computer Specs]Processor  ➤  3950x 16coreGPU            ➤  GTX 1080TIRAM           ➤  16 GB DDR4 CL14[Road To 200K Subs]Subs   |        Date             Subs      |         Date100     -   10/05/2018  |  110k      -  14/09/20181k       -    30/05/2018 |  120k      -   19/09/201810k     -    21/06/2018 |  130k      -   24/09/201820k     -    26/06/2018 |  140k      -   29/09/201830k     -    02/07/2018 |  150k      -   04/10/201840k     -    08/07/2018 |  160k      -   07/10/201850k     -    18/07/2018 |  170k      -   12/10/201860k     -    01/08/2018 |  180k      -   15/10/201870k     -    16/08/2018 |  190k      -   18/10/201880k     -    23/08/2018 |  200k      -   20/10/201890k     -    02/09/2018 |  :::::::::::::::::::::::::::::::::100k     -  09/09/2018 |   ::::::::::[Goal]:::::::::::[Road To 400K Subs]Subs    |         Date            Subs    |         Date210k    -   22/10/2018 |  310k     -   12/11/2018220k    -   24/10/2018 |  320k     -   14/11/2018230k    -   25/10/2018 |  330k     -   16/11/2018240k    -   28/10/2018 |  340k     -   17/11/2018250k    -   30/10/2018 |  350k     -   19/11/2018260k    -   01/11/2018 |  360k     -   20/11/2018270k    -   03/11/2018 |  370k     -   21/11/2018280k    -   05/11/2018 |  380k     -   23/11/2018290k    -   08/11/2018 |  390k     -   24/11/2018300k    -   10/11/2018 |  400k     -   25/11/2018                          ::::::::::[Goal]::::::::::::[Road To 1M Subs]Subs         |            Date500k         -        09/12/2018600k         -        25/12/2018700k         -        08/01/2019800k         -        21/01/2019900k         -        05/02/2019 1M           -        22/02/2019    ::::::::::[Goal]::::::::::::[INTRO/OUTRO MUSIC] : ARTIST (_ensnare_) ➤ https://bit.ly/2lWPiij[Partner Channel] Mayur Gaming   ➤  https://www.youtube.com/c/MayurGamingI do not take credits for any song, music, or any other copyright things in my videos that belongs to its the rightful owner so if you want me to remove things that might belongs to you then contact me on my business email id and I will remove it.","Hiii guys my name is RON and i like playing games so i'm starting my new channel to bring joy to your life.i hope you guys like my content.Thank you[Email ID]    :   rongaming7272@gmail.com","ron gaming fun gameplay pubg mobile human fall flat funny ark survival minecraft","Dqe7Iw2MiZ8"
XUbAHtYz_Fg,"I Built a SECRET Gaming Room in my House! *PS5*","UCBwSufNse8VMBvQM_rCSvgQ","Morgz","24","918.0","https://i.ytimg.com/vi/XUbAHtYz_Fg/default.jpg","morgz|morgz mum|girlfriend|challenge|mystery|24 hours|challenges|funny|fun|morgz mom|bald martin|24 hours challenge|gaming setup|hidden gaming room|secret gaming room|building hidden gaming room|building secret gaming room|gaming room|i built a secret gaming room|hidden secret gaming room|secret room|hidden secret room|room tour|ultimate gaming setup|playstation 5|ps5|xbox series x|hidden|ps5 gaming setup|bunker|i built|hidden room|faze rug|fort|xbox","Today I Made An EPIC HIDDEN SECRET GAMING ROOM In My House with a PS5, Xbox Series X, Giant TV, Nintendo Switch & More Epic Gaming Gear! & Then I Challenged MINI MORGZ To See If He Could FIND My SECRET HIDDEN GAMING SETUP! Where Should I Make My Next SECRET GAMING DEN? Comment Below!►►NEW MINIGAME OUT NOW ON MORGZ ULTIMATE CHALLENGE ►►https://morgzultimatechallenge.com/play►NEW CUSTOM MERCH OUT NOW!► https://morgz.co—————————| BE ACTIVE FOR A FOLLOW |------------------- ►FOLLOW ME ON TWITTER: https://twitter.com/Morgz►FOLLOW ME ON INSTAGRAM: https://www.instagram.com/morgz►ADD MY SNAPCHAT: Morgz►FOLLOW ME ON TIKTOK: https://www.tiktok.com/@morgz—————————| OTHER |—————————►BUSINESS ENQUIRIES: business@morgz.coSTAY AWESOME TEAMMORGZ!! :D","No, i'm not 12.","Morgz Morgz Mum Challenge Prank 24 Hours Fortnite Boyfriend Girlfriend Overnight Challenge Couple Mystery Box Mystery Wheel Fun","Dqe7Iw2MiZ8"
Ayct8xy3oRc,"Civilization VI - First Look: Vietnam | Civilization VI New Frontier Pass","UCWj7XnnfbKHGVnZ8iSoETSQ","Sid Meier's Civilization","20","195.0","https://i.ytimg.com/vi/Ayct8xy3oRc/default.jpg","Sid Meier's Civilization|Firaxis|strategy video game|video game|Civilization|Sid Meier","Get a first look at the Vietnam civilization, and its leader Bà Triệu. SUBSCRIBE for First Looks at other civilizations, leaders, features and tips from the developers of Civilization VI: http://2kgam.es/CivilizationYTPlay Civilization VI ► http://2kgam.es/CivilizationVI  FOLLOW US: OFFICIAL WEBSITE ► http://www.civilization.com TWITTER ► https://twitter.com/civgame FACEBOOK ► https://www.facebook.com/civ INSTAGRAM ► https://www.instagram.com/civgame/ABOUT CIVILIZATION VI - NEW FRONTIER PASS The New Frontier Pass is a new season pass for Civilization VI that brings eight new civilizations and nine new leaders, six new game modes and more to the critically acclaimed strategy game. Content will be released in six DLC packs delivered on a bimonthly basis from May 2020 to March 2021. Some features require either the Gathering Storm or Rise and Fall expansions to play. ABOUT CIVILIZATION VI Civilization VI offers new ways to interact with your world, expand your empire across the map, advance your culture, and compete against history’s greatest leaders to build a civilization that will stand the test of time. ABOUT CIVILIZATION Originally created by legendary game designer Sid Meier, Civilization is a turn-based strategy game in which you attempt to build an empire to stand the test of time. Explore a new land, research technology, conquer your enemies, and go head-to-head with history’s most renowned leaders as you attempt to build the greatest civilization the world has ever known. #CivilizationVI #NewFrontierPass #OneMoreTurnCivilization VI - First Look: Babylon | Civilization VI New Frontier Pass","The Official Sid Meier's Civilization® YouTube channel.Created by legendary game designer Sid Meier, Civilization is a turn-based strategy game series in which you attempt to build an empire to stand the test of time. Become Ruler of the World by establishing and leading a civilization from the dawn of man into the space age. Wage war, conduct diplomacy, discover new technologies, go head-to-head with some of history's greatest leaders, and build the most powerful empire the world has ever known.Civilization VI offers new ways to interact with your world, expand your empire across the map, advance your culture, and compete against history’s greatest leaders to build a civilization that will stand the test of time. ESRB Rating: Everyone 10+ with Drug Reference, Language, Mild Violence, Suggestive Themes","Sid Meier Civilization Firaxis strategy turn-based civ Sid Meier Sid Meier's Civilization Civilization V Civilization VI PC Firaxis Games gaming strategy game video game video games civ 6 civ 5 one more turn steam pc game gaming Firaxis Sid Meier's Civilization Firaxis strategy video game video game Civilization Sid Meier civ vi civ 6 civilization 6 civ 6 gathering storm civilization 6 gathering storm firaxis games gathering storm civ 6 update civ 6 patch gathering storm gameplay gathering storm first look new content patch game update","Dqe7Iw2MiZ8"
gvsUyWTA4Gg,"PROJECT ZORGO DEFEATED! Extreme Trick Shots Horse Challenge! Who is the Worst Spy Ninja of All Time?","UCmFzvquJYoSDFhd9W0JhZKw","Daniel Gizmo","24","1373.0","https://i.ytimg.com/vi/gvsUyWTA4Gg/default.jpg","spy ninjas|spy ninja|chad wild clay|cwc|vy qwaint|chad and vy|project zorgo|vy|chad|pz9|hacker|daniel|regina|melvin|fgteev|unspeakable|stephen sharer|guava juice|superbowserlogan|sml|123 go|preston|dobre|jelly|mrbeast|lankybox|sssniperwolf|faze rug|ssundee|cloaker|basketball|trick shot|ping pong|tennis|baseball|onion|mayo|dude perfect|dp|hid|girlfriend|24 hours|new years|resolution|weird|friends|reacted|videos|ot|fun|funny|comedy|2021|clean|diaper|vs|safe|house","YouTube is SAVED!After Chad Wild Clay made MELVIN IS ALIVE!, Vy Qwaint created THE END..., and Daniel Gizmo uploaded Can You Survive the Chaos Simulator? Spy Ninjas vs Moving Uhaul Truck Challenge!, The Spy Ninja team has finally defeated the Project Zorgo leader and has put an end to the evil hackers. It is the end of Project Zorgo, but a new start for the Spy Ninjas, who can finally begin to make extremely awesome content without fear of the mean hackers. Perlita and the Cloaker, two strong individuals who have helped the team throughout their adventures against Project Zorgo have decided that their adventure is not yet over, and they part ways to finish their own story. And a huge special thanks to all the Spy Ninjas at home who have helped out throughout all the years, commenting, liking, sharing videos, and uploading their own. What's next for the Spy Ninjas? Is Project Zorgo truly defeated yet? What content are all the Spy Ninjas gonna make?Watch my friend’s awesome videos:Lucas and Marcus - I HID FROM MY GIRLFRIEND FOR 24 HOURS!https://www.youtube.com/watch?v=gJobpfeSO4wsuperbowserlogan - SML Movie: Jeffy's New Year's Resolutionhttps://www.youtube.com/watch?v=PrOQoPlb9y4sssniperwolf - Weird Vending Machines You've Never Seen Beforehttps://www.youtube.com/watch?v=64-_xdZCW4oFaZe Rug - I Got Plastic Surgery & This is How My Friends Reacted...https://www.youtube.com/watch?v=9AtHQ_jOKfEDude Perfect - Worst Dude Perfect Videos of All Time | OT 23https://www.youtube.com/watch?v=1SIX0HTH-50▶ SPY NINJAS & CWC Merchandise - https://www.spyninjasstore.com/▶ SPY NINJA NETWORK - http://spyninjanetwork.com/epzvideo▶ Official Spy Ninjas Website - https://www.spyninjas.net/Watch Spy Ninjas here:▶ Chad - https://www.youtube.com/user/chadwildclay▶ Vy - https://www.youtube.com/user/VyQwaint▶ Daniel - https://www.youtube.com/channel/UCmFzvquJYoSDFhd9W0JhZKw▶ Regina - https://www.youtube.com/channel/UCiNJel5I2JYglFEn0TOXh_Q▶ Melvin PZ9 - https://www.youtube.com/channel/UC6Ewbj-MFWA7dXgQA9y5EEwSpy Ninjas' Instagram:▶ Chad - https://www.instagram.com/chadwildclay▶ Vy - https://www.instagram.com/vyqwaint▶ Daniel - https://www.instagram.com/cwcdaniel▶ Regina - https://www.instagram.com/cwcregina▶ Melvin PZ9 - https://www.instagram.com/spyninjamelvin/Most royalty free background music is from Epidemic Sounds. You can use their music in your videos by clicking here http://share.epidemicsound.com/mDVsZ","I am a former member of Project Zorgo. I used to go by the hacker code name PZ1. Once I fully learned of their plans to control YouTube, I decided to leave the group and help my new friends Chad Wild Clay and Vy Qwaint by joining the SPY NINJAS. We then convinced my closest colleague, Regina PZ4, the join us as well. Her brother, Melvin PZ9 also joined the Spy Ninjas, however, his motives are always questionable.On this channel, I will be sharing everything I learned about the team and piecing together the clues, evidence, riddles, and puzzles to solve exactly what Project Zorgo is up to.","spy ninjas spy ninja hacker project zorgo hackers funny youtubers youtube comedy mystery vy qwaint cwc spy ninja chad wild clay daniel regina","Dqe7Iw2MiZ8"
