video_id,title,channelId,channelTitle,categoryId,duration,thumbnail_link,tags,description,channel_desc,channel_keywords,related_vid_id
Fg5gSBL9fy4,"“SKINS” IS A PERFECT EXAMPLE OF WHY I HATE ART PEOPLE| BAD MOVIES & A BEAT | KennieJD","UC-pkCUlaRDMA--8LTWQDuHA","Kennie J.D.","24","1886.0","https://i.ytimg.com/vi/Fg5gSBL9fy4/default.jpg","Kenniejd|african american|african|Kendall|Black|Black beauty|beauty|korean|korean beauty|kbeauty|k-beauty|makeup|makeup tutorial|korea|kpop|k-pop|korean makeup|lifestyle|GRWM|get ready with me|story time|storytime|dark|cosmetics|face|anime|asian trends|viral makeup|bad movies|bad movie reviews|reviews|commentary|bad movies and a beat|bad movies & a beat|kennie|funny|skins|skins Spanish movie|skins UK|pieles|art film|art house cinema","PRODUCTS USED~FACE~Rare Beauty Liquid Touch Weightless Foundation in 400W https://go.magik.ly/ml/13ko5/Rare Beauty Liquid Touch Brightening Concealer in 360W and 380W https://go.magik.ly/ml/13ko6/Beauty Bakerie Flour Powder Yellow https://go.magik.ly/ml/n3qm/Melt Makeup Powder Bronzer and Contour Sculpt Stack https://go.magik.ly/ml/13ko8/Heme Toasted Nut Blush https://shrsl.com/2pxzbAnastasia Beverly Hills Amrezy highlighter (discontinued)~EYES~EM Brow Pencil in Ebony https://www.emcosmetics.com/products/ebony-brow-pencil?utm_source=RAN&utm_medium=affiliates&utm_content=Kenniejd&utm_campaign=2&ranMID=44040&ranEAID=VQs6rOjmA8Q&ranSiteID=VQs6rOjmA8Q-0lS8afMEyqHUwGoTn9jbLwEM Cosmetics Flexi Brow https://www.emcosmetics.com/products/flexibrow-clear-brow-gel?utm_source=RAN&utm_medium=affiliates&utm_content=Kenniejd&utm_campaign=2&ranMID=44040&ranEAID=VQs6rOjmA8Q&ranSiteID=VQs6rOjmA8Q-wjRkN4jf7as1cOwkCsPVlgColourpop Lyric Pressed Power Palette https://go.magik.ly/ml/142pm/ Tony Moly Perfect Eyes Long Kinny Gel Pen Liner https://shrsl.com/2pxzp It Cosmetics Superhero Mascara  https://go.magik.ly/ml/ix5m/ ~LIPS~Colourpop Lippie Liner in Bff 3 https://go.magik.ly/ml/rvku/Colourpop So Juicy Gloss in She’s Here https://go.magik.ly/ml/142pn/~MUSIC~Ryan Little - Practice Patience - https://thmatc.co/?l=4EA44585▻FOLLOW MEInstagram: KenniejdTwitter: @Kenniejd▻CONTACT MEEmail (For collaboration or business Inquiries ONLY)KennieJD@gmail.comFTC: This video is NOT sponsored unless otherwise stated in the video. The links above are affiliate links, from which I do make a commission.","Hello, I'm Kennie (Kendall)I'm a blerd (black nerd) who loves everything beauty! I am a makeup and bad movie lover, self-proclaimed Korean beauty enthusiast, and just an overall chill chick. JOIN THE BISCUIT FAM! Subscribe to enter the world of makeup, kbeauty, randomness and the occasional storytime. NEW VIDEOS EVERY WEEK!","Kenniejd africa american african Kendall Black Black beauty beauty korean korean beauty kbeauty k-beauty makeup makeup tutorial korea kpop k-pop korean makeup lifestyle GRWM get ready with me story time storytime dark cosmetics face anime asian trends viral makeup skin care skincare bad movies bad movies and a beat bad movie reviews reviews","d3e8d9nErUk"
92R2X4f-e6A,"Peacock Dress 2: Unpacking a dark history","UCWmQGoSY-lmWlakti_Br3cQ","Cathy Hay","26","1651.0","https://i.ytimg.com/vi/92R2X4f-e6A/default.jpg","motivation|mental health|sewing|costuming|dressmaking|cosplay|happiness|peacock dress|house of worth","As the world changes and commits to creating a more inclusive, equitable world, some historical clothing makers have been asking hard questions specific to what we do. How on earth do we go on admiring and happily sewing clothes from a history that's laced with racism and injustice?I've been thinking hard about this myself, since as I'm sure you are aware, there's more to the Peacock dress than pretty metallic embroidery.This week, I want to share more about the historical landscape in which the Peacock dress was designed, made, and worn - including a potential connection to my own ancestors - and if I may, I'd like to share the thoughts of one insignificant, white, middle class woman about where we might go from here as people recreating these clothes.I think there IS something important that we can contribute - in fact, I think we have a small but highly relevant part to play in helping to create a better world.I hope you'll let me know what you think.Footnotes: apologies that most of these are Wikipedia links, I'm still early in this journey.1 - First Indian War of Independence, 1857 / Rebellion: https://en.wikipedia.org/wiki/Indian_Rebellion_of_18572 - Britain in India: https://en.wikipedia.org/wiki/History_of_the_British_Raj3 - Muslin: https://en.wikipedia.org/wiki/Muslin#History4 - Dr Shashi Tharoor on what Britain owes to India: https://youtu.be/f7CW7S0zxv4Further reading: this has been my first port of call...An Era of Darkness: The British Empire in India by Shashi TharoorImages:- Thumbnail: Muslim Lady Reclining or An Indian Girl with a Hookah, painted in Dacca, Bengal Presidency. A woman in Bengal region of the Indian subcontinent clad in fine Bengali muslin, by Francesco Renaldi, 1789 {{PD-US}}- Mrs Edmund Morton Pleydell by Thomas Gainsborough- Illustration from ''Journal für Fabrik, Manufaktur, Handlung und Mode''. Leipzig, Voß, 1st half of the year 1796. - Photograph of Cavendish Mill, Ashton-under-Lyne: One of a number of mills in the town where my ancestors lived. Photograph by Clem Rutter, Rochester, Kent.- Peacock dress listing on the National Trust website: http://www.nationaltrustcollections.org.uk/object/107881Join my mailing list and ask your own question:http://eepurl.com/ciT6hTYou can also follow me and see my own sewing on Instagram:http://instagram.com/cathy.hay","Let me offer you an oasis. Come home, exhale, and allow yourself to become the happiest, most creative human you can be, despite the chaos in your life.Hello, I'm Cathy. I've been working on my own mental and emotional health for almost 30 years after a mental health crisis knocked me sideways in my teens (I went there so that you don't have to.) I offer no formal qualifications in this area, just personal experience and more than a quarter century of obsessive independent study, but I hope to help you as a friend - and a voice of sanity in a demanding world.When I'm sewing, I love to reverse engineer and recreate the clothing of the late Victorian and Edwardian eras so that it can step out of the glass museum case and live again. I'm also the founder of the award-winning online community Foundations Revealed, which helps ambitious dressmakers to connect, learn together, and realise their most daring sewing dreams.","motivation creativity sewing dressmaking mental health costuming cosplay","d3e8d9nErUk"
iHH_Ipa27iE,"i know im way too late but... #makemememomintoameme","UCRQuECibLXz2yZxZwypqSVQ","Hello There","1","110.0","https://i.ytimg.com/vi/iHH_Ipa27iE/default.jpg","[none]","the video that inspired this one: https://m.youtube.com/watch?v=rezIbKrPNvM","hi :) no one is gonna read this lolshe/heri don’t know what this channel is supposed to be. i like to edit things and when something i make is good enough i’ll post it here. i have a feeling it’s going to be mostly the owl house and fashion history my account is a safe space for anyone who needs it. if you’re going to be ableist, racist, sexist, homophobic, transphobic, or any other ‘phobic’ i’m deleting your commentalso i’m sorry my grammar sucks🐢🏳️‍🌈","","d3e8d9nErUk"
J-M2kWCSANs,"Making a Silver & Brown Renaissance Gown | Vlog | Part Two","UChyWv5fy8utAWVhRPVV85XQ","Angela Clayton","26","2041.0","https://i.ytimg.com/vi/J-M2kWCSANs/default.jpg","sewing|costumery|diy|renaissance|cranach the elder|wolfgang krodel|tutorial|medieval|fashion|vlog|embroidery|lace|brocade|metallic|silver|brown|dress|historic|historical|angela clayton","Missed part one? Watch it first! : https://www.youtube.com/watch?v=EKV9Z-VMfMc✩ Relevant things✩Chalk liner: https://www.joann.com/clover-chaco-liner-marker-yellow/4791125.html?utm_source=google&utm_medium=cpc&gclid=CjwKCAjw_-D3BRBIEiwAjVMy7GiRKcuPRYmDWOYdpE49jZVemRvX7JIU0IR14zO_pbSYzAmfpJIBXRoChwQQAvD_BwEThe upholstery thread: https://www.onlinefabricstore.net/coats-and-clark-extra-strong-upholstery-thread-white-.htmI ordered the waxed thread from here: https://www.judithm.com/MORE VLOGS: https://www.youtube.com/playlist?list=PLk1yJujskxaCHy-iWxPaRTLLRboj7HF7oCranach the Elder works: https://www.wikiart.org/en/lucas-cranach-the-elderWolfgang Krodel the Elder has many works featuring similar designs. German 16th century gowns blog post: http://jeannedepompadour.blogspot.com/2013/04/german-style-from-1468-1588.html?m=1Medium weight canvas interlining - it appears they no longer stock the more affordable options. But it was originally purchased from : https://www.biasbespoke.com/✩✩✩If you would like to help support the channel, please check out my Patreon! https://www.patreon.com/angelacostumeryIt helps fund all my videos. And contributing gives you early access to my videos, and access to a bunch of exclusive content!✩✩✩If you are interested in seeing more of my work or contacting me, I'll leave links to my various sites below!Website: https://www.angelaclaytoncostumery.com/Instagram: https://www.instagram.com/angelacostumeryBlog: https: http://angelacostumery.comEmail: AngelaCostumery@gmail.com [serious inquires only please!]✩✩✩My name is Angela Clayton, I’m a twenty two year old self taught designer and seamstress who is currently living on Long Island, in NY. FAQ: Where is your dress form from? : I use three forms - a vintage WOLF form, a display form from Buystoreshelving.com, and a PGM form. What is your table made out of? : My table has a surface of HOMASOTE which is a paper fiber board, soft enough to push pins into.Where is your iron from? : I use this gravity feed iron (affiliate link) https://amzn.to/2NBtsyDWhat sewing machine do you use? : You can hear all about my machines in this video!https://www.youtube.com/watch?v=u5EDJcLWc8YDo you recommend any sewing books? : Yes! Read more about my library here.What scissors do you use? : I have three main pairsThe multichrome ones are by Tula Pink (affiliate link): https://amzn.to/300eH9xThe silver ones are by Gingher (affiliate link) : https://amzn.to/2LrewQFThe gold ones were gifted to me by Whiteley : https://www.whiteley.co.uk/exo/ https://angelacostumery.com/2016/11/22/historical-costume-reference-book-reviews/✩✩✩","I'm a hobbyist seamstress and costume maker who has hopes of working in the industry someday. I make a lot of historically inspired things and ruffly dresses. This channel is a way of sharing my progress and my process through videos. :)Unfortunately uploads might not be very consistent because a lot of my projects can't be filmed. But I keep my blogs updated with progress for all my costumes, especially the complicated ones I can't film!Angelacostumery.comA bit more about me: I'm mostly self taught when it comes to sewing, I learn through trial and error. I would like to work in the costume world, either for theater or film. Right now I don't have a job, nor am I attending classes (I have graduated high school) I'm just focusing on learning and building my portfolio!I live in New York and I have a wonderful miniature dachshund. My main inspiration is historical fashion. That's about it!","","d3e8d9nErUk"
3Ryg4X3oKAg,"Bridgerton's Golda Rosheuvel on playing TV's first Black Queen | No Filter with Naomi","UCK31LlyXHUjTr1kGQiqn3xA","Naomi","19","2677.0","https://i.ytimg.com/vi/3Ryg4X3oKAg/default.jpg","naomi|campbell|naomi campbell|naomi campbell youtube|youtube naomi campbell|bridgerton|queen|golda|golda rosheuvel|black queen|netflix|othello|no filter|interview","It was an absolute honor to sit down with actress Golda Rosheuvel to discuss the success of Bridgerton and becoming TV's first black queen.This is No Filter with Naomi, a weekly series with the most well-known innovators in the fashion, beauty and entertainment space. Subscribe now: https://bit.ly/-NaomiYTFollow Naomi!Instagram: https://instagram.com/NaomiTwitter: https://twitter.com/NaomiCampbellFacebook: https://facebook.com/NaomiCampbellWatch more videos!No Filter with Naomi: https://bit.ly/2B0hXdOBeing Naomi: https://bit.ly/3cJJ5v2Newest Videos: https://bit.ly/32MYGc1 Most Popular: https://bit.ly/39oG0k4 About Naomi Campbell:Naomi was born in London, England and discovered as a fashion model at age 15. Throughout her career, she's fronted the covers of over 1000 magazines, been featured in campaigns for celebrated houses including Burberry, Prada, Dolce & Gabbana, Marc Jacobs, and Louis Vuitton, and walked iconic shows for Chanel, Azzedine Alaia, Christian Dior, and Versace. Beyond her work in the fashion & entertainment industries, Campbell has used her celebrity for an array of fundraising and non-profit initiatives across the globe.  Environmentalism, as well as Human Rights and Global Health, as it specifically pertains to women and children, have been critical sectors of Campbell’s work.  She has even formed her own non-profit, Fashion For Relief.Today, Campbell is undoubtedly solidifying her place as a cultural innovator- using her incredible platform and success for positive change across industries around the world.#NaomiCampbell","Welcome to the official Naomi Campbell YouTube channel! Naomi Campbell was born in London, England and discovered as a fashion model at age 15. Throughout her career, she's fronted the covers of over 1000 magazines, been featured in campaigns for celebrated houses including Burberry, Prada, Dolce & Gabbana, Marc Jacobs, and Louis Vuitton, and walked iconic shows for Chanel, Azzedine Alaia, Christian Dior, and Versace.Beyond her work in the fashion & entertainment industries, Campbell has used her celebrity for an array of fundraising and non-profit initiatives across the globe.  Environmentalism, as well as Human Rights and Global Health, as it specifically pertains to women and children, have been critical sectors of Campbell’s work.  She has even formed her own non-profit, Fashion For Relief.Today, Campbell is undoubtedly solidifying her place as a cultural innovator- using her incredible platform and success for positive change across industries around the world.","naomi campbell naomi campbell naomi campbell youtube youtube naomi campbell naomi campbell channel channel naomi campbell naomi campbell youtube channel youtube channel naomi campbell naomi youtube youtube naomi naomi youtube channel youtube channel naomi no filter filter no filter with naomi naomi no filter being naomi interview interviews naomi interview interview naomi naomi campbell interview interview naomi campbell naomi campbell walk naomi campbell airplane tyra banks tyra banks naomi campbell","d3e8d9nErUk"
tXasadwCrZI,"Krystal and Saagar: The CRINGIEST Moments Of Media’s Fawning Biden Inaugural Coverage","UCPWXiRWZ29zrxPFIQT7eHSA","The Hill","25","564.0","https://i.ytimg.com/vi/tXasadwCrZI/default.jpg","Rising|Krystal Ball|Saagar Enjeti|Progressive|Progressive Politics|Democrats|Democratic Party|Republicans|GOP|Republican Party|Media|Biden|Biden Administration","Krystal Ball and Saagar Enjeti react to the media's shift in tone as they begin to cover the Biden administration.About Rising: Rising is a weekday morning show with bipartisan hosts that breaks the mold of morning TV by taking viewers inside the halls of Washington power like never before. The show leans into the day's political cycle with cutting edge analysis from DC insiders who can predict what is going to happen. It also sets the day's political agenda by breaking exclusive news with a team of scoop-driven reporters and demanding answers during interviews with the country's most important political newsmakers. Follow Rising on social media:Website: Hill.TVFacebook: facebook.com/HillTVLive/Instagram: @HillTVLiveTwitter: @HillTVLiveFollow Saagar Enjeti & Krystal Ball on social media:Twitter: @esaagar and @krystalballInstagram: @esaagar and @krystalmball","The Hill is the premier source for policy and political news. Follow for tweets on what's happening in Washington, breaking news and retweets of our reporters.","The Hill Capitol Hill Lobbying Politics Campaign Political Congress Trump Clinton Obama Congressional House Senate Legislation Roll Call Lobbyists Presidential Election K Street Pelosi Rising Krystal Ball Saagar Enjeti Bernie Sanders Rising Joe Biden","d3e8d9nErUk"
e4wajXk_cDs,"Kristin's Wife Comes Out As Trans","UCsN7kK_cJKG4PtP5AC8MP4A","The Kitchen & Jorn Show","22","1261.0","https://i.ytimg.com/vi/e4wajXk_cDs/default.jpg","trans|coming out|coming out as trans|trans woman|trans women|brie|kristin and jen|kitchen and jorn|jen from buzzfeed|kristin from buzzfeed","Meet Brie!Subscribe to our Patreon: https://www.patreon.com/kitchenandjornVideo edited by: Mia Barnett (https://www.instagram.com/miapagebarnett)Video captioned by: Arielle StewartTitle cards by: Oliver Rogue (https://www.youtube.com/c/OXRStudios)Channel art by: Sarah Day (https://sarahdayarts.com)New videos every Friday, at 12PM PST!Sound effects obtained from: https://www.zapsplat.com","New videos every Friday at 12PM PST!The wonderful and beloved creation of Kristin Chirico and Jen Ruggirello! Do you love hilarious queer women who are also HOT? Do you wanna laugh/cry/and kiss our beautiful faces? Then subscribe to The Kitchen & Jorn Show! Videos about being gay, being silly, being lovely, and our lives as independent creators in Los Angeles!Channel Art by the wonderful Sarah Day (@sarahdayarts)","","d3e8d9nErUk"
qbF7ita0RfQ,"Is Bridgerton historically inaccurate?? (no spoilers!)","UCstXtOmn4BvOnxKg81Msz4Q","Luanda Yasmin","24","214.0","https://i.ytimg.com/vi/qbF7ita0RfQ/default.jpg","Bridgerton|Netflix|Regency era|London|Daphne Bridgerton|Simon Basset|Lady Whistledown|Featherington|Period Drama|Queen Charlotte|Royal family|Julie Andrews|Shonda Rhimes|Shondaland|Julia Quinn|Chris Van Dusen|King George III|Queen Elizabeth II|Queen Victoria|Historian|Romance|Romance novel|Historical","The new period drama on Netflix is raising eyebrows over it’s inclusive cast. Let’s talk about how realistic it is for black people to be in Regency era London. Luanda’s socials: Instagram: https://www.instagram.com/luandayasminTwitter: https://www.twitter.com/luandayasmin Tik Tok: https://vm.tiktok.com/ZSgkr5eX/","Luanda is an actress, model, spoken word artist, writer and content creator. These are her thoughts and feelings in the form of opinion pieces, current affairs commentary and comedy sketches.","","d3e8d9nErUk"
KmBIOxeuJ3I,"John Oliver on Biden’s Inauguration, Trump’s Bizarre Departure & Becoming a U.S. Citizen","UCa6vGFO9ty8v5KZJXQxdhaw","Jimmy Kimmel Live","23","751.0","https://i.ytimg.com/vi/KmBIOxeuJ3I/default.jpg","jimmy|jimmy kimmel|jimmy kimmel live|late night|talk show|funny|comedic|comedy|clip|comedian|mean tweets|Pandemic|Coronavirus|COVID-19|Social Distancing|Quarantine|Interview|John Oliver|Late Night Hosts|Kids|TV Production|Inauguration|Joe Biden|Garth Brooks|Jlo|Citizenship|Donald Trump|America|Valentines Day|England|British|New Zealand|British Government|January the 6th|Rudy Giuliani|Village People|YMCA|Frank Sinatra","John talks about the challenges of doing his show from home, Joe Biden being sworn in as President, becoming a U.S. citizen while Trump was in office, returning to work on Valentine’s Day, friends from England calling him to talk about the state of the world, and the Capitol attacks. SUBSCRIBE to get the latest #Kimmel: http://bit.ly/JKLSubscribeWatch Mean Tweets: http://bit.ly/KimmelMT10Connect with Jimmy Kimmel Live Online:Visit the Jimmy Kimmel Live WEBSITE: http://bit.ly/JKLWebsiteLike Jimmy Kimmel on FACEBOOK: http://bit.ly/KimmelFBLike Jimmy Kimmel Live on FACEBOOK: http://bit.ly/JKLFacebookFollow @JimmyKimmel on TWITTER: http://bit.ly/KimmelTWFollow Jimmy Kimmel Live on TWITTER: http://bit.ly/JKLTwitterFollow Jimmy Kimmel Live on INSTAGRAM: http://bit.ly/JKLInstagramAbout Jimmy Kimmel Live:Jimmy Kimmel serves as host and executive producer of Emmy®-nominated “Jimmy Kimmel Live!,” ABC’s late-night talk show. “Jimmy Kimmel Live!” is well known for its huge viral video successes, with over 11 billion views and more than 15 million subscribers on the show’s YouTube channel. Some of Kimmel’s most popular comedy bits include “Celebrities Read Mean Tweets,” “Lie Witness News,” “Unnecessary Censorship,” “Halloween Candy YouTube Challenge,” and music videos like “I (Wanna) Channing All Over Your Tatum.”","The official Jimmy Kimmel Live! YouTube Channel. Home of Celebrities Read Mean Tweets, YouTube Challenges and the rest of your favorite viral late night videos.","Official Jimmy Kimmel Live channel late night comedy talk show funny humor laughs abc disney JKL ABC Jackhole comics bits clips sketches comedians tonight hollywood highland los angeles california walt company talkshow nightly mean tweets","d3e8d9nErUk"
uWh5JdynBUM,"Superman & Lois Trailer (HD) Tyler Hoechlin The CW superhero series","UCDR8cvjALazMm2j9hOar8_g","TV Promos","24","61.0","https://i.ytimg.com/vi/uWh5JdynBUM/default.jpg","tv promos|tvpromosdb|television promos|tvpromos","In SUPERMAN & LOIS, after years of facing megalomaniacal supervillains, monsters wreaking havoc on Metropolis, and alien invaders intent on wiping out the human race, the world’s most famous superhero, The Man of Steel aka Clark Kent (Tyler Hoechlin, “Teen Wolf”) and comic books’ most famous journalist, Lois Lane (Elizabeth Tulloch, “Grimm”), come face to face with one of their greatest challenges ever - dealing with all the stress, pressures and complexities that come with being working parents in today’s society. Complicating the already daunting job of raising two boys, Clark and Lois must also concern themselves with whether or not their sons Jonathan (Jordan Elsass, “Little Fires Everywhere”) and Jordan (Alexander Garfin, “The Peanuts Movie”) could inherit their father’s Kryptonian superpowers as they grow older. Returning to Smallville to handle some Kent family business, Clark and Lois are reacquainted with Lana Lang (Emmanuelle Chriqui, “Entourage”), a local loan officer who also happens to be Clark’s first love, and her Fire Chief husband Kyle Cushing (Erik Valdez, “Graceland”). The adults aren’t the only ones rediscovering old friendships in Smallville as the Kent sons are reacquainted with Lana and Kyle’s rebellious daughter, Sarah (Inde Navarrette, “Wander Darkly”). Of course, there’s never a dull moment in the life of a superhero, especially with Lois’ father, General Samuel Lane (Dylan Walsh, “Nip/Tuck”) looking for Superman to vanquish a villain or save the day at a moment’s notice. Meanwhile, Superman and Lois’ return to idyllic Smallville is set to be upended when a mysterious stranger (Wolé Parks, “All American”) enters their lives. Subscribe to tvpromosdb on Youtube for more Superman & Lois season 1 promos in HD!Superman & Lois official website: https://www.cwtv.com/shows/superman-and-lois/Watch more Superman & Lois Season 1 videos: https://www.youtube.com/playlist?list=PLfrisy2KXzkeBVk1nyOlJPfYS3v6RyBfJLike Superman & Lois on Facebook: https://www.facebook.com/CWSupermanAndLoisFollow Superman & Lois on Twitter: https://twitter.com/cwsupermanloisFollow Superman & Lois on Instagram: https://www.instagram.com/cwsupermanandlois#SupermanAndLois» Watch Superman & Lois Tuesdays at 9:00pm on The CW» Starring: Tyler Hoechlin, Elizabeth Tulloch, Jordan Elsass, Alexander Garfin","Here you'll find only officially released television promos and teasers, along with exclusive interviews and more. Make sure to subscribe to never miss a video! Visit our websites below for more up to the minute television news.","TV promos television tvpromosdb televisionpromosdb tvpromos trailers commercials Television Promos","d3e8d9nErUk"
3XP5SiWwuWg,"Enough is enough.","UCneR_qQ1NE_u9neBSEJJ7lg","MsAaliyahJay","1","853.0","https://i.ytimg.com/vi/3XP5SiWwuWg/default.jpg","1-20-21","Shop My Clothing Brand: https://twistedsaintsswim.comFollow my clothing brand @TwistedSaintsSwimNEW VIDEOS EVERY WEEK!*Click the notification bell so you don't miss new content!*SUBSCRIBE ⇢ Youtube.com/MsAaliyahJay⇢ MY NEICE’S CHANNEL (FOR KIDS): https://www.youtube.com/channel/UC_yPye4htHVKGmvmjFp2nJg》》》》》》》》》》》》》》》》》》》》》》》》》》》》❀ Lets be friends ♡⇢ Instagram: @AaliyahJay⇢Twitter: @AaliyahJay⇢ Snapchat: MsAaliyahJay⇢ My Brand: www.twistedsaintsswim.com⇢ My Brand Instagram: @TwistedSaintsswim ⇢ Merch Page: @AaliyahArmyShop ⇢ Merch Website https://fanjoy.co/collections/aaliyah-jay ❀ POPULAR VIDEOS ❀ MAKEUP TUTORIALS ⇢ https://www.youtube.com/playlist?list=PLVpgGIOCWdSi_LAvKX3_nCgZLxqvKBt_F STORY TIMES ⇢ https://www.youtube.com/playlist?list=PLVpgGIOCWdSjGftcd93TbOVmksX-LPh9LHAIR TUTORIALS ⇢ https://www.youtube.com/playlist?list=PLVpgGIOCWdSi0Ok_MC2viZwiPDtzE88uW GIRL CHAT ⇢ https://www.youtube.com/playlist?list=PLVpgGIOCWdSjl_hEI0_ZrsmmhItf4GssN 》》》》》》》》》》》》》》》》》》》》》》》》》》》》❀ FREQUENTLY ASKED QUESTIONS ⇢ Q: How old are you? A: 25⇢ Q: Where do you live? Los Angeles & New York City ⇢ Q: What camera do you use? A: Canon T3i ⇢ Q: What editing software do you use? A: Final Cut Pro","I'm not into fashion, Fashion is into me....INSTAGRAM: @AaliyahJayTwitter.com/AaliyahJay","","d3e8d9nErUk"
