video_id,title,channelId,channelTitle,categoryId,duration,thumbnail_link,tags,description,channel_desc,channel_keywords,related_vid_id
ydcqVrSCOns,"I let 100 players build their dream house in 1 hour","UCsEgeyBfOnGGBpjIvkDJbWg","Socksfor1","20","607.0","https://i.ytimg.com/vi/ydcqVrSCOns/default.jpg","Socksfor1|I let 100 players build their dream house in 2 hours|minecraft 100 player challenge|I gave 100 players plots|minecraft build challenge|minecraft build challenges￼|minecraft|I paid 10000 dollars|i paid 10000 dollars for pro minecraft|i paid 10000 for pro minecraft builders to upgrade my base|minecraft 100|family friend|no cursing|no swearing|laast to stop|challenge|dream house|dream minecraft house|dream mine","yeetfor more events join my server socks.gg YEET (╯°□°)╯︵ ┻━┻ Previous Video →https://www.youtube.com/watch?v=F-CUE9yTR0Q#Minecraft#100player⛏️JOIN SERVER → socks.gg use code Socksfor1 in the item shop ad👽REDDIT → https://bit.ly/3ejZBmf🔴TWITCH → https://bit.ly/3iSmkcq📷INSTAGRAM → https://bit.ly/38KFjRA 🐦TWITTER → https://bit.ly/2Oi0YHC👕NEW MERCH → https://bit.ly/2AThH0O🎥2ND CHANNEL → https://bit.ly/38Kb6SQ 😀DISCORD → https://bit.ly/2ZXonUcMUSIC → https://bit.ly/3edT2Sc OUTRO → https://bit.ly/2DoKefpMODPACK → https://bit.ly/2BQWQM9EDITOR → praduhEMAIL→ nicholas@socksfor1.comFamily Friendly PG Clean 13+","I do it all! Editor for others with over 100 million plus views including Samsung USReddit, Twitch, Tiktok, Youtube partnerInstagram https://www.instagram.com/socksfor1/Twitter https://twitter.com/Socksfor1Twitch https://www.twitch.tv/socksfor1#1 trending - 10/29/201000 Subs- 2/16/182000 Subs- 7/7/183000 Subs-10/9/185000 Subs-11/22/1810000 Subs-12/10/1825000 Subs-12/27/1850000 Subs 3/13/19100000 Subs 4/25/19500000 Subs 10/31/191000000 Subs 2/25/202000000 Subs 10/21/203000000 Subs 1/1/21","Sockfor1 Fortnite Minecraft Family Friendly 13+ VR Virtual Reality Dank Memes Dank","7Jbtl9JTOHQ"
Bs8sxyqAzpg,"Minecraft, But Everytime I Jump, I Jump Higher","UCsEgeyBfOnGGBpjIvkDJbWg","Socksfor1","20","665.0","https://i.ytimg.com/vi/Bs8sxyqAzpg/default.jpg","Socksfor1|minecraft|family friendly|jump map|jump higher|mod|minecraft mod|socksfor1 modded minecraft|socksfor1 modded minecraft part 1|socks for 1 modded minecraft on impossible|minecraft but every jump is 1000 feet|minecreaft modded|child friendly|no swearing|how to|minecraft but|no cursing|kid friendly","Minecraft but every jump is over 1000 feet!LAST VIDEO: https://www.youtube.com/watch?v=5sdk5UFouGgTWITTER► https://www.twitter.com/Socksfor1 Merch► https://teespring.com/stores/socksfor1-drawerFatmemegod► https://www.youtube.com/watch?v=QmZ_66Sm93wBlaza► https://www.youtube.com/channel/UCiaRjc5me4e-rChdBh076dAModcredit Ziplaw -https://www.youtube.com/channel/UCT_drzuYCUjVXufAaEoIb3QRoarkCats - https://twitter.com/Roark_CatsSocksfor2►  https://www.youtube.com/channel/UC-XTuGOHIF7vWvbhJZ56wbwTIKTOK► http://vm.tiktok.com/dQ5p6m/TWITCH► https://www.twitch.tv/socksfor1TWITTER► https://www.twitter.com/Socksfor1 DISCORD ► https://discord.gg/AUxGJkUINSTAGRAM ►https://www.instagram.com/socksfor1/#Minecraft#jumpClips/Songs in OrderEditor: Sony Vegas 16Copyright problem/Business? nicholas@socksfor1.comI will contact you back as soon as possible. Thank you for watching! Hoped you enjoyed.","I do it all! Editor for others with over 100 million plus views including Samsung USReddit, Twitch, Tiktok, Youtube partnerInstagram https://www.instagram.com/socksfor1/Twitter https://twitter.com/Socksfor1Twitch https://www.twitch.tv/socksfor1#1 trending - 10/29/201000 Subs- 2/16/182000 Subs- 7/7/183000 Subs-10/9/185000 Subs-11/22/1810000 Subs-12/10/1825000 Subs-12/27/1850000 Subs 3/13/19100000 Subs 4/25/19500000 Subs 10/31/191000000 Subs 2/25/202000000 Subs 10/21/203000000 Subs 1/1/21","Sockfor1 Fortnite Minecraft Family Friendly 13+ VR Virtual Reality Dank Memes Dank","7Jbtl9JTOHQ"
q7R6mckmb4o,"RAFT but every 10 seconds A SHARK SPAWNS","UCsEgeyBfOnGGBpjIvkDJbWg","Socksfor1","20","635.0","https://i.ytimg.com/vi/q7R6mckmb4o/default.jpg","Socksfor1|raft|raft 24 hours|raft but a shark spawns every 10 seconds|raft but a shark spawns every 10 seconds (mod)|raft game|raft shark|raft gameplay|raft funny moments|raft online|raft but I download every single mod|raft update|raft lets play|raft new chapter aphmau|raft new update|raft new ending|worlds best raft|raft fastest boat|raft faster raft|raft fastest way to get wood|raft bird nest|raft bird boss|raft bird kill","raft but I download every single mod and sharks spawn every 10 secondsPrevious Video →https://www.youtube.com/watch?v=io0scSLdav4#Mods#RaftFriends in video @Fatmemegod @blazaplays⛏️JOIN SERVER → socks.gg use code Socksfor1 in the item shop ad👽REDDIT → https://bit.ly/3ejZBmf🔴TWITCH → https://bit.ly/3iSmkcq📷INSTAGRAM → https://bit.ly/38KFjRA 🐦TWITTER → https://bit.ly/2Oi0YHC👕NEW MERCH → https://bit.ly/2AThH0O🎥2ND CHANNEL → https://bit.ly/38Kb6SQ 😀DISCORD → https://bit.ly/2ZXonUcMUSIC → https://bit.ly/3edT2Sc (Kevin MacLeod)→ https://bit.ly/3kdvbVY (Epidemic) OUTRO → https://bit.ly/2DoKefpMODPACK → https://bit.ly/2BQWQM9EDITOR → praduhEMAIL→ nicholas@socksfor1.comFamily Friendly PG Clean 13+","I do it all! Editor for others with over 100 million plus views including Samsung USReddit, Twitch, Tiktok, Youtube partnerInstagram https://www.instagram.com/socksfor1/Twitter https://twitter.com/Socksfor1Twitch https://www.twitch.tv/socksfor1#1 trending - 10/29/201000 Subs- 2/16/182000 Subs- 7/7/183000 Subs-10/9/185000 Subs-11/22/1810000 Subs-12/10/1825000 Subs-12/27/1850000 Subs 3/13/19100000 Subs 4/25/19500000 Subs 10/31/191000000 Subs 2/25/202000000 Subs 10/21/203000000 Subs 1/1/21","Sockfor1 Fortnite Minecraft Family Friendly 13+ VR Virtual Reality Dank Memes Dank","7Jbtl9JTOHQ"
3rvVMgB8DFY,"Among Us NEW VAMPIRE ROLE","UC5dLONf1C4HwzSZQ8ptpETA","Bakbak","20","623.0","https://i.ytimg.com/vi/3rvVMgB8DFY/default.jpg","among us|among|us|among us IQ|among us impostor|among us but the impostor can|among us mods|among us mod|among us modded|among us new|among us new role|among us new gamemode|among us vampire role|among us funny|among us memes|Among Us NEW VAMPIRE ROLE","Among Us coded so that there's a new Vampire roleTwitch: https://www.twitch.tv/bakbakliveTwitter: https://twitter.com/Bakbak_YTDiscord: https://discord.gg/mZ7EKaBSupport a creator code: BakbakFriends in this videohttps://bit.ly/3l1b25shttps://bit.ly/3fPPqbt","I make videos.That's about it really.For business enquiries: ytbakbak@gmail.com","Fortnite","7Jbtl9JTOHQ"
m1xEAm9Ndks,"among us SPECIAL ROLES but EVERYONE CAN VENT (mods)","UCsEgeyBfOnGGBpjIvkDJbWg","Socksfor1","20","830.0","https://i.ytimg.com/vi/m1xEAm9Ndks/default.jpg","Socksfor1|among us|among us mods|among us funny|among us memes|among us new gamemode|among us funny moments|among us gameplay|among us hacks|among us cheats|among us impostor|among us modded|among us 100 players|among us no kill cooldown|among us update|among us glitch|among us but crewmates can vent|among us iq|among us new|among us hack|among us imposter|among us socksfor1|among us but everyone can vent|among us trolling|modded among us","Today we play modded among us SPECIAL ROLES but EVERYONE CAN VENT Enter the youtooz giveaway ! - https://socksfor1.youtooz.com/Follow my Twitter - @Socksfor1Follow my Instagram - @Socksfor1Edited By- PraduhCheck now out the youtooz website-  https://youtooz.com/products/socksfor1Friends in video @Blaza Plays @FatMemeGod @Joocie @Nadwe @Laff @TbhHonest #amongusWelcome back to modded among us but today we are playing with some special among us roles such as sheriff, jester, doctor, and detective. The twist is now that all the crewmates have the ability to vent! This results in some crazy impostor plays and also allows the crewmates to pull of some fun stuff as well! I will be playing with my friends with Blaza, Memegod, Laff and many more! This was for sure a cool among us mod and even competes with among us terminator mode, among us god mode, among new doctor role, among us no kill cooldown, among us new airship map, and all the cool among us roles!","I do it all! Editor for others with over 100 million plus views including Samsung USReddit, Twitch, Tiktok, Youtube partnerInstagram https://www.instagram.com/socksfor1/Twitter https://twitter.com/Socksfor1Twitch https://www.twitch.tv/socksfor1#1 trending - 10/29/201000 Subs- 2/16/182000 Subs- 7/7/183000 Subs-10/9/185000 Subs-11/22/1810000 Subs-12/10/1825000 Subs-12/27/1850000 Subs 3/13/19100000 Subs 4/25/19500000 Subs 10/31/191000000 Subs 2/25/202000000 Subs 10/21/203000000 Subs 1/1/21","Sockfor1 Fortnite Minecraft Family Friendly 13+ VR Virtual Reality Dank Memes Dank","7Jbtl9JTOHQ"
CkJ8sYKDQlU,"RLCRAFT Survival Competition (Hardest Minecraft Modpack)","UCsEgeyBfOnGGBpjIvkDJbWg","Socksfor1","20","1033.0","https://i.ytimg.com/vi/CkJ8sYKDQlU/default.jpg","Socksfor1|socksfor1 mods|socksfor1 largest modpack|socksfor1 rl craft|socksfor1 hardest modpack|socksfor1 blaza|socksfor1 vs blaza|socksfor1 but I download every single mod|socksfor1|socksfor1 modded minecraft|socksfor1 vs blaza hardest minecraft modpack|hardest minecraft achievement|rl craft|rl craft hardest modpack","today i go head to head vs blaza in rl craft who can do better YEET (╯°□°)╯︵ ┻━┻ Previous Video →https://www.youtube.com/watch?v=2DFx8yWJjYY#Minecraft#Mod⛏️JOIN SERVER → socks.gg use code Socksfor1 in the item shop ad👽REDDIT → https://bit.ly/3ejZBmf🔴TWITCH → https://bit.ly/3iSmkcq📷INSTAGRAM → https://bit.ly/38KFjRA 🐦TWITTER → https://bit.ly/2Oi0YHC👕NEW MERCH → https://bit.ly/2AThH0O🎥2ND CHANNEL → https://bit.ly/38Kb6SQ 😀DISCORD → https://bit.ly/2ZXonUcMUSIC → https://bit.ly/3edT2Sc OUTRO → https://bit.ly/2DoKefpMODPACK → https://bit.ly/2BQWQM9EDITOR → aosebi EMAIL→ nicholas@socksfor1.comFamily Friendly PG Clean 13+","I do it all! Editor for others with over 100 million plus views including Samsung USReddit, Twitch, Tiktok, Youtube partnerInstagram https://www.instagram.com/socksfor1/Twitter https://twitter.com/Socksfor1Twitch https://www.twitch.tv/socksfor1#1 trending - 10/29/201000 Subs- 2/16/182000 Subs- 7/7/183000 Subs-10/9/185000 Subs-11/22/1810000 Subs-12/10/1825000 Subs-12/27/1850000 Subs 3/13/19100000 Subs 4/25/19500000 Subs 10/31/191000000 Subs 2/25/202000000 Subs 10/21/203000000 Subs 1/1/21","Sockfor1 Fortnite Minecraft Family Friendly 13+ VR Virtual Reality Dank Memes Dank","7Jbtl9JTOHQ"
9oxT7LaEqv8,"among us NEW FORTNITE GAMEMODE","UC-XTuGOHIF7vWvbhJZ56wbw","Socksfor2","20","548.0","https://i.ytimg.com/vi/9oxT7LaEqv8/default.jpg","Family Friendly|VR|Gaming|Dank|socksfor2|Socksfor1|among us fortnite|among us socksfor1|socksfor1 mods|among us socksfor1 mods|among us new fortnite gamemode|new among us update|fortnite among us","today we play fortnite among us and it was actually pretty goodPrevious Video →https://www.youtube.com/watch?v=7Jbtl9JTOHQ#Minecraft#forniteFriends (sub to them) Fatmemegod- https://bit.ly/33oDf0GBlaza-https://bit.ly/3cWCMGj⛏️JOIN SERVER → socks.gg use code Socksfor1 in the item shop ad👽REDDIT → https://bit.ly/3ejZBmf🔴TWITCH → https://bit.ly/3iSmkcq📷INSTAGRAM → https://bit.ly/38KFjRA 🐦TWITTER → https://bit.ly/2Oi0YHC👕NEW MERCH → https://bit.ly/2AThH0O🎥2ND CHANNEL → https://bit.ly/38Kb6SQ 😀DISCORD → https://bit.ly/2ZXonUcMUSIC → https://bit.ly/3edT2Sc (Kevin MacLeod)→ https://bit.ly/3kdvbVY (Epidemic) OUTRO → https://bit.ly/2DoKefpMODPACK → https://bit.ly/2BQWQM9EDITOR → praduhEMAIL→ nicholas@socksfor1.comFamily Friendly PG Clean 13+","This is my second channel more focused on VR GAMING! All the best virtual reality moments!Editor for others with over 100 million plus views including Samsung USReddit, Twitch, Tiktok, Youtube partner500k subs 11/25/20Instagram https://www.instagram.com/socksfor1/Twitter https://twitter.com/Socksfor1Twitch https://www.twitch.tv/socksfor1","VR Family Family Friendly VR Gaming Oculus Socksfor1 Socksfor2 Virtual Reality Mully Joshdub Eddievr","7Jbtl9JTOHQ"
Oz3TESMremg,"I use INVISBILITY in minecraft among us to win","UCsEgeyBfOnGGBpjIvkDJbWg","Socksfor1","20","943.0","https://i.ytimg.com/vi/Oz3TESMremg/default.jpg","Socksfor1|I use INVISBILITY in minecraft among us to win|socksfor1 among us|socksfor1 minecraft|minecraft among us|among us hacks|among us cheats|among us minecraft map|among us socksfor1|among us no kill cooldown hack|among us no kill cooldown hack pc|among us no skill cooldown mod|among us invisible glitch|among us invisible name|socksfor1 among us mods","well to minecraft among us but I use invisiblity to win as an impostorsocks.gg (1.12.2) COME PLAY Previous Video →https://www.youtube.com/watch?v=poW3z9x9EDk#Minecraft#ModFriends (sub to them) Fatmemegod- https://bit.ly/33oDf0GBlaza-https://bit.ly/3cWCMGj⛏️JOIN SERVER → socks.gg use code Socksfor1 in the item shop ad👽REDDIT → https://bit.ly/3ejZBmf🔴TWITCH → https://bit.ly/3iSmkcq📷INSTAGRAM → https://bit.ly/38KFjRA 🐦TWITTER → https://bit.ly/2Oi0YHC👕NEW MERCH → https://bit.ly/2AThH0O🎥2ND CHANNEL → https://bit.ly/38Kb6SQ 😀DISCORD → https://bit.ly/2ZXonUcMUSIC → https://bit.ly/3edT2Sc (Kevin MacLeod)→ https://bit.ly/3kdvbVY (Epidemic) OUTRO → https://bit.ly/2DoKefpMODPACK → EDITOR → praduhEMAIL→ nicholas@socksfor1.comFamily Friendly PG Clean 13+","I do it all! Editor for others with over 100 million plus views including Samsung USReddit, Twitch, Tiktok, Youtube partnerInstagram https://www.instagram.com/socksfor1/Twitter https://twitter.com/Socksfor1Twitch https://www.twitch.tv/socksfor1#1 trending - 10/29/201000 Subs- 2/16/182000 Subs- 7/7/183000 Subs-10/9/185000 Subs-11/22/1810000 Subs-12/10/1825000 Subs-12/27/1850000 Subs 3/13/19100000 Subs 4/25/19500000 Subs 10/31/191000000 Subs 2/25/202000000 Subs 10/21/203000000 Subs 1/1/21","Sockfor1 Fortnite Minecraft Family Friendly 13+ VR Virtual Reality Dank Memes Dank","7Jbtl9JTOHQ"
gkqLF84Fc68,"among us NEW FLOOR IS LAVA GAMEMODE (mods)","UCsEgeyBfOnGGBpjIvkDJbWg","Socksfor1","20","647.0","https://i.ytimg.com/vi/gkqLF84Fc68/default.jpg","Socksfor1|among us|among us mods|among us but the impostor is a terminator|socksfor1 among us mods|op among us mods|among us but the floor is lava|among us floor is lava mod|among us new gamemode|among us update|among us but the impostor can turn inton ayone|among us but the impostor can freeze time","today we coded the floor is lava gamemode but the impostor is immune to the lava FOLLOW ME  https://bit.ly/33oI3mmPrevious Video →https://www.youtube.com/watch?v=ccFvk6MPvgk#amongus#ModFriends (sub to them) Fatmemegod- https://bit.ly/33oDf0GBlaza-https://bit.ly/3cWCMGjJuice- https://bit.ly/3oga4ENNadwe- https://bit.ly/3mmpJ4O⛏️JOIN SERVER → socks.gg use code Socksfor1 in the item shop ad😀TIKTOK→ https://bit.ly/2UynFdt👽REDDIT → https://bit.ly/3ejZBmf🔴TWITCH → https://bit.ly/3iSmkcq📷INSTAGRAM → https://bit.ly/38KFjRA 🐦TWITTER → https://bit.ly/2Oi0YHC👕NEW MERCH → https://bit.ly/2AThH0O🎥2ND CHANNEL → https://bit.ly/38Kb6SQ 😀DISCORD → https://bit.ly/2ZXonUcMUSIC → https://bit.ly/3edT2Sc (Kevin MacLeod)→ https://bit.ly/3kdvbVY (Epidemic) OUTRO → https://bit.ly/2DoKefpMODPACK → EDITOR → praduhEMAIL→ nicholas@socksfor1.comFamily Friendly PG Clean 13+","I do it all! Editor for others with over 100 million plus views including Samsung USReddit, Twitch, Tiktok, Youtube partnerInstagram https://www.instagram.com/socksfor1/Twitter https://twitter.com/Socksfor1Twitch https://www.twitch.tv/socksfor1#1 trending - 10/29/201000 Subs- 2/16/182000 Subs- 7/7/183000 Subs-10/9/185000 Subs-11/22/1810000 Subs-12/10/1825000 Subs-12/27/1850000 Subs 3/13/19100000 Subs 4/25/19500000 Subs 10/31/191000000 Subs 2/25/202000000 Subs 10/21/203000000 Subs 1/1/21","Sockfor1 Fortnite Minecraft Family Friendly 13+ VR Virtual Reality Dank Memes Dank","7Jbtl9JTOHQ"
AGbdfauxgaE,"among us NEW VR UPDATE","UC-XTuGOHIF7vWvbhJZ56wbw","Socksfor2","20","755.0","https://i.ytimg.com/vi/AGbdfauxgaE/default.jpg","Family Friendly|VR|Gaming|Dank|socksfor2|Socksfor1|among us vr|among us socksfor1|among us no killcooldown|among us but its vr|among us virtual reality|among us oculus|among us vr chat|among us cheats|among us hacks|among us 100 players|among us 100 real players","among us but in VR yes Previous Video →https://www.youtube.com/watch?v=FVwxdKJxyEE#amongus#vrFriends (sub to them) Fatmemegod- https://bit.ly/33oDf0GBlaza-https://bit.ly/3cWCMGj⛏️JOIN SERVER → socks.gg use code Socksfor1 in the item shop ad👽REDDIT → https://bit.ly/3ejZBmf🔴TWITCH → https://bit.ly/3iSmkcq📷INSTAGRAM → https://bit.ly/38KFjRA 🐦TWITTER → https://bit.ly/2Oi0YHC👕NEW MERCH → https://bit.ly/2AThH0O🎥2ND CHANNEL → https://bit.ly/38Kb6SQ 😀DISCORD → https://bit.ly/2ZXonUcMUSIC → https://bit.ly/3edT2Sc (Kevin MacLeod)→ https://bit.ly/3kdvbVY (Epidemic) OUTRO → https://bit.ly/2DoKefpMODPACK → https://bit.ly/2BQWQM9EDITOR → praduhEMAIL→ nicholas@socksfor1.comFamily Friendly PG Clean 13+","This is my second channel more focused on VR GAMING! All the best virtual reality moments!Editor for others with over 100 million plus views including Samsung USReddit, Twitch, Tiktok, Youtube partner500k subs 11/25/20Instagram https://www.instagram.com/socksfor1/Twitter https://twitter.com/Socksfor1Twitch https://www.twitch.tv/socksfor1","VR Family Family Friendly VR Gaming Oculus Socksfor1 Socksfor2 Virtual Reality Mully Joshdub Eddievr","7Jbtl9JTOHQ"
K8lF_6cZ6uA,"among us but the IMPOSTOR IS A GOD","UCsEgeyBfOnGGBpjIvkDJbWg","Socksfor1","20","708.0","https://i.ytimg.com/vi/K8lF_6cZ6uA/default.jpg","Socksfor1|among us|among us mods|among us terminator mod|among us but the impostor is a god|among us but the impostor can teleport anywhere|among us but you go invisible|among us but you can shape shift into anyone|among us but the impostor can freeze time|among us but you can drag bodies","today we play among us but we gave the impostor all the abilities, (terminator) teleport, invisiblity, shapeshift, time  stop, drag among us modsPrevious Video →https://www.youtube.com/watch?v=NHGhV2U5hzE#amongus#ModFriends (sub to them) Fatmemegod- https://bit.ly/33oDf0GBlaza-https://bit.ly/3cWCMGjJuice- https://bit.ly/3oga4ENNadwe- https://bit.ly/3mmpJ4O⛏️JOIN SERVER → socks.gg use code Socksfor1 in the item shop ad😀TIKTOK→ https://bit.ly/2UynFdt👽REDDIT → https://bit.ly/3ejZBmf🔴TWITCH → https://bit.ly/3iSmkcq📷INSTAGRAM → https://bit.ly/38KFjRA 🐦TWITTER → https://bit.ly/2Oi0YHC👕NEW MERCH → https://bit.ly/2AThH0O🎥2ND CHANNEL → https://bit.ly/38Kb6SQ 😀DISCORD → https://bit.ly/2ZXonUcMUSIC → https://bit.ly/3edT2Sc (Kevin MacLeod)→ https://bit.ly/3kdvbVY (Epidemic) OUTRO → https://bit.ly/2DoKefpMODPACK → EDITOR → praduhEMAIL→ nicholas@socksfor1.comFamily Friendly PG Clean 13+","I do it all! Editor for others with over 100 million plus views including Samsung USReddit, Twitch, Tiktok, Youtube partnerInstagram https://www.instagram.com/socksfor1/Twitter https://twitter.com/Socksfor1Twitch https://www.twitch.tv/socksfor1#1 trending - 10/29/201000 Subs- 2/16/182000 Subs- 7/7/183000 Subs-10/9/185000 Subs-11/22/1810000 Subs-12/10/1825000 Subs-12/27/1850000 Subs 3/13/19100000 Subs 4/25/19500000 Subs 10/31/191000000 Subs 2/25/202000000 Subs 10/21/203000000 Subs 1/1/21","Sockfor1 Fortnite Minecraft Family Friendly 13+ VR Virtual Reality Dank Memes Dank","7Jbtl9JTOHQ"
Ifht2PDQyzc,"among us but SANTA IS THE IMPOSTOR (op mods)","UCsEgeyBfOnGGBpjIvkDJbWg","Socksfor1","20","652.0","https://i.ytimg.com/vi/Ifht2PDQyzc/default.jpg","Socksfor1|among us|among us mods|among us new map|among us new gamemode|among us santa mode|among us socksfor1 mods|among us new role|among us impostor|among us update|among us terminator|among us but the impostor can drag bodies","today we play the new santa mode as an impostor play these gamemodes at skeld.net follow instagram  https://bit.ly/38KFjRA Previous Video →https://www.youtube.com/watch?v=3PHx7P3LhhA#amongus#ModFriends (sub to them) Fatmemegod- https://bit.ly/33oDf0GBlaza-https://bit.ly/3cWCMGjJuice- https://bit.ly/3oga4ENNadwe- https://bit.ly/3mmpJ4O⛏️JOIN SERVER → socks.gg use code Socksfor1 in the item shop ad😀TIKTOK→ https://bit.ly/2UynFdt👽REDDIT → https://bit.ly/3ejZBmf🔴TWITCH → https://bit.ly/3iSmkcq📷INSTAGRAM → https://bit.ly/38KFjRA 🐦TWITTER → https://bit.ly/2Oi0YHC👕NEW MERCH → https://bit.ly/2AThH0O🎥2ND CHANNEL → https://bit.ly/38Kb6SQ 😀DISCORD → https://bit.ly/2ZXonUcMUSIC → https://bit.ly/3edT2Sc (Kevin MacLeod)→ https://bit.ly/3kdvbVY (Epidemic) OUTRO → https://bit.ly/2DoKefpMODPACK → EDITOR → praduhEMAIL→ nicholas@socksfor1.comFamily Friendly PG Clean 13+","I do it all! Editor for others with over 100 million plus views including Samsung USReddit, Twitch, Tiktok, Youtube partnerInstagram https://www.instagram.com/socksfor1/Twitter https://twitter.com/Socksfor1Twitch https://www.twitch.tv/socksfor1#1 trending - 10/29/201000 Subs- 2/16/182000 Subs- 7/7/183000 Subs-10/9/185000 Subs-11/22/1810000 Subs-12/10/1825000 Subs-12/27/1850000 Subs 3/13/19100000 Subs 4/25/19500000 Subs 10/31/191000000 Subs 2/25/202000000 Subs 10/21/203000000 Subs 1/1/21","Sockfor1 Fortnite Minecraft Family Friendly 13+ VR Virtual Reality Dank Memes Dank","7Jbtl9JTOHQ"
y27-Cd9T_CI,"among us but the IMPOSTOR HAS A GUN (mods)","UCsEgeyBfOnGGBpjIvkDJbWg","Socksfor1","20","689.0","https://i.ytimg.com/vi/y27-Cd9T_CI/default.jpg","Socksfor1|among us|among us mods|among us but the impostor has a gun|among us but|among us mod|among us imposter|among us impostor|among us funny moments|among us gameplay|among us modded|among us update|among us but the impostor can drag bodies (mods)|modded among us|among us meme|among us troll|among us but the imposter|among us but the impostor is a god|among us but the impostors don't know each other|among us new doctor role|among us new","today we play among us but the impostor as an actual gun Follow my Twitter - @Socksfor1Follow my Instagram - @Socksfor1Edited By- PraduhFriends in video @Blaza Plays @Laff @Joocie @FatMemeGod @Nadwe @TbhHonest #amongus#amongusmodstoday I play among us with my friends such as blazaplays and fatmemegod! however, we have downloaded an among us mod that gives the impostor a GUN! This results in some hilarious among us plays and crazy impostor IQ.","I do it all! Editor for others with over 100 million plus views including Samsung USReddit, Twitch, Tiktok, Youtube partnerInstagram https://www.instagram.com/socksfor1/Twitter https://twitter.com/Socksfor1Twitch https://www.twitch.tv/socksfor1#1 trending - 10/29/201000 Subs- 2/16/182000 Subs- 7/7/183000 Subs-10/9/185000 Subs-11/22/1810000 Subs-12/10/1825000 Subs-12/27/1850000 Subs 3/13/19100000 Subs 4/25/19500000 Subs 10/31/191000000 Subs 2/25/202000000 Subs 10/21/203000000 Subs 1/1/21","Sockfor1 Fortnite Minecraft Family Friendly 13+ VR Virtual Reality Dank Memes Dank","7Jbtl9JTOHQ"
Lg4mybK1Z4M,"TROLLING Crewmates WITH TSUNAMI MOD (Among Us)","UCke6I9N4KfC968-yRcd5YRg","SSundee","20","877.0","https://i.ytimg.com/vi/Lg4mybK1Z4M/default.jpg","ssundee|ssundee among us|among us|sunday|among us ssundee|ssunde|among us mods","We give IMPOSTERS a TSUNAMI Ability in Among Us🔔 Subscribe & click the bell!  https://www.youtube.com/user/SSundee?sub_confirmation=1👍 Hit the Thumbs Up if you liked this video! 🤖 My Friends! 🤖@Nicovald @Sigils @Biffle @Henwy @Ambrew @Karangutan @LoafX @JeromeASF King: https://www.youtube.com/channel/UCDfsrt1zmPXzr19Whit_K7QMod Maker: https://www.youtube.com/channel/UC6LVV8fbaEqMh9tw3I8GQOw❗️ Follow Me! ❗️Twitter: https://www.twitter.com/SSundeeDiscord: https://discord.gg/SSundeeInstagram: https://instagram.com/ssundeeytFacebook:  https://www.facebook.com/pages/SSundee/200010033358843👨🏻‍🍳 Awesome Video Editor ► Russellhttps://www.youtube.com/russelledits👨🏼‍🎨 Awesome Thumbnail Maker ► Flashhttps://www.youtube.com/channel/UCLy01oVLarj7RNQm52jnGKw🎨 Awesome Animator ► Davidhttps://www.youtube.com/channel/UCxSSIQevKsx2bFc_Gn4WAMg?view_as=subscriber🎶 Music by Ninety9 ► LivesTobu - Such FunVideo Link: https://www.youtube.com/watch?v=d3Oc26AFDdUChannel: https://99l.tv/SubscribeDownload the album! https://99l.tv/Levelup-iThanks for watching!","Welcome to my channel!  I upload a lot of funny Minecraft and Fortnite Videos! I also upload random games. lol I yell a lot.I also play random games from time to time.-SSundee","SSundee Fortnite Fortnite Minigames Fortnite Creative Fortnite Battle Royale Fortnite Game Modes Minecraft Hardcore Minecraft","7Jbtl9JTOHQ"
