video_id,title,channelId,channelTitle,categoryId,duration,thumbnail_link,tags,description,channel_desc,channel_keywords,related_vid_id
CtAAY_cwnrE,"CallMeCarson Serious Allegations! #DramaAlert ( Lunch Club INTERVIEW )","UC11PvrGPzo6Y7Zc6-e9cAKg","DramaAlert","25","710.0","https://i.ytimg.com/vi/CtAAY_cwnrE/default.jpg","CallMeCarson|call me carson drama|callmecarson crying|call me carson|callmecarson felony|callmecarson drama|callmecarson lunch club|lunch club","► Follow for News! - https://twitter.com/KEEMSTAR► Follow IG - https://www.instagram.com/DramaAlert/► DramaAlert on Snapchat https://www.snapchat.com/discover/DramaAlert/9014656799► KEEMSTAR MERCH https://keemstar.com/products/completely-original-colorblock-design► Moms Basement https://open.spotify.com/show/3W8pwzlQAsAeOBrgZeReqJ► KEEM PARK https://KeemPark.com","Welcome to DramaAlert! Your #1 source for news on the social interactions in online entertainment!Please do not email us any news, tips or stories! Tweet or DM on Twitter - @DramaAlertDM","#DramaAlert DramaAlert Drama Alert New Drama Alert NewDramaAlert Keemstar Killer Keemstar KillerKEEMSTAR KEEM YouTube Drama drama tea drama channel youtube boxing","_WfGgl9Q1JQ"
5lEQcSsDPjY,"Mini Ladd Apologizes for Grooming and it goes Horribly","UCudN1h6nk_BVhbH4iLpdjXw","AugieRFC","24","1083.0","https://i.ytimg.com/vi/5lEQcSsDPjY/default.jpg","Mini Ladd|Miniladd|miniladd exposed|miniladd apology|miniladd drops apology|miniladd's disturbing apology|mini ladd exposed|mini ladd vanoss fight|Mini Ladd terroriser|Mini Ladd Downfall|Mini Ladd Prison mate luke|mini ladd diesel patches|vanoss gaming crew|where are they now?|a brief history|documentary|youtube documentary|Biography|entertainment|education|joon the king|fredrik knudsen|down the rabbit hole|sunnyv2|sunnyv2 downfall|rise and fall","TWITTER | https://twitter.com/augierfcPODCAST | https://open.spotify.com/show/1AB0OLv0SjcILDelEPMByGSTREAM VODS | https://youtube.com/RFCMediaYTDONATE | https://paypal.me/AugieRFCDLIVE | https://dlive.tv/augierfc#MiniLadd","AugieRFC... on YouTUBE!","","_WfGgl9Q1JQ"
xeSBHwqPEVs,"Codemiko BAN Response | Destiny on Kaceytron | xQc Hits Back at Claims","UCnwp0iOA4LjPhubDdPXsHWQ","StreamerTV","25","611.0","https://i.ytimg.com/vi/xeSBHwqPEVs/default.jpg","streamertv|codemiko|codemiko ban response|destiny|destiny on kaceytron|xqc|xqc hits back at claims|codemiko twitch|destiny twitch|xqc twitch","Twitch News & Highlight moments be sure to Subscribe & turn notifications on to catch up to the best clips of the day.In this video, I cover & Speak about Twitch news. I add my own Commentary/Chat replays/Information. I also have Permission from twitch streamers to be featured in my videos.▬▬▬▬▬▬▬▬▬▬▬▬▬▬▬▬▬▬▬▬▬▬▬▬▬▬▬▬▬▶Twitch list Credits:twitch.tv/Amouranthtwitch.tv/codemikotwitch.tv/cyrtwitch.tv/Destinytwitch.tv/erobb221twitch.tv/forsentwitch.tv/fuslietwitch.tv/Jinnyttytwitch.tv/JonZherkatwitch.tv/LIRIKtwitch.tv/loltyler1twitch.tv/Mayatwitch.tv/Sweet_Anitatwitch.tv/TaliaMartwitch.tv/Trainwreckstvtwitch.tv/xqcowStreamerTv: Join DISCORD - INSTAGRAMDiscord: https://discord.gg/FmGWxmQInstagram: https://www.instagram.com/streamer.tv/ 🌎 Patreon Channel Supporthttps://www.patreon.com/StreamerTv -Get your name featured & Early Access to New Content!🌎Patreons Playa0789 - Mazuski - Storeyyyyy - Noelle R▬▬▬▬▬▬▬▬▬▬▬▬▬▬▬▬▬▬▬▬▬▬▬▬▬▬▬▬▬🌎Self Submit - Permission Form: https://goo.gl/forms/Uk0RHF1Sua0df1Ub2▬▬▬▬▬▬▬▬▬▬▬▬▬▬▬▬▬▬▬▬▬▬▬▬▬▬▬▬▬▶Contact Or Follow :Twitter: @NevFailsTV - Extra Info[Music Tune Seeker] - SAD OLD SCHOOL STORYTELLING HIP HOP BEAT - Waithttp://soundcloud.com/tuneseekerhttp://youtube.com/tuneseekerstudio[ I have Permission from Owner to use for background Music ]RoyaltyFreeTube - Outrun Grid Animation loop 11 - Creative CommonsChannel: https://www.youtube.com/channel/UCDyoFl3axaufRwkpBA38-1wFootage license: https://creativecommons.org/licenses/by/4.0/--I have permission from Josh A to use his music for my outros--[ Music ]: Josh A - (Ft. MrTLexify) https://open.spotify.com/artist/2rWCIhENZyPVDAeFC0ESWN?si=Bh01NkwDQCOLFFaJxUqXFwhttps://twitter.com/OfficialJoshAhttps://www.youtube.com/user/JoshChaceHD","Twitch StreamerTV Subscribe for the Best Moments On Twitch, Mixer▬▬▬▬▬▬▬▬▬▬▬▬▬▬▬▬▬▬▬▬▬▬▬▬▬In my videos, I cover & Speak about Twitch/Mixer or YouTube Live News. I add my own Commentary/Chat replays/Information. I also have Permission from 500+ twitch streamers to be featured in my videos.I'm also dyslexic & I use Sources like Dexerto, Lsf Reddit, Twitter to help peace my videos. I apologize if I misread wordsCredit: https://www.dexerto.com - https://www.reddit.com/r/Live▬▬▬▬▬▬▬▬▬▬▬▬▬▬▬▬▬▬▬▬▬▬▬▬▬If you like to be featured in one of my videos & you have a funny clip DM me on Twitter or Contact via email.SUBMIT CLIPS: https://goo.gl/forms/D6DluTFT6eipR3gH3 - Permission FormPlease don't send any hate/harass any twitch streamer that featured in my videos. This is justfor entertainment. If any (Permission) streamer is unhappy with any clip pls email or DM on twitter & ill Fix/Remove the clip. ▬▬▬▬▬▬▬▬▬▬▬▬▬▬▬▬▬▬▬▬▬▬▬▬▬[Contact] :https://twitter.com/NevFailsTV DM me","StreamerTV twitch news Twitch CEO Twitch analytics live streaming twitch IRL twitch.tv how to grow on twitch twitch highlights","_WfGgl9Q1JQ"
qsi0jEwf3qQ,"I Survived Hardcore Modded Minecraft For 800 Days using the largest modpack possible","UCsEgeyBfOnGGBpjIvkDJbWg","Socksfor1","20","1516.0","https://i.ytimg.com/vi/qsi0jEwf3qQ/default.jpg","Socksfor1|minecraft harcore|i survied hardcore modded minecraft for 800 days using the largest modpack possible|100 day minecraft hardcore modded|modded minecraft|minecraft but i downloaded every single mod|minecraft modded lets play|minecraft modded ep 7|minecraft modded ep 8|minecraft 100 days|100 days hardcore|minecraft with every single mod|socksfor1 modded minecraft|socksfor1 mods|socksfor1 modpack|minecraft hardcore|hardcore mode|100 days","I Survived Hardcore Modded Minecraft For 800 Days using the largest modpack possible100 DAY HARDCORE SERIES►https://www.youtube.com/playlist?list=PLdZm-L5qiaH-_peoKvJjeyT5YqhcLf6rlLukethenotable►https://www.youtube.com/user/CreolesbackfireLAST VIDEO►https://www.youtube.com/watch?v=172CbB5HsOQMERCH► https://teespring.com/stores/socksfor1-merchDownload Modpack►https://www.technicpack.net/modpack/ericks-insane-adventure-pack.1186950SOCKSFOR2► https://www.youtube.com/channel/UC-XTuGOHIF7vWvbhJZ56wbwTWITTER► https://www.twitter.com/Socksfor1 TIKTOK► http://vm.tiktok.com/dQ5p6m/TWITCH► https://www.twitch.tv/socksfor1DISCORD ► https://discord.gg/AUxGJkUINSTAGRAM ►https://www.instagram.com/socksfor1/GET YOUR OWN MINECRAFT SERVER (APEX PRO HOSTING) ►https://billing.apexminecrafthosting.com/aff.php?aff=2199MUSIC►Kevin MacLeod (https://www.youtube.com/user/kmmusic)outro song► https://www.youtube.com/user/GabzitoHDediting help►praduh #Minecraft#ModEMAIL► nicholas@socksfor1.comThis video is intended for 13+ year olds because of game violence and advanced humor","I do it all! Editor for others with over 100 million plus views including Samsung USReddit, Twitch, Tiktok, Youtube partnerInstagram https://www.instagram.com/socksfor1/Twitter https://twitter.com/Socksfor1Twitch https://www.twitch.tv/socksfor1#1 trending - 10/29/201000 Subs- 2/16/182000 Subs- 7/7/183000 Subs-10/9/185000 Subs-11/22/1810000 Subs-12/10/1825000 Subs-12/27/1850000 Subs 3/13/19100000 Subs 4/25/19500000 Subs 10/31/191000000 Subs 2/25/202000000 Subs 10/21/203000000 Subs 1/1/21","Sockfor1 Fortnite Minecraft Family Friendly 13+ VR Virtual Reality Dank Memes Dank","_WfGgl9Q1JQ"
SRc_-V_LsQw,"Trump's last-minute pardons include Steve Bannon, Lil Wayne and scores of others","UCupvZG-5ko_eiXAupbDfxWw","CNN","25","526.0","https://i.ytimg.com/vi/SRc_-V_LsQw/default.jpg","latest News|Happening Now|CNN|President Trump|Chris Cuomo|Presidential pardons|Politics|Lil Wayne|Steve Bannon","President Donald Trump issued a raft of 11th-hour pardons and commutations early Wednesday that included his onetime political strategist, a former top fundraiser and two well-known rappers.#CNN #News","CNN operates as a division of Turner Broadcasting System, which is a subsidiary of Warner Media. CNN identifies itself as -- and is widely known to be - the most trusted source for news and information. The CNN umbrella includes nine cable and satellite television networks, two radio networks, the CNN Digital Network, which is the top network of news Web sites in the United States, and CNN Newsource, the world's most extensively syndicated news service. CNN is proud of our ability to bring you up-to-the-minute news from around the world, as a result of our many extensions.","CNN CNN News news breaking news","_WfGgl9Q1JQ"
zISrY77s9Xo,"Minx fails at hunting Swaggers and dies (EpicSMP)","UC3EhX-gV3yvlTFd6dAjBW-A","SlashClaw","20","121.0","https://i.ytimg.com/vi/zISrY77s9Xo/default.jpg","clips|clip|compilation|moments|moment|youtube|youtubers|reaction|twitch|twitch clips|twitch lyfe|popular clips|popular|most popular|top clips|top|top 10|best|smp|highlights|highlight|react|minecraft stream|minecraft lets play|epicsmp|epic smp|epic smp clips|jschlatt|schlatt|minx|justaminx|shorts|tiktok|challenge","Minx fails at hunting Swaggers and dies (EpicSMP)---#epicsmp #minecraftepicsmp #clipEpicSMP MembersAlsoJakob: https://www.youtube.com/channel/UCfy3X5ROoWyP2lUcXBbEzzwbbno$: https://www.youtube.com/c/bbnomoneyCaleb Pitts: https://twitter.com/BraingetterCaptainSparklez : https://www.youtube.com/user/CaptainSparklezCrankGameplays: https://www.youtube.com/channel/UC2S7CGceq5tsuhcVyACdA3gcritchy: https://twitter.com/chrissytiberDolan Dark: https://www.youtube.com/user/BlackIceShredderEddy Burback: https://www.youtube.com/user/ZADstudiosEgoraptor: https://www.youtube.com/user/egoraptorF1NN5TER: https://www.youtube.com/c/F1NN5TERFitz: https://www.youtube.com/channel/UCtb8P4rf_1n8KS8eZk_lNNwFreddie Dredd: https://www.youtube.com/channel/UC2l38bev0xgHr65Tz4jZ32wGus Johnson: https://www.youtube.com/user/gustoonzjacksfilms: https://www.youtube.com/user/jacksfilmsJackson Tucker: https://www.youtube.com/user/JacksonATuckerJaiden Animations: https://www.youtube.com/channel/UCGwu0nbY2wSkW8N-cghnLpAJusta Minx: https://www.youtube.com/channel/UCLKqE_2ypspRF7_z4bTmLBQKarl: https://www.youtube.com/channel/UCrYrcFGGs_nke1MggS8JvqgKrinios: https://www.youtube.com/user/ComplexSkizzleSuperMega: https://www.youtube.com/channel/UCPPc2PdtA7gCMbjYp_i_TKAmaxmoefoe: https://www.youtube.com/user/maxmoefoeMeatCanyon: https://www.youtube.com/channel/UC91V6D3nkhP89wUb9f_h17gmeowriza: https://www.twitch.tv/meowrizamichaelmcchill: https://www.twitch.tv/michaelmcchillModestCube: https://www.youtube.com/user/ModestCubeQuackity https://www.youtube.com/user/QuackityHQRubberRoss https://www.youtube.com/user/RubberRossjschlattLIVE: https://www.youtube.com/channel/UC2mP7il3YV7TxM_3m6U0bwAselma: https://www.youtube.com/c/selmasSlimecicle: https://www.youtube.com/user/SlimecicleSwaggerSouls: https://www.youtube.com/channel/UCMdGPato0IC5-zZjJIf-P9wTed Nivison: https://www.youtube.com/user/JehBerDehtraves: https://www.youtube.com/channel/UCQpEJkoeMoF4zTSEEFWhvFQtwomad 360: https://www.youtube.com/channel/UCGGdOIkVIZipux13jt7rprwWeston Koury: https://www.youtube.com/channel/UC_1quVNvjrJTak053aB9E6AWilliam Osman : https://www.youtube.com/channel/UCfMJ2MchTSW2kWaT0kK94Yw","i post Epic SMP clipsI do not take credit for the stream highlights I post, all credit goes to the content creators","tommyinnit tubbo wilbursoot justminx minx technoblade clips","_WfGgl9Q1JQ"
noH-ACywhMQ,"Mini Ladd's Apology In A Nutshell","UCeRjIpQ9koLZxfRnPa1z6Sg","Pancho","20","107.0","https://i.ytimg.com/vi/noH-ACywhMQ/default.jpg","pancho|mini ladd|mini ladd aplogy|mini ladd exposed|miniladd apology|apology|in a nutshell","Mini Ladd, you are one of the worst people to roam this platform, your apology was absolutely terrible.#MiniLaddPlaces You Can Find Me:🐦Twitter: https://tinyurl.com/TwitterPancho📸 Instagram: https://tinyurl.com/InstagramPancho👾 Discord: https://discordapp.com/invite/VTfHC3C👻 Snapchat: @pancho.witt👊 Subscribe: https://tinyurl.com/SubscribePancho🎮 Steam: https://steamcommunity.com/id/panchosdeath📩 Business Contact: panchoyt01@gmail.com🎧 Music: https://soundcloud.com/shunimusic/trapped-feat-koeze-saintgenius","hi, im pancho","Pancho PanchoIsBored panchoisbored pancho","_WfGgl9Q1JQ"
-3sgrkoElbs,"tommyinnit likes boy-","UCkHja3RPRoq3e_YNp1IEyEA","theuserunnamed","20","11.0","https://i.ytimg.com/vi/-3sgrkoElbs/default.jpg","minecraft|funny moments|livestream funny moments|dream|dreamwastaken|dream minecraft|george|georgenotfound|sapnap|tommy|tommyinnit|badboyhalo|tubbo|quackity|dreamsmp","via https://www.twitch.tv/tubbomy twitter https://twitter.com/theuserunnamed","minecraft!!!","","_WfGgl9Q1JQ"
_B2dKbGJ78s,"5 More Minecraft FACTS You Need To Know","UCO7XVLiv_5iVIaxAsnEIiLA","Block Facts","20","25.0","https://i.ytimg.com/vi/_B2dKbGJ78s/default.jpg","minecraft facts you didn't know|minecraft|minecraft things you didn't know|things you didn't know about minecraft|minecraft facts|block facts|5 More Minecraft FACTS You Need To Know|5 minecraft facts|5 new minecraft facts|Enchanting Table facts|Obsidian facts|minecraft cave air|minecraft void air|minecraft smiling creeper|minecraft iron golem|Minecraft Java Edition update|minecraft april fools 2013|minecraft height limit|minecraft deadmau5|end portal|wither","Did you know these Minecraft facts about End Portals, Enchanting Table facts, Obsidian facts? Or the Iron Golems, Minecraft Cave Air and Minecraft Creeper facts?25 seconds of FACTS!Now you know the truth about Minecraft Ender Portal's history, Minecraft's Obsidian, and the Minecraft Void Air that is found above the Minecraft height limit. Did you know any of these facts? Did you know about the Pink Wither from the 2013 April Fools Smiling Creeper Minecraft Java Edition update *(also known as the Minecraft Love and Hugs Update)? We also look at the Minecraft New Nintendo 3DS Edition version differences too!#shorts #minecraft #minecraftfacts","Explaining everything Minecraft, one block at a time.","minecraft facts blockbro","_WfGgl9Q1JQ"
Gc4SGZGFOfQ,"The Crew 2: The Hunt Launch Trailer | Ubisoft [NA]","UCBMvc6jvuTxH6TNo9ThpYjg","Ubisoft North America","20","70.0","https://i.ytimg.com/vi/Gc4SGZGFOfQ/default.jpg","The Crew 2|The Crew|Ubisoft|Ubisoft The Crew|Ubisoft Crew|Ubisoft The Crew 2|Ubisoft TC2|Motorsports|Motornation|Motorsport|Driving|Open World|Car|Bike|Ride|Boat|Plane|vehicles|Pilot|Driver|Crew|TC1|TC2|Racing|Racing Game|Driving Game|Title Update|TC2 Anniversary|Live Summit|Post-launch|Live|Motorflix|Title Update 8|TU8|Motorpass|Motorpass Trailer|The Hunt|the crew 2 the Hunt|the crew the hunt|tc2 the hunt|motorflix|the crew motorflix|tc2 motorflix","The Chase was just the beginning...ready for the Hunt? Episode 2 of Season 1 arrives January 20 and sets the stage for new vehicles and customization options with 50 tiers of Motorpass. Rev into action and take on the masked thieves as Motorflix goes off-road.The Crew 2 is available on Xbox One, Xbox One X, PlayStation 4, and PC. The Crew 2 is also available on UPLAY+,* Ubisoft’s subscription service.#TheCrew2 #TheCrewPlease SUBSCRIBE: http://bit.ly/UbisoftYouTubeChannel http://thecrewgame.comhttps://www.facebook.com/thecrewgame.usa https://www.instagram.com/thecrewgamehttps://twitter.com/thecrewgamehttp://www.youtube.com/UbisoftNADiscover all our The Crew products and exclusive items on the Ubisoft Store: https://ubi.li/4HWTKFEATURESEACH WEEK TURNS INTO A CELEBRATION IN MOTORNATIONThe LIVE Summit is a weekly PvE competition, introduced in Hot Shots, in which players take on nine activities selected from among the game’s wide range of playgrounds and disciplines.With Blazing Shots, the competition intensifies with new, unique Summit themes. Only one objective motivates our champions: getting as high up on the final leaderboard as possible. At the end of the week, players will be rewarded with exclusive items based on their ranking.Once a month, challengers will have the opportunity to take part in a Premium LIVE Summit that will reward the best competitors with a unique, special edition vehicle.Moreover, we will be surprising our players with regular themed weeks, stylizing our live content accordingly to offer dedicated LIVE Summits and events and exclusive rewards.COLLECT TWELVE NEW VEHICLESBlazing Shots will introduce a total of twelve new vehicles, available for all players to earn or purchase through in-game credits as they’re rolled out at day one or during the following months. The update will include some of the most iconic cars ever created, such as Bugatti Veyron 16.4 Grand Sport Vitesse (Hypercar) and the Mazda RX-8 (Street Race).This collection of brand-new dream cars also includes the third edition of the Elite Bundle, featuring the Porsche Carrera GT (Hypercar), the Citroen GT (Hypercar), and the Ferrari 599XX EVO (Touring Car).NEW WAYS TO CUSTOMIZE YOUR RIDESBlazing Shots will blast open your customization possibilities with a brand-new major vanity category: Underglows. Use them to create the vehicle that truly defines you as a motorsports champion, and be ready to light up the night.In addition to this new vanity category, 78 new vanities items will also be added through the update with new smokes and tires.COMPETE IN 17 NEW ACTIVITIES ALL ACROSS THE USAEach week, the LIVE Summit will include a brand-new event. This unique challenge will join the pool of PvE events all across the US, representing 17 new events over 17 weeks of activity.ABOUT UBISOFT:Ubisoft is a creator of worlds, committed to enriching players' lives with original and memorable gaming experiences. Our rich portfolio of world-renowned brands includes: Assassin’s Creed, Far Cry, For Honor, Just Dance, Watch Dogs, Tom Clancy’s video game series including Ghost Recon, Rainbow Six and The Division.  We are dedicated to delivering original and memorable gaming experiences across all popular platforms, including consoles, mobile phones, tablets and PCs. To learn more, please visit www.ubisoft.com. © 2020 Ubisoft Entertainment. All Rights Reserved. Ubisoft, and the Ubisoft logo are registered or unregistered trademarks of Ubisoft Entertainment in the US and/or other countries.The Crew 2: The Hunt Launch Trailer | Ubisoft [NA]http://www.youtube.com/UbisoftNA","Welcome to the Ubisoft North America YouTube Channel! Subscribe and be the first to see new videos from anticipated Ubisoft titles and our recent releases. Here you can see great content highlighting Assassin's Creed, Tom Clancy’s Rainbow Six Siege, For Honor, Tom Clancy's Ghost Recon Wildlands, Steep, Star Trek Bridge Crew, Tom Clancy’s The Division, Watch Dogs 2, South Park: The Fractured But Whole, Eagle Flight, Werewolves Within and many more!We've got interviews with Ubisoft's dev teams, the latest news and features from Ubiblog, and in-depth profiles on our titles & studios from the Community Development team.  Like us on FACEBOOK to be updated on what we're doing next: http://www.facebook.com/ubisoftFollow us on TWITTER to stalk our every move: http://www.twitter.com/ubisoftCheck out our website to dig deep into all things UBISOFT: http://www.ubisoft.com/Read about our official video policy here:  https://www.ubisoft.com/en-US/videopolicy.html","Ubisoft Ubisoft US Ubisoft Channel Ubisoft Gameplay Video Games Gaming Video Game Ubisoft Games","_WfGgl9Q1JQ"
T6Uc8zKwA6Y,"THREW MY IMPOSTER BUDDY UNDER THE BUS...and Ran Him Over! (Among Us w/ Friends)","UCpmu4uEZ8XcPjHdHh7_zFOg","ChilledChaosGAME","20","3088.0","https://i.ytimg.com/vi/T6Uc8zKwA6Y/default.jpg","ChilledChaos|ChilledChaosGame|Chilled|CriousGamers|objection|among us|social deception|unfortunate spacemen|multiplayer|survival|voting|funny|funny moments|cant trust chilled|betrayal|space|gameplay|town of salem|tos|Among|us|among us gameplay|among us imposters|imposter|win|disguised toast","It was suppose to be a gentle push. Just a little light suspicion. I didnt know they were vote crazy!STREAMS! - http://www.twitch.tv/Chilledchaos (Live with Among Us!)-------------------------------------------------------------------------------------------------------What is Among us?As you attempt to prepare your spaceship for departure, but beware as one or more random players among the Crew are Impostors bent on killing everyone! When a body is discovered you call a vote to decide who killed them! You can also call an emergency vote if you are suspicious. But becareful...it may lead to you getting sent out the air lock! -------------------------------------------------------------------------------------------------------If you want non livestream content subscribe to my main Youtube channelhttps://www.youtube.com/user/CriousGamersWant updates in case YouTube or Twitch breaks, follow me on twitter. I tweet about my life, my dogs, my lego addiction and more!Twitter! - http://www.twitter.com/ChilledChaosJoin our Discord to chat with me and other community members!Discord - https://discord.gg/ChilledChaos-------------------------------------------------------------------------------------------------------","Welcome to ChilledChaosGame! A channel that is going to be your hub for all your uncut, barebones, gameplay footage. A lot of people asked for videos without edits, well, now they have a place to go! The uploads that will be happening on this channel are directly brought to you by my twitch channel and organized into one solid place!CLICK HERE! - http://www.twitch.tv/chilledchaosIf you are looking for my MAIN CHANNEL with edited content you can head over to CriousGamers:https://www.youtube.com/user/CriousGamers","Chilled ChilledChaos ChilledChaosGAME chilledchaosgame ChillyWillyGames","_WfGgl9Q1JQ"
joPunL5LR_s,"roblox made EVERYONE happy...","UCpzpXXRkho1BfO7KUENJdNA","KonekoKitten","20","313.0","https://i.ytimg.com/vi/joPunL5LR_s/default.jpg","roblox|funny|moments|funny moments|roblox funny moments|funny moments roblox|happy roblox|roblox made everyone happy|roblox happy|roblox update|new roblox update|roblox happy update|roblox made people happy|roblox made EVERYONE happy...|roblox new update|roblox gameplay|roblox let's play|roblox commentary|roblox discussion|konekokitten|konekokitten roblox","buy my roblox merch!!! https://www.roblox.com/groups/4332797/KonekoKittens-Official-Fan-Club#!/storesub pls: https://bit.ly/2EtEIY7roblox made EVERYONE happy...my insta: https://www.instagram.com/konekokittenirlroblox made EVERYONE happy...join my discord: https://discord.gg/KonekoKitten► twitter: https://twitter.com/KonekoKittenYT/► roblox made EVERYONE happy...What is Roblox? ROBLOX is an online virtual playground and workshop, where kids of all ages can safely interact, create, have fun, and learn. It’s unique in that practically everything on ROBLOX is designed and constructed by members of the community. ROBLOX is designed for 13 to 18 year olds, but it is open to people of all ages. Each player starts by choosing an avatar and giving it an identity. They can then explore ROBLOX — interacting with others by chatting, playing games, or collaborating on creative projects. Each player is also given their own piece of undeveloped real estate along with a virtual toolbox with which to design and build anything — be it a navigable skyscraper, a working helicopter, a giant pinball machine, a multiplayer “Capture the Flag” game or some other, yet-to-be-dreamed-up creation. There is no cost for this first plot of virtual land. By participating and by building cool stuff, ROBLOX members can earn specialty badges as well as ROBLOX dollars (“Robux”). In turn, they can shop the online catalog to purchase avatar clothing and accessories as well as premium building materials, interactive components, and working mechanisms.In this video, I play roblox and talk about roblox removing a feature on roblox recently in the next day or so that is pretty useless and it made everyone happy that won't really make anyone upset at all to be completely honest lolThe content uploaded to this channel is intended for 13+ audiences.since you actually read these, here's a secret. i sleep with socks on#roblox","Daily ROBLOX gaming videos with Koneko. Other games are played sometimes, but it's usually ROBLOX. You can call me Koneko (ko-neck-oh, it's much easier than it looks)We mostly do either commentaries/stories/gameplays on this channel of just random things going on in the roblox community.BUSINESS ONLY: konekokittenbusiness@gmail.com [run by my manager, not by me]WE DO NOT ACCEPT ENDORSEMENTS/PROMOTIONS FOR FREE ROBUX/REWARDS WEBSITES. EMAILS INQUIRING THIS WILL BE BLOCKED ON SIGHT, NO EXCEPTIONS","konekokitten gaming game roblox male games gamer gameplay pg kid friendly family","_WfGgl9Q1JQ"
cU2BaLO4OPE,"MINI LADD apology is not too bad and is not too good","UCitlsuMfYAQcnAOLBvvHtWA","Reckerzsolo","20","518.0","https://i.ytimg.com/vi/cU2BaLO4OPE/default.jpg","[none]","i edit a littile bit of the important stuff to avoid miss infocheck the apology:https://www.youtube.com/watch?v=_WfGgl9Q1JQ#miniladd  #apology","Welcome to Reckerz variety channel.               upload scheduel coming soon.","","_WfGgl9Q1JQ"
