video_id,title,channelId,channelTitle,categoryId,duration,thumbnail_link,tags,description,channel_desc,channel_keywords,related_vid_id
ATiOLdsINDs,"Three Maxed Accounts Literally Try to Lure me On Vid","UCl7FxeciaU48G-K6oIRH0xg","KempQ","20","776.0","https://i.ytimg.com/vi/ATiOLdsINDs/default.jpg","runescape|osrs|oldschool runescape|kempq|mmorpg|mmo|game|family friendly|runescape gp|pc games|gaming|Free To Play|Mobile|Full Loot|Old School|adventure games|fantasy games|lure|antilure|antiscam|bait|scam|banned|ban|accounts|twisted bow|rich|money|maxed accounts|undercover","Find out how you can get 3 months of ExpressVPN for free at https://www.ExpressVPN.com/KempQJoin me as I go undercover as bait for these people scamming in runescape, and try to get some money out of their lure attempt. Thanks to PureSpam for lending me his account to anti-lure: https://www.twitch.tv/purespam◆ Join the clan chat! 😃: KempQ CC ◇ Follow on Twitter 🐦: https://twitter.com/kempkor◆ Join the Discord: https://discord.gg/wBGctdAGet Deals with my Affiliate Links:Listen to Audio Entertainment Free for 30 days: http://www.audibletrial.com/kempq (may need to use different browser)Play Oldschool Runescape now, a free to play (F2P) online MMORPG:http://oldschool.runescape.com/🔊 Music ♬:OSRS Remixed Music by OSRSBeatzWaste Another Lie - WellmessFlute Salad - OSRSCan't Dampen My Spirit - Adriel FairNow We Fight - Bonnie GraceSpooky - OSRSChasing the Truth - Dream CaveMarty Gots a Plan - Kevin MacleodExpanse - Trap Remix by OSRSBeatzEmotion - OSRSKool Kats - Kevin MacleodDark Times - Etienne RousselIntroduction: (0:00)Banned Lurers: (2:03)Adventure of Carlos: (2:55)Maxed Accounts Lure: (4:44)","I make gaming videos for Oldschool Runescape (OSRS, the Free online MMORPG by Jagex). Along with slaying dragons and players on RuneScape, I have a passion for sharing my adventures with others.Feel free to message me on Twitter. My DMs are open to everyone!","Games Gaming OSRS Oldschool Runescape KempQ kid friendly for all ages Mmorpg iron man ironman 10hp PK Pking Fire cape money making","ELQmwf0uUVQ"
PETT2dIOnZs,"It's over","UC6-NBhOCP8DJqnpZE4TNE-A","Lance Stewart","24","621.0","https://i.ytimg.com/vi/PETT2dIOnZs/default.jpg","[none]","Julia's Video: http://bit.ly/JuliaCovidChapstickBecome a Member for EXCLUSIVE Content Here:https://www.youtube.com/channel/UC6-NBhOCP8DJqnpZE4TNE-A/joinGET NEW MERCH HERE: http://Lance210.comText Me: +1 (856) 666-0631SUBSCRIBE FOR DAILY VIDS! ►► http://bit.ly/LanceStewartChannelINSTAGRAM: https://instagram.com/Lance210/TWITTER: https://twitter.com/Lance210Snapchat: https://www.snapchat.com/add/itsLance210Business Email: imLance210@gmail.comFAN MAIL: BOX #2031134 SO BLACK HORSE PIKEBLACKWOOD, NJ 08012__210 Familyhttps://www.instagram.com/juliaxsummer/https://www.instagram.com/ninastewart91/https://www.instagram.com/bruguy91/https://www.instagram.com/xosabrinanicolexo/","NEW VLOG POSTED EVERYDAY AT 4PM EST / 1 PM PST! Text Me! +1 (856) 666-0631FAN MAIL: BOX #2041134 SO BLACK HORSE PIKEBLACKWOOD, NJ 08012For instant updates, check out my social media accounts below!","Lance Stewart Lance210","ELQmwf0uUVQ"
d_ZzUKvFvAo,"ImDontai Reacts To Memes For ImDontai V30","UClylk2CQZtH7bSOuNJ66k4A","ImStillDontai","22","2074.0","https://i.ytimg.com/vi/d_ZzUKvFvAo/default.jpg","[none]","In Honor Of Calebnwokolo21 & MajinCarphttps://www.twitch.tv/im_dontai/https://www.twitch.tv/im_dontai/https://www.twitch.tv/im_dontai/https://www.twitch.tv/im_dontai/https://www.twitch.tv/im_dontai/https://www.twitch.tv/im_dontai/https://www.twitch.tv/im_dontai/https://www.twitch.tv/im_dontai/Merch! https://shop.bbtv.com/collections/imdontaiPO Box 56230Virginia Beach, Va 23456","","","ELQmwf0uUVQ"
lS889lJeLaM,"10 Throwback NFL Uniforms That NEED To Make a COMEBACK","UCI4D2tSAiHqZBRB67nTKqww","TPS","17","706.0","https://i.ytimg.com/vi/lS889lJeLaM/default.jpg","Throwback NFL Uniforms That NEED To Make a COMEBACK|best nfl jerseys|worst nfl jerseys|best nfl uniforms|worst nfl uniforms|best throwback nfl uniforms|worst throwback nfl uniforms|nfl|Tennessee Titans: Houston Oilers Home Uniforms|minnesota vikings uniforms|Seattle Seahawks: First Home Uniforms|Tampa Bay Buccaneers: Creamsicle Uniforms|Baltimore Ravens: Original Home Uniforms|Denver Broncos uniforms|New England Patriots: Pat Patriot Uniforms|dallas cowboys uniforms","Here are throwback NFL Jerseys we should bring back.If you're new, Subscribe! → http://bit.ly/Subscribe-to-TPSEvery NFL team has changed up their uniforms at one point or another. As a result, all 32 clubs would have what we would consider to be a “throwback uniform.”Now, some of these teams can be seen wearing their throwback unis from time to time throughout the season. But there are still many great throwback uniforms that haven’t been worn in years, or even decades. And we’re just DYING to see them again! These are 10 throwback NFL uniforms that NEED to make a comeback.Don’t forget to subscribe to TPS and make sure you hit the bell and turn on our notifications and join the notification squad.TotalProSports on Social Media:Facebook: https://www.facebook.com/TotalProSportsTwitter: https://twitter.com/TotalProSportsInstagram: https://www.instagram.com/TotalProSportsFor copyright matters please contact us at: info@icisicmedia.comAll images licensed through GettyImagesHost: Aaron LegerEditor: Scott ShawverWriter: Alex Hoegler#NFLJerseys #Throwback #NFL","TPS is one of the fastest growing channels on Youtube. We make list videos of Superstar Athletes and sports teams on a regular basis. Our site, TotalProSports.com is one of the most visited sports websites in the United States.For business related matters relating to our channel (including media & advertising) or copyright matters contact ICISICMedia@gmail.com","NFL Tom Brady Dallas Cowboys NFL lists every nfl team the real reason all 32 nfl teams ranking nfl new england patriots nfl lists nfl countdown nfl compilations nfl highlights aaron rodgers super bowl dak prescott jerry jones who will win the super bowl nfl channels nfl on youtube nfl rankings every nfl team","ELQmwf0uUVQ"
q8jXOBu2WqU,"Eren Declares WAR In Attack on Titan (Season 4)","UCk4o4gWFuU2YTS50ym4RbXg","Heavenly Controller","24","1351.0","https://i.ytimg.com/vi/q8jXOBu2WqU/default.jpg","attack on titan|attack on titan season 4|shingeki no kyojin|heavenly controller attack on titan|declaration of war attack on titan|attack on titan final season","INSTAGRAM: https://www.instagram.com/heavenlycontrolTWITTER: https://twitter.com/heavenlycontrolTWITCH: http://www.twitch.tv/heavenlycontrollerDISCORD: https://discord.gg/TnFuqtj","yeah.","Heavenly Controller Anime Gaming","ELQmwf0uUVQ"
XhHbZPpeztA,"DECEPTION & SPINS!","UCR5hk1KJMfT-tzrA7Vu5WgQ","Monto","20","1537.0","https://i.ytimg.com/vi/XhHbZPpeztA/default.jpg","New Map|New Survivor|New perks|Legacy Clothes|Funny Moments|Rank 1|rank one|High rank|Perk roulette|Perk wheel|DbD|Mori Animation|New DLC|Perk Builds|Monto|New Cosmetics|Stranger Things DLC|Silent Hill DLC|Pyramid Head|Halloween event|Cosplay|A Binding Of Kin|Charlotte|Victor|Blindfolded","Been a while but I'm back with a schedulehttps://www.twitch.tv/theonlymontoWant some Monto Merch?https://www.designbyhumans.com/shop/Monto/🌐 CHEESE that LIKE and SUBSCRIBE if YOU WANT MORE DbD!___________________________🎵Outro: https://youtu.be/Mbo21zQDfFA👉Discord: https://discord.gg/ZBWjRS6👉Twitter: https://twitter.com/TheOnlyMonto➕ Subscribe: https://www.youtube.com/themontologist","I entertain, at the same time as being good at the games I play.","Montologist Dead By Daylight Monto Guide Survivor Friday The 13th A Lullaby For The Dark The Huntress","ELQmwf0uUVQ"
OvpB4i40nu0,"1v1ing FROSTY Gameing as revenge did i win?!?","UCOsHM6nUpExu-6plSlAtcDA","octrainfaster AF","20","262.0","https://i.ytimg.com/vi/OvpB4i40nu0/default.jpg","[none]","","I upload gaming content. Two vids a week tuesday and saturday. U dont have to sub but i definetely recomend u to. Love all my octrain supporters💙💯💯🔥🔥👍","","ELQmwf0uUVQ"
hiFw24hb86k,"McGregor vs. Holloway | Best Moments","UCXz7ndon_Z1cYm49dwxbK0w","Larone","17","578.0","https://i.ytimg.com/vi/hiFw24hb86k/default.jpg","conor|mcgregor","Best moments featuring Conor McGregor & Max Holloway in UFC Fight Night: Boston#UFC","","Larone","ELQmwf0uUVQ"
PeXnwF8jA5c,"It's Time... to INVADE the EVIL MANSION!! | EEZYCRAFT #9","UCp1VWSTrt2cUBInkn4dUmDA","iBerleezy","20","2604.0","https://i.ytimg.com/vi/PeXnwF8jA5c/default.jpg","Berleezy|iBerleezy|Gameplay|Walkthrough|Lets Play|Comedy|Commentary|Hilarious","Sub to my young bru, @HeyHixen! Official #EEZYGANG MERCH!! - https://www.eezygang.comMy Twitch ► https://www.twitch.tv/berleezyMy Instagram ► https://www.instagram.com/berleezyMy Twitter ► https://twitter.com/berleezyLike me on Facebook ► https://www.facebook.com/berleezyBECOME A MEMBER and SUPPORT the #EEZYGANG today!! (Users of iOS and other unsupported devices can use this link to become members)https://www.youtube.com/channel/UCp1VWSTrt2cUBInkn4dUmDA/joinIf you’re reading the description, this is Berleezy's official gaming channel! Subscribe for gaming, horror let’s play videos and fire ass content every week!","#EEZYGANG MERCH!! - https://www.eezygang.comFollow me on Instagram ► https://www.instagram.com/berleezyLike me on Facebook ► https://www.facebook.com/berleezyFollow me on Twitter ► https://twitter.com/berleezy","berleezy","ELQmwf0uUVQ"
NDNCR3tONBY,"Inside the NBA Reacts To The James Harden Trade","UC9-OpMMVoNP5o10_Iyq7Ndw","Bleacher Report","17","546.0","https://i.ytimg.com/vi/NDNCR3tONBY/default.jpg","bleacher report|br|nba|shaq|chuck|kenny smith|chuck inside the nba|chuck james harden|james harden trade|james harden brooklyn nets|shaq james harden trade|shaq james harden|shaq inside the nba|inside the nba james harden|inside the nba 2021|shaq chuck best moments|chuck shaq best moments|kenny smith inside the nba|ernie johnson inside the nba|james harden kevin durant|james harden kyrie irving|brooklyn nets|brooklyn nets trade|james harden 2021","Shaq, Chuck, Kenny Smith and EJ reacted to the blockbuster trade that landed James Harden on the Brooklyn Nets. Subscribe: https://www.youtube.com/user/BleacherReport?sub_confirmation=1Follow on IG: http://www.instagram.com/f/bleacherreportFollow us on Twitter: http://www.twitter.com/bleacherreportLike us on Facebook: http://www.facebook.com/bleacherreport#InsideTheNBA #JamesHarden #NBA","The official YouTube page of Bleacher Report. Subscribe to see sports highlights, features and animations that drive fandom and bring the culture of sports to life.","sports bleacher report nba mma ufc football basketball nfl mlb baseball playoffs","ELQmwf0uUVQ"
M6Hc888IOKQ,"TELLING MY GIRLFRIEND SHUT UP B TO SEE HOW SHE REACTS!! *NEVER AGAIN*","UCwfBtug_t3HHRg3-40xWilA","Qui & Ken","24","1168.0","https://i.ytimg.com/vi/M6Hc888IOKQ/default.jpg","qui and ken|ken and qui|qui|ken|TELLING MY GIRLFRIEND SHUT UP B|TO|SEE|HOW|SHE|REACTS!!|*NEVER|AGAIN*|telling my girlfriend shut up b|to|see|her|reaction|never again|rissa and quan|prank|boyfriend|girlfriend|best pranks|pranks|funny|reaction|her reaction|prank on girlfriend|tiktok|tiktok trend|riss and quan|relationshp","#quiandken  #qkgang  #kenandquiSEND US MAIL 💌 Qui and Ken P.O Box 78838Atlanta, Georgia 30357LETS BE FRIENDS 🥰 FOLLOW US: QUI’S INSTAGRAM: https://www.instagram.com/quirenea/KEN’S INSTAGRAM: https://www.instagram.com/therealitsken/ OUR COUPLES INSTAGRAM: https://instagram.com/quiandkenofficial?igshid=1sz2z4xyhh2hx•QUI’S BEAUTY CHANNEL: https://www.youtube.com/channel/UChVUMeMToRHaIyYBX2pgfrQQUI’S SNAPCHAT: Laquittar KEN’S SNAPCHAT: Rosebruh3 TIKTOK: https://vm.tiktok.com/7J8q7m/FACEBOOK: https://www.facebook.com/officialquiandken/“Business Inquiries or Collaborations” quiandken@nebnetworks.comSUBSCRIBE SUBSCRIBE SUBSCRIBE!!!!!!!!!","Qui & Ken| subscribe to “Q&Kgang” also turn on your notifications if you want to catch our videos  VLOGS, PRANKS, CHALLENGES, AND MORE (BUSINESS EMAIL: quiandken@nebnetworks.com)FOLLOW US ON SOCIAL MEDIA :(Qui)Instagram-Quirenea (Ken)Instagram-therealitsken","Qui&Ken QUI AND KEN QUI KEN QUIANDKEN","ELQmwf0uUVQ"
M6Hc888IOKQ,"TELLING MY GIRLFRIEND SHUT UP B TO SEE HOW SHE REACTS!! *NEVER AGAIN*","UCwfBtug_t3HHRg3-40xWilA","Qui & Ken","24","1168.0","https://i.ytimg.com/vi/M6Hc888IOKQ/default.jpg","qui and ken|ken and qui|qui|ken|TELLING MY GIRLFRIEND SHUT UP B|TO|SEE|HOW|SHE|REACTS!!|*NEVER|AGAIN*|telling my girlfriend shut up b|to|see|her|reaction|never again|rissa and quan|prank|boyfriend|girlfriend|best pranks|pranks|funny|reaction|her reaction|prank on girlfriend|tiktok|tiktok trend|riss and quan|relationshp","#quiandken  #qkgang  #kenandquiSEND US MAIL 💌 Qui and Ken P.O Box 78838Atlanta, Georgia 30357LETS BE FRIENDS 🥰 FOLLOW US: QUI’S INSTAGRAM: https://www.instagram.com/quirenea/KEN’S INSTAGRAM: https://www.instagram.com/therealitsken/ OUR COUPLES INSTAGRAM: https://instagram.com/quiandkenofficial?igshid=1sz2z4xyhh2hx•QUI’S BEAUTY CHANNEL: https://www.youtube.com/channel/UChVUMeMToRHaIyYBX2pgfrQQUI’S SNAPCHAT: Laquittar KEN’S SNAPCHAT: Rosebruh3 TIKTOK: https://vm.tiktok.com/7J8q7m/FACEBOOK: https://www.facebook.com/officialquiandken/“Business Inquiries or Collaborations” quiandken@nebnetworks.comSUBSCRIBE SUBSCRIBE SUBSCRIBE!!!!!!!!!","Qui & Ken| subscribe to “Q&Kgang” also turn on your notifications if you want to catch our videos  VLOGS, PRANKS, CHALLENGES, AND MORE (BUSINESS EMAIL: quiandken@nebnetworks.com)FOLLOW US ON SOCIAL MEDIA :(Qui)Instagram-Quirenea (Ken)Instagram-therealitsken","Qui&Ken QUI AND KEN QUI KEN QUIANDKEN","ELQmwf0uUVQ"
aLoBCRUEpmk,"The Joe Budden Podcast Episode 407 | Your Why","UC23_r1bpkTWaBltbXsQxysA","Joe Budden TV","24","8797.0","https://i.ytimg.com/vi/aLoBCRUEpmk/default.jpg","JOE BUDDEN|hiphop|rap|JOE BUDDEN TV|Slaughterhouse|i'll name this podcast later|podcast|The Joe Budden Podcast|Joe Budden Podcast|state of the culture|revolt|revolt tv|pull up|JBP|joe budden network|see the thing is|bridget kelly|joe budden 2021","Joe and the guys review the most downloaded apps of 2020 (2:00), and it looks like Joe’s getting into women’s business with the launch of a new show on the Joe Budden Network (2:27). James Harden is headed to the Brooklyn Nets to join KD & Kyrie (25:20). While this affects Joe’s roster, Mal explains why he thinks James Harden should be a 6th man (48:17). Joe speaks directly to entitled artists (52:05) and addresses Spotify’s stock slipping following analyst doubts over the company’s direction (1:20:20). As for other business dealings, Verzuz and NFL are partnering for this year’s Pro Bowl to showcase players’ position highlights (1:27:45) and Lamar Odom signs a celebrity boxing deal (1:43:20). Finally, Joe breaks down Bitcoin for dummy’s, as it reached it’s all-time high (1:52:03).   Sleeper Picks Joe | SZA - “Good Days”   Rory | James Fauntleroy - “Take Me”   Mal | Mac Ayres - “Jumping Off The Moon”    Parks | Black Rob - “You Know What”Subscribe for more content from the Joe Budden Network: http://bit.ly/BuddenYTSubWatch more exclusive series and footage from the Joe Budden Network:The Joe Budden Podcast - http://bit.ly/BuddenPodcastPull Up - http://bit.ly/JoeBuddenPullUpSee, The Thing Is - http://bit.ly/STTIYouTubeJBP Clips - http://bit.ly/JBPClipsJBP Cartoon - http://bit.ly/JBPCartoonJoe Budden Official Music Videos - http://bit.ly/BuddenVidshttp://www.joebudden.comhttps://twitter.com/JoeBuddenhttps://www.instagram.com/joebudden/#JoeBudden","the wonderful world of jumpoff Joe Budden, welcome","joe budden tv joe budden rage and the machine hip-hop rap mood muzik Love and Hiphop Slaughterhouse podcast Joe Budden Podcast The Joe Budden Podcast Everyday Struggle Complex Complex News Everyday Struggle Complex Complex Everyday Struggle Everyday Struggle Joe Budden dj akademiks charlamagne tha god pull up Oh what a night state of the culture revolt revolt tv pusha T see the thing is bridget kelly mal rory olivia dope mandii b joe budden network joe budden 2021 girl i guess karen civil ming lee","ELQmwf0uUVQ"
uawrjcVuDas,"What is an NBA Bust?","UCy4wbGx16ZusDQ2xkxv_xoQ","BSOLZ","17","656.0","https://i.ytimg.com/vi/uawrjcVuDas/default.jpg","What Is an NBA Bust?|The Biggest NBA Draft Bust From Every Team|Top 10 Biggest Draft BUSTS In NBA History|The Lonzo Ball Trap..|Swishout|kobe bryant|michael jordan|lebron|lebron james|russell westbrook|first take|stephen a smith|skip bayless|max kellerman|undisputed|nba|nba finals|zion williamson|nba playoffs|james harden|stephen curry|lonzo ball|lonzo ball bust|lamelo ball vs lonzo ball|lonzo ball highlights|lonzo ball 6th man|BSOLZ","What is an NBA Bust?Discord: https://discord.gg/MCsnBSqTwitch: https://www.twitch.tv/bsolz_Instagram: https://www.instagram.com/bsolz/- - - - - - - - - - - - - - - - - - - - - - - - - - - - - - - - - - - - - - - - - - - - - - - - - - - - - - - - - - - - - - - - -Let's Keep It A Buck Podcast!Live on Twitch Wed and Sun at 10:00 PM EST on https://www.twitch.tv/bsolz_FULL EPISODES:-- YouTube: https://www.youtube.com/channel/UCcjNSOjU-i7tmy_pCRS0NBg-- iTunes: https://podcasts.apple.com/us/podcast/lets-keep-it-a-buck/id1515130467-- Spotify: https://open.spotify.com/show/60yWhRMj7bnn6YACZp23fk?si=wrspEwFxTkCgazCV6A76JA","Welcome to the BSOLZ channel! If you love basketball and anything about basketball, then this is the place to be. I do mainly Top 5s and discussion videos on this channel. What I'm trying to do with this channel is grow the largest basketball community on YouTube. A one stop sanctuary for people to talk about the game we all love, basketball. So if you wanna become part of that community, then go ahead and hit the SUBSCRIBE button. This channel is also partnered with NBA Playmakers.  NBA Playmakers is the online video network for YouTube creators covering all corners of basketball. From the hallowed grounds of Rucker Park to the rafters of the Staples Center, from kicks reviews to trick shot compilations, it’s a fusion of ball culture, style, and attitude through video.NBA Playmakers launches you into a worldwide basketball community for content creators.Follow me on:IG- bsolzTwitter- BSOLZ_Business e-mail- bryansolis18@hotmail.com","NBA basketball BSOLZ NBA 2K NBA Playmakers NBA highlights NBA mix NBA What If NBA News Basketball National Basketball Association","ELQmwf0uUVQ"
79M2IaS7BIA,"FlightReacts NETS at CAVALIERS | FULL GAME HIGHLIGHTS | January 20, 2021!","UCoGIPQ7M4NWai7LRgRhaSOg","NotYourAverageFlight","17","840.0","https://i.ytimg.com/vi/79M2IaS7BIA/default.jpg","BEST BUILD|NBA 2K21 BEST ARCHETYPE|NBA 2K21 MYCAREER|NBA 2K21 MYPARK|NBA 2K21 TOP REP|BEST JUMPSHOT 2K21|NBA 2K21 STRETCH BIG GAMEPLAY STORY PRANKS IRL FAMILY FUN KIDS|nba 2k21|nba 2k21 my team|nba 2k|basketball|sports|education","LETS GET 4 Million TOGETHER! Be sure to subMerchhttps://www.flightreacts.us/Checkout my stream https://www.twitch.tv/flight23whiteSUBSCRIBE to other channel here https://www.youtube.com/channel/UC_k0qgMNIW2VmTQKjFsbXDwSOCIAL MEDIAFollow me on twitter: https://twitter.com/Flight23WhiteFollow my  instagram https://www.instagram.com/Flight23White_","Exciting, Energetic, Entertainment.","NBA 2k21 basketball irl 2k LIVE GAMEPLAY Nba mypark family fun kids 3v3 5v5 ps4","ELQmwf0uUVQ"
nB2vrJIFf7I,"I Put Every NBA Player On Their HOMETOWN TEAMS... here’s what happened.","UCd8YyVTur0fe8P8NXgOPRgQ","Clique Productions","20","3930.0","https://i.ytimg.com/vi/nB2vrJIFf7I/default.jpg","nba 2k|nba 2k21|nba|myleague|stephen curry|lebron james|kawhi leonard|nba 2k21 next gen|nba 2k21 ps5|nba 2k21 xbox series x|kevin durant|lebron james cavs|nba 2k21 career simulation|nba 2k21 next gen career simulation|career simulation|nba career simulation|james harden|ja morant|zion williamson|every nba player|greatest nba players","i put every player back home. that includes bringing back Seattle & New Jersey, LeBron & Steph are teammates, Zion and Ja reunite, Los Angeles is Los Angeles and all the international guys are pretty good2nd Channel (ImClique): https://www.youtube.com/channel/UCIuO_JngVmwh_oUKJOcLxKA?sub_confirmation=1Twitch: https://www.twitch.tv/cliqueproductionsTwitter: https://twitter.com/ImClique_Instagram: https://instagram.com/ImClique_Merch: https://teespring.com/stores/cliqueproductionsDiscord: https://discord.com/invite/cliqueBusiness: knicksclique@gmail.com","I mean it's pretty self explanatory you see the videos","nba 2k nba 2k21 nba 2k rebuild nba 2k rebuild nba 2k nba myleague myleague 2k21 knicks clique nba career simulation nba 2k21 career simulation nba 2k21 career sim 2k career sim nba 2k career simulation 2k myleague","ELQmwf0uUVQ"
YTy4cTB2_AM,"The Joe Budden Podcast Episode 406 | A Gaping Hole","UC23_r1bpkTWaBltbXsQxysA","Joe Budden TV","24","8571.0","https://i.ytimg.com/vi/YTy4cTB2_AM/default.jpg","JOE BUDDEN|hiphop|rap|JOE BUDDEN TV|Slaughterhouse|i'll name this podcast later|podcast|The Joe Budden Podcast|Joe Budden Podcast|state of the culture|revolt|revolt tv|pull up|JBP|joe budden network|see the thing is|bridget kelly|joe budden 2021|us capital|drake|drake dropbox|drake unreleased music","A loaded episode this week as Rory makes his return in-person to the pod and Joe shares his concerns about Rory's arrival (4:35). Also, over the weekend Joe analyzed the U.S. Capitol breach and had a message for the participants (10:38), Mal gets a tarot card reading on the podcast which exposes his love-life (32:00), and a Drake dropbox file with unreleased music is leaked which the guys react to (1:00:20). In addition, the guys discuss how dangerous a new law that was passed which allows lyrics to be used against artist in court (1:46:50) and a new Covid-19 bill that demands the government provides information on any potential UFO's (2:05:40) and more on this loaded episode!  Sleeper Picks: Joe | Mac Ayres - “Easy”  Rory | Emotional Oranges - “Bonafide” (Ft. Chiiild)  Mal | Sy Ari Da Kid - “The Last Goat”  Parks | Navy Blue - “Breathe” (Ft. Yasiin Bey)Subscribe for more content from the Joe Budden Network: http://bit.ly/BuddenYTSubWatch more exclusive series and footage from the Joe Budden Network:The Joe Budden Podcast - http://bit.ly/BuddenPodcastPull Up - http://bit.ly/JoeBuddenPullUpSee, The Thing Is - http://bit.ly/STTIYouTubeJBP Clips - http://bit.ly/JBPClipsJBP Cartoon - http://bit.ly/JBPCartoonJoe Budden Official Music Videos - http://bit.ly/BuddenVidshttp://www.joebudden.comhttps://twitter.com/JoeBuddenhttps://www.instagram.com/joebudden/#JoeBudden","the wonderful world of jumpoff Joe Budden, welcome","joe budden tv joe budden rage and the machine hip-hop rap mood muzik Love and Hiphop Slaughterhouse podcast Joe Budden Podcast The Joe Budden Podcast Everyday Struggle Complex Complex News Everyday Struggle Complex Complex Everyday Struggle Everyday Struggle Joe Budden dj akademiks charlamagne tha god pull up Oh what a night state of the culture revolt revolt tv pusha T see the thing is bridget kelly mal rory olivia dope mandii b joe budden network joe budden 2021 girl i guess karen civil ming lee","ELQmwf0uUVQ"
n5aQeLwwEns,"forming a secret organization [Dream SMP]","UCFAiFyGs6oDiF1Nf-rRJpZA","Technoblade","20","7394.0","https://i.ytimg.com/vi/n5aQeLwwEns/default.jpg","Minecraft|Technoblade|Technothepig|Dream SMP|Technoblade Dream SMP|Minecraft Dream SMP|Technoblade Minecraft","Lore stream (may miss donations). More importantly, PLUSHIES GO ON SALE TOMORROW AT 3 PM EST GO GO GO https://youtooz.com/collections/technobladepog thumbnail by https://twitter.com/jester_u/status/1348285475992313857past livestreams playlist: https://www.youtube.com/playlist?list=PLQSoWXSpjA3-egtFq45DcUydZ885W7MTT--------------------------------⭐ EVERY TIME SOMEONE HITS THE JOIN BUTTON I BECOME EVEN MORE POWERFUL so consider it, i guess. i mean you get like. a sword next to your name in my livechat and comment section. AND custom emojis. AND access to the worst discord on earth. it's a steal. trust me. would I lie to you? definitely not. i am a paragon of honesty and virtue. hit the join button today⭐ CHANNEL MEMBER LINK: https://www.youtube.com/channel/UCFAiFyGs6oDiF1Nf-rRJpZA/membership ⭐How to join the Sponsor Discord:1. Be a sponsor2. On Discord, sync your YouTube account with your Discord account, by going into User Settings - Connections - YouTube.3. Discord will automatically sync with your YouTube account, and you'll find all the streamers you're sponsored to right in the Connections tab! You can hit the Join Server buttonnote: for new sponsors, it may take up to an hour for discord to sync with YT and know you're a sponsor, so stop yelling at me. please. MY FEELINGS D:note: this does not work on mobile, get on a pc nerd we'll be right back scene by https://twitter.com/Limes_Smile/status/1309095152477253632⭐ twitter: https://twitter.com/Technothepighouse design: https://www.youtube.com/watch?v=aSl_MdFOmHMmusic from:https://www.epidemicsound.com/referral/m3rfi7/","I play video games too much. I might not be the best, but I do have hot elbows.My twitter:https://twitter.com/Technothepigavatar by https://twitter.com/AmyTheMudkipbanner by https://www.youtube.com/channel/UCd6BuNIVkn5oDBeDsr6HIGQ","Technoblade Technothepig Hypixel Hypixel Skywars Skywars Texture Pack Minecraft Minecraft PVP PVP Bedwars Hypixel Bedwars Minecraft Bedwars","ELQmwf0uUVQ"
