video_id,title,channelId,channelTitle,categoryId,duration,thumbnail_link,tags,description,channel_desc,channel_keywords,related_vid_id
z65noVSnhuk,"Trolling FatMemeGod with Lucky Blocks (minecraft mods)","UC-XTuGOHIF7vWvbhJZ56wbw","Socksfor2","20","631.0","https://i.ytimg.com/vi/z65noVSnhuk/default.jpg","Socksfor2|Socksfor1|Trolling fatmemegod with lucky blocks|best minecraft|minecraft epic moments|minecraft funny moments|minecraft|hardcore minecraft|funniest minecraft|minecraft funny moments compilation|top minecraft|minecraft compilation|minecraft 2020|funny minecraft|minecraft funny|minecraft fails|funniest minecraft fails|try not to laugh minecraft|funniest minecraft videos|among us with friends|fun game to play with friends|fatmemegod among us","today we will be trolling fatmemegod with a minecraft mod called lucky blocks, which is part of the crazy craft modpack! Follow my Twitter - @Socksfor1Follow my Instagram - @Socksfor1Edited By- PraduhFriends in video @Blaza Plays @FatMemeGod #Minecraftwelcome back to another hilarious minecraft video with my friends blaza and fatmemegod! Today we get on the crazy craft minecraft modpack and troll fatmemegod since he is still learning minecraft! He had no idea about the lucky blocks so it was a great troll!","This is my second channel more focused on VR GAMING! All the best virtual reality moments!Editor for others with over 100 million plus views including Samsung USReddit, Twitch, Tiktok, Youtube partner500k subs 11/25/20Instagram https://www.instagram.com/socksfor1/Twitter https://twitter.com/Socksfor1Twitch https://www.twitch.tv/socksfor1","VR Family Family Friendly VR Gaming Oculus Socksfor1 Socksfor2 Virtual Reality Mully Joshdub Eddievr","7Jbtl9JTOHQ"
atuxMZl_6PQ,"minecraft ULTIMATE BUNKER vs 1000 ARMORED ZOMBIES","UC-XTuGOHIF7vWvbhJZ56wbw","Socksfor2","20","723.0","https://i.ytimg.com/vi/atuxMZl_6PQ/default.jpg","Socksfor2|Socksfor1|minecraft|minecraft noob vs pro vs hacker|minecraft house|noob vs pro minecraft|house minecraft|minecraft zombie|zombie minecraft|minecraft animation|minecraft zombie house|1 clone trooper vs 1000 battle droids|minecraft pro|minecraft dogs|dogs minecraft|wolf minecraft|minecraft base|minecraft trap|mirl minecraft|minecraft noob|1000 clone troopers vs 1000 battle droids|minecraft how to","today we play minecrafts ultimate bunker and I survived with blaza against 1000 zombies bruhFollow my Twitter - @Socksfor1Follow my Instagram - @Socksfor1Edited By- PraduhFriends in video #Minecraftultime bunker zombie vs a ton of zombies, what could go wrong?","This is my second channel more focused on VR GAMING! All the best virtual reality moments!Editor for others with over 100 million plus views including Samsung USReddit, Twitch, Tiktok, Youtube partner500k subs 11/25/20Instagram https://www.instagram.com/socksfor1/Twitter https://twitter.com/Socksfor1Twitch https://www.twitch.tv/socksfor1","VR Family Family Friendly VR Gaming Oculus Socksfor1 Socksfor2 Virtual Reality Mully Joshdub Eddievr","7Jbtl9JTOHQ"
mOwSO6qWNqk,"TABS NEW UNIT CREATOR BATTLE (Totally Accurate Battle Simulator)","UC-XTuGOHIF7vWvbhJZ56wbw","Socksfor2","20","856.0","https://i.ytimg.com/vi/mOwSO6qWNqk/default.jpg","Family Friendly|VR|Gaming|Dank|socksfor2|Socksfor1|totally accurate battle simulator|tabs|totally accurate battle simulator new secret units|totally accurate battle simulator new update|totally accurate battle simulator new faction|tabs unit creator update|tabs best unit creator|tabs unit creator funny moments|tabs funny moments|tab unit creator funny|tabs funny|tabs best cutom units|tabs creator beta","today blaza and i make overpowered and dumb units in the new unit creator in totally accurPrevious Video →https://www.youtube.com/watch?v=PHojnKb4daI#TABS#unitcreatorFriends (sub to them) Fatmemegod- https://bit.ly/33oDf0GBlaza-https://bit.ly/3cWCMGj⛏️JOIN SERVER → socks.gg use code Socksfor1 in the item shop ad👽REDDIT → https://bit.ly/3ejZBmf🔴TWITCH → https://bit.ly/3iSmkcq📷INSTAGRAM → https://bit.ly/38KFjRA 🐦TWITTER → https://bit.ly/2Oi0YHC👕NEW MERCH → https://bit.ly/2AThH0O🎥2ND CHANNEL → https://bit.ly/38Kb6SQ 😀DISCORD → https://bit.ly/2ZXonUcMUSIC → https://bit.ly/3edT2Sc (Kevin MacLeod)→ https://bit.ly/3kdvbVY (Epidemic) OUTRO → https://bit.ly/2DoKefpMODPACK → https://bit.ly/2BQWQM9EDITOR → praduhEMAIL→ nicholas@socksfor1.comFamily Friendly PG Clean 13+","This is my second channel more focused on VR GAMING! All the best virtual reality moments!Editor for others with over 100 million plus views including Samsung USReddit, Twitch, Tiktok, Youtube partner500k subs 11/25/20Instagram https://www.instagram.com/socksfor1/Twitter https://twitter.com/Socksfor1Twitch https://www.twitch.tv/socksfor1","VR Family Family Friendly VR Gaming Oculus Socksfor1 Socksfor2 Virtual Reality Mully Joshdub Eddievr","7Jbtl9JTOHQ"
3lpgq34Csu8,"Blade and Sorcery VR but I downloaded every single mod","UC-XTuGOHIF7vWvbhJZ56wbw","Socksfor2","20","604.0","https://i.ytimg.com/vi/3lpgq34Csu8/default.jpg","Socskfor1|Family Friendly|VR|Gaming|blade and sorcery vr|blade and sorcery vr mods|blade and sorcery minecraft mod vr|blade and sorcery vr but I downloaded every single mod|blade and sorcery star wars mod|vr mods|blade and sorcery thanos mod|blade|blades and sorcery lightsaber|blades and sorcery best kills|blades and sorcery vr|virtual reality|blade and sorcery mods|blade and sorcery|Socksfor2|blades and sorcery vr star wars|star wars","I decided to download the star wars, minecraft, thanos, and many more mods in blade and sorcery vr on the oculus rift sLAST VIDEO: https://www.youtube.com/watch?v=cGz-nhrXVSQSupport a creator code : Socksfor1TWITCH► https://www.twitch.tv/socksfor1Editor help► Ragepiglet #VR#bladeandsoceryEditor: Sony Vegas 16MUSIC►Kevin MacLeod (https://www.youtube.com/user/kmmusic)outro► https://www.youtube.com/user/GabzitoHDStar wars remix theme (https://www.youtube.com/watch?v=afq2XIMpWac) Copyright problem/Business? nicholas@socksfor1.comI will contact you back as soon as possible. Thank you for watching! Hoped you enjoyed.","This is my second channel more focused on VR GAMING! All the best virtual reality moments!Editor for others with over 100 million plus views including Samsung USReddit, Twitch, Tiktok, Youtube partner500k subs 11/25/20Instagram https://www.instagram.com/socksfor1/Twitter https://twitter.com/Socksfor1Twitch https://www.twitch.tv/socksfor1","VR Family Family Friendly VR Gaming Oculus Socksfor1 Socksfor2 Virtual Reality Mully Joshdub Eddievr","7Jbtl9JTOHQ"
X2GLlOuTVXs,"100 Layers of Diamonds vs 100 Layers of Lava! - Minecraft Challenge","UC70Dib4MvFfT1tU6MqeyHpQ","Preston","24","937.0","https://i.ytimg.com/vi/X2GLlOuTVXs/default.jpg","funny|challenge|family|comedy|preston|brianna","100 Layers of Diamonds vs 100 Layers of Lava! - Minecraft Challenge with Preston 👊👕 Get your merch here! 🡆 http://www.prestonsstylez.com/ 👀 FOLLOW ME HERE!🡆 TikTok - https://www.tiktok.com/@preston🡆 Instagram - https://instagram.com/prestonplayz🡆 Twitter - https://twitter.com/Preston🡆 PrestonShorts - https://bit.ly/2VrTLIr🎮 Join my Fan Discord! 🡆 http://discord.gg/PrestonFaZe Rug - I Challenged Professional Football Players to a 1v1...https://youtu.be/Q9iaLIMGBDIUnspeakable - We Found A KEY FROZEN In ICE…https://youtu.be/6y5BTGTFTmgCarter Sharer - EAT IT AND ILL PAY FOR IT!! (FAST FOOD EDITION)https://youtu.be/2NxPyzrWXLg------------------------------Additional music provided by Epidemic SoundClick here for a free trial! 🡆 http://share.epidemicsound.com/TBNR","Hey y'all!I’m a 25-year-old, Jesus loving, video game playing, vlogger from the great state of Texas! I live to make epic and exciting vlogs for all of you — my FireNation family!. If you’re a fan and wanna talk to me, just hit me up on Twitter! I love engaging with all of my fans! 🔥🔥🔥Psalm 23:1: “The LORD is my shepherd, I lack nothing.”","family challenge challenges vlog little brother wife husband boy girl kids","7Jbtl9JTOHQ"
mqgi6W3deMU,"among us GOD vs SPECIAL ROLES (mods)","UCsEgeyBfOnGGBpjIvkDJbWg","Socksfor1","20","732.0","https://i.ytimg.com/vi/mqgi6W3deMU/default.jpg","Socksfor1|among us mods|among us socksfor1 mods|among us GOD vs SPECIAL roles|among us terminator mode|among us new doctor mod|among us but the impostors don't know each other|among us best impostor plays|among us roles|among us new update|among us best jester plays|among us new sheriff role","today, the among us impostor god will play against the sheriff, jester, doctor, detective, and many morePrevious Video →https://www.youtube.com/watch?v=u86xVKATzE8#amongus#modsFriends (sub to them) Fatmemegod- https://bit.ly/33oDf0GBlaza-https://bit.ly/3cWCMGjJuice- https://bit.ly/3oga4ENNadwe- https://bit.ly/3mmpJ4O⛏️JOIN SERVER → socks.gg use code Socksfor1 in the item shop ad😀TIKTOK→ https://bit.ly/2UynFdt👽REDDIT → https://bit.ly/3ejZBmf🔴TWITCH → https://bit.ly/3iSmkcq📷INSTAGRAM → https://bit.ly/38KFjRA 🐦TWITTER → https://bit.ly/2Oi0YHC👕NEW MERCH → https://bit.ly/2AThH0O🎥2ND CHANNEL → https://bit.ly/38Kb6SQ 😀DISCORD → https://bit.ly/2ZXonUcMUSIC → https://bit.ly/3edT2Sc (Kevin MacLeod)→ https://bit.ly/3kdvbVY (Epidemic) OUTRO → https://bit.ly/2DoKefpMODPACK → EDITOR → praduhEMAIL→ nicholas@socksfor1.comFamily Friendly PG Clean 13+","I do it all! Editor for others with over 100 million plus views including Samsung USReddit, Twitch, Tiktok, Youtube partnerInstagram https://www.instagram.com/socksfor1/Twitter https://twitter.com/Socksfor1Twitch https://www.twitch.tv/socksfor1#1 trending - 10/29/201000 Subs- 2/16/182000 Subs- 7/7/183000 Subs-10/9/185000 Subs-11/22/1810000 Subs-12/10/1825000 Subs-12/27/1850000 Subs 3/13/19100000 Subs 4/25/19500000 Subs 10/31/191000000 Subs 2/25/202000000 Subs 10/21/203000000 Subs 1/1/21","Sockfor1 Fortnite Minecraft Family Friendly 13+ VR Virtual Reality Dank Memes Dank","7Jbtl9JTOHQ"
paxw8yQuDTU,"BEATING IMPOSSIBLE HUMAN FALL FLAT LEVELS (.0001%)","UC-XTuGOHIF7vWvbhJZ56wbw","Socksfor2","20","571.0","https://i.ytimg.com/vi/paxw8yQuDTU/default.jpg","Family Friendly|VR|Gaming|Dank|socksfor2|Socksfor1|BEATING IMPOSSIBLE HUMAN FALL FLAT LEVELS|human fall flat|human fall flat impossible|human fall flat hardest level|human fall flat most difficult level|most difficult human fall flat level 2|hitesh ks human fall flat most difficult level","today we play the most impossible human fall flat levelsPrevious Video →https://www.youtube.com/watch?v=JvWwadqWu7o#humanfallfalt#hardlevelFriends (sub to them) Fatmemegod- https://bit.ly/33oDf0GBlaza-https://bit.ly/3cWCMGj⛏️JOIN SERVER → socks.gg use code Socksfor1 in the item shop ad👽REDDIT → https://bit.ly/3ejZBmf🔴TWITCH → https://bit.ly/3iSmkcq📷INSTAGRAM → https://bit.ly/38KFjRA 🐦TWITTER → https://bit.ly/2Oi0YHC👕NEW MERCH → https://bit.ly/2AThH0O🎥2ND CHANNEL → https://bit.ly/38Kb6SQ 😀DISCORD → https://bit.ly/2ZXonUcMUSIC → https://bit.ly/3edT2Sc (Kevin MacLeod)→ https://bit.ly/3kdvbVY (Epidemic) OUTRO → https://bit.ly/2DoKefpMODPACK → https://bit.ly/2BQWQM9EDITOR → CriticEMAIL→ nicholas@socksfor1.comFamily Friendly PG Clean 13+","This is my second channel more focused on VR GAMING! All the best virtual reality moments!Editor for others with over 100 million plus views including Samsung USReddit, Twitch, Tiktok, Youtube partner500k subs 11/25/20Instagram https://www.instagram.com/socksfor1/Twitter https://twitter.com/Socksfor1Twitch https://www.twitch.tv/socksfor1","VR Family Family Friendly VR Gaming Oculus Socksfor1 Socksfor2 Virtual Reality Mully Joshdub Eddievr","7Jbtl9JTOHQ"
JvWwadqWu7o,"Forcing 100 players to build their best redstone contraption","UC-XTuGOHIF7vWvbhJZ56wbw","Socksfor2","20","643.0","https://i.ytimg.com/vi/JvWwadqWu7o/default.jpg","Family Friendly|VR|Gaming|Dank|socksfor2|Socksfor1|100 players|Forcing 100 players to build their best redstone contraption|100 players best redstone contraption|minecraft|mincraft build battle|minecraft server|minecraft level 1 to 100|minecraft level 1000|socksfor1 minecraft","today I make 100 players make their best redstone contraption Previous Video →https://www.youtube.com/watch?v=akW1-G4piPc#Minecraft#ModFriends (sub to them) Fatmemegod- https://bit.ly/33oDf0GBlaza-https://bit.ly/3cWCMGj⛏️JOIN SERVER → socks.gg use code Socksfor1 in the item shop ad👽REDDIT → https://bit.ly/3ejZBmf🔴TWITCH → https://bit.ly/3iSmkcq📷INSTAGRAM → https://bit.ly/38KFjRA 🐦TWITTER → https://bit.ly/2Oi0YHC👕NEW MERCH → https://bit.ly/2AThH0O🎥2ND CHANNEL → https://bit.ly/38Kb6SQ 😀DISCORD → https://bit.ly/2ZXonUcMUSIC → https://bit.ly/3edT2Sc (Kevin MacLeod)→ https://bit.ly/3kdvbVY (Epidemic) OUTRO → https://bit.ly/2DoKefpMODPACK → https://bit.ly/2BQWQM9EDITOR → praduhEMAIL→ nicholas@socksfor1.comFamily Friendly PG Clean 13+","This is my second channel more focused on VR GAMING! All the best virtual reality moments!Editor for others with over 100 million plus views including Samsung USReddit, Twitch, Tiktok, Youtube partner500k subs 11/25/20Instagram https://www.instagram.com/socksfor1/Twitter https://twitter.com/Socksfor1Twitch https://www.twitch.tv/socksfor1","VR Family Family Friendly VR Gaming Oculus Socksfor1 Socksfor2 Virtual Reality Mully Joshdub Eddievr","7Jbtl9JTOHQ"
n9-P89JTHzA,"PLAYING TERRIBLE AMONG US RIP-OFFS","UC-XTuGOHIF7vWvbhJZ56wbw","Socksfor2","20","639.0","https://i.ytimg.com/vi/n9-P89JTHzA/default.jpg","Family Friendly|VR|Gaming|Dank|socksfor2|Socksfor1|among us|among|us|among us 2|among us rip offs|among us knock offs|among us impostor|among us impostor wins|among us gameplay|among us animation|best impostor plays|among us roblox|impostor|among us high iq|among us high iq moments|among us socksfor1|rip offs","today we play different versions of among us that are not that good Previous Video →https://www.youtube.com/watch?v=C1TILeyizPo#amongusFriends in video @Fatmemegod @blazaplays⛏️JOIN SERVER → socks.gg use code Socksfor1 in the item shop ad👽REDDIT → https://bit.ly/3ejZBmf🔴TWITCH → https://bit.ly/3iSmkcq📷INSTAGRAM → https://bit.ly/38KFjRA 🐦TWITTER → https://bit.ly/2Oi0YHC👕NEW MERCH → https://bit.ly/2AThH0O🎥2ND CHANNEL → https://bit.ly/38Kb6SQ 😀DISCORD → https://bit.ly/2ZXonUcMUSIC → https://bit.ly/3edT2Sc (Kevin MacLeod)→ https://bit.ly/3kdvbVY (Epidemic) OUTRO → https://bit.ly/2DoKefpMODPACK → https://bit.ly/2BQWQM9EDITOR → praduhEMAIL→ nicholas@socksfor1.comFamily Friendly PG Clean 13+","This is my second channel more focused on VR GAMING! All the best virtual reality moments!Editor for others with over 100 million plus views including Samsung USReddit, Twitch, Tiktok, Youtube partner500k subs 11/25/20Instagram https://www.instagram.com/socksfor1/Twitter https://twitter.com/Socksfor1Twitch https://www.twitch.tv/socksfor1","VR Family Family Friendly VR Gaming Oculus Socksfor1 Socksfor2 Virtual Reality Mully Joshdub Eddievr","7Jbtl9JTOHQ"
TOsB7brss3c,"among us NEW GOD MODE (overpowered mods)","UClqbG3xJmmQRWQIBPZV6s7A","FatMemeGod","20","551.0","https://i.ytimg.com/vi/TOsB7brss3c/default.jpg","fatmemegod|fatmemegod among us|fatmemegod mods|socksfor1|among us|among us mods|among us terminator mod|among us but the impostor is a god|among us but the impostor can teleport anywhere|among us but you go invisible|among us but you can shape shift into anyone|among us but the impostor can freeze time|among us but you can drag bodies|among us NEW GOD MODE|overpowered among us mods|among us GOD MODE|trolling fatmemegod|trolling fatmemegod in minecraft|fun","today we play among us with GOD MODE! We gave the impostor (terminator) all the abilities: shapeshift (morph), teleport, invisibility, time stop, walk through walls, and even drag bodies. It was soo much fun! Watch my previous video here: https://www.youtube.com/watch?v=kvQiDSvZKFkFriends in this video:@Socksfor1 @Blaza Plays @Joocie @Nadwe @Laff @TbhHonest thumbnail artist: https://twitter.com/Sikuto7MUSIC: https://bit.ly/3edT2Sc (Kevin MacLeod)              https://bit.ly/3kdvbVY (Epidemic)In this video, I  got some insane among us plays, and I even got 2 big brain impostor wins in this video! It's safe to say that these mods are super overpowered. This was so fun, awesome, poggers and cool! NEW FUNNIEST AMONG US MOD EVER!!!the person who did my face reveal btw lol: https://www.fiverr.com/santabai_isback#amongus#mod","SUBSCRIBE TO JOIN DA UNDER 300K SQUAD!!! 🔥🔥----------------------------------------------------------------------------------------------------------------------------------------------------------------------------------------------------------------------------♦️ Follow me on twitter: @FatMemeGod♦️ Follow me on tik tok: @fatmemegod_🥳 Milestones 🥳    💎 1k: January 20 2019    💎 2k: May 31 2020    💎 3k: June 26 2020    💎 4k: August 7 2020    💎 5k: August 23 2020    💎 10k: October 6 2020    💎 20k: November 6, 2020    💎 30k: November 19, 2020    💎 40k: November 25, 2020    💎 50k: December 1, 2020    💠 100k: December 29, 2020    💠 200k: January 16, 2021","meme funny FatMemeGod socksfor1 dankmemes funny moments socksfor2 fat meme god socksfor1 funny blaza funny edit memes fat meme socks for 1 socks for 2 funny co op games socksfor2 funny moments fatmemegod funny moments fatmemegod funny fat meme god channel","7Jbtl9JTOHQ"
GCn0FwNObq0,"MINECRAFT *PRO* vs MOST *SECURE SAFE HOUSE*  (Largest Minecraft modpack)","UCsEgeyBfOnGGBpjIvkDJbWg","Socksfor1","20","868.0","https://i.ytimg.com/vi/GCn0FwNObq0/default.jpg","Socksfor1|minecraft safe house|socksfor1 modpack|socksfor1 but i downloaded every single mod|minecraft safe house tutorial|minecraft safe house vs fans|minecraft safe house unspeakable|minecraft mods|minecraft best safe house|best safest house in minecraft|best modded safehouse minecraft|minecraft security camera|minecraft security craft|socksfor1 modded minecraft","A minecraft pro vs the ultimate safe house in modded minecraftLAST VIDEO►https://www.youtube.com/watch?v=172CbB5HsOQMERCH► https://teespring.com/stores/socksfor1-merchSOCKSFOR2► https://www.youtube.com/channel/UC-XTuGOHIF7vWvbhJZ56wbwTWITTER► https://www.twitter.com/Socksfor1 TIKTOK► http://vm.tiktok.com/dQ5p6m/TWITCH► https://www.twitch.tv/socksfor1DISCORD ► https://discord.gg/AUxGJkUINSTAGRAM ►https://www.instagram.com/socksfor1/GET YOUR OWN MINECRAFT SERVER (APEX PRO HOSTING) ►https://billing.apexminecrafthosting.com/aff.php?aff=2199MUSIC►Kevin MacLeod (https://www.youtube.com/user/kmmusic)outro song► https://www.youtube.com/user/GabzitoHDediting help►praduh #Minecraft#ModEMAIL► nicholas@socksfor1.comThis video is intended for 13+ year olds because of game violence and advanced humor","I do it all! Editor for others with over 100 million plus views including Samsung USReddit, Twitch, Tiktok, Youtube partnerInstagram https://www.instagram.com/socksfor1/Twitter https://twitter.com/Socksfor1Twitch https://www.twitch.tv/socksfor1#1 trending - 10/29/201000 Subs- 2/16/182000 Subs- 7/7/183000 Subs-10/9/185000 Subs-11/22/1810000 Subs-12/10/1825000 Subs-12/27/1850000 Subs 3/13/19100000 Subs 4/25/19500000 Subs 10/31/191000000 Subs 2/25/202000000 Subs 10/21/203000000 Subs 1/1/21","Sockfor1 Fortnite Minecraft Family Friendly 13+ VR Virtual Reality Dank Memes Dank","7Jbtl9JTOHQ"
nINihtcisUk,"Minecraft BUT we can't call items by their actual name","UCXzNUzXm8LVwh7IfBmhIb6A","Socksfor3","22","304.0","https://i.ytimg.com/vi/nINihtcisUk/default.jpg","dream minecraft|minecraft but|minecraft challenge|Minecraft BUT we can't call items by their actual name|minecraft socksfor1|socksfor3 minecraft|socksfor1 mods|socksfor1 largest modpack|socksfor1 but I download every single mod","minecraft but if we name any minecraft thing but its actual name the video endsLEAVE UR IDEAS BUT IT MUST HAVE THE WORD BUT IN ITPrevious Video →#MinecraftFriends in video @Fatmemegod @blazaplays ⛏️JOIN SERVER → socks.gg use code Socksfor1 in the item shop ad👽REDDIT → https://bit.ly/3ejZBmf🔴TWITCH → https://bit.ly/3iSmkcq📷INSTAGRAM → https://bit.ly/38KFjRA 🐦TWITTER → https://bit.ly/2Oi0YHC👕NEW MERCH → https://bit.ly/2AThH0O🎥2ND CHANNEL → https://bit.ly/38Kb6SQ 😀DISCORD → https://bit.ly/2ZXonUcMUSIC → https://bit.ly/3edT2Sc (Kevin MacLeod)→ https://bit.ly/3kdvbVY (Epidemic) OUTRO → https://bit.ly/2DoKefpMODPACK → https://bit.ly/2BQWQM9EDITOR → praduhEMAIL→ nicholas@socksfor1.comFamily Friendly PG Clean 13+","I play games ","","7Jbtl9JTOHQ"
PXejYZPhem4,"I Troll BadBoyHalo with A Confusing Minecraft Mod","UCzMjRlKVO9XIqH_crIFpi6w","Skeppy","20","727.0","https://i.ytimg.com/vi/PXejYZPhem4/default.jpg","minecraft|mine craft|minecraft youtuber|pg|family friendly|skeppy|minecraft skeppy|no swearing|no cursing|minecraft trolling|minecraft troll|funny minecraft|minecraft mod|minecraft map|parkour|trolling|troll|roleplay|custom|challenge|glitch moments|skeppy face|try not to laugh|bedwars|skywars|hypixel|dream smp|badboyhalo|cursed|cursed minecraft|minecraft house|portal mods","Skeppy makes BadBoyHalo change his perspective. This was amazing.Follow My Twitter - @SkeppyFollow My Instagram - @SkeppyToday I took BadBoyHalo on a tour of my home on the new Minecraft Server Update LMAO. BadBoyHalo gets lost and I have to save him (as usual), I show off my bedroom, mirror room and my farm and I think he got scared? He refuses to come to my house now? Bad absolutely lost his mind this video so if this gets 100,000 likes I might let him out of the simulation (or you could say: Bad absolutely lost his mind this video so if this does not get 100k likes may all your servers be CURSED)Not Minecraft, But Water Rises or Minecraft, But Lava Rises, or any other but challenge like that. This is me pushing Bad to the edge of insanity.","Skeppy - friendly and fun gaming content! :D I pretty much upload content such as Minecraft Trolling, Minecraft Hypixel and other Minecraft maps and games.don't take my videos too seriously, they're mostly just a joke or skits","","7Jbtl9JTOHQ"
0RFLsQ5LrVA,"ASSERTING MY DOMINANCE (Bad Boys at School)","UC-XTuGOHIF7vWvbhJZ56wbw","Socksfor2","20","592.0","https://i.ytimg.com/vi/0RFLsQ5LrVA/default.jpg","Family Friendly|VR|Gaming|Dank|socksfor2|Socksfor1|bad guys at school game|funny game|goat simulator|broken physics|game phsics|school simulator|simulator game|school|school game|funniest|multiplayer|sharks|throwing sharks to assert my domiance","Previous Video →https://www.youtube.com/watch?v=jbQ3qgUySnA#badboysatschoolFriends in video @Fatmemegod @blazaplays⛏️JOIN SERVER → socks.gg use code Socksfor1 in the item shop ad👽REDDIT → https://bit.ly/3ejZBmf🔴TWITCH → https://bit.ly/3iSmkcq📷INSTAGRAM → https://bit.ly/38KFjRA 🐦TWITTER → https://bit.ly/2Oi0YHC👕NEW MERCH → https://bit.ly/2AThH0O🎥2ND CHANNEL → https://bit.ly/38Kb6SQ 😀DISCORD → https://bit.ly/2ZXonUcMUSIC → https://bit.ly/3edT2Sc (Kevin MacLeod)→ https://bit.ly/3kdvbVY (Epidemic) OUTRO → https://bit.ly/2DoKefpMODPACK → https://bit.ly/2BQWQM9EDITOR → praduhEMAIL→ nicholas@socksfor1.comFamily Friendly PG Clean 13+","This is my second channel more focused on VR GAMING! All the best virtual reality moments!Editor for others with over 100 million plus views including Samsung USReddit, Twitch, Tiktok, Youtube partner500k subs 11/25/20Instagram https://www.instagram.com/socksfor1/Twitter https://twitter.com/Socksfor1Twitch https://www.twitch.tv/socksfor1","VR Family Family Friendly VR Gaming Oculus Socksfor1 Socksfor2 Virtual Reality Mully Joshdub Eddievr","7Jbtl9JTOHQ"
7_7y8GZosQM,"DON’T Dig Straight Down in Realistic Minecraft.. (Teardown)","UCfLuMSIDmeWRYpuCQL0OJ6A","Kwebbelkop","20","487.0","https://i.ytimg.com/vi/7_7y8GZosQM/default.jpg","funny|moments|comedy|challenge|fun|entertainment|kwebbelkop|funny videos|KOP|kwebbelkops|kweb|minecraft modded|minecraft teardown|minecraft dig straight down","DON’T Dig Straight Down in Realistic Minecraft (Teardown)What happens when you dig straight down in this super REALISTIC MODDED version of MINECRAFT?👕 Exclusive KWEBBELKOP Merch: http://kops.com/🐯 Check Out Tiger's Channel:https://www.youtube.com/channel/UC7ee3opL79Ha9IW2FDKkSbg😎 Check out James/Typo's Socials:https://www.instagram.com/therealtypo/https://www.youtube.com/c/TypoReal 🤗 Become a Member! https://www.youtube.com/channel/UCfLuMSIDmeWRYpuCQL0OJ6A/join🎮 MY GEARMy Capture Card! http://e.lga.to/Kwebbelkop🎵 CREDITSCan't Stop Won't Stop - Mighty & Highhttps://www.youtube.com/watch?v=ZPi3ZtReWBw","Welcome to my channel. My name is Kwebbelkop or Jordi. I'm an English speaking YouTuber! I like making videos and I love to do silly stuff. I love playing games with my friends and interacting with my KOPS! I upload at least 1 video every single day at the exact same time.  I love watching funny videos, seeing amazing animations, and enjoying family friendly content. If you enjoy amazing videos. you have come to the right place!Sponsored by Elgato! http://e.lga.to/Kwebbelkop","kwebbelkop jelly slogoman gaming games funny moments reaction child friendly minecraft tiger gta 5","7Jbtl9JTOHQ"
