video_id,title,channelId,channelTitle,categoryId,duration,thumbnail_link,tags,description,channel_desc,channel_keywords,related_vid_id
9S-pb79-0kw,"When your coach refuses to put you in the game","UCrA2bqOHwjX1DxgP9CaVJzw","Lenarr Young","23","290.0","https://i.ytimg.com/vi/9S-pb79-0kw/default.jpg","Lenarr|Lenarr Young|lennarr|lenarryoung|lenar|lanar|lanarr|young|skit|skits|comedy|creator|funny","The first 1000 people to click this link will get a free trial of Skillshare Premium Membership: https://skl.sh/lenarryoung12201 Follow me on:Twitter: https://twitter.com/lenarr_?lang=enInstagram: https://www.instagram.com/lenarr___/?hl=en","Im here to make you laugh / business email - Lenarr@viralnation.comInstagram - Lenarr___Twitter - Lenarr_ZD5GVJ","","ELQmwf0uUVQ"
PamSNCe1oP0,"When you accidentally say you too after you say thank you","UCrA2bqOHwjX1DxgP9CaVJzw","Lenarr Young","23","195.0","https://i.ytimg.com/vi/PamSNCe1oP0/default.jpg","Lenarr|Lenarr Young|lennarr|lenarryoung|lenar|lanar|lanarr|young|skit|skits|comedy|creator|funny","Follow me on:Twitter: https://twitter.com/lenarr_?lang=enInstagram: https://www.instagram.com/lenarr___/?hl=en","Im here to make you laugh / business email - Lenarr@viralnation.comInstagram - Lenarr___Twitter - Lenarr_ZD5GVJ","","ELQmwf0uUVQ"
oqLCDHjQxEQ,"In a Zombie apocalypse...","UCI1XS_GkLGDOgf8YLaaXNRA","CalebCity","23","276.0","https://i.ytimg.com/vi/oqLCDHjQxEQ/default.jpg","[none]","Sponsored by ExpressVPN Go to https://expressvpn.com/calebcity to find out how to get 3 months free.Against actual zombies I'm scrapping 😤Musicàlune - Organic https://soundcloud.com/dansuneroquette/organicOddwin - 19","","","ELQmwf0uUVQ"
otOGmTQ4rBI,"When Walmart cancels your PS5 order","UCrA2bqOHwjX1DxgP9CaVJzw","Lenarr Young","23","401.0","https://i.ytimg.com/vi/otOGmTQ4rBI/default.jpg","Lenarr|Lenarr Young|lennarr|lenarryoung|lenar|lanar|lanarr|young|skit|skits|comedy|creator|funny","Follow me on:Twitter: https://twitter.com/lenarr_?lang=enInstagram: https://www.instagram.com/lenarr___/?hl=en","Im here to make you laugh / business email - Lenarr@viralnation.comInstagram - Lenarr___Twitter - Lenarr_ZD5GVJ","","ELQmwf0uUVQ"
52oCe9FPaxc,"When its Christmas and you're the oldest #weirdturn #plottwist #comedy #skits #comedyskits","UCG8wB0fPb3wU1A4cSoDcslQ","Dez2fly","20","262.0","https://i.ytimg.com/vi/52oCe9FPaxc/default.jpg","dez2fly comedy|dez2fly tiktok|dez2fly comedy skits|dez2fly skits|skits|comedy|tiktok compilation|dez2fly complilation|longbeachgriffey|lenarr|hardstoplucas|christmas|oldest at christmas|when its Christmas and you|christmas skits|when your the oldest in the house on christmas|funny Christmas skits|comedy Christmas skits","instagram: Dez2flyTiktok: Dez2fly","Instagram: Dez2fly","","ELQmwf0uUVQ"
TGZgXgPnflM,"When Roddy Ricch was recording The Box","UCrA2bqOHwjX1DxgP9CaVJzw","Lenarr Young","23","93.0","https://i.ytimg.com/vi/TGZgXgPnflM/default.jpg","Lenarr|Lenarr Young|lennarr|young|skit|skits|comedy|creator|funny|2019","Song - Roddy Rich - The BoxFollow me on:Twitter: https://twitter.com/lenarr_?lang=enInstagram: https://www.instagram.com/lenarr___/?hl=en","Im here to make you laugh / business email - Lenarr@viralnation.comInstagram - Lenarr___Twitter - Lenarr_ZD5GVJ","","ELQmwf0uUVQ"
9SK1I0V6U5c,"Lie Detector | Anwar Jibawi","UCEr55381WIqO1w_IzgcI5DQ","Anwar Jibawi","23","358.0","https://i.ytimg.com/vi/9SK1I0V6U5c/default.jpg","lie detector|anwar|jibawi|lie|detector|how girls act in horror movies|membership qa 3|bathroom buddies|thats my sister|How Girls Act in Horror Movies|lelepons|hannahstocking|rudymancuso|shots|shotsstudios|alesso|anitta|brazil","WATCH MORE ► https://youtube.com/playlist?list=PLbNDd5uPifopbYqGU2CX7_DNdQFutazzbSUBSCRIBE ► https://youtube.com/channel/UCEr55381WIqO1w_IzgcI5DQ?sub_confirmation=1-----------------------------------------------------------FIND ME ON: Instagram | http://instagram.com/anwarTwitter | http://twitter.com/anwarFacebook | https://facebook.com/anwarTikTok | https://vm.tiktok.com/XjFcDpMerch | https://lilshop.comText Me | https://my.community.com/anwarjibawiCAST:Anwar Jibawi | http://youtube.com/c/anwarAlpha Cat | https://youtube.com/alphacatAlessandro Chillé | https://instagram.com/alessandrochilleactorWE HIT 500 VIDEOS WITH OVER 1 MILLION VIEWS ▶ https://youtu.be/VOzQW_fff5AShots Studios Channels:@Anwar Jibawi @Awkward Puppets @Delaney Glazer @Hannah Stocking @Juanpa Zurita @Lele Pons @Rudy Mancuso @Shots Studios @Shots Studios Kids #Anwar#AnwarJibawi#Alphacat","NEW VIDEOS EVERY WEEK! Make sure you SUBSCRIBE!Part of the Shots Studios family.","lele pons rudy mancuso anwar jibawi delaney glazer awkward puppets shots studios hannah stocking juanpa zurita cash baker maverick baker lil shop shots","ELQmwf0uUVQ"
GPDizjHUHow,"Lenarr Young - When the teacher can't pronounce your name (Try Not To Laugh)","UCg9w2x6EYbcxGiLeh8UTMdQ","InTheClutch Ent","24","438.0","https://i.ytimg.com/vi/GPDizjHUHow/default.jpg","intheclutch|freevideo|video|laughs|jokes|clutchsquad|reactions|intheclutchent|Lenarr|Lenarr Young|lennarr|lenarryoung|lenar|lanar|lanarr|young|skit|skits|comedy|creator|funny|intheclutch ent","ORIGINAL VIDEO: https://www.youtube.com/watch?v=ELQmwf0uUVQ&pbjreload=101THANKS AGAIN FOR WATCHING OUR VIDEO! MAKE SURE YOU SUBSCRIBE TO THE SQUAD. ALSO SUBSCRIBE TO DUB'S AND ROSS VLOG CHANNELSMAKE SURE YOU JOIN OUR PATREON TO GAIN EARLY ACCESS TO ALL OUR VIDEOS, EXCLUSIVE VIDEOS AND DEALS ON UPCOMING MERCH. CHECK THE LINK BELOWhttps://www.patreon.com/intheclutchADUBSLIFE713 - https://www.youtube.com/channel/UCu-nNg2XqM5Zu4Nz_Q6r7AwKICKIN IT WITH ROSS - https://www.youtube.com/user/Wimberley3906Intro graphic made by N3SC4U His Youtube Channel Link Down Below https://www.youtube.com/channel/UCbq1TWfwVLvaX9AE4wQi6qQIntro Song by Kenzal Young - 60 Degrees https://www.youtube.com/watch?v=NpbulTKGg6IIntro Song by CLIZZY HOUSTON - In The Clutch - https://www.youtube.com/watch?v=-LTbDP25IfcOutro Song by SevenSevenThree - Bliss  https://www.youtube.com/watch?v=IgqDt4ZMReQOutro Template made by Grabster - Youtube.com/GrabsterTVALSO FOLLOW US ON INSTAGRAM: @intheclutchent@dubtheg @rossthechosenone Twitter:@dubtheg - https://twitter.com/DubtheG@What_Now_Ross - https://twitter.com/What_Now_RossCheckout some DOPE Music!KENZAL YOUNGhttps://www.youtube.com/channel/UC13UYuuchpdSHrEbC-NiAwgDubtheG: https://soundcloud.com/dub-thegJoel Love: https://soundcloud.com/joel_lovemusicE.T.I.D.23: https://soundcloud.com/etid23","We are a Houston based group who want to share laughs, drama, and skits on not only funny but some serious topics. Subscribe, watch and enjoy the growth of our YouTube Family!","Wrestling Wrestling Reactions Music Reactions Rap Music Try Not To Laughs Challenges Podcast","ELQmwf0uUVQ"
1wpnTQJVcAg,"When the cutscene is WAY too long...","UCdyMFblTjr-C2N-T5TGftQQ","Nathan Doan Comedy","23","287.0","https://i.ytimg.com/vi/1wpnTQJVcAg/default.jpg","Video Games|Cyberpunk|Cyberpunk 2077|GTA 5|GTA|Grand theft auto|Nathan Doan|GTA be like|Cyberpunk be like|Nathan Doan comedy|Video games funny|Comedy|Skit","CyberPunk and GTA basically be like...SUBSCRIBE: https://bit.ly/nathandoanMORE: https://www.youtube.com/watch?v=grVED...","Follow me on Instagram for behind the scenes @NathanDoan. For instant updates, check out my social media accounts below!","Asian Ging Ging Comedy Skits Dez Petah Harold Vietnam","ELQmwf0uUVQ"
9wGtO5UXQaI,"When you can respawn in real life","UCrA2bqOHwjX1DxgP9CaVJzw","Lenarr Young","23","238.0","https://i.ytimg.com/vi/9wGtO5UXQaI/default.jpg","Lenarr|Lenarr Young|Lennar|LenarrYoung|Zac|Lenar|Lanarr|Young|Skit|Skits|Comedy","Intro; Ball out - been ballin- https://www.youtube.com/watch?v=vTa204WsZB0UCwbu...Outro - Chief Keef - citgo - https://youtu.be/FE5rpTDoUx0Follow me on:Twitter: https://twitter.com/lenarr_?lang=enInstagram: https://www.instagram.com/lenarr___/?hl=enTwitch - https://www.twitch.tv/yaboylenarrTumblr: http://lenarr.tumblr.com","Im here to make you laugh / business email - Lenarr@viralnation.comInstagram - Lenarr___Twitter - Lenarr_ZD5GVJ","","ELQmwf0uUVQ"
Toa6Oea01qk,"The first person to suggest mail by pigeon.","UCI1XS_GkLGDOgf8YLaaXNRA","CalebCity","23","305.0","https://i.ytimg.com/vi/Toa6Oea01qk/default.jpg","comedy|calebcity","Fun fact tho, they used to call mail people 'couriers' and horses were used centuries before pigeons... but not in this sketch 🤫 MusicTek.Lun - DANCIN ALL JOLLY LIKE","","","ELQmwf0uUVQ"
FzkwV0EslZA,"will you laugh or will you not laugh?","UC9BMWLruGWsr1nTzFqmMfHw","The Meme Sheep","23","639.0","https://i.ytimg.com/vi/FzkwV0EslZA/default.jpg","dank|dank memes|dank memes compilation|dankest memes|meme compilation|dank comp|funny dank|dankest memes compilation|try not to laugh|try not to laugh challenge|memes|meme|funny|funny videos|ylyl|you laugh you lose|tntl|you laugh you lose challenge|funny memes|best memes|memes compilation|tik tok memes|memes that|fresh memes|dank compilation|memesheep|will you laugh|try not to laugh impossible|don't laugh|don't laugh challenge|you laugh|laugh","The Best and Funniest Memes to ever be witnessed.Meme & MemeSheep Merch: http://bit.ly/MemeDrips Code MEMESHEEP For 10% OFF Orders Over $99Anime Merch: https://bit.ly/TheMemeSheepAnimeMerchYour comments may also be featured on TheFunnySheep:▶ https://www.youtube.com/channel/UCToL81nQ6MqKeRK9n-r4howTheMemeSheep is more than a meme channel.My mission is to make your days better and make you laugh at the freshest,dankest,funniest meme compilations ever to be witnessed by the human eye.It is scientifically proven that these meme compilations cure depression around the world, every single day.Leave a like and subscribe with notifications on for the funniest videos, best memes.Don't forget to leave your funny comments to be featured in my videos.Deleted 90 million views worth of videos(rip)🎥 CREDITS FOR THIS VIDEOhttps://pastebin.com/u672iRXW-----▶ FOLLOW ◀-----🌍 TikTok: https://www.tiktok.com/@thememesheepyt🌍 INSTAGRAM: https://www.instagram.com/thememesheeps/ 🌍 TWITTER: https://twitter.com/TheMemeSheep1📩 thememesheep@gmail.com - for business 🌈🐑Copyright Disclaimer, Under Section 107 of the Copyright Act 1976, allowance is made for 'fair use' for purposes such as criticism, comment, news reporting, teaching, scholarship, and research. Fair use is a use permitted by copyright statute that might otherwise be infringing. Non-profit, educational or personal use tips the balance in favor of fair use.#memes #dankmemes #funny #thememesheep","dank sheep descends upon mere mortals to grant them the everlasting knowledge bestowed upon him from centuries of being dank.deleted like 100 million views worth of videosbusiness/partnership : thememesheep@gmail.com","dank memes meme dank memes thememesheep meme sheep funny memes new memes meme compilation dank memes compilation funniest memes daily memes clean memes reddit memes best memes memes that tiktok tiktok compilation you laugh you lose ylyl ultimate dank memes memes 2021 best memes compilation perfectly cut screams perfectly cut screams compilation","ELQmwf0uUVQ"
EV8f53c8FgI,"When eating ketchup takes a weird turn. #weirdturn #dez2fly","UCG8wB0fPb3wU1A4cSoDcslQ","Dez2fly","23","267.0","https://i.ytimg.com/vi/EV8f53c8FgI/default.jpg","ketchup dez2fly|dez2fly ketchup|dez2fly eating ketchup|dez2fly when eating ketchup takes|ketchup|weird turn|weird turn dez2fly|dez2fly weird turn|calebcity|lenarr|longbeachgriffey|hardstop lucas","Get 20% OFF + Free international shipping + free gifts @MANSCAPED with promo code DEZ at https://www.manscaped.com#sponsored Instagram: Dez2flyTiktok: Dez2fly","Instagram: Dez2fly","","ELQmwf0uUVQ"
__eozjSut9U,"When the game you're playing has skill based matchmaking","UCrA2bqOHwjX1DxgP9CaVJzw","Lenarr Young","23","152.0","https://i.ytimg.com/vi/__eozjSut9U/default.jpg","Lenarr|Lenarr Young|lennarr|lenarryoung|lenar|lanar|lanarr|young|skit|skits|comedy|creator|funny","Follow me on:Twitter: https://twitter.com/lenarr_?lang=enInstagram: https://www.instagram.com/lenarr___/?hl=en","Im here to make you laugh / business email - Lenarr@viralnation.comInstagram - Lenarr___Twitter - Lenarr_ZD5GVJ","","ELQmwf0uUVQ"
M9hyix5Gv9g,"Starbucks Be Like","UCR9NuNwCUIhMOLUQnLN7_WA","Kyle Exum","23","286.0","https://i.ytimg.com/vi/M9hyix5Gv9g/default.jpg","Starbucks Be Like|Starbucks|Kyle Exum|Kyle|Exum|Kyle Exam|Old Belt Road|Old Town Road parody|Coffee|mama mode|Dad's Plan|Parents be like|Parents|Moms be like|dads plan|kyle exum parody songs|Dunkin Donuts Be Like|Comedy|Funny videos|Apple Be Like|The Reason McDonalds Doesn't Deliver|Mama Mode|Sicko Mode Parody|Dad Catches Me Listening to Mo Bamba by Sheck Wes|TikTok|Lucid Dreams Parody|Ariana Grande|Thank You Next|Dante Williams|Dtay|The Mom Rap|Lol","100,000 Likes and I’ll drop my next video! Thanks for watching! Like, Subscribe and Comment! Become a Channel Member to see sneak peaks of my videos before they’re released, get exclusive live streams, behind the scenes and more!Click below to check it out:https://www.youtube.com/channel/UCR9NuNwCUIhMOLUQnLN7_WA/joinInstagram: http://www.Instagram.com/KyleExumTikTok: Kyle Exum Twitter: http://www.Twitter.com/KyleExumFacebook: http://www.Facebook.com/KyleExumOfficial Merchandise: https://exumerch.com/———————————————————————————For anyone looking to start your own YouTube channel, here’s the equipment I use to make my videos:Camera: https://amzn.to/2szlclaLighting Set-Up: https://amzn.to/2W5KgxSTripod: https://amzn.to/2RXftnnComputer: https://amzn.to/2RWuDJSMicrophone (For Parodies & Raps): https://amzn.to/2T5xDkjCamera Microphone: https://amzn.to/2S59u0d","If you like to laugh, Subscribe to my channel. New Video Every Week!","Kyle Exum Mom Rap Trap 3 Little Pigs Exum Kyle Exam The TikTok Song Kyle Kyle Skits Comedy The Teacher Rap The Grandpa Rap Dad's Plan When Our Generation Gets Old And Hears a Throwback Song The Christmas Mom Rap The Annoying Brother Dante Williams CalebCity Funny Videos Kyle Vine Kyle TikTok TikTokin I Been TikTokin Kyle Exum Parody Songs Kyle Exum Songs Belt Hurts Moms Be Like Dads Be Like rap Mom Vs. Dad Rap Battle Parody Old Belt Road Rap Battle mama mode whooping on my mind","ELQmwf0uUVQ"
wZQPRnsZBck,"When you take school pictures","UCrA2bqOHwjX1DxgP9CaVJzw","Lenarr Young","23","256.0","https://i.ytimg.com/vi/wZQPRnsZBck/default.jpg","Lenarr|Lenarr Young|lennarr|lenarryoung|lenar|lanar|lanarr|young|skit|skits|comedy|creator|funny","Follow me on:Twitter: https://twitter.com/lenarr_?lang=enInstagram: https://www.instagram.com/lenarr___/?hl=en","Im here to make you laugh / business email - Lenarr@viralnation.comInstagram - Lenarr___Twitter - Lenarr_ZD5GVJ","","ELQmwf0uUVQ"
FutTIrFJyo0,"If you learned how to quick save in real life.","UCI1XS_GkLGDOgf8YLaaXNRA","CalebCity","23","183.0","https://i.ytimg.com/vi/FutTIrFJyo0/default.jpg","calebcity|comedy|quicksave","Im quick saving before every purchase I ever make so I could use it before I actually buy it.Music Oddwin - 19","","","ELQmwf0uUVQ"
VboHrvYq5jc,"Me vs literally ANYONE in word games.","UCI1XS_GkLGDOgf8YLaaXNRA","CalebCity","23","253.0","https://i.ytimg.com/vi/VboHrvYq5jc/default.jpg","comedy|calebcity","Everyone I go against knows the entire dictionary and the lore to each word.MusicKing Kaiyo - melodicOddwin - 19","","","ELQmwf0uUVQ"
7MywfkPAxdg,"When 21 savage was recording Dont come out the house","UCrA2bqOHwjX1DxgP9CaVJzw","Lenarr Young","23","166.0","https://i.ytimg.com/vi/7MywfkPAxdg/default.jpg","Lenarr|Lenarr Young|Lennar|LenarrYoung|Lenar|Young|Skit|Skits|Comedy","Song - Metro boomin - don’t come out the house outro - chief keef -  Citgo https://www.youtube.com/watch?v=FE5rpTDoUx0Follow me on:Twitter: https://twitter.com/lenarr_?lang=enInstagram: https://www.instagram.com/lenarr___/?hl=enTwitch - https://www.twitch.tv/yaboylenarrTumblr: http://lenarr.tumblr.com","Im here to make you laugh / business email - Lenarr@viralnation.comInstagram - Lenarr___Twitter - Lenarr_ZD5GVJ","","ELQmwf0uUVQ"
hsJXyABfQjs,"Waiting in line for the best roller coaster at a theme park","UCrA2bqOHwjX1DxgP9CaVJzw","Lenarr Young","23","176.0","https://i.ytimg.com/vi/hsJXyABfQjs/default.jpg","Lenarr|Lenarr Young|lennarr|lenarryoung|lenar|lanar|lanarr|young|skit|skits|comedy|creator|funny","Follow me on:Twitter: https://twitter.com/lenarr_?lang=enInstagram: https://www.instagram.com/lenarr___/?hl=en","Im here to make you laugh / business email - Lenarr@viralnation.comInstagram - Lenarr___Twitter - Lenarr_ZD5GVJ","","ELQmwf0uUVQ"
bY6si6F4eMw,"People destroy anything when they rage","UCrA2bqOHwjX1DxgP9CaVJzw","Lenarr Young","23","202.0","https://i.ytimg.com/vi/bY6si6F4eMw/default.jpg","Lenarr|Lenarr Young|lennarr|lenarryoung|lenar|lanar|lanarr|young|skit|skits|comedy|creator|funny","Follow me on:Twitter: https://twitter.com/lenarr_?lang=enInstagram: https://www.instagram.com/lenarr___/?hl=en","Im here to make you laugh / business email - Lenarr@viralnation.comInstagram - Lenarr___Twitter - Lenarr_ZD5GVJ","","ELQmwf0uUVQ"
qU10OJTpCLk,"The friend that ACTUALLY gives you the wifi password","UCI1XS_GkLGDOgf8YLaaXNRA","CalebCity","23","242.0","https://i.ytimg.com/vi/qU10OJTpCLk/default.jpg","[none]","We actually just came up with this on the spot.w/LongBeachGriffy - https://www.youtube.com/channel/UCWiY6fYdxuEe78r-0uFCnhALenarr - https://www.youtube.com/channel/UCrA2bqOHwjX1DxgP9CaVJzw","","","ELQmwf0uUVQ"
b_E24sOb838,"This kid accidentally broke a window - his mum is NOT going to be happy when she finds out...","UCa4iGdyiyTjZcPF4TxsL1UQ","Jovan YN","24","154.0","https://i.ytimg.com/vi/b_E24sOb838/default.jpg","This kid accidentally broke a window - his mum is NOT going to be happy when she finds out...|A Bit Of Everything|HaroldHilton22|breaks window|broke window|4m views|scared|roasted|funny|snapchat|693558257494349|821370291379811|fb|facebook|twitter|tweet|sc|story|black|ass beat|black mom|mum|mom|mother|african|american|rip","😂😂😂Via: Twitter.com/HaroldHilton22Like & Subscribe For More!!","Business Enquiries: jovansanyasi@gmail.com","jovan","ELQmwf0uUVQ"
SNU8wlN_3V8,"A regular Shark Tank episode","UCrA2bqOHwjX1DxgP9CaVJzw","Lenarr Young","23","449.0","https://i.ytimg.com/vi/SNU8wlN_3V8/default.jpg","Lenarr|Lenarr Young|lennarr|lenarryoung|lenar|lanar|lanarr|zac|zack|zach|young|instagram|skit|skits|comedy|creator|funny|2019|vine|viner","Follow me on:Twitter: https://twitter.com/lenarr_?lang=enInstagram: https://www.instagram.com/lenarr___/?hl=en","Im here to make you laugh / business email - Lenarr@viralnation.comInstagram - Lenarr___Twitter - Lenarr_ZD5GVJ","","ELQmwf0uUVQ"
ut9JQq3X3VY,"When A restaurant only has Off Brand Drinks","UC4G10tk3AHFuyMIuD3rHOBA","RDCworld1","23","134.0","https://i.ytimg.com/vi/ut9JQq3X3VY/default.jpg","[none]","Man everybody know about these type of restaurants they always got the wrong drinks!Follow us on social media!@supremedreams_1@rdcworld1Also we go live on twitch all the time!Twitch.tv/rdcgaming","RDCworld1 is all about making our fans laugh. We provide entertainment through skits, vlogs, short films, and more. Therefore, if you come across this channel please join our world and leave feedback!Anticipating rain, I can't make the same mistakes again.We hope to make it to 5,000,000 subscribers now! And even quicker than it took to get to 3,000,000! Thank you for all of y'alls support!After reaching 1 million subscribers I feel like a Great mission has been accomplished, but when one mission ends another begins...Check out our shop! https://www.rdcworld1.com/shopRDCworldPO Box 6124Round Rock, TX 78683","Rdcworld1 Comedy Vlogs Skits Entertainment Rdcworld Anime SupremeDreams RDC","ELQmwf0uUVQ"
4Vptr-EDdAg,"TYPES OF RAPPERS IN THE STUDIO","UCyoEZ7icpGsUlki08Is8v9g","loveliveserve","24","366.0","https://i.ytimg.com/vi/4Vptr-EDdAg/default.jpg","Loveliveserve|lls|love live serve|Noah boat|rhino|comedy|skit|music|rapping|reactions|hip hop|rap|parody|prank|funny|blasting music in library|playing music in library|library prank|types of rappers|types of people at school|types of teachers|types of slimes|types of girlfriends|types of boyfriends|funny songs|when the music video does not match the song|when the music video doesnt match the song|blasting inappropriate music|types of aux cord users|zeze|blueface","Watch More BEST OF LoveLiveServe: http://bit.ly/BESTOFLoveLiveServeSubscribe to LoveLiveServe: https://www.youtube.com/user/loveliveserve?sub_confirmation=1WATCH OUR VLOGS HERE: https://www.youtube.com/channel/UCyLLL4Al34gr3XH2_h4db5gGET LLS MERCH BELOW!http://bit.ly/LLSMerchBOOK US ON CAMEO:⇨https://www.cameo.com/rhino17⇨https://www.cameo.com/noahboat_FOLLOW US ON SOCIAL MEDIA:Noah Boat:⇨IG- https://www.instagram.com/noahboat_⇨Twitter- https://twitter.com/noahboat_Rhino:⇨IG- https://www.instagram.com/rhino_⇨Twitter- https://twitter.com/ryaburtonLLS Snapchat⇨http://bit.ly/LLSsnapchatLoveLiveServe:⇨IG- https://www.instagram.com/loveliveserve⇨TikTok- https://www.tiktok.com/@loveliveserve⇨FB- https://www.facebook.com/loveliveservevideosFor business contact, email us at brian.sokolik@authenticm.comAbout LoveLiveServe:Wuz Goodie! Welcome to LoveLiveServe! We go by Noah Boat & Rhino and we have a passion for making relatable and entertaining video content. We produce a variety of material on this channel that is suitable for a wide range of audiences. We look forward to creating a lot more videos for you guys!TYPES OF RAPPERS IN THE STUDIOhttps://www.youtube.com/watch?v=4Vptr-EDdAgLoveLiveServehttps://www.youtube.com/loveliveserve","Wuz Goodie! Welcome to LoveLiveServe! We go by Rhino & Noah Boat. We have a passion for making relatable and entertaining video content. We produce a variety of material on this channel that is suitable for a wide range of audiences. We look forward to creating a lot more videos for you guys!For business contact, email us at brian.sokolik@authenticm.com","Loveliveserve lls love live serve Noah boat rhino comedy skit music rapping reactions hip hop rap parody prank rappers funny songs blasting music in library playing music in library library prank","ELQmwf0uUVQ"
bye1_FpfVPU,"The Kahoot Rap (Kahoot Star)","UCR9NuNwCUIhMOLUQnLN7_WA","Kyle Exum","23","341.0","https://i.ytimg.com/vi/bye1_FpfVPU/default.jpg","The Kahoot Rap|Kahoot Star|Kyle Exum|When Our Generation Gets Old and Hears a Throwback Song|Kahoot! Star|Kahoot!|Kahoot trap|Trap Kahoot|Trap Kahoot Song|Kyle|Exum|Kyle Exam|If Social Media Apps Were People|Kahoot song|The Kahoot Song|I'm a Kahoot Star|And I'm winning|And there's something bout this music hitting different|Kyle Exum Raps|Kyle Rap|The Mom Rap|Trap 3 Little Pigs|Mama Mode|When Our Generation Gets Old|Vine|Kahoot TikTok|TikTok Kahoot","250,000 Likes and I’ll Drop my Next Video Early!Thanks for Watching! Like, Subscribe and Comment! 500,000 Likes and I’ll respond to every comment up until the 500K markThe Kahoot Rap (Kahoot Star) Is Now Available on All Streaming Networks! Stream it Up!: https://fanlink.to/TheKahootRapSpotify: https://open.spotify.com/album/2NxDANS8CDkshIeH3T0CU1?si=qUu4iAxZQ9KCiED7ouGuGAApple Music: https://music.apple.com/us/album/the-kahoot-rap-kahoot-star-single/1542306849YouTube Music: https://music.youtube.com/watch?v=1MW0F3d6N38&feature=shareiTunes: https://music.apple.com/us/album/the-kahoot-rap-kahoot-star-single/1542306849SoundCloud: https://soundcloud.com/kyleexum/the-kahoot-rap-kahoot-starTidal: https://tidal.com/album/163981723Deezer: https://deezer.page.link/zQ67HGiFjMPvbhjq5Text Me! +1 (860) 385-62952090 Merch Available Now!: https://montlaurel.com/products/mont-laurel-x-kyle-exum-collab-t-shirt?_pos=1&_sid=26016b9e4&_ss=rProd. by Ricky Desktop. Check his Channel Out: https://www.youtube.com/channel/UCWDXOdjAOXU2YYRbCmQvrYAThe Kahoot! Lobby Tune is composed and produced by Alf Inge Wang”.Follow My Social Media:Instagram: http://www.Instagram.com/KyleExumTikTok: Kyle Exum Twitter: http://www.Twitter.com/KyleExumFacebook: http://www.Facebook.com/KyleExumOfficial Apple Music:  https://music.apple.com/us/artist/kyle-exum/956157064Spotify:  https://open.spotify.com/artist/6EYpuJIDJshhN4CHCg43te?si=8ggbOm3rSAuRSwag2MV9iwStream my “Trap 3 Little Pigs” Song: https://fanlink.to/Trap3LittlePigsApple Music:  https://music.apple.com/us/album/trap-3-little-pigs-single/1468734263Spotify: https://open.spotify.com/track/3WoHA0OFlzXofpKnblSFmr?si=QVTzn8XmQ3ipfH1Wpce1JgSoundCloud: http://www.soundcloud.com/kyleexumYou can Buy my Trap 3 Little Pigs Book Here: Trap 3 Little Pigs (Lyrically Accurate Version): https://amzn.to/30qvtzdTrap 3 Little Pigs (Young Readers Version): https://amzn.to/2LGEG2aStream my “The Exum Household” Album: https://fanlink.to/TheExumHouseholdBusiness Email: kyleexum@select.coMerchandise: https://exumerch.com/———————————————————————————For anyone looking to start your own YouTube channel, here’s the equipment I use to make my videos:Camera: https://amzn.to/2szlclaLighting Set-Up: https://amzn.to/2W5KgxSTripod: https://amzn.to/2RXftnnComputer: https://amzn.to/2RWuDJSMicrophone (For Parodies & Raps): https://amzn.to/2T5xDkjCamera Microphone: https://amzn.to/2S59u0d","If you like to laugh, Subscribe to my channel. New Video Every Week!","Kyle Exum Mom Rap Trap 3 Little Pigs Exum Kyle Exam The TikTok Song Kyle Kyle Skits Comedy The Teacher Rap The Grandpa Rap Dad's Plan When Our Generation Gets Old And Hears a Throwback Song The Christmas Mom Rap The Annoying Brother Dante Williams CalebCity Funny Videos Kyle Vine Kyle TikTok TikTokin I Been TikTokin Kyle Exum Parody Songs Kyle Exum Songs Belt Hurts Moms Be Like Dads Be Like rap Mom Vs. Dad Rap Battle Parody Old Belt Road Rap Battle mama mode whooping on my mind","ELQmwf0uUVQ"
