video_id,title,channelId,channelTitle,categoryId,duration,thumbnail_link,tags,description,channel_desc,channel_keywords,related_vid_id
gMTboyvzcdI,"Mini Ladd Doesn't Deserve A Second Chance (my thoughts)","UCM90gMiLPlVnhSLhrdF_MZA","SoCloseToToast","24","1491.0","https://i.ytimg.com/vi/gMTboyvzcdI/default.jpg","Mini Ladd Doesn't Deserve A Second Chance reaction|Mini Ladd Doesn't Deserve A Second Chance|Mini Ladd Doesn't Deserve A Second Chance (my thoughts)|mini ladd drama 2020|mini ladd quits|mini ladd leaves youtube|mini ladd|mini ladd youtube drama|mini ladd allegations|mini ladd documentary|soclosetotoast reacts|soclosetotoast|vanossgaming|wildcat|h20delirious|terroriser vs mini ladd|terroriser|mini ladd girlfriend|mini ladd minors|mini ladd abuse|mini ladd reaction","🍞 Subscribe & Hit that Bell! 🔔BUY SOME MERCH to Support the Channel!: https://www.bonfire.com/store/soclosetotoast/I have no words to say about how I feel about this. I waited a while to watch anything on this. Its so dark and goes so much further than I ever imagined. What are your thoughts?Thank you for tuning into my reaction videos! Be sure to drop a like and a comment of other videos you want me to check out! Thank you for all the support and love!@Prison Mate Luke OG Video: https://www.youtube.com/watch?v=PRSV_yShSyQ&t=609s&ab_channel=PrisonMateLuke-SUBSCRIBE NOW-  \https://www.youtube.com/user/soclosetotoast?sub_confirmation=1► HIT the JOIN BUTTON! BECOME a Member here on Youtube to support the channel! (Get special perks)► Become a Patreon to support me PLEASE :) http://www.patreon.com/soclosetotoast► EPIC GAMES Creator Code: SOCLOSETOTOAZT---------------------------------------------------------------------------Say Hi to ME on the Links Below ---------------------------------------------------------------------------►Follow Twitter: https://twitter.com/SoCloseToToast►Follow Instagram: https://www.instagram.com/soclosetoinstagram/►Join Discord: https://discord.gg/pVTTX9v►Follow Twitch: https://www.twitch.tv/soclosetotoast►Follow TikTok: https://www.tiktok.com/@soclosetotoast?source=h5_m►Like Facebook Fan Page: http://on.fb.me/1985hfp►ALL MY SOCIALS in 1 LINK: https://linktr.ee/soclosetotoast►For business inquires: toastbusiness@gmail.comI've created an Amazon shop with equipment and products that I use!Use this link if you use Amazon! (it helps out a lot): https://www.amazon.com/shop/soclosetotoast#miniladd #allegations #reaction #soclosetotoast #prisonmateluke #miniladddrama #drama #youtubedrama2020 #youtubedrama #miniladdreaction #miniladdabuse #miniladd2020","I love making videos no matter the content! Its my passion, my hobby and what truly makes me happy! I hope it makes you happy as well as I wouldn't post at all if I didn't make one person happy. That is my goal and my mission statement! Hope you stay or continue on the ride of this crazy road on Youtube! Feel free to share around to other toasters in the world and subscribe for more awesomeness!For business inquiries or video proposals please e-mail : toastbusiness@gmail.com","Beatbox beatboxing beatbox reactions reaction beatbox battle beatbox funny moments beatbox trolling gaming beatbox gaming swissbeatbox insane beatboxing amazing beatboxing beatbox compilations beatbox trolling fortnite call of duty youtube viral best beatbox drops insane beatbox drops hilarious videos funny videos funny reactions youtube reacts soclosetotoast pewdiepie vanossgaming voice trolling voice changer loopstation beatbox beatbox compilations","_WfGgl9Q1JQ"
f_mSIjr2DwU,"Among Us but I can HIDE BODIES (mafia mod)","UChXKjLEzAB1K7EZQey7Fm1Q","Pokimane","20","1383.0","https://i.ytimg.com/vi/f_mSIjr2DwU/default.jpg","pokimane|among us|among us imposter|among us gameplay|among us funny moments|among us impostor gameplay|among us impostor tips|offlinetv|among us memes|poki|pokemane|among us best impostor|among us funny|corpse|corpse among us|karl jacobs|proximity chat among us|proximity chat|corpse husband|pokimane twitch|pokimane stream|karl|5up among us|5up|punz|trainwreck|trainwreckstv|modded among us|among us mod|among us impostor mod|nogla|nogla among us|bakbak","My first time playing an impostor mod in Among Us! Being able to hide bodies is insane o_O❤ Expand Me ❤my friends :)peterpark: https://www.twitch.tv/peterparktvtrainwreckstv: https://www.twitch.tv/trainwreckstvnogla: https://www.youtube.com/user/DaithiDeNoglakarl jacobs: https://www.twitch.tv/karljacobsjanet: https://www.youtube.com/channel/UCdH7fwkQ5RGVAMIAN2ufm4Q5up: https://www.youtube.com/channel/UC_ZguPA4uCaQ8Q3Q8IK-HfQbakbak: https://www.youtube.com/channel/UC5dLONf1C4HwzSZQ8ptpETApunz: https://www.youtube.com/channel/UC3WPr2tp5UaVIMxbowcpu3A❥ Tiktok: http://bit.ly/pokitiktok❥ Instagram: http://bit.ly/2kkJnDv❥ Twitch: http://bit.ly/2kD4LEh❥ Discord: http://bit.ly/2lTKoTk❥ Twitter: http://bit.ly/2kPyN7x❥ Edited by needy: https://twitter.com/needdyedits❥ Thumbnail by jksad: https://twitter.com/jksadlol❥ Produced by BeeCoy: https://twitter.com/HumbleBee93Send me things!Pokimane1171 S Robertson Blvd #521Los Angeles, CA 90035","Hey! My name's Imane but you can call me Poki/Pokimane :) I love playing video games and connecting with others through Twitch and YouTube. Thanks for coming to my channel!For Business Inquiries: hana.tjia@unitedtalent.comWatch my Amazon Documentary - Streaming IRL ft. Pokimane!: bit.ly/streamirlI opened up a PO box! 😄❤️Pokimane (or Imane)1171 S Robertson BlvdNumber #372Los Angeles, CA 90035 #Pokimane #Poki","pokimane fortnite fortnite season 10 poki pokimane fortnite fortnite event minecraft tsm myth fitz fitz and pokimane myth myth and pokimane pokimane and myth pokimane league of legends pokimane lol season 10 pokimane minecraft pokimane fitz also fitz pokemane poki and fitz fitz minecraft fitz and pokimane minecraft #pokimane minecraft pokimane fortnite pokimane poki minecraft poki asmr pokimaine pokemon fortnite pokimane 12 year old pokimane thicc pewdiepie cizzorz pokimane random duos p0k1m4n3 mr beast","_WfGgl9Q1JQ"
0vuUdszIZIo,"3 Questionably Heterosexual Men Sit on a Couch and Answer Stupid Questions. (Late PAX East 2016 Q&A)","UC-kOXc3gBwksVfmndSEz7jg","I AM WILDCAT","20","1079.0","https://i.ytimg.com/vi/0vuUdszIZIo/default.jpg","PAX East 2016 Q&A|I AM WILDCAT Vlog|I AM WILDCAT Face|PAX East 2014 Q&A|I AM WILDCAT 4th of July|I AM WILDCAT|W1LDC4T43","Friends in this video! 407's Channel: http://www.youtube.com/user/AlphaSquadHDPanda's Channel: http://www.youtube.com/BigJigglyPandaPAX East 2014 Q&A! https://www.youtube.com/watch?v=xsO-TPDFfYg Thanks for watching! LIKE the video if you enjoyed and always leave comments, I read them all! :D Thanks for your support!Follow me on twitter: http://bit.ly/I_AM_WILDCATMy Instagram: http://instagram.com/wildcat_official Want I AM WILDCAT Shirts and Merchandise?US Shop: http://wildcat-shop.spreadshirt.com/ UK Shop: http://wildcat-shop.spreadshirt.co.uk/ EU Shop: http://wildcat-shop-eu.spreadshirt.net/ Follow Me on Twitch: http://www.twitch.tv/I_AMWILDCATSubscribe to my let's play channel: http://bit.ly/WILDCATLetsPlaysApply for a Partnership: http://apply.fullscreen.net/?ref=w1ldc4t43For Business Inquiries Contact: IAMWILDCATBusiness@yahoo.comCheck out my controller sponsor - http://customcontrollerzz.com/?aff=2Discount Code (8% off): WILDCATControllerzz Twitter - https://twitter.com/ccontrollerzzOutro Song: The Wreckage -- Breaking Through http://www.youtube.com/watch?v=LekDT7RmdisPlease flag hateful comments or spam...we don't need that here :DMusic from:Kevin MacLeod: http://incompetech.com/ http://www.premiumbeat.com/ http://audionautix.com/No one reads this far into the description...what are you doing snooping around...","Tyler - I AM WILDCATFor Business Inquiries Contact: business@iamwildcat.netAbout Me:My name is Tyler and I make my videos for fun and to get a couple laughs out of my viewers. I do my best to make entertaining content and upload as often as I see fit. Feel free to subscribe, it's free :D","I AM WILDCAT WILDCAT Funny Moments Videos GTAV GTA 5 GTA V Gmod Gmod Sandbox Sandbox Garry's Mod Call of Duty CoD Fortnite","_WfGgl9Q1JQ"
4cFLleNoSgo,"Mini Ladd's Apology: Too Little Too Late...","UCCCMvTGR0gewgWlaRzfLvcQ","The Beak","23","740.0","https://i.ytimg.com/vi/4cFLleNoSgo/default.jpg","Mini Ladd|mini ladd apology|mini ladd exposed|Mini Ladd Drama|My apology|mini ladd my apology|mini ladd terroriser|mini ladd thirst project|mini ladd stadium|Mini Ladd apology video|Mini Ladd is over|mini ladd diesel patches|Mini Ladd apology is garbage|Mini Ladd 17 years old|Mini Ladd minor|craig thompson|Craig Thompson stadium|my response reaction|My response mini ladd|mini ladd allegations|mini ladd allegations 2020|Mini Ladd Kavos","Mini Ladd has recently uploaded an apology for his interesting behavior with two of his fans. This apology is the best apology he has made, but this doesn't mean that it's good. Yes, he apologized, but Mini Ladd's Apology is Too Little Too Late.Discord:https://discord.gg/gDuQJAscTwitter:@TheSucciestLadMini's apology:https://youtu.be/_WfGgl9Q1JQPlease note that all media featured in this video falls under fair use as the video is transformative in nature. This video is for entertainment purposes and falls in correct accordance within the provisions set out in the Copyright Act 1976. Stay Succulent#MiniLadd #MiniLaddApology #MiniLaddDrama","Hey there mate! My name's The Beak. If you’re a big gamer lad you better watch my commentary videos because they are the embodiment of gamer. My Socials and all that:Twitter -  @TheSuccuiestLadDiscord - https://discord.gg/6G56dB8Please note that all the videos you see on this channel are made to make you laugh and aren't serious.Stay Succulent","Commentary Commentary channel Funny reaction Funny commentary channel Commentary videos Reaction videos Comedy videos Comedy Funny moments Comedy Video games Penguins Exposed Exposed Videos","_WfGgl9Q1JQ"
KB7X5w7k_Hc,"MiniLadd is Still A Creep","UCUgTbksZ3fecQg2TOhHLH1A","CreepShow Art","23","1209.0","https://i.ytimg.com/vi/KB7X5w7k_Hc/default.jpg","creepshowart|creepshow|art|Mini Ladd|Miniladd|Craig Thompson|Miniladd is a creep|Miniladd is still a creep","♡patreon - patreon.com/creepshowart♡","just a small peanut with big peanut dreamscheck out my merch https://teespring.com/stores/the-creepshop?page=1","funny art channel sketchbook storytime speeddraw","_WfGgl9Q1JQ"
smIkZiz6BSE,"WE RACE TO THE FINISH IN THIS MARIO KART GOLF IT MAP!","UCQiojTHkAvFvdCSajklqUXA","Terroriser","20","1047.0","https://i.ytimg.com/vi/smIkZiz6BSE/default.jpg","terroriser|the terroriser|golf it|golf-it|golf it escape room map|golf it escape room|terroriser golf|terroriser golf it|terrorizer|moo golf|golf it prison|golf it funny|moo|trolling|snuckle|golf it escape|rage|golf rage|vanoss|vanoss gaming|vanossgaming|vanoss golf|golf it plinko|funny moments|daithi|plinko|Funny Moments|mini golf|Terroriser Rage|mini golf rage|irish|gaming|funny|comedy|moo rage|panda|DLC|Parody|Epic|RAGE QUIT|RAGE|troll map|anger","Become a member of the channel and gain access to the Terroriser Discord and also custom emotes in livestreams here: https://www.youtube.com/channel/UCQiojTHkAvFvdCSajklqUXA/joinIf you enjoyed the video hit that LIKE button and drop a COMMENT down below!Stay Awesome guys!Want a Terroriser T-Shirt? Check them out here: https://shop.terrorisermerch.com/https://terroriser.3blackdot.com/Please behave in the comments section and avoid silly or hateful comments :D►►►Follow me on Twitter◄◄◄ https://twitter.com/Terroriser►►►Like me on Facebook◄◄◄ https://www.facebook.com/pages/Terroriser►►►Follow me on Twitch◄◄◄http://www.twitch.tv/Terroriser►►►Follow me on Instagram◄◄◄http://instagram.com/TerroriserFriends in the VideoMoo Snuckel: https://www.youtube.com/user/BnBENTERPR1SESVanoss:  https://www.youtube.com/user/VanossGamingDaithi: https://www.youtube.com/user/DaithiDeNogla","Hi.","Terroriser Terrorizer thegamingterroriser Brian Funny Moments Comedy Irish Ireland Vlogs Vlogger Blogs Blogger Gaming Gameplay Video Games Let's Plays Lets Play Lets Plays Scary Scary Moments Reaction Videos Funny","_WfGgl9Q1JQ"
wm7P9rab0N8,"Unboxing and reviewing TERRIBLE items from Wish.com (Hilarious Reactions)","UC1o9zvRwIqP_K5ByWs-EVwA","BigJigglyPanda","24","1028.0","https://i.ytimg.com/vi/wm7P9rab0N8/default.jpg","bigjigglypanda|big jiggly panda|gaming|unbox|unboxing|review|wish|wish.com|bigjigglypanda wish|react|reacting|reaction|bigjigglypanda reaction|big jiggly panda wish|big jiggly wish|big jiggly|hilarious|funny|bigjigglypanda laugh|big jiggly panda laugh|laughing|bigjigglypanda laughing","The time has come, the video you've all been waiting for is here. The items we ordered off wish.com have arrived and they are terrible. Just absolutely terrible. That's what makes them so amazing. Merchandise Store - https://www.bigjigglypanda.comTwitter: http://www.twitter.com/bigjigglypandaInstagram: http://instagram.com/bigjigglyTwitch: http://www.twitch.tv/bigjigglypandaFriends in the Video - Check Them Out!what are friends","Hi, I'm Panda. You can call me Anthony.","BigJigglyPanda JigglyPanda Panda Big Panda Funny Laugh Laugh Rage Gaming Funny Moments","_WfGgl9Q1JQ"
MJuIbG8wFb8,"my biggest announcement ever...","UC-sjC5fKKsrpcZRJwlZJzZQ","McCreamy","20","636.0","https://i.ytimg.com/vi/MJuIbG8wFb8/default.jpg","fortnite|fortnite battle royale|fortnite gameplay|fortnite chapter 2|challenge|epic|mccreamy|new|update|memes|funny moments|glitches|aimbot|hacking|cheating|funny|video games|gaming|games|skins|fortnite aimbot|fortnite cheater|fortnite daily moments|fortnite best plays|fortnite best|fortnite daily|fortnite challenges|fortnite moments|epic games|24 hours|lazarbeam|tournament|win|sniper|overpowered|mythic|season 5","🍦 https://mccreamy.shop/ 🍦🍦 https://mccreamy.shop/ 🍦🍦 https://mccreamy.shop/ 🍦LIKE and SUBSCRIBE if you enjoyed this video!WATCH ME LIVE ON TWITCH! https://twitch.tv/McCreamyJoin my Notification Crew: click the 🔔 Bell & on Twitch click the 💜🐦 TWITTER - https://twitter.com/McCreamy📷 INSTAGRAM - https://instagram.com/mccreamyFor more Fortnite Battle Royale gameplay watch me live athttps://twitch.tv/McCreamyMusic ▼▶ Video Music: Epidemic Sounds▶ Outro Music: https://goo.gl/MrwCEuStill reading, what are you doing? Hit that Subscribe button already or you won't get a high elimination victory royale against stream snipers on twitch.tv ( ͡° ͜ʖ ͡°)USE CODE CREAMY IN THE FORTNITE ITEM SHOP","McCreamy, the source of the best content and EPIC memes.","games gaming fortnite challenge reaction vlogs","_WfGgl9Q1JQ"
nN9W2CnZif8,"THE DUAL 1911's ARE TOO GOOD IN WARZONE","UCloQ3llsTy-eenlO1qTTD7A","TheseKnivesOnly","20","804.0","https://i.ytimg.com/vi/nN9W2CnZif8/default.jpg","call of duty|theseknivesonly|warzone|call of duty warzone|warzone rage|cold war warzone|cod warzone|call of duty cold war warzone|1911|cold war 1911|dual 1911 warzone|dual 1911 cold war|cold war warzone dual 1911|best 1911 class cold war|1911 loadout|warzone best 1911 class|THE DUAL 1911's ARE TOO GOOD IN WARZONE|1911 best class setup|1911 best loadout|cold war 1911 best class|dual wield 1911|dual 1911|warzone dual wield 1911|warzone 1911","Subscribe to the channel for more Call of Duty Modern Warfare Warzone Gameplay: http://bit.ly/TKOSubscribeTHE DUAL 1911'S ARE TOO GOOD IN WARZONECheck out my merch here: https://theseknivesonly.merchforall.com/Use code TKO for a discount on all Scuf prodcuts here: http://scuf.co/TKOJoin my Discord Server: https://discord.gg/CmbHNqqYapFollow me :)Twitter: https://twitter.com/TheseKnivesOnlyInstagram: https://www.instagram.com/theseknivesonly/Twitch: https://www.twitch.tv/TheseKnivesOnlyOutro Music: 637Godwin - Ballin (prod. Saba)https://www.youtube.com/channel/UCxSHOKGANgmI8gtR9ONx36wBusiness Email: TheseKnivesOnlyBusiness@gmail.comAll videos uploaded are created by: TheseKnivesOnly#Warzone #CallofDuty #ColdWar","I'm that guy that most likely made you rage last game with a knife :D","Call of Duty COD TheseKnivesOnly TKO Black Ops Modern Warfare Call of Duty Modern Warfare Warzone Call of Duty Warzone Modern Warfare Warzone Call of Duty Rage Reactions Modern Warfare Rage Reactions Call of Duty Reactions Modern Warfare Black Ops Black Ops 4 BO4 warzone battle royale rage reactions call of duty funny moments modern warfare mutiplayer new melee weapon dlc melee weapon","_WfGgl9Q1JQ"
xE_aD7JA818,"The Best Of BasicallyIDoWrk 2020!","UCbgtuRStKI_5ACSjubSTUPA","BasicallyIDoWrk","20","7225.0","https://i.ytimg.com/vi/xE_aD7JA818/default.jpg","Basically I Do Work|Basically I Do Wrk|Master of Disguise|Trolling Online Multiplayer|funny moments|marcel|hilarious|gaming|trending|basicallyidowrk","Thank you so much for making 2020 slightly less awful! I love all of you!  ✅ BE SURE TO LIKE, SUBSCRIBE, AND TURN ON NOTIFICATIONS!!!📲 FOLLOW MY OTHER SOCIAL MEDIAS:🐦 https://twitter.com/BasicallyIDoWrk📷 https://www.instagram.com/basicallyidowrk/My Brother's Twitch!💜 Pony: https://www.twitch.tv/ponymontanaOutro Song is HI-HO by [B]- Rogershttps://soundcloud.com/itsbrogersyo","Hi! I'm Marcel, also known as BasicallyIDoWrk. Welcome to my channel! Comedy gaming videos posted every other day.","Basicallyidowrk Basicallyidowork Wrk Basically 'funny moments' 'Gmod' 'Funny Gaming' 'Vlogs' 'Marcel On Monday' Marcel Cunningham call of duty Marcell Video game Funny moments Hilarious","_WfGgl9Q1JQ"
7SeQrn2a3cA,"15 Most Dangerous Trees You Should Never Touch","UCN7kE4xVGr1wF-sc50m036w","The Genius Lemon","10","1381.0","https://i.ytimg.com/vi/7SeQrn2a3cA/default.jpg","deadly plants|bizarre plant|poisonous plants|dangerous plants|interesting facts|in the world|plants|facts|dangerous|poisonous|world|nature|poison|flowers|toxic plants|wildlife|killer plants|touch|wildness|true facts|mind blowing|deadly|deadliest plants|tree|insects|poisonous plant|strange plants|unbelievable|terrifying plants|crazy|creepy|scary plants|unexplained|earth|terrifying|natural|dangerous trees|never touch","Trees are beautiful, majestic and borderline poetic. They give children something to climb, birds somewhere to live and provide all of us with precious, precious oxygen. But, did you know, there are some trees that are 10,000% NOT our friends? Did you know that there are some trees that are SO dangerous you shouldn’t even go near them, not alone TOUCH them! These are the most dangerous trees you should never touch! ► For copyright matters please contact us: OfficialAmerikano@hotmail.com►Check out more amazing plant videos from All The Fruit: https://www.youtube.com/channel/UCrKEeyhQxkfeXy-HN1R8wCA","Welcome to The Genius Lemon! Not only will we give you the most fruitylicious facts but also the most educational and entertaining videos on YouTube!Subscribe and become part of the GeniusSquad!","Educational Entertainment Trending Viral","_WfGgl9Q1JQ"
kG3Bnwp_ItI,"Mini Ladd's New Apology Is Garbage","UCzztaOtjmaZoiLvWLagq7bg","Def Noodles","27","950.0","https://i.ytimg.com/vi/kG3Bnwp_ItI/default.jpg","commentary|drama|tea channel|satire|mini ladd|mini ladd apology|mini ladd drama|mini ladd halley|mini ladd apology reaction|mini ladd my apology|mini ladd apology video|mini ladd reacts to diesel patches|mini ladd exposed|mini ladd controversy|mini ladd controversey 2020|diesel patches|mini ladd diesel patches|drama channel|youtube drama|drama alert|mini ladd clearing the air|mini ladd drama 2020|mini ladd drama explained|craig thompson|scarce|dramaalert","Mini Ladd's New Apology Is GarbageJOIN THE DEFENDERS: https://goo.gl/bYCwLcSupport Me On Patreon: https://goo.gl/PohXdzWatch Me Live On Twitch: http://bit.ly/2RtipYdFriend Me On Facebook: https://goo.gl/UnZgHU#miniladd #craigthompson #ladd #mini #minilad #vanoss #vanossgaming #exposed #react #reacts #reaction #reactions #familyfriendly #lists #top #curiosities✳️ This video is rated PG-13Hi Defenders! Hope you're all well. Here is a resource for anyone going through a hard time: https://www.crisistextline.org/Take care of yourselves, take care of your friends and family. And please be safe. Peace.➡️ Follow My Other Channels:Go With Dennis: https://www.youtube.com/channel/UCHgFO2em7PQpvSKI0rCjcsgSaint Pablo:https://www.youtube.com/channel/UCXCS6PE9MU14qwDZXmPUNGg ➡️ Follow Me Everywhere:Facebook: https://goo.gl/UnZgHUTwitter: https://goo.gl/XR7CwTInstagram: https://goo.gl/UiWAqjSoundcloud: http://bit.ly/2HagaCrPinterest: https://goo.gl/A2wLjCBlog: https://goo.gl/rNdYu9Discord: https://goo.gl/zDkpkSSubreddit: https://goo.gl/jDRgP1Snapchat: https://goo.gl/yUNyJxOfficial Site: https://goo.gl/Zujw7p  👨‍🚀 About Dennis Feitosa:What's up? My name is Dennis Feitosa and Def Noodles is a show I created. It's a mix between The Soup and The Colbert Report, a satirical take on Internet news commentary hosted by a cat in Minecraft house. Thank you so much for subbing, and make sure to send me all video recommendations to dennis@gowithdennis.comDISCLAIMER: Def Noodles is a character created by Dennis Feitosa meant to satirize some of the most deranged, toxic and destructive aspects of Internet Culture. Def Noodles borrows from Twitter outrage, modern-day commentary cynicism, excessive clickbait, trolling, buzzword hacking, cancel culture and outright pandering to righteous indignation to reflect on the realities of contemporary social media interactions and media coverage. The opinions and thoughts expressed by Def Noodles are not a reflection of Dennis Feitosa's beliefs. This disclaimer applies to all Def Noodles social media platforms.","What's up? My name is Dennis Feitosa and Def Noodles is a show I created. It's a mix between The Soup and The Colbert Report, a satirical take on Internet news and commentary hosted by a cat in a Minecraft house. Thank you so much for subbing, and make sure to send me all video recommendations to dennis@gowithdennis.comDISCLAIMER: Def Noodles is a character created by Dennis Feitosa meant to satirize some of the most deranged, toxic and destructive aspects of Internet Culture. Def Noodles borrows from Twitter outrage, modern-day commentary cynicism, excessive clickbait, trolling, buzzword hacking, cancel culture and outright pandering to righteous indignation to reflect on the realities of contemporary social media interactions and media coverage. The opinions and thoughts expressed by Def Noodles are not a reflection of Dennis Feitosa's beliefs. This disclaimer applies to all Def Noodles social media platforms.","reaction react educational reacting to tik tok tiktok satire commentary funniest hilarious funny moments comedy fun entertainment gaming game gameplay minecraft tea makeup make up youtubers youtuber youtube def noodles dennis feitosa","_WfGgl9Q1JQ"
4fpmgyh_OGk,"Mini Ladd's Disgusting Apology","UCjyuCDYbaJ_fU7w-pc4Av2A","The Hot Box","20","1095.0","https://i.ytimg.com/vi/4fpmgyh_OGk/default.jpg","the hot box|mini ladd|apology","YouTuber Mini Ladd recently published a video called 'My Apology' in which he attempts to take accountability for his disgusting conduct with fans. Unfortunately, the video falls flat on many notes, and today on The Hot Box, we examine the video in question.Songs Used (I OWN ONLY THE MERCH SONG):Merch Song Made for The Hot Box by Kurkox on Fiverrhttps://www.fiverr.com/kurkoxThe TALENTED Junsoo Park:https://www.youtube.com/watch?v=_dZmuRh3-4Ehttps://www.youtube.com/watch?v=hk9iRbm7U8ghttps://www.youtube.com/channel/UCBQdHpUz7W0sq09MgJYvpcgIchika Nito the legend himself:https://www.youtube.com/watch?v=Zqw-1GWUNvkhttps://www.youtube.com/watch?v=ulxrWlGZVpshttps://www.youtube.com/watch?v=h6WLuL4MyPkhttps://www.youtube.com/watch?v=PU5jaFvy3vghttps://soundcloud.com/officialbiosphere/tomorrow-will-be-a-better-day-ft-the-klippMERCH: https://teespring.com/stores/hotboxTwitter: http://twitter.com/official_hotboxPatreon: http://patreon.com/officialhotbox/#thehotbox #miniladd #apology","Gameplay and variety content with a dose of medication.Show the love to the subscribe button.","","_WfGgl9Q1JQ"
8YEu64ytPkU,"*NEW* CUSTOM MAFIA MOD! | Among Us (Welcome to the Family)","UCdQWs2nw6w77Rw0t-37a4OA","CaRtOoNz","20","1522.0","https://i.ytimg.com/vi/8YEu64ytPkU/default.jpg","cart0onz|cartoonz|cartoons|funny moments|let's play|cartoonz face reveal|among us|among us mafia|among us mod|h2o delirious|delirious|among us animation|cartoonz among us","NEW MERCH!  https://cartoonz.3blackdot.com/http://www.cartoonz.comhttp://www.amazon.com/shop/cartoonzCaRtOoNz Beard Oil! Get yours here! https://www.canyouhandlebar.com/products/animated-coffee-aromaDelirious: http://www.youtube.com/h2odeliriousOhm: http://www.youtube.com/maskedgamerRilla: http://www.youtube.com/gorillaphent85Squirrel: http://www.youtube.com/channel/UClJ38gvUfmqrAT-hGsIt6LwCaRtOoNz Clothing Line: http://cartoonz.spreadshirt.comSEND FANMAIL HERE!PO Box 18002Greensboro, NC27419-8002Social Media:http://cartoonz.spreadshirt.comhttp://www.twitter.com/_cartoonz  -   @_cartoonzhttp://www.facebook.com/cart0onzIhttp://www.instagram.com/cartoonzhttp://www.caffeine.tv/cartoonzOutro Song: Watching Cartoons - Jay Allen https://www.youtube.com/watch?v=VChfV6zUzXI#cartoonz","","","_WfGgl9Q1JQ"
