video_id,title,channelId,channelTitle,categoryId,duration,thumbnail_link,tags,description,channel_desc,channel_keywords,related_vid_id
3NRriVUjErM,"REAL IRON MAN REPULSOR + GIVEAWAY!","UCjgpFI5dU-D1-kh9H1muoxQ","Hacksmith Industries","28","1082.0","https://i.ytimg.com/vi/3NRriVUjErM/default.jpg","thehacksmith|hacksmith|Ironman|stark industries|make it real|tony stark|gauntlet|superhero|iron man armour|jarvis|marvel comics|mcu|avengers|build|stark|science|laser|laser beam|real iron man gauntlet|repulser|photon beam|photon|helmet|iron man suit|arc reactor|metal|powerful laser|experiment|super powers|scientist|styropyro|real ironman helmet|armour|repulsor|muon beam|metal iron man gauntlet|iron man repulsor|real iron man suit|iron man","Get Honey for FREE and start saving money today ► http://joinhoney.com/hacksmithThanks Honey for sponsoring this video! Enter the Helmet Giveaway ► https://forms.gle/ZobtfubkFzkU626AATry Altium Designer for Free and start designing your own PCBs ► https://www.altium.com/yt/TheHacksmithView & share electronic designs online ►https://www.altium.com/viewer/https://jlcpcb.com/  $2  2Layer 5PCBs,  $5  4 Layer 5PCBsPre-order the MK5 Helmet from Joetoys ► https://joetoyss.com/collections/iron-man-1/products/iron-man-mk5-helmet (and use Honey to get an exclusive coupon!)#adCheck out Alex Lab's hydrogen based repulsor ► https://www.youtube.com/watch?v=FDVrM929s70Become a Hacksmith member get exclusive perks! ► https://www.youtube.com/channel/UCjgpFI5dU-D1-kh9H1muoxQ/join►Watch videos early! ►Project design files (solidworks)►Merch Discounts ►Collaborate with us on our videos SOCIALWebsite ► http://www.hacksmith.techFacebook ► http://www.facebook.com/thehacksmithInstagram ► http://www.instagram.com/thehacksmithTwitter ► http://twitter.com/thehacksmithPatreon ► http://www.patreon.com/thehacksmithDiscord ► https://discordapp.com/invite/thehacksmith Merch ► https://www.hacksmith.storeCHAPTERS:  0:00 Intro0:21 James Calls Out Elon Musk1:17 Build Intro2:41 What Is Iron Mans Gauntlet Anyway?3:31 James Talks High Powered Lasers4:57 How To Win The Iron Man Helmet5:50 Bogdan Designs The PCB7:44 James Assembles The Cooling System10:13 The Gauntlet Arrives11:08 Final Assembly13:24 The Finished Product13:54 Testing The Gauntlet17:18 OutroMUSIC:Jump Jive And Sing The Elvis Schoenbergs OrchestraLicensed from Triple Scoop Music ►https://triplescoopmusic.com/Thunder by BlakewolfLicensed from Triple Scoop Music ►https://triplescoopmusic.com/Sirens by Your NeighborsLicensed from Triple Scoop Music ►https://triplescoopmusic.com/Strain by DWANINUNGKALicensed from Triple Scoop Music ►https://triplescoopmusic.com/I’m Gonna Fly by Todd HerfindalLicensed from Triple Scoop Music ►https://triplescoopmusic.com/Defending The Future by Kelty WoodsLicensed from Triple Scoop Music ►https://triplescoopmusic.com/Spaghetti And Rock N Roll by Your NeighborsLicensed from Triple Scoop Music ►https://triplescoopmusic.com/Lift Me Higher by BamtoneLicensed from Triple Scoop Music ►https://triplescoopmusic.com/SOFTWARE:Video Review / Collaboration ► http://r.frame.io/pZq3NVideo Editing ► Adobe Premiere VFX ► https://productioncrate.grsm.io/HacksmithCAD ► Solidworks CAM ► Autodesk HSM http://bit.ly/HSMworksCAMERA GEAR:Highspeed Cam - Chronos 1.4 ► http://bit.ly/chronosCamMain shooter - Panasonic GH5s ► https://bhpho.to/2Fjd80N Phone - Samsung S10  ► https://bhpho.to/2N8FOh8Camcorder - Sony Handycam ► https://bhpho.to/2FDnq81 Action Cam - GoPro ► https://bhpho.to/2FxXDC4 Steadicam - Removu K1 ► https://bhpho.to/2N9lDQq Main mic - Sennheiser ► https://bhpho.to/2DsR8ecBendy Tripod ► https://bhpho.to/2FyLNb0 Main Tripods - old second hand Manfrotto tripods no longer sold. Studio Light - Luxli ► https://bhpho.to/2N9SPavTOOLS / MACHINES: CNC Waterjet Cutter ► http://bit.ly/wazerJetCNC Plasma Cutter ► http://bit.ly/EMTplasma3d Printers ► http://bit.ly/H1PrinterCNC Mill ►  http://bit.ly/PCNC440CNC Lathe ► http://bit.ly/15LSlantProLaser Cutter - Gweike LG900N 80W ► http://lmgtfy.com/?q=lg900n 3d Scanner ► http://amzn.to/2pwbvTuDrills, drivers, grinders, saws, etc ► http://amzn.to/2p9SPJ3 Mig Welder ► http://bit.ly/MP250iWelderTig Welder ► http://bit.ly/Tig200WelderQuiet Air Compressor ► http://bit.ly/38zVKzBDesktop PC ► https://youtu.be/gSbt3LK8hCs Purchases made through some store links may provide some compensation to Hacksmith.WARNING: THESE VIDEOS ARE FOR ENTERTAINMENT PURPOSES ONLY. PERSONAL USE OF VIDEO CONTENT IS AT YOUR OWN RISK. THE HACKSMITH IS A TRAINED PROFESSIONAL WHO KNOWS EXACTLY WHAT HE'S DOING. EXCEPT WHEN HE DOESN'T. DO NOT ATTEMPT TO RECREATE OR RE-ENACT ANYTHING SHOWN IN THESE VIDEOS.#makeitreal #ironman","We take fictional ideas from movies, video games & comics, and make real working prototypes!I quit my full-time job as an engineer and product developer to make only the coolest inventions -- just for you guys -- right here on YouTube. We show the engineering process of making our projects to inspire others into STEM fields, and to show that anything is possible with science!Please send media inquires through https://www.hacksmith.tech/contactFor FAQ please visit https://www.hacksmith.tech/faq","DIY props cosplay prop replicas tech engineering gadgets make it real prototyping marvel make it real science prop replicas real working props extreme cosplay stark industries hacksmith industries real life tony stark technology real life iron man","Dqe7Iw2MiZ8"
0T8z4BJPEBU,"HOVERBOARD BUILD (PART 1/2)","UCjgpFI5dU-D1-kh9H1muoxQ","Hacksmith Industries","28","750.0","https://i.ytimg.com/vi/0T8z4BJPEBU/default.jpg","thehacksmith|hacksmith|back to the future|marty|doc|doc brown|hoverboard|future|delorean|time machine|hovering|magnets|science|make it real|real working hoverboard|magnetic|eddy currents|engineering|engineer|stem|experiment|workshop|build|electronics|battery|michael j fox|metal|mechanical|inventor|creating|time travel|great scott|heavy|biff|back to the future theme|1985|futuristic|hover skateboard|tech|back to the future 2|wheels|hover|board|self lacing shoes","Play Monster Legends for free today ► https://monsterlegends.onelink.me/X4Sc/TheHacksmith -- the first game to feature a Hacksmith Monster!Check out K&J Magnetics for all your magnet needs! https://www.kjmagnetics.com/Check out Tattu Batteries for all your battery needs! https://www.genstattu.com/Become a Hacksmith member get exclusive perks! ► https://www.youtube.com/channel/UCjgpFI5dU-D1-kh9H1muoxQ/join►Early video access ►Project design files (solidworks)►Merch Discounts ►Collaborate with us on our videos SOCIALWebsite ► http://www.hacksmith.techFacebook ► http://www.facebook.com/thehacksmithInstagram ► http://www.instagram.com/thehacksmithTwitter ► http://twitter.com/thehacksmithPatreon ► http://www.patreon.com/thehacksmithDiscord ► https://discordapp.com/invite/thehacksmith Merch ► https://www.hacksmith.storeCHAPTERS: 0:00 James Talks Hoverboards2:07 Jimmy Talks Magnets3:26 Eddy Currents Coming Into Play4:15 How To Maximize Magnet Strength5:00 James Is In A Game!!! 5:59 Jimmy Designs and Builds The Wheel7:09 Testing The Prototype8:05 Designing The Board8:49 Make It Real!10:40 Balancing The Wheels11:14 In The Next Episode!11:33 Explosion12:00 OutroMUSIC:After Dark by PYLOTLicensed from Monstercat ►https://www.monstercat.com/So Fine by Maksym MurashkoLicensed from Triple Scoop Music ►https://triplescoopmusic.com/Odin’s Ghost by Stephen WalkingLicensed from Monstercat ►https://www.monstercat.com/SOFTWARE:PCB Design ► https://www.altium.com/yt/TheHacksmithVideo Review / Collaboration ► http://r.frame.io/pZq3NVideo Editing ► Adobe Premiere CAD ► Solidworks CAM ► Autodesk HSM http://bit.ly/HSMworksCAMERA GEAR:Highspeed Cam - Chronos 1.4 ► http://bit.ly/chronosCamMain shooter - Panasonic GH5s ► https://bhpho.to/2Fjd80N Phone - Samsung S10  ► https://bhpho.to/2N8FOh8Camcorder - Sony Handycam ► https://bhpho.to/2FDnq81 Action Cam - GoPro ► https://bhpho.to/2FxXDC4 Steadicam - Removu K1 ► https://bhpho.to/2N9lDQq Main mic - Sennheiser ► https://bhpho.to/2DsR8ecBendy Tripod ► https://bhpho.to/2FyLNb0 Main Tripods - old second hand Manfrotto tripods no longer sold. Studio Light - Luxli ► https://bhpho.to/2N9SPavTOOLS / MACHINES: CNC Mill - Tormach 1100MX ► https://hubs.ly/H0B8DWG0CNC Mill - Tormach PCNC 440 ► https://hubs.ly/H0B8DYk0CNC Lathe - Tormach 15L ► https://hubs.ly/H0B8Gcp0Autofeed Bandsaw - Tormach AF50 ► https://hubs.ly/H0B8Gj10CNC Waterjet Cutter ► http://bit.ly/wazerJetCNC Plasma Cutter ► http://bit.ly/EMTplasma3d Printers ► http://bit.ly/H1PrinterLaser Cutter - Gweike LG900N 80W ► http://lmgtfy.com/?q=lg900n 3d Scanner ► http://amzn.to/2pwbvTuDrills, drivers, grinders, saws, etc ► http://amzn.to/2p9SPJ3 Mig Welder ► http://bit.ly/MP250iWelderTig Welder ► http://bit.ly/Tig200WelderQuiet Air Compressor ► http://bit.ly/38zVKzBDesktop PC ► https://youtu.be/gSbt3LK8hCs Purchases made through some store links may provide some compensation to Hacksmith.WARNING: THESE VIDEOS ARE FOR ENTERTAINMENT PURPOSES ONLY. PERSONAL USE OF VIDEO CONTENT IS AT YOUR OWN RISK. THE HACKSMITH IS A TRAINED PROFESSIONAL WHO KNOWS EXACTLY WHAT HE'S DOING. EXCEPT WHEN HE DOESN'T. DO NOT ATTEMPT TO RECREATE OR RE-ENACT ANYTHING SHOWN IN THESE VIDEOS.#hoverboard #bttf #makeitreal","We take fictional ideas from movies, video games & comics, and make real working prototypes!I quit my full-time job as an engineer and product developer to make only the coolest inventions -- just for you guys -- right here on YouTube. We show the engineering process of making our projects to inspire others into STEM fields, and to show that anything is possible with science!Please send media inquires through https://www.hacksmith.tech/contactFor FAQ please visit https://www.hacksmith.tech/faq","DIY props cosplay prop replicas tech engineering gadgets make it real prototyping marvel make it real science prop replicas real working props extreme cosplay stark industries hacksmith industries real life tony stark technology real life iron man","Dqe7Iw2MiZ8"
1kj5N67J2aE,"We Made SELF-LACING SHOES from BACK TO THE FUTURE!","UCjgpFI5dU-D1-kh9H1muoxQ","Hacksmith Industries","28","789.0","https://i.ytimg.com/vi/1kj5N67J2aE/default.jpg","thehacksmith|hacksmith|back to the future|self lacing shoes|self tying shoes|self lacing shoes back to the future|bttf|self-lacing nike mag|self lacing nike|self-tying shoes|self-lacing shoes bttf|make it real|vessi shoes|bttf shoes|back to the future shoes|nike bttf shoes|digikey|maker.io|altium|engineering","Thanks to Vessi for Sponsoring this video, get your own pair of shoes at ► https://vessi.com/hacksmith and if you miss the sale, use code hacksmith to save big!  Check out our circuit diagram on Maker.IO ► https://www.digikey.com/en/maker/projects/the-hacksmith-self-tying-sneakers/c039117b454e4b709b93d88320f19c5aTry Altium Designer for Free and start designing your own PCBs ► https://www.altium.com/yt/TheHacksmithView & share electronic designs online ►https://www.altium.com/viewer/Support our Kickstarter ► https://bit.ly/2IQO304Become a Hacksmith member get exclusive perks! ► https://www.youtube.com/channel/UCjgpFI5dU-D1-kh9H1muoxQ/join►Early video access ►Project design files (solidworks)►Merch Discounts ►Collaborate with us on our videos CHAPTERS:0:00 Teaser0:17 The plan1:23 Lace tests2:32 Vessi3:19 Design4:06 Dig the sole5:35 Lace spool6:20 A metal sole7:03 The electronics7:47 Final Assembly8:52 A gift to James10:52 Kickstarter12:43 The endSOCIALWebsite ► http://www.hacksmith.techFacebook ► http://www.facebook.com/thehacksmithInstagram ► http://www.instagram.com/thehacksmithTwitter ► http://twitter.com/thehacksmithPatreon ► http://www.patreon.com/thehacksmithDiscord ► https://discordapp.com/invite/thehacksmith Merch ► https://hacksmith.storeSOFTWARE:PCB Design ► https://www.altium.com/yt/TheHacksmithVideo Review / Collaboration ► http://r.frame.io/pZq3NVideo Editing ► Adobe Premiere CAD ► Solidworks CAM ► Autodesk HSM http://bit.ly/HSMworksCAMERA GEAR:Highspeed Cam - Chronos 1.4 ► http://bit.ly/chronosCamMain shooter - Panasonic GH5s ► https://bhpho.to/2Fjd80N Phone - Samsung S10  ► https://bhpho.to/2N8FOh8Camcorder - Sony Handycam ► https://bhpho.to/2FDnq81 Action Cam - GoPro ► https://bhpho.to/2FxXDC4 Steadicam - Removu K1 ► https://bhpho.to/2N9lDQq Main mic - Sennheiser ► https://bhpho.to/2DsR8ecBendy Tripod ► https://bhpho.to/2FyLNb0 Main Tripods - old second hand Manfrotto tripods no longer sold. Studio Light - Luxli ► https://bhpho.to/2N9SPavTOOLS / MACHINES: CNC Waterjet Cutter ► http://bit.ly/wazerJetCNC Plasma Cutter ► http://bit.ly/EMTplasma3d Printers ► http://bit.ly/H1PrinterCNC Mill ►  http://bit.ly/PCNC440CNC Lathe ► http://bit.ly/15LSlantProLaser Cutter - Gweike LG900N 80W ► http://lmgtfy.com/?q=lg900n 3d Scanner ► http://amzn.to/2pwbvTuDrills, drivers, grinders, saws, etc ► http://amzn.to/2p9SPJ3 Mig Welder ► http://bit.ly/MP250iWelderTig Welder ► http://bit.ly/Tig200WelderQuiet Air Compressor ► http://bit.ly/38zVKzBDesktop PC ► https://youtu.be/gSbt3LK8hCs Purchases made through some store links may provide some compensation to Hacksmith.MUSIC IN ORDER OF APPEARANCE:Past 2 Present by Kian HowLicensed from Triple Scoop Music ►https://triplescoopmusic.com/Dramatic Shift by DPLicensed from Triple Scoop Music ►https://triplescoopmusic.com/King of Swing by Rob McAllisterLicensed from Triple Scoop Music ►https://triplescoopmusic.com/Tunnel Vision by IndasoulLicensed from Triple Scoop Music ►https://triplescoopmusic.com/Messenger by Evgeny KiselevichLicensed from Triple Scoop Music ►https://triplescoopmusic.com/Dream of Love by AU5 & Heavy JLicensed from Triple Scoop Music ►https://triplescoopmusic.com/Climb High by Air in MotionLicensed from Triple Scoop Music ►https://triplescoopmusic.com/Sly Little Creatures by AuvicLicensed from Triple Scoop Music ►https://triplescoopmusic.com/Friction by Bryant LowryLicensed from Triple Scoop Music ►https://triplescoopmusic.com/WARNING: THESE VIDEOS ARE FOR ENTERTAINMENT PURPOSES ONLY. PERSONAL USE OF VIDEO CONTENT IS AT YOUR OWN RISK. THE HACKSMITH IS A TRAINED PROFESSIONAL WHO KNOWS EXACTLY WHAT HE'S DOING. EXCEPT WHEN HE DOESN'T. DO NOT ATTEMPT TO RECREATE OR RE-ENACT ANYTHING SHOWN IN THESE VIDEOS.#BackToTheFuture #MakeItReal #Hacksmith","We take fictional ideas from movies, video games & comics, and make real working prototypes!I quit my full-time job as an engineer and product developer to make only the coolest inventions -- just for you guys -- right here on YouTube. We show the engineering process of making our projects to inspire others into STEM fields, and to show that anything is possible with science!Please send media inquires through https://www.hacksmith.tech/contactFor FAQ please visit https://www.hacksmith.tech/faq","DIY props cosplay prop replicas tech engineering gadgets make it real prototyping marvel make it real science prop replicas real working props extreme cosplay stark industries hacksmith industries real life tony stark technology real life iron man","Dqe7Iw2MiZ8"
74ZSIJk2pcg,"Flying RC Car","UCRijo3ddMTht_IHyNSNXpNQ","Dude Perfect","17","557.0","https://i.ytimg.com/vi/74ZSIJk2pcg/default.jpg","dude perfect|dude perfect stereotypes|dude perfect water bottle flip|bottle flip|water bottle flip|dude perfect bottle flip|dude perfect basketball|dp|dude perfect world record|edition|nerf|trick shots|trick shot|family|ping pong|bowling|clean|family friendly|bubble wrap|soccer|football|spinner|spinners|fidget spinners|dude|battle|rc|remote control|car|flying|traxxas|hummer|frogger|crush|cody|coby|wins|egg|crack","RC cars are way more fun when they are FLYING!! Our craziest RC battle yet!!► Thanks for subscribing! - http://bit.ly/SubDudePerfect► Subscribe to our Behind The Scenes & BLOOPERS: https://bit.ly/DPplusSubscribe► Click HERE to watch the behind the scenes: https://youtu.be/z4FnDEYg2ywMusic by Zayde Wolf:► Click HERE to download “BACK AT IT by ZAYDE WOLF - https://zaydewolf.ffm.to/backatit ► Click HERE to visit ARTIST Facebook page - https://zaydewolf.ffm.to/facebook ► Click HERE to listen on Spotify - https://zaydewolf.ffm.to/spotify ► Click HERE to listen on YouTube - https://youtu.be/qweHTHwFq3o / https://www.youtube.com/zaydewolfNEXT LEVEL STUFF -------------------------------------------🎒 NEW Merch - http://bit.ly/DPStore🎮 Play our FREE iPhone game! - http://smarturl.it/DudePerfect2📱 Text us - (469) 205-7005🔔 Hit the bell next to Subscribe so you don't miss a video!👨🏻‍💻 Watch our newest vids! - http://bit.ly/NewDPVids📕 Read our Book - Go Big - http://amzn.to/OYdZ2sFollow our Instagrams so we can be best friends -------------------------------------------🏆 http://Instagram.com/DudePerfect🧔🏻 http://Instagram.com/TylerNToney👱🏻‍♂️ http://Instagram.com/Cody_Jones_🙋🏻‍♂️ http://Instagram.com/CobyCotton👨‍🦰 http://Instagram.com/GarrettHilbert⛹🏻‍♂️ http://Instagram.com/CoryCotton-------------------------------------------“Back at It”Performed by ZAYDE WØLF Courtesy of Lyric House, LLCWritten by Dustin Burnett©2021 Lyric House Denver Publishing o/b/o Red Coco Publishing (ASCAP)-------------------------------------------#battleBonus points if you're still reading this! Comment: What would your flying RC car look like?!Click here to learn more about Dude Perfect:http://bit.ly/AboutDudePerfectAs always...Go Big and God Bless!- Your friends at Dude PerfectBusiness or Media, please contact us at: Dude@DudePerfect.com------------5 Best Friends and a Panda.If you like Sports + Comedy, come join the Dude Perfect team!Best known for trick shots, stereotypes, battles, bottle flips, ping pong shots and all-around competitive fun, Dude Perfect prides ourselves in making the absolute best family-friendly entertainment possible! Welcome to the crew! Pound it 👊🏻 Noggin 🙇🏻‍♂️ - Dude Perfect","5 best buds just kickin' it.If you like Sports + Comedy, come join the Dude Perfect team!","dude perfect dude perfect stereotypes dude perfect water bottle flip bottle flip water bottle flip dude perfect bottle flip dude perfect basketball dp dude perfect world record edition nerf trick shots trick shot family ping pong bowling clean family friendly bubble wrap soccer football spinner spinners fidget spinners dude","Dqe7Iw2MiZ8"
5f6mDfc5zg4,"World's BRIGHTEST Flashlight?","UCjgpFI5dU-D1-kh9H1muoxQ","Hacksmith Industries","28","1061.0","https://i.ytimg.com/vi/5f6mDfc5zg4/default.jpg","thehacksmith|hacksmith|giant|flashlight|world record|world's largest|bright|light|technology|science|stem|engineering|workshop|create|metal|electricity|LED|power|inventor|torch|battery|large|experiment|turbo mode|flood light|blind|button|electronics|gigantic|powerful|most powerful flashlight|world's brightest flashlight|LED flashlight|lumens|imalent|destroy|ants|oversized|hazard|beacon|pcb|soldering|wires|tallest flashlight|wired|imalent ms18|ms18|diy","Check out http://KiwiCo.com/hacksmith50 for 50% off your first month of any subscription crate. Hey @Markiplier -- want to review this one? I think it's a bit brighter..See the circuit diagram at Maker.IO ► https://www.digikey.com/en/maker/blogs/2020/the-hacksmith-the-worlds-brightest-flashlightCheck out the Imalent MS-18, the brightest flashlight you can actually buy online! ► https://www.imalentstore.com/products/imalent-ms18-100000-lumen-flashlight   -- use coupon code DZYJ10YHM to save 5% on the Imalent store!Become a Hacksmith member get exclusive perks! ► https://www.youtube.com/channel/UCjgpFI5dU-D1-kh9H1muoxQ/join►Early video access ►Project design files (solidworks)►Merch Discounts ►Collaborate with us on our videos SOCIALWebsite ► http://www.hacksmith.techFacebook ► http://www.facebook.com/thehacksmithInstagram ► http://www.instagram.com/thehacksmithTwitter ► http://twitter.com/thehacksmithPatreon ► http://www.patreon.com/thehacksmithDiscord ► https://discordapp.com/invite/thehacksmith Merch ► https://www.hacksmith.storeSOFTWARE:PCB Design ► https://www.altium.com/yt/TheHacksmithVideo Review / Collaboration ► http://r.frame.io/pZq3NVideo Editing ► Adobe Premiere CAD ► Solidworks CAM ► Autodesk HSM http://bit.ly/HSMworksCAMERA GEAR:Highspeed Cam - Chronos 1.4 ► http://bit.ly/chronosCamMain shooter - Panasonic GH5s ► https://bhpho.to/2Fjd80N Phone - Samsung S10  ► https://bhpho.to/2N8FOh8Camcorder - Sony Handycam ► https://bhpho.to/2FDnq81 Action Cam - GoPro ► https://bhpho.to/2FxXDC4 Steadicam - Removu K1 ► https://bhpho.to/2N9lDQq Main mic - Sennheiser ► https://bhpho.to/2DsR8ecBendy Tripod ► https://bhpho.to/2FyLNb0 Main Tripods - old second hand Manfrotto tripods no longer sold. Studio Light - Luxli ► https://bhpho.to/2N9SPavTOOLS / MACHINES: CNC Mill - Tormach 1100MX ► https://hubs.ly/H0B8DWG0CNC Mill - Tormach PCNC 440 ► https://hubs.ly/H0B8DYk0CNC Lathe - Tormach 15L ► https://hubs.ly/H0B8Gcp0Autofeed Bandsaw - Tormach AF50 ► https://hubs.ly/H0B8Gj10CNC Waterjet Cutter ► http://bit.ly/wazerJetCNC Plasma Cutter ► http://bit.ly/EMTplasma3d Printers ► http://bit.ly/H1PrinterLaser Cutter - Gweike LG900N 80W ► http://lmgtfy.com/?q=lg900n 3d Scanner ► http://amzn.to/2pwbvTuDrills, drivers, grinders, saws, etc ► http://amzn.to/2p9SPJ3 Mig Welder ► http://bit.ly/MP250iWelderTig Welder ► http://bit.ly/Tig200WelderQuiet Air Compressor ► http://bit.ly/38zVKzBDesktop PC ► https://youtu.be/gSbt3LK8hCs Purchases made through some store links may provide some compensation to Hacksmith.WARNING: THESE VIDEOS ARE FOR ENTERTAINMENT PURPOSES ONLY. PERSONAL USE OF VIDEO CONTENT IS AT YOUR OWN RISK. THE HACKSMITH IS A TRAINED PROFESSIONAL WHO KNOWS EXACTLY WHAT HE'S DOING. EXCEPT WHEN HE DOESN'T. DO NOT ATTEMPT TO RECREATE OR RE-ENACT ANYTHING SHOWN IN THESE VIDEOS.#makeitreal #engineering #flashlights","We take fictional ideas from movies, video games & comics, and make real working prototypes!I quit my full-time job as an engineer and product developer to make only the coolest inventions -- just for you guys -- right here on YouTube. We show the engineering process of making our projects to inspire others into STEM fields, and to show that anything is possible with science!Please send media inquires through https://www.hacksmith.tech/contactFor FAQ please visit https://www.hacksmith.tech/faq","DIY props cosplay prop replicas tech engineering gadgets make it real prototyping marvel make it real science prop replicas real working props extreme cosplay stark industries hacksmith industries real life tony stark technology real life iron man","Dqe7Iw2MiZ8"
