video_id,title,channelId,channelTitle,categoryId,duration,thumbnail_link,tags,description,channel_desc,channel_keywords,related_vid_id
qh7dgSldw-w,"Why We Left BuzzFeed | Kitchen & Jorn","UCsN7kK_cJKG4PtP5AC8MP4A","The Kitchen & Jorn Show","22","2117.0","https://i.ytimg.com/vi/qh7dgSldw-w/default.jpg","kristin and jen|kristin & jen|kristin chirico|jen ruggirello|jen from buzzfeed|kristin from buzzfeed|buzzfeed ladylike|why we left buzzfeed|jen from ladylike|kristin from ladylike","Trigger warning: We discuss suicidal ideation and depression in this video. Please take care of yourselves! Resources for folks experiencing similar things: https://suicidepreventionlifeline.org/ https://translifeline.org/hotline/In which Kristin and Jen discuss why they left BuzzFeed. ALSO: We are in a quarantine bubble! Wear your masks!Subscribe to our Patreon: https://www.patreon.com/kitchenandjornVideo edited by: Mia Barnett (https://www.instagram.com/miapagebarnett)Video captioned by: Arielle StewartTitle cards by: Oliver Rogue (https://www.youtube.com/c/OXRStudios)Channel Art by: Sarah Day (https://sarahdayarts.com)New videos every Friday!","New videos every Friday at 12PM PST!The wonderful and beloved creation of Kristin Chirico and Jen Ruggirello! Do you love hilarious queer women who are also HOT? Do you wanna laugh/cry/and kiss our beautiful faces? Then subscribe to The Kitchen & Jorn Show! Videos about being gay, being silly, being lovely, and our lives as independent creators in Los Angeles!Channel Art by the wonderful Sarah Day (@sarahdayarts)","","e4wajXk_cDs"
26VzqQd-bZg,"Eugene Ranks The Cheapest Wines","UCpi8TJfiA4lKGkaXs__YdBA","The Try Guys","23","1714.0","https://i.ytimg.com/vi/26VzqQd-bZg/default.jpg","try guys|keith|ned|zach|eugene|habersberger|fulmer|kornfeld|yang|buzzfeedvideo|buzzfeed|ariel|ned & ariel|comedy|education|funny|try|learn|fail|experiment|test|tryceratops|Rank King|Eugene Ranks|Eugene Ranks Everything|wine ranking|best wines|best cheap wines|cheap wine|cheapest wine|wine review|wine tasting|red wine|white wine|wine folly|expensive wine|expensive wines|wine glass|wine expert|drinking wine|wine taste test|wine sommelier|sparkling wine","The King is back and he's got a new Queen at his side, the Regal Rank Wife, Becky! Today they're sipping only the cheapest of wines from their chalice! What will these lovers of wine decide? #RankKingAre you a business looking to work with The Try Guys? Reach out to us at 2ndtrybusiness@gmail.com for all business inquiries! 🎧THE TRYPOD 🎧: watch our new podcast at https://youtube.com/trypod or listen at https://tryguys.com/podcast📘THE HIDDEN POWER OF F*CKING UP 📘: check out our new book at https://tryguys.com/bookGet your official Try Guys color hoodies and phone cases at https://tryguys.com/collections/color-line 💙❤️💚💜Support us! http://www.patreon.com/tryguys. Join our Patreon to get videos a day early, plus, live streams, chatrooms, BTS footage, exclusive merchandise, and more!SUBSCRIBE TO AND FOLLOW THE TRY GUYS http://www.youtube.com/c/tryguyshttp://www.facebook.com/tryguys  http://www.twitter.com/tryguyshttps://www.instagram.com/tryguysFOLLOW THE GUYShttp://www.Instagram.com/keithhabshttp://www.Instagram.com/nedfulmerhttp://www.Instagram.com/korndiddyhttp://www.instagram.com/eugeneleeyang http://www.twitter.com/keithhabshttp://www.twitter.com/nedfulmer http://www.twitter.com/korndiddyhttp://www.twitter.com/eugeneleeyang THE TRY GUYSThe #TryGuys is the flagship channel of 2ND TRY, LLC. Tune in twice a week for shows from Keith, Ned, Zach and Eugene, the creators and stars of The Try Guys.FEATURINGBecky Habersberger @becksmecks2EDITED BYElliot DickerhoofMUSICLicensed from AudioNetworkSFXLicensed from AudioblocksVIDEOLicensed from VideoblocksOfficial Try Guys Photos By Mandee Johnson Photography | @mandeephoto2nd Try, LLC STAFFExecutive Producer - Keith HabersbergerExecutive Producer - Ned FulmerExecutive Producer - Zach KornfeldExecutive Producer - Eugene Lee YangProducer - Rachel Ann ColeProducer - Nick RufcaAssociate Producer - Alexandria HerringEditor - Devlin McCluskeyEditor - YB ChangEditor - Elliot DickerhoofAssistant Editor - Will WitwerPodcast Producer - Miles BonsignoreCamera Operator/Assistant Production Coordinator - Jonathan KirkSound Operator Assistant Production Coordinator - Sam JohnsonContent Strategist - Kaylin BurkeSpecial Thanks To! Thanks to all of our Gold Level Patrons! AJ S., Amy Fleming, Ana Camba, Cat Hicks, Elisa Proust, Emma Godfrey, Erica Rao, Jared Aarons, Kelsey Bock, Kourtney Wong, Loretta Wen, Matthew Tadros, Miha, Paulus, Sarah Waxman, Traci Lew, Wendy Tran, Lily","Welcome to our new, completely independent channel, featuring the same guys, with better videos. New episodes every Wednesday & Saturday!Get tickets for our worldwide tour Legends Of The Internet at www.tryguys.com/tourThe TryPod podcast available everywhere at www.tryguys.com/podcastOrder our book The Hidden Power Of F*cking Up at www.tryguys.com/bookOfficial Try Guys merch at www.tryguys.comTHE TRY TEAMExecutive Producer - Keith HabersbergerExecutive Producer - Ned FulmerExecutive Producer - Zach KornfeldExecutive Producer - Eugene Lee YangProducer - Nick RufcaProducer - Rachel Ann ColeProduction Manager - Alexandria HerringAssistant Production Coordinator / TryPod Producer - Miles BonsignoreEditor - Devlin McCluskeyEditor - YB ChangEditor - Elliot DickerhoofAssistant Editor - Will WitwerSocial Media Manager - Kaylin BurkeOffice Production Assistant - Sam JohnsonProduction Assistant - Jonathan KirkThe Try Guys is the flagship channel of 2ND TRY, LLC.","try guys keith ned zach eugene habersberger fulmer kornfeld yang buzzfeedvideo buzzfeed ariel ned & ariel","e4wajXk_cDs"
wJH1wC85igY,"We Surprise Our Kid With a Playroom Makeover!","UCDVPcEbVLQgLZX0Rt6jo34A","Mr. Kate","26","1661.0","https://i.ytimg.com/vi/wJH1wC85igY/default.jpg","makeover|playroom|interior design|home decor|kids room|magical|creativity|waldorf|montessori|reggio|reggio emilia|nature|learning|diy|how-to|beautiful|nursery|nursery makeover|home makeover|before and after|stayhome|inspiring|education|educational|painting|craft project|staining|eco-friendly|farm|family|mrkate|mr kate|mister kate","We’re creating a DIY magical playroom for our son Moon and surprising him with the reveal!SUBSCRIBE to our channel!: http://bit.ly/mrkateyoutubeSign up to be the first to hear when our Furniture Line is available!! https://bit.ly/mrkatenotifymeWatch Our Spare Bedroom Become Moon’s Room!: https://youtu.be/LCw2Q-4wF90 Catch up with OMG We Bought A House!: https://www.youtube.com/playlist?list=PLxrcW2MAluZI6qVFJmGtbf5F5QJ4tThjX Become a member for exclusive VLOGS, LIVE CHATS, EMOJIS, BADGES and DISCOUNT CODES: https://www.youtube.com/channel/UCDVPcEbVLQgLZX0Rt6jo34A/join #DIY #playroom #makeover #kidsroom #interiordesign #homedecor #transformation #mrkate #montessori #waldorf #reggio_________________________Shop This Video!: Table and Chair Set: https://bit.ly/2K8gEyx Storage Cabinet (similar): https://bit.ly/3i8FMly Black Sconce: https://bit.ly/3s0VIuxGreen Rug: https://bit.ly/38iatRR Jute Rug: https://amzn.to/3s3R5jd Wooden Balance Board: https://amzn.to/2MHh7szT-Ball Set: https://amzn.to/3hPMLzqRed and Orange Play Scarf: https://amzn.to/3onHTnw Counting Toy: https://amzn.to/35eZmHeRainbow Play Scarf: https://amzn.to/399bpqJ Block Crayons: https://amzn.to/3bh3pH0 Modeling Wax: https://amzn.to/399jEmF Easel Paper Roll: https://amzn.to/2LsLrGN Kinetic Sand: https://amzn.to/3hQGVO9 Olive Wood Scoops: https://amzn.to/38l38B5 Elephant Handpuppet: https://amzn.to/2LsGn4WBunny Handpuppet: https://amzn.to/3sb21Me Cat Handpuppet: https://amzn.to/2MxuMSM Wooden Harp Toy: https://amzn.to/35k9uPg Piano Toy: https://amzn.to/2MxuMSM Seagrass Baskets: https://amzn.to/39eaq94 Open Weave Basket: https://bit.ly/3bgvcqU Wooden Spools: https://amzn.to/2XdV2nk Wooden Cars: https://amzn.to/3s3oPgyWooden Peg Dolls: https://amzn.to/2L02DUg Wooden Square Trays: https://amzn.to/2JPsVI0 Colored Wool Yarn: https://amzn.to/35gSSbc _________________________We are following the FilmLA and Los Angeles Reopening Guidelines for safe filming: All crew and cast members are tested regularly. 6 Feet Distancing at a minimum, strong sanitization protocols and masks must be worn at all times by everyone except when filming on camera._________________________Instagram: http://www.instagram.com/mrkate and http://www.instagram.com/joeyzehr Tik Tok: @mrkate Snapchat: MrKateTwitter: http://www.twitter.com/mrkateFacebook: http://www.facebook.com/mrkatedotcomPinterest: http://www.pinterest.com/mrkate/ _________________________Creative Credit: Audio Tracks - Epidemic Sound: http://share.epidemicsound.com/rGjgC","Join me, Mr. Kate, as I take you on a journey through life, style, interior design, and DIY!","makeover decorating interior design diy transformation do it yourself haul vintage stylist funny kate albrecht joey zehr mr. kate the mr kate mrkate.com clothes beauty tutorials tutorial how to on the cheap budget thrift thrifted","e4wajXk_cDs"
b_ZvcYYCTdA,"Kristin And Jen Try Every Trader Joe's Vegan Food | Kitchen & Jorn","UCsN7kK_cJKG4PtP5AC8MP4A","The Kitchen & Jorn Show","22","1235.0","https://i.ytimg.com/vi/b_ZvcYYCTdA/default.jpg","[none]","Kristin and Jen (AKA Kitchen & Jorn) try all of Trader Joe's vegan foods!Subscribe to our Patreon: https://www.patreon.com/kitchenandjornFollow us on Instagram: @jenrigatoni, @itskristinchirico, @itskitchenandjornVideo edited by: Kelly Duong","New videos every Friday at 12PM PST!The wonderful and beloved creation of Kristin Chirico and Jen Ruggirello! Do you love hilarious queer women who are also HOT? Do you wanna laugh/cry/and kiss our beautiful faces? Then subscribe to The Kitchen & Jorn Show! Videos about being gay, being silly, being lovely, and our lives as independent creators in Los Angeles!Channel Art by the wonderful Sarah Day (@sarahdayarts)","","e4wajXk_cDs"
62xQxbmEWmU,"Kristin And Jen Compete To Make The Best Pancake | Kitchen & Jorn","UCsN7kK_cJKG4PtP5AC8MP4A","The Kitchen & Jorn Show","26","728.0","https://i.ytimg.com/vi/62xQxbmEWmU/default.jpg","kristin and jen|kitchen and jorn|kitchen & jorn|jen from buzzfeed|kristin from buzzfeed|jen and kristin|jen ruggirello|kristin chirico|little food fight|lil food fight|pancakes","DISCLAIMER: This video was shot back in Fall and before Brie was out publicly. If any of y'all are being transphobic, you will be banned! Captions are on the way. Little food fight, baby!Subscribe to our Patreon: https://www.patreon.com/kitchenandjornVideo edited by: Oliver Rogue (https://www.youtube.com/c/OXRStudios)Video captioned by: Arielle StewartTitle cards by: Oliver Rogue (https://www.youtube.com/c/OXRStudios)Channel art by: Sarah Day (https://sarahdayarts.com)New videos every Friday!","New videos every Friday at 12PM PST!The wonderful and beloved creation of Kristin Chirico and Jen Ruggirello! Do you love hilarious queer women who are also HOT? Do you wanna laugh/cry/and kiss our beautiful faces? Then subscribe to The Kitchen & Jorn Show! Videos about being gay, being silly, being lovely, and our lives as independent creators in Los Angeles!Channel Art by the wonderful Sarah Day (@sarahdayarts)","","e4wajXk_cDs"
TF0W0uCpUT0,"Kristin Dresses Like Jen For A Week | Kitchen & Jorn","UCsN7kK_cJKG4PtP5AC8MP4A","The Kitchen & Jorn Show","22","941.0","https://i.ytimg.com/vi/TF0W0uCpUT0/default.jpg","kitchen and jorn|kristin and jen|kitchen & jorn|kristin chirico|jen ruggirello|jen from buzzfeed|kristin from buzzfeed|buzzfeed ladylike","Use code KITCHENANDJORN80 to get $80 off across 5 HelloFresh boxes, including free shipping on your first box at https://bit.ly/2IQNnYe.Subscribe to our Patreon: https://www.patreon.com/kitchenandjornVideo edited by: Mia Barnett (https://www.instagram.com/miapagebarnett)Video captioned by: Arielle StewartTitle cards by: Oliver Rogue (https://www.youtube.com/c/OXRStudios)Channel art by: Sarah Day (https://sarahdayarts.com)New videos every Friday!","New videos every Friday at 12PM PST!The wonderful and beloved creation of Kristin Chirico and Jen Ruggirello! Do you love hilarious queer women who are also HOT? Do you wanna laugh/cry/and kiss our beautiful faces? Then subscribe to The Kitchen & Jorn Show! Videos about being gay, being silly, being lovely, and our lives as independent creators in Los Angeles!Channel Art by the wonderful Sarah Day (@sarahdayarts)","","e4wajXk_cDs"
GydOSqmaw_w,"Do Exes See Their Breakup the Same Way? | Cut","UCbaGn5VkOVlcRgIWAHcrJKA","Cut","24","378.0","https://i.ytimg.com/vi/GydOSqmaw_w/default.jpg","Cut|Watch Cut|people|people videos|storytelling|relationships|Dating|Interviews|Firsts|couples|exes|love|Kids Try|games|challenges|Ethnic groups|People Interviews|Dares|Truth or Dare|100 ways|blind dates|100 people|experiments|#tbt|party games|Truth or Drink|HiHo Kids|Hiho|college|100 YOB|100 Years of Beauty|breakup|ex|boyfriend|girlfriend","Buy Truth or Drink: The Card Game - http://www.playtruthordrink.com/Buy Fear Pong: The Card Game - https://fearponggame.com/Visit our Store - https://buy.cut.com/Sponsor this series: http://www.cut.com/sponsorshipSUBSCRIBE: http://bit.ly/CutSubscribeDon't forget to subscribe and follow us!Official Site: https://www.cut.com/Facebook: http://cut.com/facebook Twitter: https://twitter.com/CutInstagram: http://cut.com/instagramSnapchat: @watchcut Cut Swag: http://cut.com/shopAbout Cut: Small questions have powerful effects when they go viral. Cut spreads stories for fun, for serious, and for real– bringing the internet together one awkward moment at a time.Produced, directed, and edited by https://cut.com Want to work with us? http://cut.com/hiring Want to be in a video? http://cut.com/casting Want to sponsor a video? http://cut.com/sponsorships For licensing inquiries: http://cut.com/licensingDo Exes See Their Breakup the Same Way?https://youtu.be/GydOSqmaw_w#breakup #exes #loveCuthttps://www.youtube.com/watchcut","Cut is for everyone.Sponsor our videos: cut.com/sponsorshipBuy Truth or Drink and Fear Pong now: buy.cut.comFollow us on:Facebook.com/watchcutTwitter.com/CutSnapchat: @watchcutInstagram: @Cut @100YOBSend us stuff!PO Box 19604Seattle, WA 98109","Cut WatchCut WatchCut WatchCut video weed would you rather beer pong lineup storytelling relationships Dating Interviews Firsts couples exes love Kids Try games challenges Dares Truth or Dare 100 ways blind dates 100 people experiments strangers Truth or Drink HiHoKids Hiho kids videos 100YOB 100 Yearsof Beauty FearPong TBT how couples sleep the button keep it 100","e4wajXk_cDs"
0eFdq5Fd2TU,"Trying 2021 Nail Art Trends","UCGCVyTWogzQ4D170BLy2Arw","Simply Nailogical","24","1289.0","https://i.ytimg.com/vi/0eFdq5Fd2TU/default.jpg","nails|nail art|nail tutorial|beauty tutorial|nail art tutorial|diy nails|diy nail art|simply nailogical|cristine|nail trends|2021|2020|2021 trends|fashion week|fashion trends|biting nails|retro nails|muted nails|nail style|nail art trends|smudge nail art|how not to streak nail polish","Stay at home and paint your nails💅😷Got boring nails? Just add a Holo Taco 💿🌮 Sign up for email updates to be notified about restocks ➡️ http://holota.co/holothere1 ♡ Subscribe to never miss n̶e̶w̶ ̶n̶a̶i̶l̶ ̶a̶r̶t̶ ̶t̶u̶t̶o̶r̶i̶a̶l̶s̶! http://bit.ly/subsimply♡ Subscribe to Holo Taco (for nail videos lol): http://bit.ly/SubHoloTaco♡ Subscribe to the Podcast to hear me have adult conversations: http://bit.ly/SubSimplyPodLogicalAllure article: https://www.allure.com/story/nail-trends-2021Simply historical piece on yellow nails: http://bit.ly/YellowNailsDontMatter_ _ _ _ _ _ _ _ _ _ _ _ _ _ _ _ _ _ _ _ _ _ _ _ _ _ _ _ _ _ _ _ _ _♡PRODUCTS USED IN THIS VIDEO:♡♥ Holo Taco - Peely Base♥ Holo Taco - Smoothing Base♥ Holo Taco - Rainbow Collection♥ Black & white acrylic paint: https://amzn.to/39hXEWN♥ Jade Crystal Glow Lolligloss Jelly (pink)♥ Holo Taco - Scattered Holo Taco & Flakie Holo Taco♥ Press-on nails: https://amzn.to/3bpeWny♥ Unreleased Holo Tacos👀♥ Essie orange: https://amzn.to/3bplK4z♥ OPI Nude: https://amzn.to/2LgiY7e♥ Essie brown: https://amzn.to/39g1S19♥ Essie pistachio: https://amzn.to/3q8HZ2P♥ Blue face masks: https://amzn.to/2Lye9WPTools:♥ Holo Taco - Rainbow Chrome Nail Tool Kit: https://www.holotaco.com/products/rainbow-chrome-nail-tool-kit♥ Holo Taco - One-Coat Black 🖤♥ Nail vinyls: http://bit.ly/NailVinyls1♥ Unreleased Holo Taco Brushes & clean-up brush👀_ _ _ _ _ _ _ _ _ _ _ _ _ _ _ _ _ _ _ _ _ _ _ _ _ _ _ _ _ _ _ _ _ _Stalk me on all the social medias!http://instagram.com/simplynailogicalhttps://www.snapchat.com/add/simplynailogicahttps://twitter.com/nailogicalhttps://www.facebook.com/simplynailogicalhttp://www.simplynailogical.com (archival materials)My other YouTube channels:https://www.youtube.com/simplypodlogicalhttps://www.youtube.com/holotacohttps://www.youtube.com/simplynotlogical_ _ _ _ _ _ _ _ _ _ _ _ _ _ _ _ _ _ _ _ _ _ _ _ _ _ _ _ _ _ _ _ _ _I film my nail videos with this camera: http://amzn.to/1MgznhtThis 105mm macro lens: http://amzn.to/1Pi8PM3I filmed my face in this video with this camera: https://amzn.to/327OB7bThis lens: https://amzn.to/38HnBgUVoiceover mic: http://amzn.to/1MefGpGAudio recorder: https://amzn.to/3dbtg1wExternal mic: https://amzn.to/32AnO3gRing light for face-cams: http://amzn.to/2cU7cNOI edit my videos with: http://bit.ly/videoeditor1I get some cool editing filters from: https://motionvfx.sjv.io/Ze3bRCheck out my personalized Amazon page with stuff I like! https://www.amazon.com/shop/simplynailogicalMusic: http://share.epidemicsound.com/SIMPLY_ _ _ _ _ _ _ _ _ _ _ _ _ _ _ _ _ _ _ _ _ _ _ _ _ _ _ _ _ _ _ _ _ _Disclaimer cause I love you guys: This video was not sponsored by any of the brands mentioned. All opinions are my own. Some links above are affiliate links.","Holo everyone, it's me Cristine. I'm not like other nail art channels. http://www.holotaco.comFollow me everywhere, cause you're a stalker:Instagram: @simplynailogicalMy cats' Instagrams: @menchiethecat @zylerthecatSnapchat: simplynailogica (no L!)Facebook: Simply NailogicalTwitter: @nailogicalSend me whatever you want! Nail polish, drawings of my cats, locks of your hair, anything goes (please skip illegal contraband)!Cristine / Simply NailogicalP.O. Box 35051 WestgateOttawa, ONK1Z 1A2CANADA(Companies: Please contact me first, ty!)","nail art nails nail art tutorial nail tutorial holo taco holo","e4wajXk_cDs"
iCkeNzHZHHU,"We Draft Our Celebrity Apocalypse Survival Team - You Can Sit With Us Ep. 26","UCRrigpc864fw8ZNsJ2AnEJA","TryPods","23","3259.0","https://i.ytimg.com/vi/iCkeNzHZHHU/default.jpg","tryguys|keith|ned|zach|eugene|habersberger|fulmer|kornfeld|yang|buzzfeedvideo|buzzfeed|ariel|ned & ariel|comedy|education|funny|try|learn|fail|experiment|test|tryceratops|podcast|advice|miles|miles nation|secrets|show|talkshow|behind the scenes|youtubers|ramble|audio|video podcast|clip|segment|silly|becky|maggie|you can sit with us|try wives|girls|female|women","Automatically save money while shopping online at https://joinhoney.com/sitwithusGet 20% off a premium quality chef’s knife at https://misen.com/sitwithusConsign your luxury items and earn up to 85% of the selling price at https://therealreal.comThis week Maggie gives us some medical myths and mysteries, and Becky has a new spooky show to dissect. Come sit with us!FOLLOW UShttp://www.Instagram.com/arielmfulmerhttp://www.Instagram.com/becksmecks2http://www.Instagram.com/magsbustamantehttp://www.twitter.com/becksmeckshttp://www.twitter.com/magsbustamanteYOU CAN SIT WITH USMaggie, Becky, and Ariel are your new best friends. In their weekly podcast they dive into female friendships, current events, and what's going on in their lives. Sit down with them, and enjoy!MUSICLicensed from AudioNetworkPODCAST PRODUCERMiles Bonsignore","The Try Guys have swam with sharks, survived in the wild, shocked themselves with birthing simulators, and risked their lives for their videos. In this weekly podcast they dissect their experiences as internet creators and best friends who have made a living failing upwards.","tryguys keith ned zach eugene habersberger fulmer kornfeld yang buzzfeedvideo buzzfeed ariel ned & ariel comedy education funny try learn fail experiment test tryceratops podcast comedy show miles cadence13 ramble","e4wajXk_cDs"
vfJbfpfiNek,"Guess What Cake This Is (Game)","UC4PooiX37Pld1T8J5SYT-SQ","Good Mythical Morning","24","892.0","https://i.ytimg.com/vi/vfJbfpfiNek/default.jpg","gmm|good mythical morning|rhettandlink|rhett and link|mythical|rhett|mclaughlin|link|neal|will it|taste test|season 18","Today, we're seeing who can guess what crazy cake is being built first. GMM #1888Thanks to Yolanda Gampp and the folks at the How to Cake It channel for allowing us to use their awesome videos! Check out more of their awesome cake builds on:YouTube: https://youtube.com/howtocakeitFacebook: https://facebook.com/howtocakeitInstagram: https://instagram.com/howtocakeitCheck out the Mythical Society: https://www.mythicalsociety.comSubscribe to GMM: https://www.youtube.com/goodmythicalmorning?sub_confirmation=1Watch today's GMMORE: https://youtu.be/9FciaSYVz-QClick the bell icon so you'll know when we add a new episode!Want more GMM? Check out these playlists:Season 17 - https://www.youtube.com/playlist?list=PLJ49NV73ttrvKwXQjGntFUjtYdhLcXaiuSeason 16 - https://www.youtube.com/playlist?list=PLJ49NV73ttrvCQhgIj1Ovt3g0PBlO18s2Will It? - https://www.youtube.com/playlist?list=PLJ49NV73ttrucP6jJ1gjSqHmhlmvkdZufTaste Tests! - https://www.youtube.com/playlist?list=PLJ49NV73ttrsUefw67wH_pnEJ5KwJZ7lNGet a copy of our novel, The Lost Causes of Bleak Creek @ http://www.bleakcreek.comPick up official GMM and Mythical merch at https://mythical.comand https://www.amazon.com/mythicalDon’t miss our weekly podcast, Ear Biscuits: https://applepodcasts.com/earbiscuitsFollow Mythical:Instagram: https://instagram.com/mythicalFacebook: https://facebook.com/mythicalTwitter: https://twitter.com/mythicalWebsite: https://mythical.comCheck Out Our Other Mythical Channels:Mythical Kitchen: https://youtube.com/mythicalkitchenRhett & Link: https://youtube.com/rhettandlinkGood Mythical MORE: https://youtube.com/goodmythicalmoreWant to send us something? https://mythical.com/contactSubmit your Wheel of Mythicality video here: http://bit.ly/GMMWheelIntroSUBMISSIONSIntro Animation by Dana Schechter https://www.danaschechter.com/Intro & Outro Music by Mark Byers http://www.markaholic.com/Supplemental Music from Extreme Production Music: https://www.extrememusic.com/Mic: ‘The Mouse’ by Blue Microphones https://www.bluemic.com/mouse/Get the GMM Set Gear!* Apple AirPort Extreme: https://amzn.to/2NnIvvk* Apple iPad Pro (12.9-inch, Wi-Fi, 64GB) - Space Gray (Latest Model) - MTEL2LL/A: https://amzn.to/2NnKXlw* Guardian Industrial Products DH-CP-4 3 Channel Rubber Cable Ramp (Straight): https://amzn.to/2NdshoR* Cartoni Focus HD Fluid Head with 3 Tube Ultra-Light Tripod, Mid-Level Spreader and Soft Case - Black: https://amzn.to/2X4i7X8* ARRI SkyPanel S60-C LED Softlight (Blue/Silver, Edison): https://amzn.to/2YgM3km* Chef-Master 90050 Professional Heat Lamp, Silver: https://amzn.to/2Xa1Wwr* Samsung UN40H5003 40-Inch 1080p LED TV (2014 Model): https://amzn.to/2NdMU4e* Sony LMDA170 17 Production Video LCD Monitor, 16:9 Native Aspect Ratio, 1080p Resolution: https://amzn.to/2YlB9tH* Behringer Xenyx 1002 Premium 10-Input 2-Bus Mixer with XENYX Mic Preamps and British Eqs: https://amzn.to/2Yeeqzl* Elgato Game Capture Card HD60 S - Stream and Record in 1080p60, for PlayStation 4, Xbox One & Xbox 360 (Renewed): https://amzn.to/2NdOBP6* Pyle Universal Speaker Stand Mount Holder - Heavy Duty Tripod w/ Adjustable Height from 40” to 71” and 35mm Compatible Insert - Easy Mobility Safety PIN and Knob Tension Locking for Stability PSTND2: https://amzn.to/2JcCpce* JBL EON612 Portable 12 2-Way Multipurpose Self-Powered Sound Reinforcement: https://amzn.to/2Ndluvm* Bolt 500 XT 3G-SDI/HDMI Wireless TX/RX: https://amzn.to/2J1OeSk* Voigtlaender 17,5/0,95 Nokton 17.5 mm-17.5 mm Lens: https://amzn.to/2JjUCEP* Blackmagic Design Micro Converter SDI to HDMI (with Power Supply) BMD-CONVCMIC/SH/WPSU: https://amzn.to/2J6iw6y* Panasonic H-HSA35100 F2.8 II ASPH 35-100mm Mirrorless Micro Four Thirds Mount POWER Optical I.S. LUMIX G X VARIO Professional Lens: https://amzn.to/2RAhIul* PANASONIC LUMIX Professional 12-35mm Camera Lens G X VARIO II, F2.8 ASPH, Dual I.S. 2.0 with Power O.I.S., Mirrorless Micro Four Thirds, H-HSA12035 (2017 Model, Black): https://amzn.to/2J9WH5S* Decimator Design DMON-12S | 12 Channel Multi Viewer with HDMI SDI Outputs: https://amzn.to/2J9Xkwg* Decimator MD-HX HDMI and SDI Cross Converter with Scaling & Frame Rate Conversion: https://amzn.to/2Ymj52c* PANASONIC LUMIX GH4 Body 4K Mirrorless Camera, 16 Megapixels, 3 Inch Touch LCD, DMC-GH4KBODY (USA Black): https://amzn.to/2WZjlD6* Blue Microphones Mouse Microphone Kc: https://amzn.to/2Ybu12I","Welcome to Good Mythical Morning with Rhett & Link! Tune in every Monday-Friday to watch us eat truly unbelievable things, explore surprising new products and trends, compete in original games with celebrity guests, implement serious experiments in hilarious ways, and more.Pick up official GMM and Mythical merch at https://mythical.comand https://www.amazon.com/mythicalJoin the Mythical Society: https://www.mythicalsociety.com/Order our new novel: https://bleakcreek.comFollow Mythical: Instagram: https://instagram.com/mythicalFacebook: https://facebook.com/mythicalTwitter: https://twitter.com/mythicalWebsite: https://mythical.com","gmm good mythical morning rhettandlink rhett and link mythical rhett mclaughlin link neal season 17 s17 will it taste test","e4wajXk_cDs"
