video_id,title,channelId,channelTitle,categoryId,duration,thumbnail_link,tags,description,channel_desc,channel_keywords,related_vid_id
RTHEdP7_sJQ,"Manchester United vs Manchester City 0-2 Post Match Analysis | solskjaer loses another Semi Finals 😡","UCH1zkar0bYnnIGHkyXTw4nA","Soccer Gossips","17","1297.0","https://i.ytimg.com/vi/RTHEdP7_sJQ/default.jpg","Manchester United|Manchester City|Manchester United vs Man City post match reaction|Man United vs Man City post match analysis|Man United vs Man City post match|Man United vs Man City 2020|Man United vs Man City highlights|Man United vs Man City|Man United|the united stand|man united post match|Solskjaer post match|Man United 0-2 Man City|Post Match Press Conference|Stretford Paddock|Adam McKola|Stephen Howson|Rants N Bants|UnitedPeoplesTV|Manutd vs Mancity","Man United vs Man City post match:MAN UTD 0 Man City 2 2020: Man United vs City Highlights 2020:Manchester United 0-2 Manchester City: Fernandinho and John Stones strike in second half to see off local rivals and book a place in the Carabao Cup final for the FOURTH year in a rowJohn Stones grabbed his first goal in over three years at the start of the second half to give Man City the leadFernandinho's supreme volley seven minutes from time made the semi-final safe for the Carabao Cup holdersGame had seen three goals ruled out for offside in the first half with Kevin de Bruyne also hitting the postCity will now look to win the competition for the fifth time in six years when they take on Tottenham in May 🎥  SUBSCRIBE youtube.com/c/SoccerGossips 📱 FOLLOW US 👍 Facebook: https://www.facebook.com/sgossips/📸 Instagram: https://www.instagram.com/soccer_gossips/👥 Twitter: https://twitter.com/soccer_gossipsCity were the superior team here, even if their victory was built on unlikely foundations – a goal from John Stones. It was 1,162 days since his last for the club – against Napoli in 2017 – and this one was bundled into goal off his thigh, a testament to determination more than any training ground scheme. Luke Shaw - 6Steady down the left flank for United without doing anything spectacular. Found his man with a couple of crosses but was limited by a hard-working Sterling and had a real wrestle with the City man for much of the match.Paul Pogba - 6Pogba has looked like he has been getting back to his best in recent weeks and looked sharp early on, pouncing on a loose City pass before overhitting a cross. Tried to get United going on the front foot after City's goal and teed up Fernandes for a wild shot but could not be the inspiration.Bruno Fernandes - 5A poor performance from United's key man when they needed him to step up. Harmless long-range shots in either half and a miscued pass to Rashford when United were on the break suggested a player searching for something that was not quite there. Wasted a great chance with 20 minutes to go when the ball sat up for him nicely in the box.Marcus Rashford - 6Fred - 7A fine long ball in the first half from Fred should have been controlled and finished by Rashford but the striker missed his touch. Mopped up loose balls well in midfield and worked hard to limit the opposition.Yet nobody in blue was complaining. The Carabao Cup may be fourth in any elite club’s wish list, but all derby victories have meaning, certainly one that condemns Manchester United to a fourth straight semi-final defeat.Victor Lindelof - 5Returning to the United defence after suffering a back problem on Boxing Day, Lindelof got back up to speed well. He and Maguire had to deal with the challenge of City's attackers not playing in a usual striker role so positioning was key in open play. But it was his missed clearance from the free-kick which allowed the ball to go through to Stones.Harry Maguire - 6Maguire made vital blocks in the league fixture between these teams last month but could not react quickly enough to block the free-kick for the goal when Lindelof made his misjudgement. Glanced a header wide from a first-half cornerAnd bragging rights are bragging rights, whether the taunts come on the factory floor or, in these strange times, over Zoom. #ManchesterUnited #MUFCIt does not bode well for United’s title challenge that this team has got in the habit of losing the big ones, and any fear that City might not be able to hang on as United searched for an equaliser ended when Fernandinho made it two with eight minutes to go.Anthony Martial - 5Like Rashford, Martial scored home and away against City last season but he rarely threatened in this one, badly miscuing his best chance when he had a header from Shaw's deflected cross. Fortunate not to be booked for diving late on as United searched for an equaliser.City won a corner, taken on the right by Kevin De Bruyne and United spurned two chances to clear.Anthony Martial’s clearing header didn’t quite get far enough, but at least it fell to a team-mate, Aaron Wan-Bissaka. Sadly, his header was absolutely dismal. Tame and short and straight to Fernandinho who struck a low shot from outside the area.","The LATEST in Players and Coaches gossips and entertainment news from Soccer Gossips, some of the best pieces from off the field! If a soccer play has bought it, said it, wore it or did it, Soccer Gossips has the story and something to say about it! Reporting on Most famous soccer teams, players, coaches and more.Make sure you subscribe and turn on notifications so you don't miss a single upload!","Soccer Post match Manchester united news managers reaction soccer interviews premier league news Jose Mourinho ole the united stand Manchester united fans pre match interviews premier league highlights goals skills documentaries premier league season matchday highlights and analysis football pre match highlights espnfc espnuk nbc sports manchester united news post match analysis Soccer Gossips Manchester Unted MUFC The United Stand Sky Sports thogden Optus Sport goals & highlights man united vs leeds preview NBC Sports","Dcw_V3gt-7w"
5AUDBJ9NNjU,"LIVERPOOL VS BURNLEY LIVE | 70K Q+A WATCHALONG!","UCBo6GODq8tM6iuIEvxFUEqw","James Lawrence Allcott","17","0.0","https://i.ytimg.com/vi/5AUDBJ9NNjU/default_live.jpg","[none]","James Allcott watches Liverpool vs Burnley at Anfield in the Premier League to celebrate hitting 70k subs!SUBSCRIBE TO THE CHANNEL HERE: 🎥👉https://www.youtube.com/jameslawrence...FOLLOW JAMES ON TWITCH👉 https://www.twitch.tv/jamesallcottJOIN US ON  THE JAFFN PATREON 🎧👉https://www.patreon.com/JamesandFlavSUBSCRIBE TO 'THE PROCESS': 🎧👉https://play.acast.com/s/theprocessFOLLOW JAMES ON TWITTER:👉https://twitter.com/jamesallcottFOLLOW JAMES ON INSTAGRAM:👉📸 @jlallcott","With a brain for statistics and an ability to add a humourous twist to every match, James is known as a refreshing and authentic personality in sport.Engrained in the fabric of football media, James has been placing the spotlight on fans for years, telling their stories through his work at Ball Street, XO and podcast 'Great Touch For A Big Lad'. A frequent guest on The Kick Off, captain of the XO team in the 2018 Wembley Cup, and a QPR season ticket holder, James is known for his (occasionally misplaced) optimism. James's was also recently announced as YouTube's 'Creator on The Rise' for his James Lawrence Allcott channel, which explores many themes that affect the millennial generation as well as the beautiful game.","james allcott james lawrence allcott premier league football soccer premier league youtube channel james alcott","Dcw_V3gt-7w"
PSqapdvrze8,"Barcelona’s Pedri not afraid to play alongside Lionel Messi – Ale Moreno | ESPN FC","UC6c1z7bA__85CIWZ_jpCK-Q","ESPN FC","17","263.0","https://i.ytimg.com/vi/PSqapdvrze8/default.jpg","espn fc|barcelona|barca|lionel messi|messi|pedri|pedri barcelona|messi pedri|pedri messi|pedri messi connection|pedri goal|barcelona vs athletic bilbao|athletic bilbao vs barcelona|athetic bilbao|athletic vs barcelona|ale moreno|alejandro moreno|ronald koeman|koeman|koeman barcelona|ronald koeman barcelona|espn|espnfc|soccer|football|julien laurens|messi barcelona|lionel messi goal|messi goal|barcelona analysis|barcelona news|espn fc uk|fc|la liga","Alejandro Moreno and Julien Laurens join Dan Thomas on ESPN FC to react to the emerging partnership between Barcelona’s Lionel Messi and Pedri, after both players scored in Barca’s 3-2 win vs. Athletic Bilbao. Moreno praises the 18-year-old’s comfort playing alongside Messi, something that his more experienced teammates have struggled with. The group also assesses how Ronald Koeman’s progress shaping the side is going.#ESPNFC #LaLiga #Barca✔ Subscribe to ESPN+: http://espnplus.com/soccer/youtube✔ Subscribe to ESPN FC on YouTube: http://bit.ly/SUBSCRIBEtoESPNFC","","soccer espn fc futbol football espn","Dcw_V3gt-7w"
0fldzrAVDpc,"Frank Lampard OUT at Chelsea? Is Brendan Rodgers next in line? | ESPN FC","UC6c1z7bA__85CIWZ_jpCK-Q","ESPN FC","17","386.0","https://i.ytimg.com/vi/0fldzrAVDpc/default.jpg","Frank Lampard|Frank Lampard Out|Frank Lampard sacked|Frank Lampard Chelsea|Lampard|Frank Lampard sacked in the morning|Brendan Rodgers|Chelsea vs. Leicester|Chelsea reaction|Frank Lampard interview|ESPN FC|ESPN FC UK|Premier League|Premier League Reaction|Thomas Tuchel|Brendan Rodgers Chelsea|Brendan Rodgers Chelsea manager|Craig Burley|Frank Leboeuf|Shaka Hislop|Lampard sacked in the morning|Lampard out|ESPN Soccer|ESPN FC Soccer|EPL|Soccer","Things are unraveling, and unraveling FAST for Frank Lampard at Chelsea after yet another defeat in the Premier League, this time at the hands of Leicester City. Where did matters start to fall apart for Lampard? ESPN FC’s Craig Burley feels the inconsistency all throughout the pitch from defense to attack is a cause for concern for the Blues, who now sit in eighth in the league. Frank Leboeuf believes Leicester’s Brendan Rodgers might be the first choice to take over if Lampard is sacked, who could restore character in the entire squad. Shaka Hislop also chimes in whether or not Lampard will get the sack by the morning and why Thomas Tuchel isn’t the best option.#ESPNFC #Chelsea #PremierLeague #Lampard✔ Subscribe to ESPN+: http://espnplus.com/soccer/youtube✔ Subscribe to ESPN FC on YouTube: http://bit.ly/SUBSCRIBEtoESPNFC","","soccer espn fc futbol football espn","Dcw_V3gt-7w"
_-tuORFfhU8,"Man Utd 0-2 Man City - Pep Guardiola - 'Can't Wait To Go Back To Wembley' - Press Conference","UCiVg6vRhuyjsWgHkDNOig6A","BeanymanSports","17","453.0","https://i.ytimg.com/vi/_-tuORFfhU8/default.jpg","Football|Soccer|Beanyman|BeanymanSports|Beany|Sports|Premier League|Press Conference|Full|Interview|Presser|Manager|FULL|Post Match Press Conference|Post Match|Pre-match|soccer|sport|football|Carabao Cup|League Cup|Manchester City|Pep Guardiola|Man City|Man Utd|Manchester United","Manchester City manager Pep Guardiola speaks to the press following his team's 0-2 victory over Manchester United in the Carabao Cup.Please subscribe, like the video and share wherever you can!Help support the channel from only £0.99p a month!Get special loyalty badges next to your name in comments and live chat! You'll also get team badge emojis from your favourite team to use in live chat and premieres!! Click 'Join' below the video for more info or visit = https://www.youtube.com/channel/UCiVg6vRhuyjsWgHkDNOig6A/join**DO NOT copy and re-upload any part of this video anywhere otherwise copyright strikes will be made! You do not have my permission** I have all the necessary rights to use this footage, all my footage is licensed, please contact me if you're unsure, you can find my email address on my 'about' page.To make sure you don't miss any of my videoson this and my other channels please :Subscribe here!: http://bit.ly/BeanymanSportsSubTwitter: http://www.twitter.com/BeanymanSportsInstagram: https://www.instagram.com/beanymansportsFacebook: https://www.facebook.com/BeanymanSportsUse my link for $10 (£7.34) of FREE Bitcoin just for joining Coinbase! This is the perfect time to join! = https://www.coinbase.com/join/5a2fe94978112a01dabaf777If you want to help with the costs involved with running the channel you can also support me on my Patreon here = https://www.patreon.com/BeanymanSports","King of thumbnails! Bringing you all the latest press conferences, interviews & training footage!","Manchester United Liverpool Chelsea City Football Beanyman BeanymanSports Beany Interview Press Conference","Dcw_V3gt-7w"
gTPYJY6-kYI,"LIVERPOOL vs BURNLEY With Mark GOLDBRIDGE Live","UCFxG3MxHC1ogUglvJeMHmVQ","Mark Goldbridge That's Football","24","0.0","https://i.ytimg.com/vi/gTPYJY6-kYI/default_live.jpg","Goldbridge|Mark Goldbridge|Live football|Football|Liverpool vs Burnley|Liverpool Burnley|Liverpool live","Liverpool vs Burnley watchalong with Mark Goldbridge. Join in our live match watchalong with Mark Goldbridge 🔔 SUBSCRIBE here https://buff.ly/2pKx1mL","That's Football is the football fan channel where football fans can have their say on everything to do with the game they love. Manchester United, Liverpool, Spurs, Arsenal, Chelsea, Man City, Aston Villa. It doesn't matter what team you support. That's football is here to listen to your opinions and discuss football's biggest stories.Subscribe to The United Stand YouTube Channel here https://www.youtube.com/channel/UCMmVPVb0BwSIOWVeDwlPocQ","chelsea liverpool manchester united manchester city tottenham hotspur transfer gossip","Dcw_V3gt-7w"
QywoKFSsF-o,"Manchester United CANNOT LIVE with Liverpool & Man City if they play their best - Burley | ESPN FC","UCk8gzAOGprcGAFMWGzZ2zQw","ESPN UK","17","574.0","https://i.ytimg.com/vi/QywoKFSsF-o/default.jpg","espn|espn fc|espnfc|espn uk|manchester city|manchester united|man city|man united|man utd|carabao cup|efl cup|carabao|manchester united manchester city|man united man city|manchester united man city|man utd man city|man united manchester city|united city|premier league|english premier league|epl|liverpool|manchester united title|ole gunnar solskjaer|solskjaer|solskjaer tactics|man united premier league|man united carabao cup|manchester derby","ESPN FC's Craig Burley and Frank Leboeuf react to Manchester City's 2-0 win over Manchester United in the Carabao Cup semifinal. Leboeuf praises Pep Guardiola's squad for a dominant performance while Burley believes Man United have no chance of keeping pace with Liverpool or Man City if either team plays at their best.#ESPNFCSubscribe to ESPN UK: http://bit.ly/1oGUzVAFollow ESPN UK across multiple platforms:https://en-gb.facebook.com/ESPNUKhttps://twitter.com/ESPNUKhttps://www.espn.co.uk/","Welcome to ESPN UK, home to some of the best sports analysis and discussion on YouTube.Subscribe to keep up to date with all the major happenings in the world of Football.","football video espn premier league nfl american sport nba mma cricket f1","Dcw_V3gt-7w"
TU6-xmBpqvw,"The ESPN FC panel react to THAT Christian Pulisic photoshoot | ESPN FC Extra Time","UC6c1z7bA__85CIWZ_jpCK-Q","ESPN FC","17","1138.0","https://i.ytimg.com/vi/TU6-xmBpqvw/default.jpg","Leicester vs Chelsea|Chelsea vs Leicester|Chelsea Leicester|Leicester Chelsea|Chelsea highlights|Leicester highlights|Chelsea vs|Christian Pulisic|Pulisic GQ|GQ photoshoot|Pulisic photo|Pulisic photoshoot|Pulisic Chelsea|Brendan Rodgers|Ralph Hasenhüttl|Max Allegri|Chelsea news|Frank Lampard|Lampard sacked|Lampard out|Lampard news|Lampard press conference|Lampard Chelsea|Rodgers|Brendan Rodgers to Chelsea|espnfc|espn fc|espn fc extra time|espn","ESPN FC's Craig Burley, Frank Leboeuf and Shaka Hislop answer your tweets on Extra Time, including:(0:35) Who is the best replacement should Chelsea decide to sack Frank Lampard: Brendan Rodgers, Ralph Hasenhuttl or Max Allegri?(2:33) Recent rumors have Chelsea linked with Erling Haaland. Is he the right player to get the Blues back to winning ways?(4:52) Do the FC guys think Christian Pulisic's GQ photoshoot will hinder him at Chelsea?(12:25) Will West Ham finish in the Premier League top eight?✔ Subscribe to ESPN+: http://espnplus.com/soccer/youtube✔ Subscribe to ESPN FC on YouTube: http://bit.ly/SUBSCRIBEtoESPNFC","","soccer espn fc futbol football espn","Dcw_V3gt-7w"
nJGj-EsY8q8,"Pep Guardiola - Man Utd v Man City - Pre-Match Press Conference","UCiVg6vRhuyjsWgHkDNOig6A","BeanymanSports","17","626.0","https://i.ytimg.com/vi/nJGj-EsY8q8/default.jpg","Football|Soccer|Beanyman|BeanymanSports|Beany|Sports|Premier League|Press Conference|Full|Interview|Presser|Manager|FULL|Post Match Press Conference|Post Match|Pre-match|football|soccer|sport|man city|man utd|manchester|manchester city|pep guardiola","Manchester City manager Pep Guardiola holds a press conference ahead of Saturday's clash with Manchester United.Guardiola has no doubts about rival manager Ole Gunnar Solskjaer’s quality – but knows results will ultimately determine the Norwegian’s future at Old Trafford.Please subscribe, like the video and share wherever you can!Help support the channel from only £0.99p a month!Get special loyalty badges next to your name in comments and live chat! You'll also get team badge emojis from your favourite to use in live chat and premieres!! Click 'Join' below the video for more info or visit = https://www.youtube.com/channel/UCiVg6vRhuyjsWgHkDNOig6A/join**DO NOT copy and re-upload any part of this video anywhere otherwise copyright strikes will be made! You do not have my permission** I have all the necessary rights to use this footage, my footage is licensed through agencies, please contact me if you're unsure, you can find my email address on my 'about' page.To make sure you don't miss any of my videoson this and my other channels please :Subscribe here!: http://bit.ly/BeanymanSportsSubTwitter: http://www.twitter.com/BeanymanSportsInstagram: https://www.instagram.com/beanymansportsFacebook: https://www.facebook.com/BeanymanSportsIf you want to help with the costs involved with running the channel you can also support me on my Patreon here = https://www.patreon.com/BeanymanSports","King of thumbnails! Bringing you all the latest press conferences, interviews & training footage!","Manchester United Liverpool Chelsea City Football Beanyman BeanymanSports Beany Interview Press Conference","Dcw_V3gt-7w"
7Qorj0DvSqA,"MAN UNITED 0-2 MAN CITY - Carabao Cup Reaction","UCnU7ly6zEcQxUScjhkgFYAQ","Thogden","17","9521.0","https://i.ytimg.com/vi/7Qorj0DvSqA/default.jpg","united|city|man united|man city|city united|united v city|united vs city|man united vs man city|man united v man city|united v man city|man united vs man city live|united live|manchester derby|goldbridge|united stand|man united stand|man united v man city live|united v city live|united city live|manchester|thogden|thogdad|mark goldbridge|united stand live|mufc|mufc live|city highlights|Man City 2-0 man United|Man United 0-2 Man City","Watch Man United 0-2 Man City Carabao Cup Reaction Highlights with Thogden and Thogdad! Man United Man City Live in EPL. Predict the score in the live chat to win today's giveaway... #MUFC #MCFC #EPL                                     ↓Open for links↓►FACEBOOK: https://www.facebook.com/Thogden►Twitter: http://twitter.com/thogden►INSTAGRAM: http://instagram.com/thogden►Business Enquiries: thogden.pr@gmail.com==============================================","Hello! My Name is Theo and this is my channel. I upload what I enjoy making the most and that is usually to do with football. I make videos going to football matches and about my life!Contact me:Twitter: @thogdenFacebook: @ThogdenInstagram: @ThogdenBUSINESS EMAIL BELOWbusiness@nextleveltalent.co.uk","Thogden Football Bolton BWFC Championship Premier League Liverpool Arsenal Chelsea Spurs True Geordie Arsenalfantv Hashtag United England Threelions Russia bolton wanderers man united copa90 dortmund scotland celtic rangers premier league EFL","Dcw_V3gt-7w"
mQVmenyxqYA,"Solskjaer's VAN DE BEEK Update! Lingard on the Move? Man Utd Transfer News","UCMmVPVb0BwSIOWVeDwlPocQ","The United Stand","24","2013.0","https://i.ytimg.com/vi/mQVmenyxqYA/default.jpg","Manchester United|Man United|Man Utd|Manchester United TV|The United Stand|United Stand|Manchester United News|MUFC|Man Utd News|United|Manchester United 2020|Manchester United Latest News|Manchester United Transfer News|Transfer|Solskjaer|Ole Gunnar Solskjaer|Solskjaer news|Solskjaer press conference|Ole Gunnar Solskjaer Press Conference|Van De Beek|Bruno|Bruno Fernandes|Cavani|Edinson Cavani|Cavani ban|Cavani FA Ban|Moises Caicedo","Man Utd midfielder Donny Van De Beek will have to wait for his United chance says Solskjaer and Jesse Lingard makes transfer plans to leave according to reports. Get the latest Man Utd Transfer News on The United Stand. . 🔔 SUBSCRIBE to That's Football here https://buff.ly/2pKx1mLUnited Stand Exclusive T Shirt collection https://united-stand.myshopify.com/🚨VISIT OUR WEBSITE 🚨For all the latest United news and TUS content:https://www.theunitedstand.com⏲️The United Stand Content TIMELINE is the best way to find all our latest content quickly! https://www.theunitedstand.com/timeline📰 LATEST WRITTEN NEWS https://www.theunitedstand.com/articles/latest-news📸 FOLLOW OUR INSTAGRAMhttps://www.instagram.com/theunitedstandtv/✅ The United Stand MEMBERSHIP https://buff.ly/2I2Of9R📧Contact The United Stand = soccerboxtv@gmail.com📧WRITER SUBMISSIONS = unitedstandwebsite@gmail.comAddressing: Jamie or NoraSee the FULL United Stand Kit Range CLICK HERE https://buff.ly/2Krpw1zEXCLUSIVE NEW PODCAST ITUNES https://buff.ly/2ZUhv84Spotify https://buff.ly/34dwEo6Google Podcast https://buff.ly/2ZHlNDnCastBox https://buff.ly/2UuiU3RRadio Public https://buff.ly/34jWkzAThe United Stand is Manchester United's biggest independent fan channel. Made for Manchester United fans by Manchester United fans, the United Stand provides you with the latest Manchester United transfer news, highlights, goal reviews and much more. So if MUFC means the world to you, get involved and subscribe to The United Stand http://bit.ly/1CmczHm#ManchesterUnited #MUFC","Manchester United news and updates from the number one independent Manchester United fan channel on YouTube. The United Stand provides you with the latest Manchester United transfer news, highlights, goal reviews and much more. So if you love football, get involved and join the United Stand.We provide Manchester United fans a platform to express real fan opinionated content from the people who matter most - Manchester United fans. No scripted ex professional footballers, no out of touch journalists, the United Stand totally focused on Manchester United fans views. Whether it's Man Utd players in the first time or the Manchester United academy. So get involved and have your say on the biggest club in world football. Manchester United.","Manchester United ManUtd Man Utd Man United Manchester United FC The United Stand Manchester United Man Utd football soccer manchester united news man u manchester united fans football news transfer news jose mourinho mourinho football transfer news manchester united transfer news goals highlights manutd man utd news mark goldbridge manchester united academy","Dcw_V3gt-7w"
bgd0009qTzM,"'STALE' Liverpool have been CARRYING Mohamed Salah for months! - Hutchison | ESPN FC","UCk8gzAOGprcGAFMWGzZ2zQw","ESPN UK","17","351.0","https://i.ytimg.com/vi/bgd0009qTzM/default.jpg","espn|espn uk|espn fc|espn fc uk|espn soccer|espn football|espn liverpool|espn manchester united|liverpool|manchester united|man united|man utd|liverpool manchester united|liverpool vs manchester united|liverpool news|liverpool transfer news|salah|mohamed salah|jurgen klopp|sadio mane|paul pogba|liverpool man united|ole gunnar solskjaer|premier league|premier league news|gab and juls|espn premier league|espn premier league analysis|firmino","ESPN FC's Gab Marcotti and Julien Laurens (The Gab and Juls Show) are joined by Don Hutchison to analyse the big Premier League game of the weekend, Liverpool vs. Manchester United. Man United sat top of the table going into the game and therefore remain on top after their 0-0 draw, however Laurens, who was at the game and spoke to Harry Maguire, claims the United players were disappointed to come away with the draw and felt they could have taken all 3 points from Liverpool. Luke Shaw also spoke after the game and stated United were unlucky not to win, something Liverpool captain Jordan Henderson disagreed with. Marcotti questions what the issue may be for Liverpool who have now gone four games without a win in the league. Hutchinson believes Jurgen Klopp's men are getting stale and Klopp needs to consider signing some top players in January if they are to retain the Premier League title. Hutchinson also feels as though the Liverpool team have been carrying Mohamed Salah and feels he would be dropped if it wasn't for Diogo Jota being out injured.Subscribe to ESPN UK: http://bit.ly/1oGUzVAFollow ESPN UK across multiple platforms:https://en-gb.facebook.com/ESPNUKhttps://twitter.com/ESPNUKhttps://www.espn.co.uk/","Welcome to ESPN UK, home to some of the best sports analysis and discussion on YouTube.Subscribe to keep up to date with all the major happenings in the world of Football.","football video espn premier league nfl american sport nba mma cricket f1","Dcw_V3gt-7w"
