video_id,title,channelId,channelTitle,categoryId,duration,thumbnail_link,tags,description,channel_desc,channel_keywords,related_vid_id
uVcSnJduRlg,"Carly Waddell and Evan Bass Split: What Went Wrong","UCVxZlxikHMY8LzspzinH1ww","Us Weekly","24","121.0","https://i.ytimg.com/vi/uVcSnJduRlg/default.jpg","Carly Waddell|evan bass|bachelor nation","Shut down! Carly Waddell slammed speculation about the timeline of her separation from Evan Bass after the Bachelorette alum’s ex-wife, Marie Bass, alleged they split nearly two years before it was announced.Subscribe for more Us Weekly videos! - https://bit.ly/33yer6Ohttps://www.usmagazine.com/Follow Us Weekly on Facebook: https://www.facebook.com/UsWeeklyFollow Us Weekly on Instagram: https://www.instagram.com/usweekly/Follow Us Weekly on Twitter: https://twitter.com/usweekly","Get today's top celebrity news, celebrity photos, style tips, exclusive video, Red Carpets and more on UsMagazine.com, the official website of Us Weekly","","5PtKZ5cx3v8"
d-QTB_fjZdQ,"HOW TO GET ON THE BACHELOR, OUR STORY | Carly Waddell and Evan Bass","UCiRBm8w6yfSJdly2wwfe0rw","Carly Waddell","22","785.0","https://i.ytimg.com/vi/d-QTB_fjZdQ/default.jpg","[none]","My husband Evan and I discuss how we got onto The Bachelor franchise. Our experiences were SO different, so we discuss tips and advice to getting on the show!Thank you so much for watching! I hope you enjoyed today's video. Be sure to like and subscribe to see more of my adventures on YouTube. New videos will be uploaded every Sunday!CARLY'S Instagram: http://instagram.com/carlywadCARLY's Twitter: https://twitter.com/carlywaddellListen to Mommies Tell All Podcast: https://podcasts.apple.com/us/podcast/mommies-tell-all/id1457381834EVAN's Instagram: http://instagram.com/theebassEVAN's Twitter: https://twitter.com/ebassclinicsCamera I Use: https://amzn.to/2Yf0pmmCamera Lens: https://amzn.to/30ppLAzMicrophone Attachment: https://amzn.to/30rcszRTripod: https://amzn.to/2UsveTzFor Youtube Business-Related Inquiries contact: CarlywaddellYT@gmail.comFTC // This video is not sponsored | Amazon and Reward Style are affiliate links. All opinions are my own! ♡","Hi y'all, I'm Carly Waddell, welcome to my channel! You may know me from The Bachelor or Bachelor In Paradise where I met my husband, Evan Bass. I'm excited to give you a deeper look inside my life through my YouTube channel! My life is a constant balancing act between being a wife, a mommy, and taking time for myself. On my channel, I'll be diving into all things beauty, mommy life, family time, and behind the scenes of my experience on a reality show. I'm going to be posting new videos every Sunday, so be sure to SUBSCRIBE! ♡","","5PtKZ5cx3v8"
ZwCWEmWbKaY,"THE OFFICIAL CHATWINS HOUSE TOUR! | Full House Walkthrough of Every Room in Our Dream Home","UC2TTY2iAEYVAWimBjU-NvHA","The Chatwins","22","3775.0","https://i.ytimg.com/vi/ZwCWEmWbKaY/default.jpg","chatwins|chatfam|chatwins house tour|the chatwins house tour|chatwins full house tour|chatwins official house tour|chatwins entire home tour|chatwins net worth|chatwin homes|chatfam house tour|luxury house tour|multimillion dollar house|multimillion dollar house tour|real estate house tour|house walkthrough|my house|my house tour|our house tour|ace family house tour|labrant house tour|bingham house tour|jake paul house tour|mr beast house tour|house","Finally!!!  CHATWINS HOUSE TOUR!! We promised for 2 entire years that we would do the House Tour soon haha... and in 2019 we promised it would be in 2020. Today happens to be the last day in 2020, and although this was without question the hardest video we have ever made, I think you guys will enjoy it. It literally took all day, sun up to sun down to film, since we had to take breaks when the babies weren't napping and they kept wanting to play haha. It was tough but we did it. This is the offical Chatwins Chatfam house tour of 2020. Full entire house walkthrough of every room. Since we had triplets and a 4 year old, and a baby on the way, we had to get creative and strategic on where their rooms were and whether they should sleep with one of their siblings in the same room or not. Hope you enjoy the full house tour. Love you all and Happy New Year! Here's to making 2021 the best year yet. It's just a decision in your own head that you have to decide. We got this! Let's dominate 2021 Chatfam xoxoHOUSE TOUR Merch Promouse Code HOUSETOUR at Checkouthttp://bit.ly/313FEtt ROYAL ROOM LINKSRug https://rstyle.me/cz-n/eu2xu2cgwrfCribhttps://rstyle.me/cz-n/eu2ynscgwrfWallpaper - Code: CHATWIN15 https://loomwell.com/products/arrow-wallpaper?_pos=1&_sid=b157ad96a&_ss=rLong Live Boy Hood Signshttps://opalplusolive.com/products/copy-of-bright-eyed-bushy-tailed-straight-font?_pos=1&_sid=3a32a7c7a&_ss=rInspirational Men of Historyhttps://emzicompany.comNumero 74 teepeehttps://en.smallable.com/search?q=Numero+74+teepeeNumero 74 wall pouchhttps://en.smallable.com/search?q=Numero+74+wall+pouchGathre Maphttps://gathre.com/products/midi-plus?_pos=4&_sid=166324218&_ss=rLeather Chairhttps://rstyle.me/cz-n/eu26vccgwrfBlack & White Pouf https://rstyle.me/cz-n/eu26xtcgwrfCrib Sheets - Code: CARA15https://www.mebiebaby.com/collections/crib-sheets/products/chestnut-textiles-crib-sheetCuddle & Kind Knit Dollshttps://cuddleandkind.com/?gclid=EAIaIQobChMI5fbtm6TJ7QIVoyCtBh3BOgQ_EAAYASAAEgIJovD_BwELittle Unicorn Bison Beddinghttps://littleunicorn.com/search?type=product&q=BisonSaranoni Blanketshttps://saranoni.comHatch Baby Sound Machinehttps://rstyle.me/cz-n/eu27vvcgwrfSubscribe to our new YouTube Gaming channel: Daddy D!https://bit.ly/35q6lhuCara's Woman's Clothing Boutique: Chatwin Collectionhttp://bit.ly/chatwincollectionGet a free $250 doorbell camera from Vivint Smarthome!Easily the best security system out there http://bit.ly/347tLFDJoin the CHATFAM. SUBSCRIBE!  https://bit.ly/2rETUtiMake sure you like, subscribe, comment, turn on post notifications, and follow our Instagram accounts since we will be doing shout outs every video.Send us Mail! (include your email address for a thank you)P.O. Box 970571Orem, UT84097Follow us on Instagram!FAMILY: @thechatwinsCARA: @carachatwinDARIK: @darikchatwinGEMMA: @gemma_chatwinTRIPLETS: @chatwintripletsChatwin Collection: @chatwincollection TikTok: https://vm.tiktok.com/93p3tT/Facebook:https://www.facebook.com/thechatwins/Twitter!https://twitter.com/TheChatwins2020 is the year of the CHATFAM!XO♥️ Cara, Darik, Gemma, Reese, Royal, Wren & Pia. #TheChatwins #family #vlog #familyvlog Thanks for watching the video","Hi, we're the Chatwins! Darik, Cara , our beautiful daughter Gemma, and of course the TRIPLETS, Reese, Royal and Wren who just joined our family. Oh and mom is PREGNANT with baby boy due in February 2021. This is the story of our lives. Happy for the adventure yet to come and the opportunity to share it with all of you! Join the family!Join the CHATFAM!We love each and every one of you. Be sure to Subscribe! Follow us on Instagram!FAMILY: https://www.instagram.com/thechatwinsCARA: https://www.instagram.com/carachatwinDARIK: https://www.instagram.com/darikchatwinGEMMA: https://www.instagram.com/gemma_chatwinTRIPLETS: https://www.instagram.com/chatwintripletsSee you soon!XO The Chatwins","birth vlog baby mama dance the Chatwins chatfam triplets triplet baby mama dance twins parenting pregancy triplet pregancy we are pregnant gender reveal pregnancy reveal New parents mom dad father mother parents parenting mom life day in the life daily vlogs family vlogs family vlogger family vlogging vlogger vlog family vlog young family pregnant mom baby vlog family channel mom vlog YouTube family fun life large family family family friendly family life toddlers kids baby babies baby vlog pregnancy pregnant pregnancy vlog triplets","5PtKZ5cx3v8"
0QkE7Yo4R_o,"VLOG: WE MET SANTA CLAUS! | Carly Waddell","UCiRBm8w6yfSJdly2wwfe0rw","Carly Waddell","22","405.0","https://i.ytimg.com/vi/0QkE7Yo4R_o/default.jpg","[none]","Hey everyone!! I hope you enjoyed today's video! When my parents told me they were having a socially-distant Santa Claus at their popcorn shop, I was SO excited to take Bella and Charlie! I am linking the Sweet Charlotte website & social media down below!Sweet Charlotte: https://sweetcharlotte.store/Facebook: @sweetcharlottepopcornInstagram: @sweet_charlotte_popcornCARLY'S Instagram: http://instagram.com/carlywadCARLY's Twitter: https://twitter.com/carlywaddellListen to Mommies Tell All Podcast: https://podcasts.apple.com/us/podcast/mommies-tell-all/id1457381834Camera I Use: https://amzn.to/2Yf0pmmCamera Lens: https://amzn.to/30ppLAzMicrophone Attachment: https://amzn.to/30rcszRTripod: https://amzn.to/2UsveTzFor Youtube Business-Related Inquiries contact: CarlywaddellYT@gmail.comFTC // This video is not sponsored | Amazon and Reward Style are affiliate links. All opinions are my own! ♡","Hi y'all, I'm Carly Waddell, welcome to my channel! You may know me from The Bachelor or Bachelor In Paradise where I met my husband, Evan Bass. I'm excited to give you a deeper look inside my life through my YouTube channel! My life is a constant balancing act between being a wife, a mommy, and taking time for myself. On my channel, I'll be diving into all things beauty, mommy life, family time, and behind the scenes of my experience on a reality show. I'm going to be posting new videos every Sunday, so be sure to SUBSCRIBE! ♡","","5PtKZ5cx3v8"
xdP0FSkshfE,"Life Update + Dating after Divorce","UCXWbqygoT5kFia4_R8tycdQ","Krystal Nielson","22","700.0","https://i.ytimg.com/vi/xdP0FSkshfE/default.jpg","coachkrystal|krystalnielson|fitness|bachelor|workout|hiit|5 min workout|cardio|abs|at-home workout","Hello, YouTube! It's been a while... and we have lots to catch up on.xx, Krystal","","fitness hiit cardio workout 5 min workout fitness tips","5PtKZ5cx3v8"
S7DfWkexrlA,"Carly And Evan Get Married! - Bachelor In Paradise","UCVc-qp-0L4zjR_QUEr0SAHw","Bachelor Nation on ABC","24","291.0","https://i.ytimg.com/vi/S7DfWkexrlA/default.jpg","the bachelor|the bachelorette|bachelor nation|abc|abc television|reality tv|chris harrison|bachelor|saeaon 4|bachelor in paradise|bachelor couple|carly waddell|evan bass|wedding|couple|love|engagements|marriage","A clip from the wedding ceremony of Bachelor In Paradise cast members Carly Waddell and Evan Bass. (From Bachelor In Paradise Season 4, Episode 1B).","The official YouTube channel for ABC's The Bachelor Franchise. Watch Matt's journey Mondays at 8|7c. 🌹","","5PtKZ5cx3v8"
Mr5YmPWC9JQ,"SHOCKING ULTRASOUND... TWINS?! | LAUREN & ARIE","UCkoZyNqTZyBZ8nu8E_OSkWw","Lauren & Arie","22","847.0","https://i.ytimg.com/vi/Mr5YmPWC9JQ/default.jpg","Lauren and Arie|Arie and Lauren|Lauren Burnham|Lauren Luyendyk|Arie Luyendyk|Twins|Twin pregnancy|Natural Twins|Fraternal twins|Bachelor Twins|The Bachelor","Many of you watched our journey through loss and our recent pregnancy announcement. We are so so grateful for all of the love and support from you guys! We feel so lucky. Follow along and subscribe to see this amazing part of our lives unfold.Watch our pregnancy announcement: https://youtu.be/2Up7Jbtg37ASubscribe to follow along on our pregnancy journey!Follow us on Instagram too!https://www.instagram.com/laurenluyendykhttps://www.instagram.com/ariejrhttps://www.instagram.com/alessiluyendykAs always, we love and appreciate every one of you!-Lauren and Arie Luyendyk","Hey guys we are Arie and Lauren and you may know us from The Bachelor! Season 22 was quite the ride but we want to share more with you. Join us for Bachelor recaps, family VLOGS, Lauren's beauty tips, travel and so much more! Please subscribe and we're excited for this journey ;)","","5PtKZ5cx3v8"
Lp6V4JVo9-U,"WHY I NEEDED TO BE GLUTEN FREE | Carly Waddell","UCiRBm8w6yfSJdly2wwfe0rw","Carly Waddell","22","636.0","https://i.ytimg.com/vi/Lp6V4JVo9-U/default.jpg","[none]","I can't wait to share in future videos my favorite gluten free recipes, and what I eat in a day on a gluten free diet! I wanted to share my story on how I found out I needed to be gluten free because it's such an important part of my life. Let me know in the comments what other types of gluten free videos you would like to see from me!Here is the link to the lab where I bought my test: https://www.enterolab.comInstagram: http://instagram.com/carlywadTwitter: https://twitter.com/carlywaddellListen to Mommies Tell All Podcast: https://podcasts.apple.com/us/podcast/mommies-tell-all/id1457381834Camera I Use: https://amzn.to/2Yf0pmmCamera Lens: https://amzn.to/30ppLAzMicrophone Attachment: https://amzn.to/30rcszRTripod: https://amzn.to/2UsveTz For Youtube Business-Related Inquires contact: CarlywaddellYT@gmail.com","Hi y'all, I'm Carly Waddell, welcome to my channel! You may know me from The Bachelor or Bachelor In Paradise where I met my husband, Evan Bass. I'm excited to give you a deeper look inside my life through my YouTube channel! My life is a constant balancing act between being a wife, a mommy, and taking time for myself. On my channel, I'll be diving into all things beauty, mommy life, family time, and behind the scenes of my experience on a reality show. I'm going to be posting new videos every Sunday, so be sure to SUBSCRIBE! ♡","","5PtKZ5cx3v8"
Mt3b5XhVkf0,"MY NEWBORN ESSENTIALS + MUST HAVES: 2020 | Carly Waddell","UCiRBm8w6yfSJdly2wwfe0rw","Carly Waddell","22","1026.0","https://i.ytimg.com/vi/Mt3b5XhVkf0/default.jpg","Carly Waddell|Carly and Evan|Evan Bass|The Bachelor|Bachelor In Paradise|Newborn|Newborn Essentials|Newborn must haves","Hi y'all, welcome to my channel! Be sure to like and subscribe to see more of my adventures on YouTube. New videos will be uploaded every Sunday!Before I became a mom, I had NO idea what products I would need to make my new mommy life easier. I would ask for recommendations all the time from friends and family, so I really wanted to share with all of you what I was obsessed with for my newborn babies. Finding the right products for your baby can be SO TOUGH! And what might work for some babies, won't work for others. I hope this video is helpful for you! If you have any newborn must haves that I didn't mention, please share so we can all help each other out in the comments down below! :)Products I mentioned in this video (in order):Huggies Little Snugglers Baby Diapers, Size Newborn, 128 Ct - https://amzn.to/3haeKZXWaterWipes Baby Wipes, 60 Count - https://amzn.to/3e1ani5Huggies Natural Care Baby Wipes 3 pack- https://amzn.to/2AnOTNFBoudreaux's Butt Paste Diaper Rash Ointment | Maximum Strength- https://amzn.to/3cPGxeWBaby Nasal Aspirator NoseFrida the Snotsucker - https://amzn.to/3dPk3fmLittle Remedies Saline Spray and Drops | Safe for Newborns | 0.5 Fl Oz (Pack of 1) - https://amzn.to/2Uu6g69Puracy Organic Haircare and Skin Care Set, Natural Shower Gel, Shampoo, Conditioner, Moisturizer, 60 Ounce (4-Pack) - https://amzn.to/2AltcO3Puracy Organic Hand & Body Lotion, Fragrance Free Unscented- https://amzn.to/2Yny11mBaby bath sponges - https://amzn.to/37ngxq3Angelcare Baby Bath Support, Grey - https://amzn.to/3f6afxJZoLi BUZZ B | Electric Baby Nail Trimmer, Baby Nail File - https://amzn.to/2UugGTpPhilips Avent Soothie Snuggle Pacifier, 0-3 Months, Giraffe- https://amzn.to/2AZ8zXVPhilips AVENT Soothie Pacifier, 0-3 Months, Blue, 4 Pack- https://amzn.to/2Yi2AWlMAM Night Pacifiers (0-6 months)  - https://amzn.to/30oI9K0Dr. Brown's Baby Bottle, Options+ Anti-Colic Narrow Bottle, 8 Ounce (Pack of 4) - https://amzn.to/2zi4IVtPhilips AVENT Fast Bottle Warmer- https://amzn.to/2ziGfzoCooluli Mini Fridge Electric Cooler and Warmer (4 Liter / 6 Can): https://amzn.to/37eIznwWhite Noise Sound Machine | Portable Sleep Therapy for Home , Office , Baby & Travel- https://amzn.to/30sm6SAHatch Baby Rest Sound Machine, Night Light and Time-to-Rise - https://amzn.to/3f9yETcMotorola Video Baby Monitor 5” - https://amzn.to/2MMyvZwAden by aden + anais Swaddle Blanket- https://amzn.to/3cUQ0BOMiracle Blanket Swaddle Wrap for Newborn Infant Baby, Camper - https://amzn.to/37f5lM0Baby Merlin's Magic Sleepsuit -https://amzn.to/2zjxDbTSleepingBaby Zipadee-Zip Swaddle Transition Baby Swaddle - https://amzn.to/2YhZdPbSnuggle Me Organic | Baby Lounger - https://amzn.to/2XMNQiZBoppy Original Newborn Lounger  - https://amzn.to/2Up9OqkMuslin Burp Cloths 4 Pack- https://amzn.to/3cPXDJFBoppy Bare Naked Nursing Pillow and Positioner - https://amzn.to/3cMQSIrBoppy Original Pillow Cover, Earth Tone Woodland- https://amzn.to/3hbTZNoDiaper Genie - https://amzn.to/2Ye1smACARLY'S Instagram: http://instagram.com/carlywadCARLY's Twitter: https://twitter.com/carlywaddellListen to Mommies Tell All Podcast: https://podcasts.apple.com/us/podcast/mommies-tell-all/id1457381834Camera I Use: https://amzn.to/2Yf0pmmCamera Lens: https://amzn.to/30ppLAzMicrophone Attachment: https://amzn.to/30rcszRTripod: https://amzn.to/2UsveTzFor Youtube Business-Related Inquiries contact: CarlywaddellYT@gmail.comFTC // This video is not sponsored | Amazon and Reward Style are affiliate links. All opinions are my own! ♡","Hi y'all, I'm Carly Waddell, welcome to my channel! You may know me from The Bachelor or Bachelor In Paradise where I met my husband, Evan Bass. I'm excited to give you a deeper look inside my life through my YouTube channel! My life is a constant balancing act between being a wife, a mommy, and taking time for myself. On my channel, I'll be diving into all things beauty, mommy life, family time, and behind the scenes of my experience on a reality show. I'm going to be posting new videos every Sunday, so be sure to SUBSCRIBE! ♡","","5PtKZ5cx3v8"
jtzo9yn59oM,"MY EGG FREEZING JOURNEY + VIDEO DIARY | Carly Waddell","UCiRBm8w6yfSJdly2wwfe0rw","Carly Waddell","22","858.0","https://i.ytimg.com/vi/jtzo9yn59oM/default.jpg","[none]","Hi everyone! This video is super special to me, and I'm excited to be able to show you my egg freezing experience. I hope you enjoyed going back in time with me a little! Thank you so much for watching!OVA Website: ovaeggfreezing.comCARLY'S Instagram: http://instagram.com/carlywadCARLY's Twitter: https://twitter.com/carlywaddellListen to Mommies Tell All Podcast: https://podcasts.apple.com/us/podcast/mommies-tell-all/id1457381834EVAN's Instagram: http://instagram.com/theebassEVAN's Twitter: https://twitter.com/ebassclinicsCamera I Use: https://amzn.to/2Yf0pmmCamera Lens: https://amzn.to/30ppLAzMicrophone Attachment: https://amzn.to/30rcszRTripod: https://amzn.to/2UsveTzFor Youtube Business-Related Inquiries contact: CarlywaddellYT@gmail.comFTC // This video is not sponsored | Amazon and Reward Style are affiliate links. All opinions are my own! ♡","Hi y'all, I'm Carly Waddell, welcome to my channel! You may know me from The Bachelor or Bachelor In Paradise where I met my husband, Evan Bass. I'm excited to give you a deeper look inside my life through my YouTube channel! My life is a constant balancing act between being a wife, a mommy, and taking time for myself. On my channel, I'll be diving into all things beauty, mommy life, family time, and behind the scenes of my experience on a reality show. I'm going to be posting new videos every Sunday, so be sure to SUBSCRIBE! ♡","","5PtKZ5cx3v8"
mxcxqMyDDYM,"READING YOUR ASSUMPTIONS ABOUT US... INSECURITIES? RICH? AGAINST THE BACHELOR? DO WE HAVE JOBS?","UCkoZyNqTZyBZ8nu8E_OSkWw","Lauren & Arie","22","940.0","https://i.ytimg.com/vi/mxcxqMyDDYM/default.jpg","The Bachelor|Lauren and Arie|Arie Luyendyk|Lauren Luyendyk|Lauren Burnham|Assumptions about us","The assumptions about us! We reached out to our IG followers and these were some off the top assumptions about of. We were kind of shocked at some of them, check it out! Enjoy the vid and don't forget to subscribe :)Follow us on Instagram!https://www.instagram.com/laurenluyendykhttps://www.instagram.com/ariejrhttps://www.instagram.com/alessiluyendykAs always, we love and appreciate every one of you :)-Lauren and Arie Luyendyk","Hey guys we are Arie and Lauren and you may know us from The Bachelor! Season 22 was quite the ride but we want to share more with you. Join us for Bachelor recaps, family VLOGS, Lauren's beauty tips, travel and so much more! Please subscribe and we're excited for this journey ;)","","5PtKZ5cx3v8"
l_orydm_YDU,"OUR BACHELOR IN PARADISE STORY (Part 2) | Carly Waddell and Evan Bass","UCiRBm8w6yfSJdly2wwfe0rw","Carly Waddell","22","841.0","https://i.ytimg.com/vi/l_orydm_YDU/default.jpg","[none]","So, all our Bachelor In Paradise secrets are spilled! I have always gotten sooo many questions about Evan and my love story, so I'm excited to finally talk about it in depth!! I hope you guys liked this video and as always, be sure to SUBSCRIBE so you never miss a Sunday upload! Thank you for watching! CARLY'S Instagram: http://instagram.com/carlywadCARLY's Twitter: https://twitter.com/carlywaddellListen to Mommies Tell All Podcast: https://podcasts.apple.com/us/podcast/mommies-tell-all/id1457381834EVAN's Instagram: http://instagram.com/theebassEVAN's Twitter: https://twitter.com/ebassclinicsCamera I Use: https://amzn.to/2Yf0pmmCamera Lens: https://amzn.to/30ppLAzMicrophone Attachment: https://amzn.to/30rcszRTripod: https://amzn.to/2UsveTzFor Youtube Business-Related Inquiries contact: CarlywaddellYT@gmail.comFTC // This video is not sponsored | Amazon and Reward Style are affiliate links. All opinions are my own! ♡","Hi y'all, I'm Carly Waddell, welcome to my channel! You may know me from The Bachelor or Bachelor In Paradise where I met my husband, Evan Bass. I'm excited to give you a deeper look inside my life through my YouTube channel! My life is a constant balancing act between being a wife, a mommy, and taking time for myself. On my channel, I'll be diving into all things beauty, mommy life, family time, and behind the scenes of my experience on a reality show. I'm going to be posting new videos every Sunday, so be sure to SUBSCRIBE! ♡","","5PtKZ5cx3v8"
6U5OI2yIzRo,"MERRY CHRISTMAS (FOR ALESSI)","UCkoZyNqTZyBZ8nu8E_OSkWw","Lauren & Arie","22","942.0","https://i.ytimg.com/vi/6U5OI2yIzRo/default.jpg","Alessi Ren|Alessi Luyendyk|Christmas Vlog|Luyendyk Christmas|Arie and Lauren|Lauren Luyendyk|Lauren and Arie","This ones for you Alessi :) More of a home video than a vlog but hopefully you look back at this when you're older and smile :) Your mom and I love you very much and hope you had the best Christmas!Mom and Dad xoxoFor everyone else watching, hope you enjoy our home video for Alessi and don't forget to Subscribe to follow along !Follow us on Instagram too!https://www.instagram.com/laurenluyendykhttps://www.instagram.com/ariejrhttps://www.instagram.com/alessiluyendykAs always, we love and appreciate every one of you!-Lauren and Arie Luyendyk","Hey guys we are Arie and Lauren and you may know us from The Bachelor! Season 22 was quite the ride but we want to share more with you. Join us for Bachelor recaps, family VLOGS, Lauren's beauty tips, travel and so much more! Please subscribe and we're excited for this journey ;)","","5PtKZ5cx3v8"
ArzZdgPvFgc,"BABY NAMES I LOVE BUT WON'T BE USING | Carly Waddell","UCiRBm8w6yfSJdly2wwfe0rw","Carly Waddell","22","592.0","https://i.ytimg.com/vi/ArzZdgPvFgc/default.jpg","Carly Waddell|Evan Bass|Carly and Evan|The Bachelor|Bachelor in Paradise|baby names i love but won't be using|baby names","Hi y'all, welcome to my channel! Be sure to like and subscribe to see more of my adventures on YouTube. New videos will be uploaded every Sunday!I am OBSESSED with baby names, so I would LOVE to read your favorite baby names in the comments down below! As always, thank you so much for watching! ♡CARLY'S Instagram: http://instagram.com/carlywadCARLY's Twitter: https://twitter.com/carlywaddellListen to Mommies Tell All Podcast: https://podcasts.apple.com/us/podcast/mommies-tell-all/id1457381834Camera I Use: https://amzn.to/2Yf0pmmCamera Lens: https://amzn.to/30ppLAzMicrophone Attachment: https://amzn.to/30rcszRTripod: https://amzn.to/2UsveTzFor Youtube Business-Related Inquiries contact: CarlywaddellYT@gmail.comFTC // This video is not sponsored | Amazon and Reward Style are affiliate links. All opinions are my own! ♡","Hi y'all, I'm Carly Waddell, welcome to my channel! You may know me from The Bachelor or Bachelor In Paradise where I met my husband, Evan Bass. I'm excited to give you a deeper look inside my life through my YouTube channel! My life is a constant balancing act between being a wife, a mommy, and taking time for myself. On my channel, I'll be diving into all things beauty, mommy life, family time, and behind the scenes of my experience on a reality show. I'm going to be posting new videos every Sunday, so be sure to SUBSCRIBE! ♡","","5PtKZ5cx3v8"
atfqKmwnkRY,"Caelynn Confronts Tayshia - The Bachelor","UCVc-qp-0L4zjR_QUEr0SAHw","Bachelor Nation on ABC","24","99.0","https://i.ytimg.com/vi/atfqKmwnkRY/default.jpg","the bachelor|the bachelorette|bachelor nation|abc|abc television|abc network|reality tv|chris harrison|bachelor in paradise|the bachelor winter games|bachelorette 2018|season 23|the bachelor season 23|colton underwood","Caelynn confronts Tayshia about what she had said to Colton.Watch The Bachelor with Colton Underwood Mondays on ABC!","The official YouTube channel for ABC's The Bachelor Franchise. Watch Matt's journey Mondays at 8|7c. 🌹","","5PtKZ5cx3v8"
