video_id,title,channelId,channelTitle,categoryId,duration,thumbnail_link,tags,description,channel_desc,channel_keywords,related_vid_id
pnR52GbCAjo,"I’m not a ‘Yes Man’ - Shaq responds to James Harden | First Take","UCiWLfSweyRNmLpgEHekhoAg","ESPN","17","268.0","https://i.ytimg.com/vi/pnR52GbCAjo/default.jpg","first take|espn|nba|james harden|first take today|stephen a smith|stephen a|stephen a. smith|shaq|shaquille o'neal|basketball|sports|shaquille oneal|james harden nets|kyrie irving|nets|kevin durant|kyrie nets|brooklyn nets|stephen a james harden|first take nba|espn first take|harden|irving|#nba|nba news|nba first take|first take james harden|espn nba|kellerman|first take espn|max kellerman","Shaquille O’Neal joins First Take and addresses James Harden possibly having an issue with him saying it is ‘championship or bust’ for Harden and the Brooklyn Nets this season.#FirstTake #NBA✔️ Subscribe to ESPN+https://plus.espn.com/✔️ Get the ESPN App: http://www.espn.com/espn/apps/espn✔️ Subscribe to ESPN on YouTube: http://es.pn/SUBSCRIBEtoYOUTUBE✔️ Subscribe to NBA on ESPN on YouTube: http://bit.ly/SUBSCRIBEtoNBAonESPN✔️ Watch ESPN on YouTube TV: http://es.pn/YouTubeTVESPN on Social Media:► Follow on Twitter: http://www.twitter.com/espn► Like on Facebook: http://www.facebook.com/espn► Follow on Instagram: http://www.instagram.com/espnVisit ESPN on YouTube to get up-to-the-minute sports news coverage, scores, highlights and commentary for NFL, NHL, MLB, NBA, College Football, NCAA Basketball, soccer and more. More on ESPN.com: https://www.espn.com","ESPN on YouTube features up-to-the-minute sports news coverage, scores, highlights and commentary for NFL, NHL, MLB, NBA, College Football, NCAA Basketball, Soccer, Fantasy, UFC/Boxing and more. ✔ Subscribe to ESPN on YouTube: http://es.pn/SUBSCRIBEtoYOUTUBE✔ Watch ESPN on YouTube TV: http://es.pn/YouTubeTVGet more ESPN on YouTube:► First Take: http://es.pn/FirstTakeonYouTubeESPN on Social Media:► Follow on Twitter: http://www.twitter.com/espn► Like on Facebook: http://www.facebook.com/espn► Follow on Instagram: http://www.instagram.com/espnMore on ESPN.com: http://www.espn.com","espn sports sports news sports live sports clips sports videos sports center sportscenter sports channel sports documentaries first take the jump sportsnation outside the lines nfl live nba countdown highlights","bMzpGpSUqWE"
9wia18rcY80,"Cade Cunningham College and High School Highlights — Future No.1 Pick?!","UC9-OpMMVoNP5o10_Iyq7Ndw","Bleacher Report","17","331.0","https://i.ytimg.com/vi/9wia18rcY80/default.jpg","bleacher report|br|nba|college basketball|cade cunningham|cade cunningham highlights|cade cunningham nba draft|cade cunningham 2021 draft|cade cunningham oklahoma state|cade cunningham 2020|cade cunningham high school|cade cunningham nba|cade cunningham montverde|cade cunningham mixtape|cade cunningham 2021|cade cunningham nba comparison|cade cunningham guard|cade cunningham big 12|cade cunningham oklahoma state sooneers|cade cunningham sooners","Oklahoma State point guard Cade Cunningham could be the number one pick in the 2021 NBA Draft. The former top-3 high school recruit is a 6-foot-8 big guard! Subscribe: https://www.youtube.com/user/BleacherReport?sub_confirmation=1Follow on IG: http://www.instagram.com/br_hoopsFollow us on Twitter: http://www.twitter.com/brhoopsLike us on Facebook: http://www.facebook.com/bleacherreport","The official YouTube page of Bleacher Report. Subscribe to see sports highlights, features and animations that drive fandom and bring the culture of sports to life.","sports bleacher report nba mma ufc football basketball nfl mlb baseball playoffs","bMzpGpSUqWE"
ugFLt8cIIzM,"Ravens vs. Titans Super Wild Card Weekend Highlights | NFL 2020 Playoffs","UCDVYQ4Zhbm3S2dlz7P1GBDg","NFL","17","600.0","https://i.ytimg.com/vi/ugFLt8cIIzM/default.jpg","NFL|Football|offense|defense|American Football|highlight|highlights|game|sport|play|plays|season|postseason|playoffs|2020|touchdown|td|game highlights|super wild card weekend|best plays|top plays|ravens|baltimore|bal|titans|tennessee|ten|ravens titans game highlights|ravens highlights|titans highlights|ravens td|titans td|wild card|lamar jackson td|lamar|derrick henry","The Baltimore Ravens take on the Tennessee Titans during Super Wild Card Weekend of the 2020 NFL postseason.Subscribe to NFL: http://j.mp/1L0bVBuCheck out our other channels:Para más contenido de la NFL en Español, suscríbete a https://www.youtube.com/nflenespanolNFL Fantasy Football https://www.youtube.com/nflfantasyfootballNFL Vault http://www.youtube.com/nflvaultNFL Network http://www.youtube.com/nflnetworkNFL Films http://www.youtube.com/nflfilmsNFL Rush http://www.youtube.com/nflrushNFL Play Football https://www.youtube.com/playfootballNFL Podcasts https://www.youtube.com/nflpodcasts#NFL #NFLPlayoffs #SuperWildCard","The official YouTube page of the NFL.Subscribe to the NFL YouTube channel to see immediate in-game highlights from your favorite teams and players, daily fantasy football updates, all your favorite NFL podcasts, and more!","NFL highlights Football offense defense afc nfc Super Bowl American Football full nfl games full game National Football League sports professional football fantasy fantasy football Patriots Jets Bills Dolphins Giants Redskins Cowboys Eagles Bengals Browns Ravens Steelers Vikings Packers Bears Lions Chargers Broncos Raiders Chiefs Seahawks Rams 49ers Cardinals Titans Colts Jaguars Texans Saints Panthers Buccaneers Bucs Niners Pats Falcons","bMzpGpSUqWE"
elkS8MEHY0Q,"Buccaneers vs. Saints Divisional Round Highlights | NFL 2020 Playoffs","UCDVYQ4Zhbm3S2dlz7P1GBDg","NFL","17","651.0","https://i.ytimg.com/vi/elkS8MEHY0Q/default.jpg","NFL|Football|offense|defense|American Football|highlight|highlights|game|sport|play|plays|season|postseason|playoffs|2020|touchdown|td|game highlights|divisional roumd|divisional|best plays|top plays|buccaneers|bucs|tampa bay|tb|new orleans|saints|no|bucs saints game highlights|bucs highlights|saints highlights|bucs td|saints td|tom brady|drew brees","The Tampa Bay Buccaneers take on the New Orleans Saints during the Divisional Round of the 2020 NFL postseason.Subscribe to NFL: http://j.mp/1L0bVBuCheck out our other channels:Para más contenido de la NFL en Español, suscríbete a https://www.youtube.com/nflenespanolNFL Fantasy Football https://www.youtube.com/nflfantasyfootballNFL Vault http://www.youtube.com/nflvaultNFL Network http://www.youtube.com/nflnetworkNFL Films http://www.youtube.com/nflfilmsNFL Rush http://www.youtube.com/nflrushNFL Play Football https://www.youtube.com/playfootballNFL Podcasts https://www.youtube.com/nflpodcasts#NFL #NFLPlayoffs #NFLDivisionalRound","The official YouTube page of the NFL.Subscribe to the NFL YouTube channel to see immediate in-game highlights from your favorite teams and players, daily fantasy football updates, all your favorite NFL podcasts, and more!","NFL highlights Football offense defense afc nfc Super Bowl American Football full nfl games full game National Football League sports professional football fantasy fantasy football Patriots Jets Bills Dolphins Giants Redskins Cowboys Eagles Bengals Browns Ravens Steelers Vikings Packers Bears Lions Chargers Broncos Raiders Chiefs Seahawks Rams 49ers Cardinals Titans Colts Jaguars Texans Saints Panthers Buccaneers Bucs Niners Pats Falcons","bMzpGpSUqWE"
TTTJd4qptxU,"THE TRUTH ABOUT LAMELO BALL'S HISTORIC TRIPLE DOUBLE! | YOUNGEST IN NBA HISTORY!?","UCs3G7P_AE_iSOuJBt6lNqeQ","DKM","17","481.0","https://i.ytimg.com/vi/TTTJd4qptxU/default.jpg","lamelo ball|lamelo ball triple double|lamelo triple double|lamelo ball highlights|lamelo ball vs atlanta hawks|melo ball|lamelo|lamelo ball news|lamelo ball triple double vs atlanta hawks|lamelo vs trae young|lamelo ball vs hawks|lamelo ball nbl|lamelo ball vs lonzo ball|lonzo ball exposed|dkm|theflightmike|ballfacts|getlikecoop|charlotte hornets|lamelo ball interview|ball family|ball brothers|pelicans|g-league|liangelo|lavar","FOLLOW ME OVER ON TWITCH FOR LIVESTREAMS!https://www.twitch.tv/dkm_ytSUBSCRIBE TO MY 2ND CHANNEL (SOCCER/FOOTBALL)https://www.youtube.com/channel/UC_qKMHj0ge-rqYqb0HYgN9gFOLLOW MY NEW INSTAGRAM!!!https://www.instagram.com/zflockhart/FOLLOW MY TWITTER https://twitter.com/DKM_SportsCLICK HERE TO JOIN THE DISCORD COMMUNITY SERVERhttps://discord.com/invite/Zp5YvZa*Copyright Disclaimer Under Section 107 of the Copyright Act 1976, allowance is made for fair use for purposes such as criticism, comment, news reporting, teaching, scholarship, and research. Fair use is a use permitted by copyright statute that might otherwise be infringing. Non-profit, educational or personal use tips the balance in favor of fair use. No copyright infringement intended. ALL RIGHTS BELONG TO THEIR RESPECTIVE OWNERS*#lamelo #lameloball #charlottehornetsGullible","20-year-old content creator, sports fanatic who breaks down, offers analysis and brings you up-to-the-minute news and views on everything basketball related.","DKM Basketball Ball Family NBA NBL Euroleague college ball brothers g-league high school","bMzpGpSUqWE"
woDg0bxw9XM,"LaMelo Ball on first NBA game vs. Lonzo: 'It was cool to be out there with him' | NBA on ESPN","UCiWLfSweyRNmLpgEHekhoAg","ESPN","17","154.0","https://i.ytimg.com/vi/woDg0bxw9XM/default.jpg","lamelo ball|lamelo|lamelo ball interview|lamelo interview|lamelo ball vs lonzo ball|lamelo vs lonzo|melo ball|melo|melo interview|lamelo ball vs pelicans|lamelo ball postgame|lamelo postgame|lamelo vs pelicans|charlotte hornets vs new orleans pelicans|hornets vs pelicans|hornets pelicans|charlotte hornets|hornets|new orleans pelicans|pelicans|lonzo ball|lonzo|nba on espn|espn nba|nba interviews|lamelo ball espn|espn|espn live|nba|basketball|nba news","Charlotte Hornets rookie LaMelo Ball speaks to reporters in a postgame interview after his first game vs. the New Orleans Pelicans and brother Lonzo Ball.#NBA #Sports✔️ Donate now to Jimmy V Fund here: https://www.v.org/v-week/✔️Subscribe to ESPN+ http://espnplus.com/youtube✔️ Get the ESPN App: http://www.espn.com/espn/apps/espn✔️Subscribe to ESPN on YouTube: http://es.pn/SUBSCRIBEtoYOUTUBE✔️ Subscribe to NBA on ESPN on YouTube: http://bit.ly/SUBSCRIBEtoNBAonESPN✔️ Watch ESPN on YouTube TV: http://es.pn/YouTubeTVESPN on Social Media:► Follow on Twitter: http://www.twitter.com/espn► Like on Facebook: http://www.facebook.com/espn► Follow on Instagram: http://www.instagram.com/espnVisit ESPN on YouTube to get up-to-the-minute sports news coverage, scores, highlights and commentary for NFL, NHL, MLB, NBA, College Football, NCAA Basketball, soccer and more. More on ESPN.com: https://www.espn.com","ESPN on YouTube features up-to-the-minute sports news coverage, scores, highlights and commentary for NFL, NHL, MLB, NBA, College Football, NCAA Basketball, Soccer, Fantasy, UFC/Boxing and more. ✔ Subscribe to ESPN on YouTube: http://es.pn/SUBSCRIBEtoYOUTUBE✔ Watch ESPN on YouTube TV: http://es.pn/YouTubeTVGet more ESPN on YouTube:► First Take: http://es.pn/FirstTakeonYouTubeESPN on Social Media:► Follow on Twitter: http://www.twitter.com/espn► Like on Facebook: http://www.facebook.com/espn► Follow on Instagram: http://www.instagram.com/espnMore on ESPN.com: http://www.espn.com","espn sports sports news sports live sports clips sports videos sports center sportscenter sports channel sports documentaries first take the jump sportsnation outside the lines nfl live nba countdown highlights","bMzpGpSUqWE"
9HP1Z45OE4c,"AFC Championship Thursday Press Conferences | Chiefs vs. Bills","UC-hXefb6XBFSubWz6Ezf_lA","Kansas City Chiefs","17","0.0","https://i.ytimg.com/vi/9HP1Z45OE4c/default_live.jpg","kansas city chiefs|chiefs|press conference|nfl|kansas city|national football league|andy reid|brett veach|arrowhead|arrowhead stadium|chiefs training camp|training camp|nfl training camp|tyrann mathieu|travis kelce|patrick mahomes|clark hunt|afc championship|chiefs vs bills|chiefs press conferences","Watch Chiefs coaches and players speak with the media ahead of the AFC Championship. #BUFvsKCTentative Schedule:Andy Reid & Coordinators - 1:30pm CTChiefs Players - 1:40pm CTSubscribe for more videos! https://bit.ly/2OuOUnBMore Chiefs NFL action! https://bit.ly/2Moa1VR#KansasCityChiefs #Chiefs #NFLFollow Our Social Media!Website: https://www.chiefs.com/Facebook: https://www.facebook.com/KansasCityChiefsTwitter: https://twitter.com/ChiefsInstagram: https://www.instagram.com/chiefs","Welcome to the official YouTube page of the Kansas City Chiefs and Chiefs Kingdom.Subscribe to the Kansas City Chiefs YouTube channel for the most recent updates, highlights, series and much more.","Kansas City Chiefs Chiefs NFL Football American Football Kansas City Arrowhead Arrowhead Stadium Chiefs Kingdom Chefs Cheifs Chiefs Highlights Chiefs Recap Chiefs Breakdown Chiefs Storylines Chiefs Podcast Patrick Mahomes Andy Reid Tyrann Mathieu Frank Clark Travis Kelce Tyreek Hill Chris Jones","bMzpGpSUqWE"
XT6FIN5TVKg,"Shaq, Kenny and Chuck React to James Harden Being Traded to the Brooklyn Nets | NBA on TNT","UCU7iRrk3xfpUk0R6VdyC1Ow","NBA on TNT","17","530.0","https://i.ytimg.com/vi/XT6FIN5TVKg/default.jpg","NBA on TNT|NBA|Inside the NBA|Charles Barkley|Shaq|Kenny Smith|Ernie Johnson|Houston Rockets|Brooklyn Nets|James Harden|Kyrie Irving|Kevin Durant","The Inside guys discuss the blockbuster deal that sent Rockets superstar James Harden to the Brooklyn Nets to join Kevin Durant and Kyrie Irving. Watch highlights from Inside the NBA with Shaq, Charles Barkley, Kenny Smith and Ernie Johnson and more! Subscribe now to be updated on the latest videos: https://www.youtube.com/nbaontnt?sub_confirmation=1Connect with NBA on TNT:Follow NBA on TNT on Twitter: https://twitter.com/NBAonTNTLike NBA on TNT on Facebook: https://www.facebook.com/NBAONTNT/Follow NBA on TNT on Instagram: https://www.instagram.com/nbaontnt/?hl=en","The official YouTube page of the NBA on TNT","NBA on TNT Inside the NBA Basketball Shaq NBA on TNT Charles Barkley Kenny Smith Ernie Johnson Inside NBAonTNT","bMzpGpSUqWE"
wuvtSOPCwBM,"BEST Premier League Team Goals | Manchester United, Arsenal, Liverpool & more! | Part 2","UCG5qGWdu8nIRZqJ_GgDwQ-w","Premier League","17","868.0","https://i.ytimg.com/vi/wuvtSOPCwBM/default.jpg","Premier League|epl|PL|Manchester United|Arsenal|Liverpool|Chelsea|Man United|Man City|Marcus Rashford|Bruno Fernandes|Paul Pogba|Aubameyang|Mesut Ozil|Ozil|team goals|Premier League team goals|tiki taka|tiki-taka|football|soccer|Premier League goals|Premier League highlights|พรีเมียร์ลีก|ประตู|ฟุตบอล|ไฮไลท์|ทีมเวิร์ค|ติกิ ตาก้า|ทีม|อาร์เซน่อล|เชลซี|แมนเชสเตอร์ ซิตี้|แมนเชสเตอร์ ยูไนเต็ด|ลิเวอร์พูล|เชฟฟิลด์ ยูไนเต็ด|วูล์ฟแฮมป์ตัน วันเดอเรอร์ส|Raheem Sterling","Following Neal Maupay’s goal for Brighton & Hove Albion versus Leeds United and Marcus Rashford finishing a fine Manchester United move against Sheffield United, we’ve created a compilation of some of the best team goals produced in the Premier League. This video features goals scored by Pierre-Emerick Aubameyang (Arsenal), George Baldock (Sheffield United), Wilfried Zaha (Crystal Palace), Jamie Vardy (Leicester City), Raheem Sterling (Manchester City), Jose Enrique (Liverpool), Diogo Jota (Wolverhampton Wanderers), Willian (Chelsea) and more!Who scored the best goal? Let us know in the comments.Best team goals part 1 👉  https://youtu.be/9YGyP4ObC-Uหลังจากได้เป็นประตูที่ นีล โมเปย์ ดาวยิงของ ไบรท์ตัน แอนด์ โฮฟ ยิงใส่ ลีดส์ ยูไนเต็ด และการจบสกอร์จากการเข้าทำสุดสวยของ มาร์คัส แรชฟอร์ด ในเกมกับ เชฟฟิลด์ ยูไนเต็ด เราเลยรวบรวมประตูสวยๆจากทีมเวิร์คที่เกิดขึ้นในพรีเมียร์ลีกมาให้ชมกัน!พบกับประตูของ ปิแอร์-เอเมอริค โอบาเมยอง(อาร์เซน่อล), จอร์จ บัลด็อก(เชฟฟิลด์ ยูไนเต็ด), วิลฟรีด ซาฮา(คริสตัล พาเลซ), เจมี่ วาร์ดี้(เลสเตอร์ ซิตี้), ราฮีม สเตอร์ลิ่ง(แมนเชสเตอร์ ซิตี้), โฆเซ่ เอ็นริเก้(ลิเวอร์พูล), ดิโอโก้ โจต้า(วูล์ฟแฮมป์ตัน วันเดอเรอร์ส), วิลเลี่ยน(เชลซี) และอีกเพียบ!ตามไปชมตอนที่ 1 ได้ที่นี่ 👉  https://youtu.be/9YGyP4ObC-USubscribe to the official Premier League YouTube channel: http://preml.ge/PremierLeagueYouTube Premier League website: http://preml.ge/PremierLeagueWebsiteFollow the Premier League on Instagram: http://preml.ge/PremierLeagueInstagramFollow the Premier League on Twitter: http://preml.ge/PremierLeagueTwitterLike the Premier League on Facebook: http://preml.ge/PremierLeagueFacebookPlay Fantasy Premier League: http://preml.ge/FantasyPremierLeagueTo license Premier League match footage: https://imgreplay.com/contact#PremierLeague #Goals #TeamGoals #Football #Soccer #พรีเมียร์ลีก #ทีม #ฟุตบอลYour safety onlineVisit the Child Exploitation and Online Protection website for confidential support if something has happened online which has made you feel unsafe, if you are worried about someone else or to report online abuse. (https://www.ceop.police.uk/safety-centre)You should contact the Police by calling 999 if you or anybody else is in any sort of danger.Visit CEOP’s Thinkuknow website for advice and guidance on safe surfing and staying safe online for example when using mobile phones, blogs, social media, chatting, online gaming and emailing. (https://www.thinkuknow.co.uk)You can also visit the Premier League safeguarding page for more information. (https://www.premierleague.com/safeguarding)","Welcome to the official Premier League YouTube channel. Keep up to date with the latest content from the Premier League.Subscribe to the official Premier League YouTube channel: http://preml.ge/PremierLeagueYouTube Premier League website: http://preml.ge/PremierLeagueWebsiteFollow the Premier League on Instagram: http://preml.ge/PremierLeagueInstagramFollow the Premier League on Twitter: http://preml.ge/PremierLeagueTwitterLike the Premier League on Facebook: http://preml.ge/PremierLeagueFacebookPlay Fantasy Premier League: http://preml.ge/FantasyPremierLeague","premier league football soccer fantasy premier league premier league goals premier league highlights fpl fyi epl fplfyi premierleague fpl show epl goals epl highlights fantasy premier league show uncut top 5 football highlights football goals trickbox fpl prem uncut premier league football highlights soccer highlights goals highlights","bMzpGpSUqWE"
38L_hrG0hUA,"San Antonio Spurs vs Golden State Warriors Highlights 2nd Quarter | NBA Season 2021 - Jan 20","UCehxny23v1JLXg-2_n4vBsQ","Triple-Double","17","369.0","https://i.ytimg.com/vi/38L_hrG0hUA/default.jpg","[none]","San Antonio Spurs vs Golden State Warriors Highlights 2nd Quarter | NBA Season 2021 - Jan 20","","","bMzpGpSUqWE"
fqh9P7Hgl7Y,"BREAKING: LaMelo Ball Sponsors AAU TEAM Manager Jermaine Jackson to Coach! 1 of 1!","UCHqIh6m396zqJ2El9aVqvPg","AB the HERO!","17","246.0","https://i.ytimg.com/vi/fqh9P7Hgl7Y/default.jpg","lavar ball|lonzo ball|lamelo ball|big baller brand|Liangelo Ball|ball family|ball brothers|tina Ball|AB the HERO|JBA League|Lamelo ball Hornets|Lonzo Ball Pelicans|dkm|ball facts|BREAKING: LaMelo Ball Sponsors AAU TEAM Manager Jermaine Jackson to Coach! 1 of 1!|lamelo ball aau|lamelo ball jermaine jackson|lamelo ball manager|lamelo ball pumpa hoops|2020 nba draft prospects|melo ball|jermaine jackson nba","BREAKING: LaMelo Ball Sponsors AAU TEAM Manager Jermaine Jackson to Coach! 1 of 1!For More Check Me out on Social Media: @ABtheHEROABtheHERO.comGet Ur #ABtheHERO Merch! HERE: https://bit.ly/2QmX17fDonate and Support the Movement: https://goo.gl/i665WDSubscribe for more: https://goo.gl/9E3NfSEquipment:Camera: https://amzn.to/3krUu7fLens: https://amzn.to/3orJY2cMic: https://amzn.to/31FgDruLaptop: https://amzn.to/3mxgvCzCapture card 1: https://amzn.to/34w83NLCapture card 2: https://amzn.to/3onvuk0Lights: https://amzn.to/3jq7wRtLights: https://amzn.to/31DVi1JColored lights: https://amzn.to/35tAdbeColored lights: https://amzn.to/3dWGEHIUSB Mic: https://amzn.to/31Fi2OVDesk: https://amzn.to/35qYwGQRonin S: https://amzn.to/34q7fcR","Dropping Knowledge! on All things JBA, Big Baller Brand, NBA, NFL, Sports, Business, and Da Culture!","sports film vlog Lavar Ball Lamelo Ball Lonzo Ball Lakers big baller brand puma hoops sportswear nba basketball charlotte hornets new orleans pelicans","bMzpGpSUqWE"
0hfkp_y1Ppo,"THE CHARLOTTE HORNETS Are TRYING To RUIN LAMELO BALL ft(Lonzo Ball)","UCYNdELP1pU88VzshXSewEQg","GETLIKECOOP","17","542.0","https://i.ytimg.com/vi/0hfkp_y1Ppo/default.jpg","LaMelo Ball|LaMelo Ball Hornets|LaMelo Ball Charlotte Hornets|Charlotte Hornets|LaMelo Ball vs Lonzo Ball|LaMelo Ball starting|Lonzo Ball|New Orleans Pelicans|Zion Williamson|Gordon Hayward|Devonte' Graham|Devonte Graham|Terry Rozier|LaMelo Ball highlights|Lonzo Ball Highlights|LiAngelo Ball|LiAngelo Ball NBA|BBB|Brandon Ingram|espn|undisputed|stephen a smith","THE CHARLOTTE HORNETS Are TRYING To RUIN LAMELO BALL ft(Lonzo Ball)Twitter ⚡︎ http://twitter.com/glikecoopStream⚡︎  http://twitch.tv/getlikecoopREBUILD CHANNEL SUB TO THIS  ⚡︎  https://www.youtube.com/channel/UCznjVj7Edwgxt7EKbRGX6JwNFL Channel ⚡︎ https://www.youtube.com/channel/UCH_rIwb01dGsWlMnpOMTOygInstagram ⚡︎ http://instagram.com/glikecoop","The best source for entertaining NBA News and Insight.","nba nba news basketball","bMzpGpSUqWE"
8WDAJJVWbsA,"Max reacts to the Rockets trading James Harden to the Nets | First Take","UCiWLfSweyRNmLpgEHekhoAg","ESPN","17","435.0","https://i.ytimg.com/vi/8WDAJJVWbsA/default.jpg","james harden|first take james harden|max kellerman|james harden trade|houston rockets|nba news|nba|james harden rockets|espn|james harden nets|rockets|nba on espn|james harden houston rockets|espn nba|james harden espn|harden|harden trade|brooklyn nets|nba trade|nba 2020|first take|james harden brooklyn nets|brooklyn nets trade|stephen a smith|harden nets|nets|nba espn|brooklyn|stephen a|first take today|nba james harden|rockets trade harden","Stephen A. Smith and Max Kellerman react to the Brooklyn Nets acquiring James Harden from the Houston Rockets in a 4-team blockbuster deal.#FirstTake #NBA✔️ Subscribe to ESPN+https://plus.espn.com/✔️ Get the ESPN App: http://www.espn.com/espn/apps/espn✔️ Subscribe to ESPN on YouTube: http://es.pn/SUBSCRIBEtoYOUTUBE✔️ Subscribe to NBA on ESPN on YouTube: http://bit.ly/SUBSCRIBEtoNBAonESPN✔️ Watch ESPN on YouTube TV: http://es.pn/YouTubeTVESPN on Social Media:► Follow on Twitter: http://www.twitter.com/espn► Like on Facebook: http://www.facebook.com/espn► Follow on Instagram: http://www.instagram.com/espnVisit ESPN on YouTube to get up-to-the-minute sports news coverage, scores, highlights and commentary for NFL, NHL, MLB, NBA, College Football, NCAA Basketball, soccer and more. More on ESPN.com: https://www.espn.com","ESPN on YouTube features up-to-the-minute sports news coverage, scores, highlights and commentary for NFL, NHL, MLB, NBA, College Football, NCAA Basketball, Soccer, Fantasy, UFC/Boxing and more. ✔ Subscribe to ESPN on YouTube: http://es.pn/SUBSCRIBEtoYOUTUBE✔ Watch ESPN on YouTube TV: http://es.pn/YouTubeTVGet more ESPN on YouTube:► First Take: http://es.pn/FirstTakeonYouTubeESPN on Social Media:► Follow on Twitter: http://www.twitter.com/espn► Like on Facebook: http://www.facebook.com/espn► Follow on Instagram: http://www.instagram.com/espnMore on ESPN.com: http://www.espn.com","espn sports sports news sports live sports clips sports videos sports center sportscenter sports channel sports documentaries first take the jump sportsnation outside the lines nfl live nba countdown highlights","bMzpGpSUqWE"
