video_id,title,channelId,channelTitle,categoryId,duration,thumbnail_link,tags,description,channel_desc,channel_keywords,related_vid_id
fWdbo0i8v9g,"Get Abs & Flat Stomach Workout | Flat Stomach Challenge 2021","UCCgLoMYIyP0U56dEhEL1wXQ","Chloe Ting","26","668.0","https://i.ytimg.com/vi/fWdbo0i8v9g/default.jpg","abs|abs workout|abs exercise|lower abs workout|intense ab workout|10 minute abs|flat belly exercise|flat belly workout|abs workout program|abs program|workout|exercise|flat stomach|flat tummy|female abs|female six pack|how to get abs|sexy abs|girl abs|quick way to get abs|get abs quick|abs fast|10 mins workout|abs challenge|chloe ting abs|abs chloe|chloe abs|flat stomach workout|flat stomach exercise|how to get flat stomach|abs routine","Time to work those abs! Check out my Flat Stomach Challenge. We've got 8 brand new episodes in this 28 days program. Please smash that like button for me, and drop a comment below with how you go each day.✚ Free Program Schedulehttps://www.chloeting.com/program/2021/flat-stomach-challenge.htmlNew Warm Up Routine - https://youtu.be/j6C-6F6dr-4Ep 1 - Full Body - https://youtu.be/CPI_Ve7vsHsEp 2 - Abs - https://youtu.be/fWdbo0i8v9gEp 3 - Upper Body -  https://youtu.be/iN-AEOs9rzcEp 4 - Booty - 7th JanEp 5 - HIIT - 11th JanEp 6 - Lower Abs - 13th JanCooldown - TBA✚ Sponsor this channelhttps://www.youtube.com/chloeting/joinSub to my 2nd channelhttps://www.youtube.com/channel/UCBrcDabYtwbR1VIhwH5efZA?sub_confirmation=1✚ My linkshttps://www.instagram.com/chloe_t/https://www.instagram.com/itschloeting/twitch.tv/chloetinghttps://discord.gg/chloetingMy Spotify Playlist https://open.spotify.com/user/s17162aerlbfj7cpsvv48spyx?si=0Zzwvx6-SdW2gbuyIveoaQ✚ Music byParty in Backyard - https://www.youtube.com/user/PartyInBackyardI Can Feel It - https://youtu.be/rMxjLEfZUrwSean Remix - https://youtu.be/R4YzjPfwSJgDylan LockeRoomie Badhttps://youtu.be/XYVqxH1s4qc#workouts #fitness #chloetingIMPORTANT DISCLAIMER: Some people may see my video titles as click-bait. YouTubers optimise their video's meta data for discovery due to how the algorithm is like. This isn't anything new. Most people who've been watching YouTube for years would understand this. If you're unhappy and get triggered by this, well, this channel isn't for you then. I’ve provided free workout schedules and programs since day 1 and have always optimised my meta data as such so that's not going to change.Having said that, it doesn't mean the workout do not work. You will still see results by following a suitable program schedule, watching your diet, being in a deficit or surplus (based on your goals), doing exercises in good form, etc. These are all equally important factors. You're not going to get abs, grow a booty, grow biceps magically from 1 or 2 videos, in 1, 2, 3 or 4 weeks cause everyone is different. I've explain multiple times throughout videos throughout my channel over years that it takes time and lots of factors, so don't take a video title out of context. Targetting fat loss is not scientifically proven. Everyone is different and it takes time. When doing any home workouts, do take precaution to exercise in a safe environment, and if you need help or you're not seeing results, I suggest seeing a health and fitness professional to give you tailored advice on your exercise form and dietary needs. I am not a medical professional and what I share on my channel are my views and what has worked for myself. Your health and safety is the utmost importance so find out what works for you.","Subscribe to my channel and find weekly workout videos, healthy food recipes and other fun videos! I've got FREE workout programs on my channel with workout calendar schedules so check it out!","fitness health lifestyle healthy diet healthy diet workout bodybuilding exercise exercise for women women fitness gym abs flat tummy fitspo fitspiration fit girls absworkout abs workout fashion travel lookbook chloeting free workout program","CPI_Ve7vsHs"
xlIKZKO8wao,"10 Min HIIT to burn lots of calories | No Equipment Fat Burning Workout","UCCgLoMYIyP0U56dEhEL1wXQ","Chloe Ting","26","647.0","https://i.ytimg.com/vi/xlIKZKO8wao/default.jpg","hiit|10 mins hiit|full body hiit|full body|full body workout|workout|workout challenge|intense full body|intense hiit workout|intense abs|exercise|lose weight|weight loss|full body workout at home|full body workout for beginner|hiit workout|hiit workout for fat loss|hiit workout at home|cardio|cardio workout|hiit abs workout|no jumping workout|standing hiit|exercise to lose weight|free workout|free workout program|home workout|fast hiit","Quick and effective 10 min hiit with no equipment, standing only and no planks! Get your workout in and if you're looking for support, join the rest of us workout out together this November to December! Schedule below✚ Free November to December Schedule - JOIN US and do it TOGETHER!https://www.chloeting.com/program✚ Sponsor this channelhttps://www.youtube.com/chloeting/joinSub to my 2nd channelhttps://www.youtube.com/channel/UCBrcDabYtwbR1VIhwH5efZA?sub_confirmation=1✚ My linkshttps://www.instagram.com/chloe_t/https://www.instagram.com/itschloeting/twitch.tv/chloetinghttps://discord.gg/chloetingMy Spotify Playlist https://open.spotify.com/user/s17162aerlbfj7cpsvv48spyx?si=0Zzwvx6-SdW2gbuyIveoaQ✚ Music byMusic provided by Monstercat: Aiobahn feat. Cozi Zuehlsdorff - Medusahttps://youtube.com/monstercat https://youtube.com/monstercatinstinctTrack: Diamond Eyes - Everything [NCS Release]Music provided by NoCopyrightSounds.Watch: https://youtu.be/_XspQUK22-UFree Download / Stream: http://ncs.io/EverythingYOTrack:  Cabuizee & Britt Lari - Closer Music Provided by Magic RecordsListen To The Original:  https://youtu.be/vE4h9Z_tLYkFree Download:  https://fanlink.to/dJ4sUsage Policy: http://www.magicmusicLLC.comTrack: Unknown Brain & Kyle Reynolds - I'm Sorry Mom [NCS Release]Music provided by NoCopyrightSounds.Watch: https://youtu.be/-owvY5f3mCAFree Download / Stream: http://ncs.io/ImSorryMom#workouts #hiit #chloetingIMPORTANT DISCLAIMER: Some people may see my video titles as click-bait. YouTubers optimise their video's meta data for discovery due to how the algorithm is like. This isn't anything new. Most people who've been watching YouTube for years would understand this. If you're unhappy and get triggered by this, well, this channel isn't for you then. I’ve provided free workout schedules and programs since day 1 and have always optimised my meta data as such so that's not going to change.Having said that, it doesn't mean the workout do not work. You will still see results by following a suitable program schedule, watching your diet, being in a deficit or surplus (based on your goals), doing exercises in good form, etc. These are all equally important factors. You're not going to get abs, grow a booty, grow biceps magically from 1 or 2 videos, in 1, 2, 3 or 4 weeks cause everyone is different. I've explain multiple times throughout videos throughout my channel over years that it takes time and lots of factors, so don't take a video title out of context. Targetting fat loss is not scientifically proven. Everyone is different and it takes time. When doing any home workouts, do take precaution to exercise in a safe environment, and if you need help or you're not seeing results, I suggest seeing a health and fitness professional to give you tailored advice on your exercise form and dietary needs. I am not a medical professional and what I share on my channel are my views and what has worked for myself. Your health and safety is the utmost importance so find out what works for you.","Subscribe to my channel and find weekly workout videos, healthy food recipes and other fun videos! I've got FREE workout programs on my channel with workout calendar schedules so check it out!","fitness health lifestyle healthy diet healthy diet workout bodybuilding exercise exercise for women women fitness gym abs flat tummy fitspo fitspiration fit girls absworkout abs workout fashion travel lookbook chloeting free workout program","CPI_Ve7vsHs"
9rQ5wxssQss,"15 min Intense HIIT for Fat Burn | Standing & No Equipment","UCCgLoMYIyP0U56dEhEL1wXQ","Chloe Ting","26","945.0","https://i.ytimg.com/vi/9rQ5wxssQss/default.jpg","full body|hiit|full body workout|workout|intense full body|intense hiit workout|intense abs|exercise|lose weight|weight loss|full body workout at home|full body workout for beginner|hiit workout|hiit workout for fat loss|hiit workout at home|cardio|cardio workout|hiit abs workout|no jumping workout|beginner workout|exercise to lose weight|home workout|workout from home|fast workout|15 mins|15 mins workout|apartment friendly workout|hiit exercise","Quick and effective 15 min hiit with no equipment, apartment friendly workout! Get your workout in and if you're looking for support, join the rest of us workout out together this November to December! Schedule below✚ Free November to December Schedule - JOIN US and do it TOGETHER!https://www.chloeting.com/program✚ Sponsor this channelhttps://www.youtube.com/chloeting/joinSub to my 2nd channelhttps://www.youtube.com/channel/UCBrcDabYtwbR1VIhwH5efZA?sub_confirmation=1✚ My linkshttps://www.instagram.com/chloe_t/https://www.instagram.com/itschloeting/twitch.tv/chloetinghttps://discord.gg/chloetingMy Spotify Playlist https://open.spotify.com/user/s17162aerlbfj7cpsvv48spyx?si=0Zzwvx6-SdW2gbuyIveoaQ✚ Music byMusic provided by Monstercat: Rogue - Fortresshttps://youtube.com/monstercat https://youtube.com/monstercatinstinctTrack: Mesqo & Jewels - HumanityMusic Provided By: Magic RecordsListen To The Original: https://youtu.be/rI4GC47zeWQFanlink: https://fanlink.to/humanityTrack: James Stikå - For YouMusic Provided by Magic RecordsListen To The Original: https://youtu.be/QnD73OwR-EMFree Download: https://fanlink.to/cxvBTrack: Alex Skrindo & Miza - Thinkin' [NCS Release]Music provided by NoCopyrightSounds.Watch: https://youtu.be/CkC5igeV_tMFree Download / Stream: http://ncs.io/ThinkinYOTrack: Raven & Kreyn - Muffin [NCS Release]Music provided by NoCopyrightSounds.Watch: https://youtu.be/rc5SMO5bvx0 Free Download / Stream: http://ncs.io/MuffinYOTrack:  Cabuizee & Britt Lari - Closer Music Provided by Magic RecordsListen To The Original:  https://youtu.be/vE4h9Z_tLYkFree Download:  https://fanlink.to/dJ4sUsage Policy: http://www.magicmusicLLC.comTrack: Unknown Brain & Kyle Reynolds - I'm Sorry Mom [NCS Release]Music provided by NoCopyrightSounds.Watch: https://youtu.be/-owvY5f3mCAFree Download / Stream: http://ncs.io/ImSorryMom#workouts #fitness #chloetingIMPORTANT DISCLAIMER: Some people may see my video titles as click-bait. YouTubers optimise their video's meta data for discovery due to how the algorithm is like. This isn't anything new. Most people who've been watching YouTube for years would understand this. If you're unhappy and get triggered by this, well, this channel isn't for you then. I’ve provided free workout schedules and programs since day 1 and have always optimised my meta data as such so that's not going to change.Having said that, it doesn't mean the workout do not work. You will still see results by following a suitable program schedule, watching your diet, being in a deficit or surplus (based on your goals), doing exercises in good form, etc. These are all equally important factors. You're not going to get abs, grow a booty, grow biceps magically from 1 or 2 videos, in 1, 2, 3 or 4 weeks cause everyone is different. I've explain multiple times throughout videos throughout my channel over years that it takes time and lots of factors, so don't take a video title out of context. Targetting fat loss is not scientifically proven. Everyone is different and it takes time. When doing any home workouts, do take precaution to exercise in a safe environment, and if you need help or you're not seeing results, I suggest seeing a health and fitness professional to give you tailored advice on your exercise form and dietary needs. I am not a medical professional and what I share on my channel are my views and what has worked for myself. Your health and safety is the utmost importance so find out what works for you.","Subscribe to my channel and find weekly workout videos, healthy food recipes and other fun videos! I've got FREE workout programs on my channel with workout calendar schedules so check it out!","fitness health lifestyle healthy diet healthy diet workout bodybuilding exercise exercise for women women fitness gym abs flat tummy fitspo fitspiration fit girls absworkout abs workout fashion travel lookbook chloeting free workout program","CPI_Ve7vsHs"
StN0-7XLuR4,"Full Body No Jumping Workout To Burn Fat | Burn Thigh Fat Low Impact Cardio","UCCgLoMYIyP0U56dEhEL1wXQ","Chloe Ting","26","962.0","https://i.ytimg.com/vi/StN0-7XLuR4/default.jpg","full body|no jumping|fat burning|burn fat|low impact|cardio|thigh fat|thigh workout|thigh exercise|leg exercise|leg workout|belly fat|legs and belly workout|legs and belly exercise|burn thigh fat|lose weight|home workout|low intensity workout|thin legs|sexy legs|leg workout for women|thigh gap|full body workout|fat burn|core exercise|leg workout at home|thigh gap workout|thigh slimming workout|thigh workout for women|female thigh workout","If you're looking to slim your legs and thighs, this 25 day program is for you! To get slim legs you need to avoid high intensity and this whole program is designed to be low intensity to help you burn fat but also avoid bulk legs.☆25 Day Slim Thigh Challenge☆Full schedule: https://www.chloeting.com/programEpisode 1 - Slim Thigh - https://youtu.be/EUruBzhv7KkEpisode 2 - Standing Abs - https://youtu.be/V4sWpLJcQoUEpisode 3 - Fat Burn - This videoEpisode 4 - Inner Thigh Burn - Coming soon☆Help subtitle this video☆http://www.youtube.com/timedtext_video?ref=share&v=StN0-7XLuR4☆Sponsor this channel☆https://www.youtube.com/chloeting/join☆Sub to my 2nd channel☆https://www.youtube.com/channel/UCBrcDabYtwbR1VIhwH5efZA?sub_confirmation=1☆My links☆https://www.instagram.com/chloe_t/https://www.instagram.com/itschloeting/twitch.tv/chloeting☆Music by☆Track: Helynt - Time (Magic Free Release)Music Provided by Magic RecordsListen To The Original: https://youtu.be/YaQ4hIBQNxgFree Download: https://fanlink.to/cwcwTrack: Le Malls - Come Through (feat. Ari G.) [NCS Release]Music provided by NoCopyrightSounds.Watch: https://youtu.be/mLMQKntCttAFree Download / Stream: http://ncs.io/ComeThrough#workouts #fitness #chloetingIMPORTANT DISCLAIMER: Please note that all of my videos are titled according to SEO best practices for content discoverability. Unfortunately this may mean that video titles are subjective and shouldn't be seen as absolute truth. As an example, targeting fat reduction is not scientifically proven but a video title might suggest otherwise. When following any of my videos, please take precaution to exercise in a safe environment, and I highly suggest seeing a health and fitness professional to give you advice on your exercise form and dietary needs. Every person is unique and there is no one size fits all solution to health or fitness. I am not a medical professional and your health and safety is the utmost importance.","Subscribe to my channel and find weekly workout videos, healthy food recipes and other fun videos! I've got FREE workout programs on my channel with workout calendar schedules so check it out!","fitness health lifestyle healthy diet healthy diet workout bodybuilding exercise exercise for women women fitness gym abs flat tummy fitspo fitspiration fit girls absworkout abs workout fashion travel lookbook chloeting free workout program","CPI_Ve7vsHs"
-p0PA9Zt8zk,"Do This Warm Up Before Your Workouts | Quick Warm Up Routine","UCCgLoMYIyP0U56dEhEL1wXQ","Chloe Ting","26","387.0","https://i.ytimg.com/vi/-p0PA9Zt8zk/default.jpg","warm up|warm up exercise|warm up exercise before workout|warm up exercise for beginner|warm up routine|warm up routine before workout|warm up workout|warm up workout at home|easy warm up|warm up stretch|good warm up|full body warm up|warm up stretches before workout|home workout|home workout no equipment|5 min workout|5 min warm up|5 min exercise|workout|exercise|fast warm up|quick warm up|effective warm up|home exercise|easy exercise","It's the new 2020 Summer Shred! Here's a brand new warm up routine that you can use before ANY of your workouts in any workout program. It's a quick 6 minute routine to get you warmed up before you get to the real action. Enjoy!☆Summer Shred Challenge 2020☆Full program schedule - https://www.chloeting.com/programWarm Up - This VideoEpisode 1 - https://youtu.be/OBSUUi0FAKoEpisode 2 - https://youtu.be/hAUIGLE8PEoEpisode 3 - https://youtu.be/7L-Td_p0bXEEpisode 4 - https://youtu.be/fMPoCc78v0gEpisode 5 - https://youtu.be/JEEG0hBNk3EEpisode 6 - Releasing 25th May☆Help subtitle this video☆http://www.youtube.com/timedtext_video?ref=share&v=-p0PA9Zt8zk☆Sponsor this channel☆https://www.youtube.com/chloeting/join☆Sub to my 2nd channel☆https://www.youtube.com/channel/UCBrcDabYtwbR1VIhwH5efZA?sub_confirmation=1☆My links☆https://www.instagram.com/chloe_t/https://www.instagram.com/itschloeting/twitch.tv/chloeting☆Music by☆Music | With You by Declan DPWatch: https://youtu.be/Cr5RK_F5E84License: http://www.declandp.info/licenseDownload/Stream: https://hypeddit.com/link/gbhbv9Music | Magical by Declan DPWatch: https://youtu.be/WIs5LmR5ZGULicense: http://www.declandp.info/licenseDownload/Stream: https://hypeddit.com/link/t7shxi#workouts #fitness #chloetingIMPORTANT DISCLAIMER: Some people may see my video titles as click-bait. YouTubers optimise their video's meta data for discovery due to how the algorithm is like. This isn't anything new. Most people who've been watching YouTube for years would understand this. If you're unhappy and get triggered by this, well, this channel isn't for you then. I’ve provided free workout schedules and programs since day 1 and have always optimised my meta data as such so that's not going to change.Having said that, it doesn't mean the workout do not work. You will still see results by following a suitable program schedule, watching your diet, being in a deficit or surplus (based on your goals), doing exercises in good form, etc. These are all equally important factors. You're not going to get abs, grow a booty, grow biceps magically from 1 or 2 videos, in 1, 2, 3 or 4 weeks cause everyone is different. A title may come close to suggesting that, but I've explain multiple times throughout videos throughout my channel over years that it takes time and lots of factors, so don't take a video title out of context. Targetting fat loss is also not scientifically proven. Everyone is different and it takes time. When doing any home workouts, do take precaution to exercise in a safe environment, and if you need help or you're not seeing results, I suggest seeing a health and fitness professional to give you tailored advice on your exercise form and dietary needs. I am not a medical professional and what I share on my channel are my views and what has worked for myself. Your health and safety is the utmost importance so find out what works for you.","Subscribe to my channel and find weekly workout videos, healthy food recipes and other fun videos! I've got FREE workout programs on my channel with workout calendar schedules so check it out!","fitness health lifestyle healthy diet healthy diet workout bodybuilding exercise exercise for women women fitness gym abs flat tummy fitspo fitspiration fit girls absworkout abs workout fashion travel lookbook chloeting free workout program","CPI_Ve7vsHs"
Crda1Sv9mks,"Do This Workout To Lose Weight | 2020 2 Weeks Shred Challenge","UCCgLoMYIyP0U56dEhEL1wXQ","Chloe Ting","26","972.0","https://i.ytimg.com/vi/Crda1Sv9mks/default.jpg","workout|home workout|full body workout|full body routine|weight loss|weight loss routine|home weight loss|hiit|hiit exercise|hiit workout|full body hiit|fat burn|burn fat|exercise|intense full body|2 weeks program|14 days program weight loss program|hiit for fat loss|hiit workout at home|hiit cardio workout|weight loss challenge|how to lose weight|workout to lose weight|2 weeks shred|2 weeks shred challenge|do this to lose weight|chloe ting","Brand new 2 weeks shred! Full body workout to help you with your fitness journey. Check out the full 2020 2 weeks shred schedule below!✚ 2020 2 Weeks Shred ChallengeSchedule: https://www.chloeting.com/program/2020/two-weeks-shred-challenge.htmlEpisode 1 - https://youtu.be/Crda1Sv9mksEpisode 2 - https://youtu.be/h8ctkfSx6R0Episode 3 - https://youtu.be/VlkL3kg2NnoEpisode 4 - https://youtu.be/_Y2k5O6PuikEpisode 5 - https://youtu.be/Sc-2yZaKsBU✚ Help subtitle this videohttp://www.youtube.com/timedtext_video?ref=share&v=Crda1Sv9mks✚ Sponsor this channelhttps://www.youtube.com/chloeting/joinSub to my 2nd channelhttps://www.youtube.com/channel/UCBrcDabYtwbR1VIhwH5efZA?sub_confirmation=1✚ My linkshttps://www.instagram.com/chloe_t/https://www.instagram.com/itschloeting/twitch.tv/chloetinghttps://discord.com/invite/f7NY5VKMy Spotify Playlist https://open.spotify.com/user/s17162aerlbfj7cpsvv48spyx?si=0Zzwvx6-SdW2gbuyIveoaQ✚ Music byParty in Backyard - Leon Lush - James Charles (Straight Boys) [Remix]https://youtu.be/wqhZVwjFpEwParty in Backyard - Me & The Boys (Rewind 2018)https://youtu.be/ulbGlbqWykMParty in Backyard - Rewind Time 2019https://youtu.be/-XsYMHm64wMParty in Backyard - The Ting Goes Skrra (Mans Not Hot) [Remix]https://youtu.be/ameboL8AhyoDylan Locke - Lasagnahttps://youtu.be/sJO9yLYZAWE#workouts #fitness #chloetingIMPORTANT DISCLAIMER: Some people may see my video titles as click-bait. YouTubers optimise their video's meta data for discovery due to how the algorithm is like. This isn't anything new. Most people who've been watching YouTube for years would understand this. If you're unhappy and get triggered by this, well, this channel isn't for you then. I’ve provided free workout schedules and programs since day 1 and have always optimised my meta data as such so that's not going to change.Having said that, it doesn't mean the workout do not work. You will still see results by following a suitable program schedule, watching your diet, being in a deficit or surplus (based on your goals), doing exercises in good form, etc. These are all equally important factors. You're not going to get abs, grow a booty, grow biceps magically from 1 or 2 videos, in 1, 2, 3 or 4 weeks cause everyone is different. I've explain multiple times throughout videos throughout my channel over years that it takes time and lots of factors, so don't take a video title out of context. Targetting fat loss is not scientifically proven. Everyone is different and it takes time. When doing any home workouts, do take precaution to exercise in a safe environment, and if you need help or you're not seeing results, I suggest seeing a health and fitness professional to give you tailored advice on your exercise form and dietary needs. I am not a medical professional and what I share on my channel are my views and what has worked for myself. Your health and safety is the utmost importance so find out what works for you.","Subscribe to my channel and find weekly workout videos, healthy food recipes and other fun videos! I've got FREE workout programs on my channel with workout calendar schedules so check it out!","fitness health lifestyle healthy diet healthy diet workout bodybuilding exercise exercise for women women fitness gym abs flat tummy fitspo fitspiration fit girls absworkout abs workout fashion travel lookbook chloeting free workout program","CPI_Ve7vsHs"
