video_id,title,channelId,channelTitle,categoryId,duration,thumbnail_link,tags,description,channel_desc,channel_keywords,related_vid_id
MmCFK5Tfs1M,"Single Girl Seduces J-Hope from BTS In The Sims 4| Part 74","UCBUVGPsJzc1U8SECMgBaMFw","BuzzFeed Multiplayer","20","1921.0","https://i.ytimg.com/vi/MmCFK5Tfs1M/default.jpg","BuzzFeed|Multiplayer|Buzzfeed multiplayer|gaming|gamer|gameplay|100 baby challenge|Kelsey Imppichiche|Buzzfeed Kelsey|Sims 4|Sims challenges|let’s play|the sims|buzzfeed gaming|sims 4 challenges|sims 4 gameplay|games|simulation games|let's play|let's play sims|buzzfeed sims|kelsey plays|PL-100BabyMaster|PL-100BabyS3|the sims 4|sims gameplay|sims lets play|Single Girl Seduces J-Hope from BTS In The Sims 4| Part 74","WE BACK BABY AND IT'S SEASON 3! Single girl Kelsey is back to play the Sims 4 in 2021 and continues the very long, and very popular 100-baby challenge with Season 3 and part 74! This episode, Kelly is looking for baby daddies within the BTS crew, this time setting her eyes on J-Hope. Kelly has grown up a lot, but still can't let go of her bad habits. Will she be able to have more children by the time the episode is over?Credits: https://www.buzzfeed.com/bfmp/videos/118739Subscribe to BuzzFeed Multiplayer: https://bzfd.it/2kVnL0zBuzzFeed MultiplayerHome for all things gaming, cosplay, real-life recreations, real professionals playing games, challenges, and more! If this sounds like the stuff you’re into then please subscribe today!Love BuzzFeed Multiplayer? Get the merch! BUY NOW: https://bzfd.it/shopmultiplayeryoutubeFollow us on Twitter: https://twitter.com/multiplayerBFLike us on Facebook: https://www.facebook.com/buzzfeedmultiplayer/GET MORE BUZZFEED:https://www.buzzfeed.comhttps://www.buzzfeed.com/videoshttps://www.youtube.com/buzzfeedvideohttps://www.youtube.com/asishttps://www.youtube.com/buzzfeedmultiplayerhttps://www.youtube.com/buzzfeedunsolvednetworkhttp://youtube.com/buzzfeedcelebhttps://www.youtube.com/perolikehttps://www.youtube.com/buzzfeedviolethttps://www.youtube.com/goodfulhttps://www.youtube.com/niftyhttps://www.youtube.com/buzzfeedtastyhttps://www.youtube.com/bringmehttps://www.youtube.com/abouttoeatSUBSCRIBE TO BUZZFEED NEWSLETTERS:https://www.buzzfeed.com/newslettersMUSICLicensed via Audio Network","Home for all things gaming, cosplay, real-life recreations, real professionals playing games, challenges, and more! If this sounds like the stuff you’re into then please subscribe today!Love BuzzFeed Multiplayer? Get the merch! BUY NOW: https://bzfd.it/shopmultiplayeryoutubeFollow us on Twitter: https://twitter.com/multiplayerBFLike us on Facebook: https://www.facebook.com/buzzfeedmultiplayer/","buzzfeed buzzfeed multiplayer buzzfeed gaming gaming buzzfeedblue funny videos challenges pc gaming playing video games video games","e4wajXk_cDs"
Yq_WWhntjEg,"Our cat passed away - dealing with grief and loss","UCH2c0ynrljAA-jW8tq3u3HA","The Sip with Ryland Adams and Lizze Gordon","22","3151.0","https://i.ytimg.com/vi/Yq_WWhntjEg/default.jpg","Losing a pet|cat|grief","Videos that helped us: Danielle MacKinnon - Soul Family Video https://www.youtube.com/watch?v=je3-5gaNaMQThe Josh Speaks - How to deal with losing a pet https://www.youtube.com/watch?v=fPdoUa0xqUERussell Brand - My Cat Died. https://www.youtube.com/watch?v=GtHuQItYspIJoan Ranquet - How to recognize when your deceased pet sends messages to you https://www.youtube.com/watch?v=WDhl7Dz7cuk","Pop culture, hot topics, and mouth burning celebrity gossip; with Ryland Adams and co-host Lizze Gordon NOTHING is off limits. Each week the opinionated duo welcome listeners and the occasional guest to join in on their uncensored conversations that will leave you thirsty for more.","","e4wajXk_cDs"
o45iiYHTg_E,"Is 'Drivers License' Good, Or Are You Just Sexist?","UCETIG20p0npb7i4fwkuredA","Internet Jules","23","861.0","https://i.ytimg.com/vi/o45iiYHTg_E/default.jpg","drivers license|olivia rodrigo|high school musical|hsmtmts|sabrina carpenter|halsey|lizzo|harry styles|ariana grande|tate macrae","MY ALBUM ‘OVERSHARING’ OUT NOW: https://open.spotify.com/album/2Wn87dd2oa9747JMWQrewk?si=7JJCa0u_Q2KFi5eEIBrdjwhttps://music.apple.com/us/album/oversharing/1528008931BECOME A PATRON TO LEARN HOW TO MAKE A SONGPatreon: https://www.patreon.com/internetjulesInstagram:julistrawbridgeEmail me if you want to make a demo or learn some fun things! internetjules@gmail.com  Follow the playlist and message me if you wanna be on it! https://open.spotify.com/playlist/0is9gGfanGwcwjglCdMH7o?si=c-3p_UphR_2VpVmX2KTgyA","I write songs and act ridiculous on and off camera.","music","e4wajXk_cDs"
uQvsxCg3HyM,"Petition To Ban Eugenia Cooney From YouTube?","UCravYcv6C0CopL2ukVzhzNw","JaclynGlenn","24","1341.0","https://i.ytimg.com/vi/uQvsxCg3HyM/default.jpg","Eugenia|eugeniacooney|Eugenia Cooney|jaclynglenn|jaclyn glenn|body checking|recovery|twitch|petition","My thoughts on the petition to ban Eugenia (temporarily) from social media platforms to give her time to recover. The petition ► https://www.change.org/p/youtube-remove-eugenia-cooney-from-youtube-twitch-instagram?redirect=falseJosie Maria Interview ► https://www.youtube.com/watch?v=wRQyrlHPGCAGreat videos on this from other creators ►Eugenia Cooney Doesn't Want Your Help - https://www.youtube.com/watch?v=yPXmAAR1_dQ&t=641sEugenia Cooney is Getting Worse and Concerning Fans - https://www.youtube.com/watch?v=45U76WkUhK8&t=781sEugenia Cooney's Toxic Impact On Her Fans - https://www.youtube.com/watch?v=Z5-Ih8KtOtQBody Checking Content On Youtube - https://www.youtube.com/watch?v=ZwzuFAP5rOE&t=147sWe Need To Talk About This Woman - https://www.youtube.com/watch?v=FJteipLDngwThis one is more about Kati Morton but a great watch - Kati Morton: YouTube’s Most Unethical Therapist - https://www.youtube.com/watch?v=_OHoOqcORls------------------------------------Support me on Patreon ► http://www.patreon.com/JaclynMERCH STORE ► https://www.ffvmerch.com/Follow me on Onlyfans!! ► https://onlyfans.com/jaclynglennAmazon wish list ► http://a.co/dNVUaLgSubscribe to my Vlog channel ► http://www.youtube.com/JaclynVlogs FOLLOW ME ON TIKTOK!!! ►  https://www.tiktok.com/@jaclynglennINSTAGRAM (@JaclynGlenn) ► https://www.instagram.com/JaclynGlennTWITTER (@JaclynGlenn) ► http://twitter.com/JaclynGlennFACEBOOK ► https://www.facebook.com/JaclynGlenn TWITCH ► http://www.twitch.tv/jaclynglennBUSINESS INQUIRIES ONLY: jaclynglenn@gmail.com Venmo: @jaclynglennSend me snail mail! PO BOX listed @ https://www.youtube.com/user/JaclynGlenn/about#Eugenia #EugeniaCooney #Petition","Twitter:  @JaclynGlenn   ///   Facebook: JaclynGlenn   ///   Instagram:  JaclynGlennSEND ME SNAIL MAIL! Jaclyn GlennPO BOX 1154 Studio City, CA 91614","lifestyle advice relationship relationship advice girl vlog skeptic video funny atheist atheism cringe comedy commentary jaclyn glenn jaclynglenn","e4wajXk_cDs"
Pt3bwlAJ0lw,"POPEYES MUKBANG | JOE BIDEN & KAMALA HARRIS INAUGURATION","UCtmtLO_AIYqIdFjRTrorQEQ","Ayootravv","22","1282.0","https://i.ytimg.com/vi/Pt3bwlAJ0lw/default.jpg","trump|joe biden|donald trump|trump impeachment|president trump|ayootravv|ayootravv mukbang|mukbang|asmr|food fusion|food network|food review|ayoosauce|senate|what i eat|food vlog|먹방|the challenge|man vs food|asmr mukbang|eating show|seafood boil|clark atlanta university|mukbang seafood|asmr mouth sounds|seafood boil mukbang|asmr eating|남자 asmr|asmr drinking sounds|seafood mukbang|멜론|deshelled seafood boil|asmr sleep|storytime|cnn|cnn 10|vlogs","What's going on Cordell Crew? Grab a bite to eat and join me for a popeyes chicken mukbang.Purchase AyooSauce & AyooMerch:www.ayootravv.comIntro Designed by: @graphicsbymileycarterr on InstagramThumbnails by : @treblesome_tenor on InstagramIf you’d like to donate to help this channel continue to grow:Cashapp: $TravieeFollow my social media:Instagram: ayootravvFacebook: AyooTravvSnapchat: ayootravvTwitter: AyooTravv","Yooo wussup.? This ya boi Travo Cordell checking in from Atlanta, Ga. I am a singer, rapper, songwriter, and dancer. Make sure you hit that subscribe button before leaving my channel. When you check out the videos don't forget to like and comment as well.Facebook: Ayee TravieeInstagram: ayootravvTwitter: YouLoveTrav","ayootravv","e4wajXk_cDs"
E36RLSNCEPc,"Trisha Paytas ENDS Friendships with Shane and Ryland","UCoZbEyqmn18GCQvHn-yMQyQ","Cherita Explains It All","24","1771.0","https://i.ytimg.com/vi/E36RLSNCEPc/default.jpg","trisha paytas|blndsundoll4mj|i just want to move on|commentary|shane dawson|jeffree star","#trishapaytas #hairbyjay #jeffreestar====================Peter Monn's video: https://www.youtube.com/watch?v=3PhzhuwNJRUOpiniaholics Podcast: https://open.spotify.com/episode/7IkQlbUdXIZZfn9PKHBqXg?si=cAQe7XhNTBut1Ij6KSFhcA====================Follow me on social media:Twitter: @cheritaisrandomSnapchat: @cheritaisrandomInstagram: @cheritaisrandomTikTok: @cheritaisrandom====================Disclaimer: Copyright Disclaimer Under Section 107 of the Copyright Act 1976, allowance is made for fair use for purposes such as criticism, comment, news reporting, teaching, scholarship, and research. Fair use is a use permitted by copyright statute that might otherwise be infringing. It is illegal to make a false copyright claim and such actions may lead to our party seeking compensation for losses. This video was created and published by Cherita Gaskin in her personal capacity. The opinions expressed in this article are the author's own and should not be taken as fact. The validity of any evidence provided should be independently checked for authenticity, and Cherita Gaskin takes no responsibility for the actions of those viewing this video.","I make entertaining “drama” videos...in a positive way 😊","","e4wajXk_cDs"
8nEO2wByYFo,"Global National: Jan. 20, 2021 | Joe Biden, Kamala Harris sworn in at peaceful inauguration","UChLtXXpo4Ge1ReTEboVvTDg","Global News","25","1364.0","https://i.ytimg.com/vi/8nEO2wByYFo/default.jpg","U.S. president|White House|Inauguration Day|Joe Biden oath of office|President Joe Biden|Joe Biden|Biden|President Biden|Biden inauguration|Biden pandemic|Biden executive orders|Biden climate change|Paris accords|Biden first days|Kamala Harris|Kamala Harris inauguration|Vice President|Donald Trump|Trump leaves|Trump departure|Inauguration security|Canada|Keystone XL|Justin Trudeau|coronavirus|covid-19|washington|pfizer|vaccine","A new era has begun at the White House. Joe Biden was sworn in on Wednesday as the 46th U.S. president, and Kamala Harris shattered gender and racial barriers when she was sworn-in as vice-president. In the Oval Office, Biden has already signed a string of executive orders. Jackson Proskow has more on Biden’s first day as president. Mike Armstrong reports from the streets of Washington, D.C., which has been locked down in the leadup to the inauguration. Hours after he was sworn into office, Biden signed an executive order to revoke the permit that would allow the Keystone XL pipeline expansion project to continue. Mercedes Stephenson has reaction from the Trudeau government. Canadian provinces each have their own timeline for vaccinating seniors who don’t live in long-term care or retirement homes against COVID-19. As Mike LeCouteur explains, seniors advocates say that older adults should be prioritized, regardless of where they live. Plus, Eric Sorensen reflects on this year’s presidential inauguration and Biden’s address compared to his predecessors.For more info, please go to http://www.globalnews.caSubscribe to Global News Channel HERE: http://bit.ly/20fcXDcLike Global News on Facebook HERE: http://bit.ly/255GMJQFollow Global News on Twitter HERE: http://bit.ly/1Toz8mtFollow Global News on Instagram HERE: https://bit.ly/2QZaZIB#GlobalNews","Welcome to the official Global News channel on YouTube. Please subscribe and join us at our website: http://globalnews.ca.Commenting Policy:Please keep your comments and posts clean, constructive and on topic. Unlawful, disrespectful, slanderous, defamatory, malicious, threatening, profane, obscene, tasteless or pornographic remarks will not be tolerated, and will be deleted without notice. Spam, graffiti, campaigning and advertising are also strictly prohibited. While we encourage free speech and debate, harassment and attacks on fellow YouTube users are unacceptable. Repeated abusers of this policy will be reported, and may be banned.Schedule of Original Content:Daily - Global NationalThursday - Global News ExplainsSunday - The West Block","Global News Global National global national news","e4wajXk_cDs"
JaWsSgmj4_Y,"IS BITSOFBRI REALLY MOVING TO HAWAII || CONFUSING HER FANS BY BEING SUPER SUS || **FULL SNARK**","UCyLxf0Z_NaFEQ7kj437VpFQ","The Dad Challenge Channel","24","1873.0","https://i.ytimg.com/vi/JaWsSgmj4_Y/default.jpg","family vloggers|family vloggers exposed|commentary|reaction commentary|comedy|james stauffer|stauffer garage|myka stauffer|jesssfam|bitsofbro|colleen ballinger|sacconejolys|tiffani beaston|aaryn williams|the labrant fam|labrants|the weiss life|ace family|kids on instagram|bitsofbri|brianna k|thrlife|gabrielle weiss|gabrielle nichole","#bitsofbri#tiffanibeaston#acefamilydonate to the cause.https://ko-fi.com/takedownfamilyvloggersJoin the facebook group https://www.facebook.com/groups/1093868907732091Tesla CODE!! https://ts.la/joshua58106Join our Patreon for exclusive content and early vids! https://www.patreon.com/thedadchallengeGet some merch yo! https://teespring.com/stores/the-dad-challenge-storePO BOX - Joshua Barbour PO BOX 99900 KY 582 684RPO CONESTOGA MALLWATERLOO ON N2L 0B8Business inquires - josh@thedadchallengepodcast.comFollow us!! InstaGram https://www.instagram.com/thedadchallengepodcast/Twitter https://twitter.com/DadChallengePodFacebook https://www.facebook.com/thedadchallengepodcastThe Podcast https://www.anchor.fm/thedadchallenge...Discord - https://discord.gg/fzDjC2","","the dad challenge podcast anti mlm anti family vlogger family vloggers exposed commentary reaction commentary comeday parenting","e4wajXk_cDs"
fVTwYcACZfY,"[469]Workout Clothes For The Win|Simplicity 1111 & Simplicity 8327 Ft. Minerva.com Fabric","UCGJwVadYo0gfzL6Dgm9rIgw","SewNaturalDane","26","1102.0","https://i.ytimg.com/vi/fVTwYcACZfY/default.jpg","sewing projects|plus size sewing|how to sew|sewing plus size workout clothes|plus size memade garments|sewing workout clothes|simplicity 1111|simplicity 8327|sew workout clothes","Today we are talking workout clothes. I show how these pieces work in action and for the type of exercise I do, they work for me.  These are Simplicity Pattern 1111 and Simplicity Pattern 8327. Simplicity 1111 is out of print, but you may find it on ebay, etsy or amazon. Link to Minerva Blog Post:  https://www.minerva.com/people/1000696 Fabric:1. Aqua lycra swimwear/activewear from Minerva.com, the print I was gifted is no longer available, but I did link to similar fabric: https://www.minerva.com/mp/1197961/activewear-knit-fabric-aqua&variant=1166364 2. Navy Blue Activewear from Fabric Mart: https://tinyurl.com/yy2u5c2g********************************************************************************How You Can Support My Channel:For those interested you can subscribe to my website here and get the free measurement chart download I spoke about in my previous video. https://www.sewnaturaldane.com/  You can find the video here: https://youtu.be/iMW4jFf_WSEAlso consider liking my Facebook page, I'll share special projects and offerings over there as well.https://www.facebook.com/SewNaturalDane/***********************************************************************************About Affiliate links:  if you purchase by clicking on these links, there is no cost to you, I receive a small commission that helps support the channel.  Thank you in advance for your support.Some of My Favorite Items from Amazon (Affiliate Link):https://www.amazon.com/shop/naturaldaneOther links below to specific items I've spoken about:Where to Buy the Style Sew Me Patterns (affiliate link): http://www.stylesewmepatterns.com?aff=8Rebecca Page Patterns (affiliate link): https://rebecca-page.com/?affiliates=235***********************************************************************************Frequently Asked Questions Answered Here:1.  What Are Your Go-To Plus Size Pattern Companies:Part 1 Cashmerette Patterns: https://youtu.be/xFmTX0gEZRcPart 2 Rebecca Page Patterns: https://youtu.be/8MXZzpeAgV42.  Where Do You Send Your Patterns To Print and How do You Place Your Order:I send my patterns to PDF Plotting, Watch How To Here: https://youtu.be/SYlyKCvrnrg3.  How Do I Trace My Patterns: https://youtu.be/MTyPAc4Gqs4***************************************************************Where Else You Can Find Me:Instagram: https://www.instagram.com/sewnaturaldane/Pinterest:  NaturalDaneMail Inquiries:NaturalDanePO BOX 60914Houston, TX 77205eMail: naturaldane at gmail dot comMy Business Youtube Channel: https://www.youtube.com/channel/UCFf9kMuKVeIIKtso5kgiNdw/videosInstagram: https://www.instagram.com/thefabricbeautique/Website:  http://www.thefabricbeautique.com/Facebook: https://www.facebook.com/fabricbeautique/Twitter:  https://twitter.com/FabricBeautique","Naturalista since 2007, but my healthy hair journey began in November 2012 AND I love to sew! My channel will mainly focus on my sewing journey to include handbag and wallet making.  There will also be SewALongs and DIYs sprinkled in.  So make sure you subscribe.  A little more about me:Owner of The Fabric Beautique www.thefabricbeautique.com1.  A Christian, I Love The Lord!2.  A Wife & MotherBusiness InquiriesAttention: SewNaturalDanePO BOX 60914Houston, Texas 77205STAY BLESSED!!!","","e4wajXk_cDs"
NA5MY3qo8Ko,"Ep #66: AMANDA KNOX PART 1 | Good For You Podcast with Whitney Cummings","UCZa3lYPi8caXYxl5DeIzJgg","Whitney Cummings","23","6105.0","https://i.ytimg.com/vi/NA5MY3qo8Ko/default.jpg","whitney cummings|comedian|standup|female comic|female podcast|good for you podcast|podcast|stand up|amanda knox|foxy knoxy|tell all|tabloids|celebrity interview","Call/Text Whitney: (818) 239-7527Subscribe: https://bit.ly/36wghEkApple Podcasts: https://apple.co/34n2nTcSpotify: https://spoti.fi/2NDmF40Thank you:https://dailyharvest.com code: goodforyouhttps://helixsleep.com/whitneyhttps://earnest.com/whitneyhttps://getroman.com/whitneyWhitney and Amanda Knox talk about it ALL, in part one of this wild interview.Call the Good For You Hotline and leave a voicemail here: (818) 538-9940Instagram: https://www.instagram.com/whitneycummingsTwitter: https://twitter.com/whitneycummingsFacebook: https://www.facebook.com/whitneycummingsBenton's Insta: https://www.instagram.com/bentonrayyBenton's Twitter: https://twitter.com/bentonrayy","Whitney Cummings official YouTube Channel. The new special “Can I Touch It?” streaming on Netflix now.","whitney cummings comedian female comedian stand up","e4wajXk_cDs"
C2FyrsWEDcY,"Jeffree Star SPEAKS OUT on the Kanye West DRAMA in new video...!","UCqBdhITIto1mF0k8C8t313w","Angelika Oles","24","1037.0","https://i.ytimg.com/vi/C2FyrsWEDcY/default.jpg","angelika|angelika oles|Jeffree Star|Kanye West|Jeffree Star and Kanye West|Jeffree Star dating Kanye West|Jeffree Star Wyoming|Kanye West Wyoming|Kim Kardashian|Kim Kardashian divorce|Jeffree Star boyfriend|Jeffree Star nate|Jeffree Star cosmetics|Jeffree Star Shane Dawson|Jeffree Star drama|jeffree star boyfriend|Jeffree Star Kanye west|kanye west divorce|tea spill|spill sesh|dustin daily|the viewers voice|Addressing The Kanye Situation","This video is about Jeffree Star addressing the Kanye West drama in his new video Addressing The Kanye Situation! Enjoy :)2nd channel: https://www.youtube.com/channel/UCoTlbi8TFSEElX5p3HNcnEAhttps://www.instagram.com/angelika.oles_/https://vm.tiktok.com/ZSvcqGVd/https://www.instagram.com/phoebethecockapoo_/Affiliate links/codes (I make a %):Oden's Eye: https://www.odenseye.se/discount/ANGELIKA (10% off for you and 10% for me)Glossier: https://glossier.79ic8e.net/56YPo (10% off for you and 10% commission for me)Cult Beauty: https://go.magik.ly/ml/zhmd/Beautybay: https://go.magik.ly/ml/zhmh/Colourpop: https://go.magik.ly/ml/zhw0/","","Beauty Comedy Vlog","e4wajXk_cDs"
YNmMbjoLMaE,"😂🪄BIG TRAIN MANAGER SKILLS🐶✈️","UCZFkmmlLX_mCJdIAQSSM32g","The Postmodern Family","22","578.0","https://i.ytimg.com/vi/YNmMbjoLMaE/default.jpg","Americans living in the UK|Postmodern family|Felipe and Lillian|traditional family|traditional values|expats|family vlog|christian family|southampton|americans react|reacting to|react to|reaction video|British comedy|us versus uk|Big train|Simon peg|Manager skills|Essential manager skills|Sketch show","Hey guys! We react to “Big Train” and its Manager Skills sketch! Editor: Leah RobinsonThis video brought to you by Fortunato Goods’ 100% Genuine Leather Handmade Belt: https://www.instagram.com/fortunatogoods/, and remember the code 'postmodernfam' for free and fast shipping within the UK! All their goods are made in the UK by UK-sourced raw materials.If you're new to our channel, we are Americans living in the UK. We make five new videos a week and would love it if you subscribed to our channel and hit that notification bell!Remember, you can buy our music on iTunes and everywhere now if you search The Postmodern Family or click on the links below.Music on Amazon: https://amzn.to/31q24FI, https://amzn.to/31x95V4, https://amzn.to/2TnOsrCMusic on iTunes: http://bit.ly/buyPMFsongs, http://bit.ly/PMFfrenchsongs, http://bit.ly/PMFitaliansongs------------Subscribe to our channel for new videos three times a week! ➡️ http://bit.ly/postmodernfamBuy a T-Shirt in support of our channel here  ➡️https://teespring.com/stores/the-postmodern-familyBuy us a gift from our Amazon Wish List! ➡️ http://bit.ly/pmfwishlistSubscribe to our Podcast to get inside our heads ➡️ http://bit.ly/pmfpodcastIf you’re wondering how you can support us, get mentioned in our video descriptions or even given a shout out in one of our videos, check out our Patreon page ➡️ http://bit.ly/pmfpatreonAnd our Website for everything that we're doing: thepostmodernfamily.com; http://bit.ly/pmfwebsite------------facebook: @postmodernfamilytwitter: @postmodern_faminstagram: @postmodernfamilypinterest: @postmodernfamily-------------BUY OUR GEARPrimary DSLR Camera: https://amzn.to/2MegxkEBackup DSLR Camera: https://amzn.to/2KqNS9MCompact Mirrorless Camera: https://amzn.to/2Kuh5QYFavourite Lens for DSLR Videography: https://amzn.to/31yOUX6Favourite Lens for DSLR Photography: https://amzn.to/2YTphOUBest Lens for Mirrorless Camera: https://amzn.to/2KtACRDBest Microphone for DSLR: https://amzn.to/2Mbz2pLEditing Software: https://amzn.to/2KsZFnV PLAYLISTSMost Popular Videos: http://bit.ly/bestofpmfFood in the UK: http://bit.ly/foodinukPregnant in the UK: http://bit.ly/ukpregnancyVIDEOSReal Opera Singer Sings Never Enough: https://youtu.be/JvVhKAuxp8EUS vs. UK Healthcare: https://youtu.be/_xM5h55Dp_I5 Day UK Food Tour: https://youtu.be/9Uuoeih9Bp8We Love UK Food: https://youtu.be/_moJ3ok6nTsBaby Bump Progression: https://youtu.be/IfSHIa_lIGkUS vs. UK Driving Conditions: https://youtu.be/0msw5tfYzX8Americans Love Moggmentum: https://youtu.be/AQvCP8iK5iU","Hey guys! We are Felipe and Lillian, Americans living in the UK, living a traditional family life. We make videos vlogging our journey through marriage, raising children, and commenting on culture, society, parenting, living as ex-pats, languages, natural eating, natural birth, and more! ------------Subscribe to our channel for new videos three times a week: youtube.com/c/thepostmodernfamilyBuy our unique t-shirt designs to support our channel and our interns: https://teespring.com/stores/the-postmodern-familySubscribe to our Podcast to get inside our heads: https://itunes.apple.com/gb/podcast/the-postmodern-family/id1252448505?mt=2Check out our Patreon if you want to join our Exclusive Community: patreon.com/thepostmodernfamilyBuy Lillian's music here: http://bit.ly/buyPMFsongs, http://bit.ly/PMFfrenchsong, and http://bit.ly/PMFitaliansongsAnd our Website for everything that we're doing: thepostmodernfamily.com","family parenting culture languages pregnancy marriage","e4wajXk_cDs"
-aGtGJcvKbo,"Beautiful Makeup Tutorial Compilation 2021 ♥ VIRAL GLAM MAKEUP TUTORIAL #3","UCvMsvCn9b6C4kxOyDq2VYiQ","BeautyLife","26","766.0","https://i.ytimg.com/vi/-aGtGJcvKbo/default.jpg","[none]","Beautiful Makeup Tutorial Compilation 2021 ♥ VIRAL GLAM MAKEUP TUTORIAL #3Thank you all so much for watching, I hope you enjoyed! ❤️❤️❤️Music Artist https://soundcloud.com/osh-vahttps://www.youtube.com/channel/UC_uiomVq61yUos1FUuOdsTwSongs: Oshóva - Lively (Vlog No Copyright Music)Oshóva - Summer's Tides Oshóva - Moody SwingOshóva - Our Fantasies Oshóva - Lonely RideOshóva - Mountain_s LullabyCreative Commons — Attribution 3.0 Unported  — CC BY 3.0","","","e4wajXk_cDs"
-xvBxkWG6go,"why i lied to you for so long - gabbie hanna","UCN59EzXOq0r9CstB_wxu8Iw","Gabbie Hanna Music","10","1808.0","https://i.ytimg.com/vi/-xvBxkWG6go/default.jpg","gabbie hanna|thegabbieshow|vlogmas|drama|monster|typing|genius|interview|channel|music|i am the victim|storytime|smoking|woah|call me crazy|makeover|diy|turf|cat|cats|kittens|decor|decoration","please subscribe to this new channel: https://tinyurl.com/findingghfollow me on spotify: https://tinyurl.com/gabbiehanna-spotifyvlogmas day 9","Music, art & life.Follow me on Spotify: https://open.spotify.com/artist/gabbiehanna-spotifyFollow me on twitter: https://twitter.com/GabbieHannaFollow me on instagram: https://www.instagram.com/GabbieHanna/Follow me on Tiktok: https://www.tiktok.com/@gabbiehanna?source=h5_m","gabbie hanna thegabbieshow music poetry the gabbie show podcast burnout genius i am the victim typing poetry monster meme","e4wajXk_cDs"
