video_id,title,channelId,channelTitle,categoryId,duration,thumbnail_link,tags,description,channel_desc,channel_keywords,related_vid_id
rI2qyg-meMM,"Am I The A**hole? 2 - SimplyPodLogical #45","UC5FF_Ubkm8yohCIGQkq7bCg","SimplyPodLogical","22","3645.0","https://i.ytimg.com/vi/rI2qyg-meMM/default.jpg","simplypodlogical|simply nailogical|simplynailogical|simplynailogical podcast|simply podcast|nailogical podcast|cristine and ben|cristine & ben|simplynailogical boyfriend|pod logical|youtuber podcast|reddit|advice|aita|am I the asshole|jerk|am I the jerk|internet advice|bad boyfriend|dating|relationships","On this episode of SimplyPodLogical, Cristine and Ben look at posts on the popular subreddit r/amitheasshole and discuss bad boyfriends, peeing on the floor, keeping secrets in a relationship, and co-workers who don’t wash their hair. 0:00 - Hey what’s up holo everyone 0:59 - Am I the a**hole for missing my ride by 36 seconds?4:43 - Am I the a**hole for setting a pee trap for my wife?11:31 - Am I the a**hole for telling HR my co-worker doesn’t wash her hair?20:54 - Am I the a**hole for letting my family prank my girlfriend?26:47 - Am I the a**hole for calling my white girlfriend a “mayo mamma”?31:13 - Am I the a**hole for telling my girlfriend she doesn’t have a real job?37:45 - Am I the a**hole for expecting my boyfriend to replace my socks?44:15 - Am I the a**hole for proposing to my girlfriend with a video game reference?50:34 - Am I the a**hole for abandoning my girlfriend on top of a mountain? 55:17 - Am I the a**hole for not letting my girlfriend see my secret private box?_ _ _ _ _ _ _ _ _ _ _ _ _ _ _ _ _ _ _ _ _ _ _ _ _ _ _ _ _ _ _ _ _ _Follow the simplypod and drop us some episode topic suggestions!:https://twitter.com/simplypodlogicahttps://www.instagram.com/simplypodlogical/https://www.facebook.com/simplypodlogical/https://www.reddit.com/r/simplypodlogical/Cristine:https://www.youtube.com/simplynailogicalhttps://www.holotaco.comhttps://twitter.com/nailogicalhttps://www.snapchat.com/add/simplynailogicahttps://www.instagram.com/simplynailogical/https://www.facebook.com/simplynailogical/Ben:https://twitter.com/simplybenlogicahttps://www.instagram.com/simplybenlogical/_ _ _ _ _ _ _ _ _ _ _ _ _ _ _ _ _ _ _ _ _ _ _ _ _ _ _ _ _ _ _ _ _ _Shop items from our Podcast set on my Amazon storefront! https://www.amazon.com/shop/simplynailogical(affiliate link)©Simply Nailogical Inc. All opinions are our own.","Well holo there... lets T A C O ‘bout it😏🌮🎧A Simply Nailogical Podcast with Cristine & BenNEW EPISODES EVERY  🌮~ T A C O  T U E S D A Y ~🌮Audio episodes also available on Apple Podcasts and Spotify by Wednesday AM","podcast simplynailogical cristine ben simplymomlogical simplydadlogical simplynailogical podcast holo holo taco cristine and ben","e4wajXk_cDs"
7Ybd3eLUqlM,"Watch Act 1 of S13 E4 👑 RuPaulmark Channel | RuPaul’s Drag Race","UC0sEIyXXalzD1lbwm3D2xpA","RuPaul's Drag Race","24","502.0","https://i.ytimg.com/vi/7Ybd3eLUqlM/default.jpg","vh1|rupaul|rupaul's drag race|drag race|VH1|ru paul|drag queen|RPDR Season 13|Drag Race Season 13|Drag Race New Season|Drag Race Season 13 Queens|Drag Race Season 13 Ruveil|Drag Race Queens Reveal|LGBT|Drag Race Competition|Rupaul New Season|Drag Race Super Star|Drag Race Superstar|RuVeal Runway Walk|Denali Foxx|Elliott Puckett|Joey Jay|Kahmora Hall|LaLa Ri|Kandy Muse|Mik|Olivia Lux|Rose|Symone|Tamisha Iman|Tina Burner|Utica|Ep 4|RPDR 13 EP 4","With the queens all together and elimination back in play, now the real race begins! Which team are you excited for in the RuPaulmark Channel acting challenge? 🎭🎬  Don’t miss a new #DragRace Friday at 8/7c on VH1! 💅#VH1 #DragRaceMore from RuPaul's Drag Race:Official Website: http://www.vh1.com/shows/rupauls-drag-race Like RuPaul's Drag Race on Facebook: https://www.facebook.com/rupaulsdragrace Follow RuPaul's Drag Race on Instagram: https://www.instagram.com/rupaulsdragrace/ Follow RuPaul's Drag Race on Twitter: https://twitter.com/rupaulsdragrace","Welcome to the RuPaul's Drag Race YouTube channel! Subscribe for drag herstory and digital exclusives with your favorite queens.Watch Canada's Drag Race Mondays at 8/7c on Logo!","vh1 logo showtime all stars rupaul drag race rupaul's drag race","e4wajXk_cDs"
MbcpUpzeEgk,"Can I Make A $300 Mac & Cheese For Shane? • Dish Granted","UCircJf-FlToBNjuy9xG-i5A","Watcher","24","1366.0","https://i.ytimg.com/vi/MbcpUpzeEgk/default.jpg","Steven Lim|BuzzFeed Worth It|Vs.|Mac N Cheese|Expensive|Shane Madej|Food|Cooking Show|Competition|Tasty|Recipe|Without A Recipe|About to eat","Welcome to Dish Granted! A show where host & amateur home cook Steven Lim attempts to create the most extravagant dishes for his friends. Our first guest is Watcher's very own puppet master & ghost hunter-extraordinaire, Shane Madej!Get Dish Granted aprons at http://www.watcherstore.comSupport us at:http://www.patreon.com/watcher​Watcher. A network from Steven Lim, Ryan Bergara, and Shane Madej.Filming was conducted under recommended COVID-safe guidelines. Social:http://www.instagram.com/wearewatcher​http://www.twitter.com/wearewatcher​https://www.facebook.com/watcherentertainmenthttps://wearewatcher.tumblr.com/​Business Inquiries: hello@watcherentertainment.comCreated and hosted by Steven LimCo-directed by: Tony Kim (@tonykfilms)Featuring: Shane MadejPhone-A-Friend: Francesco Sinatra (@pasta_sisters)Edited by: Anthony FrederickProduction Coordinator & Sound: Brittney LeeCreative Director of Post Production: Anthony FrederickHead of Development: Katie LeBlancExecutive Producers: Steven Lim, Shane Madej, Ryan Bergara, Katie LeBlancSpecial Thanks to: Semolina Artisanal Pasta (@semolinaartisanalpasta), Say Cheese (saycheeselosangeles), Truffle Brothers (trufflebrothers), Pasta Sisters (@pasta_sisters)Show Logo designed by: Casandra Ng (casandrang)Videos featured:SimplyFoodByTy's Mac & Cheese Recipe: https://youtu.be/12RCZXrk8vgChef Michael Garrett's Graham Cracker Black Pepper Streusel: https://www.ice.edu/blog/chef-michael-garretts-macaroni-pie-recipeTasty's Perfect Pie Recipe: https://youtu.be/SR4R7GHxU1wMusic Provided by Audio NetworkSFX by AudioblocksLogo Designed by Jennet Liaw (@jennetliaw)Logo Sound Design by Yuta Endo (@yuuutaendo)","Watcher is a new production studio that is focused on creating television-caliber, unscripted series in the digital space. Our shows have a genuine curiosity and earnest exploration into a variety of topics including food, travel, horror and everything in between. Subscribe to stay up-to-date on the latest for your favorite series.OUR SHOWS: Are You ScaredGrocery RunHomemadeMaking WatcherPuppet HistorySocial Distancing & Dungeons & DragonsSpooky Small TalkToo Many Spirits!Top 5 BeatdownTourist TrappedWatcher Weekly Weird and/or Wonderful WorldBusiness Inquiries: hello@watcherentertainment.com","Ryan Bergara Shane Madej Steven Lim Production Studio Homemade Grocery Run Spooky Small Talk Watcher Weekly Making Watcher Puppet History Weird and or Wonderful World Top 5 Beatdown BuzzFeed Unsolved Worth It Are You Scared too many spirits","e4wajXk_cDs"
8vQVSeRK3AY,"Virgins Answer Very Personal Questions | Sex Ed","UCJjSDX-jUChzOEyok9XYRJQ","Jubilee","24","621.0","https://i.ytimg.com/vi/8vQVSeRK3AY/default.jpg","jubilee|jubilee media|jubilee project|middle ground|spectrum|odd man out|versus 1|embrace empathy|live deeper|love language|blind devotion|jubilee sex ed|sex ed|sexual education|sexual health|virgins|jubilee virgins|jubilee virgin sex ed|asking questions about sex|sex q and a","Content warning: This video contains discussion of or reference to sexual assault and other sensitive topics. Follow us on INSTAGRAM: 👉https://www.instagram.com/jubileemedia/ 👈SUBSCRIBE for more! http://bit.ly/SUBSCRIBEjubilee Be in a Jubilee video: http://bit.ly/JubileeCastingSupport Jubilee: http://www.jubileemedia.com/support👉 We started a second channel! Behind the scenes, director commentaries, reaction videos, and more! Check it out & subscribe to Twobilee: https://www.youtube.com/channel/UChaokX58PemxqTI3KjscjPwAre you a loyal Jubilee fan? Join our Facebook group: https://www.facebook.com/groups/407942859721012/Have an idea or a personal story you'd like to share? Submit here: https://airtable.com/shrFDrsc4DzgBV3lV| ABOUT |We believe in the power of empathy for human good. Ultimately, we aim to inspire people to EMBRACE EMPATHY.| SOCIAL |Jubilee Facebook: https://www.facebook.com/jubileemediaJubilee Instagram: https://www.instagram.com/jubileemedia/Jubilee Twitter: https://www.twitter.com/jubileemediaJubilee Website: https://www.jubileemedia.comFEATURING:Jake - https://www.instagram.com/jakerohrs/Isabel - https://www.instagram.com/nova73017/Juliet - https://www.instagram.com/julieterminda Renee - https://www.instagram.com/renee_is_super_loud/Sudarsh - https://www.instagram.com/nemekk_/Brandon - https://www.instagram.com/brandoncyeeKendra - https://www.instagram.com/ken10hollywoodGrace - https://www.instagram.com/gracekiemChapters0:00 Intro0:28 How do you define virginity?1:20 How badly do you want to have sex?2:24 Why are you a virgin?3:30 Have you ever had an orgasm?4:19 Would you rather your first time be with a virgin or someone experienced?4:56 Are you embarrassed about being a virgin?6:28 Have you ever had the chance to lose your virginity, but chose not to?7:35 Do you watch porn?8:42 Are you afraid for your first time?For brands interested in partnering with Jubilee, email us:hello@jubileemedia.com","We believe in the power of empathy for human good.","“Jubilee” “jubilee media” project” “good videos” “positive “millennial” “film” “social impact “storytelling” “good” “positive” “change”","e4wajXk_cDs"
_hTL33eL0RA,"Instagram Followers Control My Furniture Flip !! *FREE furniture old to NEW*","UCzzOKT1SkE7qdycJvPCR3Gg","Mia Maples","26","1305.0","https://i.ytimg.com/vi/_hTL33eL0RA/default.jpg","mia maples|my instagram followers control my day|free furniture makeover|free furniture flip|flipping furniture|flipping free furniture|furniture makeover|old to new|my instagram followers control my makeover|instagram followers control my furniture makeover|followers decide my day|followers decide my renovation|followers decide my room makeover|instagram hacks|free furniture shopping|decorating a room for free|making free furniture cute|diy","Another FREE furniture makeover, this time with a twist !! You decide what we do !! Follow me on instagram to be a part of the next one :) @miamaples New Video's Fridays & Sundays :) !!Shop My Merch: https://fanjoy.co/collections/mia-maples  TikTok: @realiomiamaples Instagram: @miamaples  :)","Here on this channel we like to HAVE FUN !! Whether we are renovating a house, playing with makeup, trying on clothes OR ANYTHING REALLY!","","e4wajXk_cDs"
jRazV_zB1Zg,"Trixie Makeup using ELF Cosmetics","UC0biFgrMdkv1hFAFLVePODQ","Trixie Mattel","26","1606.0","https://i.ytimg.com/vi/jRazV_zB1Zg/default.jpg","trixie|mattel|cosmetics|ELF|full face|one brand","Full face of Trixie makeup using ELF Cosmetics!Shop Pop Off Glitter from Trixie Cosmetics: https://www.trixiecosmetics.com/shop/pop-off","Legend, Icon, and Star Trixie MattelAges 3 and Up, Accessories Sold Separately, Batteries Not Included","trixie mattel trixie cosmetics","e4wajXk_cDs"
lprJ4tEMSSg,"Keith & Zach Take The Friendship Test - The TryPod Ep. 92","UCRrigpc864fw8ZNsJ2AnEJA","TryPods","23","4256.0","https://i.ytimg.com/vi/lprJ4tEMSSg/default.jpg","tryguys|keith|ned|zach|eugene|habersberger|fulmer|kornfeld|yang|buzzfeedvideo|buzzfeed|ariel|ned & ariel|comedy|education|funny|try|learn|fail|experiment|test|tryceratops|podcast|advice|miles|miles nation|secrets|show|talkshow|behind the scenes|youtubers|ramble|audio|video podcast|clip|segment|silly|becky|maggie|you can sit with us|try wives|girls|female|women|friendship test|glamour|bff|best friend","FOLLOW UShttp://www.Instagram.com/keithhabshttp://www.Instagram.com/nedfulmerhttp://www.Instagram.com/korndiddyhttp://www.instagram.com/eugeneleeyanghttp://www.instagram.com/milesbon http://www.twitter.com/keithhabshttp://www.twitter.com/nedfulmer http://www.twitter.com/korndiddyhttp://www.twitter.com/eugeneleeyang http://www.twitter.com/milesbondTHE TRYPODThe Try Guys have swam with sharks, survived in the wild, shocked themselves with birthing simulators, and risked their lives for their videos. In this weekly podcast they dissect their experiences as internet creators and best friends who have made a living failing upwards. MUSICLicensed from AudioNetworkPODCAST PRODUCERMiles Bonsignore","The Try Guys have swam with sharks, survived in the wild, shocked themselves with birthing simulators, and risked their lives for their videos. In this weekly podcast they dissect their experiences as internet creators and best friends who have made a living failing upwards.","tryguys keith ned zach eugene habersberger fulmer kornfeld yang buzzfeedvideo buzzfeed ariel ned & ariel comedy education funny try learn fail experiment test tryceratops podcast comedy show miles cadence13 ramble","e4wajXk_cDs"
I7wTe5SRRsw,"Emma Chamberlain on Her Acne Journey, and Guide to TikTok Makeup | Beauty Secrets | Vogue","UCRXiA3h1no_PFkb1JCP0yMA","Vogue","26","812.0","https://i.ytimg.com/vi/I7wTe5SRRsw/default.jpg","how to|celebrity|emma chamberlain|emma chamberlain beauty secrets|emma chamberlain interview|emma chamberlain vogue|emma chamberlain vogue interview|emma chamberlain beauty|emma chamberlain makeup|emma chamberlain makeup tutorial|emma chamberlain getting ready|emma chamberlain gets ready|emma chamberlain getting ready with|makeup tutorial|beauty tutorial|emma|emma chamberlain youtuber|emma chamberlain tiktok|emma chamberlain vogue makeup|vogue","Watch Emma Chamberlain share her beauty secrets, from how she takes care of her blemish-prone skin to her everyday makeup look.Shop this beauty routine:Bad Habit Silent Mode Hydrating Hyaluronic Mask: https://shop-links.co/1729982660003975323iUNIK Black Snail Restore Serum Repair Ampoule: https://amzn.to/2KwWqP9 iUNIK Tea tree Relief Natural Facial Serum: https://amzn.to/390V34B The Ordinary Niacinamide 10% + Zinc 1%: https://shop-links.co/1729982705285338746Bad Habit Dewd Hemp Nourishing Facial Oil: https://shop-links.co/1729982748170479319Elta MD UV Clear Facial Sunscreen Broad-Spectrum SPF 46: https://amzn.to/3o0giYFKosas LipFuel Active Lip Balm: https://shop-links.co/1730004190175871646 Kosas Tinted Face Oil Foundation: https://shop-links.co/1729982849773159060Kosas Revealer Super Creamy + Brightening Concealer: http://bit.ly/3itKCdfMarc Jacobs Beauty O!Mega Bronzer Coconut Perfect Tan: https://shop-links.co/1729983138591641491Becca Cosmetics Shimmering Skin Perfector® Pressed Highlighter: https://shop-links.co/1729983205235734402Maybelline Great Lash Clear Mascara: https://shop-links.co/1729983371728013499Benefit Cosmetics Gimme Brow + Tinted Volumizing Eyebrow Gel: https://shop-links.co/1729983468449439839Buxom Full-On Plumping Lip Cream Gloss: https://shop-links.co/1729983695474627128Milani Baked Blush: https://shop-links.co/1729984940007042008Byredo Space Black Mascara: https://fave.co/3nW2GxGCharlotte Tilbury Lip Cheat Lip Liner - Pillow Talk Collection: https://shop-links.co/1729984736101968054Charlotte Tilbury Collagen Lip Bath Gloss: https://shop-links.co/1729984796770440164IGK Jet Lag Invisible Dry Shampoo: https://shop-links.co/1729984905515206655Drybar Money Maker Flexible Hold Hairspray: https://shop-links.co/1729984996228349180When you buy something through our retail links, we earn an affiliate commission.Still haven’t subscribed to Vogue on YouTube? ►► http://bit.ly/vogueyoutubesubWant to hear more from our editors? Subscribe to the magazine ►► http://bit.ly/2wXh1VWCheck out our new podcast 'In Vogue: The 1990s'  ►► https://link.chtbl.com/iv-yt-description ABOUT VOGUEVogue is the authority on fashion news, culture trends, beauty coverage, videos, celebrity style, and fashion week updates. Emma Chamberlain on Her Acne Journey, and Guide to TikTok Makeup | Beauty Secrets | Vogue","Vogue places fashion in the context of culture and the world we live in—how we dress, live and socialize; what we eat, listen to and watch; who leads and inspires us. Vogue immerses itself in fashion, always leading readers to what will happen next. Thought-provoking, relevant and always influential, Vogue defines the culture of fashion.","Vogue fashion style beauty anna wintour 73 questions beauty secrets","e4wajXk_cDs"
x2WBythSGoQ,"The exact moment Shane Dawson's career ended: 12:37 PM, 06/30/20.","UCqWxviU8cjjHZsTLWgPFZuA","dangelowallace","24","4415.0","https://i.ytimg.com/vi/x2WBythSGoQ/default.jpg","d'angelo wallace|dangelowallace|commentary|The exact moment Shane Dawson's career ended: 12:37 PM 06/30/20","shane dawson learns that you can't serve your humble pie and eat it tooPodcast: https://www.youtube.com/channel/UCNo1zLUBp0gwDmuXvB7OOwwBonus videos: https://www.youtube.com/dangelowallaceInsta | Twitter @dangelnohttps://instagr.am/dangelno | https://twitter.com/dangelno","internet person","d'angelo wallace dangelowallace commentary","e4wajXk_cDs"
OLWMbG8qC80,"Villains in 2021 be like:","UCy0Pr5u-MwGXXzp_GDd4m_g","Julie Nolke","23","352.0","https://i.ytimg.com/vi/OLWMbG8qC80/default.jpg","[none]","You think waterboarding is bad just you wait. Get Surfshark VPN at https://surfshark.deals/nolke - Enter promo code NOLKE for 83% off and 3 extra months for FREE!","Hey, I'm Julie. I'm an actor, writer and creator of this channel. Tune in for a new comedy sketch every Thursday. Management and Acting InquiriesGrand Wave Entertainmentcarolyn@grandwaveentertainment.com","Feeling Peckish julie nolke","e4wajXk_cDs"
RSMrurKuJIY,"let's talk about buzzfeed | Devin But Better","UCkqU_7_CmVJ0xKViT9rnHEA","Devin Lytle","24","541.0","https://i.ytimg.com/vi/RSMrurKuJIY/default.jpg","Buzzfeed|Lady Like|Devin But Better|Frederica “Freddie” Ransome|Jennifer Jen Ruggirello|Kristin Chirico|LadyLike|Chantel Houston|Devin Lytle","hey! let's talk about buzzfeed. respectfully tho, because i still have some friends who work there and i love them so let's not make their lives harder by talking a bunch of shit, y'know? love you, you beautiful nerds. If you liked this video, subscribe now for more: https://bit.ly/DevinButBetter","This is my BuzzFeed and Ladylike account! Check out my stuff over at Ladylike and Boldy! xx","Devin Lytle Devin But Better Buzzfeed LadyLike Lady Like Frederica “Freddie” Ransome Jennifer Jen Ruggirello Chantel Houston Kristin Chirico","e4wajXk_cDs"
NDuaiYf8WDQ,"Try Guys Debunk COVID Vaccine Conspiracies With Dr. Fauci","UCpi8TJfiA4lKGkaXs__YdBA","The Try Guys","23","856.0","https://i.ytimg.com/vi/NDuaiYf8WDQ/default.jpg","try guys|keith|ned|zach|eugene|habersberger|fulmer|kornfeld|yang|buzzfeedvideo|buzzfeed|ariel|ned & ariel|comedy|education|funny|try|learn|fail|experiment|test|tryceratops|fauci|vaccine|covid 19|vaccine news|health|health news|dr fauci|doctor fauci|dr anthony fauci|interview|covid|moderna|biontech|new covid strain|israel vaccination|vaccine production|joe biden vaccine|covid vaccine|new strain|pfizer|kamala harris vaccine|vaccine rollout","Today we're asking Dr. Anthony Fauci all of the questions you want answers to about the COVID- 19 vaccine and debunking conspiracy theories, misinformation, and myths! Thank you, Dr. Fauci taking the time to talk with us! Covid-19 Vaccine FAQ'sCDC:https://www.cdc.gov/coronavirus/2019-ncov/vaccines/faq.htmlFDA:https://www.fda.gov/emergency-preparedness-and-response/mcm-legal-regulatory-and-policy-framework/pfizer-biontech-covid-19-vaccine-frequently-asked-questionsNYTimes:https://www.nytimes.com/interactive/2021/health/how-covid-19-vaccines-work.htmlCDC:https://www.cdc.gov/coronavirus/2019-ncov/vaccines/expect.htmlAre you a business looking to work with The Try Guys? Reach out to us at 2ndtrybusiness@gmail.com for all business inquiries! 🎧THE TRYPOD 🎧: watch our new podcast at https://youtube.com/trypod or listen at https://tryguys.com/podcast📘THE HIDDEN POWER OF F*CKING UP 📘: check out our new book at https://tryguys.com/bookGet your official Try Guys color hoodies and phone cases at https://tryguys.com/collections/color-line 💙❤️💚💜Support us! http://www.patreon.com/tryguys. Join our Patreon to get videos a day early, plus, live streams, chatrooms, BTS footage, exclusive merchandise, and more!SUBSCRIBE TO AND FOLLOW THE TRY GUYS http://www.youtube.com/c/tryguyshttp://www.facebook.com/tryguys  http://www.twitter.com/tryguyshttps://www.instagram.com/tryguysFOLLOW THE GUYShttp://www.Instagram.com/keithhabshttp://www.Instagram.com/nedfulmerhttp://www.Instagram.com/korndiddyhttp://www.instagram.com/eugeneleeyang http://www.twitter.com/keithhabshttp://www.twitter.com/nedfulmer http://www.twitter.com/korndiddyhttp://www.twitter.com/eugeneleeyang THE TRY GUYSThe #TryGuys is the flagship channel of 2ND TRY, LLC. Tune in twice a week for shows from Keith, Ned, Zach and Eugene, the creators and stars of The Try Guys.FEATURINGDr. Anthony Fauci - Director of the National Institute of Allergy and Infectious Diseases and professional Immunologist  EDITED BYDevlin McCluskey MUSICLicensed from AudioNetworkSFXLicensed from AudioblocksVIDEOLicensed from VideoblocksOfficial Try Guys Photos By Mandee Johnson Photography | @mandeephotoEXTERNAL CREDITS Zoe Malik - Writer / Research Producer 2nd Try, LLC STAFFExecutive Producer - Keith HabersbergerExecutive Producer - Ned FulmerExecutive Producer - Zach KornfeldExecutive Producer - Eugene Lee YangProducer - Rachel Ann ColeProducer - Nick RufcaAssociate Producer - Alexandria HerringEditor - Devlin McCluskeyEditor - YB ChangEditor - Elliot DickerhoofAssistant Editor - Will WitwerPodcast Producer - Miles BonsignoreCamera Operator/Assistant Production Coordinator - Jonathan KirkSound Operator Assistant Production Coordinator - Sam JohnsonContent Strategist - Kaylin BurkeSpecial Thanks To! Thanks to all of our Gold Level Patrons! AJ S., Amy Fleming, Ana Camba, Cat Hicks, Elisa Proust, Emma Godfrey, Erica Rao, Jared Aarons, Kelsey Bock, Kourtney Wong, Loretta Wen, Matthew Tadros, Miha, Paulus, Sarah Waxman, Traci Lew, Wendy Tran, Lily","Welcome to our new, completely independent channel, featuring the same guys, with better videos. New episodes every Wednesday & Saturday!Get tickets for our worldwide tour Legends Of The Internet at www.tryguys.com/tourThe TryPod podcast available everywhere at www.tryguys.com/podcastOrder our book The Hidden Power Of F*cking Up at www.tryguys.com/bookOfficial Try Guys merch at www.tryguys.comTHE TRY TEAMExecutive Producer - Keith HabersbergerExecutive Producer - Ned FulmerExecutive Producer - Zach KornfeldExecutive Producer - Eugene Lee YangProducer - Nick RufcaProducer - Rachel Ann ColeProduction Manager - Alexandria HerringAssistant Production Coordinator / TryPod Producer - Miles BonsignoreEditor - Devlin McCluskeyEditor - YB ChangEditor - Elliot DickerhoofAssistant Editor - Will WitwerSocial Media Manager - Kaylin BurkeOffice Production Assistant - Sam JohnsonProduction Assistant - Jonathan KirkThe Try Guys is the flagship channel of 2ND TRY, LLC.","try guys keith ned zach eugene habersberger fulmer kornfeld yang buzzfeedvideo buzzfeed ariel ned & ariel","e4wajXk_cDs"
