video_id,title,channelId,channelTitle,categoryId,duration,thumbnail_link,tags,description,channel_desc,channel_keywords,related_vid_id
Ti3gnNfzXbs,"RYAN GARCIA CALLS OUT TANK DAVIS WITH CANELO SECONDS AFTER BEATING LUKE CAMPBELL IN THE LOCKER ROOM","UCzp5-dEdqKOS9tCF8S-UErg","Little Giant Boxing","17","279.0","https://i.ytimg.com/vi/Ti3gnNfzXbs/default.jpg","Ryan garcia|Luke Campbell|DAZN|boxing|Boxeo|No boxing no life|Ryan garcia after knocking out Luke Campbell|Boxing news|Ryan garcia vs Luke Campbell|post fight presser conference|Little Giant boxing|Little Giant Boxing Ryan garcia|Canelo|Little Giant boxing Canelo|Little Giant boxing Ryan garcia|Ryan garcia calls out Gervonta tank Davis|Ryan garcia vs Luke Campbell fight|Ryan garcia gets dropped by Luke campbell|Ryan garcia knocks out Luke Campbell","#GarciaCampbell #GarciavsCampbell #TankDavisRYAN GARCIA CALLS OUT TANK DAVIS WITH CANELO SECONDS AFTER BEATING LUKE CAMPBELL IN THE LOCKER ROOMIn this video, Ryan Garcia calls out Gervonta Tank Davis after knocking out Luke Campbell and goes as far as to say he has no excuses to not make the fight happen. Ryan garcia celebrates win with Canelo in the locker room.","Bringing you behind the scenes with your favorite fighters. Boxing interviews, training, and one on one interviews","Boxing Boxeo Little Giant Boxing Canelo","6lIvg3JLQk0"
nSQudnJSZiI,"HIGHLIGHTS | Sean Garcia vs. Rene Marquez","UCurvRE5fGcdUgCYWgh-BDsg","DAZN Boxing","17","597.0","https://i.ytimg.com/vi/nSQudnJSZiI/default.jpg","dazn|boxing|highlights|full fight|ko|knockout|ryan garcia|top 10|canelo|anthony joshua|ggg|haney|sean garcia|rene marquez|garcia campbell|undercard","January 2nd, 2021 -- Sean Garcia vs. Rene Marquez from the American Airlines Center in Dallas, Texas.Subscribe to our YouTube channel 👉  http://bit.ly/DAZNBoxingYouTubeDownload the DAZN app now 👉  http://bit.ly/DAZN_YTFollow DAZN Boxing On Social Media 👇Twitter: https://www.twitter.com/DAZNBoxingInstagram: https://www.instagram.com/DAZNBoxingFacebook: https://www.facebook.com/DAZN","Subscribe to our YouTube channel 👉  http://bit.ly/DAZNBoxingYouTubeDownload the DAZN app now 👉  http://bit.ly/DAZN_YTFollow DAZN Boxing On Social Media 👇Twitter: https://www.twitter.com/DAZNBoxingInstagram: https://www.instagram.com/DAZNBoxingFacebook: https://www.facebook.com/DAZN","boxing mma dazn stream highlights full fights canelo ryan garcia","6lIvg3JLQk0"
SVn7LsAbiRQ,"FULL FIGHT | Devin Haney vs. Alfredo Santiago (DAZN REWIND)","UCurvRE5fGcdUgCYWgh-BDsg","DAZN Boxing","17","3294.0","https://i.ytimg.com/vi/SVn7LsAbiRQ/default.jpg","dazn|boxing|highlights|full fight|ko|knockout|ryan garcia|top 10|canelo|anthony joshua|ggg|haney|ksi|logan paul|haney santiago|alfredo santiago","November 9, 2019 -- Devin Haney vs. Alfredo Santiago from Staples Center in Los Angeles, California.Subscribe to our YouTube channel 👉  http://bit.ly/DAZNBoxingYouTubeDownload the DAZN app now 👉  http://bit.ly/DAZN_YTFollow DAZN Boxing On Social Media 👇Twitter: https://www.twitter.com/DAZNBoxingInstagram: https://www.instagram.com/DAZNBoxingFacebook: https://www.facebook.com/DAZN","Subscribe to our YouTube channel 👉  http://bit.ly/DAZNBoxingYouTubeDownload the DAZN app now 👉  http://bit.ly/DAZN_YTFollow DAZN Boxing On Social Media 👇Twitter: https://www.twitter.com/DAZNBoxingInstagram: https://www.instagram.com/DAZNBoxingFacebook: https://www.facebook.com/DAZN","boxing mma dazn stream highlights full fights canelo ryan garcia","6lIvg3JLQk0"
ptndYf5whSU,"EXCLUSIVE! WOW! RYAN GARCIA IMMEDIATELY AFTER STOPPING LUKE CAMPBELL","UCjb7rhCq6GmiW42NRjEgA9g","Fino Boxing","17","317.0","https://i.ytimg.com/vi/ptndYf5whSU/default.jpg","Ryan García|Luke Campbell|Fino Boxing|Eddie Hearn|Matchroom Boxing|Sky Sports|IFL TV|seconds out|boxing social|behind the gloves|FIGHTHYPE|Frank Warren|Anthony Joshua|Tyson Fury|Ricky Hatton|Billy Joe Saunders|Chris Eubanks|Frank Smith|DAZN|UK Boxing|The Boxing Source|George Groves|Carl FRONCH|TY Boxing|Adriana Jimenez|TV BOXEO|HAY TIRO|ESPN DEPORTES|ESPN KNOCKOUT|CANAL SPACE","","Fino Boxing goal is to bring the fight fans the best knowledgeable boxing news today.","BOXING PBC FINO FIGHTHUB FIGHTHYPE ESNEWS Fino Boxing IFL TV Behind The Gloves Matchroom DAZN Eddie Hearn Golden Boy Boxing Mike Tyson Roy Jones Jr Canelo ryan garcia teofimo lopez devin haney Fino Boxing IFL TV Fighthype Fighthub Fight ESNEWS BOXEO Mexicano Golden Boy Boxing Top Rank DAZN Eddie Hearn vergil ortiz shawn porter keith thurman yordenis ugas oscar de la hoya top rank boxing Gervonta Davis Stephen Fulton Terence Crawford Matchroom Boxing","6lIvg3JLQk0"
4UXutAr4gao,"Justin Fields Survives CRUSHING HIT! Ohio State vs Clemson Sugar Bowl Highlights","UCHlBaw2X5iYQGJhd5v718Zw","Brian Sutterer MD","17","385.0","https://i.ytimg.com/vi/4UXutAr4gao/default.jpg","ohio state buckeyes|ohio state football|college football|justin fields hit|justin fields|justin fields injury|ohio state vs clemson|college football highlights|college football playoff|sugar bowl 2021|sugar bowl|ohio state vs clemson highlights|doctor reacts|justin fields massive hit|clemson player ejected|all state sugar bowl|cfp semifinals|espn cfp","Ohio State Quarterback Justin Fields survived a massive, bone-crushing hit against Clemson during the Sugar Bowl college football playoff semi-final. While fields continued the game, there is serious worry for major injuries to fields, including possible rib fractures and internal organ injuries like to the kidney. In this video we'll review the hit and the key aspects of the injuries that Fields will have to be evaluated for.Follow Me on Twitter!https://twitter.com/b_suttererI'm a doctor and a sports fan and this channel is dedicated to exploring the unique medical side of the world of sports, including NBA, MLB, NFL, UFC, and many more! Breaking down the biggest what ifs, historical injuries and stories, and making learning about medicine fun and relevant for all sports fans!Anatomy images: https://www.biodigital.comDISCLAIMER: Content not intended to be taken as medical advice. Opinions are my own and do not represent those of my employer. I have not personally treated or evaluated the individual(s) discussed in this video. Content used with educational and transformative intent within Fair Use GuidelinesContent owned and produced by Brian Sutterer LLC 2021","Are you a sports fan? Ever wonder about what is going on when they discuss different injuries? This channel is all about combining my two passions and reviewing sports injuries to explain them in a way the casual fan can understand and learn from.  I'm a resident doctor specializing in physical medicine and rehabilitation (PM&R).  So if you want to learn more about everything from past notable injuries to current athletes, be sure to subscribe and check out my channel!*Content on this channel is not to be taken as medical advice and opinions represent those of the individual(s) and not of my employer. I have not personally evaluated any of the athletes discusses on this channel and have never been involved in any aspect of their clinical care-Content produced and owned by Brian Sutterer LLC","nba nfl highlights nba what if sports medicine nba news sports news basketball sports injuries brian sutterer ufc injuries nba highlights","6lIvg3JLQk0"
RcFfMSbucXM,"McGregor vs. Alvarez | Best Moments","UCXz7ndon_Z1cYm49dwxbK0w","Larone","17","2052.0","https://i.ytimg.com/vi/RcFfMSbucXM/default.jpg","conor|mcgregor","Best moments featuring Conor McGregor & Eddie Alvarez in UFC 205#UFC","","Larone","6lIvg3JLQk0"
SD9XOl11A9U,"GERVONTA DAVIS REACTS TO RYAN GARCIA KNOCKING OUT CAMPBELL IN 7 AFTER GETTING DROPPED","UCmxZw7N4Jyljr1RbSs4Ymaw","FightHype.com","17","107.0","https://i.ytimg.com/vi/SD9XOl11A9U/default.jpg","Gervonta Davis|Ryan Garcia|Luke Campbell|Boxing|FightHype","FightHype.com is on hand in Dallas, Texas where lightweight sensation Ryan Garcia knocked out top contender Luke Campbell with a brutal body shot in the 7th round of their showdown. You don't want to miss what went down after the fight. Check it out!","FIGHTHYPE.COM - A FIGHT IS A FIGHTThe one-stop source for all of your boxing and mixed martial arts news from around the internet. Get exclusive interviews, breaking news, interactive features and more.Powered by hard work & dedication and founded by Ben Thompson.SUBSCRIBE NOW TO THIS CHANNEL TO BE NOTIFIED OF DAILY VIDEO UPDATESIF YOU ENJOY OUR VIDEOS, PLEASE BE SURE TO SHOW YOUR SUPPORT AND ALSO VISIT THE WEBSITE, WWW.FIGHTHYPE.COM, DAILY SO WE CAN CONTINUE TO BRING YOU COMPLETE FIGHT COVERAGE.","FightHype Floyd Mayweather Jr. Manny Pacquiao Mayweather Pacquiao Canelo Boxing MMA UFC","6lIvg3JLQk0"
9utzegEPfXY,"Teddy Atlas on Ryan Garcia's TKO win over Luke Campbell + What's Next | Ep. 110","UC7D_b_1q4Dxz9ebeEYVVxWQ","THE FIGHT with Teddy Atlas","17","5384.0","https://i.ytimg.com/vi/9utzegEPfXY/default.jpg","teddy atlas|boxing|ryan garcia|ryan garcia next fight|ryan garcia luke campbell|garcia campbell|ryan garcia highlights|ryan garcia campbell|knockout","Teddy Atlas and co-host Ken Rideout discuss Ryan Garcia's TKO win over Luke Campbell along with what's next for Garcia.Thanks to PowerDot for sponsoring this episode. Get 20% off at http://www.PowerDot.com/Atlas and use code ATLAS. We'll also be covering the purchase price of 1 out of every 5 devices purchased using code ATLAS (up to 20 devices). Email us your receipt at TheFight@HitHardMedia.com for your chance to get it on the house.Episode is available on iTunes here: https://itunes.apple.com/us/podcast/the-fight-with-teddy-atlas/id1450847408?mt=2And on all other podcast platforms.THE FIGHT T-SHIRTShttps://teddy-atlas.myshopify.com/TEDDY'S SOCIAL MEDIATwitter - http://twitter.com/teddyatlasrealInstagram - http://instagram.com/teddy_atlasTHE FIGHT WITH TEDDY ATLAS SOCIAL MEDIAInstagram - http://instagram.com/thefightWTATwitter - http://twitter.com/thefightwtaFacebook - https://www.facebook.com/TheFightwithTeddyAtlasBig thanks to VHS collection for intro music. More on VHS Collection here: http://www.vhscollection.com/.Thanks for tuning in. Please be sure to subscribe!#RyanGarcia#GarciaCampbell#TeddyAtlas","","boxing teddy atlas the fight with teddy atlas boxing podcast","6lIvg3JLQk0"
CDpW9IvNt5M,"Mentally I'm hurting 🥊 | Luke Campbell on 'sickening' Garcia defeat & retirement","UC_JQGBtA7P0RwkRxd7xpJcA","Sky Sports Boxing","17","823.0","https://i.ytimg.com/vi/CDpW9IvNt5M/default.jpg","sky sports boxing|sky sports boxing stream|boxing|sky sports|luke campbell vs ryan garcia full fight|luke campbell|luke campbell interview|luke campbell vs ryan garcia|luke campbell highlights|luke campbell knocks down ryan garcia|ryan garcia knockout|ryan garcia|ryan garcia highlights","►SUBSCRIBE http://bit.ly/SSBoxingSubLuke Campbell says the Ryan Garcia defeat was 'sickening', but has not even thought about retirement after a fresh setback in his pursuit of a world lightweight title.►TWITTER: https://twitter.com/skysportsboxing►FACEBOOK: http://www.facebook.com/skysportsboxing►WEBSITE: http://www.skysports.com/boxingMORE FROM SKY SPORTS ON YOUTUBE:►SKY SPORTS FOOTBALL: http://bit.ly/SSFootballSub►SKY SPORTS CRICKET: https://bit.ly/SubscribeSkyCricket►SOCCER AM: http://bit.ly/SoccerAMSub►SKY SPORTS F1: http://bit.ly/SubscribeSkyF1►SKY SPORTS: http://bit.ly/SkySportsSub►SKY SPORTS GOLF: https://bit.ly/SubscribeSkySportsGolf","The home of Sky Sports Boxing on YouTube. To watch Sky Sports Box Office events click here: http://bit.ly/2yI99qp","Sky sports sky sports boxing sky sports boxing stream anthony joshua anthony joshua highlights","6lIvg3JLQk0"
OYJvmPDNu9s,"Ryan Garcia: Who Should He Fight Next?","UCurvRE5fGcdUgCYWgh-BDsg","DAZN Boxing","17","621.0","https://i.ytimg.com/vi/OYJvmPDNu9s/default.jpg","dazn|boxing|highlights|full fight|ko|knockout|ryan garcia|top 10|canelo|anthony joshua|ggg|haney|garcia campbell|luke campbell|devin haney|teofimo lopez|gervonta davis","Subscribe to our YouTube channel 👉  http://bit.ly/DAZNBoxingYouTubeDownload the DAZN app now 👉  http://bit.ly/DAZN_YTFollow DAZN Boxing On Social Media 👇Twitter: https://www.twitter.com/DAZNBoxingInstagram: https://www.instagram.com/DAZNBoxingFacebook: https://www.facebook.com/DAZN","Subscribe to our YouTube channel 👉  http://bit.ly/DAZNBoxingYouTubeDownload the DAZN app now 👉  http://bit.ly/DAZN_YTFollow DAZN Boxing On Social Media 👇Twitter: https://www.twitter.com/DAZNBoxingInstagram: https://www.instagram.com/DAZNBoxingFacebook: https://www.facebook.com/DAZN","boxing mma dazn stream highlights full fights canelo ryan garcia","6lIvg3JLQk0"
35-oNJ4uVJw,"HE'S LEGIT!!! What Really Happened (Ryan Garcia vs Luke Campbell)","UCZD2qRU8J82XGdGdUWYneNQ","TheWeasle","17","515.0","https://i.ytimg.com/vi/35-oNJ4uVJw/default.jpg","ufc|boxing|ryan garcia|ryan garcia vs luke campbell|luke campbell|ryan garcia knockout|ryan garcia ko|ryan garcia luke campbell|ryan garcia vs luke campbell full fight|ryan garcia vs luke campbell highlights|ryan garcia vs luke campbell knockout|ryan garcia vs luke campbell ko|garcia vs campbell|garcia vs campbell ko|garcia ko campbell|ryan garcia luke campbell ko|ryan garcia highlights|ryan garcia vs luke campbell breakdown","Ryan Garcia vs Luke Campbell was a shocking bout where Garcia exceeded expectations about his abilities against legit opposition and about his toughness. How did Garcia adjust? What got him dropped? How did he land that body shot?___________________________________________________________________________MERCH: teespring.com/stores/theweasle-store-2Feel free to help out the channel with more content: https://www.patreon.com/theweasleFollow me on Twitter:https://twitter.com/ThaWeasleMusic:- 'Hearse' Produced by: Gloomy on the TrackTraktrain: traktrain.com/gloomyonthetrackis licensed under a Creative Commons Attribution license (https://creativecommons.org/licenses/...)Promoted by: CFC https://www.youtube.com/channel/UCQLZ...","Friendly, rather simplistic, and yet in-depth fighting analysis on current high-caliber combat competitions. I just love watching and breaking fights down and sharing my ideas with the rest of other combat fans around the world.","mma mma breakdowns breakdowns ufc ufc breakdowns theweasle theweaslemma the weasel the weasel mma ufc full fight full fight highlights analysis","6lIvg3JLQk0"
yWOf-I9n_h0,"Ryan Garcia Calls Out Gervonta Davis & Devin Haney After KOing Luke Campbell","UCurvRE5fGcdUgCYWgh-BDsg","DAZN Boxing","17","432.0","https://i.ytimg.com/vi/yWOf-I9n_h0/default.jpg","dazn|boxing|highlights|full fight|ko|knockout|ryan garcia|top 10|canelo|anthony joshua|ggg|haney|garcia campbell|luke campbell|devin haney|tank davis|teofimo lopez|cool hand|king ry","January 2nd, 2021 -- Ryan Garcia vs. Luke Campbell from the American Airlines Center in Dallas, Texas.Subscribe to our YouTube channel 👉  http://bit.ly/DAZNBoxingYouTubeDownload the DAZN app now 👉  http://bit.ly/DAZN_YTFollow DAZN Boxing On Social Media 👇Twitter: https://www.twitter.com/DAZNBoxingInstagram: https://www.instagram.com/DAZNBoxingFacebook: https://www.facebook.com/DAZN","Subscribe to our YouTube channel 👉  http://bit.ly/DAZNBoxingYouTubeDownload the DAZN app now 👉  http://bit.ly/DAZN_YTFollow DAZN Boxing On Social Media 👇Twitter: https://www.twitter.com/DAZNBoxingInstagram: https://www.instagram.com/DAZNBoxingFacebook: https://www.facebook.com/DAZN","boxing mma dazn stream highlights full fights canelo ryan garcia","6lIvg3JLQk0"
B7Ivkss15NA,"Devin Haney Surprised By Tayler Holder As He Talks Ryan Garcia KO Win Over Luke Campbell | Esnews","UCI-Oq7oFGakzSzHFlTtsUsQ","ESNEWS","17","124.0","https://i.ytimg.com/vi/B7Ivkss15NA/default.jpg","[none]","#TaylerHolder  #devinhaney #ryangarcia","EsNews Is ranked among the top 40 Sports Sites In the WorldElie Seckbach (אלי זקבך) has been featured by RING Magazine & the LA Times dubbed The most influential reporter in boxing.His ability to get interesting quotes from star athletes prompted Andy Gray of CNN/SI to call him the most entertaining NBA reporter out there.While Former Mike Tyson Publicist Michael Marley writes: If there is going to be an Internet age Howard Cosell,  it's Elie Seckbach.In 2009  Seckbach was nominated by the Associated Press and won the Mark Twain Award. In 2010 Seckbach won the Boxing Reporter of The Year award from ATG Radio. In 2019 The WBA Honored Elie for his contribution to boxing coverage. In August 2020 Lil Wayne samples Seckbach in his song 'Kobe Bryant. Away from sports Elie has covered major news events and has won both a Golden Mike and an Emmy Award. His reports have been featured on: ESPN, AOL Sports FanHouse & NBC TV, The LA Daily News, FOX 11 NEWS and CBS 2 News.","Boxing Boxing Interviews Boxing Highlights Boxing News MMA UFC Sporting News Boxing Footage Boxing Behind The Scenes Behind The Scenes Boxing News 2019 UFC Fighting MMA Fighting Breaking Boxing News Boxing Videos MMA Highlights UFC Highlights Training Sports Interviews Authentic Boxing News Boxing Matches UFC Videos MMA Videos Manny Pacquiao Deontay Wilder Oscar Del A Hoya Conor Mcgregor Ronda Rousey Sports Interviews Boxing News 2019 Boxing Press Conferences Fight Night Outside The Ring Boxing Updates Rare Footage Sports","6lIvg3JLQk0"
zDhm9wabuDU,"RYAN GARCIA Post fight interview after STOPPING LUKE CAMPBELL | DAZN BOXING","UCEVVENPnHv-kcp2PqQuJvHg","SecondsOut","17","298.0","https://i.ytimg.com/vi/zDhm9wabuDU/default.jpg","boxing|secondsout|seconds out|combat|sport|sports|Combat Sport (Sport)|boxe|boxeo|boxer|knockouts|ryan garcia|luke campbell|garcia vs campbell|dazn|DAZN|campbell vs garcia|campbell v garcia|luke campbell vs ryan garcia","RYAN GARCIA FULL Post fight interview after stopping LUKE CAMPBELL | DAZN BOXINGSubscribe to DAZN: http://www.dazn.com/SecondsOutSubscribe for updates - http://goo.gl/meA2GBFollow on Twitter: http://goo.gl/VDYVMPLike on Facebook: https://www.facebook.com/secondsoutliveSecondsOut is a world leader in boxing entertainment since 1999.Part of the Knockout TV YouTube MCN - http://goo.gl/t77GMc","Official channel of SecondsOut.comThe ultimate boxing destination on the web. If you want to see more great content visit http://www.SecondsOut.com for live fights, documentaries and other great boxing content.Join the fastest growing boxing community on the web - blog, comment, vote, message and discuss - FREE.Don't forget to subscribe to this YouTube channel to stay up to date with all the latest videos from http://www.SecondsOut.com","boxing combat sport secondsout seconds out interview event gym sports fight","6lIvg3JLQk0"
capEDsuacyw,"GERVONTA DAVIS ON RYAN GARCIA SAYING HE WILL KO HIM IN 2 - OPENS UP ON THE MEGA FIGHT EsNews Boxing","UCI-Oq7oFGakzSzHFlTtsUsQ","ESNEWS","17","710.0","https://i.ytimg.com/vi/capEDsuacyw/default.jpg","elie seckbach|esnews|boxing|mma|sports interviews|es news|boxing news|mma news|boxing interviews|mma interviews|champion|championship|gold medal|boxeo|knockout|winner|boxing movie|USA|AUSTRALIA|NEW ZEALAND|UK BOXING","#GERVONTADAVIS #RYANGARCIA #BOXING #TANKDAVIS Elie Seckbach ReportingSubscribe: https://www.youtube.com/user/ESNEWSFollow TALENT:➡️ Follow my IG: https://www.instagram.com/elieseckbach/➡️ Twitter: https://twitter.com/SeckbachOfficial Website: http://www.esnewsreporting.com/ Watch More ESNEWS:➡️ Latest Uploads: http://bit.ly/esnews-latest-uploads➡️ The Robert Garcia Reality Show: http://bit.ly/robert-garcia-reality-show➡️ Brandon Krause Videos: http://bit.ly/brandon-krause-videos➡️ Boxing Basics: http://bit.ly/boxing-basics➡️ Popular Videos: http://bit.ly/esnews-popular-videos About ESNEWS:Elie Seckbach (אלי זקבך) features by the LA Times and Ring Magazine as the Most Influential boxing reporter has been covering Sports BOXING MMA & The NBA since 1997. ✅ His ability to get interesting quotes from star athletes prompted Andy Gray of CNN/SI to call him the most entertaining NBA reporter out there.✅ While Former Mike Tyson Publicist Michael Marley writes: If there is going to be an Internet age Howard Cosell, it may turn out to be Elie Seckbach.⭐In 2009  Seckbach was nominated by the Associated Press and won the Mark Twain Award.⭐✅ In June 09' Lil Wayne samples Seckbach in his song 'Kobe Bryant. And in 2010 Seckbach won the Boxing Reporter of The Year award from ATG Radio. In 2017 Seckbach received two Awards for his boxing coverage. ✅ Away from sports Elie has covered major news events and has won both a Golden Mike and an Emmy Award. ✅ His reports have been featured on: AOL Sports FanHouse & NBC TV, The LA Daily News and CBS 2 News.Prior to that Seckbach reported for leading news outlets in Israel.","EsNews Is ranked among the top 40 Sports Sites In the WorldElie Seckbach (אלי זקבך) has been featured by RING Magazine & the LA Times dubbed The most influential reporter in boxing.His ability to get interesting quotes from star athletes prompted Andy Gray of CNN/SI to call him the most entertaining NBA reporter out there.While Former Mike Tyson Publicist Michael Marley writes: If there is going to be an Internet age Howard Cosell,  it's Elie Seckbach.In 2009  Seckbach was nominated by the Associated Press and won the Mark Twain Award. In 2010 Seckbach won the Boxing Reporter of The Year award from ATG Radio. In 2019 The WBA Honored Elie for his contribution to boxing coverage. In August 2020 Lil Wayne samples Seckbach in his song 'Kobe Bryant. Away from sports Elie has covered major news events and has won both a Golden Mike and an Emmy Award. His reports have been featured on: ESPN, AOL Sports FanHouse & NBC TV, The LA Daily News, FOX 11 NEWS and CBS 2 News.","Boxing Boxing Interviews Boxing Highlights Boxing News MMA UFC Sporting News Boxing Footage Boxing Behind The Scenes Behind The Scenes Boxing News 2019 UFC Fighting MMA Fighting Breaking Boxing News Boxing Videos MMA Highlights UFC Highlights Training Sports Interviews Authentic Boxing News Boxing Matches UFC Videos MMA Videos Manny Pacquiao Deontay Wilder Oscar Del A Hoya Conor Mcgregor Ronda Rousey Sports Interviews Boxing News 2019 Boxing Press Conferences Fight Night Outside The Ring Boxing Updates Rare Footage Sports","6lIvg3JLQk0"
POOhK0SdCy0,"Ryan Garcia's 7th rd KO of Luke Campbell - Hightlight Breakdown","UCpMD2REbXPJPUjqB1ql71LQ","Fouts Boxing Theory","17","238.0","https://i.ytimg.com/vi/POOhK0SdCy0/default.jpg","film|study|boxing|highlights|analysis|post|fight|ryan garcia vs luke campbell|ryan garcia|ryan garcia highlights|ryan garcia luke campbell highlights|ryan garcia luke campbell ko|Ryan garcia knock down|ryan garcia knockout|ryan garcia ko","Support me on Patreon at https://www.patreon.com/FoutsBoxingFollow me on Facebook at www.facebook.com/foutsboxingTwitter www.twitter.com/FoutsMathewLayering your offense video - https://www.youtube.com/watch?v=kajVEZl5ezwLayering your Defense video - https://www.youtube.com/watch?v=JBrw0HWZ9gcGraphic Design by http://theseaisdark.design/Marcato loop by Shady Dave found on https://www.freesound.org/people/ShadyDave/ NO COPYRIGHT INFRINGEMENTCopyright Disclaimer Under Section 107 of the Copyright Act 1976, allowance is made for fair use for purposes such as criticism, comment, news reporting, teaching, scholarship, and research. Fair use is a use permitted by copyright statute that might otherwise be infringing. Non-profit, educational or personal use tips the balance in favor of fair use.","Based in San Diego, California, the Fouts Boxing team is committed to providing in-depth film study and breakdowns. Learn offensive and defensive strategies each week. ----About Mathew Fouts // I grew up in San Jose, California and have been obsessed with understanding fight strategy since I was kid. Presently, I work in biotech by day and train and do film-study by night. Subscribe to learn more about my boxing journey and watch me analyze the best, intriguing fights.----If you like these videos please consider heading over to https://www.patreon.com/FoutsBoxing and donating today. Your donation will help me with delivering great boxing content on a much more frequent basis. My goal is to be able to deliver daily videos and even better content to you. ---To read my boxing articles and learn to box: www.foutsboxing.comBe sure to like us on Facebook at www.facebook.com/foutsboxing.Thanks again for watching!","boxing film study analysis breakdown highlight mathew fouts ufc combat sports thory fouts boxing theory mathew fouts","6lIvg3JLQk0"
