video_id,title,channelId,channelTitle,categoryId,duration,thumbnail_link,tags,description,channel_desc,channel_keywords,related_vid_id
I7wTe5SRRsw,"Emma Chamberlain on Her Acne Journey, and Guide to TikTok Makeup | Beauty Secrets | Vogue","UCRXiA3h1no_PFkb1JCP0yMA","Vogue","26","812.0","https://i.ytimg.com/vi/I7wTe5SRRsw/default.jpg","how to|celebrity|emma chamberlain|emma chamberlain beauty secrets|emma chamberlain interview|emma chamberlain vogue|emma chamberlain vogue interview|emma chamberlain beauty|emma chamberlain makeup|emma chamberlain makeup tutorial|emma chamberlain getting ready|emma chamberlain gets ready|emma chamberlain getting ready with|makeup tutorial|beauty tutorial|emma|emma chamberlain youtuber|emma chamberlain tiktok|emma chamberlain vogue makeup|vogue","Watch Emma Chamberlain share her beauty secrets, from how she takes care of her blemish-prone skin to her everyday makeup look.Shop this beauty routine:Bad Habit Silent Mode Hydrating Hyaluronic Mask: https://shop-links.co/1729982660003975323iUNIK Black Snail Restore Serum Repair Ampoule: https://amzn.to/2KwWqP9 iUNIK Tea tree Relief Natural Facial Serum: https://amzn.to/390V34B The Ordinary Niacinamide 10% + Zinc 1%: https://shop-links.co/1729982705285338746Bad Habit Dewd Hemp Nourishing Facial Oil: https://shop-links.co/1729982748170479319Elta MD UV Clear Facial Sunscreen Broad-Spectrum SPF 46: https://amzn.to/3o0giYFKosas LipFuel Active Lip Balm: https://shop-links.co/1730004190175871646 Kosas Tinted Face Oil Foundation: https://shop-links.co/1729982849773159060Kosas Revealer Super Creamy + Brightening Concealer: http://bit.ly/3itKCdfMarc Jacobs Beauty O!Mega Bronzer Coconut Perfect Tan: https://shop-links.co/1729983138591641491Becca Cosmetics Shimmering Skin Perfector® Pressed Highlighter: https://shop-links.co/1729983205235734402Maybelline Great Lash Clear Mascara: https://shop-links.co/1729983371728013499Benefit Cosmetics Gimme Brow + Tinted Volumizing Eyebrow Gel: https://shop-links.co/1729983468449439839Buxom Full-On Plumping Lip Cream Gloss: https://shop-links.co/1729983695474627128Milani Baked Blush: https://shop-links.co/1729984940007042008Byredo Space Black Mascara: https://fave.co/3nW2GxGCharlotte Tilbury Lip Cheat Lip Liner - Pillow Talk Collection: https://shop-links.co/1729984736101968054Charlotte Tilbury Collagen Lip Bath Gloss: https://shop-links.co/1729984796770440164IGK Jet Lag Invisible Dry Shampoo: https://shop-links.co/1729984905515206655Drybar Money Maker Flexible Hold Hairspray: https://shop-links.co/1729984996228349180When you buy something through our retail links, we earn an affiliate commission.Still haven’t subscribed to Vogue on YouTube? ►► http://bit.ly/vogueyoutubesubWant to hear more from our editors? Subscribe to the magazine ►► http://bit.ly/2wXh1VWCheck out our new podcast 'In Vogue: The 1990s'  ►► https://link.chtbl.com/iv-yt-description ABOUT VOGUEVogue is the authority on fashion news, culture trends, beauty coverage, videos, celebrity style, and fashion week updates. Emma Chamberlain on Her Acne Journey, and Guide to TikTok Makeup | Beauty Secrets | Vogue","Vogue places fashion in the context of culture and the world we live in—how we dress, live and socialize; what we eat, listen to and watch; who leads and inspires us. Vogue immerses itself in fashion, always leading readers to what will happen next. Thought-provoking, relevant and always influential, Vogue defines the culture of fashion.","Vogue fashion style beauty anna wintour 73 questions beauty secrets","CPI_Ve7vsHs"
94On_brAQak,"CARDIO INTENSO PARA QUEMAR GRASA | GYMVIRTUAL","UCfwP2H1CDJvssk6g2pm8EgA","gymvirtual","17","826.0","https://i.ytimg.com/vi/94On_brAQak/default.jpg","ejercicios|ejercicios en casa|ejercicios para adelgazar|adelgazar|ejercicios para bajar barriga|ejercicios para bajar de peso|ejercicios para bajar la panza|at home workout|cardio|cardio intenso|ejercicios de cardio|cardio quema grasa|cardio para adelgazar|cardio workout|at home cardio workout|cardio para quemar grasa|cardio sin saltos|cardio abdomen|cardio en casa|hiit|cardio hiit|cardio para bajar de peso|gymvirtual|gym|fitness|abdomen y piernas|piernas","♥ ♥ LÉEME / DESPLIÉGAME ♥ ♥Hola a todos,hoy os traigo una rutina de ejercicios de cardio para adelgazar y quemar grasa en casa.En la web http://www.gymvirtual.com/calendarios encontraréis los calendarios de entrenamiento tanto para principiantes como para avanzados.Si quieres conseguir tú transformación en solamente 12 semanas, entra ya en http://www.pgv12.com y elige el PLAN PGV12 que más se adapte a ti.Nuestro lema: YO PUEDO CON TODOLos hashtags: #GymVirtual #YPCT #YoPuedoConTodo #PGV12♡♡ ¡SUSCRÍBETE! ♡♡ http://www.youtube.com/user/gymvirtual .................................................................................................................................♡♡ ROPA ♡♡♡♡TOTAL LOOK OYSHO: https://bit.ly/OYSHOpatryjordan.................................................................................................................................♡♡ PLAN DE ENTRENAMIENTO + NUTRICIÓN 12 SEMANAS♡♡http://www.pgv12.com.................................................................................................................................♡♡¡ECHA UN VISTAZO A NUESTRA TIENDA ONLINE! ♡♡http://www.gymvirtualshop.comhttp://www.instagram.com/gymvirtualshop.................................................................................................................................MIS OTROS CANALES♡ SECRETOS DE CHICAS: http://www.youtube.com/secretosdechicas ♡ SECRETOS DE CHICAS VIP: http://www.youtube.com/secretosdechic... ♡ GYM VIRTUAL: http://www.youtube.com/gymvirtual ♡ SECRETOS DE CHICAS VLOG: http://www.youtube.com/secretosdechic... ♡ PATRY JORDAN: http://www.youtube.com/patryjordan .................................................................................................................................REDES SOCIALES♡ INSTAGRAM: http://www.instagram.com/gymvirtual_com♡ SNAPCHAT: patryjordan♡ TWITTER: http://www.twitter.com/gymvirtual_com ♡ FACEBOOK: http://www.facebook.com/gymvirtual♡ PINTEREST: http://www.pinterest.com/patryjordan ♡ GOOGLE +: http://bit.ly/1UKC7Jv ♡ MI PÁGINA WEB: http://www.gymvirtual.com  ♡ COMPRAR MI LIBRO: http://bit.ly/1MxJmx9♡ COMPRAR MI EBOOK: http://bit.ly/1Fruwbq ♡ MÚSICA QUE UTILIZAMOS:  http://share.epidemicsound.com/PatryJordan ♡♡GRACIAS POR VERME","En el canal de Gym Virtual encontrarás rutinas de ejercicio para trabajar todo el cuerpo sin necesidad de salir de casa ni de utilizar ningún tipo de material. Además, encontraréis consejos sobre salud, alimentación y deporte, y recetas sanas y fáciles para hacer en casa.","deporte rutina de ejericicios gluteos mancuernas pesas tonificar","CPI_Ve7vsHs"
wJICFFU6wT0,"Exercises Burn up to 350 calories in 30 minutes - Weekday Successful Fat Loss Plan | Eva Fitness","UCzZM2XyXAogNCgvxKHnOd0w","Eva Fitness","26","1939.0","https://i.ytimg.com/vi/wJICFFU6wT0/default.jpg","eva fitness|aerobic dance workout|weight loss at home|aerobic|aerobic Workout|aerobics workout for weight loss|aerobic exercise|zumba dance workout for belly fat|exercises to lose belly fat|aerobic dance|Mira Pham Workout|burn 350 calories|burn 350 calories in 30 mins|successful fat loss plan|mira pham Challenge 2021|Weight Loss Challenge 2021|fat loss|fat loss plan|successful fat loss|fat loss excercise|burn calories|excercises burn calories","👉 Exercise Burn up to 350 calories in 30 minutes - Weekday Successful Fat Loss Plan | Eva Fitness#WeightLoss #Aerobic #MiraPham▬▬▬▬▬▬▬▬▬▬ ⏳ 𝐋𝐈𝐊𝐄 & 𝐒𝐔𝐁𝐒𝐂𝐑𝐈𝐁𝐄:          👉 𝐒𝐔𝐁𝐒𝐂𝐑𝐈𝐁𝐄 : https://bit.ly/3nIQQIh         👉 𝐋𝐈𝐊𝐄 : https://www.facebook.com/mirapham.inc         👉 𝐋𝐈𝐊𝐄 : https://www.facebook.com/evafitness.contact▬▬▬▬▬▬▬▬▬▬⏳ CONTACT US: 🚫 If any producer or label has an issue with any of the uploads please get in contact. Thank You!         ✉ evafitness.contact@gmail.com         © Copyright by Eva Fitness ☞ Do not Reup !","Hi..............Eva Fitness offers fresh fitness tutorials, workouts, and exercises that will help you on your road to healthy living, weight loss, belly fat,and stress relief.⏳ New videos will be updated weekly: Tuesday & Saturday at 20h00 (GMT+7)                     See you again!----------------------------------------👉 Subscribe To Never Miss Our Newest Videos: https://goo.gl/VRSFD9----------------------------------------Help us reach 1.000.000 Subscribers !","Aerobic Workout aerobic dance aerobic dance exercise aerobic exercises to lose weight Aerobics workout for belly fat cardio workout dance fat burning workout aerobic dance workout music aerobic fitness aerobic reduction of belly fat fat burning aerobic dance music weight loss belly fat workout zumba zumba fitness fat loss weight loss workout aerobics workout for weight loss aerobic exercise zumba dance workout for belly fat zumba workout exercises to lose belly fat mira pham eva fitness eva aerobic eva mira pham","CPI_Ve7vsHs"
4q6vTbxU_bI,"Fast Weight Loss Exercises For Obese People | Zumba Class","UCOD8lPSrcmelzjAsRbE4fzg","Zumba Class","26","2439.0","https://i.ytimg.com/vi/4q6vTbxU_bI/default.jpg","Zumba Class|fast weight loss exercises|weight loss|exercises for obese people|fast weight loss exercises for obese people|the most effective exercise|Weight Loss workout program|Obese People workout program|workout to lose weight|how to lose weight|weight loss challenge|full body routine|full body Weight Loss Exercises For Obese People|Aerobic dance for Weight Loss|Zumba dance for Weight Loss Exercises|Exercises To Lose Weight|best exercise to lose weight","💕 Fast Weight Loss Exercises For Obese People | Zumba Class#MiraPham #AerobicDanceღ 𝐋𝐈𝐊𝐄 & 𝐒𝐔𝐁𝐒𝐂𝐑𝐈𝐁𝐄:          💕 𝐒𝐔𝐁𝐒𝐂𝐑𝐈𝐁𝐄: http://bit.ly/2kAsbdr         💕  𝐋𝐈𝐊𝐄 Fanpage: https://bit.ly/36aIoLi 🚫 If any producer or label has an issue with any of the uploads please get in contact. Thank You!         ✉ zumbaclass.fitness@gmail.com         © Copyright by Zumba Class ☞ Do not Reup","Hello !Zumba Class offers fresh fitness tutorials, workouts, and exercises that will help you on your road to healthy living, weight loss, belly fat,and stress relief.⏳ New videos will be updated weekly: 7 at 05h00 AM (GMT+7)                     See you again!----------------------------------------ღ 𝐋𝐈𝐊𝐄 & 𝐒𝐔𝐁𝐒𝐂𝐑𝐈𝐁𝐄:         💕 𝐒𝐔𝐁𝐒𝐂𝐑𝐈𝐁𝐄: http://bit.ly/2kAsbdr         💕  𝐋𝐈𝐊𝐄 Fanpage: https://bit.ly/36aIoLi🚫 If any producer or label has an issue with any of the uploads please get in contact. Thank You!         ✉ zumbaclass.fitness@gmail.com         © Copyright by Zumba Class ☞ Do not Reup----------------------------------------Help me 1.000.000 Subscribe !","Aerobic Zumba Class dance Fitness Workout Gym Abs Weight Loss burn calories bikini body fat burning abs workout aerobic step flat belly workout flat belly exercise booty workout booty workout aerobic exercise intense aerobic workout mira pham zumba mira pham zin mira pham aerobic class aerobic mira pham zumba for belly fat loss dance exercise zumba class for weight loss workout music zumba music zumba songs workout at home zumba for beginners belly fat workout dance exercise workout zumba dance for weight loss workout","CPI_Ve7vsHs"
P2Fq3v2uLaI,"HOW I LOST 60 POUNDS DURING QUARANTINE","UC-oiHrcQUrZLITWDoARa5lQ","DoniaLuvsU","22","1621.0","https://i.ytimg.com/vi/P2Fq3v2uLaI/default.jpg","weightloss|quarantineweight|weightlosstransformation|beforeandafter|healthyfoods|weightlossjourney|coachgreg|gregducette","Hey Everyone.WATCH MY WHAT I ATE IN A DAY VIDEO:https://www.youtube.com/watch?v=5lz8DSMLsTAI am very open, real, raw and honest throughout this video. I tried to share as much possible, pictures and videos I never thought I would be putting out there of my body. But this is real life and it's not easy to get back in shape so I hope i can provide some inspiration for anyone out there needing it..FOLLOW ME ON THE GRAM OR EMAIL ME: thedoniaidrissi@gmail.comIG: @DONIALUVSUhttps://www.instagram.com/donialuvsu/ALL BODIES AND SHAPES AND SIZES ARE BEAUTIFUL!God Bless You Guys.","Hi! Welcome to my world of all kind of random things going on.PR/COLLAB: thedoniaidrissi@gmail.comSocial Medias: DoniaLuvsU","donia influencer donialuvsu donia idrissi","CPI_Ve7vsHs"
gA8LEqRXAVk,"Can I Exercise on My Period?! (Dos & Don'ts) | Joanna Soh","UCnP_T4dI2JYG7BnH42PC9qw","Joanna Soh Official","26","383.0","https://i.ytimg.com/vi/gA8LEqRXAVk/default.jpg","Joanna soh|Joanna soh workout|Joanna soh strength training|strength training for women|how to lose weight|weight loss|how to lose belly fat|cardio workout to lose belly fat|low impact cardio exercises|exercises to lose belly fat|weight loss transformation|weight loss tips|weight loss journey|nutrition|eat clean|clean eating|meal plan for women to lose weight|meal prep|healthy recipes|beginner exercises at home|workout plan|squat|morning workout","Download my Fitness App here: https://www.fiolife.com/ SUBSCRIBE: http://bit.ly/SUBJoannaSoh | Follow my IG: https://instagram.com/joannasohofficial/Can I Exercise on My Period?! (Dos & Don'ts) | Joanna SohCan I workout on my period? Is it dangerous? What exercises should I do when on my period? What should I avoid? That’s what I’ll be answering in today’s video!When we’re on our period, we have to deal with bloating, mood swings, cramps, fatigue and indigestion. Yes, you should exercise on your period, saying that however, there are also certain types of exercises which we might want to avoid, depending on how your body feels. Watch this video to learn what you SHOULD & SHOUD NOT do!________________Weight Loss Tips: https://www.youtube.com/playlist?list=PLyP8pbBMxcsjSQjf_2V8ZJku_njMfh_ZmWeight Loss Meal Plan & Recipes: https://www.youtube.com/playlist?list=PLyP8pbBMxcsiVZKn2idlOzVppEmkQuXBpAbs & Core Workout: https://www.youtube.com/playlist?list=PLyP8pbBMxcsi0MwwHzR5tWUjphLt7vt5qCrazy Workout Challenges: https://youtube.com/watch?v=g83v1m2P4_g&list=PLyP8pbBMxcsgw079OkBK0o-sjKzX4qE0Jm________________Record a video or take a picture of you doing the workout, tag me @JoannaSohOfficial #JSohActive I'm a certified Personal Trainer (ACE), Women’s Fitness Specialist (NASM) and Nutrition Coach, with over 10 years of experience.Stay connected and follow me:Joanna Soh:http://joannasoh.com/https://www.instagram.com/joannasohofficial/https://www.facebook.com/joannasohofficial/https://www.youtube.com/user/joannasohofficialhttps://twitter.com/Joanna_Soh(Subscribe to my website for printable workouts & recipes)My Fitness Apphttps://www.instagram.com/fio.apphttps://www.facebook.com/fioapp________________Can I Exercise on My Period?! (Dos & Don'ts) | Joanna Soh","Hey, I’m Joanna Soh, and welcome to my channel! I’m a certified Personal Trainer (ACE), Nutrition Coach and Women’s Fitness Specialist (NASM). I've been in the fitness industry for over 10 years!On my channel, you can find workout videos and ideas, nutrition tips and advice on healthy eating, as well as recipes to make your fitness journey a smooth one! I hope my videos will help you reach your fitness goals and achieve the healthy lifestyle you’ve always dreamed about.Business enquiries ONLY: joannasohofficial@gmail.comShare your Life & Body Transformation story to jsoh.inspiration@gmail.comStay connected:http://www.joannasoh.comhttp://www.facebook.com/joannasohofficialhttp://www.instagram.com/joannasohofficialSpread the LOVE! x","Fitness fit health living balance food faith love live life exercise workouts best effective tone women woman beginners sexy fat burning female fat burn lose weight loss nutrition coach advise eat clean joanna soh jsoh","CPI_Ve7vsHs"
R_t5x8qI1GY,"Weekday Successful Fat Loss Plan - The Most Amazing Weight Loss Challenge 2021 | Eva Fitness","UCzZM2XyXAogNCgvxKHnOd0w","Eva Fitness","26","3123.0","https://i.ytimg.com/vi/R_t5x8qI1GY/default.jpg","weight loss 2021|fat loss 2021|Weight Loss|fat loss|weight loss challenge|fat loss challenge|Weight Loss Challenge 2021|fat loss challenge 2021|aerobic dance workout|weight loss at home|aerobic|eva fitness|aerobic Workout|aerobic dance fitness|aerobics workout for weight loss|aerobic exercise|zumba workout|aerobic dance|Mira Pham Workout|Fat Loss Plan|Weekday Successful Fat Loss Plan|The Most Amazing Weight Loss|mira pham Challenge 2021","👉 Weekday Successful Fat Loss Plan - The Most Amazing Weight Loss Challenge 2021 | Eva Fitness#WeightLoss #Aerobic #MiraPham▬▬▬▬▬▬▬▬▬▬ ⏳ 𝐋𝐈𝐊𝐄 & 𝐒𝐔𝐁𝐒𝐂𝐑𝐈𝐁𝐄:          👉 𝐒𝐔𝐁𝐒𝐂𝐑𝐈𝐁𝐄 : https://bit.ly/3nIQQIh         👉 𝐋𝐈𝐊𝐄 : https://www.facebook.com/mirapham.inc         👉 𝐋𝐈𝐊𝐄 : https://www.facebook.com/evafitness.contact▬▬▬▬▬▬▬▬▬▬⏳ CONTACT US: 🚫 If any producer or label has an issue with any of the uploads please get in contact. Thank You!         ✉ evafitness.contact@gmail.com         © Copyright by Eva Fitness ☞ Do not Reup !","Hi..............Eva Fitness offers fresh fitness tutorials, workouts, and exercises that will help you on your road to healthy living, weight loss, belly fat,and stress relief.⏳ New videos will be updated weekly: Tuesday & Saturday at 20h00 (GMT+7)                     See you again!----------------------------------------👉 Subscribe To Never Miss Our Newest Videos: https://goo.gl/VRSFD9----------------------------------------Help us reach 1.000.000 Subscribers !","Aerobic Workout aerobic dance aerobic dance exercise aerobic exercises to lose weight Aerobics workout for belly fat cardio workout dance fat burning workout aerobic dance workout music aerobic fitness aerobic reduction of belly fat fat burning aerobic dance music weight loss belly fat workout zumba zumba fitness fat loss weight loss workout aerobics workout for weight loss aerobic exercise zumba dance workout for belly fat zumba workout exercises to lose belly fat mira pham eva fitness eva aerobic eva mira pham","CPI_Ve7vsHs"
l8RBDfZh5nw,"Weight Loss 5-7 Kg in 30 Days - 50Mins Aerobic Workout Everyday for The Best Body Shape l EvaFitness","UCTmYp8kCTifan_xt8xyFJ0A","Eva Fitness","26","2815.0","https://i.ytimg.com/vi/l8RBDfZh5nw/default.jpg","Eva Fitness|EvaFitness|Aerobic Workout|Aerobic Dance|Aerobic Dance Workout|Aerobic Abs|Aerobic Exercise|Aerobic dance workout easy steps|Zumba dance workout full video|Zumba Dance Workout|senam aerobik zumba|senam aerobik|senam aerobik terbaru|Aerobic dance Workout Beautiful Girl|Aerobic reduction of belly fat quickly|Weight Loss 5-7 Kg in 30 Days|50 Mins Aerobic Workout Everyday|50 Mins Aerobic Workout Everyday for The Best Body Shape","Weight Loss 5-7 Kg in 30 Days - 50 Mins Aerobic Workout Everyday for The Best Body Shape l Eva Fitness#EvaFitness, #aerobicdance, #aerobicexercise, #aerobicworkout, #danceworkout, #aerobicabs, #zumbaclass, #zumbaworkout, #weightloss, #aerobicsworkoutforweightloss, #aerobicexerciseathometoloseweight, #exercisetoloseweightfastathome, #zumbadanceworkoutforbellyfat,  #theducthammy, #giammothua","Hello,Welcome to the Eva Fitness channel!I love aerobics, zumba and fitness dance. I will be updating the latest videos on aerobic, zumba, fitness dance at this youtube channel. Wishing people to watch the video on the channel to practice every day, will have a beautiful body, healthy ...","Eva Fitness EvaFitness Aerobic Workout Aerobic Dance Aerobic Dance Workout Aerobic Abs Aerobic Exercise Aerobic dance workout easy steps Zumba dance workout full video Zumba Dance Workout senam aerobik zumba senam aerobik senam aerobik terbaru Aerobic dance Workout Beautiful Girl Aerobic reduction of belly fat quickly best youtube workout zumba dance workout for beginners step by step eva fitness aerobics aerobics workout for weight loss belly fat workout small waist workout","CPI_Ve7vsHs"
oG40WfZR9Ps,"40 MINS AEROBIC REDUCTION OF BELLY FAT QUICKLY | Aerobic Dance Exercises Full Video | Eva Fitness","UCzZM2XyXAogNCgvxKHnOd0w","Eva Fitness","26","2470.0","https://i.ytimg.com/vi/oG40WfZR9Ps/default.jpg","eva fitness|aerobic dance workout|aerobic dance exercises|aerobic Workout|aerobic dance fitness|aerobic exercises|belly fat exercises|belly fat workout|Mira Pham Workout|reduction of belly fat|Aerobic dance workout full video|Aerobic reduction of belly fat quickly|belly fat dance exercises|belly fat dance fitness|get rid of belly fat quickly|get rid of belly fat exercises|reduction of belly fat exercises|aerobic reduction of belly fat|reduce belly fat","40 MINS AEROBIC REDUCTION OF BELLY FAT QUICKLY | Aerobic Dance Exercises Full Video | Eva Fitness#EvaFitness #MiraPham▬▬▬▬▬▬▬▬▬▬ ⏳ 𝐋𝐈𝐊𝐄 & 𝐒𝐔𝐁𝐒𝐂𝐑𝐈𝐁𝐄:          👉 𝐒𝐔𝐁𝐒𝐂𝐑𝐈𝐁𝐄 : https://bit.ly/3nIQQIh         👉 𝐋𝐈𝐊𝐄 : https://www.facebook.com/mirapham.inc         👉 𝐋𝐈𝐊𝐄 : https://www.facebook.com/evafitness.contact▬▬▬▬▬▬▬▬▬▬⏳ CONTACT US: 🚫 If any producer or label has an issue with any of the uploads please get in contact. Thank You!         ✉ evafitness.contact@gmail.com         © Copyright by Eva Fitness ☞ Do not Reup !","Hi..............Eva Fitness offers fresh fitness tutorials, workouts, and exercises that will help you on your road to healthy living, weight loss, belly fat,and stress relief.⏳ New videos will be updated weekly: Tuesday & Saturday at 20h00 (GMT+7)                     See you again!----------------------------------------👉 Subscribe To Never Miss Our Newest Videos: https://goo.gl/VRSFD9----------------------------------------Help us reach 1.000.000 Subscribers !","Aerobic Workout aerobic dance aerobic dance exercise aerobic exercises to lose weight Aerobics workout for belly fat cardio workout dance fat burning workout aerobic dance workout music aerobic fitness aerobic reduction of belly fat fat burning aerobic dance music weight loss belly fat workout zumba zumba fitness fat loss weight loss workout aerobics workout for weight loss aerobic exercise zumba dance workout for belly fat zumba workout exercises to lose belly fat mira pham eva fitness eva aerobic eva mira pham","CPI_Ve7vsHs"
